ob1=OBI(cluster=1:1:2,proxy_num=0,init_unit_cpu=0);
ob1.set extra_config=$mini_ob_config;
ob1.reboot;
ob1.mysql alter system set debug_sync_timeout = '1000s';
ob1.mysql ALTER SYSTEM SET enable_rebalance = 'false';
ob1.mysql ALTER SYSTEM SET enable_rereplication = 'true';
set @@session.ob_query_timeout = 200000000;
alter system set __min_full_resource_pool_memory=1073741824;
use oceanbase;
ob1.mysql CREATE RESOURCE POOL tenant_pool UNIT = "2c2g", UNIT_NUM = 1, ZONE_LIST = ('z1', 'z2', 'z3');
ob1.mysql CREATE TENANT tenant_for_migrate_locality RESOURCE_POOL_LIST=('tenant_pool'), LOCALITY = "F@z1, F@z3", PRIMARY_ZONE = "z1" SET ob_tcp_invited_nodes='%';
create table t1_no_pk (c1 int);
insert into t1_no_pk values (1), (2), (3);
select * from t1_no_pk order by c1 asc;
c1
1
2
3
update t1_no_pk set c1=c1+10;
select * from t1_no_pk order by c1 asc;
c1
11
12
13
create table t1_pk (c1 int primary key);
insert into t1_pk values (1), (2), (3);
select * from t1_pk order by c1 asc;
c1
1
2
3
update t1_pk set c1=c1+10;
select * from t1_pk order by c1 asc;
c1
11
12
13
create table t1_part (c1 int primary key) partition by hash(c1) partitions 4;
insert into t1_part values (1), (2), (3), (4);
select * from t1_part order by c1 asc;
c1
1
2
3
4
update t1_part set c1=c1+10;
select * from t1_part order by c1 asc;
c1
11
12
13
14
alter system minor freeze tenant tenant_for_migrate_locality;
ob1.z1.obs0.check_log_until_success -c "succeed to release head data memtable";
ob1.z3.obs1.check_log_until_success -c "succeed to release head data memtable";
insert into t1_no_pk values (4), (5), (6);
insert into t1_no_pk values (7), (8), (9);
insert into t1_no_pk values (10), (11), (12);
insert into t1_pk values (4), (5), (6);
insert into t1_pk values (7), (8), (9);
insert into t1_pk values (10);
insert into t1_part values (5), (6), (7), (8);
insert into t1_part values (9), (10), (21), (22);
alter system minor freeze tenant tenant_for_migrate_locality;
ob1.z1.obs0.check_log_until_success -c "succeed to release head data memtable";
ob1.z3.obs1.check_log_until_success -c "succeed to release head data memtable";
'prepare finished'
'case 1.1 start'
ob1.mysql set ob_global_debug_sync = 'BEFORE_SEND_DRTASK_RPC wait_for signal';
ob1.mysql alter system set_tp tp_name = ERRSIM_CLEAN_TASK_FROM_DRTASK_TABLE_ERROR, error_code = 4002, frequency = 1;
select tenant_id, ls_id, task_type, priority, target_paxos_replica_number, target_replica_type, source_paxos_replica_number, source_replica_type, comment from oceanbase.V$OB_LS_REPLICA_TASK_PLAN;
tenant_id	ls_id	task_type	priority	target_paxos_replica_number	target_replica_type	source_paxos_replica_number	source_replica_type	comment
1001	1	MIGRATE REPLICA	LOW	2	FULL	2	FULL	migrate replica due to unit not match
1002	1	MIGRATE REPLICA	LOW	2	FULL	2	FULL	migrate replica due to unit not match
1002	1001	MIGRATE REPLICA	LOW	2	FULL	2	FULL	migrate replica due to unit not match
select tenant_id, ls_id, task_type, priority, target_paxos_replica_number, target_replica_type, source_paxos_replica_number, source_replica_type, comment from oceanbase.V$OB_LS_REPLICA_TASK_PLAN;
tenant_id	ls_id	task_type	priority	target_paxos_replica_number	target_replica_type	source_paxos_replica_number	source_replica_type	comment
1002	1	MIGRATE REPLICA	LOW	2	FULL	2	FULL	migrate replica due to unit not match
1002	1001	MIGRATE REPLICA	LOW	2	FULL	2	FULL	migrate replica due to unit not match
alter system change tenant tenant_id = 1001;
select tenant_id, ls_id, task_type, priority, target_paxos_replica_number, target_replica_type, source_paxos_replica_number, source_replica_type, comment from oceanbase.V$OB_LS_REPLICA_TASK_PLAN;
tenant_id	ls_id	task_type	priority	target_paxos_replica_number	target_replica_type	source_paxos_replica_number	source_replica_type	comment
1001	1	MIGRATE REPLICA	LOW	2	FULL	2	FULL	migrate replica due to unit not match
ob1.check_until_timeout SELECT COUNT(*) = 1 FROM oceanbase.DBA_OB_UNIT_JOBS WHERE unit_id = $unit_id AND job_type = "MIGRATE_UNIT" AND job_status = "INPROGRESS", 1, 20;
ob1.mysql set ob_global_debug_sync = 'now signal signal';
ob1.check_until_timeout select count(*) = $migrate_ls_cnt from oceanbase.CDB_OB_LS_REPLICA_TASKS where task_status = "INPROGRESS", 1, 20;
ls_id	task_type	priority	task_status	target_paxos_replica_number	target_replica_type	source_paxos_replica_number	source_replica_type	comment
1	MIGRATE REPLICA	LOW	INPROGRESS	2	FULL	2	FULL	migrate replica due to unit not match
ls_id	task_type	priority	task_status	target_paxos_replica_number	target_replica_type	source_paxos_replica_number	source_replica_type	comment
1	MIGRATE REPLICA	LOW	INPROGRESS	2	FULL	2	FULL	migrate replica due to unit not match
1001	MIGRATE REPLICA	LOW	INPROGRESS	2	FULL	2	FULL	migrate replica due to unit not match
ls_id	task_type	priority	task_status	target_paxos_replica_number	target_replica_type	source_paxos_replica_number	source_replica_type	comment
1	MIGRATE REPLICA	LOW	INPROGRESS	2	FULL	2	FULL	migrate replica due to unit not match
ob1.mysql alter system set_tp tp_name = ERRSIM_CLEAN_TASK_FROM_DRTASK_TABLE_ERROR, error_code = 4002, frequency = 0;
ob1.check_until_timeout SELECT COUNT(*) = 1 FROM oceanbase.DBA_OB_UNITS WHERE unit_id = $unit_id AND migrate_from_svr_ip is null, 1, 400;
ob1.check_until_timeout SELECT COUNT(*) = 0 FROM oceanbase.CDB_OB_LS_LOCATIONS WHERE tenant_id = $tenant_id AND role = "LEADER" AND member_list NOT LIKE '%$z3_dst0%' AND member_list LIKE '%$z3_dst1%', 1, 20;
ob1.check_until_timeout SELECT COUNT(*) = 1 FROM oceanbase.DBA_OB_UNIT_JOBS WHERE unit_id = $unit_id AND job_type = "MIGRATE_UNIT" AND job_status = "SUCCESS", 1, 20;
'case 1.1 finish'
'case 2.1 start'
ob1.mysql set ob_global_debug_sync = 'BEFORE_SEND_DRTASK_RPC wait_for signal';
ob1.mysql alter system set_tp tp_name = ERRSIM_CLEAN_TASK_FROM_DRTASK_TABLE_ERROR, error_code = 4002, frequency = 1;
ALTER TENANT tenant_for_migrate_locality LOCALITY = 'F@z1,F@z2,F@z3';
select tenant_id, ls_id, task_type, priority, target_paxos_replica_number, target_replica_type, source_paxos_replica_number, source_replica_type, comment from oceanbase.V$OB_LS_REPLICA_TASK_PLAN;
tenant_id	ls_id	task_type	priority	target_paxos_replica_number	target_replica_type	source_paxos_replica_number	source_replica_type	comment
1001	1	ADD REPLICA	HIGH	3	FULL	2	FULL	add paxos replica according to locality
1002	1	ADD REPLICA	HIGH	3	FULL	2	FULL	add paxos replica according to locality
1002	1001	ADD REPLICA	HIGH	3	FULL	2	FULL	add paxos replica according to locality
select tenant_id, ls_id, task_type, priority, target_paxos_replica_number, target_replica_type, source_paxos_replica_number, source_replica_type, comment from oceanbase.V$OB_LS_REPLICA_TASK_PLAN;
tenant_id	ls_id	task_type	priority	target_paxos_replica_number	target_replica_type	source_paxos_replica_number	source_replica_type	comment
1001	1	ADD REPLICA	HIGH	3	FULL	2	FULL	add paxos replica according to locality
1002	1	ADD REPLICA	HIGH	3	FULL	2	FULL	add paxos replica according to locality
1002	1001	ADD REPLICA	HIGH	3	FULL	2	FULL	add paxos replica according to locality
select tenant_id, ls_id, task_type, priority, target_paxos_replica_number, target_replica_type, source_paxos_replica_number, source_replica_type, comment from oceanbase.V$OB_LS_REPLICA_TASK_PLAN;
tenant_id	ls_id	task_type	priority	target_paxos_replica_number	target_replica_type	source_paxos_replica_number	source_replica_type	comment
1002	1	ADD REPLICA	HIGH	3	FULL	2	FULL	add paxos replica according to locality
1002	1001	ADD REPLICA	HIGH	3	FULL	2	FULL	add paxos replica according to locality
alter system change tenant tenant_id = 1001;
select tenant_id, ls_id, task_type, priority, target_paxos_replica_number, target_replica_type, source_paxos_replica_number, source_replica_type, comment from oceanbase.V$OB_LS_REPLICA_TASK_PLAN;
tenant_id	ls_id	task_type	priority	target_paxos_replica_number	target_replica_type	source_paxos_replica_number	source_replica_type	comment
1001	1	ADD REPLICA	HIGH	3	FULL	2	FULL	add paxos replica according to locality
ob1.check_until_timeout SELECT COUNT(*) AS cnt FROM oceanbase.DBA_OB_TENANT_JOBS WHERE tenant_id = $tenant_id AND job_type = "ALTER_TENANT_LOCALITY" AND sql_text LIKE "%F@z1,F@z2,F@z3%" AND extra_info like "%FULL{1}@z1, FULL{1}@z3%" AND job_status = "INPROGRESS", 1, 20;
ob1.mysql set ob_global_debug_sync = 'now signal signal';
ob1.check_until_timeout select count(*) = $ls_cnt + $meta_ls_cnt from oceanbase.CDB_OB_LS_REPLICA_TASKS where task_status = "INPROGRESS", 1, 20;
select ls_id, task_type, priority, task_status, target_paxos_replica_number, target_replica_type, source_paxos_replica_number, source_replica_type, comment from oceanbase.DBA_OB_LS_REPLICA_TASKS;
ls_id	task_type	priority	task_status	target_paxos_replica_number	target_replica_type	source_paxos_replica_number	source_replica_type	comment
1	ADD REPLICA	HIGH	INPROGRESS	3	FULL	2	FULL	add paxos replica according to locality
select ls_id, task_type, priority, task_status, target_paxos_replica_number, target_replica_type, source_paxos_replica_number, source_replica_type, comment from oceanbase.DBA_OB_LS_REPLICA_TASKS;
ls_id	task_type	priority	task_status	target_paxos_replica_number	target_replica_type	source_paxos_replica_number	source_replica_type	comment
1	ADD REPLICA	HIGH	INPROGRESS	3	FULL	2	FULL	add paxos replica according to locality
1001	ADD REPLICA	HIGH	INPROGRESS	3	FULL	2	FULL	add paxos replica according to locality
alter system change tenant tenant_id = 1001;
select ls_id, task_type, priority, task_status, target_paxos_replica_number, target_replica_type, source_paxos_replica_number, source_replica_type, comment from oceanbase.DBA_OB_LS_REPLICA_TASKS;
ls_id	task_type	priority	task_status	target_paxos_replica_number	target_replica_type	source_paxos_replica_number	source_replica_type	comment
1	ADD REPLICA	HIGH	INPROGRESS	3	FULL	2	FULL	add paxos replica according to locality
ob1.mysql alter system set_tp tp_name = ERRSIM_CLEAN_TASK_FROM_DRTASK_TABLE_ERROR, error_code = 4002, frequency = 0;
ob1.check_until_timeout SELECT COUNT(*) = 1 FROM oceanbase.DBA_OB_TENANTS WHERE tenant_id = $tenant_id AND previous_locality is null, 1 ,500;
ob1.check_until_timeout SELECT COUNT(*) = 1 FROM oceanbase.DBA_OB_TENANTS WHERE tenant_id = $meta_tenant_id AND previous_locality is null, 1 ,500;
ob1.check_until_timeout SELECT COUNT(*) = 1 FROM oceanbase.DBA_OB_TENANTS WHERE tenant_id = $tenant_id AND primary_zone = (SELECT primary_zone FROM oceanbase.DBA_OB_TENANTS WHERE tenant_id = $meta_tenant_id), 1 ,50;
ob1.check_until_timeout SELECT COUNT(*) = 1 FROM oceanbase.__all_tenant where tenant_id = $tenant_id AND zone_list = (SELECT zone_list FROM oceanbase.__all_tenant WHERE tenant_id = $meta_tenant_id), 1 ,50;
ob1.check_until_timeout SELECT COUNT(*) = 1 FROM oceanbase.DBA_OB_TENANT_JOBS WHERE tenant_id = $tenant_id AND job_type = "ALTER_TENANT_LOCALITY" AND sql_text LIKE "%F@z1,F@z2,F@z3%" AND extra_info like "%FULL{1}@z1, FULL{1}@z3%" AND job_status = "SUCCESS", 1, 20;
ob1.check_until_timeout SELECT COUNT(*) = 0 FROM oceanbase.CDB_OB_LS_LOCATIONS WHERE tenant_id = $meta_tenant_id AND role = "LEADER" AND member_list NOT LIKE "%$z2_dst0%", 1, 20;
ob1.check_until_timeout SELECT COUNT(*) = 0 FROM oceanbase.CDB_OB_LS_LOCATIONS WHERE tenant_id = $tenant_id AND role = "LEADER" AND member_list NOT LIKE "%$z2_dst0%", 1, 20;
ob1.check_until_timeout SELECT COUNT(*) = 0 FROM oceanbase.CDB_OB_LS_REPLICA_TASKS, 1, 30;
'case 2.1 finish'
'case 2.2 start'
ob1.mysql set ob_global_debug_sync = 'BEFORE_SEND_DRTASK_RPC wait_for signal';
ob1.mysql alter system set_tp tp_name = ERRSIM_CLEAN_TASK_FROM_DRTASK_TABLE_ERROR, error_code = 4002, frequency = 1;
ALTER TENANT tenant_for_migrate_locality LOCALITY = 'F@z1,F@z3';
select tenant_id, ls_id, task_type, priority, target_paxos_replica_number, target_replica_type, source_paxos_replica_number, source_replica_type, comment from oceanbase.V$OB_LS_REPLICA_TASK_PLAN;
tenant_id	ls_id	task_type	priority	target_paxos_replica_number	target_replica_type	source_paxos_replica_number	source_replica_type	comment
1001	1	REMOVE PAXOS REPLICA	HIGH	2	FULL	3	NULL	remove redundant paxos replica according to locality
1002	1	REMOVE PAXOS REPLICA	HIGH	2	FULL	3	NULL	remove redundant paxos replica according to locality
1002	1001	REMOVE PAXOS REPLICA	HIGH	2	FULL	3	NULL	remove redundant paxos replica according to locality
select tenant_id, ls_id, task_type, priority, target_paxos_replica_number, target_replica_type, source_paxos_replica_number, source_replica_type, comment from oceanbase.V$OB_LS_REPLICA_TASK_PLAN;
tenant_id	ls_id	task_type	priority	target_paxos_replica_number	target_replica_type	source_paxos_replica_number	source_replica_type	comment
1001	1	REMOVE PAXOS REPLICA	HIGH	2	FULL	3	NULL	remove redundant paxos replica according to locality
1002	1	REMOVE PAXOS REPLICA	HIGH	2	FULL	3	NULL	remove redundant paxos replica according to locality
1002	1001	REMOVE PAXOS REPLICA	HIGH	2	FULL	3	NULL	remove redundant paxos replica according to locality
select tenant_id, ls_id, task_type, priority, target_paxos_replica_number, target_replica_type, source_paxos_replica_number, source_replica_type, comment from oceanbase.V$OB_LS_REPLICA_TASK_PLAN;
tenant_id	ls_id	task_type	priority	target_paxos_replica_number	target_replica_type	source_paxos_replica_number	source_replica_type	comment
1002	1	REMOVE PAXOS REPLICA	HIGH	2	FULL	3	NULL	remove redundant paxos replica according to locality
1002	1001	REMOVE PAXOS REPLICA	HIGH	2	FULL	3	NULL	remove redundant paxos replica according to locality
alter system change tenant tenant_id = 1001;
select tenant_id, ls_id, task_type, priority, target_paxos_replica_number, target_replica_type, source_paxos_replica_number, source_replica_type, comment from oceanbase.V$OB_LS_REPLICA_TASK_PLAN;
tenant_id	ls_id	task_type	priority	target_paxos_replica_number	target_replica_type	source_paxos_replica_number	source_replica_type	comment
1001	1	REMOVE PAXOS REPLICA	HIGH	2	FULL	3	NULL	remove redundant paxos replica according to locality
ob1.check_until_timeout SELECT COUNT(*) = 1 FROM oceanbase.DBA_OB_TENANT_JOBS WHERE tenant_id = $tenant_id AND job_type = "ALTER_TENANT_LOCALITY" AND sql_text LIKE "%F@z1,F@z3%" AND extra_info like "%FULL{1}@z1, FULL{1}@z2, FULL{1}@z3%" AND job_status = "INPROGRESS", 1, 20;
ob1.mysql set ob_global_debug_sync = 'now signal signal';
ob1.check_until_timeout select count(*) = $ls_cnt + $meta_ls_cnt from oceanbase.CDB_OB_LS_REPLICA_TASKS where task_status = "INPROGRESS", 1, 20;
select ls_id, task_type, priority, task_status, target_paxos_replica_number, target_replica_type, source_paxos_replica_number, source_replica_type, comment from oceanbase.DBA_OB_LS_REPLICA_TASKS;
ls_id	task_type	priority	task_status	target_paxos_replica_number	target_replica_type	source_paxos_replica_number	source_replica_type	comment
1	REMOVE PAXOS REPLICA	HIGH	INPROGRESS	2	FULL	3	NULL	remove redundant paxos replica according to locality
select ls_id, task_type, priority, task_status, target_paxos_replica_number, target_replica_type, source_paxos_replica_number, source_replica_type, comment from oceanbase.DBA_OB_LS_REPLICA_TASKS;
ls_id	task_type	priority	task_status	target_paxos_replica_number	target_replica_type	source_paxos_replica_number	source_replica_type	comment
1	REMOVE PAXOS REPLICA	HIGH	INPROGRESS	2	FULL	3	NULL	remove redundant paxos replica according to locality
1001	REMOVE PAXOS REPLICA	HIGH	INPROGRESS	2	FULL	3	NULL	remove redundant paxos replica according to locality
alter system change tenant tenant_id = 1001;
select ls_id, task_type, priority, task_status, target_paxos_replica_number, target_replica_type, source_paxos_replica_number, source_replica_type, comment from oceanbase.DBA_OB_LS_REPLICA_TASKS;
ls_id	task_type	priority	task_status	target_paxos_replica_number	target_replica_type	source_paxos_replica_number	source_replica_type	comment
1	REMOVE PAXOS REPLICA	HIGH	INPROGRESS	2	FULL	3	NULL	remove redundant paxos replica according to locality
ob1.mysql alter system set_tp tp_name = ERRSIM_CLEAN_TASK_FROM_DRTASK_TABLE_ERROR, error_code = 4002, frequency = 0;
ob1.check_until_timeout SELECT COUNT(*) = 1 FROM oceanbase.DBA_OB_TENANTS WHERE tenant_id = $tenant_id AND previous_locality is null, 1 ,500;
ob1.check_until_timeout SELECT COUNT(*) = 1 FROM oceanbase.DBA_OB_TENANTS WHERE tenant_id = $meta_tenant_id AND previous_locality is null, 1 ,500;
ob1.check_until_timeout SELECT COUNT(*) = 1 FROM oceanbase.DBA_OB_TENANTS WHERE tenant_id = $tenant_id AND primary_zone = (SELECT primary_zone FROM oceanbase.DBA_OB_TENANTS WHERE tenant_id = $meta_tenant_id), 1 ,50;
ob1.check_until_timeout SELECT COUNT(*) = 1 FROM oceanbase.__all_tenant WHERE tenant_id = $tenant_id AND zone_list = (SELECT zone_list FROM oceanbase.__all_tenant WHERE tenant_id = $meta_tenant_id), 1 ,50;
ob1.check_until_timeout SELECT COUNT(*) = 1 FROM oceanbase.DBA_OB_TENANT_JOBS WHERE tenant_id = $tenant_id AND job_type = "ALTER_TENANT_LOCALITY" AND sql_text LIKE "%F@z1,F@z3%" AND extra_info like "%FULL{1}@z1, FULL{1}@z2, FULL{1}@z3%" AND job_status = "SUCCESS", 1, 20;
ob1.check_until_timeout SELECT COUNT(*) = 0 FROM oceanbase.CDB_OB_LS_LOCATIONS WHERE tenant_id = $meta_tenant_id AND role = "LEADER" AND member_list LIKE "%$z2_dst0%", 1, 20;
ob1.check_until_timeout SELECT COUNT(*) = 0 FROM oceanbase.CDB_OB_LS_LOCATIONS WHERE tenant_id = $tenant_id AND role = "LEADER" AND member_list LIKE "%$z2_dst0%", 1, 20;
'case 2.2 finish'
