ob1=OBI(cluster=2:2, proxy_num=0);
ob1.set extra_config=$mini_ob_config;
ob1.force_stop;
ob1.clean_backup_dest;
ob1.reboot;
ob1.mysql alter resource unit sys_unit_config memory_size='2G';
use oceanbase;
CREATE RESOURCE UNIT unit_1 MAX_CPU 2, MEMORY_SIZE '4G';
CREATE RESOURCE POOL small_pool UNIT = 'unit_1', UNIT_NUM = 2;
CREATE RESOURCE POOL small_pool_2 UNIT = 'unit_1', UNIT_NUM = 2;
ob1.mysql alter system set _backup_idle_time = '10s';
ob1.mysql alter system set merger_check_interval = '10s';
ob1.mysql alter system set debug_sync_timeout = '1000s';
ob1.mysql alter system set enable_async_syslog=false;
ob1.mysql CREATE TENANT $backup_mysql_tenant RESOURCE_POOL_LIST = ('small_pool'), primary_zone = "z1,z2" set ob_tcp_invited_nodes='%', ob_compatibility_mode='mysql';
ob1.mysql alter system set ls_gc_delay_time = '0s' tenant = '$backup_mysql_tenant';
create table t1(a int primary key, b int, c int) partition by hash (a) partitions 100;
insert into t1(a, b) values(1, 1);
ob1.mysql alter system archivelog;
ob1.check_until_timeout select status from oceanbase.CDB_OB_ARCHIVELOG where tenant_id=$backup_mysql_tenant_id, DOING, 600;
ob1.mysql alter system major freeze tenant = '$backup_mysql_tenant';
ob1.check_until_timeout select (frozen_scn - last_scn) as result from oceanbase.CDB_OB_MAJOR_COMPACTION where tenant_id=$backup_mysql_tenant_id, 0, 600;
ob1.mysql alter system backup database;
ob1.check_until_timeout select count(*) c from __all_backup_job_history where tenant_id = 1, 1, 600;
ob1.check_until_timeout select result from oceanbase.CDB_OB_BACKUP_JOB_HISTORY where tenant_id = $backup_mysql_tenant_id, 0, 10;
ob1.check_until_timeout select result from oceanbase.CDB_OB_BACKUP_TASK_HISTORY where tenant_id = $backup_mysql_tenant_id, 0, 10;
use oceanbase;
ob1.check_until_timeout select count(*)>=1 from oceanbase.__all_virtual_ls_status where status = 'NORMAL' and tenant_id = $backup_mysql_tenant_id, 1, 100;
ob1.check_until_timeout select floor(checkpoint_scn / 1000) > '$restore_checkpoint1' from CDB_OB_ARCHIVELOG, 1, 600;
ob1.check_until_timeout select floor(checkpoint_scn / 1000) > '$restore_checkpoint2' from CDB_OB_ARCHIVELOG, 1, 600;
ob1.mysql set ob_global_debug_sync = 'STOP_RECOVERY_LS_THREAD0 wait_for signal';
ob1.check_until_timeout SELECT status FROM __all_tenant WHERE tenant_id = 1003, NORMAL, 200;
ob1.check_until_timeout select count(*) from __all_virtual_ls_meta_table where tenant_id = 1004 and restore_status != 0, 0, 600;
ob1.check_until_timeout select status FROM __all_tenant WHERE tenant_id = 1004, NORMAL, 300;
ob1.check_until_timeout select count(*) FROM __all_restore_job, 0, 200;
ob1.mysql ALTER SYSTEM RECOVER STANDBY TENANT $restore_mysql_tenant UNTIL UNLIMITED;
select tenant_role from __all_virtual_tenant_info where tenant_id = 1004;
tenant_role
STANDBY
ob1.mysql_p select ls_id, ls_group_id, unit_group_id from oceanbase.__all_virtual_ls_status where tenant_id = $restore_mysql_tenant_id order by ls_id;
ls_id	ls_group_id	unit_group_id
1	0	0
1001	1001	1003
1002	1001	1003
1003	1002	1004
1004	1002	1004
ob1.mysql set ob_global_debug_sync = 'now signal signal';
ob1.mysql alter resource tenant $restore_mysql_tenant unit_num = 1;
ob1.check_until_timeout select count(*) from oceanbase.__all_unit where status != 'ACTIVE', 0, 300;
ob1.mysql_p select ls_id, ls_group_id, unit_group_id from oceanbase.__all_virtual_ls_status where tenant_id = $restore_mysql_tenant_id order by ls_id;
ls_id	ls_group_id	unit_group_id
1	0	0
1001	1001	1004
1002	1001	1004
1003	1002	1004
1004	1002	1004
ob1.check_until_timeout select count(*) from oceanbase.__all_virtual_unit where tenant_id = $restore_mysql_tenant_id or tenant_id + 1 = $restore_mysql_tenant_id, 4, 300;
ob1.mysql alter resource tenant $restore_mysql_tenant unit_num = 2;
ob1.check_until_timeout select count(*) from oceanbase.__all_virtual_ls_status where tenant_id = $restore_mysql_tenant_id and ls_group_id != 0  and unit_group_id != $unit_group_id, 2, 30;
alter system change tenant tenant_id = 1003;
update __all_ls_status set unit_group_id = 1005 where ls_id =  1002 ;
select ls_id, ls_group_id, unit_group_id from oceanbase.__all_ls_status order by ls_id;
ls_id	ls_group_id	unit_group_id
1	0	0
1001	1001	1004
1002	1001	1005
1003	1002	1005
1004	1002	1005
ob1.check_until_timeout select count(*) from oceanbase.__all_virtual_ls_status where tenant_id = $restore_mysql_tenant_id and ls_group_id != 0  and unit_group_id != $unit_group_id, 2, 30;
select ls_id, ls_group_id, unit_group_id from oceanbase.__all_ls_status order by ls_id;
ls_id	ls_group_id	unit_group_id
1	0	0
1001	1001	1004
1002	1001	1004
1003	1002	1005
1004	1002	1005
update __all_ls_status set unit_group_id = 1005 where ls_id =  1001 ;
select ls_id, ls_group_id, unit_group_id from oceanbase.__all_ls_status order by ls_id;
ls_id	ls_group_id	unit_group_id
1	0	0
1001	1001	1005
1002	1001	1004
1003	1002	1005
1004	1002	1005
ob1.check_until_timeout select count(*) from oceanbase.__all_virtual_ls_status where tenant_id = $restore_mysql_tenant_id and ls_group_id != 0  and unit_group_id != $unit_group_id, 4, 30;
ob1.check_until_timeout select count(*) from oceanbase.__all_virtual_ls_status where tenant_id = $restore_mysql_tenant_id and ls_group_id != 0  and unit_group_id != $unit_group_id, 2, 30;
select ls_id, ls_group_id, unit_group_id from oceanbase.__all_ls_status order by ls_id;
ls_id	ls_group_id	unit_group_id
1	0	0
1001	1001	1005
1002	1001	1005
1003	1002	1004
1004	1002	1004
