ob1=OBI(cluster=1:1:1,proxy_num=0);
ob1.reboot;
ob1.mysql CREATE RESOURCE UNIT 1c2g MAX_CPU 1, MEMORY_SIZE '2G';
ob1.mysql CREATE RESOURCE POOL pool1 UNIT='1c2g',UNIT_NUM=1,ZONE_LIST=('z1','z2','z3');
ob1.mysql CREATE TENANT IF NOT EXISTS test_tenant_mysql RESOURCE_POOL_LIST=('pool1') set ob_tcp_invited_nodes='%', ob_compatibility_mode='mysql';
### service_name长度为65，不可插入
ALTER SYSTEM CREATE SERVICE service_mysql__service_mysql__service_mysql__service_mysql__12345 tenant = test_tenant_mysql;
ERROR HY000: Incorrect arguments to service_name, whose length should be 1 - 64
### service_name数字开头，不可插入
ALTER SYSTEM CREATE SERVICE 5dd tenant = test_tenant_mysql;
ERROR HY000: Incorrect arguments to service_name, which should be start with letter
### service_name有不允许的字符，不可插入
ALTER SYSTEM CREATE SERVICE d$d tenant = test_tenant_mysql;
ERROR HY000: Incorrect arguments to service_name, which can only include letter, digit and underscore
### 有temp offline server的情况下create可以但会显示NOT_FULLY_STARTED
ob1.z2.obs0.force_stop;
ob1.check_until_timeout select count(*) from __all_server where svr_ip='$z2_ip' and svr_port=$z2_port and status='INACTIVE' and start_service_time = 0 and last_offline_time > 0,1,120;
alter system change tenant tenant_id = 1001;
select tenant_id, name, value from __all_service_epoch where name="service_name_epoch";
tenant_id	name	value
1002	service_name_epoch	0
alter system change tenant tenant_id = 1;
ALTER SYSTEM CREATE SERVICE service_mysql__service_mysql__service_mysql__service_mysql__1234 tenant = test_tenant_mysql;
ERROR HY000: The service has not started on all servers
select tenant_id, service_name_id, service_name, service_status from __all_virtual_service where tenant_id=1002;
tenant_id	service_name_id	service_name	service_status
1002	1	service_mysql__service_mysql__service_mysql__service_mysql__1234	STARTED
alter system change tenant tenant_id = 1001;
select tenant_id, name, value from __all_service_epoch where name="service_name_epoch";
tenant_id	name	value
1002	service_name_epoch	1
alter system change tenant tenant_id = 1;
### 机器永久下线
alter system set server_permanent_offline_time = '20s';
### 检查打印的日志
### 不允许插入第二个service_name
ALTER SYSTEM CREATE SERVICE test_service_2 tenant = test_tenant_mysql;
ERROR HY000: The number of service_name for the tenant exceeds the limit, service name related command is not allowed
### 确认系统租户和meta租户不可修改
ALTER SYSTEM CREATE SERVICE test_service tenant = META$1002;
ERROR 0A000: Service name related command of META or SYS tenant is not supported
ALTER SYSTEM CREATE SERVICE test_service tenant = sys;
ERROR 0A000: Service name related command of META or SYS tenant is not supported
ob1.z2.obs0.start;
ob1.check_until_timeout select count(*) from __all_server where svr_ip='$z2_ip' and svr_port=$z2_port and start_service_time > 0,1,120;
### so_status不为normal, stop service不成功;
ALTER SYSTEM SWITCHOVER TO STANDBY TENANT test_tenant_mysql;
alter system set_tp tp_name = ERRSIM_TENANT_ROLE_TRANS_WAIT_SYNC_ERROR, error_code = 1044, frequency = 1;
ALTER SYSTEM SWITCHOVER TO PRIMARY TENANT test_tenant_mysql;
ERROR HY000: query primary failed(original error code: -1044), switchover to primary is not allowed
alter system set_tp tp_name = ERRSIM_TENANT_ROLE_TRANS_WAIT_SYNC_ERROR, error_code = 1044, frequency = 0;
ALTER SYSTEM STOP SERVICE service_mysql__service_mysql__service_mysql__service_mysql__1234 tenant = test_tenant_mysql;
ERROR HY000: The tenant's switchover status is not normal, service name related command is not allowed
ALTER SYSTEM SWITCHOVER TO PRIMARY TENANT test_tenant_mysql;
### service不是stop状态 delete 不成功
ALTER SYSTEM DELETE SERVICE service_mysql__service_mysql__service_mysql__service_mysql__1234 tenant = test_tenant_mysql;
ERROR HY000: The service_status is not STOPPED, DELETE SERVICE is not allowed
### stop service
ALTER SYSTEM STOP SERVICE service_mysql__service_mysql__service_mysql__service_mysql__1234 tenant = test_tenant_mysql;
select tenant_id, service_name_id, service_name, service_status from __all_virtual_service where tenant_id=1002;
tenant_id	service_name_id	service_name	service_status
1002	1	service_mysql__service_mysql__service_mysql__service_mysql__1234	STOPPED
alter system change tenant tenant_id = 1001;
select tenant_id, name, value from __all_service_epoch where name="service_name_epoch";
tenant_id	name	value
1002	service_name_epoch	3
alter system change tenant tenant_id = 1;
### start service
ALTER SYSTEM START SERVICE service_mysql__service_mysql__service_mysql__service_mysql__1234 tenant = test_tenant_mysql;
select tenant_id, service_name_id, service_name, service_status from __all_virtual_service where tenant_id=1002;
tenant_id	service_name_id	service_name	service_status
1002	1	service_mysql__service_mysql__service_mysql__service_mysql__1234	STARTED
alter system change tenant tenant_id = 1001;
select tenant_id, name, value from __all_service_epoch where name="service_name_epoch";
tenant_id	name	value
1002	service_name_epoch	4
alter system change tenant tenant_id = 1;
### stop service 但是有tmp offline server
ob1.z2.obs0.force_stop;
ob1.check_until_timeout select count(*) from __all_server where svr_ip='$z2_ip' and svr_port=$z2_port and status='INACTIVE' and start_service_time = 0 and last_offline_time > 0,1,120;
alter system set server_permanent_offline_time = '2000000s';
ALTER SYSTEM STOP SERVICE service_mysql__service_mysql__service_mysql__service_mysql__1234 tenant = test_tenant_mysql;
ERROR HY000: The tenant has units on temporary offline servers, STOP SERVICE is not allowed
alter system change tenant tenant_id = 1001;
select tenant_id, name, value from __all_service_epoch where name="service_name_epoch";
tenant_id	name	value
1002	service_name_epoch	4
alter system change tenant tenant_id = 1;
### start again,但是有tmp offline server
ALTER SYSTEM START SERVICE service_mysql__service_mysql__service_mysql__service_mysql__1234 tenant = test_tenant_mysql;
ERROR HY000: The service has not started on all servers
alter system change tenant tenant_id = 1001;
select tenant_id, name, value from __all_service_epoch where name="service_name_epoch";
tenant_id	name	value
1002	service_name_epoch	4
alter system change tenant tenant_id = 1;
### start again, 没有tmp offline server
alter system set server_permanent_offline_time = '20s';
ALTER SYSTEM START SERVICE service_mysql__service_mysql__service_mysql__service_mysql__1234 tenant = test_tenant_mysql;
select tenant_id, service_name_id, service_name, service_status from __all_virtual_service where tenant_id=1002;
tenant_id	service_name_id	service_name	service_status
1002	1	service_mysql__service_mysql__service_mysql__service_mysql__1234	STARTED
alter system change tenant tenant_id = 1001;
select tenant_id, name, value from __all_service_epoch where name="service_name_epoch";
tenant_id	name	value
1002	service_name_epoch	4
alter system change tenant tenant_id = 1;
ob1.z2.obs0.start;
ob1.check_until_timeout select count(*) from __all_server where svr_ip='$z2_ip' and svr_port=$z2_port and start_service_time > 0,1,120;
### stop service
ob1.mysql ALTER SYSTEM STOP SERVICE service_mysql__service_mysql__service_mysql__service_mysql__1234 tenant = test_tenant_mysql;
select tenant_id, service_name_id, service_name, service_status from __all_virtual_service where tenant_id=1002;
tenant_id	service_name_id	service_name	service_status
1002	1	service_mysql__service_mysql__service_mysql__service_mysql__1234	STOPPED
alter system change tenant tenant_id = 1001;
select tenant_id, name, value from __all_service_epoch where name="service_name_epoch";
tenant_id	name	value
1002	service_name_epoch	6
alter system change tenant tenant_id = 1;
### delete service
ALTER SYSTEM DELETE SERVICE service_mysql__service_mysql__service_mysql__service_mysql__1234 tenant = test_tenant_mysql;
select count(*) from __all_virtual_service where tenant_id=1002;
count(*)
0
alter system change tenant tenant_id = 1001;
select tenant_id, name, value from __all_service_epoch where name="service_name_epoch";
tenant_id	name	value
1002	service_name_epoch	7
alter system change tenant tenant_id = 1;
### failover
ALTER SYSTEM SWITCHOVER TO STANDBY TENANT test_tenant_mysql;
ALTER SYSTEM CREATE SERVICE test_service tenant = test_tenant_mysql;
select tenant_id, service_name_id, service_name, service_status from __all_virtual_service where tenant_id=1002;
tenant_id	service_name_id	service_name	service_status
1002	2	test_service	STARTED
ALTER SYSTEM ACTIVATE STANDBY TENANT test_tenant_mysql;
select tenant_id, service_name_id, service_name, service_status from __all_virtual_service where tenant_id=1002;
tenant_id	service_name_id	service_name	service_status
### 建连接
ob1.mysql ALTER SYSTEM CREATE SERVICE TEST_service tenant = test_tenant_mysql;
ob1.mysql alter system set_tp tp_name = ERRSIM_MOCK_SERVICE_NAME, error_code = 4018, frequency = 1;
ob1.check_until_timeout select count(*) from __all_virtual_processlist where service_name="test_service" and tenant_id=1002, 1, 3;
### stop service
ob1.mysql ALTER SYSTEM STOP SERVICE Test_SERvice tenant = test_tenant_mysql;
### stop service后连接都被kill掉 建连接
ob1.check_until_timeout select count(*) from CDB_OB_TENANT_EVENT_HISTORY where tenant_id=1002 and event ='KILL CONNECTIONS OF SERVICE NAME' and VALUE2 = 1 and VALUE3 != '', 1 ,3;
ob1.check_until_timeout select count(*) from __all_virtual_processlist where service_name="test_service" and tenant_id=1002, 0, 3;
### delete service 验证缓存可以在__all_service表为空的情况下看到service_epoch更新
ob1.mysql ALTER SYSTEM DELETE SERVICE Test_SERvice tenant = test_tenant_mysql;
ob1.mysql alter system set_tp tp_name = ERRSIM_MOCK_SERVICE_NAME, error_code = 1044, frequency = 0;
ob1.mysql ALTER SYSTEM CREATE SERVICE TEST_service tenant = test_tenant_mysql;
ob1.mysql ALTER SYSTEM STOP SERVICE Test_SERvice tenant = test_tenant_mysql;
ALTER SYSTEM DELETE SERVICE test_service;
ERROR 0A000: Service name related command of SYS tenant is not supported
ALTER SYSTEM DELETE SERVICE tesT_service tenant = test_tenant_mysql;
ALTER SYSTEM CREATE SERVICE test_service tenant = trytry;
ERROR HY000: Unknown tenant 'trytry'
ALTER SYSTEM DELETE SERVICE ssssss tenant = test_tenant_mysql;
ERROR HY000: This service_name is not found in the tenant
ALTER SYSTEM START SERVICE ssssss tenant = test_tenant_mysql;
ERROR HY000: This service_name is not found in the tenant
ALTER SYSTEM STOP SERVICE ssssss tenant = test_tenant_mysql;
ERROR HY000: This service_name is not found in the tenant
ALTER SYSTEM CREATE SERVICE test_service tenant = test_tenant_mysql;
alter system change tenant tenant_id=1001;
update oceanbase.__all_service set service_status="STOPPING";
select service_name, service_status from oceanbase.__all_service;
service_name	service_status
test_service	STOPPING
alter system change tenant tenant_id=1;
SELECT SERVICE_NAME_ID, SERVICE_NAME, SERVICE_STATUS FROM OCEANBASE.CDB_OB_SERVICES;
SERVICE_NAME_ID	SERVICE_NAME	SERVICE_STATUS
5	test_service	STOPPING
ALTER SYSTEM STOP SERVICE test_service tenant = test_tenant_mysql;
SELECT SERVICE_NAME_ID, SERVICE_NAME, SERVICE_STATUS FROM OCEANBASE.CDB_OB_SERVICES;
SERVICE_NAME_ID	SERVICE_NAME	SERVICE_STATUS
5	test_service	STOPPED
ALTER SYSTEM DELETE SERVICE test_service tenant = test_tenant_mysql;
SELECT SERVICE_NAME_ID, SERVICE_NAME, SERVICE_STATUS FROM OCEANBASE.CDB_OB_SERVICES;
SERVICE_NAME_ID	SERVICE_NAME	SERVICE_STATUS
ob1.mysql alter system set_tp tp_name = ERRSIM_MOCK_SERVICE_NAME, error_code = 4018, frequency = 1;
ALTER SYSTEM CREATE SERVICE test_service tenant = test_tenant_mysql;
ob1.mysql ALTER SYSTEM SWITCHOVER TO STANDBY TENANT test_tenant_mysql;
select ls_id from __all_ls;
ERROR HY000: The tenant is not PRIMARY
ob1.mysql ALTER SYSTEM SWITCHOVER TO PRIMARY TENANT test_tenant_mysql;
select count(*) from __all_virtual_processlist where service_name="test_service" and command = 'Query';
count(*)
1
select count(*) from GV$OB_PROCESSLIST where service_name="test_service" and command = 'Query';
count(*)
1
