ob1=OBI(cluster=1:1:1,proxy_num=0);
ob1.force_stop;
ob1.clean_backup_dest;
ob1.reboot;
ob1.mysql alter resource unit sys_unit_config memory_size='2G';
ob1.mysql CREATE RESOURCE UNIT unit_1 MAX_CPU 2, MEMORY_SIZE '2G';
ob1.mysql CREATE RESOURCE POOL pool_1 UNIT = 'unit_1', UNIT_NUM = 1, ZONE_LIST=('z1', 'z2', 'z3');
ob1.mysql CREATE TENANT $backup_mysql_tenant RESOURCE_POOL_LIST = ('pool_1'), primary_zone = "z2" set ob_tcp_invited_nodes='%', ob_compatibility_mode='mysql';
use oceanbase;
ALTER SYSTEM SWITCHOVER TO STANDBY TENANT META$1002 VERIFY;
ERROR HY000: Incorrect arguments to tenant name, only support operating user tenant
ALTER SYSTEM SWITCHOVER TO STANDBY TENANT sys VERIFY;
ERROR HY000: Incorrect arguments to tenant name, only support operating user tenant
alter system change tenant tenant_id = 1001;
UPDATE oceanbase.__all_tenant_info SET recovery_until_scn = 100 where tenant_id=1002;
alter system change tenant tenant_id = 1;
SELECT recovery_until_scn FROM oceanbase.__all_virtual_tenant_info WHERE tenant_id = 1002;
recovery_until_scn
100
ALTER SYSTEM SWITCHOVER TO STANDBY TENANT backup_mysql_tenant VERIFY;
ERROR HY000: Invalid argument
alter system change tenant tenant_id = 1001;
UPDATE oceanbase.__all_tenant_info SET recovery_until_scn = 4611686018427387903 where tenant_id=1002;
alter system change tenant tenant_id = 1;
ob1.mysql ALTER SYSTEM SWITCHOVER TO STANDBY TENANT $backup_mysql_tenant VERIFY;
SELECT tenant_role FROM oceanbase.__all_virtual_tenant_info WHERE tenant_id = 1002;
tenant_role
PRIMARY
alter system change tenant tenant_id = 1001;
UPDATE oceanbase.__all_tenant_info SET switchover_status = 'PREPARE SWITCHING TO PRIMARY' where tenant_id=1002;
alter system change tenant tenant_id = 1;
SELECT switchover_status FROM oceanbase.__all_virtual_tenant_info WHERE tenant_id = 1002;
switchover_status
PREPARE SWITCHING TO PRIMARY
ALTER SYSTEM SWITCHOVER TO STANDBY TENANT backup_mysql_tenant VERIFY;
ERROR HY000: switchover status not match, switchover to standby is not allowed
alter system change tenant tenant_id = 1001;
UPDATE oceanbase.__all_tenant_info SET switchover_status = 'FLASHBACK' where tenant_id=1002;
alter system change tenant tenant_id = 1;
SELECT switchover_status FROM oceanbase.__all_virtual_tenant_info WHERE tenant_id = 1002;
switchover_status
FLASHBACK
ALTER SYSTEM SWITCHOVER TO STANDBY TENANT backup_mysql_tenant VERIFY;
ERROR HY000: switchover status not match, switchover to standby is not allowed
alter system change tenant tenant_id = 1001;
UPDATE oceanbase.__all_tenant_info SET switchover_status = 'PREPARE FLASHBACK' where tenant_id=1002;
alter system change tenant tenant_id = 1;
SELECT switchover_status FROM oceanbase.__all_virtual_tenant_info WHERE tenant_id = 1002;
switchover_status
PREPARE FLASHBACK
ALTER SYSTEM SWITCHOVER TO STANDBY TENANT backup_mysql_tenant VERIFY;
ERROR HY000: switchover status not match, switchover to standby is not allowed
alter system change tenant tenant_id = 1001;
UPDATE oceanbase.__all_tenant_info SET switchover_status = 'SWITCHING TO PRIMARY' where tenant_id=1002;
alter system change tenant tenant_id = 1;
SELECT switchover_status FROM oceanbase.__all_virtual_tenant_info WHERE tenant_id = 1002;
switchover_status
SWITCHING TO PRIMARY
ALTER SYSTEM SWITCHOVER TO STANDBY TENANT backup_mysql_tenant VERIFY;
ERROR HY000: switchover status not match, switchover to standby is not allowed
alter system change tenant tenant_id = 1001;
UPDATE oceanbase.__all_tenant_info SET switchover_status = 'NORMAL' where tenant_id=1002;
ob1.mysql ALTER SYSTEM SWITCHOVER TO STANDBY TENANT $backup_mysql_tenant;
ob1.mysql ALTER SYSTEM SWITCHOVER TO STANDBY TENANT $backup_mysql_tenant;
