ob1=OBI(cluster=2,proxy_num=0,version=4_3_2_0);
ob1.reboot;
create resource unit box max_cpu 1, memory_size='10G';
create resource pool pool unit = 'box', unit_num = 1;
create tenant oracle replica_num = 1, resource_pool_list=('pool') set ob_tcp_invited_nodes='%', ob_compatibility_mode='oracle';
create user priv_test IDENTIFIED BY 123;
grant create session to priv_test;
BEGIN FOR r IN (select view_name from ALL_VIEWS where owner='SYS') LOOP EXECUTE IMMEDIATE 'GRANT SELECT ON SYS.' || r.view_name || ' TO PRIV_TEST'; END LOOP; END;
select count(*) from sys.all_views;
COUNT(*)
463
select count(*) from sys.dba_tab_privs where grantee = 'PRIV_TEST';
COUNT(*)
463
ob1.mysql alter system begin upgrade;
ob1.mysql alter system begin rolling upgrade;
ob1.z1.obs0.stop;
ob1.z1.obs0.upgrade;
ob1.z1.obs0.nstart;
ob1.z1.obs1.stop;
ob1.z1.obs1.upgrade;
ob1.z1.obs1.nstart;
ob1.check_until_timeout select count(*) from oceanbase.__all_server a left join oceanbase.__all_virtual_server_schema_info b on a.svr_ip = b.svr_ip and a.svr_port = b.svr_port where b.svr_ip is null, 0, 120;
ob1.check_until_timeout select count(*) as cnt from oceanbase.__all_virtual_server_schema_info as a join oceanbase.__all_virtual_server_schema_info as b on a.tenant_id = b.tenant_id  where a.refreshed_schema_version != b.refreshed_schema_version or a.refreshed_schema_version % 8 != 0, 0, 180;
update oceanbase.__all_server set id = 4096 where id = 2;
select id from oceanbase.__all_server order by id;
id
1
4096
alter system end rolling upgrade;
ERROR HY000: max server id in the cluster cannot be larget than MAX_SERVER_COUNT, UPGRADE is not allowed
update oceanbase.__all_server set id = 2 where id = 4096;
select id from oceanbase.__all_server order by id;
id
1
2
ob1.z1.obs1.delete;
ob1.check_until_timeout select count(*) from __all_server, 1,120;
ob1.mysql alter system end rolling upgrade;
ob1.mysql alter system run upgrade job 'UPGRADE_ALL';
ob1.check_until_timeout select job_status from oceanbase.__all_rootservice_job where job_type='UPGRADE_ALL' order by job_id limit 1, SUCCESS, 600;
ob1.mysql alter system end upgrade;
select count(*) from sys.dba_tab_privs where grantee = 'PRIV_TEST';
COUNT(*)
463
