ob1=OBI(cluster=2:2:2,proxy_num=0,init_unit_cpu=0);
ob1.z1.obs0.set extra_config=$extra_conf;
ob1.z1.obs1.set extra_config=$extra_conf;
ob1.z2.obs0.set extra_config=$extra_conf;
ob1.z2.obs1.set extra_config=$extra_conf;
ob1.reboot;
ob1.mysql alter system set debug_sync_timeout = '1000s';
# create mysql tenant
CREATE RESOURCE UNIT if not exists unit_1 MAX_CPU 2, MEMORY_SIZE='3G';
CREATE RESOURCE POOL if not exists pool_1 UNIT = 'unit_1', UNIT_NUM = 2;
CREATE TENANT mysql RESOURCE_POOL_LIST = ('pool_1'), primary_zone='z1', locality="F@z1, F@z2, C@z3" set ob_tcp_invited_nodes='%';
# create oracle tenant
CREATE RESOURCE POOL if not exists pool_2 UNIT = 'unit_1', UNIT_NUM = 1;
CREATE TENANT oracle RESOURCE_POOL_LIST = ('pool_2'), primary_zone='z1', locality="F@z1, F@z2, C@z3" set ob_tcp_invited_nodes='%', ob_compatibility_mode='oracle';
ob1.check_until_timeout select count(*) as cnt from oceanbase.__all_virtual_server_schema_info as a join oceanbase.__all_virtual_server_schema_info as b on a.tenant_id = b.tenant_id  where a.refreshed_schema_version != b.refreshed_schema_version, 0, 60;
ob1.mysql alter system set enable_rebalance = false tenant sys;
ob1.mysql alter system set partition_balance_schedule_interval = '0s' tenant all_user;

########################################
############# mysql tenant #############
########################################
ob1.mysql alter system set partition_balance_schedule_interval = '2h' tenant mysql;
# create noraml table
create table mys_t1(c1 int, c2 int, c3 int, c4 longtext, index(c1) local, index(c2) global);
ob1.check_until_timeout select count(*) from CDB_OB_TABLE_LOCATIONS where tenant_id = $mysql_tenant_id and (table_id = $mys_t1_tid or data_table_id = $mys_t1_tid) and role = 'LEADER' and duplicate_scope = 'NONE', 5, 3;
select table_id, table_name, table_type, duplicate_scope from oceanbase.DBA_OB_TABLE_LOCATIONS where (table_id = 500002 or data_table_id = 500002) and role = 'LEADER' order by table_id;
table_id	table_name	table_type	duplicate_scope
500002	mys_t1	USER TABLE	NONE
500003	__idx_500002_c1	INDEX	NONE
500004	__idx_500002_c2	INDEX	NONE
500005	__AUX_LOB_META_500005_	LOB AUX TABLE	NONE
500006	__AUX_LOB_PIECE_500006_	LOB AUX TABLE	NONE
ob1.check_until_timeout select count(*) from CDB_OB_LS where tenant_id = $mysql_tenant_id and flag like "%duplicate%", 0, 3;
##########
# 1. verify normal table to duplicate table process
alter table mys_t1 duplicate_scope = 'CLUSTER';
# 1.1. change schemas of priamry table and aux tables
ob1.check_until_timeout select count(*) from CDB_OB_TABLE_LOCATIONS where tenant_id = $mysql_tenant_id and (table_id = $mys_t1_tid or data_table_id = $mys_t1_tid) and role = 'LEADER' and duplicate_scope = 'CLUSTER', 5, 3;
select table_id, table_name, table_type, duplicate_scope from oceanbase.DBA_OB_TABLE_LOCATIONS where (table_id = 500002 or data_table_id = 500002) and role = 'LEADER' order by table_id;
table_id	table_name	table_type	duplicate_scope
500002	mys_t1	USER TABLE	CLUSTER
500003	__idx_500002_c1	INDEX	CLUSTER
500004	__idx_500002_c2	INDEX	CLUSTER
500005	__AUX_LOB_META_500005_	LOB AUX TABLE	CLUSTER
500006	__AUX_LOB_PIECE_500006_	LOB AUX TABLE	CLUSTER
# 1.2. duplicate_ls is created in the same time
ob1.check_until_timeout select count(*) from CDB_OB_LS where tenant_id = $mysql_tenant_id and flag like "%duplicate%", 1, 3;
ob1.check_until_timeout select count(*) from CDB_OB_TABLE_LOCATIONS where tenant_id = $mysql_tenant_id and (table_id = $mys_t1_tid or data_table_id = $mys_t1_tid) and ls_id = $dup_ls_id, 0, 3;
# 1.3. create local index before transferring duplicate table to dup ls
create index local_idx_on_mys_t1_c3 on mys_t1(c3) local;
ob1.check_until_timeout select count(*) from CDB_OB_TABLE_LOCATIONS where tenant_id = $mysql_tenant_id and table_id = $local_idx_on_mys_t1_c3_tid and ls_id = $dup_ls_id, 0, 3;
# 1.4 generate partition balace job and tasks
ob1.mysql alter system set partition_balance_schedule_interval = '10s' tenant mysql;
ob1.check_until_timeout select count(*) from CDB_OB_BALANCE_JOBS where tenant_id = $mysql_tenant_id and job_type = 'PARTITION_BALANCE', 1, 30;
ob1.check_until_timeout select count(*) from CDB_OB_BALANCE_JOB_HISTORY where tenant_id = $mysql_tenant_id and job_type = 'PARTITION_BALANCE' and status = 'COMPLETED', 1, 120;
ob1.check_until_timeout select count(*) from CDB_OB_BALANCE_TASK_HISTORY where tenant_id = $mysql_tenant_id and job_id = $last_job_id and status = 'COMPLETED', 4, 3;
ob1.check_until_timeout select count(*) from CDB_OB_TRANSFER_TASK_HISTORY where tenant_id = $mysql_tenant_id and status = 'COMPLETED' and balance_task_id in (select task_id from CDB_OB_BALANCE_TASK_HISTORY where tenant_id = $mysql_tenant_id and job_id = $last_job_id and status = 'COMPLETED'), 2, 3;
# 1.5. verify tablets have been transferred from normal ls to dup_ls
ob1.check_until_timeout select count(*) from CDB_OB_TABLE_LOCATIONS where tenant_id = $mysql_tenant_id and (table_id = $mys_t1_tid or data_table_id = $mys_t1_tid) and role = 'LEADER' and ls_id = $dup_ls_id, 6, 3;
##########
# 2. verify duplicate_scope table to normal table process
alter table mys_t1 duplicate_scope = 'NONE';
# 2.1. change schemas of priamry table and aux tables
ob1.check_until_timeout select count(*) from CDB_OB_TABLE_LOCATIONS where tenant_id = $mysql_tenant_id and (table_id = $mys_t1_tid or data_table_id = $mys_t1_tid) and role = 'LEADER' and duplicate_scope = 'NONE', 6, 3;
select table_id, table_name, table_type, duplicate_scope from oceanbase.DBA_OB_TABLE_LOCATIONS where (table_id = 500002 or data_table_id = 500002) and role = 'LEADER' order by table_id;
table_id	table_name	table_type	duplicate_scope
500002	mys_t1	USER TABLE	NONE
500003	__idx_500002_c1	INDEX	NONE
500004	__idx_500002_c2	INDEX	NONE
500005	__AUX_LOB_META_500005_	LOB AUX TABLE	NONE
500006	__AUX_LOB_PIECE_500006_	LOB AUX TABLE	NONE
500007	__idx_500002_local_idx_on_mys_t1_c3	INDEX	NONE
# 2.2. generate partition balace job and tasks
ob1.check_until_timeout select count(*) from CDB_OB_BALANCE_JOBS where tenant_id = $mysql_tenant_id and job_type = 'PARTITION_BALANCE', 1, 30;
ob1.check_until_timeout select count(*) from CDB_OB_BALANCE_JOB_HISTORY where tenant_id = $mysql_tenant_id and job_type = 'PARTITION_BALANCE' and status = 'COMPLETED', 2, 120;
ob1.check_until_timeout select count(*) from CDB_OB_BALANCE_TASK_HISTORY where tenant_id = $mysql_tenant_id and job_id = $last_job_id and status = 'COMPLETED', 3, 3;
ob1.check_until_timeout select count(*) from CDB_OB_TRANSFER_TASK_HISTORY where tenant_id = $mysql_tenant_id and status = 'COMPLETED' and balance_task_id in (select task_id from CDB_OB_BALANCE_TASK_HISTORY where tenant_id = $mysql_tenant_id and job_id = $last_job_id and status = 'COMPLETED'), 1, 3;
# 2.3. verify tablets have been transferred from dup ls to normal ls
ob1.check_until_timeout select count(*) from CDB_OB_TABLE_LOCATIONS where tenant_id = $mysql_tenant_id and (table_id = $mys_t1_tid or data_table_id = $mys_t1_tid) and ls_id = $dup_ls_id, 0, 3;
##########
# 3. duplicate_scope is conflicted with tablegroup
create tablegroup mys_tg;
create table mys_t2(c1 int) duplicate_scope = 'CLUSTER';
alter table mys_t2 tablegroup = 'mys_tg';
ERROR 0A000: changing duplicate_scope of table in tablegroup is not supported
alter tablegroup mys_tg add mys_t2;
ERROR 0A000: duplicate table in tablegroup not supported
alter table mys_t2 duplicate_scope = 'CLUSTER' tablegroup = 'mys_tg';
ERROR 0A000: changing duplicate_scope of table in tablegroup is not supported
alter table mys_t2 duplicate_scope = 'NONE' tablegroup = 'mys_tg';
ERROR null: success
alter table mys_t2 duplicate_scope = 'CLUSTER';
ERROR 0A000: changing duplicate_scope of table in tablegroup is not supported
alter table mys_t2 duplicate_scope = 'CLUSTER' tablegroup = '';
ERROR null: success
##########
# 4. batch duplicate tables partition balance
ob1.mysql alter system set partition_balance_schedule_interval = '0s' tenant mysql;
# 4.1. prepare data
create tablegroup tg_none sharding = 'NONE';
create tablegroup tg_partition sharding = 'PARTITION';
create tablegroup tg_adaptive sharding = 'ADAPTIVE';
create table mys_normal_part_zero_1(c1 int, c2 int, c3 longtext, index(c1) local, index(c2) global);
create table mys_normal_part_one_1(c1 int, c2 int, c3 longtext, index(c1) local, index(c2) global) partition by hash(c1) partitions 2;
create table mys_normal_part_two_1(c1 int, c2 int, c3 longtext, index(c1) local, index(c2) global) partition by range(c1) subpartition by hash(c1) subpartitions 2 (partition p1 values less than (100), partition p2 values less than MAXVALUE);
create table mys_dup_part_zero_1(c1 int, c2 int, c3 longtext, index(c1) local, index(c2) global) duplicate_scope = 'cluster';
create table mys_dup_part_one_1(c1 int, c2 int, c3 longtext, index(c1) local, index(c2) global) duplicate_scope = 'cluster' partition by hash(c1) partitions 2;
create table mys_dup_part_two_1(c1 int, c2 int, c3 longtext, index(c1) local, index(c2) global) duplicate_scope = 'cluster' partition by range(c1) subpartition by hash(c1) subpartitions 2 (partition p1 values less than (100), partition p2 values less than MAXVALUE);
create table mys_normal_part_zero_2(c1 int, c2 int, c3 longtext, index(c1) local, index(c2) global);
create table mys_normal_part_one_2(c1 int, c2 int, c3 longtext, index(c1) local, index(c2) global) partition by hash(c1) partitions 2;
create table mys_normal_part_two_2(c1 int, c2 int, c3 longtext, index(c1) local, index(c2) global) partition by range(c1) subpartition by hash(c1) subpartitions 2 (partition p1 values less than (100), partition p2 values less than MAXVALUE);
create table mys_dup_part_zero_2(c1 int, c2 int, c3 longtext, index(c1) local, index(c2) global) duplicate_scope = 'cluster';
create table mys_dup_part_one_2(c1 int, c2 int, c3 longtext, index(c1) local, index(c2) global) duplicate_scope = 'cluster' partition by hash(c1) partitions 2;
create table mys_dup_part_two_2(c1 int, c2 int, c3 longtext, index(c1) local, index(c2) global) duplicate_scope = 'cluster' partition by range(c1) subpartition by hash(c1) subpartitions 2 (partition p1 values less than (100), partition p2 values less than MAXVALUE);
create table mys_normal_part_zero_3(c1 int, c2 int, c3 longtext, index(c1) local, index(c2) global);
create table mys_normal_part_one_3(c1 int, c2 int, c3 longtext, index(c1) local, index(c2) global) partition by hash(c1) partitions 2;
create table mys_normal_part_two_3(c1 int, c2 int, c3 longtext, index(c1) local, index(c2) global) partition by range(c1) subpartition by hash(c1) subpartitions 2 (partition p1 values less than (100), partition p2 values less than MAXVALUE);
create table mys_dup_part_zero_3(c1 int, c2 int, c3 longtext, index(c1) local, index(c2) global) duplicate_scope = 'cluster';
create table mys_dup_part_one_3(c1 int, c2 int, c3 longtext, index(c1) local, index(c2) global) duplicate_scope = 'cluster' partition by hash(c1) partitions 2;
create table mys_dup_part_two_3(c1 int, c2 int, c3 longtext, index(c1) local, index(c2) global) duplicate_scope = 'cluster' partition by range(c1) subpartition by hash(c1) subpartitions 2 (partition p1 values less than (100), partition p2 values less than MAXVALUE);
create table mys_normal_part_zero_4(c1 int, c2 int, c3 longtext, index(c1) local, index(c2) global);
create table mys_normal_part_one_4(c1 int, c2 int, c3 longtext, index(c1) local, index(c2) global) partition by hash(c1) partitions 2;
create table mys_normal_part_two_4(c1 int, c2 int, c3 longtext, index(c1) local, index(c2) global) partition by range(c1) subpartition by hash(c1) subpartitions 2 (partition p1 values less than (100), partition p2 values less than MAXVALUE);
create table mys_dup_part_zero_4(c1 int, c2 int, c3 longtext, index(c1) local, index(c2) global) duplicate_scope = 'cluster';
create table mys_dup_part_one_4(c1 int, c2 int, c3 longtext, index(c1) local, index(c2) global) duplicate_scope = 'cluster' partition by hash(c1) partitions 2;
create table mys_dup_part_two_4(c1 int, c2 int, c3 longtext, index(c1) local, index(c2) global) duplicate_scope = 'cluster' partition by range(c1) subpartition by hash(c1) subpartitions 2 (partition p1 values less than (100), partition p2 values less than MAXVALUE);
alter table mys_normal_part_zero_1 duplicate_scope = 'cluster';
alter table mys_normal_part_one_1 duplicate_scope = 'cluster';
alter table mys_normal_part_two_1 duplicate_scope = 'cluster';
alter table mys_dup_part_zero_1 duplicate_scope = 'none';
alter table mys_dup_part_one_1 duplicate_scope = 'none';
alter table mys_dup_part_two_1 duplicate_scope = 'none';
alter table mys_normal_part_zero_2 duplicate_scope = 'cluster';
alter table mys_normal_part_one_2 duplicate_scope = 'cluster';
alter table mys_normal_part_two_2 duplicate_scope = 'cluster';
alter table mys_dup_part_zero_2 duplicate_scope = 'none';
alter table mys_dup_part_one_2 duplicate_scope = 'none';
alter table mys_dup_part_two_2 duplicate_scope = 'none';
alter table mys_normal_part_zero_3 duplicate_scope = 'cluster';
alter table mys_normal_part_one_3 duplicate_scope = 'cluster';
alter table mys_normal_part_two_3 duplicate_scope = 'cluster';
alter table mys_dup_part_zero_3 duplicate_scope = 'none';
alter table mys_dup_part_one_3 duplicate_scope = 'none';
alter table mys_dup_part_two_3 duplicate_scope = 'none';
alter table mys_normal_part_zero_4 duplicate_scope = 'cluster';
alter table mys_normal_part_one_4 duplicate_scope = 'cluster';
alter table mys_normal_part_two_4 duplicate_scope = 'cluster';
alter table mys_dup_part_zero_4 duplicate_scope = 'none';
alter table mys_dup_part_one_4 duplicate_scope = 'none';
alter table mys_dup_part_two_4 duplicate_scope = 'none';
# 4.2. verify balance job
ob1.mysql alter system set partition_balance_schedule_interval = '10s' tenant mysql;
ob1.check_until_timeout select count(*) from CDB_OB_BALANCE_JOBS where tenant_id = $mysql_tenant_id and job_type = 'PARTITION_BALANCE', 1, 60;
ob1.check_until_timeout select count(*) from CDB_OB_BALANCE_JOBS where tenant_id = $mysql_tenant_id and job_type = 'PARTITION_BALANCE', 0, 420;
ob1.check_until_timeout select count(*) from CDB_OB_BALANCE_JOB_HISTORY where tenant_id = $mysql_tenant_id and job_type = 'PARTITION_BALANCE' and status = 'COMPLETED' and job_id > $last_job_id, 2, 120;
# 4.3. verify distribution
ob1.check_until_timeout select count(*) from CDB_OB_TABLE_LOCATIONS where tenant_id = $mysql_tenant_id and table_name like "%mys_normal_%" and ls_id != $dup_ls_id, 0, 3;
ob1.check_until_timeout select count(*) from CDB_OB_TABLE_LOCATIONS where tenant_id = $mysql_tenant_id and data_table_id in (select distinct(table_id) from CDB_OB_TABLE_LOCATIONS where tenant_id = $mysql_tenant_id and table_name like "%mys_normal_%") and ls_id != $dup_ls_id, 0, 3;
ob1.check_until_timeout select count(*) from CDB_OB_TABLE_LOCATIONS where tenant_id = $mysql_tenant_id and table_name like "%mys_dup_%" and ls_id = $dup_ls_id, 0, 3;
ob1.check_until_timeout select count(*) from CDB_OB_TABLE_LOCATIONS where tenant_id = $mysql_tenant_id and data_table_id in (select distinct(table_id) from CDB_OB_TABLE_LOCATIONS where tenant_id = $mysql_tenant_id and table_name like "%mys_dup_%") and ls_id = $dup_ls_id, 0, 3;
ob1.check_until_timeout select count(distinct(ls_id)) from CDB_OB_TABLE_LOCATIONS where tenant_id = $mysql_tenant_id and table_name in ("mys_dup_part_zero_1", "mys_dup_part_zero_2"), 1, 3;
##########
# 5. test redundant dup ls
ob1.mysql alter system set enable_rebalance = false tenant mysql;
ob1.check_until_timeout select count(*) from CDB_OB_LS where tenant_id = $mysql_tenant_id and flag like "%DUPLICATE%" and status = 'NORMAL', 1, 3;
# 5.1. create redundant dup ls manually
alter system change tenant mysql;
alter system change tenant sys;
ob1.check_until_timeout select count(*) from CDB_OB_LS where tenant_id = $mysql_tenant_id and flag like "%DUPLICATE%" and status = 'NORMAL', 2, 60;
# 5.2. no tablet will be created on redundant dup ls
create table mys_t3(c1 int, c2 int, c3 longtext, index(c1) local, index(c2) global) duplicate_scope = 'cluster';
create table mys_t4(c1 int, c2 int, c3 longtext, index(c1) local, index(c2) global) duplicate_scope = 'cluster' partition by hash(c1) partitions 5;
ob1.check_until_timeout select count(*) from CDB_OB_TABLE_LOCATIONS where tenant_id = $mysql_tenant_id and ls_id = $redundant_dup_ls_id, 0, 3;
# 5.3. shrink redundant dup ls by ls balance
ob1.mysql alter system set enable_rebalance = true tenant mysql;
ob1.check_until_timeout select count(*) from CDB_OB_BALANCE_JOB_HISTORY where tenant_id = $mysql_tenant_id and job_type = 'LS_BALANCE' and balance_strategy = 'LS balance by shrink' and status = 'COMPLETED', 1, 120;
ob1.check_until_timeout select count(*) from CDB_OB_LS where tenant_id = $mysql_tenant_id and flag like "%DUPLICATE%" and status = 'NORMAL', 1, 3;
##########
# 6. test reset ls_group_id to 0 for single dup ls
ob1.mysql alter system set enable_rebalance = false tenant mysql;
ob1.check_until_timeout select ls_group_id from CDB_OB_LS where tenant_id = $mysql_tenant_id and ls_id = $dup_ls_id, 0, 3;
# 6.1. change ls_group_id for dup ls manually
alter system change tenant mysql;
alter system change tenant sys;
ob1.check_until_timeout select ls_group_id from CDB_OB_LS where tenant_id = $mysql_tenant_id and ls_id = $dup_ls_id, $ls_group_id, 3;
# 6.2. ls_group_id of dup ls will be changed to 0 by ls balance
ob1.mysql alter system set enable_rebalance = true tenant mysql;
ob1.check_until_timeout select ls_group_id from CDB_OB_LS where tenant_id = $mysql_tenant_id and ls_id = $dup_ls_id, 0, 120;
##########
# 7. test migrate and transform type for dup ls with ls_group_id
ob1.mysql alter resource tenant mysql unit_num = 1;
ob1.check_until_timeout select count(*) from GV\$OB_UNITS where tenant_id in ($mysql_tenant_id, $mysql_tenant_id-1), 6, 240;
ob1.mysql alter tenant mysql locality = 'F@z1,F@z2';
ob1.check_until_timeout select count(*) from __all_tenant where previous_locality != '', 0, 120;
ob1.mysql alter tenant mysql locality = 'F@z1,F@z2,R@z3';
ob1.check_until_timeout select count(*) from __all_tenant where previous_locality != '', 0, 120;
# 7.1. set ls_group_id for dup ls
ob1.mysql alter system set enable_rebalance = false tenant mysql;
ob1.check_until_timeout select ls_group_id != $ls_group_id from __all_virtual_ls_status where tenant_id = $mysql_tenant_id and ls_id = $dup_ls_id, 1, 3;
alter system change tenant mysql;
update __all_ls set ls_group_id = 1002 where ls_id = 1003;
ob1.check_until_timeout select count(*) from __all_virtual_ls_status where tenant_id = $mysql_tenant_id and ls_id = $dup_ls_id and ls_group_id = $ls_group_id and unit_group_id != 0, 1, 5;
alter system change tenant sys;
# 7.2. test migrate dup ls replica when migrate unit
# 7.2.1. migrate F replica of dup ls with ls_group_id
ob1.check_until_timeout select concat(svr_ip,':',svr_port) = '$obs_z1_0_ip:$obs_z1_0_port' from CDB_OB_LS_LOCATIONS where tenant_id = $mysql_tenant_id and zone = 'z1' and replica_type = 'FULL', 1, 3;
ob1.mysql alter system migrate unit $unit_id destination '$obs_z1_1_ip:$obs_z1_1_port';
ob1.check_until_timeout select count(*) from __all_unit where migrate_from_svr_port != 0, 0, 120;
ob1.check_until_timeout select count(*) from CDB_OB_LS_LOCATIONS where tenant_id = $mysql_tenant_id and ls_id = $dup_ls_id and zone = 'z1' and concat(svr_ip,':',svr_port) = '$obs_z1_1_ip:$obs_z1_1_port' and replica_type = 'FULL', 1, 5;
# 7.6.2 migrate R replica of dup ls with ls_group_id
ob1.check_until_timeout select concat(svr_ip,':',svr_port) = '$obs_z3_0_ip:$obs_z3_0_port' from CDB_OB_LS_LOCATIONS where tenant_id = $mysql_tenant_id and zone = 'z3' and replica_type = 'READONLY', 1, 3;
ob1.mysql alter system migrate unit $unit_id destination '$obs_z3_1_ip:$obs_z3_1_port';
ob1.check_until_timeout select count(*) from __all_unit where migrate_from_svr_port != 0, 0, 120;
ob1.check_until_timeout select count(*) from CDB_OB_LS_LOCATIONS where tenant_id = $mysql_tenant_id and ls_id = $dup_ls_id and zone = 'z3' and concat(svr_ip,':',svr_port) = '$obs_z3_1_ip:$obs_z3_1_port' and replica_type = 'READONLY', 1, 5;
alter system change tenant mysql;
update __all_ls set ls_group_id = 0 where ls_id = 1003;
alter system change tenant sys;
ob1.mysql alter system set enable_rebalance = true tenant mysql;
##########
# 8. test transfer with R replica while dup ls not exists
ob1.mysql alter tenant oracle locality = 'F@z1,F@z2';
ob1.check_until_timeout select count(*) from __all_tenant where previous_locality != '', 0, 120;
ob1.mysql alter tenant oracle locality = 'F@z1,F@z2,R@z3';
ob1.check_until_timeout select count(*) from __all_tenant where previous_locality != '', 0, 120;
ob1.mysql alter tenant oracle primary_zone = RANDOM;
ob1.check_until_timeout select count(*) from CDB_OB_BALANCE_JOBS where tenant_id = $oracle_tenant_id and job_type = 'LS_BALANCE' and balance_strategy = 'LS balance by expand', 1, 60;
ob1.check_until_timeout select count(*) from CDB_OB_BALANCE_JOBS where tenant_id = $oracle_tenant_id and job_type = 'LS_BALANCE' and balance_strategy = 'LS balance by expand', 0, 420;
ob1.mysql alter tenant oracle primary_zone = 'z1';
ob1.check_until_timeout select count(*) from CDB_OB_BALANCE_JOBS where tenant_id = $oracle_tenant_id and job_type = 'LS_BALANCE' and balance_strategy = 'LS balance by shrink', 1, 60;
ob1.check_until_timeout select count(*) from CDB_OB_BALANCE_JOBS where tenant_id = $oracle_tenant_id and job_type = 'LS_BALANCE' and balance_strategy = 'LS balance by shrink', 0, 420;

########################################
############ oracle tenant #############
########################################
# create noraml table
create table ora_t1(c1 int, c2 int, c3 clob);
create index ora_l_idx_t1 on ora_t1(c1) local;
create index ora_g_idx_t1 on ora_t1(c2) global;
ob1.check_until_timeout select count(*) from CDB_OB_TABLE_LOCATIONS where tenant_id = $oracle_tenant_id and (table_id = $ora_t1_tid or data_table_id = $ora_t1_tid) and role = 'LEADER' and duplicate_scope = 'NONE', 5, 3;
select table_id, table_name, table_type, duplicate_scope from SYS.DBA_OB_TABLE_LOCATIONS where (table_id = 500002 or data_table_id = 500002) and role = 'LEADER' order by table_id;
TABLE_ID	TABLE_NAME	TABLE_TYPE	DUPLICATE_SCOPE
500002	ORA_T1	USER TABLE	NONE
500003	__AUX_LOB_META_500003_	LOB AUX TABLE	NONE
500004	__AUX_LOB_PIECE_500004_	LOB AUX TABLE	NONE
500005	__idx_500002_ORA_L_IDX_T1	INDEX	NONE
500006	__idx_500002_ORA_G_IDX_T1	INDEX	NONE
ob1.check_until_timeout select count(*) from CDB_OB_LS where tenant_id = $oracle_tenant_id and flag like "%duplicate%", 0, 3;
##########
# 1. normal table to duplicate table
alter table ora_t1 duplicate_scope = 'CLUSTER';
# 1.1. change schemas of priamry table and aux tables
ob1.check_until_timeout select count(*) from CDB_OB_TABLE_LOCATIONS where tenant_id = $oracle_tenant_id and (table_id = $ora_t1_tid or data_table_id = $ora_t1_tid) and role = 'LEADER' and duplicate_scope = 'CLUSTER', 5, 3;
select table_id, table_name, table_type, duplicate_scope from SYS.DBA_OB_TABLE_LOCATIONS where (table_id = 500002 or data_table_id = 500002) and role = 'LEADER' order by table_id;
TABLE_ID	TABLE_NAME	TABLE_TYPE	DUPLICATE_SCOPE
500002	ORA_T1	USER TABLE	CLUSTER
500003	__AUX_LOB_META_500003_	LOB AUX TABLE	CLUSTER
500004	__AUX_LOB_PIECE_500004_	LOB AUX TABLE	CLUSTER
500005	__idx_500002_ORA_L_IDX_T1	INDEX	CLUSTER
500006	__idx_500002_ORA_G_IDX_T1	INDEX	CLUSTER
# 1.2. create duplicate_ls in the same time
ob1.check_until_timeout select count(*) from CDB_OB_LS where tenant_id = $oracle_tenant_id and flag like "%duplicate%", 1, 3;
##
# 2. duplicate_scope table to normal table
alter table ora_t1 duplicate_scope = 'NONE';
# 2.1. change schemas of priamry table and aux tables
ob1.check_until_timeout select count(*) from CDB_OB_TABLE_LOCATIONS where tenant_id = $oracle_tenant_id and (table_id = $ora_t1_tid or data_table_id = $ora_t1_tid) and role = 'LEADER' and duplicate_scope = 'NONE', 5, 3;
select table_id, table_name, table_type, duplicate_scope from SYS.DBA_OB_TABLE_LOCATIONS where (table_id = 500002 or data_table_id = 500002) and role = 'LEADER' order by table_id;
TABLE_ID	TABLE_NAME	TABLE_TYPE	DUPLICATE_SCOPE
500002	ORA_T1	USER TABLE	NONE
500003	__AUX_LOB_META_500003_	LOB AUX TABLE	NONE
500004	__AUX_LOB_PIECE_500004_	LOB AUX TABLE	NONE
500005	__idx_500002_ORA_L_IDX_T1	INDEX	NONE
500006	__idx_500002_ORA_G_IDX_T1	INDEX	NONE
##########
# 3. duplicate_scope is conflicted with tablegroup
create tablegroup ora_tg;
create table ora_t2(c1 int) duplicate_scope = 'CLUSTER';
alter table ora_t2 tablegroup = 'ORA_TG';
ERROR 0A000: OBE-00600: internal error code, arguments: -4007, changing duplicate_scope of table in tablegroup is not supported
alter tablegroup ora_tg add ora_t2;
ERROR 0A000: OBE-00600: internal error code, arguments: -4007, duplicate table in tablegroup not supported
alter table ora_t2 duplicate_scope = 'CLUSTER' tablegroup = 'ORA_TG';
ERROR 0A000: OBE-00600: internal error code, arguments: -4007, changing duplicate_scope of table in tablegroup is not supported
alter table ora_t2 duplicate_scope = 'NONE' tablegroup = 'ORA_TG';
ERROR null: success
alter table ora_t2 duplicate_scope = 'CLUSTER';
ERROR 0A000: OBE-00600: internal error code, arguments: -4007, changing duplicate_scope of table in tablegroup is not supported
alter table ora_t2 duplicate_scope = 'CLUSTER' tablegroup = '';
ERROR null: success

########################################
############ other tenant ##############
########################################
# duplicate table is not allowed in sys tenant
create table sys_t1(c1 int) duplicate_scope = 'CLUSTER';
ERROR 0A000: create duplicate table under sys or meta tenant not supported
create table sys_t1(c1 int) duplicate_scope = 'NONE';
alter table sys_t1 duplicate_scope = 'CLUSTER';
ERROR 0A000: not user tenant, alter table duplicate scope not supported
