#Environmental cleaning
drop user hjw@'%';
create user hjw identified by 'hjw';
grant all on *.* to hjw WITH GRANT OPTION;
#function-8    约束
#function-9    分区表
#function-10    pl/sql
#function-8     约束=====>primary key
drop table test1;
create table test1(c1 int,c2 varchar(50),c3 varchar(50),PRIMARY key(c2,c3));
insert into test1 values(1,bin_to_uuid(uuid_to_bin('e097bcbb-3fbd-11ed-9291-b8599f1d613a')),bin_to_uuid(uuid_to_bin('e0daf39c-3fbd-11ed-9291-b8599f1d613a')));
insert into test1 values(2,bin_to_uuid(uuid_to_bin('e0479be4-3fbd-11ed-9291-b8599f1d613a')),bin_to_uuid(uuid_to_bin('e11a70f8-3fbd-11ed-9291-b8599f1d613a')));
insert into test1 values(3,bin_to_uuid(uuid_to_bin('dd747f47-3fbd-11ed-9645-7cd30abc95d8')),bin_to_uuid(uuid_to_bin('de73a513-3fbd-11ed-9645-7cd30abc95d8')));
insert into test1 values(4,bin_to_uuid(uuid_to_bin('dec6af5e-3fbd-11ed-9645-7cd30abc95d8'),22),bin_to_uuid(uuid_to_bin('df0e8fae-3fbd-11ed-9645-7cd30abc95d8'),54));
select * from test1 order by c1 asc;
c1	c2	c3
1	e097bcbb-3fbd-11ed-9291-b8599f1d613a	e0daf39c-3fbd-11ed-9291-b8599f1d613a
2	e0479be4-3fbd-11ed-9291-b8599f1d613a	e11a70f8-3fbd-11ed-9291-b8599f1d613a
3	dd747f47-3fbd-11ed-9645-7cd30abc95d8	de73a513-3fbd-11ed-9645-7cd30abc95d8
4	3fbd11ed-af5e-dec6-9645-7cd30abc95d8	3fbd11ed-8fae-df0e-9645-7cd30abc95d8
insert into test1 values(4,bin_to_uuid(uuid_to_bin('dec6af5e-3fbd-11ed-9645-7cd30abc95d8',6)),bin_to_uuid(uuid_to_bin('df0e8fae-3fbd-11ed-9645-7cd30abc95d8',4)));
select * from test1 order by c1 asc;
c1	c2	c3
1	e097bcbb-3fbd-11ed-9291-b8599f1d613a	e0daf39c-3fbd-11ed-9291-b8599f1d613a
2	e0479be4-3fbd-11ed-9291-b8599f1d613a	e11a70f8-3fbd-11ed-9291-b8599f1d613a
3	dd747f47-3fbd-11ed-9645-7cd30abc95d8	de73a513-3fbd-11ed-9645-7cd30abc95d8
4	11ed3fbd-dec6-af5e-9645-7cd30abc95d8	11ed3fbd-df0e-8fae-9645-7cd30abc95d8
4	3fbd11ed-af5e-dec6-9645-7cd30abc95d8	3fbd11ed-8fae-df0e-9645-7cd30abc95d8
insert into test1 values(5,bin_to_uuid(uuid_to_bin('e097bcbb-3fbd-11ed-9291-b8599f1d613a')),bin_to_uuid(uuid_to_bin('e0daf39c-3fbd-11ed-9291-b8599f1d613a')));
insert into test1 values(5,bin_to_uuid(uuid_to_bin('e097bcbb-3fbd-11ed-9291-b8599f1d613a')),bin_to_uuid(uuid_to_bin('4d82490a-3fbe-11ed-9645-7cd30abc95d8')));
insert into test1 values(6,bin_to_uuid(uuid_to_bin('5dc89c44-3fbe-11ed-9645-7cd30abc95d8')),bin_to_uuid(uuid_to_bin('4d82490a-3fbe-11ed-9645-7cd30abc95d8')));
insert into test1 values(6,bin_to_uuid(uuid_to_bin('null')),bin_to_uuid(uuid_to_bin('null')));
select * from test1 order by c1 asc;
c1	c2	c3
1	e097bcbb-3fbd-11ed-9291-b8599f1d613a	e0daf39c-3fbd-11ed-9291-b8599f1d613a
2	e0479be4-3fbd-11ed-9291-b8599f1d613a	e11a70f8-3fbd-11ed-9291-b8599f1d613a
3	dd747f47-3fbd-11ed-9645-7cd30abc95d8	de73a513-3fbd-11ed-9645-7cd30abc95d8
4	11ed3fbd-dec6-af5e-9645-7cd30abc95d8	11ed3fbd-df0e-8fae-9645-7cd30abc95d8
4	3fbd11ed-af5e-dec6-9645-7cd30abc95d8	3fbd11ed-8fae-df0e-9645-7cd30abc95d8
5	e097bcbb-3fbd-11ed-9291-b8599f1d613a	4d82490a-3fbe-11ed-9645-7cd30abc95d8
6	5dc89c44-3fbe-11ed-9645-7cd30abc95d8	4d82490a-3fbe-11ed-9645-7cd30abc95d8
select * from test1 where c2=bin_to_uuid(uuid_to_bin('e097bcbb-3fbd-11ed-9291-b8599f1d613a')) order by c1 asc;
c1	c2	c3
1	e097bcbb-3fbd-11ed-9291-b8599f1d613a	e0daf39c-3fbd-11ed-9291-b8599f1d613a
5	e097bcbb-3fbd-11ed-9291-b8599f1d613a	4d82490a-3fbe-11ed-9645-7cd30abc95d8
select * from test1 where c2=bin_to_uuid(uuid_to_bin('e097bcbb-3fbd-11ed-9291-b8599f1d613a')) order by c1 asc;
c1	c2	c3
1	e097bcbb-3fbd-11ed-9291-b8599f1d613a	e0daf39c-3fbd-11ed-9291-b8599f1d613a
5	e097bcbb-3fbd-11ed-9291-b8599f1d613a	4d82490a-3fbe-11ed-9645-7cd30abc95d8
update test1 set c2=bin_to_uuid(uuid_to_bin('e097bcbb-3fbd-11ed-9291-b8599f1d613a')) where c2=bin_to_uuid(uuid_to_bin('5dc89c44-3fbe-11ed-9645-7cd30abc95d8'));
select * from test1 order by c1 asc;
c1	c2	c3
1	e097bcbb-3fbd-11ed-9291-b8599f1d613a	e0daf39c-3fbd-11ed-9291-b8599f1d613a
2	e0479be4-3fbd-11ed-9291-b8599f1d613a	e11a70f8-3fbd-11ed-9291-b8599f1d613a
3	dd747f47-3fbd-11ed-9645-7cd30abc95d8	de73a513-3fbd-11ed-9645-7cd30abc95d8
4	11ed3fbd-dec6-af5e-9645-7cd30abc95d8	11ed3fbd-df0e-8fae-9645-7cd30abc95d8
4	3fbd11ed-af5e-dec6-9645-7cd30abc95d8	3fbd11ed-8fae-df0e-9645-7cd30abc95d8
5	e097bcbb-3fbd-11ed-9291-b8599f1d613a	4d82490a-3fbe-11ed-9645-7cd30abc95d8
6	5dc89c44-3fbe-11ed-9645-7cd30abc95d8	4d82490a-3fbe-11ed-9645-7cd30abc95d8
update test1 set c2=bin_to_uuid(uuid_to_bin('e097bcbb-3fbd-11ed-9291-b8599f1d613a')),c3=bin_to_uuid(uuid_to_bin('e0daf39c-3fbd-11ed-9291-b8599f1d613a'))
where c2=bin_to_uuid(uuid_to_bin('5dc89c44-3fbe-11ed-9645-7cd30abc95d8'));
select * from test1 order by c1 asc;
c1	c2	c3
1	e097bcbb-3fbd-11ed-9291-b8599f1d613a	e0daf39c-3fbd-11ed-9291-b8599f1d613a
2	e0479be4-3fbd-11ed-9291-b8599f1d613a	e11a70f8-3fbd-11ed-9291-b8599f1d613a
3	dd747f47-3fbd-11ed-9645-7cd30abc95d8	de73a513-3fbd-11ed-9645-7cd30abc95d8
4	11ed3fbd-dec6-af5e-9645-7cd30abc95d8	11ed3fbd-df0e-8fae-9645-7cd30abc95d8
4	3fbd11ed-af5e-dec6-9645-7cd30abc95d8	3fbd11ed-8fae-df0e-9645-7cd30abc95d8
5	e097bcbb-3fbd-11ed-9291-b8599f1d613a	4d82490a-3fbe-11ed-9645-7cd30abc95d8
6	5dc89c44-3fbe-11ed-9645-7cd30abc95d8	4d82490a-3fbe-11ed-9645-7cd30abc95d8
update test1 set bin_to_uuid(uuid_to_bin('e097bcbb-3fbd-11ed-9291-b8599f1d613a'))=bin_to_uuid(uuid_to_bin('e097bcbb-3fbd-11ed-9291-b8599f1d613a')) where c2=bin_to_uuid(uuid_to_bin('5dc89c44-3fbe-11ed-9645-7cd30abc95d8'));
update test1 set bin_to_uuid(uuid_to_bin('e097bcbb-3fbd-11ed-9291-b8599f1d613a',6))=bin_to_uuid(uuid_to_bin('e097bcbb-3fbd-11ed-9291-b8599f1d613a')) where c2=bin_to_uuid(uuid_to_bin('5dc89c44-3fbe-11ed-9645-7cd30abc95d8',4));
drop table test1;
#function-8     约束=====>unique
drop table test1;
create table test1(c1 int,c2 varchar(50),c3 varchar(50),unique(c2,c3));
insert into test1 values(1,bin_to_uuid(uuid_to_bin('e097bcbb-3fbd-11ed-9291-b8599f1d613a')),bin_to_uuid(uuid_to_bin('e0daf39c-3fbd-11ed-9291-b8599f1d613a')));
insert into test1 values(2,bin_to_uuid(uuid_to_bin('e0479be4-3fbd-11ed-9291-b8599f1d613a')),bin_to_uuid(uuid_to_bin('e11a70f8-3fbd-11ed-9291-b8599f1d613a')));
insert into test1 values(3,bin_to_uuid(uuid_to_bin('dd747f47-3fbd-11ed-9645-7cd30abc95d8')),bin_to_uuid(uuid_to_bin('de73a513-3fbd-11ed-9645-7cd30abc95d8')));
insert into test1 values(4,bin_to_uuid(uuid_to_bin('dec6af5e-3fbd-11ed-9645-7cd30abc95d8')),bin_to_uuid(uuid_to_bin('df0e8fae-3fbd-11ed-9645-7cd30abc95d8')));
select * from test1 order by c1 asc;
c1	c2	c3
1	e097bcbb-3fbd-11ed-9291-b8599f1d613a	e0daf39c-3fbd-11ed-9291-b8599f1d613a
2	e0479be4-3fbd-11ed-9291-b8599f1d613a	e11a70f8-3fbd-11ed-9291-b8599f1d613a
3	dd747f47-3fbd-11ed-9645-7cd30abc95d8	de73a513-3fbd-11ed-9645-7cd30abc95d8
4	dec6af5e-3fbd-11ed-9645-7cd30abc95d8	df0e8fae-3fbd-11ed-9645-7cd30abc95d8
insert into test1 values(4,bin_to_uuid(uuid_to_bin('dec6af5e-3fbd-11ed-9645-7cd30abc95d8',6)),bin_to_uuid(uuid_to_bin('df0e8fae-3fbd-11ed-9645-7cd30abc95d8',5)));
select * from test1 order by c1 asc;
c1	c2	c3
1	e097bcbb-3fbd-11ed-9291-b8599f1d613a	e0daf39c-3fbd-11ed-9291-b8599f1d613a
2	e0479be4-3fbd-11ed-9291-b8599f1d613a	e11a70f8-3fbd-11ed-9291-b8599f1d613a
3	dd747f47-3fbd-11ed-9645-7cd30abc95d8	de73a513-3fbd-11ed-9645-7cd30abc95d8
4	dec6af5e-3fbd-11ed-9645-7cd30abc95d8	df0e8fae-3fbd-11ed-9645-7cd30abc95d8
4	11ed3fbd-dec6-af5e-9645-7cd30abc95d8	11ed3fbd-df0e-8fae-9645-7cd30abc95d8
insert into test1 values(5,bin_to_uuid(uuid_to_bin('e097bcbb-3fbd-11ed-9291-b8599f1d613a')),bin_to_uuid(uuid_to_bin('e0daf39c-3fbd-11ed-9291-b8599f1d613a')));
insert into test1 values(5,bin_to_uuid(uuid_to_bin('e097bcbb-3fbd-11ed-9291-b8599f1d613a')),bin_to_uuid(uuid_to_bin('4d82490a-3fbe-11ed-9645-7cd30abc95d8')));
insert into test1 values(6,bin_to_uuid(uuid_to_bin('5dc89c44-3fbe-11ed-9645-7cd30abc95d8'),65),bin_to_uuid(uuid_to_bin('4d82490a-3fbe-11ed-9645-7cd30abc95d8'),null));
insert into test1 values(6,bin_to_uuid(uuid_to_bin('null')),bin_to_uuid(uuid_to_bin('null')));
select * from test1 order by c1 asc;
c1	c2	c3
1	e097bcbb-3fbd-11ed-9291-b8599f1d613a	e0daf39c-3fbd-11ed-9291-b8599f1d613a
2	e0479be4-3fbd-11ed-9291-b8599f1d613a	e11a70f8-3fbd-11ed-9291-b8599f1d613a
3	dd747f47-3fbd-11ed-9645-7cd30abc95d8	de73a513-3fbd-11ed-9645-7cd30abc95d8
4	dec6af5e-3fbd-11ed-9645-7cd30abc95d8	df0e8fae-3fbd-11ed-9645-7cd30abc95d8
4	11ed3fbd-dec6-af5e-9645-7cd30abc95d8	11ed3fbd-df0e-8fae-9645-7cd30abc95d8
5	e097bcbb-3fbd-11ed-9291-b8599f1d613a	4d82490a-3fbe-11ed-9645-7cd30abc95d8
6	3fbe11ed-9c44-5dc8-9645-7cd30abc95d8	4d82490a-3fbe-11ed-9645-7cd30abc95d8
select * from test1 where c2=bin_to_uuid(uuid_to_bin('e097bcbb-3fbd-11ed-9291-b8599f1d613a')) order by c1 asc;
c1	c2	c3
1	e097bcbb-3fbd-11ed-9291-b8599f1d613a	e0daf39c-3fbd-11ed-9291-b8599f1d613a
5	e097bcbb-3fbd-11ed-9291-b8599f1d613a	4d82490a-3fbe-11ed-9645-7cd30abc95d8
select * from test1 where c2=bin_to_uuid(uuid_to_bin('e097bcbb-3fbd-11ed-9291-b8599f1d613a')) order by c1 asc;
c1	c2	c3
1	e097bcbb-3fbd-11ed-9291-b8599f1d613a	e0daf39c-3fbd-11ed-9291-b8599f1d613a
5	e097bcbb-3fbd-11ed-9291-b8599f1d613a	4d82490a-3fbe-11ed-9645-7cd30abc95d8
select * from test1 where c2=bin_to_uuid(uuid_to_bin('e097bcbb-3fbd-11ed-9291-b8599f1d613a',6)) order by c1 asc;
c1	c2	c3
update test1 set c2=bin_to_uuid(uuid_to_bin('e097bcbb-3fbd-11ed-9291-b8599f1d613a')) where c2=bin_to_uuid(uuid_to_bin('5dc89c44-3fbe-11ed-9645-7cd30abc95d8'));
select * from test1 order by c1 asc;
c1	c2	c3
1	e097bcbb-3fbd-11ed-9291-b8599f1d613a	e0daf39c-3fbd-11ed-9291-b8599f1d613a
2	e0479be4-3fbd-11ed-9291-b8599f1d613a	e11a70f8-3fbd-11ed-9291-b8599f1d613a
3	dd747f47-3fbd-11ed-9645-7cd30abc95d8	de73a513-3fbd-11ed-9645-7cd30abc95d8
4	dec6af5e-3fbd-11ed-9645-7cd30abc95d8	df0e8fae-3fbd-11ed-9645-7cd30abc95d8
4	11ed3fbd-dec6-af5e-9645-7cd30abc95d8	11ed3fbd-df0e-8fae-9645-7cd30abc95d8
5	e097bcbb-3fbd-11ed-9291-b8599f1d613a	4d82490a-3fbe-11ed-9645-7cd30abc95d8
6	3fbe11ed-9c44-5dc8-9645-7cd30abc95d8	4d82490a-3fbe-11ed-9645-7cd30abc95d8
update test1 set c2=bin_to_uuid(uuid_to_bin('e097bcbb-3fbd-11ed-9291-b8599f1d613a')),c3=bin_to_uuid(uuid_to_bin('e0daf39c-3fbd-11ed-9291-b8599f1d613a'))
where c2=bin_to_uuid(uuid_to_bin('5dc89c44-3fbe-11ed-9645-7cd30abc95d8'));
select * from test1 order by c1 asc;
c1	c2	c3
1	e097bcbb-3fbd-11ed-9291-b8599f1d613a	e0daf39c-3fbd-11ed-9291-b8599f1d613a
2	e0479be4-3fbd-11ed-9291-b8599f1d613a	e11a70f8-3fbd-11ed-9291-b8599f1d613a
3	dd747f47-3fbd-11ed-9645-7cd30abc95d8	de73a513-3fbd-11ed-9645-7cd30abc95d8
4	dec6af5e-3fbd-11ed-9645-7cd30abc95d8	df0e8fae-3fbd-11ed-9645-7cd30abc95d8
4	11ed3fbd-dec6-af5e-9645-7cd30abc95d8	11ed3fbd-df0e-8fae-9645-7cd30abc95d8
5	e097bcbb-3fbd-11ed-9291-b8599f1d613a	4d82490a-3fbe-11ed-9645-7cd30abc95d8
6	3fbe11ed-9c44-5dc8-9645-7cd30abc95d8	4d82490a-3fbe-11ed-9645-7cd30abc95d8
update test1 set bin_to_uuid(uuid_to_bin('e097bcbb-3fbd-11ed-9291-b8599f1d613a'))=bin_to_uuid(uuid_to_bin('e097bcbb-3fbd-11ed-9291-b8599f1d613a')) where c2=bin_to_uuid(uuid_to_bin('5dc89c44-3fbe-11ed-9645-7cd30abc95d8'));
drop table test1;
#function-8     约束=====>check
drop table test1;
create table test1(c1 int,c2 varchar(50),c3 varchar(50),check(c2<bin_to_uuid(uuid_to_bin('e097bcbb-3fbd-11ed-9291-b8599f1d613a'))+52));
drop table test1;
create table test1(c1 int,c2 varchar(50),c3 varchar(50),check(c2<bin_to_uuid(uuid_to_bin('e097bcbb-3fbd-11ed-9291-b8599f1d613a'))));
drop table test1;
create table test1(c1 int,c2 varchar(50),c3 varchar(50),check(c2<(select bin_to_uuid(uuid_to_bin('e097bcbb-3fbd-11ed-9291-b8599f1d613a')))));
create table test1(c1 int,c2 varchar(50),c3 varchar(50),check(c2<bin_to_uuid(uuid_to_bin('e097bcbb-3fbd-11ed-9291-b8599f1d613a'))+52));
insert into test1 values(1,bin_to_uuid(uuid_to_bin('e097bcbb-3fbd-11ed-9291-b8599f1d613a'))+2,bin_to_uuid(uuid_to_bin('e0daf39c-3fbd-11ed-9291-b8599f1d613a'))-2);
Warnings:
Warning	1292	Truncated incorrect DOUBLE value: 'e097bcbb-3fbd-11ed-9291-b8599f1d613a'
Warning	1292	Truncated incorrect DOUBLE value: 'e0daf39c-3fbd-11ed-9291-b8599f1d613a'
Warning	1292	Truncated incorrect DOUBLE value: 'e097bcbb-3fbd-11ed-9291-b8599f1d613a'
insert into test1 values(1,bin_to_uuid(uuid_to_bin('e097bcbb-3fbd-11ed-9291-b8599f1d613a',7))+2,bin_to_uuid(uuid_to_bin('e0daf39c-3fbd-11ed-9291-b8599f1d613a',9))-2);
Warnings:
Warning	1292	Truncated incorrect DOUBLE value: '11ed3fbd-e097-bcbb-9291-b8599f1d613a'
Warning	1292	Truncated incorrect DOUBLE value: '11ed3fbd-e0da-f39c-9291-b8599f1d613a'
Warning	1292	Truncated incorrect DOUBLE value: 'e097bcbb-3fbd-11ed-9291-b8599f1d613a'
insert into test1 values(2,bin_to_uuid(uuid_to_bin('e0479be4-3fbd-11ed-9291-b8599f1d613a')),bin_to_uuid(uuid_to_bin('e11a70f8-3fbd-11ed-9291-b8599f1d613a')));
insert into test1 values(2,bin_to_uuid(uuid_to_bin('dec6af5e-3fbd-11ed-9645-7cd30abc95d8'))+53,bin_to_uuid(uuid_to_bin('df0e8fae-3fbd-11ed-9645-7cd30abc95d8'))+53);
insert into test1 values(2,bin_to_uuid(uuid_to_bin('dec6af5e-3fbd-11ed-9645-7cd30abc95d8'))+null,bin_to_uuid(uuid_to_bin('df0e8fae-3fbd-11ed-9645-7cd30abc95d8'))+null);
Warnings:
Warning	1292	Truncated incorrect DOUBLE value: 'dec6af5e-3fbd-11ed-9645-7cd30abc95d8'
Warning	1292	Truncated incorrect DOUBLE value: 'df0e8fae-3fbd-11ed-9645-7cd30abc95d8'
select * from test1 order by c1 asc;
c1	c2	c3
1	2	-2
1	13	9
2	NULL	NULL
insert into test1 values(2,bin_to_uuid(uuid_to_bin('dec6af5e-3fbd-11ed-9645-7cd30abc95d8'))+50,bin_to_uuid(uuid_to_bin('df0e8fae-3fbd-11ed-9645-7cd30abc95d8'))+50);
Warnings:
Warning	1292	Truncated incorrect DOUBLE value: 'dec6af5e-3fbd-11ed-9645-7cd30abc95d8'
Warning	1292	Truncated incorrect DOUBLE value: 'df0e8fae-3fbd-11ed-9645-7cd30abc95d8'
Warning	1292	Truncated incorrect DOUBLE value: 'e097bcbb-3fbd-11ed-9291-b8599f1d613a'
select * from test1 order by c1 asc;
c1	c2	c3
1	2	-2
1	13	9
2	NULL	NULL
2	50	50
update test1 set c2=bin_to_uuid(uuid_to_bin('e097bcbb-3fbd-11ed-9291-b8599f1d613a'))+55 where c2=50;
ERROR HY000: check constraint violated
select * from test1 order by c1 asc;
c1	c2	c3
1	2	-2
1	13	9
2	NULL	NULL
2	50	50
update test1 set c2=bin_to_uuid(uuid_to_bin('e097bcbb-3fbd-11ed-9291-b8599f1d613a'))+49 where c2=50;
Warnings:
Warning	1292	Truncated incorrect DOUBLE value: 'e097bcbb-3fbd-11ed-9291-b8599f1d613a'
Warning	1292	Truncated incorrect DOUBLE value: 'e097bcbb-3fbd-11ed-9291-b8599f1d613a'
update test1 set c2=bin_to_uuid(uuid_to_bin('e097bcbb-3fbd-11ed-9291-b8599f1d613a',7))+49 where c2=50;
select * from test1 order by c1 asc;
c1	c2	c3
1	2	-2
1	13	9
2	NULL	NULL
2	49	50
update test1 set c2=bin_to_uuid(uuid_to_bin('e097bcbb-3fbd-11ed-9291-b8599f1d613a'))+4*bin_to_uuid(uuid_to_bin('e097bcbb-3fbd-11ed-9291-b8599f1d613a')) where c2=49;
Warnings:
Warning	1292	Truncated incorrect DOUBLE value: 'e097bcbb-3fbd-11ed-9291-b8599f1d613a'
Warning	1292	Truncated incorrect DOUBLE value: 'e097bcbb-3fbd-11ed-9291-b8599f1d613a'
Warning	1292	Truncated incorrect DOUBLE value: 'e097bcbb-3fbd-11ed-9291-b8599f1d613a'
select * from test1 order by c1 asc;
c1	c2	c3
1	2	-2
1	13	9
2	NULL	NULL
2	0	50
update test1 set c2=bin_to_uuid(uuid_to_bin('e097bcbb-3fbd-11ed-9291-b8599f1d613a'))+4,c2=bin_to_uuid(uuid_to_bin('e097bcbb-3fbd-11ed-9291-b8599f1d613a'))+10 where c2=0;
Warnings:
Warning	1292	Truncated incorrect DOUBLE value: 'e097bcbb-3fbd-11ed-9291-b8599f1d613a'
Warning	1292	Truncated incorrect DOUBLE value: 'e097bcbb-3fbd-11ed-9291-b8599f1d613a'
select * from test1 order by c1 asc;
c1	c2	c3
1	2	-2
1	13	9
2	NULL	NULL
2	10	50
delete from test1 where c2=bin_to_uuid(uuid_to_bin('e097bcbb-3fbd-11ed-9291-b8599f1d613a'))+10;
Warnings:
Warning	1292	Truncated incorrect DOUBLE value: 'e097bcbb-3fbd-11ed-9291-b8599f1d613a'
Warning	1292	Truncated incorrect DOUBLE value: 'e097bcbb-3fbd-11ed-9291-b8599f1d613a'
delete from test1 where c2=bin_to_uuid(uuid_to_bin('e097bcbb-3fbd-11ed-9291-b8599f1d613a'))+null;
Warnings:
Warning	1292	Truncated incorrect DOUBLE value: 'e097bcbb-3fbd-11ed-9291-b8599f1d613a'
select * from test1 order by c1 asc;
c1	c2	c3
1	2	-2
1	13	9
2	NULL	NULL
drop table test1;
#function-8     约束=====>not null
drop table test1;
create table test1(
c1 int PRIMARY key AUTO_INCREMENT,
c2 varchar(50) not null,
c3 varchar(50) not null
);
insert into test1(c2,c3) values(
bin_to_uuid(uuid_to_bin('dec6af5e-3fbd-11ed-9645-7cd30abc95d8'))+null,
bin_to_uuid(uuid_to_bin('dec6af5e-3fbd-11ed-9645-7cd30abc95d8'))+null);
insert into test1(c2,c3) values(
bin_to_uuid(uuid_to_bin('dec6af5e-3fbd-11ed-9645-7cd30abc95d8')),
bin_to_uuid(uuid_to_bin('dec6af5e-3fbd-11ed-9645-7cd30abc95d8')));
select * from test1 order by c1 asc;
c1	c2	c3
2	dec6af5e-3fbd-11ed-9645-7cd30abc95d8	dec6af5e-3fbd-11ed-9645-7cd30abc95d8
insert into test1(c2,c3) values(
bin_to_uuid(uuid_to_bin('dec6af5e-3fbd-11ed-9645-7cd30abc95d8'))+0,
bin_to_uuid(uuid_to_bin('dec6af5e-3fbd-11ed-9645-7cd30abc95d8'))+0);
Warnings:
Warning	1292	Truncated incorrect DOUBLE value: 'dec6af5e-3fbd-11ed-9645-7cd30abc95d8'
Warning	1292	Truncated incorrect DOUBLE value: 'dec6af5e-3fbd-11ed-9645-7cd30abc95d8'
select * from test1 order by c1 asc;
c1	c2	c3
2	dec6af5e-3fbd-11ed-9645-7cd30abc95d8	dec6af5e-3fbd-11ed-9645-7cd30abc95d8
3	0	0
insert into test1(c2,c3) values(
bin_to_uuid(uuid_to_bin('dec6af5e-3fbd-11ed-9645-7cd30abc95d8',9))+0,
bin_to_uuid(uuid_to_bin('dec6af5e-3fbd-11ed-9645-7cd30abc95d8',-9))+0);
Warnings:
Warning	1292	Truncated incorrect DOUBLE value: '11ed3fbd-dec6-af5e-9645-7cd30abc95d8'
Warning	1292	Truncated incorrect DOUBLE value: '11ed3fbd-dec6-af5e-9645-7cd30abc95d8'
select * from test1 order by c1 asc;
c1	c2	c3
2	dec6af5e-3fbd-11ed-9645-7cd30abc95d8	dec6af5e-3fbd-11ed-9645-7cd30abc95d8
3	0	0
4	11	11
update test1 set c2=bin_to_uuid(uuid_to_bin('dec6af5e-3fbd-11ed-9645-7cd30abc95d8'))+null where c2=0;
update test1 set c2=bin_to_uuid(uuid_to_bin('dec6af5e-3fbd-11ed-9645-7cd30abc95d8'))+null where c2='0';
ERROR 23000: Column 'c2' cannot be null
select * from test1 order by c1 asc;
c1	c2	c3
2	dec6af5e-3fbd-11ed-9645-7cd30abc95d8	dec6af5e-3fbd-11ed-9645-7cd30abc95d8
3	0	0
4	11	11
delete from test1 where c2= bin_to_uuid(uuid_to_bin('dec6af5e-3fbd-11ed-9645-7cd30abc95d8'))+0;
delete from test1 where c2= bin_to_uuid(uuid_to_bin('dec6af5e-3fbd-11ed-9645-7cd30abc95d8'))+null;
Warnings:
Warning	1292	Truncated incorrect DOUBLE value: 'dec6af5e-3fbd-11ed-9645-7cd30abc95d8'
delete from test1 where c2= bin_to_uuid(uuid_to_bin('dec6af5e-3fbd-11ed-9645-7cd30abc95d8'));
select * from test1 order by c1 asc;
c1	c2	c3
3	0	0
4	11	11
drop table test1;
#function-8     约束=====>default
drop table test1;
create table test1(
c1 int PRIMARY key AUTO_INCREMENT,
c2 varchar(50) default (select bin_to_uuid(uuid_to_bin('dec6af5e-3fbd-11ed-9645-7cd30abc95d8'))));
create table test1(
c1 int PRIMARY key AUTO_INCREMENT,
c2 varchar(50) default bin_to_uuid(uuid_to_bin('dec6af5e-3fbd-11ed-9645-7cd30abc95d8')));
create table test1(
c1 int PRIMARY key AUTO_INCREMENT,
c2 varchar(50) default 'bin_to_uuid(uuid_to_bin(dec6af5e-3fbd-11ed-9645-7cd30abc95d8))');
create table test1(
c1 int PRIMARY key AUTO_INCREMENT,
c2 varchar(50) default 'bin_to_uuid(uuid_to_bin(dec6af5e-3fbd-11ed-9645-7cd30abc95d8)，44)');
#function-8     约束=====>foreign key
drop table test2;
drop table test1;
create table test1(c1 varchar(50) PRIMARY key);
insert into test1 values(bin_to_uuid(uuid_to_bin('dec6af5e-3fbd-11ed-9645-7cd30abc95d8'),5));
insert into test1 values(bin_to_uuid(uuid_to_bin('dec6af5e-3fbd-11ed-9645-7cd30abc95d8'),8));
insert into test1 values(bin_to_uuid(uuid_to_bin('dec6af5e-3fbd-11ed-9645-7cd30abc95d8'),10));
create table test2(c1 varchar(50) PRIMARY key,c2 int,CONSTRAINT wj FOREIGN KEY (c1) REFERENCES test1(c1));
insert into test2 values(bin_to_uuid(uuid_to_bin('dec6af5e-3fbd-11ed-9645-7cd30abc95d8'),5),bin_to_uuid(uuid_to_bin('dec6af5e-3fbd-11ed-9645-7cd30abc95d8',7)));
select * from test2 order by c1 asc;
c1	c2
insert into test2 values(bin_to_uuid(uuid_to_bin('dec6af5e-3fbd-11ed-9645-7cd30abc95d8'))+bin_to_uuid(uuid_to_bin('dec6af5e-3fbd-11ed-9645-7cd30abc95d8'))
+bin_to_uuid(uuid_to_bin('dec6af5e-3fbd-11ed-9645-7cd30abc95d8'))+bin_to_uuid(uuid_to_bin('dec6af5e-3fbd-11ed-9645-7cd30abc95d8'))
+bin_to_uuid(uuid_to_bin('dec6af5e-3fbd-11ed-9645-7cd30abc95d8')),bin_to_uuid(uuid_to_bin('dec6af5e-3fbd-11ed-9645-7cd30abc95d8')));
insert into test2 values(bin_to_uuid(uuid_to_bin('dec6af5e-3fbd-11ed-9645-7cd30abc95d8'))+bin_to_uuid(uuid_to_bin('dec6af5e-3fbd-11ed-9645-7cd30abc95d8'))
+bin_to_uuid(uuid_to_bin('dec6af5e-3fbd-11ed-9645-7cd30abc95d8'))-bin_to_uuid(uuid_to_bin('dec6af5e-3fbd-11ed-9645-7cd30abc95d8'))
-bin_to_uuid(uuid_to_bin('dec6af5e-3fbd-11ed-9645-7cd30abc95d8')),bin_to_uuid(uuid_to_bin('dec6af5e-3fbd-11ed-9645-7cd30abc95d8')));
select * from test2 order by c1 asc;
c1	c2
insert into test2 values(bin_to_uuid(uuid_to_bin('dec6af5e-3fbd-11ed-9645-7cd30abc95d8',6))+bin_to_uuid(uuid_to_bin('dec6af5e-3fbd-11ed-9645-7cd30abc95d8'))
+bin_to_uuid(uuid_to_bin('dec6af5e-3fbd-11ed-9645-7cd30abc95d8',-6))-bin_to_uuid(uuid_to_bin('dec6af5e-3fbd-11ed-9645-7cd30abc95d8'))
-bin_to_uuid(uuid_to_bin('dec6af5e-3fbd-11ed-9645-7cd30abc95d8')),bin_to_uuid(uuid_to_bin('dec6af5e-3fbd-11ed-9645-7cd30abc95d8',6.5)));
select * from test2 order by c1 asc;
c1	c2
update test2 set c1=(bin_to_uuid(uuid_to_bin('dec6af5e-3fbd-11ed-9645-7cd30abc95d8')))+7 where c2=(bin_to_uuid(uuid_to_bin('dec6af5e-3fbd-11ed-9645-7cd30abc95d8')))+ 4;
Warnings:
Warning	1292	Truncated incorrect DOUBLE value: 'dec6af5e-3fbd-11ed-9645-7cd30abc95d8'
select * from test2 order by c1 asc;
c1	c2
update test2 set c1=(bin_to_uuid(uuid_to_bin('dec6af5e-3fbd-11ed-9645-7cd30abc95d8')))*0 where c1=(bin_to_uuid(uuid_to_bin('dec6af5e-3fbd-11ed-9645-7cd30abc95d8')))* 7;
Warnings:
Warning	1292	Truncated incorrect DOUBLE value: 'dec6af5e-3fbd-11ed-9645-7cd30abc95d8'
delete from test2 where c1=(bin_to_uuid(uuid_to_bin('dec6af5e-3fbd-11ed-9645-7cd30abc95d8')))*7;
Warnings:
Warning	1292	Truncated incorrect DOUBLE value: 'dec6af5e-3fbd-11ed-9645-7cd30abc95d8'
select * from test2 order by c1 asc;
c1	c2
drop table test2;
drop table test1;
#function-9     分区表=====>hash
drop table test1;
create table test1(c1 bigint(50),c2 bigint(50))partition  by hash(c1)(PARTITION p1,PARTITION p2);
insert into test1 PARTITION(p1) values(bin_to_uuid(uuid_to_bin('da01b7f7-3fd2-11ed-9291-b8599f1d613a')),bin_to_uuid(uuid_to_bin('da410d10-3fd2-11ed-9291-b8599f1d613a')));
insert into test1 PARTITION(p1) values(bin_to_uuid(uuid_to_bin('da01b7f7-3fd2-11ed-9291-b8599f1d613a'),32),bin_to_uuid(uuid_to_bin('da410d10-3fd2-11ed-9291-b8599f1d613a'),66));
drop table test1;
create table test1(c1 BLOB,c2 BLOB)partition  by hash(c1)(PARTITION p1,PARTITION p2);
#function-9     分区表=====>key
drop table test1;
create table test1(c1 bigint(50),c2 bigint(50))partition  by key(c1)(PARTITION p1,PARTITION p2);
insert into test1 PARTITION(p1) values(bin_to_uuid(uuid_to_bin('da01b7f7-3fd2-11ed-9291-b8599f1d613a')),bin_to_uuid(uuid_to_bin('da410d10-3fd2-11ed-9291-b8599f1d613a')));
insert into test1 PARTITION(p1) values(bin_to_uuid(uuid_to_bin('da01b7f7-3fd2-11ed-9291-b8599f1d613a'),32),bin_to_uuid(uuid_to_bin('da410d10-3fd2-11ed-9291-b8599f1d613a'),66));
insert into test1 PARTITION(p2) values(bin_to_uuid(uuid_to_bin('da01b7f7-3fd2-11ed-9291-b8599f1d613a'),32),bin_to_uuid(uuid_to_bin('da410d10-3fd2-11ed-9291-b8599f1d613a'),66));
drop table test1;
create table test1(c1 BLOB,c2 BLOB)partition  by key(c1)(PARTITION p1,PARTITION p2);
#function-9     分区表=====>range
drop table test1;
create table test1(c1 bigint(50),c2 bigint(50))partition  by range(c1)(
PARTITION p1 values less than(bin_to_uuid(uuid_to_bin('da01b7f7-3fd2-11ed-9291-b8599f1d613a'),27)),
PARTITION p2 values less than(bin_to_uuid(uuid_to_bin('da01b7f7-3fd2-11ed-9291-b8599f1d613a'),127)));
create table test1(c1 bigint(50),c2 bigint(50))partition  by range(c1)(
PARTITION p1 values less than(27),
PARTITION p2 values less than(127));
insert into test1 PARTITION(p1) values(bin_to_uuid(uuid_to_bin('da01b7f7-3fd2-11ed-9291-b8599f1d613a')),bin_to_uuid(uuid_to_bin('da410d10-3fd2-11ed-9291-b8599f1d613a')));
insert into test1 PARTITION(p1) values(bin_to_uuid(uuid_to_bin('da01b7f7-3fd2-11ed-9291-b8599f1d613a'),32),bin_to_uuid(uuid_to_bin('da410d10-3fd2-11ed-9291-b8599f1d613a'),66));
insert into test1 PARTITION(p2) values(bin_to_uuid(uuid_to_bin('da01b7f7-3fd2-11ed-9291-b8599f1d613a'),32),bin_to_uuid(uuid_to_bin('da410d10-3fd2-11ed-9291-b8599f1d613a'),66));
drop table test1;
create table test1(c1 BLOB,c2 BLOB)partition  by range(c1)(
PARTITION p1 values less than(27),
PARTITION p2 values less than(127));
#function-9     分区表=====>list
drop table test1;
create table test1(c1 bigint(50),c2 bigint(50))partition  by list(c1)(
PARTITION p1 values in(bin_to_uuid(uuid_to_bin('da01b7f7-3fd2-11ed-9291-b8599f1d613a'),27)),
PARTITION p2 values in(bin_to_uuid(uuid_to_bin('da01b7f7-3fd2-11ed-9291-b8599f1d613a'),127)));
create table test1(c1 bigint(50),c2 bigint(50))partition  by list(c1)(
PARTITION p1 values in(27),
PARTITION p2 values in(127));
insert into test1 PARTITION(p1) values(bin_to_uuid(uuid_to_bin('da01b7f7-3fd2-11ed-9291-b8599f1d613a')),bin_to_uuid(uuid_to_bin('da410d10-3fd2-11ed-9291-b8599f1d613a')));
insert into test1 PARTITION(p1) values(bin_to_uuid(uuid_to_bin('da01b7f7-3fd2-11ed-9291-b8599f1d613a'),32),bin_to_uuid(uuid_to_bin('da410d10-3fd2-11ed-9291-b8599f1d613a'),66));
insert into test1 PARTITION(p2) values(bin_to_uuid(uuid_to_bin('da01b7f7-3fd2-11ed-9291-b8599f1d613a'),32),bin_to_uuid(uuid_to_bin('da410d10-3fd2-11ed-9291-b8599f1d613a'),66));
drop table test1;
create table test1(c1 BLOB,c2 BLOB)partition  by list(c1)(
PARTITION p1 values (27),
PARTITION p2 values (127));
#function-10     pl/sql
#function-10-1     存储过程=====>while循环
drop table test1;
create table test1(c1 int ,c2 char(60));
drop procedure procedure_1;
create procedure procedure_1()
begin
declare i int default -10;
while i<20
do
insert into test1 values(i,bin_to_uuid(uuid_to_bin('da01b7f7-3fd2-11ed-9291-b8599f1d613a')));
set i=i+1;
end while;
commit;
end;
/
call procedure_1();
select * from test1 order by c1 asc;
c1	c2
-10	da01b7f7-3fd2-11ed-9291-b8599f1d613a
-9	da01b7f7-3fd2-11ed-9291-b8599f1d613a
-8	da01b7f7-3fd2-11ed-9291-b8599f1d613a
-7	da01b7f7-3fd2-11ed-9291-b8599f1d613a
-6	da01b7f7-3fd2-11ed-9291-b8599f1d613a
-5	da01b7f7-3fd2-11ed-9291-b8599f1d613a
-4	da01b7f7-3fd2-11ed-9291-b8599f1d613a
-3	da01b7f7-3fd2-11ed-9291-b8599f1d613a
-2	da01b7f7-3fd2-11ed-9291-b8599f1d613a
-1	da01b7f7-3fd2-11ed-9291-b8599f1d613a
0	da01b7f7-3fd2-11ed-9291-b8599f1d613a
1	da01b7f7-3fd2-11ed-9291-b8599f1d613a
2	da01b7f7-3fd2-11ed-9291-b8599f1d613a
3	da01b7f7-3fd2-11ed-9291-b8599f1d613a
4	da01b7f7-3fd2-11ed-9291-b8599f1d613a
5	da01b7f7-3fd2-11ed-9291-b8599f1d613a
6	da01b7f7-3fd2-11ed-9291-b8599f1d613a
7	da01b7f7-3fd2-11ed-9291-b8599f1d613a
8	da01b7f7-3fd2-11ed-9291-b8599f1d613a
9	da01b7f7-3fd2-11ed-9291-b8599f1d613a
10	da01b7f7-3fd2-11ed-9291-b8599f1d613a
11	da01b7f7-3fd2-11ed-9291-b8599f1d613a
12	da01b7f7-3fd2-11ed-9291-b8599f1d613a
13	da01b7f7-3fd2-11ed-9291-b8599f1d613a
14	da01b7f7-3fd2-11ed-9291-b8599f1d613a
15	da01b7f7-3fd2-11ed-9291-b8599f1d613a
16	da01b7f7-3fd2-11ed-9291-b8599f1d613a
17	da01b7f7-3fd2-11ed-9291-b8599f1d613a
18	da01b7f7-3fd2-11ed-9291-b8599f1d613a
19	da01b7f7-3fd2-11ed-9291-b8599f1d613a
drop PROCEDURE procedure_1;
drop table test1;
create table test1(c1 int ,c2 char(100));
create procedure procedure_1()
begin
declare i int default -10;
while i<20
do
insert into test1 values(i,bin_to_uuid(uuid_to_bin('da01b7f7-3fd2-11ed-9291-b8599f1d613a'),30));
set i=i+1;
end while;
commit;
end;
/
call procedure_1();
select * from test1 order by c1 asc;
c1	c2
-10	3fd211ed-b7f7-da01-9291-b8599f1d613a
-9	3fd211ed-b7f7-da01-9291-b8599f1d613a
-8	3fd211ed-b7f7-da01-9291-b8599f1d613a
-7	3fd211ed-b7f7-da01-9291-b8599f1d613a
-6	3fd211ed-b7f7-da01-9291-b8599f1d613a
-5	3fd211ed-b7f7-da01-9291-b8599f1d613a
-4	3fd211ed-b7f7-da01-9291-b8599f1d613a
-3	3fd211ed-b7f7-da01-9291-b8599f1d613a
-2	3fd211ed-b7f7-da01-9291-b8599f1d613a
-1	3fd211ed-b7f7-da01-9291-b8599f1d613a
0	3fd211ed-b7f7-da01-9291-b8599f1d613a
1	3fd211ed-b7f7-da01-9291-b8599f1d613a
2	3fd211ed-b7f7-da01-9291-b8599f1d613a
3	3fd211ed-b7f7-da01-9291-b8599f1d613a
4	3fd211ed-b7f7-da01-9291-b8599f1d613a
5	3fd211ed-b7f7-da01-9291-b8599f1d613a
6	3fd211ed-b7f7-da01-9291-b8599f1d613a
7	3fd211ed-b7f7-da01-9291-b8599f1d613a
8	3fd211ed-b7f7-da01-9291-b8599f1d613a
9	3fd211ed-b7f7-da01-9291-b8599f1d613a
10	3fd211ed-b7f7-da01-9291-b8599f1d613a
11	3fd211ed-b7f7-da01-9291-b8599f1d613a
12	3fd211ed-b7f7-da01-9291-b8599f1d613a
13	3fd211ed-b7f7-da01-9291-b8599f1d613a
14	3fd211ed-b7f7-da01-9291-b8599f1d613a
15	3fd211ed-b7f7-da01-9291-b8599f1d613a
16	3fd211ed-b7f7-da01-9291-b8599f1d613a
17	3fd211ed-b7f7-da01-9291-b8599f1d613a
18	3fd211ed-b7f7-da01-9291-b8599f1d613a
19	3fd211ed-b7f7-da01-9291-b8599f1d613a
drop PROCEDURE procedure_1;
drop table test1;
create table test1(c1 int ,c2 char(100));
create procedure procedure_1()
begin
declare i int default -10;
while i<bin_to_uuid(uuid_to_bin('da01b7f7-3fd2-11ed-9291-b8599f1d613a',54))+20
do
insert into test1 values(i,bin_to_uuid(uuid_to_bin('da01b7f7-3fd2-11ed-9291-b8599f1d613a','23')));
set i=i+1;
end while;
commit;
end;
/
call procedure_1();
Warnings:
Warning	1292	Truncated incorrect DOUBLE value: '11ed3fd2-da01-b7f7-9291-b8599f1d613a'
select * from test1 order by c1 asc;
c1	c2
-10	11ed3fd2-da01-b7f7-9291-b8599f1d613a
-9	11ed3fd2-da01-b7f7-9291-b8599f1d613a
-8	11ed3fd2-da01-b7f7-9291-b8599f1d613a
-7	11ed3fd2-da01-b7f7-9291-b8599f1d613a
-6	11ed3fd2-da01-b7f7-9291-b8599f1d613a
-5	11ed3fd2-da01-b7f7-9291-b8599f1d613a
-4	11ed3fd2-da01-b7f7-9291-b8599f1d613a
-3	11ed3fd2-da01-b7f7-9291-b8599f1d613a
-2	11ed3fd2-da01-b7f7-9291-b8599f1d613a
-1	11ed3fd2-da01-b7f7-9291-b8599f1d613a
0	11ed3fd2-da01-b7f7-9291-b8599f1d613a
1	11ed3fd2-da01-b7f7-9291-b8599f1d613a
2	11ed3fd2-da01-b7f7-9291-b8599f1d613a
3	11ed3fd2-da01-b7f7-9291-b8599f1d613a
4	11ed3fd2-da01-b7f7-9291-b8599f1d613a
5	11ed3fd2-da01-b7f7-9291-b8599f1d613a
6	11ed3fd2-da01-b7f7-9291-b8599f1d613a
7	11ed3fd2-da01-b7f7-9291-b8599f1d613a
8	11ed3fd2-da01-b7f7-9291-b8599f1d613a
9	11ed3fd2-da01-b7f7-9291-b8599f1d613a
10	11ed3fd2-da01-b7f7-9291-b8599f1d613a
11	11ed3fd2-da01-b7f7-9291-b8599f1d613a
12	11ed3fd2-da01-b7f7-9291-b8599f1d613a
13	11ed3fd2-da01-b7f7-9291-b8599f1d613a
14	11ed3fd2-da01-b7f7-9291-b8599f1d613a
15	11ed3fd2-da01-b7f7-9291-b8599f1d613a
16	11ed3fd2-da01-b7f7-9291-b8599f1d613a
17	11ed3fd2-da01-b7f7-9291-b8599f1d613a
18	11ed3fd2-da01-b7f7-9291-b8599f1d613a
19	11ed3fd2-da01-b7f7-9291-b8599f1d613a
20	11ed3fd2-da01-b7f7-9291-b8599f1d613a
21	11ed3fd2-da01-b7f7-9291-b8599f1d613a
22	11ed3fd2-da01-b7f7-9291-b8599f1d613a
23	11ed3fd2-da01-b7f7-9291-b8599f1d613a
24	11ed3fd2-da01-b7f7-9291-b8599f1d613a
25	11ed3fd2-da01-b7f7-9291-b8599f1d613a
26	11ed3fd2-da01-b7f7-9291-b8599f1d613a
27	11ed3fd2-da01-b7f7-9291-b8599f1d613a
28	11ed3fd2-da01-b7f7-9291-b8599f1d613a
29	11ed3fd2-da01-b7f7-9291-b8599f1d613a
30	11ed3fd2-da01-b7f7-9291-b8599f1d613a
drop PROCEDURE procedure_1;
drop table test1;
#function-10-1     存储过程=====>repeat循环
create table test1(id varchar(50));
drop procedure procedure_1;
create procedure procedure_1()
begin
declare i int;
set i =1 ;
repeat
insert into test1 values (bin_to_uuid(uuid_to_bin('7f7ec311-479d-11ed-9c3f-7cd30abc95d8')));
set i = i + 1;
until i > 10 end repeat;
select * from test1;
end;
/
call procedure_1();
id
7f7ec311-479d-11ed-9c3f-7cd30abc95d8
7f7ec311-479d-11ed-9c3f-7cd30abc95d8
7f7ec311-479d-11ed-9c3f-7cd30abc95d8
7f7ec311-479d-11ed-9c3f-7cd30abc95d8
7f7ec311-479d-11ed-9c3f-7cd30abc95d8
7f7ec311-479d-11ed-9c3f-7cd30abc95d8
7f7ec311-479d-11ed-9c3f-7cd30abc95d8
7f7ec311-479d-11ed-9c3f-7cd30abc95d8
7f7ec311-479d-11ed-9c3f-7cd30abc95d8
7f7ec311-479d-11ed-9c3f-7cd30abc95d8
SELECT * from test1 order by id asc;
id
7f7ec311-479d-11ed-9c3f-7cd30abc95d8
7f7ec311-479d-11ed-9c3f-7cd30abc95d8
7f7ec311-479d-11ed-9c3f-7cd30abc95d8
7f7ec311-479d-11ed-9c3f-7cd30abc95d8
7f7ec311-479d-11ed-9c3f-7cd30abc95d8
7f7ec311-479d-11ed-9c3f-7cd30abc95d8
7f7ec311-479d-11ed-9c3f-7cd30abc95d8
7f7ec311-479d-11ed-9c3f-7cd30abc95d8
7f7ec311-479d-11ed-9c3f-7cd30abc95d8
7f7ec311-479d-11ed-9c3f-7cd30abc95d8
drop PROCEDURE procedure_1;
drop table test1;
create table test1(id varchar(50));
create procedure procedure_1()
begin
declare i int;
set i =1 ;
repeat
insert into test1 values (bin_to_uuid(uuid_to_bin('7f7ec311-479d-11ed-9c3f-7cd30abc95d8',null),34));
set i = i + 1;
until i > 10 end repeat;
select * from test1;
end;
/
call procedure_1();
id
479d11ed-c311-7f7e-9c3f-7cd30abc95d8
479d11ed-c311-7f7e-9c3f-7cd30abc95d8
479d11ed-c311-7f7e-9c3f-7cd30abc95d8
479d11ed-c311-7f7e-9c3f-7cd30abc95d8
479d11ed-c311-7f7e-9c3f-7cd30abc95d8
479d11ed-c311-7f7e-9c3f-7cd30abc95d8
479d11ed-c311-7f7e-9c3f-7cd30abc95d8
479d11ed-c311-7f7e-9c3f-7cd30abc95d8
479d11ed-c311-7f7e-9c3f-7cd30abc95d8
479d11ed-c311-7f7e-9c3f-7cd30abc95d8
SELECT * from test1 order by id asc;
id
479d11ed-c311-7f7e-9c3f-7cd30abc95d8
479d11ed-c311-7f7e-9c3f-7cd30abc95d8
479d11ed-c311-7f7e-9c3f-7cd30abc95d8
479d11ed-c311-7f7e-9c3f-7cd30abc95d8
479d11ed-c311-7f7e-9c3f-7cd30abc95d8
479d11ed-c311-7f7e-9c3f-7cd30abc95d8
479d11ed-c311-7f7e-9c3f-7cd30abc95d8
479d11ed-c311-7f7e-9c3f-7cd30abc95d8
479d11ed-c311-7f7e-9c3f-7cd30abc95d8
479d11ed-c311-7f7e-9c3f-7cd30abc95d8
drop PROCEDURE procedure_1;
drop table test1;
#function-10-1     存储过程=====>loop循环
drop table test1;
create table test1(id char(50));
drop procedure procedure_1;
create procedure procedure_1()
begin
declare i int;
set i = 1;
lp : loop
insert into test1 values (bin_to_uuid(uuid_to_bin('1b30d0ff-47a0-11ed-aedd-7cd30abc95d8',99),0.5));
insert into test1 values (bin_to_uuid(uuid_to_bin('1b30d0ff-47a0-11ed-aedd-7cd30abc95d8',null),-2));
insert into test1 values (bin_to_uuid(uuid_to_bin('1b30d0ff-47a0-11ed-aedd-7cd30abc95d8',0.1),99));
insert into test1 values (bin_to_uuid(uuid_to_bin('1b30d0ff-47a0-11ed-aedd-7cd30abc95d8',-0.9),-45));
insert into test1 values (bin_to_uuid(uuid_to_bin('1b30d0ff-47a0-11ed-aedd-7cd30abc95d8',-9),34));
set i = i + 1;
if i > 1001 then
leave lp;
end if;
end loop;
select * from test1 order by id asc;
end;
/
call procedure_1();
id
1b30d0ff-47a0-11ed-aedd-7cd30abc95d8
1b30d0ff-47a0-11ed-aedd-7cd30abc95d8
1b30d0ff-47a0-11ed-aedd-7cd30abc95d8
1b30d0ff-47a0-11ed-aedd-7cd30abc95d8
1b30d0ff-47a0-11ed-aedd-7cd30abc95d8
1b30d0ff-47a0-11ed-aedd-7cd30abc95d8
1b30d0ff-47a0-11ed-aedd-7cd30abc95d8
1b30d0ff-47a0-11ed-aedd-7cd30abc95d8
1b30d0ff-47a0-11ed-aedd-7cd30abc95d8
1b30d0ff-47a0-11ed-aedd-7cd30abc95d8
1b30d0ff-47a0-11ed-aedd-7cd30abc95d8
1b30d0ff-47a0-11ed-aedd-7cd30abc95d8
1b30d0ff-47a0-11ed-aedd-7cd30abc95d8
1b30d0ff-47a0-11ed-aedd-7cd30abc95d8
1b30d0ff-47a0-11ed-aedd-7cd30abc95d8
1b30d0ff-47a0-11ed-aedd-7cd30abc95d8
1b30d0ff-47a0-11ed-aedd-7cd30abc95d8
1b30d0ff-47a0-11ed-aedd-7cd30abc95d8
1b30d0ff-47a0-11ed-aedd-7cd30abc95d8
1b30d0ff-47a0-11ed-aedd-7cd30abc95d8
1b30d0ff-47a0-11ed-aedd-7cd30abc95d8
1b30d0ff-47a0-11ed-aedd-7cd30abc95d8
1b30d0ff-47a0-11ed-aedd-7cd30abc95d8
1b30d0ff-47a0-11ed-aedd-7cd30abc95d8
1b30d0ff-47a0-11ed-aedd-7cd30abc95d8
1b30d0ff-47a0-11ed-aedd-7cd30abc95d8
1b30d0ff-47a0-11ed-aedd-7cd30abc95d8
1b30d0ff-47a0-11ed-aedd-7cd30abc95d8
1b30d0ff-47a0-11ed-aedd-7cd30abc95d8
1b30d0ff-47a0-11ed-aedd-7cd30abc95d8
1b30d0ff-47a0-11ed-aedd-7cd30abc95d8
1b30d0ff-47a0-11ed-aedd-7cd30abc95d8
1b30d0ff-47a0-11ed-aedd-7cd30abc95d8
1b30d0ff-47a0-11ed-aedd-7cd30abc95d8
1b30d0ff-47a0-11ed-aedd-7cd30abc95d8
1b30d0ff-47a0-11ed-aedd-7cd30abc95d8
1b30d0ff-47a0-11ed-aedd-7cd30abc95d8
1b30d0ff-47a0-11ed-aedd-7cd30abc95d8
1b30d0ff-47a0-11ed-aedd-7cd30abc95d8
1b30d0ff-47a0-11ed-aedd-7cd30abc95d8
1b30d0ff-47a0-11ed-aedd-7cd30abc95d8
1b30d0ff-47a0-11ed-aedd-7cd30abc95d8
1b30d0ff-47a0-11ed-aedd-7cd30abc95d8
1b30d0ff-47a0-11ed-aedd-7cd30abc95d8
1b30d0ff-47a0-11ed-aedd-7cd30abc95d8
1b30d0ff-47a0-11ed-aedd-7cd30abc95d8
1b30d0ff-47a0-11ed-aedd-7cd30abc95d8
1b30d0ff-47a0-11ed-aedd-7cd30abc95d8
1b30d0ff-47a0-11ed-aedd-7cd30abc95d8
1b30d0ff-47a0-11ed-aedd-7cd30abc95d8
1b30d0ff-47a0-11ed-aedd-7cd30abc95d8
1b30d0ff-47a0-11ed-aedd-7cd30abc95d8
1b30d0ff-47a0-11ed-aedd-7cd30abc95d8
1b30d0ff-47a0-11ed-aedd-7cd30abc95d8
1b30d0ff-47a0-11ed-aedd-7cd30abc95d8
1b30d0ff-47a0-11ed-aedd-7cd30abc95d8
1b30d0ff-47a0-11ed-aedd-7cd30abc95d8
1b30d0ff-47a0-11ed-aedd-7cd30abc95d8
1b30d0ff-47a0-11ed-aedd-7cd30abc95d8
1b30d0ff-47a0-11ed-aedd-7cd30abc95d8
1b30d0ff-47a0-11ed-aedd-7cd30abc95d8
1b30d0ff-47a0-11ed-aedd-7cd30abc95d8
1b30d0ff-47a0-11ed-aedd-7cd30abc95d8
1b30d0ff-47a0-11ed-aedd-7cd30abc95d8
1b30d0ff-47a0-11ed-aedd-7cd30abc95d8
1b30d0ff-47a0-11ed-aedd-7cd30abc95d8
1b30d0ff-47a0-11ed-aedd-7cd30abc95d8
1b30d0ff-47a0-11ed-aedd-7cd30abc95d8
1b30d0ff-47a0-11ed-aedd-7cd30abc95d8
1b30d0ff-47a0-11ed-aedd-7cd30abc95d8
1b30d0ff-47a0-11ed-aedd-7cd30abc95d8
1b30d0ff-47a0-11ed-aedd-7cd30abc95d8
1b30d0ff-47a0-11ed-aedd-7cd30abc95d8
1b30d0ff-47a0-11ed-aedd-7cd30abc95d8
1b30d0ff-47a0-11ed-aedd-7cd30abc95d8
1b30d0ff-47a0-11ed-aedd-7cd30abc95d8
1b30d0ff-47a0-11ed-aedd-7cd30abc95d8
1b30d0ff-47a0-11ed-aedd-7cd30abc95d8
1b30d0ff-47a0-11ed-aedd-7cd30abc95d8
1b30d0ff-47a0-11ed-aedd-7cd30abc95d8
1b30d0ff-47a0-11ed-aedd-7cd30abc95d8
1b30d0ff-47a0-11ed-aedd-7cd30abc95d8
1b30d0ff-47a0-11ed-aedd-7cd30abc95d8
1b30d0ff-47a0-11ed-aedd-7cd30abc95d8
1b30d0ff-47a0-11ed-aedd-7cd30abc95d8
1b30d0ff-47a0-11ed-aedd-7cd30abc95d8
1b30d0ff-47a0-11ed-aedd-7cd30abc95d8
1b30d0ff-47a0-11ed-aedd-7cd30abc95d8
1b30d0ff-47a0-11ed-aedd-7cd30abc95d8
1b30d0ff-47a0-11ed-aedd-7cd30abc95d8
1b30d0ff-47a0-11ed-aedd-7cd30abc95d8
1b30d0ff-47a0-11ed-aedd-7cd30abc95d8
1b30d0ff-47a0-11ed-aedd-7cd30abc95d8
1b30d0ff-47a0-11ed-aedd-7cd30abc95d8
1b30d0ff-47a0-11ed-aedd-7cd30abc95d8
1b30d0ff-47a0-11ed-aedd-7cd30abc95d8
1b30d0ff-47a0-11ed-aedd-7cd30abc95d8
1b30d0ff-47a0-11ed-aedd-7cd30abc95d8
1b30d0ff-47a0-11ed-aedd-7cd30abc95d8
1b30d0ff-47a0-11ed-aedd-7cd30abc95d8
1b30d0ff-47a0-11ed-aedd-7cd30abc95d8
1b30d0ff-47a0-11ed-aedd-7cd30abc95d8
1b30d0ff-47a0-11ed-aedd-7cd30abc95d8
1b30d0ff-47a0-11ed-aedd-7cd30abc95d8
1b30d0ff-47a0-11ed-aedd-7cd30abc95d8
1b30d0ff-47a0-11ed-aedd-7cd30abc95d8
1b30d0ff-47a0-11ed-aedd-7cd30abc95d8
1b30d0ff-47a0-11ed-aedd-7cd30abc95d8
1b30d0ff-47a0-11ed-aedd-7cd30abc95d8
1b30d0ff-47a0-11ed-aedd-7cd30abc95d8
1b30d0ff-47a0-11ed-aedd-7cd30abc95d8
1b30d0ff-47a0-11ed-aedd-7cd30abc95d8
1b30d0ff-47a0-11ed-aedd-7cd30abc95d8
1b30d0ff-47a0-11ed-aedd-7cd30abc95d8
1b30d0ff-47a0-11ed-aedd-7cd30abc95d8
1b30d0ff-47a0-11ed-aedd-7cd30abc95d8
1b30d0ff-47a0-11ed-aedd-7cd30abc95d8
1b30d0ff-47a0-11ed-aedd-7cd30abc95d8
1b30d0ff-47a0-11ed-aedd-7cd30abc95d8
1b30d0ff-47a0-11ed-aedd-7cd30abc95d8
1b30d0ff-47a0-11ed-aedd-7cd30abc95d8
1b30d0ff-47a0-11ed-aedd-7cd30abc95d8
1b30d0ff-47a0-11ed-aedd-7cd30abc95d8
1b30d0ff-47a0-11ed-aedd-7cd30abc95d8
1b30d0ff-47a0-11ed-aedd-7cd30abc95d8
1b30d0ff-47a0-11ed-aedd-7cd30abc95d8
1b30d0ff-47a0-11ed-aedd-7cd30abc95d8
1b30d0ff-47a0-11ed-aedd-7cd30abc95d8
1b30d0ff-47a0-11ed-aedd-7cd30abc95d8
1b30d0ff-47a0-11ed-aedd-7cd30abc95d8
1b30d0ff-47a0-11ed-aedd-7cd30abc95d8
1b30d0ff-47a0-11ed-aedd-7cd30abc95d8
1b30d0ff-47a0-11ed-aedd-7cd30abc95d8
1b30d0ff-47a0-11ed-aedd-7cd30abc95d8
1b30d0ff-47a0-11ed-aedd-7cd30abc95d8
1b30d0ff-47a0-11ed-aedd-7cd30abc95d8
1b30d0ff-47a0-11ed-aedd-7cd30abc95d8
1b30d0ff-47a0-11ed-aedd-7cd30abc95d8
1b30d0ff-47a0-11ed-aedd-7cd30abc95d8
1b30d0ff-47a0-11ed-aedd-7cd30abc95d8
1b30d0ff-47a0-11ed-aedd-7cd30abc95d8
1b30d0ff-47a0-11ed-aedd-7cd30abc95d8
1b30d0ff-47a0-11ed-aedd-7cd30abc95d8
1b30d0ff-47a0-11ed-aedd-7cd30abc95d8
1b30d0ff-47a0-11ed-aedd-7cd30abc95d8
1b30d0ff-47a0-11ed-aedd-7cd30abc95d8
1b30d0ff-47a0-11ed-aedd-7cd30abc95d8
1b30d0ff-47a0-11ed-aedd-7cd30abc95d8
1b30d0ff-47a0-11ed-aedd-7cd30abc95d8
1b30d0ff-47a0-11ed-aedd-7cd30abc95d8
1b30d0ff-47a0-11ed-aedd-7cd30abc95d8
1b30d0ff-47a0-11ed-aedd-7cd30abc95d8
1b30d0ff-47a0-11ed-aedd-7cd30abc95d8
1b30d0ff-47a0-11ed-aedd-7cd30abc95d8
1b30d0ff-47a0-11ed-aedd-7cd30abc95d8
1b30d0ff-47a0-11ed-aedd-7cd30abc95d8
1b30d0ff-47a0-11ed-aedd-7cd30abc95d8
1b30d0ff-47a0-11ed-aedd-7cd30abc95d8
1b30d0ff-47a0-11ed-aedd-7cd30abc95d8
1b30d0ff-47a0-11ed-aedd-7cd30abc95d8
1b30d0ff-47a0-11ed-aedd-7cd30abc95d8
1b30d0ff-47a0-11ed-aedd-7cd30abc95d8
1b30d0ff-47a0-11ed-aedd-7cd30abc95d8
1b30d0ff-47a0-11ed-aedd-7cd30abc95d8
1b30d0ff-47a0-11ed-aedd-7cd30abc95d8
1b30d0ff-47a0-11ed-aedd-7cd30abc95d8
1b30d0ff-47a0-11ed-aedd-7cd30abc95d8
1b30d0ff-47a0-11ed-aedd-7cd30abc95d8
1b30d0ff-47a0-11ed-aedd-7cd30abc95d8
1b30d0ff-47a0-11ed-aedd-7cd30abc95d8
1b30d0ff-47a0-11ed-aedd-7cd30abc95d8
1b30d0ff-47a0-11ed-aedd-7cd30abc95d8
1b30d0ff-47a0-11ed-aedd-7cd30abc95d8
1b30d0ff-47a0-11ed-aedd-7cd30abc95d8
1b30d0ff-47a0-11ed-aedd-7cd30abc95d8
1b30d0ff-47a0-11ed-aedd-7cd30abc95d8
1b30d0ff-47a0-11ed-aedd-7cd30abc95d8
1b30d0ff-47a0-11ed-aedd-7cd30abc95d8
1b30d0ff-47a0-11ed-aedd-7cd30abc95d8
1b30d0ff-47a0-11ed-aedd-7cd30abc95d8
1b30d0ff-47a0-11ed-aedd-7cd30abc95d8
1b30d0ff-47a0-11ed-aedd-7cd30abc95d8
1b30d0ff-47a0-11ed-aedd-7cd30abc95d8
1b30d0ff-47a0-11ed-aedd-7cd30abc95d8
1b30d0ff-47a0-11ed-aedd-7cd30abc95d8
1b30d0ff-47a0-11ed-aedd-7cd30abc95d8
1b30d0ff-47a0-11ed-aedd-7cd30abc95d8
1b30d0ff-47a0-11ed-aedd-7cd30abc95d8
1b30d0ff-47a0-11ed-aedd-7cd30abc95d8
1b30d0ff-47a0-11ed-aedd-7cd30abc95d8
1b30d0ff-47a0-11ed-aedd-7cd30abc95d8
1b30d0ff-47a0-11ed-aedd-7cd30abc95d8
1b30d0ff-47a0-11ed-aedd-7cd30abc95d8
1b30d0ff-47a0-11ed-aedd-7cd30abc95d8
1b30d0ff-47a0-11ed-aedd-7cd30abc95d8
1b30d0ff-47a0-11ed-aedd-7cd30abc95d8
1b30d0ff-47a0-11ed-aedd-7cd30abc95d8
1b30d0ff-47a0-11ed-aedd-7cd30abc95d8
1b30d0ff-47a0-11ed-aedd-7cd30abc95d8
1b30d0ff-47a0-11ed-aedd-7cd30abc95d8
1b30d0ff-47a0-11ed-aedd-7cd30abc95d8
1b30d0ff-47a0-11ed-aedd-7cd30abc95d8
1b30d0ff-47a0-11ed-aedd-7cd30abc95d8
1b30d0ff-47a0-11ed-aedd-7cd30abc95d8
1b30d0ff-47a0-11ed-aedd-7cd30abc95d8
1b30d0ff-47a0-11ed-aedd-7cd30abc95d8
1b30d0ff-47a0-11ed-aedd-7cd30abc95d8
1b30d0ff-47a0-11ed-aedd-7cd30abc95d8
1b30d0ff-47a0-11ed-aedd-7cd30abc95d8
1b30d0ff-47a0-11ed-aedd-7cd30abc95d8
1b30d0ff-47a0-11ed-aedd-7cd30abc95d8
1b30d0ff-47a0-11ed-aedd-7cd30abc95d8
1b30d0ff-47a0-11ed-aedd-7cd30abc95d8
1b30d0ff-47a0-11ed-aedd-7cd30abc95d8
1b30d0ff-47a0-11ed-aedd-7cd30abc95d8
1b30d0ff-47a0-11ed-aedd-7cd30abc95d8
1b30d0ff-47a0-11ed-aedd-7cd30abc95d8
1b30d0ff-47a0-11ed-aedd-7cd30abc95d8
1b30d0ff-47a0-11ed-aedd-7cd30abc95d8
1b30d0ff-47a0-11ed-aedd-7cd30abc95d8
1b30d0ff-47a0-11ed-aedd-7cd30abc95d8
1b30d0ff-47a0-11ed-aedd-7cd30abc95d8
1b30d0ff-47a0-11ed-aedd-7cd30abc95d8
1b30d0ff-47a0-11ed-aedd-7cd30abc95d8
1b30d0ff-47a0-11ed-aedd-7cd30abc95d8
1b30d0ff-47a0-11ed-aedd-7cd30abc95d8
1b30d0ff-47a0-11ed-aedd-7cd30abc95d8
1b30d0ff-47a0-11ed-aedd-7cd30abc95d8
1b30d0ff-47a0-11ed-aedd-7cd30abc95d8
1b30d0ff-47a0-11ed-aedd-7cd30abc95d8
1b30d0ff-47a0-11ed-aedd-7cd30abc95d8
1b30d0ff-47a0-11ed-aedd-7cd30abc95d8
1b30d0ff-47a0-11ed-aedd-7cd30abc95d8
1b30d0ff-47a0-11ed-aedd-7cd30abc95d8
1b30d0ff-47a0-11ed-aedd-7cd30abc95d8
1b30d0ff-47a0-11ed-aedd-7cd30abc95d8
1b30d0ff-47a0-11ed-aedd-7cd30abc95d8
1b30d0ff-47a0-11ed-aedd-7cd30abc95d8
1b30d0ff-47a0-11ed-aedd-7cd30abc95d8
1b30d0ff-47a0-11ed-aedd-7cd30abc95d8
1b30d0ff-47a0-11ed-aedd-7cd30abc95d8
1b30d0ff-47a0-11ed-aedd-7cd30abc95d8
1b30d0ff-47a0-11ed-aedd-7cd30abc95d8
1b30d0ff-47a0-11ed-aedd-7cd30abc95d8
1b30d0ff-47a0-11ed-aedd-7cd30abc95d8
1b30d0ff-47a0-11ed-aedd-7cd30abc95d8
1b30d0ff-47a0-11ed-aedd-7cd30abc95d8
1b30d0ff-47a0-11ed-aedd-7cd30abc95d8
1b30d0ff-47a0-11ed-aedd-7cd30abc95d8
1b30d0ff-47a0-11ed-aedd-7cd30abc95d8
1b30d0ff-47a0-11ed-aedd-7cd30abc95d8
1b30d0ff-47a0-11ed-aedd-7cd30abc95d8
1b30d0ff-47a0-11ed-aedd-7cd30abc95d8
1b30d0ff-47a0-11ed-aedd-7cd30abc95d8
1b30d0ff-47a0-11ed-aedd-7cd30abc95d8
1b30d0ff-47a0-11ed-aedd-7cd30abc95d8
1b30d0ff-47a0-11ed-aedd-7cd30abc95d8
1b30d0ff-47a0-11ed-aedd-7cd30abc95d8
1b30d0ff-47a0-11ed-aedd-7cd30abc95d8
1b30d0ff-47a0-11ed-aedd-7cd30abc95d8
1b30d0ff-47a0-11ed-aedd-7cd30abc95d8
1b30d0ff-47a0-11ed-aedd-7cd30abc95d8
1b30d0ff-47a0-11ed-aedd-7cd30abc95d8
1b30d0ff-47a0-11ed-aedd-7cd30abc95d8
1b30d0ff-47a0-11ed-aedd-7cd30abc95d8
1b30d0ff-47a0-11ed-aedd-7cd30abc95d8
1b30d0ff-47a0-11ed-aedd-7cd30abc95d8
1b30d0ff-47a0-11ed-aedd-7cd30abc95d8
1b30d0ff-47a0-11ed-aedd-7cd30abc95d8
1b30d0ff-47a0-11ed-aedd-7cd30abc95d8
1b30d0ff-47a0-11ed-aedd-7cd30abc95d8
1b30d0ff-47a0-11ed-aedd-7cd30abc95d8
1b30d0ff-47a0-11ed-aedd-7cd30abc95d8
1b30d0ff-47a0-11ed-aedd-7cd30abc95d8
1b30d0ff-47a0-11ed-aedd-7cd30abc95d8
1b30d0ff-47a0-11ed-aedd-7cd30abc95d8
1b30d0ff-47a0-11ed-aedd-7cd30abc95d8
1b30d0ff-47a0-11ed-aedd-7cd30abc95d8
1b30d0ff-47a0-11ed-aedd-7cd30abc95d8
1b30d0ff-47a0-11ed-aedd-7cd30abc95d8
1b30d0ff-47a0-11ed-aedd-7cd30abc95d8
1b30d0ff-47a0-11ed-aedd-7cd30abc95d8
1b30d0ff-47a0-11ed-aedd-7cd30abc95d8
1b30d0ff-47a0-11ed-aedd-7cd30abc95d8
1b30d0ff-47a0-11ed-aedd-7cd30abc95d8
1b30d0ff-47a0-11ed-aedd-7cd30abc95d8
1b30d0ff-47a0-11ed-aedd-7cd30abc95d8
1b30d0ff-47a0-11ed-aedd-7cd30abc95d8
1b30d0ff-47a0-11ed-aedd-7cd30abc95d8
1b30d0ff-47a0-11ed-aedd-7cd30abc95d8
1b30d0ff-47a0-11ed-aedd-7cd30abc95d8
1b30d0ff-47a0-11ed-aedd-7cd30abc95d8
1b30d0ff-47a0-11ed-aedd-7cd30abc95d8
1b30d0ff-47a0-11ed-aedd-7cd30abc95d8
1b30d0ff-47a0-11ed-aedd-7cd30abc95d8
1b30d0ff-47a0-11ed-aedd-7cd30abc95d8
1b30d0ff-47a0-11ed-aedd-7cd30abc95d8
1b30d0ff-47a0-11ed-aedd-7cd30abc95d8
1b30d0ff-47a0-11ed-aedd-7cd30abc95d8
1b30d0ff-47a0-11ed-aedd-7cd30abc95d8
1b30d0ff-47a0-11ed-aedd-7cd30abc95d8
1b30d0ff-47a0-11ed-aedd-7cd30abc95d8
1b30d0ff-47a0-11ed-aedd-7cd30abc95d8
1b30d0ff-47a0-11ed-aedd-7cd30abc95d8
1b30d0ff-47a0-11ed-aedd-7cd30abc95d8
1b30d0ff-47a0-11ed-aedd-7cd30abc95d8
1b30d0ff-47a0-11ed-aedd-7cd30abc95d8
1b30d0ff-47a0-11ed-aedd-7cd30abc95d8
1b30d0ff-47a0-11ed-aedd-7cd30abc95d8
1b30d0ff-47a0-11ed-aedd-7cd30abc95d8
1b30d0ff-47a0-11ed-aedd-7cd30abc95d8
1b30d0ff-47a0-11ed-aedd-7cd30abc95d8
1b30d0ff-47a0-11ed-aedd-7cd30abc95d8
1b30d0ff-47a0-11ed-aedd-7cd30abc95d8
1b30d0ff-47a0-11ed-aedd-7cd30abc95d8
1b30d0ff-47a0-11ed-aedd-7cd30abc95d8
1b30d0ff-47a0-11ed-aedd-7cd30abc95d8
1b30d0ff-47a0-11ed-aedd-7cd30abc95d8
1b30d0ff-47a0-11ed-aedd-7cd30abc95d8
1b30d0ff-47a0-11ed-aedd-7cd30abc95d8
1b30d0ff-47a0-11ed-aedd-7cd30abc95d8
1b30d0ff-47a0-11ed-aedd-7cd30abc95d8
1b30d0ff-47a0-11ed-aedd-7cd30abc95d8
1b30d0ff-47a0-11ed-aedd-7cd30abc95d8
1b30d0ff-47a0-11ed-aedd-7cd30abc95d8
1b30d0ff-47a0-11ed-aedd-7cd30abc95d8
1b30d0ff-47a0-11ed-aedd-7cd30abc95d8
1b30d0ff-47a0-11ed-aedd-7cd30abc95d8
1b30d0ff-47a0-11ed-aedd-7cd30abc95d8
1b30d0ff-47a0-11ed-aedd-7cd30abc95d8
1b30d0ff-47a0-11ed-aedd-7cd30abc95d8
1b30d0ff-47a0-11ed-aedd-7cd30abc95d8
1b30d0ff-47a0-11ed-aedd-7cd30abc95d8
1b30d0ff-47a0-11ed-aedd-7cd30abc95d8
1b30d0ff-47a0-11ed-aedd-7cd30abc95d8
1b30d0ff-47a0-11ed-aedd-7cd30abc95d8
1b30d0ff-47a0-11ed-aedd-7cd30abc95d8
1b30d0ff-47a0-11ed-aedd-7cd30abc95d8
1b30d0ff-47a0-11ed-aedd-7cd30abc95d8
1b30d0ff-47a0-11ed-aedd-7cd30abc95d8
1b30d0ff-47a0-11ed-aedd-7cd30abc95d8
1b30d0ff-47a0-11ed-aedd-7cd30abc95d8
1b30d0ff-47a0-11ed-aedd-7cd30abc95d8
1b30d0ff-47a0-11ed-aedd-7cd30abc95d8
1b30d0ff-47a0-11ed-aedd-7cd30abc95d8
1b30d0ff-47a0-11ed-aedd-7cd30abc95d8
1b30d0ff-47a0-11ed-aedd-7cd30abc95d8
1b30d0ff-47a0-11ed-aedd-7cd30abc95d8
1b30d0ff-47a0-11ed-aedd-7cd30abc95d8
1b30d0ff-47a0-11ed-aedd-7cd30abc95d8
1b30d0ff-47a0-11ed-aedd-7cd30abc95d8
1b30d0ff-47a0-11ed-aedd-7cd30abc95d8
1b30d0ff-47a0-11ed-aedd-7cd30abc95d8
1b30d0ff-47a0-11ed-aedd-7cd30abc95d8
1b30d0ff-47a0-11ed-aedd-7cd30abc95d8
1b30d0ff-47a0-11ed-aedd-7cd30abc95d8
1b30d0ff-47a0-11ed-aedd-7cd30abc95d8
1b30d0ff-47a0-11ed-aedd-7cd30abc95d8
1b30d0ff-47a0-11ed-aedd-7cd30abc95d8
1b30d0ff-47a0-11ed-aedd-7cd30abc95d8
1b30d0ff-47a0-11ed-aedd-7cd30abc95d8
1b30d0ff-47a0-11ed-aedd-7cd30abc95d8
1b30d0ff-47a0-11ed-aedd-7cd30abc95d8
1b30d0ff-47a0-11ed-aedd-7cd30abc95d8
1b30d0ff-47a0-11ed-aedd-7cd30abc95d8
1b30d0ff-47a0-11ed-aedd-7cd30abc95d8
1b30d0ff-47a0-11ed-aedd-7cd30abc95d8
1b30d0ff-47a0-11ed-aedd-7cd30abc95d8
1b30d0ff-47a0-11ed-aedd-7cd30abc95d8
1b30d0ff-47a0-11ed-aedd-7cd30abc95d8
1b30d0ff-47a0-11ed-aedd-7cd30abc95d8
1b30d0ff-47a0-11ed-aedd-7cd30abc95d8
1b30d0ff-47a0-11ed-aedd-7cd30abc95d8
1b30d0ff-47a0-11ed-aedd-7cd30abc95d8
1b30d0ff-47a0-11ed-aedd-7cd30abc95d8
1b30d0ff-47a0-11ed-aedd-7cd30abc95d8
1b30d0ff-47a0-11ed-aedd-7cd30abc95d8
1b30d0ff-47a0-11ed-aedd-7cd30abc95d8
1b30d0ff-47a0-11ed-aedd-7cd30abc95d8
1b30d0ff-47a0-11ed-aedd-7cd30abc95d8
1b30d0ff-47a0-11ed-aedd-7cd30abc95d8
1b30d0ff-47a0-11ed-aedd-7cd30abc95d8
1b30d0ff-47a0-11ed-aedd-7cd30abc95d8
1b30d0ff-47a0-11ed-aedd-7cd30abc95d8
1b30d0ff-47a0-11ed-aedd-7cd30abc95d8
1b30d0ff-47a0-11ed-aedd-7cd30abc95d8
1b30d0ff-47a0-11ed-aedd-7cd30abc95d8
1b30d0ff-47a0-11ed-aedd-7cd30abc95d8
1b30d0ff-47a0-11ed-aedd-7cd30abc95d8
1b30d0ff-47a0-11ed-aedd-7cd30abc95d8
1b30d0ff-47a0-11ed-aedd-7cd30abc95d8
1b30d0ff-47a0-11ed-aedd-7cd30abc95d8
1b30d0ff-47a0-11ed-aedd-7cd30abc95d8
1b30d0ff-47a0-11ed-aedd-7cd30abc95d8
1b30d0ff-47a0-11ed-aedd-7cd30abc95d8
1b30d0ff-47a0-11ed-aedd-7cd30abc95d8
1b30d0ff-47a0-11ed-aedd-7cd30abc95d8
1b30d0ff-47a0-11ed-aedd-7cd30abc95d8
1b30d0ff-47a0-11ed-aedd-7cd30abc95d8
1b30d0ff-47a0-11ed-aedd-7cd30abc95d8
1b30d0ff-47a0-11ed-aedd-7cd30abc95d8
1b30d0ff-47a0-11ed-aedd-7cd30abc95d8
1b30d0ff-47a0-11ed-aedd-7cd30abc95d8
1b30d0ff-47a0-11ed-aedd-7cd30abc95d8
1b30d0ff-47a0-11ed-aedd-7cd30abc95d8
1b30d0ff-47a0-11ed-aedd-7cd30abc95d8
1b30d0ff-47a0-11ed-aedd-7cd30abc95d8
1b30d0ff-47a0-11ed-aedd-7cd30abc95d8
1b30d0ff-47a0-11ed-aedd-7cd30abc95d8
1b30d0ff-47a0-11ed-aedd-7cd30abc95d8
1b30d0ff-47a0-11ed-aedd-7cd30abc95d8
1b30d0ff-47a0-11ed-aedd-7cd30abc95d8
1b30d0ff-47a0-11ed-aedd-7cd30abc95d8
1b30d0ff-47a0-11ed-aedd-7cd30abc95d8
1b30d0ff-47a0-11ed-aedd-7cd30abc95d8
1b30d0ff-47a0-11ed-aedd-7cd30abc95d8
1b30d0ff-47a0-11ed-aedd-7cd30abc95d8
1b30d0ff-47a0-11ed-aedd-7cd30abc95d8
1b30d0ff-47a0-11ed-aedd-7cd30abc95d8
1b30d0ff-47a0-11ed-aedd-7cd30abc95d8
1b30d0ff-47a0-11ed-aedd-7cd30abc95d8
1b30d0ff-47a0-11ed-aedd-7cd30abc95d8
1b30d0ff-47a0-11ed-aedd-7cd30abc95d8
1b30d0ff-47a0-11ed-aedd-7cd30abc95d8
1b30d0ff-47a0-11ed-aedd-7cd30abc95d8
1b30d0ff-47a0-11ed-aedd-7cd30abc95d8
1b30d0ff-47a0-11ed-aedd-7cd30abc95d8
1b30d0ff-47a0-11ed-aedd-7cd30abc95d8
1b30d0ff-47a0-11ed-aedd-7cd30abc95d8
1b30d0ff-47a0-11ed-aedd-7cd30abc95d8
1b30d0ff-47a0-11ed-aedd-7cd30abc95d8
1b30d0ff-47a0-11ed-aedd-7cd30abc95d8
1b30d0ff-47a0-11ed-aedd-7cd30abc95d8
1b30d0ff-47a0-11ed-aedd-7cd30abc95d8
1b30d0ff-47a0-11ed-aedd-7cd30abc95d8
1b30d0ff-47a0-11ed-aedd-7cd30abc95d8
1b30d0ff-47a0-11ed-aedd-7cd30abc95d8
1b30d0ff-47a0-11ed-aedd-7cd30abc95d8
1b30d0ff-47a0-11ed-aedd-7cd30abc95d8
1b30d0ff-47a0-11ed-aedd-7cd30abc95d8
1b30d0ff-47a0-11ed-aedd-7cd30abc95d8
1b30d0ff-47a0-11ed-aedd-7cd30abc95d8
1b30d0ff-47a0-11ed-aedd-7cd30abc95d8
1b30d0ff-47a0-11ed-aedd-7cd30abc95d8
1b30d0ff-47a0-11ed-aedd-7cd30abc95d8
1b30d0ff-47a0-11ed-aedd-7cd30abc95d8
1b30d0ff-47a0-11ed-aedd-7cd30abc95d8
1b30d0ff-47a0-11ed-aedd-7cd30abc95d8
1b30d0ff-47a0-11ed-aedd-7cd30abc95d8
1b30d0ff-47a0-11ed-aedd-7cd30abc95d8
1b30d0ff-47a0-11ed-aedd-7cd30abc95d8
1b30d0ff-47a0-11ed-aedd-7cd30abc95d8
1b30d0ff-47a0-11ed-aedd-7cd30abc95d8
1b30d0ff-47a0-11ed-aedd-7cd30abc95d8
1b30d0ff-47a0-11ed-aedd-7cd30abc95d8
1b30d0ff-47a0-11ed-aedd-7cd30abc95d8
1b30d0ff-47a0-11ed-aedd-7cd30abc95d8
1b30d0ff-47a0-11ed-aedd-7cd30abc95d8
1b30d0ff-47a0-11ed-aedd-7cd30abc95d8
1b30d0ff-47a0-11ed-aedd-7cd30abc95d8
1b30d0ff-47a0-11ed-aedd-7cd30abc95d8
1b30d0ff-47a0-11ed-aedd-7cd30abc95d8
1b30d0ff-47a0-11ed-aedd-7cd30abc95d8
1b30d0ff-47a0-11ed-aedd-7cd30abc95d8
1b30d0ff-47a0-11ed-aedd-7cd30abc95d8
1b30d0ff-47a0-11ed-aedd-7cd30abc95d8
1b30d0ff-47a0-11ed-aedd-7cd30abc95d8
1b30d0ff-47a0-11ed-aedd-7cd30abc95d8
1b30d0ff-47a0-11ed-aedd-7cd30abc95d8
1b30d0ff-47a0-11ed-aedd-7cd30abc95d8
1b30d0ff-47a0-11ed-aedd-7cd30abc95d8
1b30d0ff-47a0-11ed-aedd-7cd30abc95d8
1b30d0ff-47a0-11ed-aedd-7cd30abc95d8
1b30d0ff-47a0-11ed-aedd-7cd30abc95d8
1b30d0ff-47a0-11ed-aedd-7cd30abc95d8
1b30d0ff-47a0-11ed-aedd-7cd30abc95d8
1b30d0ff-47a0-11ed-aedd-7cd30abc95d8
1b30d0ff-47a0-11ed-aedd-7cd30abc95d8
1b30d0ff-47a0-11ed-aedd-7cd30abc95d8
1b30d0ff-47a0-11ed-aedd-7cd30abc95d8
1b30d0ff-47a0-11ed-aedd-7cd30abc95d8
1b30d0ff-47a0-11ed-aedd-7cd30abc95d8
1b30d0ff-47a0-11ed-aedd-7cd30abc95d8
1b30d0ff-47a0-11ed-aedd-7cd30abc95d8
1b30d0ff-47a0-11ed-aedd-7cd30abc95d8
1b30d0ff-47a0-11ed-aedd-7cd30abc95d8
1b30d0ff-47a0-11ed-aedd-7cd30abc95d8
1b30d0ff-47a0-11ed-aedd-7cd30abc95d8
1b30d0ff-47a0-11ed-aedd-7cd30abc95d8
1b30d0ff-47a0-11ed-aedd-7cd30abc95d8
1b30d0ff-47a0-11ed-aedd-7cd30abc95d8
1b30d0ff-47a0-11ed-aedd-7cd30abc95d8
1b30d0ff-47a0-11ed-aedd-7cd30abc95d8
1b30d0ff-47a0-11ed-aedd-7cd30abc95d8
1b30d0ff-47a0-11ed-aedd-7cd30abc95d8
1b30d0ff-47a0-11ed-aedd-7cd30abc95d8
1b30d0ff-47a0-11ed-aedd-7cd30abc95d8
1b30d0ff-47a0-11ed-aedd-7cd30abc95d8
1b30d0ff-47a0-11ed-aedd-7cd30abc95d8
1b30d0ff-47a0-11ed-aedd-7cd30abc95d8
1b30d0ff-47a0-11ed-aedd-7cd30abc95d8
1b30d0ff-47a0-11ed-aedd-7cd30abc95d8
1b30d0ff-47a0-11ed-aedd-7cd30abc95d8
1b30d0ff-47a0-11ed-aedd-7cd30abc95d8
1b30d0ff-47a0-11ed-aedd-7cd30abc95d8
1b30d0ff-47a0-11ed-aedd-7cd30abc95d8
1b30d0ff-47a0-11ed-aedd-7cd30abc95d8
1b30d0ff-47a0-11ed-aedd-7cd30abc95d8
1b30d0ff-47a0-11ed-aedd-7cd30abc95d8
1b30d0ff-47a0-11ed-aedd-7cd30abc95d8
1b30d0ff-47a0-11ed-aedd-7cd30abc95d8
1b30d0ff-47a0-11ed-aedd-7cd30abc95d8
1b30d0ff-47a0-11ed-aedd-7cd30abc95d8
1b30d0ff-47a0-11ed-aedd-7cd30abc95d8
1b30d0ff-47a0-11ed-aedd-7cd30abc95d8
1b30d0ff-47a0-11ed-aedd-7cd30abc95d8
1b30d0ff-47a0-11ed-aedd-7cd30abc95d8
1b30d0ff-47a0-11ed-aedd-7cd30abc95d8
1b30d0ff-47a0-11ed-aedd-7cd30abc95d8
1b30d0ff-47a0-11ed-aedd-7cd30abc95d8
1b30d0ff-47a0-11ed-aedd-7cd30abc95d8
1b30d0ff-47a0-11ed-aedd-7cd30abc95d8
1b30d0ff-47a0-11ed-aedd-7cd30abc95d8
1b30d0ff-47a0-11ed-aedd-7cd30abc95d8
1b30d0ff-47a0-11ed-aedd-7cd30abc95d8
1b30d0ff-47a0-11ed-aedd-7cd30abc95d8
1b30d0ff-47a0-11ed-aedd-7cd30abc95d8
1b30d0ff-47a0-11ed-aedd-7cd30abc95d8
1b30d0ff-47a0-11ed-aedd-7cd30abc95d8
1b30d0ff-47a0-11ed-aedd-7cd30abc95d8
1b30d0ff-47a0-11ed-aedd-7cd30abc95d8
1b30d0ff-47a0-11ed-aedd-7cd30abc95d8
1b30d0ff-47a0-11ed-aedd-7cd30abc95d8
1b30d0ff-47a0-11ed-aedd-7cd30abc95d8
1b30d0ff-47a0-11ed-aedd-7cd30abc95d8
1b30d0ff-47a0-11ed-aedd-7cd30abc95d8
1b30d0ff-47a0-11ed-aedd-7cd30abc95d8
1b30d0ff-47a0-11ed-aedd-7cd30abc95d8
1b30d0ff-47a0-11ed-aedd-7cd30abc95d8
1b30d0ff-47a0-11ed-aedd-7cd30abc95d8
1b30d0ff-47a0-11ed-aedd-7cd30abc95d8
1b30d0ff-47a0-11ed-aedd-7cd30abc95d8
1b30d0ff-47a0-11ed-aedd-7cd30abc95d8
1b30d0ff-47a0-11ed-aedd-7cd30abc95d8
1b30d0ff-47a0-11ed-aedd-7cd30abc95d8
1b30d0ff-47a0-11ed-aedd-7cd30abc95d8
1b30d0ff-47a0-11ed-aedd-7cd30abc95d8
1b30d0ff-47a0-11ed-aedd-7cd30abc95d8
1b30d0ff-47a0-11ed-aedd-7cd30abc95d8
1b30d0ff-47a0-11ed-aedd-7cd30abc95d8
1b30d0ff-47a0-11ed-aedd-7cd30abc95d8
1b30d0ff-47a0-11ed-aedd-7cd30abc95d8
1b30d0ff-47a0-11ed-aedd-7cd30abc95d8
1b30d0ff-47a0-11ed-aedd-7cd30abc95d8
1b30d0ff-47a0-11ed-aedd-7cd30abc95d8
1b30d0ff-47a0-11ed-aedd-7cd30abc95d8
1b30d0ff-47a0-11ed-aedd-7cd30abc95d8
1b30d0ff-47a0-11ed-aedd-7cd30abc95d8
1b30d0ff-47a0-11ed-aedd-7cd30abc95d8
1b30d0ff-47a0-11ed-aedd-7cd30abc95d8
1b30d0ff-47a0-11ed-aedd-7cd30abc95d8
1b30d0ff-47a0-11ed-aedd-7cd30abc95d8
1b30d0ff-47a0-11ed-aedd-7cd30abc95d8
1b30d0ff-47a0-11ed-aedd-7cd30abc95d8
1b30d0ff-47a0-11ed-aedd-7cd30abc95d8
1b30d0ff-47a0-11ed-aedd-7cd30abc95d8
1b30d0ff-47a0-11ed-aedd-7cd30abc95d8
1b30d0ff-47a0-11ed-aedd-7cd30abc95d8
1b30d0ff-47a0-11ed-aedd-7cd30abc95d8
1b30d0ff-47a0-11ed-aedd-7cd30abc95d8
1b30d0ff-47a0-11ed-aedd-7cd30abc95d8
1b30d0ff-47a0-11ed-aedd-7cd30abc95d8
1b30d0ff-47a0-11ed-aedd-7cd30abc95d8
1b30d0ff-47a0-11ed-aedd-7cd30abc95d8
1b30d0ff-47a0-11ed-aedd-7cd30abc95d8
1b30d0ff-47a0-11ed-aedd-7cd30abc95d8
1b30d0ff-47a0-11ed-aedd-7cd30abc95d8
1b30d0ff-47a0-11ed-aedd-7cd30abc95d8
1b30d0ff-47a0-11ed-aedd-7cd30abc95d8
1b30d0ff-47a0-11ed-aedd-7cd30abc95d8
1b30d0ff-47a0-11ed-aedd-7cd30abc95d8
1b30d0ff-47a0-11ed-aedd-7cd30abc95d8
1b30d0ff-47a0-11ed-aedd-7cd30abc95d8
1b30d0ff-47a0-11ed-aedd-7cd30abc95d8
1b30d0ff-47a0-11ed-aedd-7cd30abc95d8
1b30d0ff-47a0-11ed-aedd-7cd30abc95d8
1b30d0ff-47a0-11ed-aedd-7cd30abc95d8
1b30d0ff-47a0-11ed-aedd-7cd30abc95d8
1b30d0ff-47a0-11ed-aedd-7cd30abc95d8
1b30d0ff-47a0-11ed-aedd-7cd30abc95d8
1b30d0ff-47a0-11ed-aedd-7cd30abc95d8
1b30d0ff-47a0-11ed-aedd-7cd30abc95d8
1b30d0ff-47a0-11ed-aedd-7cd30abc95d8
1b30d0ff-47a0-11ed-aedd-7cd30abc95d8
1b30d0ff-47a0-11ed-aedd-7cd30abc95d8
1b30d0ff-47a0-11ed-aedd-7cd30abc95d8
1b30d0ff-47a0-11ed-aedd-7cd30abc95d8
1b30d0ff-47a0-11ed-aedd-7cd30abc95d8
1b30d0ff-47a0-11ed-aedd-7cd30abc95d8
1b30d0ff-47a0-11ed-aedd-7cd30abc95d8
1b30d0ff-47a0-11ed-aedd-7cd30abc95d8
1b30d0ff-47a0-11ed-aedd-7cd30abc95d8
1b30d0ff-47a0-11ed-aedd-7cd30abc95d8
1b30d0ff-47a0-11ed-aedd-7cd30abc95d8
1b30d0ff-47a0-11ed-aedd-7cd30abc95d8
1b30d0ff-47a0-11ed-aedd-7cd30abc95d8
1b30d0ff-47a0-11ed-aedd-7cd30abc95d8
1b30d0ff-47a0-11ed-aedd-7cd30abc95d8
1b30d0ff-47a0-11ed-aedd-7cd30abc95d8
1b30d0ff-47a0-11ed-aedd-7cd30abc95d8
1b30d0ff-47a0-11ed-aedd-7cd30abc95d8
1b30d0ff-47a0-11ed-aedd-7cd30abc95d8
1b30d0ff-47a0-11ed-aedd-7cd30abc95d8
1b30d0ff-47a0-11ed-aedd-7cd30abc95d8
1b30d0ff-47a0-11ed-aedd-7cd30abc95d8
1b30d0ff-47a0-11ed-aedd-7cd30abc95d8
1b30d0ff-47a0-11ed-aedd-7cd30abc95d8
1b30d0ff-47a0-11ed-aedd-7cd30abc95d8
1b30d0ff-47a0-11ed-aedd-7cd30abc95d8
1b30d0ff-47a0-11ed-aedd-7cd30abc95d8
1b30d0ff-47a0-11ed-aedd-7cd30abc95d8
1b30d0ff-47a0-11ed-aedd-7cd30abc95d8
1b30d0ff-47a0-11ed-aedd-7cd30abc95d8
1b30d0ff-47a0-11ed-aedd-7cd30abc95d8
1b30d0ff-47a0-11ed-aedd-7cd30abc95d8
1b30d0ff-47a0-11ed-aedd-7cd30abc95d8
1b30d0ff-47a0-11ed-aedd-7cd30abc95d8
1b30d0ff-47a0-11ed-aedd-7cd30abc95d8
1b30d0ff-47a0-11ed-aedd-7cd30abc95d8
1b30d0ff-47a0-11ed-aedd-7cd30abc95d8
1b30d0ff-47a0-11ed-aedd-7cd30abc95d8
1b30d0ff-47a0-11ed-aedd-7cd30abc95d8
1b30d0ff-47a0-11ed-aedd-7cd30abc95d8
1b30d0ff-47a0-11ed-aedd-7cd30abc95d8
1b30d0ff-47a0-11ed-aedd-7cd30abc95d8
1b30d0ff-47a0-11ed-aedd-7cd30abc95d8
1b30d0ff-47a0-11ed-aedd-7cd30abc95d8
1b30d0ff-47a0-11ed-aedd-7cd30abc95d8
1b30d0ff-47a0-11ed-aedd-7cd30abc95d8
1b30d0ff-47a0-11ed-aedd-7cd30abc95d8
1b30d0ff-47a0-11ed-aedd-7cd30abc95d8
1b30d0ff-47a0-11ed-aedd-7cd30abc95d8
1b30d0ff-47a0-11ed-aedd-7cd30abc95d8
1b30d0ff-47a0-11ed-aedd-7cd30abc95d8
1b30d0ff-47a0-11ed-aedd-7cd30abc95d8
1b30d0ff-47a0-11ed-aedd-7cd30abc95d8
1b30d0ff-47a0-11ed-aedd-7cd30abc95d8
1b30d0ff-47a0-11ed-aedd-7cd30abc95d8
1b30d0ff-47a0-11ed-aedd-7cd30abc95d8
1b30d0ff-47a0-11ed-aedd-7cd30abc95d8
1b30d0ff-47a0-11ed-aedd-7cd30abc95d8
1b30d0ff-47a0-11ed-aedd-7cd30abc95d8
1b30d0ff-47a0-11ed-aedd-7cd30abc95d8
1b30d0ff-47a0-11ed-aedd-7cd30abc95d8
1b30d0ff-47a0-11ed-aedd-7cd30abc95d8
1b30d0ff-47a0-11ed-aedd-7cd30abc95d8
1b30d0ff-47a0-11ed-aedd-7cd30abc95d8
1b30d0ff-47a0-11ed-aedd-7cd30abc95d8
1b30d0ff-47a0-11ed-aedd-7cd30abc95d8
1b30d0ff-47a0-11ed-aedd-7cd30abc95d8
1b30d0ff-47a0-11ed-aedd-7cd30abc95d8
1b30d0ff-47a0-11ed-aedd-7cd30abc95d8
1b30d0ff-47a0-11ed-aedd-7cd30abc95d8
1b30d0ff-47a0-11ed-aedd-7cd30abc95d8
1b30d0ff-47a0-11ed-aedd-7cd30abc95d8
1b30d0ff-47a0-11ed-aedd-7cd30abc95d8
1b30d0ff-47a0-11ed-aedd-7cd30abc95d8
1b30d0ff-47a0-11ed-aedd-7cd30abc95d8
1b30d0ff-47a0-11ed-aedd-7cd30abc95d8
1b30d0ff-47a0-11ed-aedd-7cd30abc95d8
1b30d0ff-47a0-11ed-aedd-7cd30abc95d8
1b30d0ff-47a0-11ed-aedd-7cd30abc95d8
1b30d0ff-47a0-11ed-aedd-7cd30abc95d8
1b30d0ff-47a0-11ed-aedd-7cd30abc95d8
1b30d0ff-47a0-11ed-aedd-7cd30abc95d8
1b30d0ff-47a0-11ed-aedd-7cd30abc95d8
1b30d0ff-47a0-11ed-aedd-7cd30abc95d8
1b30d0ff-47a0-11ed-aedd-7cd30abc95d8
1b30d0ff-47a0-11ed-aedd-7cd30abc95d8
1b30d0ff-47a0-11ed-aedd-7cd30abc95d8
1b30d0ff-47a0-11ed-aedd-7cd30abc95d8
1b30d0ff-47a0-11ed-aedd-7cd30abc95d8
1b30d0ff-47a0-11ed-aedd-7cd30abc95d8
1b30d0ff-47a0-11ed-aedd-7cd30abc95d8
1b30d0ff-47a0-11ed-aedd-7cd30abc95d8
1b30d0ff-47a0-11ed-aedd-7cd30abc95d8
1b30d0ff-47a0-11ed-aedd-7cd30abc95d8
1b30d0ff-47a0-11ed-aedd-7cd30abc95d8
1b30d0ff-47a0-11ed-aedd-7cd30abc95d8
1b30d0ff-47a0-11ed-aedd-7cd30abc95d8
1b30d0ff-47a0-11ed-aedd-7cd30abc95d8
1b30d0ff-47a0-11ed-aedd-7cd30abc95d8
1b30d0ff-47a0-11ed-aedd-7cd30abc95d8
1b30d0ff-47a0-11ed-aedd-7cd30abc95d8
1b30d0ff-47a0-11ed-aedd-7cd30abc95d8
1b30d0ff-47a0-11ed-aedd-7cd30abc95d8
1b30d0ff-47a0-11ed-aedd-7cd30abc95d8
1b30d0ff-47a0-11ed-aedd-7cd30abc95d8
1b30d0ff-47a0-11ed-aedd-7cd30abc95d8
1b30d0ff-47a0-11ed-aedd-7cd30abc95d8
1b30d0ff-47a0-11ed-aedd-7cd30abc95d8
1b30d0ff-47a0-11ed-aedd-7cd30abc95d8
1b30d0ff-47a0-11ed-aedd-7cd30abc95d8
1b30d0ff-47a0-11ed-aedd-7cd30abc95d8
1b30d0ff-47a0-11ed-aedd-7cd30abc95d8
1b30d0ff-47a0-11ed-aedd-7cd30abc95d8
1b30d0ff-47a0-11ed-aedd-7cd30abc95d8
1b30d0ff-47a0-11ed-aedd-7cd30abc95d8
1b30d0ff-47a0-11ed-aedd-7cd30abc95d8
1b30d0ff-47a0-11ed-aedd-7cd30abc95d8
1b30d0ff-47a0-11ed-aedd-7cd30abc95d8
1b30d0ff-47a0-11ed-aedd-7cd30abc95d8
1b30d0ff-47a0-11ed-aedd-7cd30abc95d8
1b30d0ff-47a0-11ed-aedd-7cd30abc95d8
1b30d0ff-47a0-11ed-aedd-7cd30abc95d8
1b30d0ff-47a0-11ed-aedd-7cd30abc95d8
1b30d0ff-47a0-11ed-aedd-7cd30abc95d8
1b30d0ff-47a0-11ed-aedd-7cd30abc95d8
1b30d0ff-47a0-11ed-aedd-7cd30abc95d8
1b30d0ff-47a0-11ed-aedd-7cd30abc95d8
1b30d0ff-47a0-11ed-aedd-7cd30abc95d8
1b30d0ff-47a0-11ed-aedd-7cd30abc95d8
1b30d0ff-47a0-11ed-aedd-7cd30abc95d8
1b30d0ff-47a0-11ed-aedd-7cd30abc95d8
1b30d0ff-47a0-11ed-aedd-7cd30abc95d8
1b30d0ff-47a0-11ed-aedd-7cd30abc95d8
1b30d0ff-47a0-11ed-aedd-7cd30abc95d8
1b30d0ff-47a0-11ed-aedd-7cd30abc95d8
1b30d0ff-47a0-11ed-aedd-7cd30abc95d8
1b30d0ff-47a0-11ed-aedd-7cd30abc95d8
1b30d0ff-47a0-11ed-aedd-7cd30abc95d8
1b30d0ff-47a0-11ed-aedd-7cd30abc95d8
1b30d0ff-47a0-11ed-aedd-7cd30abc95d8
1b30d0ff-47a0-11ed-aedd-7cd30abc95d8
1b30d0ff-47a0-11ed-aedd-7cd30abc95d8
1b30d0ff-47a0-11ed-aedd-7cd30abc95d8
1b30d0ff-47a0-11ed-aedd-7cd30abc95d8
1b30d0ff-47a0-11ed-aedd-7cd30abc95d8
1b30d0ff-47a0-11ed-aedd-7cd30abc95d8
1b30d0ff-47a0-11ed-aedd-7cd30abc95d8
1b30d0ff-47a0-11ed-aedd-7cd30abc95d8
1b30d0ff-47a0-11ed-aedd-7cd30abc95d8
1b30d0ff-47a0-11ed-aedd-7cd30abc95d8
1b30d0ff-47a0-11ed-aedd-7cd30abc95d8
1b30d0ff-47a0-11ed-aedd-7cd30abc95d8
1b30d0ff-47a0-11ed-aedd-7cd30abc95d8
1b30d0ff-47a0-11ed-aedd-7cd30abc95d8
1b30d0ff-47a0-11ed-aedd-7cd30abc95d8
1b30d0ff-47a0-11ed-aedd-7cd30abc95d8
1b30d0ff-47a0-11ed-aedd-7cd30abc95d8
1b30d0ff-47a0-11ed-aedd-7cd30abc95d8
1b30d0ff-47a0-11ed-aedd-7cd30abc95d8
1b30d0ff-47a0-11ed-aedd-7cd30abc95d8
1b30d0ff-47a0-11ed-aedd-7cd30abc95d8
1b30d0ff-47a0-11ed-aedd-7cd30abc95d8
1b30d0ff-47a0-11ed-aedd-7cd30abc95d8
1b30d0ff-47a0-11ed-aedd-7cd30abc95d8
1b30d0ff-47a0-11ed-aedd-7cd30abc95d8
1b30d0ff-47a0-11ed-aedd-7cd30abc95d8
1b30d0ff-47a0-11ed-aedd-7cd30abc95d8
1b30d0ff-47a0-11ed-aedd-7cd30abc95d8
1b30d0ff-47a0-11ed-aedd-7cd30abc95d8
1b30d0ff-47a0-11ed-aedd-7cd30abc95d8
1b30d0ff-47a0-11ed-aedd-7cd30abc95d8
1b30d0ff-47a0-11ed-aedd-7cd30abc95d8
1b30d0ff-47a0-11ed-aedd-7cd30abc95d8
1b30d0ff-47a0-11ed-aedd-7cd30abc95d8
1b30d0ff-47a0-11ed-aedd-7cd30abc95d8
1b30d0ff-47a0-11ed-aedd-7cd30abc95d8
1b30d0ff-47a0-11ed-aedd-7cd30abc95d8
1b30d0ff-47a0-11ed-aedd-7cd30abc95d8
1b30d0ff-47a0-11ed-aedd-7cd30abc95d8
1b30d0ff-47a0-11ed-aedd-7cd30abc95d8
1b30d0ff-47a0-11ed-aedd-7cd30abc95d8
1b30d0ff-47a0-11ed-aedd-7cd30abc95d8
1b30d0ff-47a0-11ed-aedd-7cd30abc95d8
1b30d0ff-47a0-11ed-aedd-7cd30abc95d8
1b30d0ff-47a0-11ed-aedd-7cd30abc95d8
1b30d0ff-47a0-11ed-aedd-7cd30abc95d8
1b30d0ff-47a0-11ed-aedd-7cd30abc95d8
1b30d0ff-47a0-11ed-aedd-7cd30abc95d8
1b30d0ff-47a0-11ed-aedd-7cd30abc95d8
1b30d0ff-47a0-11ed-aedd-7cd30abc95d8
1b30d0ff-47a0-11ed-aedd-7cd30abc95d8
1b30d0ff-47a0-11ed-aedd-7cd30abc95d8
1b30d0ff-47a0-11ed-aedd-7cd30abc95d8
1b30d0ff-47a0-11ed-aedd-7cd30abc95d8
1b30d0ff-47a0-11ed-aedd-7cd30abc95d8
1b30d0ff-47a0-11ed-aedd-7cd30abc95d8
1b30d0ff-47a0-11ed-aedd-7cd30abc95d8
1b30d0ff-47a0-11ed-aedd-7cd30abc95d8
1b30d0ff-47a0-11ed-aedd-7cd30abc95d8
1b30d0ff-47a0-11ed-aedd-7cd30abc95d8
1b30d0ff-47a0-11ed-aedd-7cd30abc95d8
1b30d0ff-47a0-11ed-aedd-7cd30abc95d8
1b30d0ff-47a0-11ed-aedd-7cd30abc95d8
1b30d0ff-47a0-11ed-aedd-7cd30abc95d8
1b30d0ff-47a0-11ed-aedd-7cd30abc95d8
1b30d0ff-47a0-11ed-aedd-7cd30abc95d8
1b30d0ff-47a0-11ed-aedd-7cd30abc95d8
1b30d0ff-47a0-11ed-aedd-7cd30abc95d8
1b30d0ff-47a0-11ed-aedd-7cd30abc95d8
1b30d0ff-47a0-11ed-aedd-7cd30abc95d8
1b30d0ff-47a0-11ed-aedd-7cd30abc95d8
1b30d0ff-47a0-11ed-aedd-7cd30abc95d8
1b30d0ff-47a0-11ed-aedd-7cd30abc95d8
1b30d0ff-47a0-11ed-aedd-7cd30abc95d8
1b30d0ff-47a0-11ed-aedd-7cd30abc95d8
1b30d0ff-47a0-11ed-aedd-7cd30abc95d8
1b30d0ff-47a0-11ed-aedd-7cd30abc95d8
1b30d0ff-47a0-11ed-aedd-7cd30abc95d8
1b30d0ff-47a0-11ed-aedd-7cd30abc95d8
1b30d0ff-47a0-11ed-aedd-7cd30abc95d8
1b30d0ff-47a0-11ed-aedd-7cd30abc95d8
1b30d0ff-47a0-11ed-aedd-7cd30abc95d8
1b30d0ff-47a0-11ed-aedd-7cd30abc95d8
1b30d0ff-47a0-11ed-aedd-7cd30abc95d8
1b30d0ff-47a0-11ed-aedd-7cd30abc95d8
1b30d0ff-47a0-11ed-aedd-7cd30abc95d8
1b30d0ff-47a0-11ed-aedd-7cd30abc95d8
1b30d0ff-47a0-11ed-aedd-7cd30abc95d8
1b30d0ff-47a0-11ed-aedd-7cd30abc95d8
1b30d0ff-47a0-11ed-aedd-7cd30abc95d8
1b30d0ff-47a0-11ed-aedd-7cd30abc95d8
1b30d0ff-47a0-11ed-aedd-7cd30abc95d8
1b30d0ff-47a0-11ed-aedd-7cd30abc95d8
1b30d0ff-47a0-11ed-aedd-7cd30abc95d8
1b30d0ff-47a0-11ed-aedd-7cd30abc95d8
1b30d0ff-47a0-11ed-aedd-7cd30abc95d8
1b30d0ff-47a0-11ed-aedd-7cd30abc95d8
1b30d0ff-47a0-11ed-aedd-7cd30abc95d8
1b30d0ff-47a0-11ed-aedd-7cd30abc95d8
1b30d0ff-47a0-11ed-aedd-7cd30abc95d8
1b30d0ff-47a0-11ed-aedd-7cd30abc95d8
1b30d0ff-47a0-11ed-aedd-7cd30abc95d8
1b30d0ff-47a0-11ed-aedd-7cd30abc95d8
1b30d0ff-47a0-11ed-aedd-7cd30abc95d8
1b30d0ff-47a0-11ed-aedd-7cd30abc95d8
1b30d0ff-47a0-11ed-aedd-7cd30abc95d8
1b30d0ff-47a0-11ed-aedd-7cd30abc95d8
1b30d0ff-47a0-11ed-aedd-7cd30abc95d8
1b30d0ff-47a0-11ed-aedd-7cd30abc95d8
1b30d0ff-47a0-11ed-aedd-7cd30abc95d8
1b30d0ff-47a0-11ed-aedd-7cd30abc95d8
1b30d0ff-47a0-11ed-aedd-7cd30abc95d8
1b30d0ff-47a0-11ed-aedd-7cd30abc95d8
1b30d0ff-47a0-11ed-aedd-7cd30abc95d8
1b30d0ff-47a0-11ed-aedd-7cd30abc95d8
1b30d0ff-47a0-11ed-aedd-7cd30abc95d8
1b30d0ff-47a0-11ed-aedd-7cd30abc95d8
1b30d0ff-47a0-11ed-aedd-7cd30abc95d8
1b30d0ff-47a0-11ed-aedd-7cd30abc95d8
1b30d0ff-47a0-11ed-aedd-7cd30abc95d8
1b30d0ff-47a0-11ed-aedd-7cd30abc95d8
1b30d0ff-47a0-11ed-aedd-7cd30abc95d8
1b30d0ff-47a0-11ed-aedd-7cd30abc95d8
1b30d0ff-47a0-11ed-aedd-7cd30abc95d8
1b30d0ff-47a0-11ed-aedd-7cd30abc95d8
1b30d0ff-47a0-11ed-aedd-7cd30abc95d8
1b30d0ff-47a0-11ed-aedd-7cd30abc95d8
1b30d0ff-47a0-11ed-aedd-7cd30abc95d8
1b30d0ff-47a0-11ed-aedd-7cd30abc95d8
1b30d0ff-47a0-11ed-aedd-7cd30abc95d8
1b30d0ff-47a0-11ed-aedd-7cd30abc95d8
1b30d0ff-47a0-11ed-aedd-7cd30abc95d8
1b30d0ff-47a0-11ed-aedd-7cd30abc95d8
1b30d0ff-47a0-11ed-aedd-7cd30abc95d8
1b30d0ff-47a0-11ed-aedd-7cd30abc95d8
1b30d0ff-47a0-11ed-aedd-7cd30abc95d8
1b30d0ff-47a0-11ed-aedd-7cd30abc95d8
1b30d0ff-47a0-11ed-aedd-7cd30abc95d8
1b30d0ff-47a0-11ed-aedd-7cd30abc95d8
1b30d0ff-47a0-11ed-aedd-7cd30abc95d8
1b30d0ff-47a0-11ed-aedd-7cd30abc95d8
1b30d0ff-47a0-11ed-aedd-7cd30abc95d8
1b30d0ff-47a0-11ed-aedd-7cd30abc95d8
1b30d0ff-47a0-11ed-aedd-7cd30abc95d8
1b30d0ff-47a0-11ed-aedd-7cd30abc95d8
1b30d0ff-47a0-11ed-aedd-7cd30abc95d8
1b30d0ff-47a0-11ed-aedd-7cd30abc95d8
1b30d0ff-47a0-11ed-aedd-7cd30abc95d8
1b30d0ff-47a0-11ed-aedd-7cd30abc95d8
1b30d0ff-47a0-11ed-aedd-7cd30abc95d8
1b30d0ff-47a0-11ed-aedd-7cd30abc95d8
1b30d0ff-47a0-11ed-aedd-7cd30abc95d8
1b30d0ff-47a0-11ed-aedd-7cd30abc95d8
1b30d0ff-47a0-11ed-aedd-7cd30abc95d8
1b30d0ff-47a0-11ed-aedd-7cd30abc95d8
1b30d0ff-47a0-11ed-aedd-7cd30abc95d8
1b30d0ff-47a0-11ed-aedd-7cd30abc95d8
1b30d0ff-47a0-11ed-aedd-7cd30abc95d8
1b30d0ff-47a0-11ed-aedd-7cd30abc95d8
1b30d0ff-47a0-11ed-aedd-7cd30abc95d8
1b30d0ff-47a0-11ed-aedd-7cd30abc95d8
1b30d0ff-47a0-11ed-aedd-7cd30abc95d8
1b30d0ff-47a0-11ed-aedd-7cd30abc95d8
1b30d0ff-47a0-11ed-aedd-7cd30abc95d8
1b30d0ff-47a0-11ed-aedd-7cd30abc95d8
1b30d0ff-47a0-11ed-aedd-7cd30abc95d8
1b30d0ff-47a0-11ed-aedd-7cd30abc95d8
1b30d0ff-47a0-11ed-aedd-7cd30abc95d8
1b30d0ff-47a0-11ed-aedd-7cd30abc95d8
1b30d0ff-47a0-11ed-aedd-7cd30abc95d8
1b30d0ff-47a0-11ed-aedd-7cd30abc95d8
1b30d0ff-47a0-11ed-aedd-7cd30abc95d8
1b30d0ff-47a0-11ed-aedd-7cd30abc95d8
1b30d0ff-47a0-11ed-aedd-7cd30abc95d8
1b30d0ff-47a0-11ed-aedd-7cd30abc95d8
1b30d0ff-47a0-11ed-aedd-7cd30abc95d8
1b30d0ff-47a0-11ed-aedd-7cd30abc95d8
1b30d0ff-47a0-11ed-aedd-7cd30abc95d8
1b30d0ff-47a0-11ed-aedd-7cd30abc95d8
1b30d0ff-47a0-11ed-aedd-7cd30abc95d8
1b30d0ff-47a0-11ed-aedd-7cd30abc95d8
1b30d0ff-47a0-11ed-aedd-7cd30abc95d8
1b30d0ff-47a0-11ed-aedd-7cd30abc95d8
1b30d0ff-47a0-11ed-aedd-7cd30abc95d8
1b30d0ff-47a0-11ed-aedd-7cd30abc95d8
1b30d0ff-47a0-11ed-aedd-7cd30abc95d8
1b30d0ff-47a0-11ed-aedd-7cd30abc95d8
1b30d0ff-47a0-11ed-aedd-7cd30abc95d8
1b30d0ff-47a0-11ed-aedd-7cd30abc95d8
1b30d0ff-47a0-11ed-aedd-7cd30abc95d8
1b30d0ff-47a0-11ed-aedd-7cd30abc95d8
1b30d0ff-47a0-11ed-aedd-7cd30abc95d8
1b30d0ff-47a0-11ed-aedd-7cd30abc95d8
1b30d0ff-47a0-11ed-aedd-7cd30abc95d8
1b30d0ff-47a0-11ed-aedd-7cd30abc95d8
1b30d0ff-47a0-11ed-aedd-7cd30abc95d8
1b30d0ff-47a0-11ed-aedd-7cd30abc95d8
1b30d0ff-47a0-11ed-aedd-7cd30abc95d8
1b30d0ff-47a0-11ed-aedd-7cd30abc95d8
1b30d0ff-47a0-11ed-aedd-7cd30abc95d8
1b30d0ff-47a0-11ed-aedd-7cd30abc95d8
1b30d0ff-47a0-11ed-aedd-7cd30abc95d8
1b30d0ff-47a0-11ed-aedd-7cd30abc95d8
1b30d0ff-47a0-11ed-aedd-7cd30abc95d8
1b30d0ff-47a0-11ed-aedd-7cd30abc95d8
1b30d0ff-47a0-11ed-aedd-7cd30abc95d8
1b30d0ff-47a0-11ed-aedd-7cd30abc95d8
1b30d0ff-47a0-11ed-aedd-7cd30abc95d8
1b30d0ff-47a0-11ed-aedd-7cd30abc95d8
1b30d0ff-47a0-11ed-aedd-7cd30abc95d8
1b30d0ff-47a0-11ed-aedd-7cd30abc95d8
1b30d0ff-47a0-11ed-aedd-7cd30abc95d8
1b30d0ff-47a0-11ed-aedd-7cd30abc95d8
1b30d0ff-47a0-11ed-aedd-7cd30abc95d8
1b30d0ff-47a0-11ed-aedd-7cd30abc95d8
1b30d0ff-47a0-11ed-aedd-7cd30abc95d8
1b30d0ff-47a0-11ed-aedd-7cd30abc95d8
1b30d0ff-47a0-11ed-aedd-7cd30abc95d8
1b30d0ff-47a0-11ed-aedd-7cd30abc95d8
1b30d0ff-47a0-11ed-aedd-7cd30abc95d8
1b30d0ff-47a0-11ed-aedd-7cd30abc95d8
1b30d0ff-47a0-11ed-aedd-7cd30abc95d8
1b30d0ff-47a0-11ed-aedd-7cd30abc95d8
1b30d0ff-47a0-11ed-aedd-7cd30abc95d8
1b30d0ff-47a0-11ed-aedd-7cd30abc95d8
1b30d0ff-47a0-11ed-aedd-7cd30abc95d8
1b30d0ff-47a0-11ed-aedd-7cd30abc95d8
1b30d0ff-47a0-11ed-aedd-7cd30abc95d8
1b30d0ff-47a0-11ed-aedd-7cd30abc95d8
1b30d0ff-47a0-11ed-aedd-7cd30abc95d8
1b30d0ff-47a0-11ed-aedd-7cd30abc95d8
1b30d0ff-47a0-11ed-aedd-7cd30abc95d8
1b30d0ff-47a0-11ed-aedd-7cd30abc95d8
1b30d0ff-47a0-11ed-aedd-7cd30abc95d8
1b30d0ff-47a0-11ed-aedd-7cd30abc95d8
1b30d0ff-47a0-11ed-aedd-7cd30abc95d8
1b30d0ff-47a0-11ed-aedd-7cd30abc95d8
1b30d0ff-47a0-11ed-aedd-7cd30abc95d8
1b30d0ff-47a0-11ed-aedd-7cd30abc95d8
1b30d0ff-47a0-11ed-aedd-7cd30abc95d8
1b30d0ff-47a0-11ed-aedd-7cd30abc95d8
1b30d0ff-47a0-11ed-aedd-7cd30abc95d8
1b30d0ff-47a0-11ed-aedd-7cd30abc95d8
1b30d0ff-47a0-11ed-aedd-7cd30abc95d8
1b30d0ff-47a0-11ed-aedd-7cd30abc95d8
1b30d0ff-47a0-11ed-aedd-7cd30abc95d8
1b30d0ff-47a0-11ed-aedd-7cd30abc95d8
1b30d0ff-47a0-11ed-aedd-7cd30abc95d8
1b30d0ff-47a0-11ed-aedd-7cd30abc95d8
1b30d0ff-47a0-11ed-aedd-7cd30abc95d8
1b30d0ff-47a0-11ed-aedd-7cd30abc95d8
1b30d0ff-47a0-11ed-aedd-7cd30abc95d8
1b30d0ff-47a0-11ed-aedd-7cd30abc95d8
1b30d0ff-47a0-11ed-aedd-7cd30abc95d8
1b30d0ff-47a0-11ed-aedd-7cd30abc95d8
1b30d0ff-47a0-11ed-aedd-7cd30abc95d8
1b30d0ff-47a0-11ed-aedd-7cd30abc95d8
1b30d0ff-47a0-11ed-aedd-7cd30abc95d8
1b30d0ff-47a0-11ed-aedd-7cd30abc95d8
1b30d0ff-47a0-11ed-aedd-7cd30abc95d8
1b30d0ff-47a0-11ed-aedd-7cd30abc95d8
1b30d0ff-47a0-11ed-aedd-7cd30abc95d8
1b30d0ff-47a0-11ed-aedd-7cd30abc95d8
1b30d0ff-47a0-11ed-aedd-7cd30abc95d8
1b30d0ff-47a0-11ed-aedd-7cd30abc95d8
1b30d0ff-47a0-11ed-aedd-7cd30abc95d8
1b30d0ff-47a0-11ed-aedd-7cd30abc95d8
1b30d0ff-47a0-11ed-aedd-7cd30abc95d8
1b30d0ff-47a0-11ed-aedd-7cd30abc95d8
1b30d0ff-47a0-11ed-aedd-7cd30abc95d8
1b30d0ff-47a0-11ed-aedd-7cd30abc95d8
1b30d0ff-47a0-11ed-aedd-7cd30abc95d8
1b30d0ff-47a0-11ed-aedd-7cd30abc95d8
1b30d0ff-47a0-11ed-aedd-7cd30abc95d8
1b30d0ff-47a0-11ed-aedd-7cd30abc95d8
1b30d0ff-47a0-11ed-aedd-7cd30abc95d8
1b30d0ff-47a0-11ed-aedd-7cd30abc95d8
1b30d0ff-47a0-11ed-aedd-7cd30abc95d8
1b30d0ff-47a0-11ed-aedd-7cd30abc95d8
1b30d0ff-47a0-11ed-aedd-7cd30abc95d8
1b30d0ff-47a0-11ed-aedd-7cd30abc95d8
1b30d0ff-47a0-11ed-aedd-7cd30abc95d8
1b30d0ff-47a0-11ed-aedd-7cd30abc95d8
1b30d0ff-47a0-11ed-aedd-7cd30abc95d8
1b30d0ff-47a0-11ed-aedd-7cd30abc95d8
1b30d0ff-47a0-11ed-aedd-7cd30abc95d8
1b30d0ff-47a0-11ed-aedd-7cd30abc95d8
1b30d0ff-47a0-11ed-aedd-7cd30abc95d8
1b30d0ff-47a0-11ed-aedd-7cd30abc95d8
1b30d0ff-47a0-11ed-aedd-7cd30abc95d8
1b30d0ff-47a0-11ed-aedd-7cd30abc95d8
1b30d0ff-47a0-11ed-aedd-7cd30abc95d8
1b30d0ff-47a0-11ed-aedd-7cd30abc95d8
1b30d0ff-47a0-11ed-aedd-7cd30abc95d8
1b30d0ff-47a0-11ed-aedd-7cd30abc95d8
1b30d0ff-47a0-11ed-aedd-7cd30abc95d8
1b30d0ff-47a0-11ed-aedd-7cd30abc95d8
1b30d0ff-47a0-11ed-aedd-7cd30abc95d8
1b30d0ff-47a0-11ed-aedd-7cd30abc95d8
1b30d0ff-47a0-11ed-aedd-7cd30abc95d8
1b30d0ff-47a0-11ed-aedd-7cd30abc95d8
1b30d0ff-47a0-11ed-aedd-7cd30abc95d8
1b30d0ff-47a0-11ed-aedd-7cd30abc95d8
1b30d0ff-47a0-11ed-aedd-7cd30abc95d8
1b30d0ff-47a0-11ed-aedd-7cd30abc95d8
1b30d0ff-47a0-11ed-aedd-7cd30abc95d8
1b30d0ff-47a0-11ed-aedd-7cd30abc95d8
1b30d0ff-47a0-11ed-aedd-7cd30abc95d8
1b30d0ff-47a0-11ed-aedd-7cd30abc95d8
1b30d0ff-47a0-11ed-aedd-7cd30abc95d8
1b30d0ff-47a0-11ed-aedd-7cd30abc95d8
1b30d0ff-47a0-11ed-aedd-7cd30abc95d8
1b30d0ff-47a0-11ed-aedd-7cd30abc95d8
1b30d0ff-47a0-11ed-aedd-7cd30abc95d8
1b30d0ff-47a0-11ed-aedd-7cd30abc95d8
1b30d0ff-47a0-11ed-aedd-7cd30abc95d8
1b30d0ff-47a0-11ed-aedd-7cd30abc95d8
1b30d0ff-47a0-11ed-aedd-7cd30abc95d8
1b30d0ff-47a0-11ed-aedd-7cd30abc95d8
1b30d0ff-47a0-11ed-aedd-7cd30abc95d8
1b30d0ff-47a0-11ed-aedd-7cd30abc95d8
1b30d0ff-47a0-11ed-aedd-7cd30abc95d8
1b30d0ff-47a0-11ed-aedd-7cd30abc95d8
1b30d0ff-47a0-11ed-aedd-7cd30abc95d8
1b30d0ff-47a0-11ed-aedd-7cd30abc95d8
1b30d0ff-47a0-11ed-aedd-7cd30abc95d8
1b30d0ff-47a0-11ed-aedd-7cd30abc95d8
1b30d0ff-47a0-11ed-aedd-7cd30abc95d8
1b30d0ff-47a0-11ed-aedd-7cd30abc95d8
1b30d0ff-47a0-11ed-aedd-7cd30abc95d8
1b30d0ff-47a0-11ed-aedd-7cd30abc95d8
1b30d0ff-47a0-11ed-aedd-7cd30abc95d8
1b30d0ff-47a0-11ed-aedd-7cd30abc95d8
1b30d0ff-47a0-11ed-aedd-7cd30abc95d8
1b30d0ff-47a0-11ed-aedd-7cd30abc95d8
1b30d0ff-47a0-11ed-aedd-7cd30abc95d8
1b30d0ff-47a0-11ed-aedd-7cd30abc95d8
1b30d0ff-47a0-11ed-aedd-7cd30abc95d8
1b30d0ff-47a0-11ed-aedd-7cd30abc95d8
1b30d0ff-47a0-11ed-aedd-7cd30abc95d8
1b30d0ff-47a0-11ed-aedd-7cd30abc95d8
1b30d0ff-47a0-11ed-aedd-7cd30abc95d8
1b30d0ff-47a0-11ed-aedd-7cd30abc95d8
1b30d0ff-47a0-11ed-aedd-7cd30abc95d8
1b30d0ff-47a0-11ed-aedd-7cd30abc95d8
1b30d0ff-47a0-11ed-aedd-7cd30abc95d8
1b30d0ff-47a0-11ed-aedd-7cd30abc95d8
1b30d0ff-47a0-11ed-aedd-7cd30abc95d8
1b30d0ff-47a0-11ed-aedd-7cd30abc95d8
1b30d0ff-47a0-11ed-aedd-7cd30abc95d8
1b30d0ff-47a0-11ed-aedd-7cd30abc95d8
1b30d0ff-47a0-11ed-aedd-7cd30abc95d8
1b30d0ff-47a0-11ed-aedd-7cd30abc95d8
1b30d0ff-47a0-11ed-aedd-7cd30abc95d8
1b30d0ff-47a0-11ed-aedd-7cd30abc95d8
1b30d0ff-47a0-11ed-aedd-7cd30abc95d8
1b30d0ff-47a0-11ed-aedd-7cd30abc95d8
1b30d0ff-47a0-11ed-aedd-7cd30abc95d8
1b30d0ff-47a0-11ed-aedd-7cd30abc95d8
1b30d0ff-47a0-11ed-aedd-7cd30abc95d8
1b30d0ff-47a0-11ed-aedd-7cd30abc95d8
1b30d0ff-47a0-11ed-aedd-7cd30abc95d8
1b30d0ff-47a0-11ed-aedd-7cd30abc95d8
1b30d0ff-47a0-11ed-aedd-7cd30abc95d8
1b30d0ff-47a0-11ed-aedd-7cd30abc95d8
1b30d0ff-47a0-11ed-aedd-7cd30abc95d8
1b30d0ff-47a0-11ed-aedd-7cd30abc95d8
1b30d0ff-47a0-11ed-aedd-7cd30abc95d8
1b30d0ff-47a0-11ed-aedd-7cd30abc95d8
1b30d0ff-47a0-11ed-aedd-7cd30abc95d8
1b30d0ff-47a0-11ed-aedd-7cd30abc95d8
1b30d0ff-47a0-11ed-aedd-7cd30abc95d8
1b30d0ff-47a0-11ed-aedd-7cd30abc95d8
1b30d0ff-47a0-11ed-aedd-7cd30abc95d8
1b30d0ff-47a0-11ed-aedd-7cd30abc95d8
1b30d0ff-47a0-11ed-aedd-7cd30abc95d8
1b30d0ff-47a0-11ed-aedd-7cd30abc95d8
1b30d0ff-47a0-11ed-aedd-7cd30abc95d8
1b30d0ff-47a0-11ed-aedd-7cd30abc95d8
1b30d0ff-47a0-11ed-aedd-7cd30abc95d8
1b30d0ff-47a0-11ed-aedd-7cd30abc95d8
1b30d0ff-47a0-11ed-aedd-7cd30abc95d8
1b30d0ff-47a0-11ed-aedd-7cd30abc95d8
1b30d0ff-47a0-11ed-aedd-7cd30abc95d8
1b30d0ff-47a0-11ed-aedd-7cd30abc95d8
1b30d0ff-47a0-11ed-aedd-7cd30abc95d8
1b30d0ff-47a0-11ed-aedd-7cd30abc95d8
1b30d0ff-47a0-11ed-aedd-7cd30abc95d8
1b30d0ff-47a0-11ed-aedd-7cd30abc95d8
1b30d0ff-47a0-11ed-aedd-7cd30abc95d8
1b30d0ff-47a0-11ed-aedd-7cd30abc95d8
1b30d0ff-47a0-11ed-aedd-7cd30abc95d8
1b30d0ff-47a0-11ed-aedd-7cd30abc95d8
1b30d0ff-47a0-11ed-aedd-7cd30abc95d8
1b30d0ff-47a0-11ed-aedd-7cd30abc95d8
1b30d0ff-47a0-11ed-aedd-7cd30abc95d8
1b30d0ff-47a0-11ed-aedd-7cd30abc95d8
1b30d0ff-47a0-11ed-aedd-7cd30abc95d8
1b30d0ff-47a0-11ed-aedd-7cd30abc95d8
1b30d0ff-47a0-11ed-aedd-7cd30abc95d8
1b30d0ff-47a0-11ed-aedd-7cd30abc95d8
1b30d0ff-47a0-11ed-aedd-7cd30abc95d8
1b30d0ff-47a0-11ed-aedd-7cd30abc95d8
1b30d0ff-47a0-11ed-aedd-7cd30abc95d8
1b30d0ff-47a0-11ed-aedd-7cd30abc95d8
1b30d0ff-47a0-11ed-aedd-7cd30abc95d8
1b30d0ff-47a0-11ed-aedd-7cd30abc95d8
1b30d0ff-47a0-11ed-aedd-7cd30abc95d8
1b30d0ff-47a0-11ed-aedd-7cd30abc95d8
1b30d0ff-47a0-11ed-aedd-7cd30abc95d8
1b30d0ff-47a0-11ed-aedd-7cd30abc95d8
1b30d0ff-47a0-11ed-aedd-7cd30abc95d8
1b30d0ff-47a0-11ed-aedd-7cd30abc95d8
1b30d0ff-47a0-11ed-aedd-7cd30abc95d8
1b30d0ff-47a0-11ed-aedd-7cd30abc95d8
1b30d0ff-47a0-11ed-aedd-7cd30abc95d8
1b30d0ff-47a0-11ed-aedd-7cd30abc95d8
1b30d0ff-47a0-11ed-aedd-7cd30abc95d8
1b30d0ff-47a0-11ed-aedd-7cd30abc95d8
1b30d0ff-47a0-11ed-aedd-7cd30abc95d8
1b30d0ff-47a0-11ed-aedd-7cd30abc95d8
1b30d0ff-47a0-11ed-aedd-7cd30abc95d8
1b30d0ff-47a0-11ed-aedd-7cd30abc95d8
1b30d0ff-47a0-11ed-aedd-7cd30abc95d8
1b30d0ff-47a0-11ed-aedd-7cd30abc95d8
1b30d0ff-47a0-11ed-aedd-7cd30abc95d8
1b30d0ff-47a0-11ed-aedd-7cd30abc95d8
1b30d0ff-47a0-11ed-aedd-7cd30abc95d8
1b30d0ff-47a0-11ed-aedd-7cd30abc95d8
1b30d0ff-47a0-11ed-aedd-7cd30abc95d8
1b30d0ff-47a0-11ed-aedd-7cd30abc95d8
1b30d0ff-47a0-11ed-aedd-7cd30abc95d8
1b30d0ff-47a0-11ed-aedd-7cd30abc95d8
1b30d0ff-47a0-11ed-aedd-7cd30abc95d8
1b30d0ff-47a0-11ed-aedd-7cd30abc95d8
1b30d0ff-47a0-11ed-aedd-7cd30abc95d8
1b30d0ff-47a0-11ed-aedd-7cd30abc95d8
1b30d0ff-47a0-11ed-aedd-7cd30abc95d8
1b30d0ff-47a0-11ed-aedd-7cd30abc95d8
1b30d0ff-47a0-11ed-aedd-7cd30abc95d8
1b30d0ff-47a0-11ed-aedd-7cd30abc95d8
1b30d0ff-47a0-11ed-aedd-7cd30abc95d8
1b30d0ff-47a0-11ed-aedd-7cd30abc95d8
1b30d0ff-47a0-11ed-aedd-7cd30abc95d8
1b30d0ff-47a0-11ed-aedd-7cd30abc95d8
1b30d0ff-47a0-11ed-aedd-7cd30abc95d8
1b30d0ff-47a0-11ed-aedd-7cd30abc95d8
1b30d0ff-47a0-11ed-aedd-7cd30abc95d8
1b30d0ff-47a0-11ed-aedd-7cd30abc95d8
1b30d0ff-47a0-11ed-aedd-7cd30abc95d8
1b30d0ff-47a0-11ed-aedd-7cd30abc95d8
1b30d0ff-47a0-11ed-aedd-7cd30abc95d8
1b30d0ff-47a0-11ed-aedd-7cd30abc95d8
1b30d0ff-47a0-11ed-aedd-7cd30abc95d8
1b30d0ff-47a0-11ed-aedd-7cd30abc95d8
1b30d0ff-47a0-11ed-aedd-7cd30abc95d8
1b30d0ff-47a0-11ed-aedd-7cd30abc95d8
1b30d0ff-47a0-11ed-aedd-7cd30abc95d8
1b30d0ff-47a0-11ed-aedd-7cd30abc95d8
1b30d0ff-47a0-11ed-aedd-7cd30abc95d8
1b30d0ff-47a0-11ed-aedd-7cd30abc95d8
1b30d0ff-47a0-11ed-aedd-7cd30abc95d8
1b30d0ff-47a0-11ed-aedd-7cd30abc95d8
1b30d0ff-47a0-11ed-aedd-7cd30abc95d8
1b30d0ff-47a0-11ed-aedd-7cd30abc95d8
1b30d0ff-47a0-11ed-aedd-7cd30abc95d8
1b30d0ff-47a0-11ed-aedd-7cd30abc95d8
1b30d0ff-47a0-11ed-aedd-7cd30abc95d8
1b30d0ff-47a0-11ed-aedd-7cd30abc95d8
1b30d0ff-47a0-11ed-aedd-7cd30abc95d8
1b30d0ff-47a0-11ed-aedd-7cd30abc95d8
1b30d0ff-47a0-11ed-aedd-7cd30abc95d8
1b30d0ff-47a0-11ed-aedd-7cd30abc95d8
1b30d0ff-47a0-11ed-aedd-7cd30abc95d8
1b30d0ff-47a0-11ed-aedd-7cd30abc95d8
1b30d0ff-47a0-11ed-aedd-7cd30abc95d8
1b30d0ff-47a0-11ed-aedd-7cd30abc95d8
1b30d0ff-47a0-11ed-aedd-7cd30abc95d8
1b30d0ff-47a0-11ed-aedd-7cd30abc95d8
1b30d0ff-47a0-11ed-aedd-7cd30abc95d8
1b30d0ff-47a0-11ed-aedd-7cd30abc95d8
1b30d0ff-47a0-11ed-aedd-7cd30abc95d8
1b30d0ff-47a0-11ed-aedd-7cd30abc95d8
1b30d0ff-47a0-11ed-aedd-7cd30abc95d8
1b30d0ff-47a0-11ed-aedd-7cd30abc95d8
1b30d0ff-47a0-11ed-aedd-7cd30abc95d8
1b30d0ff-47a0-11ed-aedd-7cd30abc95d8
1b30d0ff-47a0-11ed-aedd-7cd30abc95d8
1b30d0ff-47a0-11ed-aedd-7cd30abc95d8
1b30d0ff-47a0-11ed-aedd-7cd30abc95d8
1b30d0ff-47a0-11ed-aedd-7cd30abc95d8
1b30d0ff-47a0-11ed-aedd-7cd30abc95d8
1b30d0ff-47a0-11ed-aedd-7cd30abc95d8
1b30d0ff-47a0-11ed-aedd-7cd30abc95d8
1b30d0ff-47a0-11ed-aedd-7cd30abc95d8
1b30d0ff-47a0-11ed-aedd-7cd30abc95d8
1b30d0ff-47a0-11ed-aedd-7cd30abc95d8
1b30d0ff-47a0-11ed-aedd-7cd30abc95d8
1b30d0ff-47a0-11ed-aedd-7cd30abc95d8
1b30d0ff-47a0-11ed-aedd-7cd30abc95d8
1b30d0ff-47a0-11ed-aedd-7cd30abc95d8
1b30d0ff-47a0-11ed-aedd-7cd30abc95d8
1b30d0ff-47a0-11ed-aedd-7cd30abc95d8
1b30d0ff-47a0-11ed-aedd-7cd30abc95d8
1b30d0ff-47a0-11ed-aedd-7cd30abc95d8
1b30d0ff-47a0-11ed-aedd-7cd30abc95d8
1b30d0ff-47a0-11ed-aedd-7cd30abc95d8
1b30d0ff-47a0-11ed-aedd-7cd30abc95d8
1b30d0ff-47a0-11ed-aedd-7cd30abc95d8
1b30d0ff-47a0-11ed-aedd-7cd30abc95d8
1b30d0ff-47a0-11ed-aedd-7cd30abc95d8
1b30d0ff-47a0-11ed-aedd-7cd30abc95d8
1b30d0ff-47a0-11ed-aedd-7cd30abc95d8
1b30d0ff-47a0-11ed-aedd-7cd30abc95d8
1b30d0ff-47a0-11ed-aedd-7cd30abc95d8
1b30d0ff-47a0-11ed-aedd-7cd30abc95d8
1b30d0ff-47a0-11ed-aedd-7cd30abc95d8
1b30d0ff-47a0-11ed-aedd-7cd30abc95d8
1b30d0ff-47a0-11ed-aedd-7cd30abc95d8
1b30d0ff-47a0-11ed-aedd-7cd30abc95d8
1b30d0ff-47a0-11ed-aedd-7cd30abc95d8
1b30d0ff-47a0-11ed-aedd-7cd30abc95d8
1b30d0ff-47a0-11ed-aedd-7cd30abc95d8
1b30d0ff-47a0-11ed-aedd-7cd30abc95d8
1b30d0ff-47a0-11ed-aedd-7cd30abc95d8
1b30d0ff-47a0-11ed-aedd-7cd30abc95d8
1b30d0ff-47a0-11ed-aedd-7cd30abc95d8
1b30d0ff-47a0-11ed-aedd-7cd30abc95d8
1b30d0ff-47a0-11ed-aedd-7cd30abc95d8
1b30d0ff-47a0-11ed-aedd-7cd30abc95d8
1b30d0ff-47a0-11ed-aedd-7cd30abc95d8
1b30d0ff-47a0-11ed-aedd-7cd30abc95d8
1b30d0ff-47a0-11ed-aedd-7cd30abc95d8
1b30d0ff-47a0-11ed-aedd-7cd30abc95d8
1b30d0ff-47a0-11ed-aedd-7cd30abc95d8
1b30d0ff-47a0-11ed-aedd-7cd30abc95d8
1b30d0ff-47a0-11ed-aedd-7cd30abc95d8
1b30d0ff-47a0-11ed-aedd-7cd30abc95d8
1b30d0ff-47a0-11ed-aedd-7cd30abc95d8
1b30d0ff-47a0-11ed-aedd-7cd30abc95d8
1b30d0ff-47a0-11ed-aedd-7cd30abc95d8
1b30d0ff-47a0-11ed-aedd-7cd30abc95d8
1b30d0ff-47a0-11ed-aedd-7cd30abc95d8
1b30d0ff-47a0-11ed-aedd-7cd30abc95d8
1b30d0ff-47a0-11ed-aedd-7cd30abc95d8
1b30d0ff-47a0-11ed-aedd-7cd30abc95d8
1b30d0ff-47a0-11ed-aedd-7cd30abc95d8
1b30d0ff-47a0-11ed-aedd-7cd30abc95d8
1b30d0ff-47a0-11ed-aedd-7cd30abc95d8
1b30d0ff-47a0-11ed-aedd-7cd30abc95d8
1b30d0ff-47a0-11ed-aedd-7cd30abc95d8
1b30d0ff-47a0-11ed-aedd-7cd30abc95d8
1b30d0ff-47a0-11ed-aedd-7cd30abc95d8
1b30d0ff-47a0-11ed-aedd-7cd30abc95d8
1b30d0ff-47a0-11ed-aedd-7cd30abc95d8
1b30d0ff-47a0-11ed-aedd-7cd30abc95d8
1b30d0ff-47a0-11ed-aedd-7cd30abc95d8
1b30d0ff-47a0-11ed-aedd-7cd30abc95d8
1b30d0ff-47a0-11ed-aedd-7cd30abc95d8
1b30d0ff-47a0-11ed-aedd-7cd30abc95d8
1b30d0ff-47a0-11ed-aedd-7cd30abc95d8
1b30d0ff-47a0-11ed-aedd-7cd30abc95d8
1b30d0ff-47a0-11ed-aedd-7cd30abc95d8
1b30d0ff-47a0-11ed-aedd-7cd30abc95d8
1b30d0ff-47a0-11ed-aedd-7cd30abc95d8
1b30d0ff-47a0-11ed-aedd-7cd30abc95d8
1b30d0ff-47a0-11ed-aedd-7cd30abc95d8
1b30d0ff-47a0-11ed-aedd-7cd30abc95d8
1b30d0ff-47a0-11ed-aedd-7cd30abc95d8
1b30d0ff-47a0-11ed-aedd-7cd30abc95d8
1b30d0ff-47a0-11ed-aedd-7cd30abc95d8
1b30d0ff-47a0-11ed-aedd-7cd30abc95d8
1b30d0ff-47a0-11ed-aedd-7cd30abc95d8
1b30d0ff-47a0-11ed-aedd-7cd30abc95d8
1b30d0ff-47a0-11ed-aedd-7cd30abc95d8
1b30d0ff-47a0-11ed-aedd-7cd30abc95d8
1b30d0ff-47a0-11ed-aedd-7cd30abc95d8
1b30d0ff-47a0-11ed-aedd-7cd30abc95d8
1b30d0ff-47a0-11ed-aedd-7cd30abc95d8
1b30d0ff-47a0-11ed-aedd-7cd30abc95d8
1b30d0ff-47a0-11ed-aedd-7cd30abc95d8
1b30d0ff-47a0-11ed-aedd-7cd30abc95d8
1b30d0ff-47a0-11ed-aedd-7cd30abc95d8
1b30d0ff-47a0-11ed-aedd-7cd30abc95d8
1b30d0ff-47a0-11ed-aedd-7cd30abc95d8
1b30d0ff-47a0-11ed-aedd-7cd30abc95d8
1b30d0ff-47a0-11ed-aedd-7cd30abc95d8
1b30d0ff-47a0-11ed-aedd-7cd30abc95d8
1b30d0ff-47a0-11ed-aedd-7cd30abc95d8
1b30d0ff-47a0-11ed-aedd-7cd30abc95d8
1b30d0ff-47a0-11ed-aedd-7cd30abc95d8
1b30d0ff-47a0-11ed-aedd-7cd30abc95d8
1b30d0ff-47a0-11ed-aedd-7cd30abc95d8
1b30d0ff-47a0-11ed-aedd-7cd30abc95d8
1b30d0ff-47a0-11ed-aedd-7cd30abc95d8
1b30d0ff-47a0-11ed-aedd-7cd30abc95d8
1b30d0ff-47a0-11ed-aedd-7cd30abc95d8
1b30d0ff-47a0-11ed-aedd-7cd30abc95d8
1b30d0ff-47a0-11ed-aedd-7cd30abc95d8
1b30d0ff-47a0-11ed-aedd-7cd30abc95d8
1b30d0ff-47a0-11ed-aedd-7cd30abc95d8
1b30d0ff-47a0-11ed-aedd-7cd30abc95d8
1b30d0ff-47a0-11ed-aedd-7cd30abc95d8
1b30d0ff-47a0-11ed-aedd-7cd30abc95d8
1b30d0ff-47a0-11ed-aedd-7cd30abc95d8
1b30d0ff-47a0-11ed-aedd-7cd30abc95d8
1b30d0ff-47a0-11ed-aedd-7cd30abc95d8
1b30d0ff-47a0-11ed-aedd-7cd30abc95d8
1b30d0ff-47a0-11ed-aedd-7cd30abc95d8
1b30d0ff-47a0-11ed-aedd-7cd30abc95d8
1b30d0ff-47a0-11ed-aedd-7cd30abc95d8
1b30d0ff-47a0-11ed-aedd-7cd30abc95d8
1b30d0ff-47a0-11ed-aedd-7cd30abc95d8
1b30d0ff-47a0-11ed-aedd-7cd30abc95d8
1b30d0ff-47a0-11ed-aedd-7cd30abc95d8
1b30d0ff-47a0-11ed-aedd-7cd30abc95d8
1b30d0ff-47a0-11ed-aedd-7cd30abc95d8
1b30d0ff-47a0-11ed-aedd-7cd30abc95d8
1b30d0ff-47a0-11ed-aedd-7cd30abc95d8
1b30d0ff-47a0-11ed-aedd-7cd30abc95d8
1b30d0ff-47a0-11ed-aedd-7cd30abc95d8
1b30d0ff-47a0-11ed-aedd-7cd30abc95d8
1b30d0ff-47a0-11ed-aedd-7cd30abc95d8
1b30d0ff-47a0-11ed-aedd-7cd30abc95d8
1b30d0ff-47a0-11ed-aedd-7cd30abc95d8
1b30d0ff-47a0-11ed-aedd-7cd30abc95d8
1b30d0ff-47a0-11ed-aedd-7cd30abc95d8
1b30d0ff-47a0-11ed-aedd-7cd30abc95d8
1b30d0ff-47a0-11ed-aedd-7cd30abc95d8
1b30d0ff-47a0-11ed-aedd-7cd30abc95d8
1b30d0ff-47a0-11ed-aedd-7cd30abc95d8
1b30d0ff-47a0-11ed-aedd-7cd30abc95d8
1b30d0ff-47a0-11ed-aedd-7cd30abc95d8
1b30d0ff-47a0-11ed-aedd-7cd30abc95d8
1b30d0ff-47a0-11ed-aedd-7cd30abc95d8
1b30d0ff-47a0-11ed-aedd-7cd30abc95d8
1b30d0ff-47a0-11ed-aedd-7cd30abc95d8
1b30d0ff-47a0-11ed-aedd-7cd30abc95d8
1b30d0ff-47a0-11ed-aedd-7cd30abc95d8
1b30d0ff-47a0-11ed-aedd-7cd30abc95d8
1b30d0ff-47a0-11ed-aedd-7cd30abc95d8
1b30d0ff-47a0-11ed-aedd-7cd30abc95d8
1b30d0ff-47a0-11ed-aedd-7cd30abc95d8
1b30d0ff-47a0-11ed-aedd-7cd30abc95d8
1b30d0ff-47a0-11ed-aedd-7cd30abc95d8
1b30d0ff-47a0-11ed-aedd-7cd30abc95d8
1b30d0ff-47a0-11ed-aedd-7cd30abc95d8
1b30d0ff-47a0-11ed-aedd-7cd30abc95d8
1b30d0ff-47a0-11ed-aedd-7cd30abc95d8
1b30d0ff-47a0-11ed-aedd-7cd30abc95d8
1b30d0ff-47a0-11ed-aedd-7cd30abc95d8
1b30d0ff-47a0-11ed-aedd-7cd30abc95d8
1b30d0ff-47a0-11ed-aedd-7cd30abc95d8
1b30d0ff-47a0-11ed-aedd-7cd30abc95d8
1b30d0ff-47a0-11ed-aedd-7cd30abc95d8
1b30d0ff-47a0-11ed-aedd-7cd30abc95d8
1b30d0ff-47a0-11ed-aedd-7cd30abc95d8
1b30d0ff-47a0-11ed-aedd-7cd30abc95d8
1b30d0ff-47a0-11ed-aedd-7cd30abc95d8
1b30d0ff-47a0-11ed-aedd-7cd30abc95d8
1b30d0ff-47a0-11ed-aedd-7cd30abc95d8
1b30d0ff-47a0-11ed-aedd-7cd30abc95d8
1b30d0ff-47a0-11ed-aedd-7cd30abc95d8
1b30d0ff-47a0-11ed-aedd-7cd30abc95d8
1b30d0ff-47a0-11ed-aedd-7cd30abc95d8
1b30d0ff-47a0-11ed-aedd-7cd30abc95d8
1b30d0ff-47a0-11ed-aedd-7cd30abc95d8
1b30d0ff-47a0-11ed-aedd-7cd30abc95d8
1b30d0ff-47a0-11ed-aedd-7cd30abc95d8
1b30d0ff-47a0-11ed-aedd-7cd30abc95d8
1b30d0ff-47a0-11ed-aedd-7cd30abc95d8
1b30d0ff-47a0-11ed-aedd-7cd30abc95d8
1b30d0ff-47a0-11ed-aedd-7cd30abc95d8
1b30d0ff-47a0-11ed-aedd-7cd30abc95d8
1b30d0ff-47a0-11ed-aedd-7cd30abc95d8
1b30d0ff-47a0-11ed-aedd-7cd30abc95d8
1b30d0ff-47a0-11ed-aedd-7cd30abc95d8
1b30d0ff-47a0-11ed-aedd-7cd30abc95d8
1b30d0ff-47a0-11ed-aedd-7cd30abc95d8
1b30d0ff-47a0-11ed-aedd-7cd30abc95d8
1b30d0ff-47a0-11ed-aedd-7cd30abc95d8
1b30d0ff-47a0-11ed-aedd-7cd30abc95d8
1b30d0ff-47a0-11ed-aedd-7cd30abc95d8
1b30d0ff-47a0-11ed-aedd-7cd30abc95d8
1b30d0ff-47a0-11ed-aedd-7cd30abc95d8
1b30d0ff-47a0-11ed-aedd-7cd30abc95d8
1b30d0ff-47a0-11ed-aedd-7cd30abc95d8
1b30d0ff-47a0-11ed-aedd-7cd30abc95d8
1b30d0ff-47a0-11ed-aedd-7cd30abc95d8
1b30d0ff-47a0-11ed-aedd-7cd30abc95d8
1b30d0ff-47a0-11ed-aedd-7cd30abc95d8
1b30d0ff-47a0-11ed-aedd-7cd30abc95d8
1b30d0ff-47a0-11ed-aedd-7cd30abc95d8
1b30d0ff-47a0-11ed-aedd-7cd30abc95d8
1b30d0ff-47a0-11ed-aedd-7cd30abc95d8
1b30d0ff-47a0-11ed-aedd-7cd30abc95d8
1b30d0ff-47a0-11ed-aedd-7cd30abc95d8
1b30d0ff-47a0-11ed-aedd-7cd30abc95d8
1b30d0ff-47a0-11ed-aedd-7cd30abc95d8
1b30d0ff-47a0-11ed-aedd-7cd30abc95d8
1b30d0ff-47a0-11ed-aedd-7cd30abc95d8
1b30d0ff-47a0-11ed-aedd-7cd30abc95d8
1b30d0ff-47a0-11ed-aedd-7cd30abc95d8
1b30d0ff-47a0-11ed-aedd-7cd30abc95d8
1b30d0ff-47a0-11ed-aedd-7cd30abc95d8
1b30d0ff-47a0-11ed-aedd-7cd30abc95d8
1b30d0ff-47a0-11ed-aedd-7cd30abc95d8
1b30d0ff-47a0-11ed-aedd-7cd30abc95d8
1b30d0ff-47a0-11ed-aedd-7cd30abc95d8
1b30d0ff-47a0-11ed-aedd-7cd30abc95d8
1b30d0ff-47a0-11ed-aedd-7cd30abc95d8
1b30d0ff-47a0-11ed-aedd-7cd30abc95d8
1b30d0ff-47a0-11ed-aedd-7cd30abc95d8
1b30d0ff-47a0-11ed-aedd-7cd30abc95d8
1b30d0ff-47a0-11ed-aedd-7cd30abc95d8
1b30d0ff-47a0-11ed-aedd-7cd30abc95d8
1b30d0ff-47a0-11ed-aedd-7cd30abc95d8
1b30d0ff-47a0-11ed-aedd-7cd30abc95d8
1b30d0ff-47a0-11ed-aedd-7cd30abc95d8
1b30d0ff-47a0-11ed-aedd-7cd30abc95d8
1b30d0ff-47a0-11ed-aedd-7cd30abc95d8
1b30d0ff-47a0-11ed-aedd-7cd30abc95d8
1b30d0ff-47a0-11ed-aedd-7cd30abc95d8
1b30d0ff-47a0-11ed-aedd-7cd30abc95d8
1b30d0ff-47a0-11ed-aedd-7cd30abc95d8
1b30d0ff-47a0-11ed-aedd-7cd30abc95d8
1b30d0ff-47a0-11ed-aedd-7cd30abc95d8
1b30d0ff-47a0-11ed-aedd-7cd30abc95d8
1b30d0ff-47a0-11ed-aedd-7cd30abc95d8
1b30d0ff-47a0-11ed-aedd-7cd30abc95d8
1b30d0ff-47a0-11ed-aedd-7cd30abc95d8
1b30d0ff-47a0-11ed-aedd-7cd30abc95d8
1b30d0ff-47a0-11ed-aedd-7cd30abc95d8
1b30d0ff-47a0-11ed-aedd-7cd30abc95d8
1b30d0ff-47a0-11ed-aedd-7cd30abc95d8
1b30d0ff-47a0-11ed-aedd-7cd30abc95d8
1b30d0ff-47a0-11ed-aedd-7cd30abc95d8
1b30d0ff-47a0-11ed-aedd-7cd30abc95d8
1b30d0ff-47a0-11ed-aedd-7cd30abc95d8
1b30d0ff-47a0-11ed-aedd-7cd30abc95d8
1b30d0ff-47a0-11ed-aedd-7cd30abc95d8
1b30d0ff-47a0-11ed-aedd-7cd30abc95d8
1b30d0ff-47a0-11ed-aedd-7cd30abc95d8
1b30d0ff-47a0-11ed-aedd-7cd30abc95d8
1b30d0ff-47a0-11ed-aedd-7cd30abc95d8
1b30d0ff-47a0-11ed-aedd-7cd30abc95d8
1b30d0ff-47a0-11ed-aedd-7cd30abc95d8
1b30d0ff-47a0-11ed-aedd-7cd30abc95d8
1b30d0ff-47a0-11ed-aedd-7cd30abc95d8
1b30d0ff-47a0-11ed-aedd-7cd30abc95d8
1b30d0ff-47a0-11ed-aedd-7cd30abc95d8
1b30d0ff-47a0-11ed-aedd-7cd30abc95d8
1b30d0ff-47a0-11ed-aedd-7cd30abc95d8
1b30d0ff-47a0-11ed-aedd-7cd30abc95d8
1b30d0ff-47a0-11ed-aedd-7cd30abc95d8
1b30d0ff-47a0-11ed-aedd-7cd30abc95d8
1b30d0ff-47a0-11ed-aedd-7cd30abc95d8
1b30d0ff-47a0-11ed-aedd-7cd30abc95d8
1b30d0ff-47a0-11ed-aedd-7cd30abc95d8
1b30d0ff-47a0-11ed-aedd-7cd30abc95d8
1b30d0ff-47a0-11ed-aedd-7cd30abc95d8
1b30d0ff-47a0-11ed-aedd-7cd30abc95d8
1b30d0ff-47a0-11ed-aedd-7cd30abc95d8
1b30d0ff-47a0-11ed-aedd-7cd30abc95d8
1b30d0ff-47a0-11ed-aedd-7cd30abc95d8
1b30d0ff-47a0-11ed-aedd-7cd30abc95d8
1b30d0ff-47a0-11ed-aedd-7cd30abc95d8
1b30d0ff-47a0-11ed-aedd-7cd30abc95d8
1b30d0ff-47a0-11ed-aedd-7cd30abc95d8
1b30d0ff-47a0-11ed-aedd-7cd30abc95d8
1b30d0ff-47a0-11ed-aedd-7cd30abc95d8
1b30d0ff-47a0-11ed-aedd-7cd30abc95d8
1b30d0ff-47a0-11ed-aedd-7cd30abc95d8
1b30d0ff-47a0-11ed-aedd-7cd30abc95d8
1b30d0ff-47a0-11ed-aedd-7cd30abc95d8
1b30d0ff-47a0-11ed-aedd-7cd30abc95d8
1b30d0ff-47a0-11ed-aedd-7cd30abc95d8
1b30d0ff-47a0-11ed-aedd-7cd30abc95d8
1b30d0ff-47a0-11ed-aedd-7cd30abc95d8
1b30d0ff-47a0-11ed-aedd-7cd30abc95d8
1b30d0ff-47a0-11ed-aedd-7cd30abc95d8
1b30d0ff-47a0-11ed-aedd-7cd30abc95d8
1b30d0ff-47a0-11ed-aedd-7cd30abc95d8
1b30d0ff-47a0-11ed-aedd-7cd30abc95d8
1b30d0ff-47a0-11ed-aedd-7cd30abc95d8
1b30d0ff-47a0-11ed-aedd-7cd30abc95d8
1b30d0ff-47a0-11ed-aedd-7cd30abc95d8
1b30d0ff-47a0-11ed-aedd-7cd30abc95d8
1b30d0ff-47a0-11ed-aedd-7cd30abc95d8
1b30d0ff-47a0-11ed-aedd-7cd30abc95d8
1b30d0ff-47a0-11ed-aedd-7cd30abc95d8
1b30d0ff-47a0-11ed-aedd-7cd30abc95d8
1b30d0ff-47a0-11ed-aedd-7cd30abc95d8
1b30d0ff-47a0-11ed-aedd-7cd30abc95d8
1b30d0ff-47a0-11ed-aedd-7cd30abc95d8
1b30d0ff-47a0-11ed-aedd-7cd30abc95d8
1b30d0ff-47a0-11ed-aedd-7cd30abc95d8
1b30d0ff-47a0-11ed-aedd-7cd30abc95d8
1b30d0ff-47a0-11ed-aedd-7cd30abc95d8
1b30d0ff-47a0-11ed-aedd-7cd30abc95d8
1b30d0ff-47a0-11ed-aedd-7cd30abc95d8
1b30d0ff-47a0-11ed-aedd-7cd30abc95d8
1b30d0ff-47a0-11ed-aedd-7cd30abc95d8
1b30d0ff-47a0-11ed-aedd-7cd30abc95d8
1b30d0ff-47a0-11ed-aedd-7cd30abc95d8
1b30d0ff-47a0-11ed-aedd-7cd30abc95d8
1b30d0ff-47a0-11ed-aedd-7cd30abc95d8
1b30d0ff-47a0-11ed-aedd-7cd30abc95d8
1b30d0ff-47a0-11ed-aedd-7cd30abc95d8
1b30d0ff-47a0-11ed-aedd-7cd30abc95d8
1b30d0ff-47a0-11ed-aedd-7cd30abc95d8
1b30d0ff-47a0-11ed-aedd-7cd30abc95d8
1b30d0ff-47a0-11ed-aedd-7cd30abc95d8
1b30d0ff-47a0-11ed-aedd-7cd30abc95d8
1b30d0ff-47a0-11ed-aedd-7cd30abc95d8
1b30d0ff-47a0-11ed-aedd-7cd30abc95d8
1b30d0ff-47a0-11ed-aedd-7cd30abc95d8
1b30d0ff-47a0-11ed-aedd-7cd30abc95d8
1b30d0ff-47a0-11ed-aedd-7cd30abc95d8
1b30d0ff-47a0-11ed-aedd-7cd30abc95d8
1b30d0ff-47a0-11ed-aedd-7cd30abc95d8
1b30d0ff-47a0-11ed-aedd-7cd30abc95d8
1b30d0ff-47a0-11ed-aedd-7cd30abc95d8
1b30d0ff-47a0-11ed-aedd-7cd30abc95d8
1b30d0ff-47a0-11ed-aedd-7cd30abc95d8
1b30d0ff-47a0-11ed-aedd-7cd30abc95d8
1b30d0ff-47a0-11ed-aedd-7cd30abc95d8
1b30d0ff-47a0-11ed-aedd-7cd30abc95d8
1b30d0ff-47a0-11ed-aedd-7cd30abc95d8
1b30d0ff-47a0-11ed-aedd-7cd30abc95d8
1b30d0ff-47a0-11ed-aedd-7cd30abc95d8
1b30d0ff-47a0-11ed-aedd-7cd30abc95d8
1b30d0ff-47a0-11ed-aedd-7cd30abc95d8
1b30d0ff-47a0-11ed-aedd-7cd30abc95d8
1b30d0ff-47a0-11ed-aedd-7cd30abc95d8
1b30d0ff-47a0-11ed-aedd-7cd30abc95d8
1b30d0ff-47a0-11ed-aedd-7cd30abc95d8
1b30d0ff-47a0-11ed-aedd-7cd30abc95d8
1b30d0ff-47a0-11ed-aedd-7cd30abc95d8
1b30d0ff-47a0-11ed-aedd-7cd30abc95d8
1b30d0ff-47a0-11ed-aedd-7cd30abc95d8
1b30d0ff-47a0-11ed-aedd-7cd30abc95d8
1b30d0ff-47a0-11ed-aedd-7cd30abc95d8
1b30d0ff-47a0-11ed-aedd-7cd30abc95d8
1b30d0ff-47a0-11ed-aedd-7cd30abc95d8
1b30d0ff-47a0-11ed-aedd-7cd30abc95d8
1b30d0ff-47a0-11ed-aedd-7cd30abc95d8
1b30d0ff-47a0-11ed-aedd-7cd30abc95d8
1b30d0ff-47a0-11ed-aedd-7cd30abc95d8
1b30d0ff-47a0-11ed-aedd-7cd30abc95d8
1b30d0ff-47a0-11ed-aedd-7cd30abc95d8
1b30d0ff-47a0-11ed-aedd-7cd30abc95d8
1b30d0ff-47a0-11ed-aedd-7cd30abc95d8
1b30d0ff-47a0-11ed-aedd-7cd30abc95d8
1b30d0ff-47a0-11ed-aedd-7cd30abc95d8
1b30d0ff-47a0-11ed-aedd-7cd30abc95d8
1b30d0ff-47a0-11ed-aedd-7cd30abc95d8
1b30d0ff-47a0-11ed-aedd-7cd30abc95d8
1b30d0ff-47a0-11ed-aedd-7cd30abc95d8
1b30d0ff-47a0-11ed-aedd-7cd30abc95d8
1b30d0ff-47a0-11ed-aedd-7cd30abc95d8
1b30d0ff-47a0-11ed-aedd-7cd30abc95d8
1b30d0ff-47a0-11ed-aedd-7cd30abc95d8
1b30d0ff-47a0-11ed-aedd-7cd30abc95d8
1b30d0ff-47a0-11ed-aedd-7cd30abc95d8
1b30d0ff-47a0-11ed-aedd-7cd30abc95d8
1b30d0ff-47a0-11ed-aedd-7cd30abc95d8
1b30d0ff-47a0-11ed-aedd-7cd30abc95d8
1b30d0ff-47a0-11ed-aedd-7cd30abc95d8
1b30d0ff-47a0-11ed-aedd-7cd30abc95d8
1b30d0ff-47a0-11ed-aedd-7cd30abc95d8
1b30d0ff-47a0-11ed-aedd-7cd30abc95d8
1b30d0ff-47a0-11ed-aedd-7cd30abc95d8
1b30d0ff-47a0-11ed-aedd-7cd30abc95d8
1b30d0ff-47a0-11ed-aedd-7cd30abc95d8
1b30d0ff-47a0-11ed-aedd-7cd30abc95d8
1b30d0ff-47a0-11ed-aedd-7cd30abc95d8
1b30d0ff-47a0-11ed-aedd-7cd30abc95d8
1b30d0ff-47a0-11ed-aedd-7cd30abc95d8
1b30d0ff-47a0-11ed-aedd-7cd30abc95d8
1b30d0ff-47a0-11ed-aedd-7cd30abc95d8
1b30d0ff-47a0-11ed-aedd-7cd30abc95d8
1b30d0ff-47a0-11ed-aedd-7cd30abc95d8
1b30d0ff-47a0-11ed-aedd-7cd30abc95d8
1b30d0ff-47a0-11ed-aedd-7cd30abc95d8
1b30d0ff-47a0-11ed-aedd-7cd30abc95d8
1b30d0ff-47a0-11ed-aedd-7cd30abc95d8
1b30d0ff-47a0-11ed-aedd-7cd30abc95d8
1b30d0ff-47a0-11ed-aedd-7cd30abc95d8
1b30d0ff-47a0-11ed-aedd-7cd30abc95d8
1b30d0ff-47a0-11ed-aedd-7cd30abc95d8
1b30d0ff-47a0-11ed-aedd-7cd30abc95d8
1b30d0ff-47a0-11ed-aedd-7cd30abc95d8
1b30d0ff-47a0-11ed-aedd-7cd30abc95d8
1b30d0ff-47a0-11ed-aedd-7cd30abc95d8
1b30d0ff-47a0-11ed-aedd-7cd30abc95d8
1b30d0ff-47a0-11ed-aedd-7cd30abc95d8
1b30d0ff-47a0-11ed-aedd-7cd30abc95d8
1b30d0ff-47a0-11ed-aedd-7cd30abc95d8
1b30d0ff-47a0-11ed-aedd-7cd30abc95d8
1b30d0ff-47a0-11ed-aedd-7cd30abc95d8
1b30d0ff-47a0-11ed-aedd-7cd30abc95d8
1b30d0ff-47a0-11ed-aedd-7cd30abc95d8
1b30d0ff-47a0-11ed-aedd-7cd30abc95d8
1b30d0ff-47a0-11ed-aedd-7cd30abc95d8
1b30d0ff-47a0-11ed-aedd-7cd30abc95d8
1b30d0ff-47a0-11ed-aedd-7cd30abc95d8
1b30d0ff-47a0-11ed-aedd-7cd30abc95d8
1b30d0ff-47a0-11ed-aedd-7cd30abc95d8
1b30d0ff-47a0-11ed-aedd-7cd30abc95d8
1b30d0ff-47a0-11ed-aedd-7cd30abc95d8
1b30d0ff-47a0-11ed-aedd-7cd30abc95d8
1b30d0ff-47a0-11ed-aedd-7cd30abc95d8
1b30d0ff-47a0-11ed-aedd-7cd30abc95d8
1b30d0ff-47a0-11ed-aedd-7cd30abc95d8
1b30d0ff-47a0-11ed-aedd-7cd30abc95d8
1b30d0ff-47a0-11ed-aedd-7cd30abc95d8
1b30d0ff-47a0-11ed-aedd-7cd30abc95d8
1b30d0ff-47a0-11ed-aedd-7cd30abc95d8
1b30d0ff-47a0-11ed-aedd-7cd30abc95d8
1b30d0ff-47a0-11ed-aedd-7cd30abc95d8
1b30d0ff-47a0-11ed-aedd-7cd30abc95d8
1b30d0ff-47a0-11ed-aedd-7cd30abc95d8
1b30d0ff-47a0-11ed-aedd-7cd30abc95d8
1b30d0ff-47a0-11ed-aedd-7cd30abc95d8
1b30d0ff-47a0-11ed-aedd-7cd30abc95d8
1b30d0ff-47a0-11ed-aedd-7cd30abc95d8
1b30d0ff-47a0-11ed-aedd-7cd30abc95d8
1b30d0ff-47a0-11ed-aedd-7cd30abc95d8
1b30d0ff-47a0-11ed-aedd-7cd30abc95d8
1b30d0ff-47a0-11ed-aedd-7cd30abc95d8
1b30d0ff-47a0-11ed-aedd-7cd30abc95d8
1b30d0ff-47a0-11ed-aedd-7cd30abc95d8
1b30d0ff-47a0-11ed-aedd-7cd30abc95d8
1b30d0ff-47a0-11ed-aedd-7cd30abc95d8
1b30d0ff-47a0-11ed-aedd-7cd30abc95d8
1b30d0ff-47a0-11ed-aedd-7cd30abc95d8
1b30d0ff-47a0-11ed-aedd-7cd30abc95d8
1b30d0ff-47a0-11ed-aedd-7cd30abc95d8
1b30d0ff-47a0-11ed-aedd-7cd30abc95d8
1b30d0ff-47a0-11ed-aedd-7cd30abc95d8
1b30d0ff-47a0-11ed-aedd-7cd30abc95d8
1b30d0ff-47a0-11ed-aedd-7cd30abc95d8
1b30d0ff-47a0-11ed-aedd-7cd30abc95d8
1b30d0ff-47a0-11ed-aedd-7cd30abc95d8
1b30d0ff-47a0-11ed-aedd-7cd30abc95d8
1b30d0ff-47a0-11ed-aedd-7cd30abc95d8
1b30d0ff-47a0-11ed-aedd-7cd30abc95d8
1b30d0ff-47a0-11ed-aedd-7cd30abc95d8
1b30d0ff-47a0-11ed-aedd-7cd30abc95d8
1b30d0ff-47a0-11ed-aedd-7cd30abc95d8
1b30d0ff-47a0-11ed-aedd-7cd30abc95d8
1b30d0ff-47a0-11ed-aedd-7cd30abc95d8
1b30d0ff-47a0-11ed-aedd-7cd30abc95d8
1b30d0ff-47a0-11ed-aedd-7cd30abc95d8
1b30d0ff-47a0-11ed-aedd-7cd30abc95d8
1b30d0ff-47a0-11ed-aedd-7cd30abc95d8
1b30d0ff-47a0-11ed-aedd-7cd30abc95d8
1b30d0ff-47a0-11ed-aedd-7cd30abc95d8
1b30d0ff-47a0-11ed-aedd-7cd30abc95d8
1b30d0ff-47a0-11ed-aedd-7cd30abc95d8
1b30d0ff-47a0-11ed-aedd-7cd30abc95d8
1b30d0ff-47a0-11ed-aedd-7cd30abc95d8
1b30d0ff-47a0-11ed-aedd-7cd30abc95d8
1b30d0ff-47a0-11ed-aedd-7cd30abc95d8
1b30d0ff-47a0-11ed-aedd-7cd30abc95d8
1b30d0ff-47a0-11ed-aedd-7cd30abc95d8
1b30d0ff-47a0-11ed-aedd-7cd30abc95d8
1b30d0ff-47a0-11ed-aedd-7cd30abc95d8
1b30d0ff-47a0-11ed-aedd-7cd30abc95d8
1b30d0ff-47a0-11ed-aedd-7cd30abc95d8
1b30d0ff-47a0-11ed-aedd-7cd30abc95d8
1b30d0ff-47a0-11ed-aedd-7cd30abc95d8
1b30d0ff-47a0-11ed-aedd-7cd30abc95d8
1b30d0ff-47a0-11ed-aedd-7cd30abc95d8
1b30d0ff-47a0-11ed-aedd-7cd30abc95d8
1b30d0ff-47a0-11ed-aedd-7cd30abc95d8
1b30d0ff-47a0-11ed-aedd-7cd30abc95d8
1b30d0ff-47a0-11ed-aedd-7cd30abc95d8
1b30d0ff-47a0-11ed-aedd-7cd30abc95d8
1b30d0ff-47a0-11ed-aedd-7cd30abc95d8
1b30d0ff-47a0-11ed-aedd-7cd30abc95d8
1b30d0ff-47a0-11ed-aedd-7cd30abc95d8
1b30d0ff-47a0-11ed-aedd-7cd30abc95d8
1b30d0ff-47a0-11ed-aedd-7cd30abc95d8
1b30d0ff-47a0-11ed-aedd-7cd30abc95d8
1b30d0ff-47a0-11ed-aedd-7cd30abc95d8
1b30d0ff-47a0-11ed-aedd-7cd30abc95d8
1b30d0ff-47a0-11ed-aedd-7cd30abc95d8
1b30d0ff-47a0-11ed-aedd-7cd30abc95d8
1b30d0ff-47a0-11ed-aedd-7cd30abc95d8
1b30d0ff-47a0-11ed-aedd-7cd30abc95d8
1b30d0ff-47a0-11ed-aedd-7cd30abc95d8
1b30d0ff-47a0-11ed-aedd-7cd30abc95d8
1b30d0ff-47a0-11ed-aedd-7cd30abc95d8
1b30d0ff-47a0-11ed-aedd-7cd30abc95d8
1b30d0ff-47a0-11ed-aedd-7cd30abc95d8
1b30d0ff-47a0-11ed-aedd-7cd30abc95d8
1b30d0ff-47a0-11ed-aedd-7cd30abc95d8
1b30d0ff-47a0-11ed-aedd-7cd30abc95d8
1b30d0ff-47a0-11ed-aedd-7cd30abc95d8
1b30d0ff-47a0-11ed-aedd-7cd30abc95d8
1b30d0ff-47a0-11ed-aedd-7cd30abc95d8
1b30d0ff-47a0-11ed-aedd-7cd30abc95d8
1b30d0ff-47a0-11ed-aedd-7cd30abc95d8
1b30d0ff-47a0-11ed-aedd-7cd30abc95d8
1b30d0ff-47a0-11ed-aedd-7cd30abc95d8
1b30d0ff-47a0-11ed-aedd-7cd30abc95d8
1b30d0ff-47a0-11ed-aedd-7cd30abc95d8
1b30d0ff-47a0-11ed-aedd-7cd30abc95d8
1b30d0ff-47a0-11ed-aedd-7cd30abc95d8
1b30d0ff-47a0-11ed-aedd-7cd30abc95d8
1b30d0ff-47a0-11ed-aedd-7cd30abc95d8
1b30d0ff-47a0-11ed-aedd-7cd30abc95d8
1b30d0ff-47a0-11ed-aedd-7cd30abc95d8
1b30d0ff-47a0-11ed-aedd-7cd30abc95d8
1b30d0ff-47a0-11ed-aedd-7cd30abc95d8
1b30d0ff-47a0-11ed-aedd-7cd30abc95d8
1b30d0ff-47a0-11ed-aedd-7cd30abc95d8
1b30d0ff-47a0-11ed-aedd-7cd30abc95d8
1b30d0ff-47a0-11ed-aedd-7cd30abc95d8
1b30d0ff-47a0-11ed-aedd-7cd30abc95d8
1b30d0ff-47a0-11ed-aedd-7cd30abc95d8
1b30d0ff-47a0-11ed-aedd-7cd30abc95d8
1b30d0ff-47a0-11ed-aedd-7cd30abc95d8
1b30d0ff-47a0-11ed-aedd-7cd30abc95d8
1b30d0ff-47a0-11ed-aedd-7cd30abc95d8
1b30d0ff-47a0-11ed-aedd-7cd30abc95d8
1b30d0ff-47a0-11ed-aedd-7cd30abc95d8
1b30d0ff-47a0-11ed-aedd-7cd30abc95d8
1b30d0ff-47a0-11ed-aedd-7cd30abc95d8
1b30d0ff-47a0-11ed-aedd-7cd30abc95d8
1b30d0ff-47a0-11ed-aedd-7cd30abc95d8
1b30d0ff-47a0-11ed-aedd-7cd30abc95d8
1b30d0ff-47a0-11ed-aedd-7cd30abc95d8
1b30d0ff-47a0-11ed-aedd-7cd30abc95d8
1b30d0ff-47a0-11ed-aedd-7cd30abc95d8
1b30d0ff-47a0-11ed-aedd-7cd30abc95d8
1b30d0ff-47a0-11ed-aedd-7cd30abc95d8
1b30d0ff-47a0-11ed-aedd-7cd30abc95d8
1b30d0ff-47a0-11ed-aedd-7cd30abc95d8
1b30d0ff-47a0-11ed-aedd-7cd30abc95d8
1b30d0ff-47a0-11ed-aedd-7cd30abc95d8
1b30d0ff-47a0-11ed-aedd-7cd30abc95d8
1b30d0ff-47a0-11ed-aedd-7cd30abc95d8
1b30d0ff-47a0-11ed-aedd-7cd30abc95d8
1b30d0ff-47a0-11ed-aedd-7cd30abc95d8
1b30d0ff-47a0-11ed-aedd-7cd30abc95d8
1b30d0ff-47a0-11ed-aedd-7cd30abc95d8
1b30d0ff-47a0-11ed-aedd-7cd30abc95d8
1b30d0ff-47a0-11ed-aedd-7cd30abc95d8
1b30d0ff-47a0-11ed-aedd-7cd30abc95d8
1b30d0ff-47a0-11ed-aedd-7cd30abc95d8
1b30d0ff-47a0-11ed-aedd-7cd30abc95d8
1b30d0ff-47a0-11ed-aedd-7cd30abc95d8
1b30d0ff-47a0-11ed-aedd-7cd30abc95d8
1b30d0ff-47a0-11ed-aedd-7cd30abc95d8
1b30d0ff-47a0-11ed-aedd-7cd30abc95d8
1b30d0ff-47a0-11ed-aedd-7cd30abc95d8
1b30d0ff-47a0-11ed-aedd-7cd30abc95d8
1b30d0ff-47a0-11ed-aedd-7cd30abc95d8
1b30d0ff-47a0-11ed-aedd-7cd30abc95d8
1b30d0ff-47a0-11ed-aedd-7cd30abc95d8
1b30d0ff-47a0-11ed-aedd-7cd30abc95d8
1b30d0ff-47a0-11ed-aedd-7cd30abc95d8
1b30d0ff-47a0-11ed-aedd-7cd30abc95d8
1b30d0ff-47a0-11ed-aedd-7cd30abc95d8
1b30d0ff-47a0-11ed-aedd-7cd30abc95d8
1b30d0ff-47a0-11ed-aedd-7cd30abc95d8
1b30d0ff-47a0-11ed-aedd-7cd30abc95d8
1b30d0ff-47a0-11ed-aedd-7cd30abc95d8
1b30d0ff-47a0-11ed-aedd-7cd30abc95d8
1b30d0ff-47a0-11ed-aedd-7cd30abc95d8
1b30d0ff-47a0-11ed-aedd-7cd30abc95d8
1b30d0ff-47a0-11ed-aedd-7cd30abc95d8
1b30d0ff-47a0-11ed-aedd-7cd30abc95d8
1b30d0ff-47a0-11ed-aedd-7cd30abc95d8
1b30d0ff-47a0-11ed-aedd-7cd30abc95d8
1b30d0ff-47a0-11ed-aedd-7cd30abc95d8
1b30d0ff-47a0-11ed-aedd-7cd30abc95d8
1b30d0ff-47a0-11ed-aedd-7cd30abc95d8
1b30d0ff-47a0-11ed-aedd-7cd30abc95d8
1b30d0ff-47a0-11ed-aedd-7cd30abc95d8
1b30d0ff-47a0-11ed-aedd-7cd30abc95d8
1b30d0ff-47a0-11ed-aedd-7cd30abc95d8
1b30d0ff-47a0-11ed-aedd-7cd30abc95d8
1b30d0ff-47a0-11ed-aedd-7cd30abc95d8
1b30d0ff-47a0-11ed-aedd-7cd30abc95d8
1b30d0ff-47a0-11ed-aedd-7cd30abc95d8
1b30d0ff-47a0-11ed-aedd-7cd30abc95d8
1b30d0ff-47a0-11ed-aedd-7cd30abc95d8
1b30d0ff-47a0-11ed-aedd-7cd30abc95d8
1b30d0ff-47a0-11ed-aedd-7cd30abc95d8
1b30d0ff-47a0-11ed-aedd-7cd30abc95d8
1b30d0ff-47a0-11ed-aedd-7cd30abc95d8
1b30d0ff-47a0-11ed-aedd-7cd30abc95d8
1b30d0ff-47a0-11ed-aedd-7cd30abc95d8
1b30d0ff-47a0-11ed-aedd-7cd30abc95d8
1b30d0ff-47a0-11ed-aedd-7cd30abc95d8
1b30d0ff-47a0-11ed-aedd-7cd30abc95d8
1b30d0ff-47a0-11ed-aedd-7cd30abc95d8
1b30d0ff-47a0-11ed-aedd-7cd30abc95d8
1b30d0ff-47a0-11ed-aedd-7cd30abc95d8
1b30d0ff-47a0-11ed-aedd-7cd30abc95d8
1b30d0ff-47a0-11ed-aedd-7cd30abc95d8
1b30d0ff-47a0-11ed-aedd-7cd30abc95d8
1b30d0ff-47a0-11ed-aedd-7cd30abc95d8
1b30d0ff-47a0-11ed-aedd-7cd30abc95d8
1b30d0ff-47a0-11ed-aedd-7cd30abc95d8
1b30d0ff-47a0-11ed-aedd-7cd30abc95d8
1b30d0ff-47a0-11ed-aedd-7cd30abc95d8
1b30d0ff-47a0-11ed-aedd-7cd30abc95d8
1b30d0ff-47a0-11ed-aedd-7cd30abc95d8
1b30d0ff-47a0-11ed-aedd-7cd30abc95d8
1b30d0ff-47a0-11ed-aedd-7cd30abc95d8
1b30d0ff-47a0-11ed-aedd-7cd30abc95d8
1b30d0ff-47a0-11ed-aedd-7cd30abc95d8
1b30d0ff-47a0-11ed-aedd-7cd30abc95d8
1b30d0ff-47a0-11ed-aedd-7cd30abc95d8
1b30d0ff-47a0-11ed-aedd-7cd30abc95d8
1b30d0ff-47a0-11ed-aedd-7cd30abc95d8
1b30d0ff-47a0-11ed-aedd-7cd30abc95d8
1b30d0ff-47a0-11ed-aedd-7cd30abc95d8
1b30d0ff-47a0-11ed-aedd-7cd30abc95d8
1b30d0ff-47a0-11ed-aedd-7cd30abc95d8
1b30d0ff-47a0-11ed-aedd-7cd30abc95d8
1b30d0ff-47a0-11ed-aedd-7cd30abc95d8
1b30d0ff-47a0-11ed-aedd-7cd30abc95d8
1b30d0ff-47a0-11ed-aedd-7cd30abc95d8
1b30d0ff-47a0-11ed-aedd-7cd30abc95d8
1b30d0ff-47a0-11ed-aedd-7cd30abc95d8
1b30d0ff-47a0-11ed-aedd-7cd30abc95d8
1b30d0ff-47a0-11ed-aedd-7cd30abc95d8
1b30d0ff-47a0-11ed-aedd-7cd30abc95d8
1b30d0ff-47a0-11ed-aedd-7cd30abc95d8
1b30d0ff-47a0-11ed-aedd-7cd30abc95d8
1b30d0ff-47a0-11ed-aedd-7cd30abc95d8
1b30d0ff-47a0-11ed-aedd-7cd30abc95d8
1b30d0ff-47a0-11ed-aedd-7cd30abc95d8
1b30d0ff-47a0-11ed-aedd-7cd30abc95d8
1b30d0ff-47a0-11ed-aedd-7cd30abc95d8
1b30d0ff-47a0-11ed-aedd-7cd30abc95d8
1b30d0ff-47a0-11ed-aedd-7cd30abc95d8
1b30d0ff-47a0-11ed-aedd-7cd30abc95d8
1b30d0ff-47a0-11ed-aedd-7cd30abc95d8
1b30d0ff-47a0-11ed-aedd-7cd30abc95d8
1b30d0ff-47a0-11ed-aedd-7cd30abc95d8
1b30d0ff-47a0-11ed-aedd-7cd30abc95d8
1b30d0ff-47a0-11ed-aedd-7cd30abc95d8
1b30d0ff-47a0-11ed-aedd-7cd30abc95d8
1b30d0ff-47a0-11ed-aedd-7cd30abc95d8
1b30d0ff-47a0-11ed-aedd-7cd30abc95d8
1b30d0ff-47a0-11ed-aedd-7cd30abc95d8
1b30d0ff-47a0-11ed-aedd-7cd30abc95d8
1b30d0ff-47a0-11ed-aedd-7cd30abc95d8
1b30d0ff-47a0-11ed-aedd-7cd30abc95d8
1b30d0ff-47a0-11ed-aedd-7cd30abc95d8
1b30d0ff-47a0-11ed-aedd-7cd30abc95d8
1b30d0ff-47a0-11ed-aedd-7cd30abc95d8
1b30d0ff-47a0-11ed-aedd-7cd30abc95d8
1b30d0ff-47a0-11ed-aedd-7cd30abc95d8
1b30d0ff-47a0-11ed-aedd-7cd30abc95d8
1b30d0ff-47a0-11ed-aedd-7cd30abc95d8
1b30d0ff-47a0-11ed-aedd-7cd30abc95d8
1b30d0ff-47a0-11ed-aedd-7cd30abc95d8
1b30d0ff-47a0-11ed-aedd-7cd30abc95d8
1b30d0ff-47a0-11ed-aedd-7cd30abc95d8
1b30d0ff-47a0-11ed-aedd-7cd30abc95d8
1b30d0ff-47a0-11ed-aedd-7cd30abc95d8
1b30d0ff-47a0-11ed-aedd-7cd30abc95d8
1b30d0ff-47a0-11ed-aedd-7cd30abc95d8
1b30d0ff-47a0-11ed-aedd-7cd30abc95d8
1b30d0ff-47a0-11ed-aedd-7cd30abc95d8
1b30d0ff-47a0-11ed-aedd-7cd30abc95d8
1b30d0ff-47a0-11ed-aedd-7cd30abc95d8
1b30d0ff-47a0-11ed-aedd-7cd30abc95d8
1b30d0ff-47a0-11ed-aedd-7cd30abc95d8
1b30d0ff-47a0-11ed-aedd-7cd30abc95d8
1b30d0ff-47a0-11ed-aedd-7cd30abc95d8
1b30d0ff-47a0-11ed-aedd-7cd30abc95d8
1b30d0ff-47a0-11ed-aedd-7cd30abc95d8
1b30d0ff-47a0-11ed-aedd-7cd30abc95d8
1b30d0ff-47a0-11ed-aedd-7cd30abc95d8
1b30d0ff-47a0-11ed-aedd-7cd30abc95d8
1b30d0ff-47a0-11ed-aedd-7cd30abc95d8
1b30d0ff-47a0-11ed-aedd-7cd30abc95d8
1b30d0ff-47a0-11ed-aedd-7cd30abc95d8
1b30d0ff-47a0-11ed-aedd-7cd30abc95d8
1b30d0ff-47a0-11ed-aedd-7cd30abc95d8
1b30d0ff-47a0-11ed-aedd-7cd30abc95d8
1b30d0ff-47a0-11ed-aedd-7cd30abc95d8
1b30d0ff-47a0-11ed-aedd-7cd30abc95d8
1b30d0ff-47a0-11ed-aedd-7cd30abc95d8
1b30d0ff-47a0-11ed-aedd-7cd30abc95d8
1b30d0ff-47a0-11ed-aedd-7cd30abc95d8
1b30d0ff-47a0-11ed-aedd-7cd30abc95d8
1b30d0ff-47a0-11ed-aedd-7cd30abc95d8
1b30d0ff-47a0-11ed-aedd-7cd30abc95d8
1b30d0ff-47a0-11ed-aedd-7cd30abc95d8
1b30d0ff-47a0-11ed-aedd-7cd30abc95d8
1b30d0ff-47a0-11ed-aedd-7cd30abc95d8
1b30d0ff-47a0-11ed-aedd-7cd30abc95d8
1b30d0ff-47a0-11ed-aedd-7cd30abc95d8
1b30d0ff-47a0-11ed-aedd-7cd30abc95d8
1b30d0ff-47a0-11ed-aedd-7cd30abc95d8
1b30d0ff-47a0-11ed-aedd-7cd30abc95d8
1b30d0ff-47a0-11ed-aedd-7cd30abc95d8
1b30d0ff-47a0-11ed-aedd-7cd30abc95d8
1b30d0ff-47a0-11ed-aedd-7cd30abc95d8
1b30d0ff-47a0-11ed-aedd-7cd30abc95d8
1b30d0ff-47a0-11ed-aedd-7cd30abc95d8
1b30d0ff-47a0-11ed-aedd-7cd30abc95d8
1b30d0ff-47a0-11ed-aedd-7cd30abc95d8
1b30d0ff-47a0-11ed-aedd-7cd30abc95d8
1b30d0ff-47a0-11ed-aedd-7cd30abc95d8
1b30d0ff-47a0-11ed-aedd-7cd30abc95d8
1b30d0ff-47a0-11ed-aedd-7cd30abc95d8
1b30d0ff-47a0-11ed-aedd-7cd30abc95d8
1b30d0ff-47a0-11ed-aedd-7cd30abc95d8
1b30d0ff-47a0-11ed-aedd-7cd30abc95d8
1b30d0ff-47a0-11ed-aedd-7cd30abc95d8
1b30d0ff-47a0-11ed-aedd-7cd30abc95d8
1b30d0ff-47a0-11ed-aedd-7cd30abc95d8
1b30d0ff-47a0-11ed-aedd-7cd30abc95d8
1b30d0ff-47a0-11ed-aedd-7cd30abc95d8
1b30d0ff-47a0-11ed-aedd-7cd30abc95d8
1b30d0ff-47a0-11ed-aedd-7cd30abc95d8
1b30d0ff-47a0-11ed-aedd-7cd30abc95d8
1b30d0ff-47a0-11ed-aedd-7cd30abc95d8
1b30d0ff-47a0-11ed-aedd-7cd30abc95d8
1b30d0ff-47a0-11ed-aedd-7cd30abc95d8
1b30d0ff-47a0-11ed-aedd-7cd30abc95d8
1b30d0ff-47a0-11ed-aedd-7cd30abc95d8
1b30d0ff-47a0-11ed-aedd-7cd30abc95d8
1b30d0ff-47a0-11ed-aedd-7cd30abc95d8
1b30d0ff-47a0-11ed-aedd-7cd30abc95d8
1b30d0ff-47a0-11ed-aedd-7cd30abc95d8
1b30d0ff-47a0-11ed-aedd-7cd30abc95d8
1b30d0ff-47a0-11ed-aedd-7cd30abc95d8
1b30d0ff-47a0-11ed-aedd-7cd30abc95d8
1b30d0ff-47a0-11ed-aedd-7cd30abc95d8
1b30d0ff-47a0-11ed-aedd-7cd30abc95d8
1b30d0ff-47a0-11ed-aedd-7cd30abc95d8
1b30d0ff-47a0-11ed-aedd-7cd30abc95d8
1b30d0ff-47a0-11ed-aedd-7cd30abc95d8
1b30d0ff-47a0-11ed-aedd-7cd30abc95d8
1b30d0ff-47a0-11ed-aedd-7cd30abc95d8
1b30d0ff-47a0-11ed-aedd-7cd30abc95d8
1b30d0ff-47a0-11ed-aedd-7cd30abc95d8
1b30d0ff-47a0-11ed-aedd-7cd30abc95d8
1b30d0ff-47a0-11ed-aedd-7cd30abc95d8
1b30d0ff-47a0-11ed-aedd-7cd30abc95d8
1b30d0ff-47a0-11ed-aedd-7cd30abc95d8
1b30d0ff-47a0-11ed-aedd-7cd30abc95d8
1b30d0ff-47a0-11ed-aedd-7cd30abc95d8
1b30d0ff-47a0-11ed-aedd-7cd30abc95d8
1b30d0ff-47a0-11ed-aedd-7cd30abc95d8
1b30d0ff-47a0-11ed-aedd-7cd30abc95d8
1b30d0ff-47a0-11ed-aedd-7cd30abc95d8
1b30d0ff-47a0-11ed-aedd-7cd30abc95d8
1b30d0ff-47a0-11ed-aedd-7cd30abc95d8
1b30d0ff-47a0-11ed-aedd-7cd30abc95d8
1b30d0ff-47a0-11ed-aedd-7cd30abc95d8
1b30d0ff-47a0-11ed-aedd-7cd30abc95d8
1b30d0ff-47a0-11ed-aedd-7cd30abc95d8
1b30d0ff-47a0-11ed-aedd-7cd30abc95d8
1b30d0ff-47a0-11ed-aedd-7cd30abc95d8
1b30d0ff-47a0-11ed-aedd-7cd30abc95d8
1b30d0ff-47a0-11ed-aedd-7cd30abc95d8
1b30d0ff-47a0-11ed-aedd-7cd30abc95d8
1b30d0ff-47a0-11ed-aedd-7cd30abc95d8
1b30d0ff-47a0-11ed-aedd-7cd30abc95d8
1b30d0ff-47a0-11ed-aedd-7cd30abc95d8
1b30d0ff-47a0-11ed-aedd-7cd30abc95d8
1b30d0ff-47a0-11ed-aedd-7cd30abc95d8
1b30d0ff-47a0-11ed-aedd-7cd30abc95d8
1b30d0ff-47a0-11ed-aedd-7cd30abc95d8
1b30d0ff-47a0-11ed-aedd-7cd30abc95d8
1b30d0ff-47a0-11ed-aedd-7cd30abc95d8
1b30d0ff-47a0-11ed-aedd-7cd30abc95d8
1b30d0ff-47a0-11ed-aedd-7cd30abc95d8
1b30d0ff-47a0-11ed-aedd-7cd30abc95d8
1b30d0ff-47a0-11ed-aedd-7cd30abc95d8
1b30d0ff-47a0-11ed-aedd-7cd30abc95d8
1b30d0ff-47a0-11ed-aedd-7cd30abc95d8
1b30d0ff-47a0-11ed-aedd-7cd30abc95d8
1b30d0ff-47a0-11ed-aedd-7cd30abc95d8
1b30d0ff-47a0-11ed-aedd-7cd30abc95d8
1b30d0ff-47a0-11ed-aedd-7cd30abc95d8
1b30d0ff-47a0-11ed-aedd-7cd30abc95d8
1b30d0ff-47a0-11ed-aedd-7cd30abc95d8
1b30d0ff-47a0-11ed-aedd-7cd30abc95d8
1b30d0ff-47a0-11ed-aedd-7cd30abc95d8
1b30d0ff-47a0-11ed-aedd-7cd30abc95d8
1b30d0ff-47a0-11ed-aedd-7cd30abc95d8
1b30d0ff-47a0-11ed-aedd-7cd30abc95d8
1b30d0ff-47a0-11ed-aedd-7cd30abc95d8
1b30d0ff-47a0-11ed-aedd-7cd30abc95d8
1b30d0ff-47a0-11ed-aedd-7cd30abc95d8
1b30d0ff-47a0-11ed-aedd-7cd30abc95d8
1b30d0ff-47a0-11ed-aedd-7cd30abc95d8
1b30d0ff-47a0-11ed-aedd-7cd30abc95d8
1b30d0ff-47a0-11ed-aedd-7cd30abc95d8
1b30d0ff-47a0-11ed-aedd-7cd30abc95d8
1b30d0ff-47a0-11ed-aedd-7cd30abc95d8
1b30d0ff-47a0-11ed-aedd-7cd30abc95d8
1b30d0ff-47a0-11ed-aedd-7cd30abc95d8
1b30d0ff-47a0-11ed-aedd-7cd30abc95d8
1b30d0ff-47a0-11ed-aedd-7cd30abc95d8
1b30d0ff-47a0-11ed-aedd-7cd30abc95d8
1b30d0ff-47a0-11ed-aedd-7cd30abc95d8
1b30d0ff-47a0-11ed-aedd-7cd30abc95d8
1b30d0ff-47a0-11ed-aedd-7cd30abc95d8
1b30d0ff-47a0-11ed-aedd-7cd30abc95d8
1b30d0ff-47a0-11ed-aedd-7cd30abc95d8
1b30d0ff-47a0-11ed-aedd-7cd30abc95d8
1b30d0ff-47a0-11ed-aedd-7cd30abc95d8
1b30d0ff-47a0-11ed-aedd-7cd30abc95d8
1b30d0ff-47a0-11ed-aedd-7cd30abc95d8
1b30d0ff-47a0-11ed-aedd-7cd30abc95d8
1b30d0ff-47a0-11ed-aedd-7cd30abc95d8
1b30d0ff-47a0-11ed-aedd-7cd30abc95d8
1b30d0ff-47a0-11ed-aedd-7cd30abc95d8
1b30d0ff-47a0-11ed-aedd-7cd30abc95d8
1b30d0ff-47a0-11ed-aedd-7cd30abc95d8
1b30d0ff-47a0-11ed-aedd-7cd30abc95d8
1b30d0ff-47a0-11ed-aedd-7cd30abc95d8
1b30d0ff-47a0-11ed-aedd-7cd30abc95d8
1b30d0ff-47a0-11ed-aedd-7cd30abc95d8
1b30d0ff-47a0-11ed-aedd-7cd30abc95d8
1b30d0ff-47a0-11ed-aedd-7cd30abc95d8
1b30d0ff-47a0-11ed-aedd-7cd30abc95d8
1b30d0ff-47a0-11ed-aedd-7cd30abc95d8
1b30d0ff-47a0-11ed-aedd-7cd30abc95d8
1b30d0ff-47a0-11ed-aedd-7cd30abc95d8
1b30d0ff-47a0-11ed-aedd-7cd30abc95d8
1b30d0ff-47a0-11ed-aedd-7cd30abc95d8
1b30d0ff-47a0-11ed-aedd-7cd30abc95d8
1b30d0ff-47a0-11ed-aedd-7cd30abc95d8
1b30d0ff-47a0-11ed-aedd-7cd30abc95d8
1b30d0ff-47a0-11ed-aedd-7cd30abc95d8
1b30d0ff-47a0-11ed-aedd-7cd30abc95d8
1b30d0ff-47a0-11ed-aedd-7cd30abc95d8
1b30d0ff-47a0-11ed-aedd-7cd30abc95d8
1b30d0ff-47a0-11ed-aedd-7cd30abc95d8
1b30d0ff-47a0-11ed-aedd-7cd30abc95d8
1b30d0ff-47a0-11ed-aedd-7cd30abc95d8
1b30d0ff-47a0-11ed-aedd-7cd30abc95d8
1b30d0ff-47a0-11ed-aedd-7cd30abc95d8
1b30d0ff-47a0-11ed-aedd-7cd30abc95d8
1b30d0ff-47a0-11ed-aedd-7cd30abc95d8
1b30d0ff-47a0-11ed-aedd-7cd30abc95d8
1b30d0ff-47a0-11ed-aedd-7cd30abc95d8
1b30d0ff-47a0-11ed-aedd-7cd30abc95d8
1b30d0ff-47a0-11ed-aedd-7cd30abc95d8
1b30d0ff-47a0-11ed-aedd-7cd30abc95d8
1b30d0ff-47a0-11ed-aedd-7cd30abc95d8
1b30d0ff-47a0-11ed-aedd-7cd30abc95d8
1b30d0ff-47a0-11ed-aedd-7cd30abc95d8
1b30d0ff-47a0-11ed-aedd-7cd30abc95d8
1b30d0ff-47a0-11ed-aedd-7cd30abc95d8
1b30d0ff-47a0-11ed-aedd-7cd30abc95d8
1b30d0ff-47a0-11ed-aedd-7cd30abc95d8
1b30d0ff-47a0-11ed-aedd-7cd30abc95d8
1b30d0ff-47a0-11ed-aedd-7cd30abc95d8
1b30d0ff-47a0-11ed-aedd-7cd30abc95d8
1b30d0ff-47a0-11ed-aedd-7cd30abc95d8
1b30d0ff-47a0-11ed-aedd-7cd30abc95d8
1b30d0ff-47a0-11ed-aedd-7cd30abc95d8
1b30d0ff-47a0-11ed-aedd-7cd30abc95d8
1b30d0ff-47a0-11ed-aedd-7cd30abc95d8
1b30d0ff-47a0-11ed-aedd-7cd30abc95d8
1b30d0ff-47a0-11ed-aedd-7cd30abc95d8
1b30d0ff-47a0-11ed-aedd-7cd30abc95d8
1b30d0ff-47a0-11ed-aedd-7cd30abc95d8
1b30d0ff-47a0-11ed-aedd-7cd30abc95d8
1b30d0ff-47a0-11ed-aedd-7cd30abc95d8
1b30d0ff-47a0-11ed-aedd-7cd30abc95d8
1b30d0ff-47a0-11ed-aedd-7cd30abc95d8
1b30d0ff-47a0-11ed-aedd-7cd30abc95d8
1b30d0ff-47a0-11ed-aedd-7cd30abc95d8
1b30d0ff-47a0-11ed-aedd-7cd30abc95d8
1b30d0ff-47a0-11ed-aedd-7cd30abc95d8
1b30d0ff-47a0-11ed-aedd-7cd30abc95d8
1b30d0ff-47a0-11ed-aedd-7cd30abc95d8
1b30d0ff-47a0-11ed-aedd-7cd30abc95d8
1b30d0ff-47a0-11ed-aedd-7cd30abc95d8
1b30d0ff-47a0-11ed-aedd-7cd30abc95d8
1b30d0ff-47a0-11ed-aedd-7cd30abc95d8
1b30d0ff-47a0-11ed-aedd-7cd30abc95d8
1b30d0ff-47a0-11ed-aedd-7cd30abc95d8
1b30d0ff-47a0-11ed-aedd-7cd30abc95d8
1b30d0ff-47a0-11ed-aedd-7cd30abc95d8
1b30d0ff-47a0-11ed-aedd-7cd30abc95d8
1b30d0ff-47a0-11ed-aedd-7cd30abc95d8
1b30d0ff-47a0-11ed-aedd-7cd30abc95d8
1b30d0ff-47a0-11ed-aedd-7cd30abc95d8
1b30d0ff-47a0-11ed-aedd-7cd30abc95d8
1b30d0ff-47a0-11ed-aedd-7cd30abc95d8
1b30d0ff-47a0-11ed-aedd-7cd30abc95d8
1b30d0ff-47a0-11ed-aedd-7cd30abc95d8
1b30d0ff-47a0-11ed-aedd-7cd30abc95d8
1b30d0ff-47a0-11ed-aedd-7cd30abc95d8
1b30d0ff-47a0-11ed-aedd-7cd30abc95d8
1b30d0ff-47a0-11ed-aedd-7cd30abc95d8
1b30d0ff-47a0-11ed-aedd-7cd30abc95d8
1b30d0ff-47a0-11ed-aedd-7cd30abc95d8
1b30d0ff-47a0-11ed-aedd-7cd30abc95d8
1b30d0ff-47a0-11ed-aedd-7cd30abc95d8
1b30d0ff-47a0-11ed-aedd-7cd30abc95d8
1b30d0ff-47a0-11ed-aedd-7cd30abc95d8
1b30d0ff-47a0-11ed-aedd-7cd30abc95d8
1b30d0ff-47a0-11ed-aedd-7cd30abc95d8
1b30d0ff-47a0-11ed-aedd-7cd30abc95d8
1b30d0ff-47a0-11ed-aedd-7cd30abc95d8
1b30d0ff-47a0-11ed-aedd-7cd30abc95d8
1b30d0ff-47a0-11ed-aedd-7cd30abc95d8
1b30d0ff-47a0-11ed-aedd-7cd30abc95d8
1b30d0ff-47a0-11ed-aedd-7cd30abc95d8
1b30d0ff-47a0-11ed-aedd-7cd30abc95d8
1b30d0ff-47a0-11ed-aedd-7cd30abc95d8
1b30d0ff-47a0-11ed-aedd-7cd30abc95d8
1b30d0ff-47a0-11ed-aedd-7cd30abc95d8
1b30d0ff-47a0-11ed-aedd-7cd30abc95d8
1b30d0ff-47a0-11ed-aedd-7cd30abc95d8
1b30d0ff-47a0-11ed-aedd-7cd30abc95d8
1b30d0ff-47a0-11ed-aedd-7cd30abc95d8
1b30d0ff-47a0-11ed-aedd-7cd30abc95d8
1b30d0ff-47a0-11ed-aedd-7cd30abc95d8
1b30d0ff-47a0-11ed-aedd-7cd30abc95d8
1b30d0ff-47a0-11ed-aedd-7cd30abc95d8
1b30d0ff-47a0-11ed-aedd-7cd30abc95d8
1b30d0ff-47a0-11ed-aedd-7cd30abc95d8
1b30d0ff-47a0-11ed-aedd-7cd30abc95d8
1b30d0ff-47a0-11ed-aedd-7cd30abc95d8
1b30d0ff-47a0-11ed-aedd-7cd30abc95d8
1b30d0ff-47a0-11ed-aedd-7cd30abc95d8
1b30d0ff-47a0-11ed-aedd-7cd30abc95d8
1b30d0ff-47a0-11ed-aedd-7cd30abc95d8
1b30d0ff-47a0-11ed-aedd-7cd30abc95d8
1b30d0ff-47a0-11ed-aedd-7cd30abc95d8
1b30d0ff-47a0-11ed-aedd-7cd30abc95d8
1b30d0ff-47a0-11ed-aedd-7cd30abc95d8
1b30d0ff-47a0-11ed-aedd-7cd30abc95d8
1b30d0ff-47a0-11ed-aedd-7cd30abc95d8
1b30d0ff-47a0-11ed-aedd-7cd30abc95d8
1b30d0ff-47a0-11ed-aedd-7cd30abc95d8
1b30d0ff-47a0-11ed-aedd-7cd30abc95d8
1b30d0ff-47a0-11ed-aedd-7cd30abc95d8
1b30d0ff-47a0-11ed-aedd-7cd30abc95d8
1b30d0ff-47a0-11ed-aedd-7cd30abc95d8
1b30d0ff-47a0-11ed-aedd-7cd30abc95d8
1b30d0ff-47a0-11ed-aedd-7cd30abc95d8
1b30d0ff-47a0-11ed-aedd-7cd30abc95d8
1b30d0ff-47a0-11ed-aedd-7cd30abc95d8
1b30d0ff-47a0-11ed-aedd-7cd30abc95d8
1b30d0ff-47a0-11ed-aedd-7cd30abc95d8
1b30d0ff-47a0-11ed-aedd-7cd30abc95d8
1b30d0ff-47a0-11ed-aedd-7cd30abc95d8
1b30d0ff-47a0-11ed-aedd-7cd30abc95d8
1b30d0ff-47a0-11ed-aedd-7cd30abc95d8
1b30d0ff-47a0-11ed-aedd-7cd30abc95d8
1b30d0ff-47a0-11ed-aedd-7cd30abc95d8
1b30d0ff-47a0-11ed-aedd-7cd30abc95d8
1b30d0ff-47a0-11ed-aedd-7cd30abc95d8
1b30d0ff-47a0-11ed-aedd-7cd30abc95d8
1b30d0ff-47a0-11ed-aedd-7cd30abc95d8
1b30d0ff-47a0-11ed-aedd-7cd30abc95d8
1b30d0ff-47a0-11ed-aedd-7cd30abc95d8
1b30d0ff-47a0-11ed-aedd-7cd30abc95d8
1b30d0ff-47a0-11ed-aedd-7cd30abc95d8
1b30d0ff-47a0-11ed-aedd-7cd30abc95d8
1b30d0ff-47a0-11ed-aedd-7cd30abc95d8
1b30d0ff-47a0-11ed-aedd-7cd30abc95d8
1b30d0ff-47a0-11ed-aedd-7cd30abc95d8
1b30d0ff-47a0-11ed-aedd-7cd30abc95d8
1b30d0ff-47a0-11ed-aedd-7cd30abc95d8
1b30d0ff-47a0-11ed-aedd-7cd30abc95d8
1b30d0ff-47a0-11ed-aedd-7cd30abc95d8
1b30d0ff-47a0-11ed-aedd-7cd30abc95d8
1b30d0ff-47a0-11ed-aedd-7cd30abc95d8
1b30d0ff-47a0-11ed-aedd-7cd30abc95d8
1b30d0ff-47a0-11ed-aedd-7cd30abc95d8
1b30d0ff-47a0-11ed-aedd-7cd30abc95d8
1b30d0ff-47a0-11ed-aedd-7cd30abc95d8
1b30d0ff-47a0-11ed-aedd-7cd30abc95d8
1b30d0ff-47a0-11ed-aedd-7cd30abc95d8
1b30d0ff-47a0-11ed-aedd-7cd30abc95d8
1b30d0ff-47a0-11ed-aedd-7cd30abc95d8
1b30d0ff-47a0-11ed-aedd-7cd30abc95d8
1b30d0ff-47a0-11ed-aedd-7cd30abc95d8
1b30d0ff-47a0-11ed-aedd-7cd30abc95d8
1b30d0ff-47a0-11ed-aedd-7cd30abc95d8
1b30d0ff-47a0-11ed-aedd-7cd30abc95d8
1b30d0ff-47a0-11ed-aedd-7cd30abc95d8
1b30d0ff-47a0-11ed-aedd-7cd30abc95d8
1b30d0ff-47a0-11ed-aedd-7cd30abc95d8
1b30d0ff-47a0-11ed-aedd-7cd30abc95d8
1b30d0ff-47a0-11ed-aedd-7cd30abc95d8
1b30d0ff-47a0-11ed-aedd-7cd30abc95d8
1b30d0ff-47a0-11ed-aedd-7cd30abc95d8
1b30d0ff-47a0-11ed-aedd-7cd30abc95d8
1b30d0ff-47a0-11ed-aedd-7cd30abc95d8
1b30d0ff-47a0-11ed-aedd-7cd30abc95d8
1b30d0ff-47a0-11ed-aedd-7cd30abc95d8
1b30d0ff-47a0-11ed-aedd-7cd30abc95d8
1b30d0ff-47a0-11ed-aedd-7cd30abc95d8
1b30d0ff-47a0-11ed-aedd-7cd30abc95d8
1b30d0ff-47a0-11ed-aedd-7cd30abc95d8
1b30d0ff-47a0-11ed-aedd-7cd30abc95d8
1b30d0ff-47a0-11ed-aedd-7cd30abc95d8
1b30d0ff-47a0-11ed-aedd-7cd30abc95d8
1b30d0ff-47a0-11ed-aedd-7cd30abc95d8
1b30d0ff-47a0-11ed-aedd-7cd30abc95d8
1b30d0ff-47a0-11ed-aedd-7cd30abc95d8
1b30d0ff-47a0-11ed-aedd-7cd30abc95d8
1b30d0ff-47a0-11ed-aedd-7cd30abc95d8
1b30d0ff-47a0-11ed-aedd-7cd30abc95d8
1b30d0ff-47a0-11ed-aedd-7cd30abc95d8
1b30d0ff-47a0-11ed-aedd-7cd30abc95d8
1b30d0ff-47a0-11ed-aedd-7cd30abc95d8
1b30d0ff-47a0-11ed-aedd-7cd30abc95d8
1b30d0ff-47a0-11ed-aedd-7cd30abc95d8
1b30d0ff-47a0-11ed-aedd-7cd30abc95d8
1b30d0ff-47a0-11ed-aedd-7cd30abc95d8
1b30d0ff-47a0-11ed-aedd-7cd30abc95d8
1b30d0ff-47a0-11ed-aedd-7cd30abc95d8
1b30d0ff-47a0-11ed-aedd-7cd30abc95d8
1b30d0ff-47a0-11ed-aedd-7cd30abc95d8
1b30d0ff-47a0-11ed-aedd-7cd30abc95d8
1b30d0ff-47a0-11ed-aedd-7cd30abc95d8
1b30d0ff-47a0-11ed-aedd-7cd30abc95d8
1b30d0ff-47a0-11ed-aedd-7cd30abc95d8
1b30d0ff-47a0-11ed-aedd-7cd30abc95d8
1b30d0ff-47a0-11ed-aedd-7cd30abc95d8
1b30d0ff-47a0-11ed-aedd-7cd30abc95d8
1b30d0ff-47a0-11ed-aedd-7cd30abc95d8
1b30d0ff-47a0-11ed-aedd-7cd30abc95d8
1b30d0ff-47a0-11ed-aedd-7cd30abc95d8
1b30d0ff-47a0-11ed-aedd-7cd30abc95d8
1b30d0ff-47a0-11ed-aedd-7cd30abc95d8
1b30d0ff-47a0-11ed-aedd-7cd30abc95d8
1b30d0ff-47a0-11ed-aedd-7cd30abc95d8
1b30d0ff-47a0-11ed-aedd-7cd30abc95d8
1b30d0ff-47a0-11ed-aedd-7cd30abc95d8
1b30d0ff-47a0-11ed-aedd-7cd30abc95d8
1b30d0ff-47a0-11ed-aedd-7cd30abc95d8
1b30d0ff-47a0-11ed-aedd-7cd30abc95d8
1b30d0ff-47a0-11ed-aedd-7cd30abc95d8
1b30d0ff-47a0-11ed-aedd-7cd30abc95d8
1b30d0ff-47a0-11ed-aedd-7cd30abc95d8
1b30d0ff-47a0-11ed-aedd-7cd30abc95d8
1b30d0ff-47a0-11ed-aedd-7cd30abc95d8
1b30d0ff-47a0-11ed-aedd-7cd30abc95d8
1b30d0ff-47a0-11ed-aedd-7cd30abc95d8
1b30d0ff-47a0-11ed-aedd-7cd30abc95d8
1b30d0ff-47a0-11ed-aedd-7cd30abc95d8
1b30d0ff-47a0-11ed-aedd-7cd30abc95d8
1b30d0ff-47a0-11ed-aedd-7cd30abc95d8
1b30d0ff-47a0-11ed-aedd-7cd30abc95d8
1b30d0ff-47a0-11ed-aedd-7cd30abc95d8
1b30d0ff-47a0-11ed-aedd-7cd30abc95d8
1b30d0ff-47a0-11ed-aedd-7cd30abc95d8
1b30d0ff-47a0-11ed-aedd-7cd30abc95d8
1b30d0ff-47a0-11ed-aedd-7cd30abc95d8
1b30d0ff-47a0-11ed-aedd-7cd30abc95d8
1b30d0ff-47a0-11ed-aedd-7cd30abc95d8
1b30d0ff-47a0-11ed-aedd-7cd30abc95d8
1b30d0ff-47a0-11ed-aedd-7cd30abc95d8
1b30d0ff-47a0-11ed-aedd-7cd30abc95d8
1b30d0ff-47a0-11ed-aedd-7cd30abc95d8
1b30d0ff-47a0-11ed-aedd-7cd30abc95d8
1b30d0ff-47a0-11ed-aedd-7cd30abc95d8
1b30d0ff-47a0-11ed-aedd-7cd30abc95d8
1b30d0ff-47a0-11ed-aedd-7cd30abc95d8
1b30d0ff-47a0-11ed-aedd-7cd30abc95d8
1b30d0ff-47a0-11ed-aedd-7cd30abc95d8
1b30d0ff-47a0-11ed-aedd-7cd30abc95d8
1b30d0ff-47a0-11ed-aedd-7cd30abc95d8
1b30d0ff-47a0-11ed-aedd-7cd30abc95d8
1b30d0ff-47a0-11ed-aedd-7cd30abc95d8
1b30d0ff-47a0-11ed-aedd-7cd30abc95d8
1b30d0ff-47a0-11ed-aedd-7cd30abc95d8
1b30d0ff-47a0-11ed-aedd-7cd30abc95d8
1b30d0ff-47a0-11ed-aedd-7cd30abc95d8
1b30d0ff-47a0-11ed-aedd-7cd30abc95d8
1b30d0ff-47a0-11ed-aedd-7cd30abc95d8
1b30d0ff-47a0-11ed-aedd-7cd30abc95d8
1b30d0ff-47a0-11ed-aedd-7cd30abc95d8
1b30d0ff-47a0-11ed-aedd-7cd30abc95d8
1b30d0ff-47a0-11ed-aedd-7cd30abc95d8
1b30d0ff-47a0-11ed-aedd-7cd30abc95d8
1b30d0ff-47a0-11ed-aedd-7cd30abc95d8
1b30d0ff-47a0-11ed-aedd-7cd30abc95d8
1b30d0ff-47a0-11ed-aedd-7cd30abc95d8
1b30d0ff-47a0-11ed-aedd-7cd30abc95d8
1b30d0ff-47a0-11ed-aedd-7cd30abc95d8
1b30d0ff-47a0-11ed-aedd-7cd30abc95d8
1b30d0ff-47a0-11ed-aedd-7cd30abc95d8
1b30d0ff-47a0-11ed-aedd-7cd30abc95d8
1b30d0ff-47a0-11ed-aedd-7cd30abc95d8
1b30d0ff-47a0-11ed-aedd-7cd30abc95d8
1b30d0ff-47a0-11ed-aedd-7cd30abc95d8
1b30d0ff-47a0-11ed-aedd-7cd30abc95d8
1b30d0ff-47a0-11ed-aedd-7cd30abc95d8
1b30d0ff-47a0-11ed-aedd-7cd30abc95d8
1b30d0ff-47a0-11ed-aedd-7cd30abc95d8
1b30d0ff-47a0-11ed-aedd-7cd30abc95d8
1b30d0ff-47a0-11ed-aedd-7cd30abc95d8
1b30d0ff-47a0-11ed-aedd-7cd30abc95d8
1b30d0ff-47a0-11ed-aedd-7cd30abc95d8
1b30d0ff-47a0-11ed-aedd-7cd30abc95d8
1b30d0ff-47a0-11ed-aedd-7cd30abc95d8
1b30d0ff-47a0-11ed-aedd-7cd30abc95d8
1b30d0ff-47a0-11ed-aedd-7cd30abc95d8
1b30d0ff-47a0-11ed-aedd-7cd30abc95d8
1b30d0ff-47a0-11ed-aedd-7cd30abc95d8
1b30d0ff-47a0-11ed-aedd-7cd30abc95d8
1b30d0ff-47a0-11ed-aedd-7cd30abc95d8
1b30d0ff-47a0-11ed-aedd-7cd30abc95d8
1b30d0ff-47a0-11ed-aedd-7cd30abc95d8
1b30d0ff-47a0-11ed-aedd-7cd30abc95d8
1b30d0ff-47a0-11ed-aedd-7cd30abc95d8
1b30d0ff-47a0-11ed-aedd-7cd30abc95d8
1b30d0ff-47a0-11ed-aedd-7cd30abc95d8
1b30d0ff-47a0-11ed-aedd-7cd30abc95d8
1b30d0ff-47a0-11ed-aedd-7cd30abc95d8
1b30d0ff-47a0-11ed-aedd-7cd30abc95d8
1b30d0ff-47a0-11ed-aedd-7cd30abc95d8
1b30d0ff-47a0-11ed-aedd-7cd30abc95d8
1b30d0ff-47a0-11ed-aedd-7cd30abc95d8
1b30d0ff-47a0-11ed-aedd-7cd30abc95d8
1b30d0ff-47a0-11ed-aedd-7cd30abc95d8
1b30d0ff-47a0-11ed-aedd-7cd30abc95d8
1b30d0ff-47a0-11ed-aedd-7cd30abc95d8
1b30d0ff-47a0-11ed-aedd-7cd30abc95d8
1b30d0ff-47a0-11ed-aedd-7cd30abc95d8
1b30d0ff-47a0-11ed-aedd-7cd30abc95d8
1b30d0ff-47a0-11ed-aedd-7cd30abc95d8
1b30d0ff-47a0-11ed-aedd-7cd30abc95d8
1b30d0ff-47a0-11ed-aedd-7cd30abc95d8
1b30d0ff-47a0-11ed-aedd-7cd30abc95d8
1b30d0ff-47a0-11ed-aedd-7cd30abc95d8
1b30d0ff-47a0-11ed-aedd-7cd30abc95d8
1b30d0ff-47a0-11ed-aedd-7cd30abc95d8
1b30d0ff-47a0-11ed-aedd-7cd30abc95d8
1b30d0ff-47a0-11ed-aedd-7cd30abc95d8
1b30d0ff-47a0-11ed-aedd-7cd30abc95d8
1b30d0ff-47a0-11ed-aedd-7cd30abc95d8
1b30d0ff-47a0-11ed-aedd-7cd30abc95d8
1b30d0ff-47a0-11ed-aedd-7cd30abc95d8
1b30d0ff-47a0-11ed-aedd-7cd30abc95d8
1b30d0ff-47a0-11ed-aedd-7cd30abc95d8
1b30d0ff-47a0-11ed-aedd-7cd30abc95d8
1b30d0ff-47a0-11ed-aedd-7cd30abc95d8
1b30d0ff-47a0-11ed-aedd-7cd30abc95d8
1b30d0ff-47a0-11ed-aedd-7cd30abc95d8
1b30d0ff-47a0-11ed-aedd-7cd30abc95d8
1b30d0ff-47a0-11ed-aedd-7cd30abc95d8
1b30d0ff-47a0-11ed-aedd-7cd30abc95d8
1b30d0ff-47a0-11ed-aedd-7cd30abc95d8
1b30d0ff-47a0-11ed-aedd-7cd30abc95d8
1b30d0ff-47a0-11ed-aedd-7cd30abc95d8
1b30d0ff-47a0-11ed-aedd-7cd30abc95d8
1b30d0ff-47a0-11ed-aedd-7cd30abc95d8
1b30d0ff-47a0-11ed-aedd-7cd30abc95d8
1b30d0ff-47a0-11ed-aedd-7cd30abc95d8
1b30d0ff-47a0-11ed-aedd-7cd30abc95d8
1b30d0ff-47a0-11ed-aedd-7cd30abc95d8
1b30d0ff-47a0-11ed-aedd-7cd30abc95d8
1b30d0ff-47a0-11ed-aedd-7cd30abc95d8
1b30d0ff-47a0-11ed-aedd-7cd30abc95d8
1b30d0ff-47a0-11ed-aedd-7cd30abc95d8
1b30d0ff-47a0-11ed-aedd-7cd30abc95d8
1b30d0ff-47a0-11ed-aedd-7cd30abc95d8
1b30d0ff-47a0-11ed-aedd-7cd30abc95d8
1b30d0ff-47a0-11ed-aedd-7cd30abc95d8
1b30d0ff-47a0-11ed-aedd-7cd30abc95d8
1b30d0ff-47a0-11ed-aedd-7cd30abc95d8
1b30d0ff-47a0-11ed-aedd-7cd30abc95d8
1b30d0ff-47a0-11ed-aedd-7cd30abc95d8
1b30d0ff-47a0-11ed-aedd-7cd30abc95d8
1b30d0ff-47a0-11ed-aedd-7cd30abc95d8
1b30d0ff-47a0-11ed-aedd-7cd30abc95d8
1b30d0ff-47a0-11ed-aedd-7cd30abc95d8
1b30d0ff-47a0-11ed-aedd-7cd30abc95d8
1b30d0ff-47a0-11ed-aedd-7cd30abc95d8
1b30d0ff-47a0-11ed-aedd-7cd30abc95d8
1b30d0ff-47a0-11ed-aedd-7cd30abc95d8
1b30d0ff-47a0-11ed-aedd-7cd30abc95d8
1b30d0ff-47a0-11ed-aedd-7cd30abc95d8
1b30d0ff-47a0-11ed-aedd-7cd30abc95d8
1b30d0ff-47a0-11ed-aedd-7cd30abc95d8
1b30d0ff-47a0-11ed-aedd-7cd30abc95d8
1b30d0ff-47a0-11ed-aedd-7cd30abc95d8
1b30d0ff-47a0-11ed-aedd-7cd30abc95d8
1b30d0ff-47a0-11ed-aedd-7cd30abc95d8
1b30d0ff-47a0-11ed-aedd-7cd30abc95d8
1b30d0ff-47a0-11ed-aedd-7cd30abc95d8
1b30d0ff-47a0-11ed-aedd-7cd30abc95d8
1b30d0ff-47a0-11ed-aedd-7cd30abc95d8
1b30d0ff-47a0-11ed-aedd-7cd30abc95d8
1b30d0ff-47a0-11ed-aedd-7cd30abc95d8
1b30d0ff-47a0-11ed-aedd-7cd30abc95d8
1b30d0ff-47a0-11ed-aedd-7cd30abc95d8
1b30d0ff-47a0-11ed-aedd-7cd30abc95d8
1b30d0ff-47a0-11ed-aedd-7cd30abc95d8
1b30d0ff-47a0-11ed-aedd-7cd30abc95d8
1b30d0ff-47a0-11ed-aedd-7cd30abc95d8
1b30d0ff-47a0-11ed-aedd-7cd30abc95d8
1b30d0ff-47a0-11ed-aedd-7cd30abc95d8
1b30d0ff-47a0-11ed-aedd-7cd30abc95d8
1b30d0ff-47a0-11ed-aedd-7cd30abc95d8
1b30d0ff-47a0-11ed-aedd-7cd30abc95d8
1b30d0ff-47a0-11ed-aedd-7cd30abc95d8
1b30d0ff-47a0-11ed-aedd-7cd30abc95d8
1b30d0ff-47a0-11ed-aedd-7cd30abc95d8
1b30d0ff-47a0-11ed-aedd-7cd30abc95d8
1b30d0ff-47a0-11ed-aedd-7cd30abc95d8
1b30d0ff-47a0-11ed-aedd-7cd30abc95d8
1b30d0ff-47a0-11ed-aedd-7cd30abc95d8
1b30d0ff-47a0-11ed-aedd-7cd30abc95d8
1b30d0ff-47a0-11ed-aedd-7cd30abc95d8
1b30d0ff-47a0-11ed-aedd-7cd30abc95d8
1b30d0ff-47a0-11ed-aedd-7cd30abc95d8
1b30d0ff-47a0-11ed-aedd-7cd30abc95d8
1b30d0ff-47a0-11ed-aedd-7cd30abc95d8
1b30d0ff-47a0-11ed-aedd-7cd30abc95d8
1b30d0ff-47a0-11ed-aedd-7cd30abc95d8
1b30d0ff-47a0-11ed-aedd-7cd30abc95d8
1b30d0ff-47a0-11ed-aedd-7cd30abc95d8
1b30d0ff-47a0-11ed-aedd-7cd30abc95d8
1b30d0ff-47a0-11ed-aedd-7cd30abc95d8
1b30d0ff-47a0-11ed-aedd-7cd30abc95d8
1b30d0ff-47a0-11ed-aedd-7cd30abc95d8
1b30d0ff-47a0-11ed-aedd-7cd30abc95d8
1b30d0ff-47a0-11ed-aedd-7cd30abc95d8
1b30d0ff-47a0-11ed-aedd-7cd30abc95d8
1b30d0ff-47a0-11ed-aedd-7cd30abc95d8
1b30d0ff-47a0-11ed-aedd-7cd30abc95d8
1b30d0ff-47a0-11ed-aedd-7cd30abc95d8
1b30d0ff-47a0-11ed-aedd-7cd30abc95d8
1b30d0ff-47a0-11ed-aedd-7cd30abc95d8
1b30d0ff-47a0-11ed-aedd-7cd30abc95d8
1b30d0ff-47a0-11ed-aedd-7cd30abc95d8
1b30d0ff-47a0-11ed-aedd-7cd30abc95d8
1b30d0ff-47a0-11ed-aedd-7cd30abc95d8
1b30d0ff-47a0-11ed-aedd-7cd30abc95d8
1b30d0ff-47a0-11ed-aedd-7cd30abc95d8
1b30d0ff-47a0-11ed-aedd-7cd30abc95d8
1b30d0ff-47a0-11ed-aedd-7cd30abc95d8
1b30d0ff-47a0-11ed-aedd-7cd30abc95d8
1b30d0ff-47a0-11ed-aedd-7cd30abc95d8
1b30d0ff-47a0-11ed-aedd-7cd30abc95d8
1b30d0ff-47a0-11ed-aedd-7cd30abc95d8
1b30d0ff-47a0-11ed-aedd-7cd30abc95d8
1b30d0ff-47a0-11ed-aedd-7cd30abc95d8
1b30d0ff-47a0-11ed-aedd-7cd30abc95d8
1b30d0ff-47a0-11ed-aedd-7cd30abc95d8
1b30d0ff-47a0-11ed-aedd-7cd30abc95d8
1b30d0ff-47a0-11ed-aedd-7cd30abc95d8
1b30d0ff-47a0-11ed-aedd-7cd30abc95d8
1b30d0ff-47a0-11ed-aedd-7cd30abc95d8
1b30d0ff-47a0-11ed-aedd-7cd30abc95d8
1b30d0ff-47a0-11ed-aedd-7cd30abc95d8
1b30d0ff-47a0-11ed-aedd-7cd30abc95d8
1b30d0ff-47a0-11ed-aedd-7cd30abc95d8
1b30d0ff-47a0-11ed-aedd-7cd30abc95d8
1b30d0ff-47a0-11ed-aedd-7cd30abc95d8
1b30d0ff-47a0-11ed-aedd-7cd30abc95d8
1b30d0ff-47a0-11ed-aedd-7cd30abc95d8
1b30d0ff-47a0-11ed-aedd-7cd30abc95d8
1b30d0ff-47a0-11ed-aedd-7cd30abc95d8
1b30d0ff-47a0-11ed-aedd-7cd30abc95d8
1b30d0ff-47a0-11ed-aedd-7cd30abc95d8
1b30d0ff-47a0-11ed-aedd-7cd30abc95d8
1b30d0ff-47a0-11ed-aedd-7cd30abc95d8
1b30d0ff-47a0-11ed-aedd-7cd30abc95d8
1b30d0ff-47a0-11ed-aedd-7cd30abc95d8
1b30d0ff-47a0-11ed-aedd-7cd30abc95d8
1b30d0ff-47a0-11ed-aedd-7cd30abc95d8
1b30d0ff-47a0-11ed-aedd-7cd30abc95d8
1b30d0ff-47a0-11ed-aedd-7cd30abc95d8
1b30d0ff-47a0-11ed-aedd-7cd30abc95d8
1b30d0ff-47a0-11ed-aedd-7cd30abc95d8
1b30d0ff-47a0-11ed-aedd-7cd30abc95d8
1b30d0ff-47a0-11ed-aedd-7cd30abc95d8
1b30d0ff-47a0-11ed-aedd-7cd30abc95d8
1b30d0ff-47a0-11ed-aedd-7cd30abc95d8
1b30d0ff-47a0-11ed-aedd-7cd30abc95d8
1b30d0ff-47a0-11ed-aedd-7cd30abc95d8
1b30d0ff-47a0-11ed-aedd-7cd30abc95d8
1b30d0ff-47a0-11ed-aedd-7cd30abc95d8
1b30d0ff-47a0-11ed-aedd-7cd30abc95d8
1b30d0ff-47a0-11ed-aedd-7cd30abc95d8
1b30d0ff-47a0-11ed-aedd-7cd30abc95d8
1b30d0ff-47a0-11ed-aedd-7cd30abc95d8
1b30d0ff-47a0-11ed-aedd-7cd30abc95d8
1b30d0ff-47a0-11ed-aedd-7cd30abc95d8
1b30d0ff-47a0-11ed-aedd-7cd30abc95d8
1b30d0ff-47a0-11ed-aedd-7cd30abc95d8
1b30d0ff-47a0-11ed-aedd-7cd30abc95d8
1b30d0ff-47a0-11ed-aedd-7cd30abc95d8
1b30d0ff-47a0-11ed-aedd-7cd30abc95d8
1b30d0ff-47a0-11ed-aedd-7cd30abc95d8
1b30d0ff-47a0-11ed-aedd-7cd30abc95d8
1b30d0ff-47a0-11ed-aedd-7cd30abc95d8
1b30d0ff-47a0-11ed-aedd-7cd30abc95d8
1b30d0ff-47a0-11ed-aedd-7cd30abc95d8
1b30d0ff-47a0-11ed-aedd-7cd30abc95d8
1b30d0ff-47a0-11ed-aedd-7cd30abc95d8
1b30d0ff-47a0-11ed-aedd-7cd30abc95d8
1b30d0ff-47a0-11ed-aedd-7cd30abc95d8
1b30d0ff-47a0-11ed-aedd-7cd30abc95d8
1b30d0ff-47a0-11ed-aedd-7cd30abc95d8
1b30d0ff-47a0-11ed-aedd-7cd30abc95d8
1b30d0ff-47a0-11ed-aedd-7cd30abc95d8
1b30d0ff-47a0-11ed-aedd-7cd30abc95d8
1b30d0ff-47a0-11ed-aedd-7cd30abc95d8
1b30d0ff-47a0-11ed-aedd-7cd30abc95d8
1b30d0ff-47a0-11ed-aedd-7cd30abc95d8
1b30d0ff-47a0-11ed-aedd-7cd30abc95d8
1b30d0ff-47a0-11ed-aedd-7cd30abc95d8
1b30d0ff-47a0-11ed-aedd-7cd30abc95d8
1b30d0ff-47a0-11ed-aedd-7cd30abc95d8
1b30d0ff-47a0-11ed-aedd-7cd30abc95d8
1b30d0ff-47a0-11ed-aedd-7cd30abc95d8
1b30d0ff-47a0-11ed-aedd-7cd30abc95d8
1b30d0ff-47a0-11ed-aedd-7cd30abc95d8
1b30d0ff-47a0-11ed-aedd-7cd30abc95d8
1b30d0ff-47a0-11ed-aedd-7cd30abc95d8
1b30d0ff-47a0-11ed-aedd-7cd30abc95d8
1b30d0ff-47a0-11ed-aedd-7cd30abc95d8
1b30d0ff-47a0-11ed-aedd-7cd30abc95d8
1b30d0ff-47a0-11ed-aedd-7cd30abc95d8
1b30d0ff-47a0-11ed-aedd-7cd30abc95d8
1b30d0ff-47a0-11ed-aedd-7cd30abc95d8
1b30d0ff-47a0-11ed-aedd-7cd30abc95d8
1b30d0ff-47a0-11ed-aedd-7cd30abc95d8
1b30d0ff-47a0-11ed-aedd-7cd30abc95d8
1b30d0ff-47a0-11ed-aedd-7cd30abc95d8
1b30d0ff-47a0-11ed-aedd-7cd30abc95d8
1b30d0ff-47a0-11ed-aedd-7cd30abc95d8
1b30d0ff-47a0-11ed-aedd-7cd30abc95d8
1b30d0ff-47a0-11ed-aedd-7cd30abc95d8
1b30d0ff-47a0-11ed-aedd-7cd30abc95d8
1b30d0ff-47a0-11ed-aedd-7cd30abc95d8
1b30d0ff-47a0-11ed-aedd-7cd30abc95d8
1b30d0ff-47a0-11ed-aedd-7cd30abc95d8
1b30d0ff-47a0-11ed-aedd-7cd30abc95d8
1b30d0ff-47a0-11ed-aedd-7cd30abc95d8
1b30d0ff-47a0-11ed-aedd-7cd30abc95d8
1b30d0ff-47a0-11ed-aedd-7cd30abc95d8
1b30d0ff-47a0-11ed-aedd-7cd30abc95d8
1b30d0ff-47a0-11ed-aedd-7cd30abc95d8
1b30d0ff-47a0-11ed-aedd-7cd30abc95d8
1b30d0ff-47a0-11ed-aedd-7cd30abc95d8
1b30d0ff-47a0-11ed-aedd-7cd30abc95d8
1b30d0ff-47a0-11ed-aedd-7cd30abc95d8
1b30d0ff-47a0-11ed-aedd-7cd30abc95d8
1b30d0ff-47a0-11ed-aedd-7cd30abc95d8
1b30d0ff-47a0-11ed-aedd-7cd30abc95d8
1b30d0ff-47a0-11ed-aedd-7cd30abc95d8
1b30d0ff-47a0-11ed-aedd-7cd30abc95d8
1b30d0ff-47a0-11ed-aedd-7cd30abc95d8
1b30d0ff-47a0-11ed-aedd-7cd30abc95d8
1b30d0ff-47a0-11ed-aedd-7cd30abc95d8
1b30d0ff-47a0-11ed-aedd-7cd30abc95d8
1b30d0ff-47a0-11ed-aedd-7cd30abc95d8
1b30d0ff-47a0-11ed-aedd-7cd30abc95d8
1b30d0ff-47a0-11ed-aedd-7cd30abc95d8
1b30d0ff-47a0-11ed-aedd-7cd30abc95d8
1b30d0ff-47a0-11ed-aedd-7cd30abc95d8
1b30d0ff-47a0-11ed-aedd-7cd30abc95d8
1b30d0ff-47a0-11ed-aedd-7cd30abc95d8
1b30d0ff-47a0-11ed-aedd-7cd30abc95d8
1b30d0ff-47a0-11ed-aedd-7cd30abc95d8
1b30d0ff-47a0-11ed-aedd-7cd30abc95d8
1b30d0ff-47a0-11ed-aedd-7cd30abc95d8
1b30d0ff-47a0-11ed-aedd-7cd30abc95d8
1b30d0ff-47a0-11ed-aedd-7cd30abc95d8
1b30d0ff-47a0-11ed-aedd-7cd30abc95d8
1b30d0ff-47a0-11ed-aedd-7cd30abc95d8
1b30d0ff-47a0-11ed-aedd-7cd30abc95d8
1b30d0ff-47a0-11ed-aedd-7cd30abc95d8
1b30d0ff-47a0-11ed-aedd-7cd30abc95d8
1b30d0ff-47a0-11ed-aedd-7cd30abc95d8
1b30d0ff-47a0-11ed-aedd-7cd30abc95d8
1b30d0ff-47a0-11ed-aedd-7cd30abc95d8
1b30d0ff-47a0-11ed-aedd-7cd30abc95d8
1b30d0ff-47a0-11ed-aedd-7cd30abc95d8
1b30d0ff-47a0-11ed-aedd-7cd30abc95d8
1b30d0ff-47a0-11ed-aedd-7cd30abc95d8
1b30d0ff-47a0-11ed-aedd-7cd30abc95d8
1b30d0ff-47a0-11ed-aedd-7cd30abc95d8
1b30d0ff-47a0-11ed-aedd-7cd30abc95d8
1b30d0ff-47a0-11ed-aedd-7cd30abc95d8
1b30d0ff-47a0-11ed-aedd-7cd30abc95d8
1b30d0ff-47a0-11ed-aedd-7cd30abc95d8
1b30d0ff-47a0-11ed-aedd-7cd30abc95d8
1b30d0ff-47a0-11ed-aedd-7cd30abc95d8
1b30d0ff-47a0-11ed-aedd-7cd30abc95d8
1b30d0ff-47a0-11ed-aedd-7cd30abc95d8
1b30d0ff-47a0-11ed-aedd-7cd30abc95d8
1b30d0ff-47a0-11ed-aedd-7cd30abc95d8
1b30d0ff-47a0-11ed-aedd-7cd30abc95d8
1b30d0ff-47a0-11ed-aedd-7cd30abc95d8
1b30d0ff-47a0-11ed-aedd-7cd30abc95d8
1b30d0ff-47a0-11ed-aedd-7cd30abc95d8
1b30d0ff-47a0-11ed-aedd-7cd30abc95d8
1b30d0ff-47a0-11ed-aedd-7cd30abc95d8
1b30d0ff-47a0-11ed-aedd-7cd30abc95d8
1b30d0ff-47a0-11ed-aedd-7cd30abc95d8
1b30d0ff-47a0-11ed-aedd-7cd30abc95d8
1b30d0ff-47a0-11ed-aedd-7cd30abc95d8
1b30d0ff-47a0-11ed-aedd-7cd30abc95d8
1b30d0ff-47a0-11ed-aedd-7cd30abc95d8
1b30d0ff-47a0-11ed-aedd-7cd30abc95d8
1b30d0ff-47a0-11ed-aedd-7cd30abc95d8
1b30d0ff-47a0-11ed-aedd-7cd30abc95d8
1b30d0ff-47a0-11ed-aedd-7cd30abc95d8
1b30d0ff-47a0-11ed-aedd-7cd30abc95d8
1b30d0ff-47a0-11ed-aedd-7cd30abc95d8
1b30d0ff-47a0-11ed-aedd-7cd30abc95d8
1b30d0ff-47a0-11ed-aedd-7cd30abc95d8
1b30d0ff-47a0-11ed-aedd-7cd30abc95d8
1b30d0ff-47a0-11ed-aedd-7cd30abc95d8
1b30d0ff-47a0-11ed-aedd-7cd30abc95d8
1b30d0ff-47a0-11ed-aedd-7cd30abc95d8
1b30d0ff-47a0-11ed-aedd-7cd30abc95d8
1b30d0ff-47a0-11ed-aedd-7cd30abc95d8
1b30d0ff-47a0-11ed-aedd-7cd30abc95d8
1b30d0ff-47a0-11ed-aedd-7cd30abc95d8
1b30d0ff-47a0-11ed-aedd-7cd30abc95d8
1b30d0ff-47a0-11ed-aedd-7cd30abc95d8
1b30d0ff-47a0-11ed-aedd-7cd30abc95d8
1b30d0ff-47a0-11ed-aedd-7cd30abc95d8
1b30d0ff-47a0-11ed-aedd-7cd30abc95d8
1b30d0ff-47a0-11ed-aedd-7cd30abc95d8
1b30d0ff-47a0-11ed-aedd-7cd30abc95d8
1b30d0ff-47a0-11ed-aedd-7cd30abc95d8
1b30d0ff-47a0-11ed-aedd-7cd30abc95d8
1b30d0ff-47a0-11ed-aedd-7cd30abc95d8
1b30d0ff-47a0-11ed-aedd-7cd30abc95d8
1b30d0ff-47a0-11ed-aedd-7cd30abc95d8
1b30d0ff-47a0-11ed-aedd-7cd30abc95d8
1b30d0ff-47a0-11ed-aedd-7cd30abc95d8
1b30d0ff-47a0-11ed-aedd-7cd30abc95d8
1b30d0ff-47a0-11ed-aedd-7cd30abc95d8
1b30d0ff-47a0-11ed-aedd-7cd30abc95d8
1b30d0ff-47a0-11ed-aedd-7cd30abc95d8
1b30d0ff-47a0-11ed-aedd-7cd30abc95d8
1b30d0ff-47a0-11ed-aedd-7cd30abc95d8
1b30d0ff-47a0-11ed-aedd-7cd30abc95d8
1b30d0ff-47a0-11ed-aedd-7cd30abc95d8
1b30d0ff-47a0-11ed-aedd-7cd30abc95d8
1b30d0ff-47a0-11ed-aedd-7cd30abc95d8
1b30d0ff-47a0-11ed-aedd-7cd30abc95d8
1b30d0ff-47a0-11ed-aedd-7cd30abc95d8
1b30d0ff-47a0-11ed-aedd-7cd30abc95d8
1b30d0ff-47a0-11ed-aedd-7cd30abc95d8
1b30d0ff-47a0-11ed-aedd-7cd30abc95d8
1b30d0ff-47a0-11ed-aedd-7cd30abc95d8
1b30d0ff-47a0-11ed-aedd-7cd30abc95d8
1b30d0ff-47a0-11ed-aedd-7cd30abc95d8
1b30d0ff-47a0-11ed-aedd-7cd30abc95d8
1b30d0ff-47a0-11ed-aedd-7cd30abc95d8
1b30d0ff-47a0-11ed-aedd-7cd30abc95d8
1b30d0ff-47a0-11ed-aedd-7cd30abc95d8
1b30d0ff-47a0-11ed-aedd-7cd30abc95d8
1b30d0ff-47a0-11ed-aedd-7cd30abc95d8
1b30d0ff-47a0-11ed-aedd-7cd30abc95d8
1b30d0ff-47a0-11ed-aedd-7cd30abc95d8
1b30d0ff-47a0-11ed-aedd-7cd30abc95d8
1b30d0ff-47a0-11ed-aedd-7cd30abc95d8
1b30d0ff-47a0-11ed-aedd-7cd30abc95d8
1b30d0ff-47a0-11ed-aedd-7cd30abc95d8
1b30d0ff-47a0-11ed-aedd-7cd30abc95d8
1b30d0ff-47a0-11ed-aedd-7cd30abc95d8
1b30d0ff-47a0-11ed-aedd-7cd30abc95d8
1b30d0ff-47a0-11ed-aedd-7cd30abc95d8
1b30d0ff-47a0-11ed-aedd-7cd30abc95d8
1b30d0ff-47a0-11ed-aedd-7cd30abc95d8
1b30d0ff-47a0-11ed-aedd-7cd30abc95d8
1b30d0ff-47a0-11ed-aedd-7cd30abc95d8
1b30d0ff-47a0-11ed-aedd-7cd30abc95d8
1b30d0ff-47a0-11ed-aedd-7cd30abc95d8
1b30d0ff-47a0-11ed-aedd-7cd30abc95d8
1b30d0ff-47a0-11ed-aedd-7cd30abc95d8
1b30d0ff-47a0-11ed-aedd-7cd30abc95d8
1b30d0ff-47a0-11ed-aedd-7cd30abc95d8
1b30d0ff-47a0-11ed-aedd-7cd30abc95d8
1b30d0ff-47a0-11ed-aedd-7cd30abc95d8
1b30d0ff-47a0-11ed-aedd-7cd30abc95d8
1b30d0ff-47a0-11ed-aedd-7cd30abc95d8
1b30d0ff-47a0-11ed-aedd-7cd30abc95d8
1b30d0ff-47a0-11ed-aedd-7cd30abc95d8
1b30d0ff-47a0-11ed-aedd-7cd30abc95d8
1b30d0ff-47a0-11ed-aedd-7cd30abc95d8
1b30d0ff-47a0-11ed-aedd-7cd30abc95d8
1b30d0ff-47a0-11ed-aedd-7cd30abc95d8
1b30d0ff-47a0-11ed-aedd-7cd30abc95d8
1b30d0ff-47a0-11ed-aedd-7cd30abc95d8
1b30d0ff-47a0-11ed-aedd-7cd30abc95d8
1b30d0ff-47a0-11ed-aedd-7cd30abc95d8
1b30d0ff-47a0-11ed-aedd-7cd30abc95d8
1b30d0ff-47a0-11ed-aedd-7cd30abc95d8
1b30d0ff-47a0-11ed-aedd-7cd30abc95d8
1b30d0ff-47a0-11ed-aedd-7cd30abc95d8
1b30d0ff-47a0-11ed-aedd-7cd30abc95d8
1b30d0ff-47a0-11ed-aedd-7cd30abc95d8
1b30d0ff-47a0-11ed-aedd-7cd30abc95d8
1b30d0ff-47a0-11ed-aedd-7cd30abc95d8
1b30d0ff-47a0-11ed-aedd-7cd30abc95d8
1b30d0ff-47a0-11ed-aedd-7cd30abc95d8
1b30d0ff-47a0-11ed-aedd-7cd30abc95d8
1b30d0ff-47a0-11ed-aedd-7cd30abc95d8
1b30d0ff-47a0-11ed-aedd-7cd30abc95d8
1b30d0ff-47a0-11ed-aedd-7cd30abc95d8
1b30d0ff-47a0-11ed-aedd-7cd30abc95d8
1b30d0ff-47a0-11ed-aedd-7cd30abc95d8
1b30d0ff-47a0-11ed-aedd-7cd30abc95d8
1b30d0ff-47a0-11ed-aedd-7cd30abc95d8
1b30d0ff-47a0-11ed-aedd-7cd30abc95d8
1b30d0ff-47a0-11ed-aedd-7cd30abc95d8
1b30d0ff-47a0-11ed-aedd-7cd30abc95d8
1b30d0ff-47a0-11ed-aedd-7cd30abc95d8
1b30d0ff-47a0-11ed-aedd-7cd30abc95d8
1b30d0ff-47a0-11ed-aedd-7cd30abc95d8
1b30d0ff-47a0-11ed-aedd-7cd30abc95d8
1b30d0ff-47a0-11ed-aedd-7cd30abc95d8
1b30d0ff-47a0-11ed-aedd-7cd30abc95d8
1b30d0ff-47a0-11ed-aedd-7cd30abc95d8
1b30d0ff-47a0-11ed-aedd-7cd30abc95d8
1b30d0ff-47a0-11ed-aedd-7cd30abc95d8
1b30d0ff-47a0-11ed-aedd-7cd30abc95d8
1b30d0ff-47a0-11ed-aedd-7cd30abc95d8
1b30d0ff-47a0-11ed-aedd-7cd30abc95d8
1b30d0ff-47a0-11ed-aedd-7cd30abc95d8
1b30d0ff-47a0-11ed-aedd-7cd30abc95d8
1b30d0ff-47a0-11ed-aedd-7cd30abc95d8
1b30d0ff-47a0-11ed-aedd-7cd30abc95d8
1b30d0ff-47a0-11ed-aedd-7cd30abc95d8
1b30d0ff-47a0-11ed-aedd-7cd30abc95d8
1b30d0ff-47a0-11ed-aedd-7cd30abc95d8
1b30d0ff-47a0-11ed-aedd-7cd30abc95d8
1b30d0ff-47a0-11ed-aedd-7cd30abc95d8
1b30d0ff-47a0-11ed-aedd-7cd30abc95d8
1b30d0ff-47a0-11ed-aedd-7cd30abc95d8
1b30d0ff-47a0-11ed-aedd-7cd30abc95d8
1b30d0ff-47a0-11ed-aedd-7cd30abc95d8
1b30d0ff-47a0-11ed-aedd-7cd30abc95d8
1b30d0ff-47a0-11ed-aedd-7cd30abc95d8
1b30d0ff-47a0-11ed-aedd-7cd30abc95d8
1b30d0ff-47a0-11ed-aedd-7cd30abc95d8
1b30d0ff-47a0-11ed-aedd-7cd30abc95d8
1b30d0ff-47a0-11ed-aedd-7cd30abc95d8
1b30d0ff-47a0-11ed-aedd-7cd30abc95d8
1b30d0ff-47a0-11ed-aedd-7cd30abc95d8
1b30d0ff-47a0-11ed-aedd-7cd30abc95d8
1b30d0ff-47a0-11ed-aedd-7cd30abc95d8
1b30d0ff-47a0-11ed-aedd-7cd30abc95d8
1b30d0ff-47a0-11ed-aedd-7cd30abc95d8
1b30d0ff-47a0-11ed-aedd-7cd30abc95d8
1b30d0ff-47a0-11ed-aedd-7cd30abc95d8
1b30d0ff-47a0-11ed-aedd-7cd30abc95d8
1b30d0ff-47a0-11ed-aedd-7cd30abc95d8
1b30d0ff-47a0-11ed-aedd-7cd30abc95d8
1b30d0ff-47a0-11ed-aedd-7cd30abc95d8
1b30d0ff-47a0-11ed-aedd-7cd30abc95d8
1b30d0ff-47a0-11ed-aedd-7cd30abc95d8
1b30d0ff-47a0-11ed-aedd-7cd30abc95d8
1b30d0ff-47a0-11ed-aedd-7cd30abc95d8
1b30d0ff-47a0-11ed-aedd-7cd30abc95d8
1b30d0ff-47a0-11ed-aedd-7cd30abc95d8
1b30d0ff-47a0-11ed-aedd-7cd30abc95d8
1b30d0ff-47a0-11ed-aedd-7cd30abc95d8
1b30d0ff-47a0-11ed-aedd-7cd30abc95d8
1b30d0ff-47a0-11ed-aedd-7cd30abc95d8
1b30d0ff-47a0-11ed-aedd-7cd30abc95d8
1b30d0ff-47a0-11ed-aedd-7cd30abc95d8
1b30d0ff-47a0-11ed-aedd-7cd30abc95d8
1b30d0ff-47a0-11ed-aedd-7cd30abc95d8
1b30d0ff-47a0-11ed-aedd-7cd30abc95d8
1b30d0ff-47a0-11ed-aedd-7cd30abc95d8
1b30d0ff-47a0-11ed-aedd-7cd30abc95d8
1b30d0ff-47a0-11ed-aedd-7cd30abc95d8
1b30d0ff-47a0-11ed-aedd-7cd30abc95d8
1b30d0ff-47a0-11ed-aedd-7cd30abc95d8
1b30d0ff-47a0-11ed-aedd-7cd30abc95d8
1b30d0ff-47a0-11ed-aedd-7cd30abc95d8
1b30d0ff-47a0-11ed-aedd-7cd30abc95d8
1b30d0ff-47a0-11ed-aedd-7cd30abc95d8
1b30d0ff-47a0-11ed-aedd-7cd30abc95d8
1b30d0ff-47a0-11ed-aedd-7cd30abc95d8
1b30d0ff-47a0-11ed-aedd-7cd30abc95d8
1b30d0ff-47a0-11ed-aedd-7cd30abc95d8
1b30d0ff-47a0-11ed-aedd-7cd30abc95d8
1b30d0ff-47a0-11ed-aedd-7cd30abc95d8
1b30d0ff-47a0-11ed-aedd-7cd30abc95d8
1b30d0ff-47a0-11ed-aedd-7cd30abc95d8
1b30d0ff-47a0-11ed-aedd-7cd30abc95d8
1b30d0ff-47a0-11ed-aedd-7cd30abc95d8
1b30d0ff-47a0-11ed-aedd-7cd30abc95d8
1b30d0ff-47a0-11ed-aedd-7cd30abc95d8
1b30d0ff-47a0-11ed-aedd-7cd30abc95d8
1b30d0ff-47a0-11ed-aedd-7cd30abc95d8
1b30d0ff-47a0-11ed-aedd-7cd30abc95d8
1b30d0ff-47a0-11ed-aedd-7cd30abc95d8
1b30d0ff-47a0-11ed-aedd-7cd30abc95d8
1b30d0ff-47a0-11ed-aedd-7cd30abc95d8
1b30d0ff-47a0-11ed-aedd-7cd30abc95d8
1b30d0ff-47a0-11ed-aedd-7cd30abc95d8
1b30d0ff-47a0-11ed-aedd-7cd30abc95d8
1b30d0ff-47a0-11ed-aedd-7cd30abc95d8
1b30d0ff-47a0-11ed-aedd-7cd30abc95d8
1b30d0ff-47a0-11ed-aedd-7cd30abc95d8
1b30d0ff-47a0-11ed-aedd-7cd30abc95d8
1b30d0ff-47a0-11ed-aedd-7cd30abc95d8
1b30d0ff-47a0-11ed-aedd-7cd30abc95d8
1b30d0ff-47a0-11ed-aedd-7cd30abc95d8
1b30d0ff-47a0-11ed-aedd-7cd30abc95d8
1b30d0ff-47a0-11ed-aedd-7cd30abc95d8
1b30d0ff-47a0-11ed-aedd-7cd30abc95d8
1b30d0ff-47a0-11ed-aedd-7cd30abc95d8
1b30d0ff-47a0-11ed-aedd-7cd30abc95d8
1b30d0ff-47a0-11ed-aedd-7cd30abc95d8
1b30d0ff-47a0-11ed-aedd-7cd30abc95d8
1b30d0ff-47a0-11ed-aedd-7cd30abc95d8
1b30d0ff-47a0-11ed-aedd-7cd30abc95d8
1b30d0ff-47a0-11ed-aedd-7cd30abc95d8
1b30d0ff-47a0-11ed-aedd-7cd30abc95d8
1b30d0ff-47a0-11ed-aedd-7cd30abc95d8
1b30d0ff-47a0-11ed-aedd-7cd30abc95d8
1b30d0ff-47a0-11ed-aedd-7cd30abc95d8
1b30d0ff-47a0-11ed-aedd-7cd30abc95d8
1b30d0ff-47a0-11ed-aedd-7cd30abc95d8
1b30d0ff-47a0-11ed-aedd-7cd30abc95d8
1b30d0ff-47a0-11ed-aedd-7cd30abc95d8
1b30d0ff-47a0-11ed-aedd-7cd30abc95d8
1b30d0ff-47a0-11ed-aedd-7cd30abc95d8
1b30d0ff-47a0-11ed-aedd-7cd30abc95d8
1b30d0ff-47a0-11ed-aedd-7cd30abc95d8
1b30d0ff-47a0-11ed-aedd-7cd30abc95d8
1b30d0ff-47a0-11ed-aedd-7cd30abc95d8
1b30d0ff-47a0-11ed-aedd-7cd30abc95d8
1b30d0ff-47a0-11ed-aedd-7cd30abc95d8
1b30d0ff-47a0-11ed-aedd-7cd30abc95d8
1b30d0ff-47a0-11ed-aedd-7cd30abc95d8
1b30d0ff-47a0-11ed-aedd-7cd30abc95d8
1b30d0ff-47a0-11ed-aedd-7cd30abc95d8
1b30d0ff-47a0-11ed-aedd-7cd30abc95d8
1b30d0ff-47a0-11ed-aedd-7cd30abc95d8
1b30d0ff-47a0-11ed-aedd-7cd30abc95d8
1b30d0ff-47a0-11ed-aedd-7cd30abc95d8
1b30d0ff-47a0-11ed-aedd-7cd30abc95d8
1b30d0ff-47a0-11ed-aedd-7cd30abc95d8
1b30d0ff-47a0-11ed-aedd-7cd30abc95d8
1b30d0ff-47a0-11ed-aedd-7cd30abc95d8
1b30d0ff-47a0-11ed-aedd-7cd30abc95d8
1b30d0ff-47a0-11ed-aedd-7cd30abc95d8
1b30d0ff-47a0-11ed-aedd-7cd30abc95d8
1b30d0ff-47a0-11ed-aedd-7cd30abc95d8
1b30d0ff-47a0-11ed-aedd-7cd30abc95d8
1b30d0ff-47a0-11ed-aedd-7cd30abc95d8
1b30d0ff-47a0-11ed-aedd-7cd30abc95d8
1b30d0ff-47a0-11ed-aedd-7cd30abc95d8
1b30d0ff-47a0-11ed-aedd-7cd30abc95d8
1b30d0ff-47a0-11ed-aedd-7cd30abc95d8
1b30d0ff-47a0-11ed-aedd-7cd30abc95d8
1b30d0ff-47a0-11ed-aedd-7cd30abc95d8
1b30d0ff-47a0-11ed-aedd-7cd30abc95d8
1b30d0ff-47a0-11ed-aedd-7cd30abc95d8
1b30d0ff-47a0-11ed-aedd-7cd30abc95d8
1b30d0ff-47a0-11ed-aedd-7cd30abc95d8
1b30d0ff-47a0-11ed-aedd-7cd30abc95d8
1b30d0ff-47a0-11ed-aedd-7cd30abc95d8
1b30d0ff-47a0-11ed-aedd-7cd30abc95d8
1b30d0ff-47a0-11ed-aedd-7cd30abc95d8
1b30d0ff-47a0-11ed-aedd-7cd30abc95d8
1b30d0ff-47a0-11ed-aedd-7cd30abc95d8
1b30d0ff-47a0-11ed-aedd-7cd30abc95d8
1b30d0ff-47a0-11ed-aedd-7cd30abc95d8
1b30d0ff-47a0-11ed-aedd-7cd30abc95d8
1b30d0ff-47a0-11ed-aedd-7cd30abc95d8
1b30d0ff-47a0-11ed-aedd-7cd30abc95d8
1b30d0ff-47a0-11ed-aedd-7cd30abc95d8
1b30d0ff-47a0-11ed-aedd-7cd30abc95d8
1b30d0ff-47a0-11ed-aedd-7cd30abc95d8
1b30d0ff-47a0-11ed-aedd-7cd30abc95d8
1b30d0ff-47a0-11ed-aedd-7cd30abc95d8
1b30d0ff-47a0-11ed-aedd-7cd30abc95d8
1b30d0ff-47a0-11ed-aedd-7cd30abc95d8
1b30d0ff-47a0-11ed-aedd-7cd30abc95d8
1b30d0ff-47a0-11ed-aedd-7cd30abc95d8
1b30d0ff-47a0-11ed-aedd-7cd30abc95d8
1b30d0ff-47a0-11ed-aedd-7cd30abc95d8
1b30d0ff-47a0-11ed-aedd-7cd30abc95d8
1b30d0ff-47a0-11ed-aedd-7cd30abc95d8
1b30d0ff-47a0-11ed-aedd-7cd30abc95d8
1b30d0ff-47a0-11ed-aedd-7cd30abc95d8
1b30d0ff-47a0-11ed-aedd-7cd30abc95d8
1b30d0ff-47a0-11ed-aedd-7cd30abc95d8
1b30d0ff-47a0-11ed-aedd-7cd30abc95d8
1b30d0ff-47a0-11ed-aedd-7cd30abc95d8
1b30d0ff-47a0-11ed-aedd-7cd30abc95d8
1b30d0ff-47a0-11ed-aedd-7cd30abc95d8
1b30d0ff-47a0-11ed-aedd-7cd30abc95d8
1b30d0ff-47a0-11ed-aedd-7cd30abc95d8
1b30d0ff-47a0-11ed-aedd-7cd30abc95d8
1b30d0ff-47a0-11ed-aedd-7cd30abc95d8
1b30d0ff-47a0-11ed-aedd-7cd30abc95d8
1b30d0ff-47a0-11ed-aedd-7cd30abc95d8
1b30d0ff-47a0-11ed-aedd-7cd30abc95d8
1b30d0ff-47a0-11ed-aedd-7cd30abc95d8
1b30d0ff-47a0-11ed-aedd-7cd30abc95d8
1b30d0ff-47a0-11ed-aedd-7cd30abc95d8
1b30d0ff-47a0-11ed-aedd-7cd30abc95d8
1b30d0ff-47a0-11ed-aedd-7cd30abc95d8
1b30d0ff-47a0-11ed-aedd-7cd30abc95d8
1b30d0ff-47a0-11ed-aedd-7cd30abc95d8
1b30d0ff-47a0-11ed-aedd-7cd30abc95d8
1b30d0ff-47a0-11ed-aedd-7cd30abc95d8
1b30d0ff-47a0-11ed-aedd-7cd30abc95d8
1b30d0ff-47a0-11ed-aedd-7cd30abc95d8
1b30d0ff-47a0-11ed-aedd-7cd30abc95d8
1b30d0ff-47a0-11ed-aedd-7cd30abc95d8
1b30d0ff-47a0-11ed-aedd-7cd30abc95d8
1b30d0ff-47a0-11ed-aedd-7cd30abc95d8
1b30d0ff-47a0-11ed-aedd-7cd30abc95d8
1b30d0ff-47a0-11ed-aedd-7cd30abc95d8
1b30d0ff-47a0-11ed-aedd-7cd30abc95d8
1b30d0ff-47a0-11ed-aedd-7cd30abc95d8
1b30d0ff-47a0-11ed-aedd-7cd30abc95d8
1b30d0ff-47a0-11ed-aedd-7cd30abc95d8
1b30d0ff-47a0-11ed-aedd-7cd30abc95d8
1b30d0ff-47a0-11ed-aedd-7cd30abc95d8
1b30d0ff-47a0-11ed-aedd-7cd30abc95d8
1b30d0ff-47a0-11ed-aedd-7cd30abc95d8
1b30d0ff-47a0-11ed-aedd-7cd30abc95d8
1b30d0ff-47a0-11ed-aedd-7cd30abc95d8
1b30d0ff-47a0-11ed-aedd-7cd30abc95d8
1b30d0ff-47a0-11ed-aedd-7cd30abc95d8
1b30d0ff-47a0-11ed-aedd-7cd30abc95d8
1b30d0ff-47a0-11ed-aedd-7cd30abc95d8
1b30d0ff-47a0-11ed-aedd-7cd30abc95d8
1b30d0ff-47a0-11ed-aedd-7cd30abc95d8
1b30d0ff-47a0-11ed-aedd-7cd30abc95d8
1b30d0ff-47a0-11ed-aedd-7cd30abc95d8
1b30d0ff-47a0-11ed-aedd-7cd30abc95d8
1b30d0ff-47a0-11ed-aedd-7cd30abc95d8
1b30d0ff-47a0-11ed-aedd-7cd30abc95d8
1b30d0ff-47a0-11ed-aedd-7cd30abc95d8
1b30d0ff-47a0-11ed-aedd-7cd30abc95d8
1b30d0ff-47a0-11ed-aedd-7cd30abc95d8
1b30d0ff-47a0-11ed-aedd-7cd30abc95d8
1b30d0ff-47a0-11ed-aedd-7cd30abc95d8
1b30d0ff-47a0-11ed-aedd-7cd30abc95d8
1b30d0ff-47a0-11ed-aedd-7cd30abc95d8
1b30d0ff-47a0-11ed-aedd-7cd30abc95d8
1b30d0ff-47a0-11ed-aedd-7cd30abc95d8
1b30d0ff-47a0-11ed-aedd-7cd30abc95d8
1b30d0ff-47a0-11ed-aedd-7cd30abc95d8
1b30d0ff-47a0-11ed-aedd-7cd30abc95d8
1b30d0ff-47a0-11ed-aedd-7cd30abc95d8
1b30d0ff-47a0-11ed-aedd-7cd30abc95d8
1b30d0ff-47a0-11ed-aedd-7cd30abc95d8
1b30d0ff-47a0-11ed-aedd-7cd30abc95d8
1b30d0ff-47a0-11ed-aedd-7cd30abc95d8
1b30d0ff-47a0-11ed-aedd-7cd30abc95d8
1b30d0ff-47a0-11ed-aedd-7cd30abc95d8
1b30d0ff-47a0-11ed-aedd-7cd30abc95d8
1b30d0ff-47a0-11ed-aedd-7cd30abc95d8
1b30d0ff-47a0-11ed-aedd-7cd30abc95d8
1b30d0ff-47a0-11ed-aedd-7cd30abc95d8
1b30d0ff-47a0-11ed-aedd-7cd30abc95d8
1b30d0ff-47a0-11ed-aedd-7cd30abc95d8
1b30d0ff-47a0-11ed-aedd-7cd30abc95d8
1b30d0ff-47a0-11ed-aedd-7cd30abc95d8
1b30d0ff-47a0-11ed-aedd-7cd30abc95d8
1b30d0ff-47a0-11ed-aedd-7cd30abc95d8
1b30d0ff-47a0-11ed-aedd-7cd30abc95d8
1b30d0ff-47a0-11ed-aedd-7cd30abc95d8
1b30d0ff-47a0-11ed-aedd-7cd30abc95d8
1b30d0ff-47a0-11ed-aedd-7cd30abc95d8
1b30d0ff-47a0-11ed-aedd-7cd30abc95d8
1b30d0ff-47a0-11ed-aedd-7cd30abc95d8
1b30d0ff-47a0-11ed-aedd-7cd30abc95d8
1b30d0ff-47a0-11ed-aedd-7cd30abc95d8
1b30d0ff-47a0-11ed-aedd-7cd30abc95d8
1b30d0ff-47a0-11ed-aedd-7cd30abc95d8
1b30d0ff-47a0-11ed-aedd-7cd30abc95d8
1b30d0ff-47a0-11ed-aedd-7cd30abc95d8
1b30d0ff-47a0-11ed-aedd-7cd30abc95d8
1b30d0ff-47a0-11ed-aedd-7cd30abc95d8
1b30d0ff-47a0-11ed-aedd-7cd30abc95d8
1b30d0ff-47a0-11ed-aedd-7cd30abc95d8
1b30d0ff-47a0-11ed-aedd-7cd30abc95d8
1b30d0ff-47a0-11ed-aedd-7cd30abc95d8
1b30d0ff-47a0-11ed-aedd-7cd30abc95d8
1b30d0ff-47a0-11ed-aedd-7cd30abc95d8
1b30d0ff-47a0-11ed-aedd-7cd30abc95d8
1b30d0ff-47a0-11ed-aedd-7cd30abc95d8
1b30d0ff-47a0-11ed-aedd-7cd30abc95d8
1b30d0ff-47a0-11ed-aedd-7cd30abc95d8
1b30d0ff-47a0-11ed-aedd-7cd30abc95d8
1b30d0ff-47a0-11ed-aedd-7cd30abc95d8
1b30d0ff-47a0-11ed-aedd-7cd30abc95d8
1b30d0ff-47a0-11ed-aedd-7cd30abc95d8
1b30d0ff-47a0-11ed-aedd-7cd30abc95d8
1b30d0ff-47a0-11ed-aedd-7cd30abc95d8
1b30d0ff-47a0-11ed-aedd-7cd30abc95d8
1b30d0ff-47a0-11ed-aedd-7cd30abc95d8
1b30d0ff-47a0-11ed-aedd-7cd30abc95d8
1b30d0ff-47a0-11ed-aedd-7cd30abc95d8
1b30d0ff-47a0-11ed-aedd-7cd30abc95d8
1b30d0ff-47a0-11ed-aedd-7cd30abc95d8
1b30d0ff-47a0-11ed-aedd-7cd30abc95d8
1b30d0ff-47a0-11ed-aedd-7cd30abc95d8
1b30d0ff-47a0-11ed-aedd-7cd30abc95d8
1b30d0ff-47a0-11ed-aedd-7cd30abc95d8
1b30d0ff-47a0-11ed-aedd-7cd30abc95d8
1b30d0ff-47a0-11ed-aedd-7cd30abc95d8
1b30d0ff-47a0-11ed-aedd-7cd30abc95d8
1b30d0ff-47a0-11ed-aedd-7cd30abc95d8
1b30d0ff-47a0-11ed-aedd-7cd30abc95d8
1b30d0ff-47a0-11ed-aedd-7cd30abc95d8
1b30d0ff-47a0-11ed-aedd-7cd30abc95d8
1b30d0ff-47a0-11ed-aedd-7cd30abc95d8
1b30d0ff-47a0-11ed-aedd-7cd30abc95d8
1b30d0ff-47a0-11ed-aedd-7cd30abc95d8
1b30d0ff-47a0-11ed-aedd-7cd30abc95d8
1b30d0ff-47a0-11ed-aedd-7cd30abc95d8
1b30d0ff-47a0-11ed-aedd-7cd30abc95d8
1b30d0ff-47a0-11ed-aedd-7cd30abc95d8
1b30d0ff-47a0-11ed-aedd-7cd30abc95d8
1b30d0ff-47a0-11ed-aedd-7cd30abc95d8
1b30d0ff-47a0-11ed-aedd-7cd30abc95d8
1b30d0ff-47a0-11ed-aedd-7cd30abc95d8
1b30d0ff-47a0-11ed-aedd-7cd30abc95d8
1b30d0ff-47a0-11ed-aedd-7cd30abc95d8
1b30d0ff-47a0-11ed-aedd-7cd30abc95d8
1b30d0ff-47a0-11ed-aedd-7cd30abc95d8
1b30d0ff-47a0-11ed-aedd-7cd30abc95d8
1b30d0ff-47a0-11ed-aedd-7cd30abc95d8
1b30d0ff-47a0-11ed-aedd-7cd30abc95d8
1b30d0ff-47a0-11ed-aedd-7cd30abc95d8
1b30d0ff-47a0-11ed-aedd-7cd30abc95d8
1b30d0ff-47a0-11ed-aedd-7cd30abc95d8
1b30d0ff-47a0-11ed-aedd-7cd30abc95d8
1b30d0ff-47a0-11ed-aedd-7cd30abc95d8
1b30d0ff-47a0-11ed-aedd-7cd30abc95d8
1b30d0ff-47a0-11ed-aedd-7cd30abc95d8
1b30d0ff-47a0-11ed-aedd-7cd30abc95d8
1b30d0ff-47a0-11ed-aedd-7cd30abc95d8
1b30d0ff-47a0-11ed-aedd-7cd30abc95d8
1b30d0ff-47a0-11ed-aedd-7cd30abc95d8
1b30d0ff-47a0-11ed-aedd-7cd30abc95d8
1b30d0ff-47a0-11ed-aedd-7cd30abc95d8
1b30d0ff-47a0-11ed-aedd-7cd30abc95d8
1b30d0ff-47a0-11ed-aedd-7cd30abc95d8
1b30d0ff-47a0-11ed-aedd-7cd30abc95d8
1b30d0ff-47a0-11ed-aedd-7cd30abc95d8
1b30d0ff-47a0-11ed-aedd-7cd30abc95d8
1b30d0ff-47a0-11ed-aedd-7cd30abc95d8
1b30d0ff-47a0-11ed-aedd-7cd30abc95d8
1b30d0ff-47a0-11ed-aedd-7cd30abc95d8
1b30d0ff-47a0-11ed-aedd-7cd30abc95d8
1b30d0ff-47a0-11ed-aedd-7cd30abc95d8
1b30d0ff-47a0-11ed-aedd-7cd30abc95d8
1b30d0ff-47a0-11ed-aedd-7cd30abc95d8
1b30d0ff-47a0-11ed-aedd-7cd30abc95d8
1b30d0ff-47a0-11ed-aedd-7cd30abc95d8
1b30d0ff-47a0-11ed-aedd-7cd30abc95d8
1b30d0ff-47a0-11ed-aedd-7cd30abc95d8
1b30d0ff-47a0-11ed-aedd-7cd30abc95d8
1b30d0ff-47a0-11ed-aedd-7cd30abc95d8
1b30d0ff-47a0-11ed-aedd-7cd30abc95d8
1b30d0ff-47a0-11ed-aedd-7cd30abc95d8
1b30d0ff-47a0-11ed-aedd-7cd30abc95d8
1b30d0ff-47a0-11ed-aedd-7cd30abc95d8
1b30d0ff-47a0-11ed-aedd-7cd30abc95d8
1b30d0ff-47a0-11ed-aedd-7cd30abc95d8
1b30d0ff-47a0-11ed-aedd-7cd30abc95d8
1b30d0ff-47a0-11ed-aedd-7cd30abc95d8
1b30d0ff-47a0-11ed-aedd-7cd30abc95d8
1b30d0ff-47a0-11ed-aedd-7cd30abc95d8
1b30d0ff-47a0-11ed-aedd-7cd30abc95d8
1b30d0ff-47a0-11ed-aedd-7cd30abc95d8
1b30d0ff-47a0-11ed-aedd-7cd30abc95d8
1b30d0ff-47a0-11ed-aedd-7cd30abc95d8
1b30d0ff-47a0-11ed-aedd-7cd30abc95d8
1b30d0ff-47a0-11ed-aedd-7cd30abc95d8
1b30d0ff-47a0-11ed-aedd-7cd30abc95d8
1b30d0ff-47a0-11ed-aedd-7cd30abc95d8
1b30d0ff-47a0-11ed-aedd-7cd30abc95d8
1b30d0ff-47a0-11ed-aedd-7cd30abc95d8
1b30d0ff-47a0-11ed-aedd-7cd30abc95d8
1b30d0ff-47a0-11ed-aedd-7cd30abc95d8
1b30d0ff-47a0-11ed-aedd-7cd30abc95d8
1b30d0ff-47a0-11ed-aedd-7cd30abc95d8
1b30d0ff-47a0-11ed-aedd-7cd30abc95d8
1b30d0ff-47a0-11ed-aedd-7cd30abc95d8
1b30d0ff-47a0-11ed-aedd-7cd30abc95d8
1b30d0ff-47a0-11ed-aedd-7cd30abc95d8
1b30d0ff-47a0-11ed-aedd-7cd30abc95d8
1b30d0ff-47a0-11ed-aedd-7cd30abc95d8
1b30d0ff-47a0-11ed-aedd-7cd30abc95d8
1b30d0ff-47a0-11ed-aedd-7cd30abc95d8
1b30d0ff-47a0-11ed-aedd-7cd30abc95d8
1b30d0ff-47a0-11ed-aedd-7cd30abc95d8
1b30d0ff-47a0-11ed-aedd-7cd30abc95d8
1b30d0ff-47a0-11ed-aedd-7cd30abc95d8
1b30d0ff-47a0-11ed-aedd-7cd30abc95d8
1b30d0ff-47a0-11ed-aedd-7cd30abc95d8
1b30d0ff-47a0-11ed-aedd-7cd30abc95d8
1b30d0ff-47a0-11ed-aedd-7cd30abc95d8
1b30d0ff-47a0-11ed-aedd-7cd30abc95d8
1b30d0ff-47a0-11ed-aedd-7cd30abc95d8
1b30d0ff-47a0-11ed-aedd-7cd30abc95d8
1b30d0ff-47a0-11ed-aedd-7cd30abc95d8
1b30d0ff-47a0-11ed-aedd-7cd30abc95d8
1b30d0ff-47a0-11ed-aedd-7cd30abc95d8
1b30d0ff-47a0-11ed-aedd-7cd30abc95d8
1b30d0ff-47a0-11ed-aedd-7cd30abc95d8
1b30d0ff-47a0-11ed-aedd-7cd30abc95d8
1b30d0ff-47a0-11ed-aedd-7cd30abc95d8
1b30d0ff-47a0-11ed-aedd-7cd30abc95d8
1b30d0ff-47a0-11ed-aedd-7cd30abc95d8
1b30d0ff-47a0-11ed-aedd-7cd30abc95d8
1b30d0ff-47a0-11ed-aedd-7cd30abc95d8
1b30d0ff-47a0-11ed-aedd-7cd30abc95d8
1b30d0ff-47a0-11ed-aedd-7cd30abc95d8
1b30d0ff-47a0-11ed-aedd-7cd30abc95d8
1b30d0ff-47a0-11ed-aedd-7cd30abc95d8
1b30d0ff-47a0-11ed-aedd-7cd30abc95d8
1b30d0ff-47a0-11ed-aedd-7cd30abc95d8
1b30d0ff-47a0-11ed-aedd-7cd30abc95d8
1b30d0ff-47a0-11ed-aedd-7cd30abc95d8
1b30d0ff-47a0-11ed-aedd-7cd30abc95d8
1b30d0ff-47a0-11ed-aedd-7cd30abc95d8
1b30d0ff-47a0-11ed-aedd-7cd30abc95d8
1b30d0ff-47a0-11ed-aedd-7cd30abc95d8
1b30d0ff-47a0-11ed-aedd-7cd30abc95d8
1b30d0ff-47a0-11ed-aedd-7cd30abc95d8
1b30d0ff-47a0-11ed-aedd-7cd30abc95d8
1b30d0ff-47a0-11ed-aedd-7cd30abc95d8
1b30d0ff-47a0-11ed-aedd-7cd30abc95d8
1b30d0ff-47a0-11ed-aedd-7cd30abc95d8
1b30d0ff-47a0-11ed-aedd-7cd30abc95d8
1b30d0ff-47a0-11ed-aedd-7cd30abc95d8
1b30d0ff-47a0-11ed-aedd-7cd30abc95d8
1b30d0ff-47a0-11ed-aedd-7cd30abc95d8
1b30d0ff-47a0-11ed-aedd-7cd30abc95d8
1b30d0ff-47a0-11ed-aedd-7cd30abc95d8
1b30d0ff-47a0-11ed-aedd-7cd30abc95d8
1b30d0ff-47a0-11ed-aedd-7cd30abc95d8
1b30d0ff-47a0-11ed-aedd-7cd30abc95d8
1b30d0ff-47a0-11ed-aedd-7cd30abc95d8
1b30d0ff-47a0-11ed-aedd-7cd30abc95d8
1b30d0ff-47a0-11ed-aedd-7cd30abc95d8
1b30d0ff-47a0-11ed-aedd-7cd30abc95d8
1b30d0ff-47a0-11ed-aedd-7cd30abc95d8
1b30d0ff-47a0-11ed-aedd-7cd30abc95d8
1b30d0ff-47a0-11ed-aedd-7cd30abc95d8
1b30d0ff-47a0-11ed-aedd-7cd30abc95d8
1b30d0ff-47a0-11ed-aedd-7cd30abc95d8
1b30d0ff-47a0-11ed-aedd-7cd30abc95d8
1b30d0ff-47a0-11ed-aedd-7cd30abc95d8
1b30d0ff-47a0-11ed-aedd-7cd30abc95d8
1b30d0ff-47a0-11ed-aedd-7cd30abc95d8
1b30d0ff-47a0-11ed-aedd-7cd30abc95d8
1b30d0ff-47a0-11ed-aedd-7cd30abc95d8
1b30d0ff-47a0-11ed-aedd-7cd30abc95d8
1b30d0ff-47a0-11ed-aedd-7cd30abc95d8
1b30d0ff-47a0-11ed-aedd-7cd30abc95d8
1b30d0ff-47a0-11ed-aedd-7cd30abc95d8
1b30d0ff-47a0-11ed-aedd-7cd30abc95d8
1b30d0ff-47a0-11ed-aedd-7cd30abc95d8
1b30d0ff-47a0-11ed-aedd-7cd30abc95d8
1b30d0ff-47a0-11ed-aedd-7cd30abc95d8
1b30d0ff-47a0-11ed-aedd-7cd30abc95d8
1b30d0ff-47a0-11ed-aedd-7cd30abc95d8
1b30d0ff-47a0-11ed-aedd-7cd30abc95d8
1b30d0ff-47a0-11ed-aedd-7cd30abc95d8
1b30d0ff-47a0-11ed-aedd-7cd30abc95d8
1b30d0ff-47a0-11ed-aedd-7cd30abc95d8
1b30d0ff-47a0-11ed-aedd-7cd30abc95d8
1b30d0ff-47a0-11ed-aedd-7cd30abc95d8
1b30d0ff-47a0-11ed-aedd-7cd30abc95d8
1b30d0ff-47a0-11ed-aedd-7cd30abc95d8
1b30d0ff-47a0-11ed-aedd-7cd30abc95d8
1b30d0ff-47a0-11ed-aedd-7cd30abc95d8
1b30d0ff-47a0-11ed-aedd-7cd30abc95d8
1b30d0ff-47a0-11ed-aedd-7cd30abc95d8
1b30d0ff-47a0-11ed-aedd-7cd30abc95d8
1b30d0ff-47a0-11ed-aedd-7cd30abc95d8
1b30d0ff-47a0-11ed-aedd-7cd30abc95d8
1b30d0ff-47a0-11ed-aedd-7cd30abc95d8
1b30d0ff-47a0-11ed-aedd-7cd30abc95d8
1b30d0ff-47a0-11ed-aedd-7cd30abc95d8
1b30d0ff-47a0-11ed-aedd-7cd30abc95d8
1b30d0ff-47a0-11ed-aedd-7cd30abc95d8
1b30d0ff-47a0-11ed-aedd-7cd30abc95d8
1b30d0ff-47a0-11ed-aedd-7cd30abc95d8
1b30d0ff-47a0-11ed-aedd-7cd30abc95d8
1b30d0ff-47a0-11ed-aedd-7cd30abc95d8
1b30d0ff-47a0-11ed-aedd-7cd30abc95d8
1b30d0ff-47a0-11ed-aedd-7cd30abc95d8
1b30d0ff-47a0-11ed-aedd-7cd30abc95d8
1b30d0ff-47a0-11ed-aedd-7cd30abc95d8
1b30d0ff-47a0-11ed-aedd-7cd30abc95d8
1b30d0ff-47a0-11ed-aedd-7cd30abc95d8
1b30d0ff-47a0-11ed-aedd-7cd30abc95d8
1b30d0ff-47a0-11ed-aedd-7cd30abc95d8
1b30d0ff-47a0-11ed-aedd-7cd30abc95d8
1b30d0ff-47a0-11ed-aedd-7cd30abc95d8
1b30d0ff-47a0-11ed-aedd-7cd30abc95d8
1b30d0ff-47a0-11ed-aedd-7cd30abc95d8
1b30d0ff-47a0-11ed-aedd-7cd30abc95d8
1b30d0ff-47a0-11ed-aedd-7cd30abc95d8
1b30d0ff-47a0-11ed-aedd-7cd30abc95d8
1b30d0ff-47a0-11ed-aedd-7cd30abc95d8
1b30d0ff-47a0-11ed-aedd-7cd30abc95d8
1b30d0ff-47a0-11ed-aedd-7cd30abc95d8
1b30d0ff-47a0-11ed-aedd-7cd30abc95d8
1b30d0ff-47a0-11ed-aedd-7cd30abc95d8
1b30d0ff-47a0-11ed-aedd-7cd30abc95d8
1b30d0ff-47a0-11ed-aedd-7cd30abc95d8
1b30d0ff-47a0-11ed-aedd-7cd30abc95d8
1b30d0ff-47a0-11ed-aedd-7cd30abc95d8
1b30d0ff-47a0-11ed-aedd-7cd30abc95d8
1b30d0ff-47a0-11ed-aedd-7cd30abc95d8
1b30d0ff-47a0-11ed-aedd-7cd30abc95d8
1b30d0ff-47a0-11ed-aedd-7cd30abc95d8
1b30d0ff-47a0-11ed-aedd-7cd30abc95d8
1b30d0ff-47a0-11ed-aedd-7cd30abc95d8
1b30d0ff-47a0-11ed-aedd-7cd30abc95d8
1b30d0ff-47a0-11ed-aedd-7cd30abc95d8
1b30d0ff-47a0-11ed-aedd-7cd30abc95d8
1b30d0ff-47a0-11ed-aedd-7cd30abc95d8
1b30d0ff-47a0-11ed-aedd-7cd30abc95d8
1b30d0ff-47a0-11ed-aedd-7cd30abc95d8
1b30d0ff-47a0-11ed-aedd-7cd30abc95d8
1b30d0ff-47a0-11ed-aedd-7cd30abc95d8
1b30d0ff-47a0-11ed-aedd-7cd30abc95d8
1b30d0ff-47a0-11ed-aedd-7cd30abc95d8
1b30d0ff-47a0-11ed-aedd-7cd30abc95d8
1b30d0ff-47a0-11ed-aedd-7cd30abc95d8
1b30d0ff-47a0-11ed-aedd-7cd30abc95d8
1b30d0ff-47a0-11ed-aedd-7cd30abc95d8
1b30d0ff-47a0-11ed-aedd-7cd30abc95d8
1b30d0ff-47a0-11ed-aedd-7cd30abc95d8
1b30d0ff-47a0-11ed-aedd-7cd30abc95d8
1b30d0ff-47a0-11ed-aedd-7cd30abc95d8
1b30d0ff-47a0-11ed-aedd-7cd30abc95d8
1b30d0ff-47a0-11ed-aedd-7cd30abc95d8
1b30d0ff-47a0-11ed-aedd-7cd30abc95d8
1b30d0ff-47a0-11ed-aedd-7cd30abc95d8
1b30d0ff-47a0-11ed-aedd-7cd30abc95d8
1b30d0ff-47a0-11ed-aedd-7cd30abc95d8
1b30d0ff-47a0-11ed-aedd-7cd30abc95d8
1b30d0ff-47a0-11ed-aedd-7cd30abc95d8
1b30d0ff-47a0-11ed-aedd-7cd30abc95d8
1b30d0ff-47a0-11ed-aedd-7cd30abc95d8
1b30d0ff-47a0-11ed-aedd-7cd30abc95d8
1b30d0ff-47a0-11ed-aedd-7cd30abc95d8
1b30d0ff-47a0-11ed-aedd-7cd30abc95d8
1b30d0ff-47a0-11ed-aedd-7cd30abc95d8
1b30d0ff-47a0-11ed-aedd-7cd30abc95d8
1b30d0ff-47a0-11ed-aedd-7cd30abc95d8
1b30d0ff-47a0-11ed-aedd-7cd30abc95d8
1b30d0ff-47a0-11ed-aedd-7cd30abc95d8
1b30d0ff-47a0-11ed-aedd-7cd30abc95d8
1b30d0ff-47a0-11ed-aedd-7cd30abc95d8
1b30d0ff-47a0-11ed-aedd-7cd30abc95d8
1b30d0ff-47a0-11ed-aedd-7cd30abc95d8
1b30d0ff-47a0-11ed-aedd-7cd30abc95d8
1b30d0ff-47a0-11ed-aedd-7cd30abc95d8
1b30d0ff-47a0-11ed-aedd-7cd30abc95d8
1b30d0ff-47a0-11ed-aedd-7cd30abc95d8
1b30d0ff-47a0-11ed-aedd-7cd30abc95d8
1b30d0ff-47a0-11ed-aedd-7cd30abc95d8
1b30d0ff-47a0-11ed-aedd-7cd30abc95d8
1b30d0ff-47a0-11ed-aedd-7cd30abc95d8
1b30d0ff-47a0-11ed-aedd-7cd30abc95d8
1b30d0ff-47a0-11ed-aedd-7cd30abc95d8
1b30d0ff-47a0-11ed-aedd-7cd30abc95d8
1b30d0ff-47a0-11ed-aedd-7cd30abc95d8
1b30d0ff-47a0-11ed-aedd-7cd30abc95d8
1b30d0ff-47a0-11ed-aedd-7cd30abc95d8
1b30d0ff-47a0-11ed-aedd-7cd30abc95d8
1b30d0ff-47a0-11ed-aedd-7cd30abc95d8
1b30d0ff-47a0-11ed-aedd-7cd30abc95d8
1b30d0ff-47a0-11ed-aedd-7cd30abc95d8
1b30d0ff-47a0-11ed-aedd-7cd30abc95d8
1b30d0ff-47a0-11ed-aedd-7cd30abc95d8
1b30d0ff-47a0-11ed-aedd-7cd30abc95d8
1b30d0ff-47a0-11ed-aedd-7cd30abc95d8
1b30d0ff-47a0-11ed-aedd-7cd30abc95d8
1b30d0ff-47a0-11ed-aedd-7cd30abc95d8
1b30d0ff-47a0-11ed-aedd-7cd30abc95d8
1b30d0ff-47a0-11ed-aedd-7cd30abc95d8
1b30d0ff-47a0-11ed-aedd-7cd30abc95d8
1b30d0ff-47a0-11ed-aedd-7cd30abc95d8
1b30d0ff-47a0-11ed-aedd-7cd30abc95d8
1b30d0ff-47a0-11ed-aedd-7cd30abc95d8
1b30d0ff-47a0-11ed-aedd-7cd30abc95d8
1b30d0ff-47a0-11ed-aedd-7cd30abc95d8
1b30d0ff-47a0-11ed-aedd-7cd30abc95d8
1b30d0ff-47a0-11ed-aedd-7cd30abc95d8
1b30d0ff-47a0-11ed-aedd-7cd30abc95d8
1b30d0ff-47a0-11ed-aedd-7cd30abc95d8
1b30d0ff-47a0-11ed-aedd-7cd30abc95d8
1b30d0ff-47a0-11ed-aedd-7cd30abc95d8
1b30d0ff-47a0-11ed-aedd-7cd30abc95d8
1b30d0ff-47a0-11ed-aedd-7cd30abc95d8
1b30d0ff-47a0-11ed-aedd-7cd30abc95d8
1b30d0ff-47a0-11ed-aedd-7cd30abc95d8
1b30d0ff-47a0-11ed-aedd-7cd30abc95d8
1b30d0ff-47a0-11ed-aedd-7cd30abc95d8
1b30d0ff-47a0-11ed-aedd-7cd30abc95d8
1b30d0ff-47a0-11ed-aedd-7cd30abc95d8
1b30d0ff-47a0-11ed-aedd-7cd30abc95d8
1b30d0ff-47a0-11ed-aedd-7cd30abc95d8
1b30d0ff-47a0-11ed-aedd-7cd30abc95d8
1b30d0ff-47a0-11ed-aedd-7cd30abc95d8
1b30d0ff-47a0-11ed-aedd-7cd30abc95d8
1b30d0ff-47a0-11ed-aedd-7cd30abc95d8
1b30d0ff-47a0-11ed-aedd-7cd30abc95d8
1b30d0ff-47a0-11ed-aedd-7cd30abc95d8
1b30d0ff-47a0-11ed-aedd-7cd30abc95d8
1b30d0ff-47a0-11ed-aedd-7cd30abc95d8
1b30d0ff-47a0-11ed-aedd-7cd30abc95d8
1b30d0ff-47a0-11ed-aedd-7cd30abc95d8
1b30d0ff-47a0-11ed-aedd-7cd30abc95d8
1b30d0ff-47a0-11ed-aedd-7cd30abc95d8
1b30d0ff-47a0-11ed-aedd-7cd30abc95d8
1b30d0ff-47a0-11ed-aedd-7cd30abc95d8
1b30d0ff-47a0-11ed-aedd-7cd30abc95d8
1b30d0ff-47a0-11ed-aedd-7cd30abc95d8
1b30d0ff-47a0-11ed-aedd-7cd30abc95d8
1b30d0ff-47a0-11ed-aedd-7cd30abc95d8
1b30d0ff-47a0-11ed-aedd-7cd30abc95d8
1b30d0ff-47a0-11ed-aedd-7cd30abc95d8
1b30d0ff-47a0-11ed-aedd-7cd30abc95d8
1b30d0ff-47a0-11ed-aedd-7cd30abc95d8
1b30d0ff-47a0-11ed-aedd-7cd30abc95d8
1b30d0ff-47a0-11ed-aedd-7cd30abc95d8
1b30d0ff-47a0-11ed-aedd-7cd30abc95d8
1b30d0ff-47a0-11ed-aedd-7cd30abc95d8
1b30d0ff-47a0-11ed-aedd-7cd30abc95d8
1b30d0ff-47a0-11ed-aedd-7cd30abc95d8
1b30d0ff-47a0-11ed-aedd-7cd30abc95d8
1b30d0ff-47a0-11ed-aedd-7cd30abc95d8
1b30d0ff-47a0-11ed-aedd-7cd30abc95d8
1b30d0ff-47a0-11ed-aedd-7cd30abc95d8
1b30d0ff-47a0-11ed-aedd-7cd30abc95d8
1b30d0ff-47a0-11ed-aedd-7cd30abc95d8
1b30d0ff-47a0-11ed-aedd-7cd30abc95d8
1b30d0ff-47a0-11ed-aedd-7cd30abc95d8
1b30d0ff-47a0-11ed-aedd-7cd30abc95d8
1b30d0ff-47a0-11ed-aedd-7cd30abc95d8
1b30d0ff-47a0-11ed-aedd-7cd30abc95d8
1b30d0ff-47a0-11ed-aedd-7cd30abc95d8
1b30d0ff-47a0-11ed-aedd-7cd30abc95d8
1b30d0ff-47a0-11ed-aedd-7cd30abc95d8
1b30d0ff-47a0-11ed-aedd-7cd30abc95d8
1b30d0ff-47a0-11ed-aedd-7cd30abc95d8
1b30d0ff-47a0-11ed-aedd-7cd30abc95d8
1b30d0ff-47a0-11ed-aedd-7cd30abc95d8
1b30d0ff-47a0-11ed-aedd-7cd30abc95d8
1b30d0ff-47a0-11ed-aedd-7cd30abc95d8
1b30d0ff-47a0-11ed-aedd-7cd30abc95d8
1b30d0ff-47a0-11ed-aedd-7cd30abc95d8
1b30d0ff-47a0-11ed-aedd-7cd30abc95d8
1b30d0ff-47a0-11ed-aedd-7cd30abc95d8
1b30d0ff-47a0-11ed-aedd-7cd30abc95d8
1b30d0ff-47a0-11ed-aedd-7cd30abc95d8
1b30d0ff-47a0-11ed-aedd-7cd30abc95d8
1b30d0ff-47a0-11ed-aedd-7cd30abc95d8
1b30d0ff-47a0-11ed-aedd-7cd30abc95d8
1b30d0ff-47a0-11ed-aedd-7cd30abc95d8
1b30d0ff-47a0-11ed-aedd-7cd30abc95d8
1b30d0ff-47a0-11ed-aedd-7cd30abc95d8
1b30d0ff-47a0-11ed-aedd-7cd30abc95d8
1b30d0ff-47a0-11ed-aedd-7cd30abc95d8
1b30d0ff-47a0-11ed-aedd-7cd30abc95d8
1b30d0ff-47a0-11ed-aedd-7cd30abc95d8
1b30d0ff-47a0-11ed-aedd-7cd30abc95d8
1b30d0ff-47a0-11ed-aedd-7cd30abc95d8
1b30d0ff-47a0-11ed-aedd-7cd30abc95d8
1b30d0ff-47a0-11ed-aedd-7cd30abc95d8
1b30d0ff-47a0-11ed-aedd-7cd30abc95d8
1b30d0ff-47a0-11ed-aedd-7cd30abc95d8
1b30d0ff-47a0-11ed-aedd-7cd30abc95d8
1b30d0ff-47a0-11ed-aedd-7cd30abc95d8
1b30d0ff-47a0-11ed-aedd-7cd30abc95d8
1b30d0ff-47a0-11ed-aedd-7cd30abc95d8
1b30d0ff-47a0-11ed-aedd-7cd30abc95d8
1b30d0ff-47a0-11ed-aedd-7cd30abc95d8
1b30d0ff-47a0-11ed-aedd-7cd30abc95d8
1b30d0ff-47a0-11ed-aedd-7cd30abc95d8
1b30d0ff-47a0-11ed-aedd-7cd30abc95d8
1b30d0ff-47a0-11ed-aedd-7cd30abc95d8
1b30d0ff-47a0-11ed-aedd-7cd30abc95d8
1b30d0ff-47a0-11ed-aedd-7cd30abc95d8
1b30d0ff-47a0-11ed-aedd-7cd30abc95d8
1b30d0ff-47a0-11ed-aedd-7cd30abc95d8
1b30d0ff-47a0-11ed-aedd-7cd30abc95d8
1b30d0ff-47a0-11ed-aedd-7cd30abc95d8
1b30d0ff-47a0-11ed-aedd-7cd30abc95d8
1b30d0ff-47a0-11ed-aedd-7cd30abc95d8
1b30d0ff-47a0-11ed-aedd-7cd30abc95d8
1b30d0ff-47a0-11ed-aedd-7cd30abc95d8
1b30d0ff-47a0-11ed-aedd-7cd30abc95d8
1b30d0ff-47a0-11ed-aedd-7cd30abc95d8
1b30d0ff-47a0-11ed-aedd-7cd30abc95d8
1b30d0ff-47a0-11ed-aedd-7cd30abc95d8
1b30d0ff-47a0-11ed-aedd-7cd30abc95d8
1b30d0ff-47a0-11ed-aedd-7cd30abc95d8
1b30d0ff-47a0-11ed-aedd-7cd30abc95d8
1b30d0ff-47a0-11ed-aedd-7cd30abc95d8
1b30d0ff-47a0-11ed-aedd-7cd30abc95d8
1b30d0ff-47a0-11ed-aedd-7cd30abc95d8
1b30d0ff-47a0-11ed-aedd-7cd30abc95d8
1b30d0ff-47a0-11ed-aedd-7cd30abc95d8
1b30d0ff-47a0-11ed-aedd-7cd30abc95d8
1b30d0ff-47a0-11ed-aedd-7cd30abc95d8
1b30d0ff-47a0-11ed-aedd-7cd30abc95d8
1b30d0ff-47a0-11ed-aedd-7cd30abc95d8
1b30d0ff-47a0-11ed-aedd-7cd30abc95d8
1b30d0ff-47a0-11ed-aedd-7cd30abc95d8
1b30d0ff-47a0-11ed-aedd-7cd30abc95d8
1b30d0ff-47a0-11ed-aedd-7cd30abc95d8
1b30d0ff-47a0-11ed-aedd-7cd30abc95d8
1b30d0ff-47a0-11ed-aedd-7cd30abc95d8
1b30d0ff-47a0-11ed-aedd-7cd30abc95d8
1b30d0ff-47a0-11ed-aedd-7cd30abc95d8
1b30d0ff-47a0-11ed-aedd-7cd30abc95d8
1b30d0ff-47a0-11ed-aedd-7cd30abc95d8
1b30d0ff-47a0-11ed-aedd-7cd30abc95d8
1b30d0ff-47a0-11ed-aedd-7cd30abc95d8
1b30d0ff-47a0-11ed-aedd-7cd30abc95d8
1b30d0ff-47a0-11ed-aedd-7cd30abc95d8
1b30d0ff-47a0-11ed-aedd-7cd30abc95d8
1b30d0ff-47a0-11ed-aedd-7cd30abc95d8
1b30d0ff-47a0-11ed-aedd-7cd30abc95d8
1b30d0ff-47a0-11ed-aedd-7cd30abc95d8
1b30d0ff-47a0-11ed-aedd-7cd30abc95d8
1b30d0ff-47a0-11ed-aedd-7cd30abc95d8
1b30d0ff-47a0-11ed-aedd-7cd30abc95d8
1b30d0ff-47a0-11ed-aedd-7cd30abc95d8
1b30d0ff-47a0-11ed-aedd-7cd30abc95d8
1b30d0ff-47a0-11ed-aedd-7cd30abc95d8
1b30d0ff-47a0-11ed-aedd-7cd30abc95d8
1b30d0ff-47a0-11ed-aedd-7cd30abc95d8
1b30d0ff-47a0-11ed-aedd-7cd30abc95d8
1b30d0ff-47a0-11ed-aedd-7cd30abc95d8
1b30d0ff-47a0-11ed-aedd-7cd30abc95d8
1b30d0ff-47a0-11ed-aedd-7cd30abc95d8
1b30d0ff-47a0-11ed-aedd-7cd30abc95d8
1b30d0ff-47a0-11ed-aedd-7cd30abc95d8
1b30d0ff-47a0-11ed-aedd-7cd30abc95d8
1b30d0ff-47a0-11ed-aedd-7cd30abc95d8
1b30d0ff-47a0-11ed-aedd-7cd30abc95d8
1b30d0ff-47a0-11ed-aedd-7cd30abc95d8
1b30d0ff-47a0-11ed-aedd-7cd30abc95d8
1b30d0ff-47a0-11ed-aedd-7cd30abc95d8
1b30d0ff-47a0-11ed-aedd-7cd30abc95d8
1b30d0ff-47a0-11ed-aedd-7cd30abc95d8
1b30d0ff-47a0-11ed-aedd-7cd30abc95d8
1b30d0ff-47a0-11ed-aedd-7cd30abc95d8
1b30d0ff-47a0-11ed-aedd-7cd30abc95d8
1b30d0ff-47a0-11ed-aedd-7cd30abc95d8
1b30d0ff-47a0-11ed-aedd-7cd30abc95d8
1b30d0ff-47a0-11ed-aedd-7cd30abc95d8
1b30d0ff-47a0-11ed-aedd-7cd30abc95d8
1b30d0ff-47a0-11ed-aedd-7cd30abc95d8
1b30d0ff-47a0-11ed-aedd-7cd30abc95d8
1b30d0ff-47a0-11ed-aedd-7cd30abc95d8
1b30d0ff-47a0-11ed-aedd-7cd30abc95d8
1b30d0ff-47a0-11ed-aedd-7cd30abc95d8
1b30d0ff-47a0-11ed-aedd-7cd30abc95d8
1b30d0ff-47a0-11ed-aedd-7cd30abc95d8
1b30d0ff-47a0-11ed-aedd-7cd30abc95d8
1b30d0ff-47a0-11ed-aedd-7cd30abc95d8
1b30d0ff-47a0-11ed-aedd-7cd30abc95d8
1b30d0ff-47a0-11ed-aedd-7cd30abc95d8
1b30d0ff-47a0-11ed-aedd-7cd30abc95d8
1b30d0ff-47a0-11ed-aedd-7cd30abc95d8
1b30d0ff-47a0-11ed-aedd-7cd30abc95d8
1b30d0ff-47a0-11ed-aedd-7cd30abc95d8
1b30d0ff-47a0-11ed-aedd-7cd30abc95d8
1b30d0ff-47a0-11ed-aedd-7cd30abc95d8
1b30d0ff-47a0-11ed-aedd-7cd30abc95d8
1b30d0ff-47a0-11ed-aedd-7cd30abc95d8
1b30d0ff-47a0-11ed-aedd-7cd30abc95d8
1b30d0ff-47a0-11ed-aedd-7cd30abc95d8
1b30d0ff-47a0-11ed-aedd-7cd30abc95d8
1b30d0ff-47a0-11ed-aedd-7cd30abc95d8
1b30d0ff-47a0-11ed-aedd-7cd30abc95d8
1b30d0ff-47a0-11ed-aedd-7cd30abc95d8
1b30d0ff-47a0-11ed-aedd-7cd30abc95d8
1b30d0ff-47a0-11ed-aedd-7cd30abc95d8
1b30d0ff-47a0-11ed-aedd-7cd30abc95d8
1b30d0ff-47a0-11ed-aedd-7cd30abc95d8
1b30d0ff-47a0-11ed-aedd-7cd30abc95d8
1b30d0ff-47a0-11ed-aedd-7cd30abc95d8
1b30d0ff-47a0-11ed-aedd-7cd30abc95d8
1b30d0ff-47a0-11ed-aedd-7cd30abc95d8
1b30d0ff-47a0-11ed-aedd-7cd30abc95d8
1b30d0ff-47a0-11ed-aedd-7cd30abc95d8
1b30d0ff-47a0-11ed-aedd-7cd30abc95d8
1b30d0ff-47a0-11ed-aedd-7cd30abc95d8
1b30d0ff-47a0-11ed-aedd-7cd30abc95d8
1b30d0ff-47a0-11ed-aedd-7cd30abc95d8
1b30d0ff-47a0-11ed-aedd-7cd30abc95d8
1b30d0ff-47a0-11ed-aedd-7cd30abc95d8
1b30d0ff-47a0-11ed-aedd-7cd30abc95d8
1b30d0ff-47a0-11ed-aedd-7cd30abc95d8
1b30d0ff-47a0-11ed-aedd-7cd30abc95d8
1b30d0ff-47a0-11ed-aedd-7cd30abc95d8
1b30d0ff-47a0-11ed-aedd-7cd30abc95d8
1b30d0ff-47a0-11ed-aedd-7cd30abc95d8
1b30d0ff-47a0-11ed-aedd-7cd30abc95d8
1b30d0ff-47a0-11ed-aedd-7cd30abc95d8
1b30d0ff-47a0-11ed-aedd-7cd30abc95d8
1b30d0ff-47a0-11ed-aedd-7cd30abc95d8
1b30d0ff-47a0-11ed-aedd-7cd30abc95d8
1b30d0ff-47a0-11ed-aedd-7cd30abc95d8
1b30d0ff-47a0-11ed-aedd-7cd30abc95d8
1b30d0ff-47a0-11ed-aedd-7cd30abc95d8
1b30d0ff-47a0-11ed-aedd-7cd30abc95d8
1b30d0ff-47a0-11ed-aedd-7cd30abc95d8
1b30d0ff-47a0-11ed-aedd-7cd30abc95d8
1b30d0ff-47a0-11ed-aedd-7cd30abc95d8
1b30d0ff-47a0-11ed-aedd-7cd30abc95d8
1b30d0ff-47a0-11ed-aedd-7cd30abc95d8
1b30d0ff-47a0-11ed-aedd-7cd30abc95d8
1b30d0ff-47a0-11ed-aedd-7cd30abc95d8
1b30d0ff-47a0-11ed-aedd-7cd30abc95d8
1b30d0ff-47a0-11ed-aedd-7cd30abc95d8
1b30d0ff-47a0-11ed-aedd-7cd30abc95d8
1b30d0ff-47a0-11ed-aedd-7cd30abc95d8
1b30d0ff-47a0-11ed-aedd-7cd30abc95d8
1b30d0ff-47a0-11ed-aedd-7cd30abc95d8
1b30d0ff-47a0-11ed-aedd-7cd30abc95d8
1b30d0ff-47a0-11ed-aedd-7cd30abc95d8
1b30d0ff-47a0-11ed-aedd-7cd30abc95d8
1b30d0ff-47a0-11ed-aedd-7cd30abc95d8
1b30d0ff-47a0-11ed-aedd-7cd30abc95d8
1b30d0ff-47a0-11ed-aedd-7cd30abc95d8
1b30d0ff-47a0-11ed-aedd-7cd30abc95d8
1b30d0ff-47a0-11ed-aedd-7cd30abc95d8
1b30d0ff-47a0-11ed-aedd-7cd30abc95d8
1b30d0ff-47a0-11ed-aedd-7cd30abc95d8
1b30d0ff-47a0-11ed-aedd-7cd30abc95d8
1b30d0ff-47a0-11ed-aedd-7cd30abc95d8
1b30d0ff-47a0-11ed-aedd-7cd30abc95d8
1b30d0ff-47a0-11ed-aedd-7cd30abc95d8
1b30d0ff-47a0-11ed-aedd-7cd30abc95d8
1b30d0ff-47a0-11ed-aedd-7cd30abc95d8
1b30d0ff-47a0-11ed-aedd-7cd30abc95d8
1b30d0ff-47a0-11ed-aedd-7cd30abc95d8
1b30d0ff-47a0-11ed-aedd-7cd30abc95d8
1b30d0ff-47a0-11ed-aedd-7cd30abc95d8
1b30d0ff-47a0-11ed-aedd-7cd30abc95d8
1b30d0ff-47a0-11ed-aedd-7cd30abc95d8
1b30d0ff-47a0-11ed-aedd-7cd30abc95d8
1b30d0ff-47a0-11ed-aedd-7cd30abc95d8
1b30d0ff-47a0-11ed-aedd-7cd30abc95d8
1b30d0ff-47a0-11ed-aedd-7cd30abc95d8
1b30d0ff-47a0-11ed-aedd-7cd30abc95d8
1b30d0ff-47a0-11ed-aedd-7cd30abc95d8
1b30d0ff-47a0-11ed-aedd-7cd30abc95d8
1b30d0ff-47a0-11ed-aedd-7cd30abc95d8
1b30d0ff-47a0-11ed-aedd-7cd30abc95d8
1b30d0ff-47a0-11ed-aedd-7cd30abc95d8
1b30d0ff-47a0-11ed-aedd-7cd30abc95d8
1b30d0ff-47a0-11ed-aedd-7cd30abc95d8
1b30d0ff-47a0-11ed-aedd-7cd30abc95d8
1b30d0ff-47a0-11ed-aedd-7cd30abc95d8
1b30d0ff-47a0-11ed-aedd-7cd30abc95d8
1b30d0ff-47a0-11ed-aedd-7cd30abc95d8
1b30d0ff-47a0-11ed-aedd-7cd30abc95d8
1b30d0ff-47a0-11ed-aedd-7cd30abc95d8
1b30d0ff-47a0-11ed-aedd-7cd30abc95d8
1b30d0ff-47a0-11ed-aedd-7cd30abc95d8
1b30d0ff-47a0-11ed-aedd-7cd30abc95d8
1b30d0ff-47a0-11ed-aedd-7cd30abc95d8
1b30d0ff-47a0-11ed-aedd-7cd30abc95d8
1b30d0ff-47a0-11ed-aedd-7cd30abc95d8
1b30d0ff-47a0-11ed-aedd-7cd30abc95d8
1b30d0ff-47a0-11ed-aedd-7cd30abc95d8
1b30d0ff-47a0-11ed-aedd-7cd30abc95d8
1b30d0ff-47a0-11ed-aedd-7cd30abc95d8
1b30d0ff-47a0-11ed-aedd-7cd30abc95d8
1b30d0ff-47a0-11ed-aedd-7cd30abc95d8
1b30d0ff-47a0-11ed-aedd-7cd30abc95d8
1b30d0ff-47a0-11ed-aedd-7cd30abc95d8
1b30d0ff-47a0-11ed-aedd-7cd30abc95d8
1b30d0ff-47a0-11ed-aedd-7cd30abc95d8
1b30d0ff-47a0-11ed-aedd-7cd30abc95d8
1b30d0ff-47a0-11ed-aedd-7cd30abc95d8
1b30d0ff-47a0-11ed-aedd-7cd30abc95d8
1b30d0ff-47a0-11ed-aedd-7cd30abc95d8
1b30d0ff-47a0-11ed-aedd-7cd30abc95d8
1b30d0ff-47a0-11ed-aedd-7cd30abc95d8
1b30d0ff-47a0-11ed-aedd-7cd30abc95d8
1b30d0ff-47a0-11ed-aedd-7cd30abc95d8
1b30d0ff-47a0-11ed-aedd-7cd30abc95d8
1b30d0ff-47a0-11ed-aedd-7cd30abc95d8
1b30d0ff-47a0-11ed-aedd-7cd30abc95d8
1b30d0ff-47a0-11ed-aedd-7cd30abc95d8
1b30d0ff-47a0-11ed-aedd-7cd30abc95d8
1b30d0ff-47a0-11ed-aedd-7cd30abc95d8
1b30d0ff-47a0-11ed-aedd-7cd30abc95d8
1b30d0ff-47a0-11ed-aedd-7cd30abc95d8
1b30d0ff-47a0-11ed-aedd-7cd30abc95d8
1b30d0ff-47a0-11ed-aedd-7cd30abc95d8
1b30d0ff-47a0-11ed-aedd-7cd30abc95d8
1b30d0ff-47a0-11ed-aedd-7cd30abc95d8
1b30d0ff-47a0-11ed-aedd-7cd30abc95d8
1b30d0ff-47a0-11ed-aedd-7cd30abc95d8
1b30d0ff-47a0-11ed-aedd-7cd30abc95d8
1b30d0ff-47a0-11ed-aedd-7cd30abc95d8
1b30d0ff-47a0-11ed-aedd-7cd30abc95d8
1b30d0ff-47a0-11ed-aedd-7cd30abc95d8
1b30d0ff-47a0-11ed-aedd-7cd30abc95d8
1b30d0ff-47a0-11ed-aedd-7cd30abc95d8
1b30d0ff-47a0-11ed-aedd-7cd30abc95d8
1b30d0ff-47a0-11ed-aedd-7cd30abc95d8
1b30d0ff-47a0-11ed-aedd-7cd30abc95d8
1b30d0ff-47a0-11ed-aedd-7cd30abc95d8
1b30d0ff-47a0-11ed-aedd-7cd30abc95d8
1b30d0ff-47a0-11ed-aedd-7cd30abc95d8
1b30d0ff-47a0-11ed-aedd-7cd30abc95d8
1b30d0ff-47a0-11ed-aedd-7cd30abc95d8
1b30d0ff-47a0-11ed-aedd-7cd30abc95d8
1b30d0ff-47a0-11ed-aedd-7cd30abc95d8
1b30d0ff-47a0-11ed-aedd-7cd30abc95d8
1b30d0ff-47a0-11ed-aedd-7cd30abc95d8
1b30d0ff-47a0-11ed-aedd-7cd30abc95d8
1b30d0ff-47a0-11ed-aedd-7cd30abc95d8
1b30d0ff-47a0-11ed-aedd-7cd30abc95d8
1b30d0ff-47a0-11ed-aedd-7cd30abc95d8
1b30d0ff-47a0-11ed-aedd-7cd30abc95d8
1b30d0ff-47a0-11ed-aedd-7cd30abc95d8
1b30d0ff-47a0-11ed-aedd-7cd30abc95d8
1b30d0ff-47a0-11ed-aedd-7cd30abc95d8
1b30d0ff-47a0-11ed-aedd-7cd30abc95d8
1b30d0ff-47a0-11ed-aedd-7cd30abc95d8
1b30d0ff-47a0-11ed-aedd-7cd30abc95d8
1b30d0ff-47a0-11ed-aedd-7cd30abc95d8
1b30d0ff-47a0-11ed-aedd-7cd30abc95d8
1b30d0ff-47a0-11ed-aedd-7cd30abc95d8
1b30d0ff-47a0-11ed-aedd-7cd30abc95d8
1b30d0ff-47a0-11ed-aedd-7cd30abc95d8
1b30d0ff-47a0-11ed-aedd-7cd30abc95d8
1b30d0ff-47a0-11ed-aedd-7cd30abc95d8
1b30d0ff-47a0-11ed-aedd-7cd30abc95d8
1b30d0ff-47a0-11ed-aedd-7cd30abc95d8
1b30d0ff-47a0-11ed-aedd-7cd30abc95d8
1b30d0ff-47a0-11ed-aedd-7cd30abc95d8
1b30d0ff-47a0-11ed-aedd-7cd30abc95d8
1b30d0ff-47a0-11ed-aedd-7cd30abc95d8
1b30d0ff-47a0-11ed-aedd-7cd30abc95d8
1b30d0ff-47a0-11ed-aedd-7cd30abc95d8
1b30d0ff-47a0-11ed-aedd-7cd30abc95d8
1b30d0ff-47a0-11ed-aedd-7cd30abc95d8
1b30d0ff-47a0-11ed-aedd-7cd30abc95d8
1b30d0ff-47a0-11ed-aedd-7cd30abc95d8
1b30d0ff-47a0-11ed-aedd-7cd30abc95d8
1b30d0ff-47a0-11ed-aedd-7cd30abc95d8
1b30d0ff-47a0-11ed-aedd-7cd30abc95d8
1b30d0ff-47a0-11ed-aedd-7cd30abc95d8
1b30d0ff-47a0-11ed-aedd-7cd30abc95d8
1b30d0ff-47a0-11ed-aedd-7cd30abc95d8
1b30d0ff-47a0-11ed-aedd-7cd30abc95d8
1b30d0ff-47a0-11ed-aedd-7cd30abc95d8
1b30d0ff-47a0-11ed-aedd-7cd30abc95d8
1b30d0ff-47a0-11ed-aedd-7cd30abc95d8
1b30d0ff-47a0-11ed-aedd-7cd30abc95d8
1b30d0ff-47a0-11ed-aedd-7cd30abc95d8
1b30d0ff-47a0-11ed-aedd-7cd30abc95d8
1b30d0ff-47a0-11ed-aedd-7cd30abc95d8
1b30d0ff-47a0-11ed-aedd-7cd30abc95d8
1b30d0ff-47a0-11ed-aedd-7cd30abc95d8
1b30d0ff-47a0-11ed-aedd-7cd30abc95d8
1b30d0ff-47a0-11ed-aedd-7cd30abc95d8
1b30d0ff-47a0-11ed-aedd-7cd30abc95d8
1b30d0ff-47a0-11ed-aedd-7cd30abc95d8
1b30d0ff-47a0-11ed-aedd-7cd30abc95d8
1b30d0ff-47a0-11ed-aedd-7cd30abc95d8
1b30d0ff-47a0-11ed-aedd-7cd30abc95d8
1b30d0ff-47a0-11ed-aedd-7cd30abc95d8
1b30d0ff-47a0-11ed-aedd-7cd30abc95d8
1b30d0ff-47a0-11ed-aedd-7cd30abc95d8
1b30d0ff-47a0-11ed-aedd-7cd30abc95d8
1b30d0ff-47a0-11ed-aedd-7cd30abc95d8
1b30d0ff-47a0-11ed-aedd-7cd30abc95d8
1b30d0ff-47a0-11ed-aedd-7cd30abc95d8
1b30d0ff-47a0-11ed-aedd-7cd30abc95d8
1b30d0ff-47a0-11ed-aedd-7cd30abc95d8
1b30d0ff-47a0-11ed-aedd-7cd30abc95d8
1b30d0ff-47a0-11ed-aedd-7cd30abc95d8
1b30d0ff-47a0-11ed-aedd-7cd30abc95d8
1b30d0ff-47a0-11ed-aedd-7cd30abc95d8
1b30d0ff-47a0-11ed-aedd-7cd30abc95d8
1b30d0ff-47a0-11ed-aedd-7cd30abc95d8
1b30d0ff-47a0-11ed-aedd-7cd30abc95d8
1b30d0ff-47a0-11ed-aedd-7cd30abc95d8
1b30d0ff-47a0-11ed-aedd-7cd30abc95d8
1b30d0ff-47a0-11ed-aedd-7cd30abc95d8
1b30d0ff-47a0-11ed-aedd-7cd30abc95d8
1b30d0ff-47a0-11ed-aedd-7cd30abc95d8
1b30d0ff-47a0-11ed-aedd-7cd30abc95d8
1b30d0ff-47a0-11ed-aedd-7cd30abc95d8
1b30d0ff-47a0-11ed-aedd-7cd30abc95d8
1b30d0ff-47a0-11ed-aedd-7cd30abc95d8
1b30d0ff-47a0-11ed-aedd-7cd30abc95d8
1b30d0ff-47a0-11ed-aedd-7cd30abc95d8
1b30d0ff-47a0-11ed-aedd-7cd30abc95d8
1b30d0ff-47a0-11ed-aedd-7cd30abc95d8
1b30d0ff-47a0-11ed-aedd-7cd30abc95d8
1b30d0ff-47a0-11ed-aedd-7cd30abc95d8
1b30d0ff-47a0-11ed-aedd-7cd30abc95d8
1b30d0ff-47a0-11ed-aedd-7cd30abc95d8
1b30d0ff-47a0-11ed-aedd-7cd30abc95d8
1b30d0ff-47a0-11ed-aedd-7cd30abc95d8
1b30d0ff-47a0-11ed-aedd-7cd30abc95d8
1b30d0ff-47a0-11ed-aedd-7cd30abc95d8
1b30d0ff-47a0-11ed-aedd-7cd30abc95d8
1b30d0ff-47a0-11ed-aedd-7cd30abc95d8
1b30d0ff-47a0-11ed-aedd-7cd30abc95d8
1b30d0ff-47a0-11ed-aedd-7cd30abc95d8
1b30d0ff-47a0-11ed-aedd-7cd30abc95d8
1b30d0ff-47a0-11ed-aedd-7cd30abc95d8
1b30d0ff-47a0-11ed-aedd-7cd30abc95d8
1b30d0ff-47a0-11ed-aedd-7cd30abc95d8
1b30d0ff-47a0-11ed-aedd-7cd30abc95d8
1b30d0ff-47a0-11ed-aedd-7cd30abc95d8
1b30d0ff-47a0-11ed-aedd-7cd30abc95d8
1b30d0ff-47a0-11ed-aedd-7cd30abc95d8
1b30d0ff-47a0-11ed-aedd-7cd30abc95d8
1b30d0ff-47a0-11ed-aedd-7cd30abc95d8
1b30d0ff-47a0-11ed-aedd-7cd30abc95d8
1b30d0ff-47a0-11ed-aedd-7cd30abc95d8
1b30d0ff-47a0-11ed-aedd-7cd30abc95d8
1b30d0ff-47a0-11ed-aedd-7cd30abc95d8
1b30d0ff-47a0-11ed-aedd-7cd30abc95d8
1b30d0ff-47a0-11ed-aedd-7cd30abc95d8
1b30d0ff-47a0-11ed-aedd-7cd30abc95d8
1b30d0ff-47a0-11ed-aedd-7cd30abc95d8
1b30d0ff-47a0-11ed-aedd-7cd30abc95d8
1b30d0ff-47a0-11ed-aedd-7cd30abc95d8
1b30d0ff-47a0-11ed-aedd-7cd30abc95d8
1b30d0ff-47a0-11ed-aedd-7cd30abc95d8
1b30d0ff-47a0-11ed-aedd-7cd30abc95d8
1b30d0ff-47a0-11ed-aedd-7cd30abc95d8
1b30d0ff-47a0-11ed-aedd-7cd30abc95d8
1b30d0ff-47a0-11ed-aedd-7cd30abc95d8
1b30d0ff-47a0-11ed-aedd-7cd30abc95d8
1b30d0ff-47a0-11ed-aedd-7cd30abc95d8
1b30d0ff-47a0-11ed-aedd-7cd30abc95d8
1b30d0ff-47a0-11ed-aedd-7cd30abc95d8
1b30d0ff-47a0-11ed-aedd-7cd30abc95d8
1b30d0ff-47a0-11ed-aedd-7cd30abc95d8
1b30d0ff-47a0-11ed-aedd-7cd30abc95d8
1b30d0ff-47a0-11ed-aedd-7cd30abc95d8
1b30d0ff-47a0-11ed-aedd-7cd30abc95d8
1b30d0ff-47a0-11ed-aedd-7cd30abc95d8
1b30d0ff-47a0-11ed-aedd-7cd30abc95d8
1b30d0ff-47a0-11ed-aedd-7cd30abc95d8
1b30d0ff-47a0-11ed-aedd-7cd30abc95d8
1b30d0ff-47a0-11ed-aedd-7cd30abc95d8
1b30d0ff-47a0-11ed-aedd-7cd30abc95d8
1b30d0ff-47a0-11ed-aedd-7cd30abc95d8
1b30d0ff-47a0-11ed-aedd-7cd30abc95d8
1b30d0ff-47a0-11ed-aedd-7cd30abc95d8
1b30d0ff-47a0-11ed-aedd-7cd30abc95d8
1b30d0ff-47a0-11ed-aedd-7cd30abc95d8
1b30d0ff-47a0-11ed-aedd-7cd30abc95d8
1b30d0ff-47a0-11ed-aedd-7cd30abc95d8
1b30d0ff-47a0-11ed-aedd-7cd30abc95d8
1b30d0ff-47a0-11ed-aedd-7cd30abc95d8
1b30d0ff-47a0-11ed-aedd-7cd30abc95d8
1b30d0ff-47a0-11ed-aedd-7cd30abc95d8
1b30d0ff-47a0-11ed-aedd-7cd30abc95d8
1b30d0ff-47a0-11ed-aedd-7cd30abc95d8
1b30d0ff-47a0-11ed-aedd-7cd30abc95d8
1b30d0ff-47a0-11ed-aedd-7cd30abc95d8
1b30d0ff-47a0-11ed-aedd-7cd30abc95d8
1b30d0ff-47a0-11ed-aedd-7cd30abc95d8
1b30d0ff-47a0-11ed-aedd-7cd30abc95d8
1b30d0ff-47a0-11ed-aedd-7cd30abc95d8
1b30d0ff-47a0-11ed-aedd-7cd30abc95d8
1b30d0ff-47a0-11ed-aedd-7cd30abc95d8
1b30d0ff-47a0-11ed-aedd-7cd30abc95d8
1b30d0ff-47a0-11ed-aedd-7cd30abc95d8
1b30d0ff-47a0-11ed-aedd-7cd30abc95d8
1b30d0ff-47a0-11ed-aedd-7cd30abc95d8
1b30d0ff-47a0-11ed-aedd-7cd30abc95d8
1b30d0ff-47a0-11ed-aedd-7cd30abc95d8
1b30d0ff-47a0-11ed-aedd-7cd30abc95d8
1b30d0ff-47a0-11ed-aedd-7cd30abc95d8
1b30d0ff-47a0-11ed-aedd-7cd30abc95d8
1b30d0ff-47a0-11ed-aedd-7cd30abc95d8
1b30d0ff-47a0-11ed-aedd-7cd30abc95d8
1b30d0ff-47a0-11ed-aedd-7cd30abc95d8
1b30d0ff-47a0-11ed-aedd-7cd30abc95d8
1b30d0ff-47a0-11ed-aedd-7cd30abc95d8
1b30d0ff-47a0-11ed-aedd-7cd30abc95d8
1b30d0ff-47a0-11ed-aedd-7cd30abc95d8
1b30d0ff-47a0-11ed-aedd-7cd30abc95d8
1b30d0ff-47a0-11ed-aedd-7cd30abc95d8
1b30d0ff-47a0-11ed-aedd-7cd30abc95d8
1b30d0ff-47a0-11ed-aedd-7cd30abc95d8
1b30d0ff-47a0-11ed-aedd-7cd30abc95d8
1b30d0ff-47a0-11ed-aedd-7cd30abc95d8
1b30d0ff-47a0-11ed-aedd-7cd30abc95d8
1b30d0ff-47a0-11ed-aedd-7cd30abc95d8
1b30d0ff-47a0-11ed-aedd-7cd30abc95d8
1b30d0ff-47a0-11ed-aedd-7cd30abc95d8
1b30d0ff-47a0-11ed-aedd-7cd30abc95d8
1b30d0ff-47a0-11ed-aedd-7cd30abc95d8
1b30d0ff-47a0-11ed-aedd-7cd30abc95d8
1b30d0ff-47a0-11ed-aedd-7cd30abc95d8
1b30d0ff-47a0-11ed-aedd-7cd30abc95d8
1b30d0ff-47a0-11ed-aedd-7cd30abc95d8
1b30d0ff-47a0-11ed-aedd-7cd30abc95d8
1b30d0ff-47a0-11ed-aedd-7cd30abc95d8
1b30d0ff-47a0-11ed-aedd-7cd30abc95d8
1b30d0ff-47a0-11ed-aedd-7cd30abc95d8
1b30d0ff-47a0-11ed-aedd-7cd30abc95d8
1b30d0ff-47a0-11ed-aedd-7cd30abc95d8
1b30d0ff-47a0-11ed-aedd-7cd30abc95d8
1b30d0ff-47a0-11ed-aedd-7cd30abc95d8
1b30d0ff-47a0-11ed-aedd-7cd30abc95d8
1b30d0ff-47a0-11ed-aedd-7cd30abc95d8
1b30d0ff-47a0-11ed-aedd-7cd30abc95d8
1b30d0ff-47a0-11ed-aedd-7cd30abc95d8
1b30d0ff-47a0-11ed-aedd-7cd30abc95d8
1b30d0ff-47a0-11ed-aedd-7cd30abc95d8
1b30d0ff-47a0-11ed-aedd-7cd30abc95d8
1b30d0ff-47a0-11ed-aedd-7cd30abc95d8
1b30d0ff-47a0-11ed-aedd-7cd30abc95d8
1b30d0ff-47a0-11ed-aedd-7cd30abc95d8
1b30d0ff-47a0-11ed-aedd-7cd30abc95d8
1b30d0ff-47a0-11ed-aedd-7cd30abc95d8
1b30d0ff-47a0-11ed-aedd-7cd30abc95d8
1b30d0ff-47a0-11ed-aedd-7cd30abc95d8
1b30d0ff-47a0-11ed-aedd-7cd30abc95d8
1b30d0ff-47a0-11ed-aedd-7cd30abc95d8
1b30d0ff-47a0-11ed-aedd-7cd30abc95d8
1b30d0ff-47a0-11ed-aedd-7cd30abc95d8
1b30d0ff-47a0-11ed-aedd-7cd30abc95d8
1b30d0ff-47a0-11ed-aedd-7cd30abc95d8
1b30d0ff-47a0-11ed-aedd-7cd30abc95d8
1b30d0ff-47a0-11ed-aedd-7cd30abc95d8
1b30d0ff-47a0-11ed-aedd-7cd30abc95d8
1b30d0ff-47a0-11ed-aedd-7cd30abc95d8
1b30d0ff-47a0-11ed-aedd-7cd30abc95d8
1b30d0ff-47a0-11ed-aedd-7cd30abc95d8
1b30d0ff-47a0-11ed-aedd-7cd30abc95d8
1b30d0ff-47a0-11ed-aedd-7cd30abc95d8
1b30d0ff-47a0-11ed-aedd-7cd30abc95d8
1b30d0ff-47a0-11ed-aedd-7cd30abc95d8
1b30d0ff-47a0-11ed-aedd-7cd30abc95d8
1b30d0ff-47a0-11ed-aedd-7cd30abc95d8
1b30d0ff-47a0-11ed-aedd-7cd30abc95d8
1b30d0ff-47a0-11ed-aedd-7cd30abc95d8
1b30d0ff-47a0-11ed-aedd-7cd30abc95d8
1b30d0ff-47a0-11ed-aedd-7cd30abc95d8
1b30d0ff-47a0-11ed-aedd-7cd30abc95d8
1b30d0ff-47a0-11ed-aedd-7cd30abc95d8
1b30d0ff-47a0-11ed-aedd-7cd30abc95d8
1b30d0ff-47a0-11ed-aedd-7cd30abc95d8
1b30d0ff-47a0-11ed-aedd-7cd30abc95d8
1b30d0ff-47a0-11ed-aedd-7cd30abc95d8
1b30d0ff-47a0-11ed-aedd-7cd30abc95d8
1b30d0ff-47a0-11ed-aedd-7cd30abc95d8
1b30d0ff-47a0-11ed-aedd-7cd30abc95d8
1b30d0ff-47a0-11ed-aedd-7cd30abc95d8
1b30d0ff-47a0-11ed-aedd-7cd30abc95d8
1b30d0ff-47a0-11ed-aedd-7cd30abc95d8
1b30d0ff-47a0-11ed-aedd-7cd30abc95d8
1b30d0ff-47a0-11ed-aedd-7cd30abc95d8
1b30d0ff-47a0-11ed-aedd-7cd30abc95d8
1b30d0ff-47a0-11ed-aedd-7cd30abc95d8
1b30d0ff-47a0-11ed-aedd-7cd30abc95d8
1b30d0ff-47a0-11ed-aedd-7cd30abc95d8
1b30d0ff-47a0-11ed-aedd-7cd30abc95d8
1b30d0ff-47a0-11ed-aedd-7cd30abc95d8
1b30d0ff-47a0-11ed-aedd-7cd30abc95d8
1b30d0ff-47a0-11ed-aedd-7cd30abc95d8
1b30d0ff-47a0-11ed-aedd-7cd30abc95d8
1b30d0ff-47a0-11ed-aedd-7cd30abc95d8
1b30d0ff-47a0-11ed-aedd-7cd30abc95d8
1b30d0ff-47a0-11ed-aedd-7cd30abc95d8
1b30d0ff-47a0-11ed-aedd-7cd30abc95d8
1b30d0ff-47a0-11ed-aedd-7cd30abc95d8
1b30d0ff-47a0-11ed-aedd-7cd30abc95d8
1b30d0ff-47a0-11ed-aedd-7cd30abc95d8
1b30d0ff-47a0-11ed-aedd-7cd30abc95d8
1b30d0ff-47a0-11ed-aedd-7cd30abc95d8
1b30d0ff-47a0-11ed-aedd-7cd30abc95d8
1b30d0ff-47a0-11ed-aedd-7cd30abc95d8
1b30d0ff-47a0-11ed-aedd-7cd30abc95d8
1b30d0ff-47a0-11ed-aedd-7cd30abc95d8
1b30d0ff-47a0-11ed-aedd-7cd30abc95d8
1b30d0ff-47a0-11ed-aedd-7cd30abc95d8
1b30d0ff-47a0-11ed-aedd-7cd30abc95d8
1b30d0ff-47a0-11ed-aedd-7cd30abc95d8
1b30d0ff-47a0-11ed-aedd-7cd30abc95d8
1b30d0ff-47a0-11ed-aedd-7cd30abc95d8
1b30d0ff-47a0-11ed-aedd-7cd30abc95d8
1b30d0ff-47a0-11ed-aedd-7cd30abc95d8
1b30d0ff-47a0-11ed-aedd-7cd30abc95d8
1b30d0ff-47a0-11ed-aedd-7cd30abc95d8
1b30d0ff-47a0-11ed-aedd-7cd30abc95d8
1b30d0ff-47a0-11ed-aedd-7cd30abc95d8
1b30d0ff-47a0-11ed-aedd-7cd30abc95d8
1b30d0ff-47a0-11ed-aedd-7cd30abc95d8
1b30d0ff-47a0-11ed-aedd-7cd30abc95d8
1b30d0ff-47a0-11ed-aedd-7cd30abc95d8
1b30d0ff-47a0-11ed-aedd-7cd30abc95d8
1b30d0ff-47a0-11ed-aedd-7cd30abc95d8
1b30d0ff-47a0-11ed-aedd-7cd30abc95d8
1b30d0ff-47a0-11ed-aedd-7cd30abc95d8
1b30d0ff-47a0-11ed-aedd-7cd30abc95d8
1b30d0ff-47a0-11ed-aedd-7cd30abc95d8
1b30d0ff-47a0-11ed-aedd-7cd30abc95d8
1b30d0ff-47a0-11ed-aedd-7cd30abc95d8
1b30d0ff-47a0-11ed-aedd-7cd30abc95d8
1b30d0ff-47a0-11ed-aedd-7cd30abc95d8
1b30d0ff-47a0-11ed-aedd-7cd30abc95d8
1b30d0ff-47a0-11ed-aedd-7cd30abc95d8
1b30d0ff-47a0-11ed-aedd-7cd30abc95d8
1b30d0ff-47a0-11ed-aedd-7cd30abc95d8
1b30d0ff-47a0-11ed-aedd-7cd30abc95d8
1b30d0ff-47a0-11ed-aedd-7cd30abc95d8
1b30d0ff-47a0-11ed-aedd-7cd30abc95d8
1b30d0ff-47a0-11ed-aedd-7cd30abc95d8
1b30d0ff-47a0-11ed-aedd-7cd30abc95d8
1b30d0ff-47a0-11ed-aedd-7cd30abc95d8
1b30d0ff-47a0-11ed-aedd-7cd30abc95d8
1b30d0ff-47a0-11ed-aedd-7cd30abc95d8
1b30d0ff-47a0-11ed-aedd-7cd30abc95d8
1b30d0ff-47a0-11ed-aedd-7cd30abc95d8
1b30d0ff-47a0-11ed-aedd-7cd30abc95d8
1b30d0ff-47a0-11ed-aedd-7cd30abc95d8
1b30d0ff-47a0-11ed-aedd-7cd30abc95d8
1b30d0ff-47a0-11ed-aedd-7cd30abc95d8
1b30d0ff-47a0-11ed-aedd-7cd30abc95d8
1b30d0ff-47a0-11ed-aedd-7cd30abc95d8
1b30d0ff-47a0-11ed-aedd-7cd30abc95d8
1b30d0ff-47a0-11ed-aedd-7cd30abc95d8
1b30d0ff-47a0-11ed-aedd-7cd30abc95d8
1b30d0ff-47a0-11ed-aedd-7cd30abc95d8
1b30d0ff-47a0-11ed-aedd-7cd30abc95d8
1b30d0ff-47a0-11ed-aedd-7cd30abc95d8
1b30d0ff-47a0-11ed-aedd-7cd30abc95d8
1b30d0ff-47a0-11ed-aedd-7cd30abc95d8
1b30d0ff-47a0-11ed-aedd-7cd30abc95d8
1b30d0ff-47a0-11ed-aedd-7cd30abc95d8
1b30d0ff-47a0-11ed-aedd-7cd30abc95d8
1b30d0ff-47a0-11ed-aedd-7cd30abc95d8
1b30d0ff-47a0-11ed-aedd-7cd30abc95d8
1b30d0ff-47a0-11ed-aedd-7cd30abc95d8
47a011ed-d0ff-1b30-aedd-7cd30abc95d8
47a011ed-d0ff-1b30-aedd-7cd30abc95d8
47a011ed-d0ff-1b30-aedd-7cd30abc95d8
47a011ed-d0ff-1b30-aedd-7cd30abc95d8
47a011ed-d0ff-1b30-aedd-7cd30abc95d8
47a011ed-d0ff-1b30-aedd-7cd30abc95d8
47a011ed-d0ff-1b30-aedd-7cd30abc95d8
47a011ed-d0ff-1b30-aedd-7cd30abc95d8
47a011ed-d0ff-1b30-aedd-7cd30abc95d8
47a011ed-d0ff-1b30-aedd-7cd30abc95d8
47a011ed-d0ff-1b30-aedd-7cd30abc95d8
47a011ed-d0ff-1b30-aedd-7cd30abc95d8
47a011ed-d0ff-1b30-aedd-7cd30abc95d8
47a011ed-d0ff-1b30-aedd-7cd30abc95d8
47a011ed-d0ff-1b30-aedd-7cd30abc95d8
47a011ed-d0ff-1b30-aedd-7cd30abc95d8
47a011ed-d0ff-1b30-aedd-7cd30abc95d8
47a011ed-d0ff-1b30-aedd-7cd30abc95d8
47a011ed-d0ff-1b30-aedd-7cd30abc95d8
47a011ed-d0ff-1b30-aedd-7cd30abc95d8
47a011ed-d0ff-1b30-aedd-7cd30abc95d8
47a011ed-d0ff-1b30-aedd-7cd30abc95d8
47a011ed-d0ff-1b30-aedd-7cd30abc95d8
47a011ed-d0ff-1b30-aedd-7cd30abc95d8
47a011ed-d0ff-1b30-aedd-7cd30abc95d8
47a011ed-d0ff-1b30-aedd-7cd30abc95d8
47a011ed-d0ff-1b30-aedd-7cd30abc95d8
47a011ed-d0ff-1b30-aedd-7cd30abc95d8
47a011ed-d0ff-1b30-aedd-7cd30abc95d8
47a011ed-d0ff-1b30-aedd-7cd30abc95d8
47a011ed-d0ff-1b30-aedd-7cd30abc95d8
47a011ed-d0ff-1b30-aedd-7cd30abc95d8
47a011ed-d0ff-1b30-aedd-7cd30abc95d8
47a011ed-d0ff-1b30-aedd-7cd30abc95d8
47a011ed-d0ff-1b30-aedd-7cd30abc95d8
47a011ed-d0ff-1b30-aedd-7cd30abc95d8
47a011ed-d0ff-1b30-aedd-7cd30abc95d8
47a011ed-d0ff-1b30-aedd-7cd30abc95d8
47a011ed-d0ff-1b30-aedd-7cd30abc95d8
47a011ed-d0ff-1b30-aedd-7cd30abc95d8
47a011ed-d0ff-1b30-aedd-7cd30abc95d8
47a011ed-d0ff-1b30-aedd-7cd30abc95d8
47a011ed-d0ff-1b30-aedd-7cd30abc95d8
47a011ed-d0ff-1b30-aedd-7cd30abc95d8
47a011ed-d0ff-1b30-aedd-7cd30abc95d8
47a011ed-d0ff-1b30-aedd-7cd30abc95d8
47a011ed-d0ff-1b30-aedd-7cd30abc95d8
47a011ed-d0ff-1b30-aedd-7cd30abc95d8
47a011ed-d0ff-1b30-aedd-7cd30abc95d8
47a011ed-d0ff-1b30-aedd-7cd30abc95d8
47a011ed-d0ff-1b30-aedd-7cd30abc95d8
47a011ed-d0ff-1b30-aedd-7cd30abc95d8
47a011ed-d0ff-1b30-aedd-7cd30abc95d8
47a011ed-d0ff-1b30-aedd-7cd30abc95d8
47a011ed-d0ff-1b30-aedd-7cd30abc95d8
47a011ed-d0ff-1b30-aedd-7cd30abc95d8
47a011ed-d0ff-1b30-aedd-7cd30abc95d8
47a011ed-d0ff-1b30-aedd-7cd30abc95d8
47a011ed-d0ff-1b30-aedd-7cd30abc95d8
47a011ed-d0ff-1b30-aedd-7cd30abc95d8
47a011ed-d0ff-1b30-aedd-7cd30abc95d8
47a011ed-d0ff-1b30-aedd-7cd30abc95d8
47a011ed-d0ff-1b30-aedd-7cd30abc95d8
47a011ed-d0ff-1b30-aedd-7cd30abc95d8
47a011ed-d0ff-1b30-aedd-7cd30abc95d8
47a011ed-d0ff-1b30-aedd-7cd30abc95d8
47a011ed-d0ff-1b30-aedd-7cd30abc95d8
47a011ed-d0ff-1b30-aedd-7cd30abc95d8
47a011ed-d0ff-1b30-aedd-7cd30abc95d8
47a011ed-d0ff-1b30-aedd-7cd30abc95d8
47a011ed-d0ff-1b30-aedd-7cd30abc95d8
47a011ed-d0ff-1b30-aedd-7cd30abc95d8
47a011ed-d0ff-1b30-aedd-7cd30abc95d8
47a011ed-d0ff-1b30-aedd-7cd30abc95d8
47a011ed-d0ff-1b30-aedd-7cd30abc95d8
47a011ed-d0ff-1b30-aedd-7cd30abc95d8
47a011ed-d0ff-1b30-aedd-7cd30abc95d8
47a011ed-d0ff-1b30-aedd-7cd30abc95d8
47a011ed-d0ff-1b30-aedd-7cd30abc95d8
47a011ed-d0ff-1b30-aedd-7cd30abc95d8
47a011ed-d0ff-1b30-aedd-7cd30abc95d8
47a011ed-d0ff-1b30-aedd-7cd30abc95d8
47a011ed-d0ff-1b30-aedd-7cd30abc95d8
47a011ed-d0ff-1b30-aedd-7cd30abc95d8
47a011ed-d0ff-1b30-aedd-7cd30abc95d8
47a011ed-d0ff-1b30-aedd-7cd30abc95d8
47a011ed-d0ff-1b30-aedd-7cd30abc95d8
47a011ed-d0ff-1b30-aedd-7cd30abc95d8
47a011ed-d0ff-1b30-aedd-7cd30abc95d8
47a011ed-d0ff-1b30-aedd-7cd30abc95d8
47a011ed-d0ff-1b30-aedd-7cd30abc95d8
47a011ed-d0ff-1b30-aedd-7cd30abc95d8
47a011ed-d0ff-1b30-aedd-7cd30abc95d8
47a011ed-d0ff-1b30-aedd-7cd30abc95d8
47a011ed-d0ff-1b30-aedd-7cd30abc95d8
47a011ed-d0ff-1b30-aedd-7cd30abc95d8
47a011ed-d0ff-1b30-aedd-7cd30abc95d8
47a011ed-d0ff-1b30-aedd-7cd30abc95d8
47a011ed-d0ff-1b30-aedd-7cd30abc95d8
47a011ed-d0ff-1b30-aedd-7cd30abc95d8
47a011ed-d0ff-1b30-aedd-7cd30abc95d8
47a011ed-d0ff-1b30-aedd-7cd30abc95d8
47a011ed-d0ff-1b30-aedd-7cd30abc95d8
47a011ed-d0ff-1b30-aedd-7cd30abc95d8
47a011ed-d0ff-1b30-aedd-7cd30abc95d8
47a011ed-d0ff-1b30-aedd-7cd30abc95d8
47a011ed-d0ff-1b30-aedd-7cd30abc95d8
47a011ed-d0ff-1b30-aedd-7cd30abc95d8
47a011ed-d0ff-1b30-aedd-7cd30abc95d8
47a011ed-d0ff-1b30-aedd-7cd30abc95d8
47a011ed-d0ff-1b30-aedd-7cd30abc95d8
47a011ed-d0ff-1b30-aedd-7cd30abc95d8
47a011ed-d0ff-1b30-aedd-7cd30abc95d8
47a011ed-d0ff-1b30-aedd-7cd30abc95d8
47a011ed-d0ff-1b30-aedd-7cd30abc95d8
47a011ed-d0ff-1b30-aedd-7cd30abc95d8
47a011ed-d0ff-1b30-aedd-7cd30abc95d8
47a011ed-d0ff-1b30-aedd-7cd30abc95d8
47a011ed-d0ff-1b30-aedd-7cd30abc95d8
47a011ed-d0ff-1b30-aedd-7cd30abc95d8
47a011ed-d0ff-1b30-aedd-7cd30abc95d8
47a011ed-d0ff-1b30-aedd-7cd30abc95d8
47a011ed-d0ff-1b30-aedd-7cd30abc95d8
47a011ed-d0ff-1b30-aedd-7cd30abc95d8
47a011ed-d0ff-1b30-aedd-7cd30abc95d8
47a011ed-d0ff-1b30-aedd-7cd30abc95d8
47a011ed-d0ff-1b30-aedd-7cd30abc95d8
47a011ed-d0ff-1b30-aedd-7cd30abc95d8
47a011ed-d0ff-1b30-aedd-7cd30abc95d8
47a011ed-d0ff-1b30-aedd-7cd30abc95d8
47a011ed-d0ff-1b30-aedd-7cd30abc95d8
47a011ed-d0ff-1b30-aedd-7cd30abc95d8
47a011ed-d0ff-1b30-aedd-7cd30abc95d8
47a011ed-d0ff-1b30-aedd-7cd30abc95d8
47a011ed-d0ff-1b30-aedd-7cd30abc95d8
47a011ed-d0ff-1b30-aedd-7cd30abc95d8
47a011ed-d0ff-1b30-aedd-7cd30abc95d8
47a011ed-d0ff-1b30-aedd-7cd30abc95d8
47a011ed-d0ff-1b30-aedd-7cd30abc95d8
47a011ed-d0ff-1b30-aedd-7cd30abc95d8
47a011ed-d0ff-1b30-aedd-7cd30abc95d8
47a011ed-d0ff-1b30-aedd-7cd30abc95d8
47a011ed-d0ff-1b30-aedd-7cd30abc95d8
47a011ed-d0ff-1b30-aedd-7cd30abc95d8
47a011ed-d0ff-1b30-aedd-7cd30abc95d8
47a011ed-d0ff-1b30-aedd-7cd30abc95d8
47a011ed-d0ff-1b30-aedd-7cd30abc95d8
47a011ed-d0ff-1b30-aedd-7cd30abc95d8
47a011ed-d0ff-1b30-aedd-7cd30abc95d8
47a011ed-d0ff-1b30-aedd-7cd30abc95d8
47a011ed-d0ff-1b30-aedd-7cd30abc95d8
47a011ed-d0ff-1b30-aedd-7cd30abc95d8
47a011ed-d0ff-1b30-aedd-7cd30abc95d8
47a011ed-d0ff-1b30-aedd-7cd30abc95d8
47a011ed-d0ff-1b30-aedd-7cd30abc95d8
47a011ed-d0ff-1b30-aedd-7cd30abc95d8
47a011ed-d0ff-1b30-aedd-7cd30abc95d8
47a011ed-d0ff-1b30-aedd-7cd30abc95d8
47a011ed-d0ff-1b30-aedd-7cd30abc95d8
47a011ed-d0ff-1b30-aedd-7cd30abc95d8
47a011ed-d0ff-1b30-aedd-7cd30abc95d8
47a011ed-d0ff-1b30-aedd-7cd30abc95d8
47a011ed-d0ff-1b30-aedd-7cd30abc95d8
47a011ed-d0ff-1b30-aedd-7cd30abc95d8
47a011ed-d0ff-1b30-aedd-7cd30abc95d8
47a011ed-d0ff-1b30-aedd-7cd30abc95d8
47a011ed-d0ff-1b30-aedd-7cd30abc95d8
47a011ed-d0ff-1b30-aedd-7cd30abc95d8
47a011ed-d0ff-1b30-aedd-7cd30abc95d8
47a011ed-d0ff-1b30-aedd-7cd30abc95d8
47a011ed-d0ff-1b30-aedd-7cd30abc95d8
47a011ed-d0ff-1b30-aedd-7cd30abc95d8
47a011ed-d0ff-1b30-aedd-7cd30abc95d8
47a011ed-d0ff-1b30-aedd-7cd30abc95d8
47a011ed-d0ff-1b30-aedd-7cd30abc95d8
47a011ed-d0ff-1b30-aedd-7cd30abc95d8
47a011ed-d0ff-1b30-aedd-7cd30abc95d8
47a011ed-d0ff-1b30-aedd-7cd30abc95d8
47a011ed-d0ff-1b30-aedd-7cd30abc95d8
47a011ed-d0ff-1b30-aedd-7cd30abc95d8
47a011ed-d0ff-1b30-aedd-7cd30abc95d8
47a011ed-d0ff-1b30-aedd-7cd30abc95d8
47a011ed-d0ff-1b30-aedd-7cd30abc95d8
47a011ed-d0ff-1b30-aedd-7cd30abc95d8
47a011ed-d0ff-1b30-aedd-7cd30abc95d8
47a011ed-d0ff-1b30-aedd-7cd30abc95d8
47a011ed-d0ff-1b30-aedd-7cd30abc95d8
47a011ed-d0ff-1b30-aedd-7cd30abc95d8
47a011ed-d0ff-1b30-aedd-7cd30abc95d8
47a011ed-d0ff-1b30-aedd-7cd30abc95d8
47a011ed-d0ff-1b30-aedd-7cd30abc95d8
47a011ed-d0ff-1b30-aedd-7cd30abc95d8
47a011ed-d0ff-1b30-aedd-7cd30abc95d8
47a011ed-d0ff-1b30-aedd-7cd30abc95d8
47a011ed-d0ff-1b30-aedd-7cd30abc95d8
47a011ed-d0ff-1b30-aedd-7cd30abc95d8
47a011ed-d0ff-1b30-aedd-7cd30abc95d8
47a011ed-d0ff-1b30-aedd-7cd30abc95d8
47a011ed-d0ff-1b30-aedd-7cd30abc95d8
47a011ed-d0ff-1b30-aedd-7cd30abc95d8
47a011ed-d0ff-1b30-aedd-7cd30abc95d8
47a011ed-d0ff-1b30-aedd-7cd30abc95d8
47a011ed-d0ff-1b30-aedd-7cd30abc95d8
47a011ed-d0ff-1b30-aedd-7cd30abc95d8
47a011ed-d0ff-1b30-aedd-7cd30abc95d8
47a011ed-d0ff-1b30-aedd-7cd30abc95d8
47a011ed-d0ff-1b30-aedd-7cd30abc95d8
47a011ed-d0ff-1b30-aedd-7cd30abc95d8
47a011ed-d0ff-1b30-aedd-7cd30abc95d8
47a011ed-d0ff-1b30-aedd-7cd30abc95d8
47a011ed-d0ff-1b30-aedd-7cd30abc95d8
47a011ed-d0ff-1b30-aedd-7cd30abc95d8
47a011ed-d0ff-1b30-aedd-7cd30abc95d8
47a011ed-d0ff-1b30-aedd-7cd30abc95d8
47a011ed-d0ff-1b30-aedd-7cd30abc95d8
47a011ed-d0ff-1b30-aedd-7cd30abc95d8
47a011ed-d0ff-1b30-aedd-7cd30abc95d8
47a011ed-d0ff-1b30-aedd-7cd30abc95d8
47a011ed-d0ff-1b30-aedd-7cd30abc95d8
47a011ed-d0ff-1b30-aedd-7cd30abc95d8
47a011ed-d0ff-1b30-aedd-7cd30abc95d8
47a011ed-d0ff-1b30-aedd-7cd30abc95d8
47a011ed-d0ff-1b30-aedd-7cd30abc95d8
47a011ed-d0ff-1b30-aedd-7cd30abc95d8
47a011ed-d0ff-1b30-aedd-7cd30abc95d8
47a011ed-d0ff-1b30-aedd-7cd30abc95d8
47a011ed-d0ff-1b30-aedd-7cd30abc95d8
47a011ed-d0ff-1b30-aedd-7cd30abc95d8
47a011ed-d0ff-1b30-aedd-7cd30abc95d8
47a011ed-d0ff-1b30-aedd-7cd30abc95d8
47a011ed-d0ff-1b30-aedd-7cd30abc95d8
47a011ed-d0ff-1b30-aedd-7cd30abc95d8
47a011ed-d0ff-1b30-aedd-7cd30abc95d8
47a011ed-d0ff-1b30-aedd-7cd30abc95d8
47a011ed-d0ff-1b30-aedd-7cd30abc95d8
47a011ed-d0ff-1b30-aedd-7cd30abc95d8
47a011ed-d0ff-1b30-aedd-7cd30abc95d8
47a011ed-d0ff-1b30-aedd-7cd30abc95d8
47a011ed-d0ff-1b30-aedd-7cd30abc95d8
47a011ed-d0ff-1b30-aedd-7cd30abc95d8
47a011ed-d0ff-1b30-aedd-7cd30abc95d8
47a011ed-d0ff-1b30-aedd-7cd30abc95d8
47a011ed-d0ff-1b30-aedd-7cd30abc95d8
47a011ed-d0ff-1b30-aedd-7cd30abc95d8
47a011ed-d0ff-1b30-aedd-7cd30abc95d8
47a011ed-d0ff-1b30-aedd-7cd30abc95d8
47a011ed-d0ff-1b30-aedd-7cd30abc95d8
47a011ed-d0ff-1b30-aedd-7cd30abc95d8
47a011ed-d0ff-1b30-aedd-7cd30abc95d8
47a011ed-d0ff-1b30-aedd-7cd30abc95d8
47a011ed-d0ff-1b30-aedd-7cd30abc95d8
47a011ed-d0ff-1b30-aedd-7cd30abc95d8
47a011ed-d0ff-1b30-aedd-7cd30abc95d8
47a011ed-d0ff-1b30-aedd-7cd30abc95d8
47a011ed-d0ff-1b30-aedd-7cd30abc95d8
47a011ed-d0ff-1b30-aedd-7cd30abc95d8
47a011ed-d0ff-1b30-aedd-7cd30abc95d8
47a011ed-d0ff-1b30-aedd-7cd30abc95d8
47a011ed-d0ff-1b30-aedd-7cd30abc95d8
47a011ed-d0ff-1b30-aedd-7cd30abc95d8
47a011ed-d0ff-1b30-aedd-7cd30abc95d8
47a011ed-d0ff-1b30-aedd-7cd30abc95d8
47a011ed-d0ff-1b30-aedd-7cd30abc95d8
47a011ed-d0ff-1b30-aedd-7cd30abc95d8
47a011ed-d0ff-1b30-aedd-7cd30abc95d8
47a011ed-d0ff-1b30-aedd-7cd30abc95d8
47a011ed-d0ff-1b30-aedd-7cd30abc95d8
47a011ed-d0ff-1b30-aedd-7cd30abc95d8
47a011ed-d0ff-1b30-aedd-7cd30abc95d8
47a011ed-d0ff-1b30-aedd-7cd30abc95d8
47a011ed-d0ff-1b30-aedd-7cd30abc95d8
47a011ed-d0ff-1b30-aedd-7cd30abc95d8
47a011ed-d0ff-1b30-aedd-7cd30abc95d8
47a011ed-d0ff-1b30-aedd-7cd30abc95d8
47a011ed-d0ff-1b30-aedd-7cd30abc95d8
47a011ed-d0ff-1b30-aedd-7cd30abc95d8
47a011ed-d0ff-1b30-aedd-7cd30abc95d8
47a011ed-d0ff-1b30-aedd-7cd30abc95d8
47a011ed-d0ff-1b30-aedd-7cd30abc95d8
47a011ed-d0ff-1b30-aedd-7cd30abc95d8
47a011ed-d0ff-1b30-aedd-7cd30abc95d8
47a011ed-d0ff-1b30-aedd-7cd30abc95d8
47a011ed-d0ff-1b30-aedd-7cd30abc95d8
47a011ed-d0ff-1b30-aedd-7cd30abc95d8
47a011ed-d0ff-1b30-aedd-7cd30abc95d8
47a011ed-d0ff-1b30-aedd-7cd30abc95d8
47a011ed-d0ff-1b30-aedd-7cd30abc95d8
47a011ed-d0ff-1b30-aedd-7cd30abc95d8
47a011ed-d0ff-1b30-aedd-7cd30abc95d8
47a011ed-d0ff-1b30-aedd-7cd30abc95d8
47a011ed-d0ff-1b30-aedd-7cd30abc95d8
47a011ed-d0ff-1b30-aedd-7cd30abc95d8
47a011ed-d0ff-1b30-aedd-7cd30abc95d8
47a011ed-d0ff-1b30-aedd-7cd30abc95d8
47a011ed-d0ff-1b30-aedd-7cd30abc95d8
47a011ed-d0ff-1b30-aedd-7cd30abc95d8
47a011ed-d0ff-1b30-aedd-7cd30abc95d8
47a011ed-d0ff-1b30-aedd-7cd30abc95d8
47a011ed-d0ff-1b30-aedd-7cd30abc95d8
47a011ed-d0ff-1b30-aedd-7cd30abc95d8
47a011ed-d0ff-1b30-aedd-7cd30abc95d8
47a011ed-d0ff-1b30-aedd-7cd30abc95d8
47a011ed-d0ff-1b30-aedd-7cd30abc95d8
47a011ed-d0ff-1b30-aedd-7cd30abc95d8
47a011ed-d0ff-1b30-aedd-7cd30abc95d8
47a011ed-d0ff-1b30-aedd-7cd30abc95d8
47a011ed-d0ff-1b30-aedd-7cd30abc95d8
47a011ed-d0ff-1b30-aedd-7cd30abc95d8
47a011ed-d0ff-1b30-aedd-7cd30abc95d8
47a011ed-d0ff-1b30-aedd-7cd30abc95d8
47a011ed-d0ff-1b30-aedd-7cd30abc95d8
47a011ed-d0ff-1b30-aedd-7cd30abc95d8
47a011ed-d0ff-1b30-aedd-7cd30abc95d8
47a011ed-d0ff-1b30-aedd-7cd30abc95d8
47a011ed-d0ff-1b30-aedd-7cd30abc95d8
47a011ed-d0ff-1b30-aedd-7cd30abc95d8
47a011ed-d0ff-1b30-aedd-7cd30abc95d8
47a011ed-d0ff-1b30-aedd-7cd30abc95d8
47a011ed-d0ff-1b30-aedd-7cd30abc95d8
47a011ed-d0ff-1b30-aedd-7cd30abc95d8
47a011ed-d0ff-1b30-aedd-7cd30abc95d8
47a011ed-d0ff-1b30-aedd-7cd30abc95d8
47a011ed-d0ff-1b30-aedd-7cd30abc95d8
47a011ed-d0ff-1b30-aedd-7cd30abc95d8
47a011ed-d0ff-1b30-aedd-7cd30abc95d8
47a011ed-d0ff-1b30-aedd-7cd30abc95d8
47a011ed-d0ff-1b30-aedd-7cd30abc95d8
47a011ed-d0ff-1b30-aedd-7cd30abc95d8
47a011ed-d0ff-1b30-aedd-7cd30abc95d8
47a011ed-d0ff-1b30-aedd-7cd30abc95d8
47a011ed-d0ff-1b30-aedd-7cd30abc95d8
47a011ed-d0ff-1b30-aedd-7cd30abc95d8
47a011ed-d0ff-1b30-aedd-7cd30abc95d8
47a011ed-d0ff-1b30-aedd-7cd30abc95d8
47a011ed-d0ff-1b30-aedd-7cd30abc95d8
47a011ed-d0ff-1b30-aedd-7cd30abc95d8
47a011ed-d0ff-1b30-aedd-7cd30abc95d8
47a011ed-d0ff-1b30-aedd-7cd30abc95d8
47a011ed-d0ff-1b30-aedd-7cd30abc95d8
47a011ed-d0ff-1b30-aedd-7cd30abc95d8
47a011ed-d0ff-1b30-aedd-7cd30abc95d8
47a011ed-d0ff-1b30-aedd-7cd30abc95d8
47a011ed-d0ff-1b30-aedd-7cd30abc95d8
47a011ed-d0ff-1b30-aedd-7cd30abc95d8
47a011ed-d0ff-1b30-aedd-7cd30abc95d8
47a011ed-d0ff-1b30-aedd-7cd30abc95d8
47a011ed-d0ff-1b30-aedd-7cd30abc95d8
47a011ed-d0ff-1b30-aedd-7cd30abc95d8
47a011ed-d0ff-1b30-aedd-7cd30abc95d8
47a011ed-d0ff-1b30-aedd-7cd30abc95d8
47a011ed-d0ff-1b30-aedd-7cd30abc95d8
47a011ed-d0ff-1b30-aedd-7cd30abc95d8
47a011ed-d0ff-1b30-aedd-7cd30abc95d8
47a011ed-d0ff-1b30-aedd-7cd30abc95d8
47a011ed-d0ff-1b30-aedd-7cd30abc95d8
47a011ed-d0ff-1b30-aedd-7cd30abc95d8
47a011ed-d0ff-1b30-aedd-7cd30abc95d8
47a011ed-d0ff-1b30-aedd-7cd30abc95d8
47a011ed-d0ff-1b30-aedd-7cd30abc95d8
47a011ed-d0ff-1b30-aedd-7cd30abc95d8
47a011ed-d0ff-1b30-aedd-7cd30abc95d8
47a011ed-d0ff-1b30-aedd-7cd30abc95d8
47a011ed-d0ff-1b30-aedd-7cd30abc95d8
47a011ed-d0ff-1b30-aedd-7cd30abc95d8
47a011ed-d0ff-1b30-aedd-7cd30abc95d8
47a011ed-d0ff-1b30-aedd-7cd30abc95d8
47a011ed-d0ff-1b30-aedd-7cd30abc95d8
47a011ed-d0ff-1b30-aedd-7cd30abc95d8
47a011ed-d0ff-1b30-aedd-7cd30abc95d8
47a011ed-d0ff-1b30-aedd-7cd30abc95d8
47a011ed-d0ff-1b30-aedd-7cd30abc95d8
47a011ed-d0ff-1b30-aedd-7cd30abc95d8
47a011ed-d0ff-1b30-aedd-7cd30abc95d8
47a011ed-d0ff-1b30-aedd-7cd30abc95d8
47a011ed-d0ff-1b30-aedd-7cd30abc95d8
47a011ed-d0ff-1b30-aedd-7cd30abc95d8
47a011ed-d0ff-1b30-aedd-7cd30abc95d8
47a011ed-d0ff-1b30-aedd-7cd30abc95d8
47a011ed-d0ff-1b30-aedd-7cd30abc95d8
47a011ed-d0ff-1b30-aedd-7cd30abc95d8
47a011ed-d0ff-1b30-aedd-7cd30abc95d8
47a011ed-d0ff-1b30-aedd-7cd30abc95d8
47a011ed-d0ff-1b30-aedd-7cd30abc95d8
47a011ed-d0ff-1b30-aedd-7cd30abc95d8
47a011ed-d0ff-1b30-aedd-7cd30abc95d8
47a011ed-d0ff-1b30-aedd-7cd30abc95d8
47a011ed-d0ff-1b30-aedd-7cd30abc95d8
47a011ed-d0ff-1b30-aedd-7cd30abc95d8
47a011ed-d0ff-1b30-aedd-7cd30abc95d8
47a011ed-d0ff-1b30-aedd-7cd30abc95d8
47a011ed-d0ff-1b30-aedd-7cd30abc95d8
47a011ed-d0ff-1b30-aedd-7cd30abc95d8
47a011ed-d0ff-1b30-aedd-7cd30abc95d8
47a011ed-d0ff-1b30-aedd-7cd30abc95d8
47a011ed-d0ff-1b30-aedd-7cd30abc95d8
47a011ed-d0ff-1b30-aedd-7cd30abc95d8
47a011ed-d0ff-1b30-aedd-7cd30abc95d8
47a011ed-d0ff-1b30-aedd-7cd30abc95d8
47a011ed-d0ff-1b30-aedd-7cd30abc95d8
47a011ed-d0ff-1b30-aedd-7cd30abc95d8
47a011ed-d0ff-1b30-aedd-7cd30abc95d8
47a011ed-d0ff-1b30-aedd-7cd30abc95d8
47a011ed-d0ff-1b30-aedd-7cd30abc95d8
47a011ed-d0ff-1b30-aedd-7cd30abc95d8
47a011ed-d0ff-1b30-aedd-7cd30abc95d8
47a011ed-d0ff-1b30-aedd-7cd30abc95d8
47a011ed-d0ff-1b30-aedd-7cd30abc95d8
47a011ed-d0ff-1b30-aedd-7cd30abc95d8
47a011ed-d0ff-1b30-aedd-7cd30abc95d8
47a011ed-d0ff-1b30-aedd-7cd30abc95d8
47a011ed-d0ff-1b30-aedd-7cd30abc95d8
47a011ed-d0ff-1b30-aedd-7cd30abc95d8
47a011ed-d0ff-1b30-aedd-7cd30abc95d8
47a011ed-d0ff-1b30-aedd-7cd30abc95d8
47a011ed-d0ff-1b30-aedd-7cd30abc95d8
47a011ed-d0ff-1b30-aedd-7cd30abc95d8
47a011ed-d0ff-1b30-aedd-7cd30abc95d8
47a011ed-d0ff-1b30-aedd-7cd30abc95d8
47a011ed-d0ff-1b30-aedd-7cd30abc95d8
47a011ed-d0ff-1b30-aedd-7cd30abc95d8
47a011ed-d0ff-1b30-aedd-7cd30abc95d8
47a011ed-d0ff-1b30-aedd-7cd30abc95d8
47a011ed-d0ff-1b30-aedd-7cd30abc95d8
47a011ed-d0ff-1b30-aedd-7cd30abc95d8
47a011ed-d0ff-1b30-aedd-7cd30abc95d8
47a011ed-d0ff-1b30-aedd-7cd30abc95d8
47a011ed-d0ff-1b30-aedd-7cd30abc95d8
47a011ed-d0ff-1b30-aedd-7cd30abc95d8
47a011ed-d0ff-1b30-aedd-7cd30abc95d8
47a011ed-d0ff-1b30-aedd-7cd30abc95d8
47a011ed-d0ff-1b30-aedd-7cd30abc95d8
47a011ed-d0ff-1b30-aedd-7cd30abc95d8
47a011ed-d0ff-1b30-aedd-7cd30abc95d8
47a011ed-d0ff-1b30-aedd-7cd30abc95d8
47a011ed-d0ff-1b30-aedd-7cd30abc95d8
47a011ed-d0ff-1b30-aedd-7cd30abc95d8
47a011ed-d0ff-1b30-aedd-7cd30abc95d8
47a011ed-d0ff-1b30-aedd-7cd30abc95d8
47a011ed-d0ff-1b30-aedd-7cd30abc95d8
47a011ed-d0ff-1b30-aedd-7cd30abc95d8
47a011ed-d0ff-1b30-aedd-7cd30abc95d8
47a011ed-d0ff-1b30-aedd-7cd30abc95d8
47a011ed-d0ff-1b30-aedd-7cd30abc95d8
47a011ed-d0ff-1b30-aedd-7cd30abc95d8
47a011ed-d0ff-1b30-aedd-7cd30abc95d8
47a011ed-d0ff-1b30-aedd-7cd30abc95d8
47a011ed-d0ff-1b30-aedd-7cd30abc95d8
47a011ed-d0ff-1b30-aedd-7cd30abc95d8
47a011ed-d0ff-1b30-aedd-7cd30abc95d8
47a011ed-d0ff-1b30-aedd-7cd30abc95d8
47a011ed-d0ff-1b30-aedd-7cd30abc95d8
47a011ed-d0ff-1b30-aedd-7cd30abc95d8
47a011ed-d0ff-1b30-aedd-7cd30abc95d8
47a011ed-d0ff-1b30-aedd-7cd30abc95d8
47a011ed-d0ff-1b30-aedd-7cd30abc95d8
47a011ed-d0ff-1b30-aedd-7cd30abc95d8
47a011ed-d0ff-1b30-aedd-7cd30abc95d8
47a011ed-d0ff-1b30-aedd-7cd30abc95d8
47a011ed-d0ff-1b30-aedd-7cd30abc95d8
47a011ed-d0ff-1b30-aedd-7cd30abc95d8
47a011ed-d0ff-1b30-aedd-7cd30abc95d8
47a011ed-d0ff-1b30-aedd-7cd30abc95d8
47a011ed-d0ff-1b30-aedd-7cd30abc95d8
47a011ed-d0ff-1b30-aedd-7cd30abc95d8
47a011ed-d0ff-1b30-aedd-7cd30abc95d8
47a011ed-d0ff-1b30-aedd-7cd30abc95d8
47a011ed-d0ff-1b30-aedd-7cd30abc95d8
47a011ed-d0ff-1b30-aedd-7cd30abc95d8
47a011ed-d0ff-1b30-aedd-7cd30abc95d8
47a011ed-d0ff-1b30-aedd-7cd30abc95d8
47a011ed-d0ff-1b30-aedd-7cd30abc95d8
47a011ed-d0ff-1b30-aedd-7cd30abc95d8
47a011ed-d0ff-1b30-aedd-7cd30abc95d8
47a011ed-d0ff-1b30-aedd-7cd30abc95d8
47a011ed-d0ff-1b30-aedd-7cd30abc95d8
47a011ed-d0ff-1b30-aedd-7cd30abc95d8
47a011ed-d0ff-1b30-aedd-7cd30abc95d8
47a011ed-d0ff-1b30-aedd-7cd30abc95d8
47a011ed-d0ff-1b30-aedd-7cd30abc95d8
47a011ed-d0ff-1b30-aedd-7cd30abc95d8
47a011ed-d0ff-1b30-aedd-7cd30abc95d8
47a011ed-d0ff-1b30-aedd-7cd30abc95d8
47a011ed-d0ff-1b30-aedd-7cd30abc95d8
47a011ed-d0ff-1b30-aedd-7cd30abc95d8
47a011ed-d0ff-1b30-aedd-7cd30abc95d8
47a011ed-d0ff-1b30-aedd-7cd30abc95d8
47a011ed-d0ff-1b30-aedd-7cd30abc95d8
47a011ed-d0ff-1b30-aedd-7cd30abc95d8
47a011ed-d0ff-1b30-aedd-7cd30abc95d8
47a011ed-d0ff-1b30-aedd-7cd30abc95d8
47a011ed-d0ff-1b30-aedd-7cd30abc95d8
47a011ed-d0ff-1b30-aedd-7cd30abc95d8
47a011ed-d0ff-1b30-aedd-7cd30abc95d8
47a011ed-d0ff-1b30-aedd-7cd30abc95d8
47a011ed-d0ff-1b30-aedd-7cd30abc95d8
47a011ed-d0ff-1b30-aedd-7cd30abc95d8
47a011ed-d0ff-1b30-aedd-7cd30abc95d8
47a011ed-d0ff-1b30-aedd-7cd30abc95d8
47a011ed-d0ff-1b30-aedd-7cd30abc95d8
47a011ed-d0ff-1b30-aedd-7cd30abc95d8
47a011ed-d0ff-1b30-aedd-7cd30abc95d8
47a011ed-d0ff-1b30-aedd-7cd30abc95d8
47a011ed-d0ff-1b30-aedd-7cd30abc95d8
47a011ed-d0ff-1b30-aedd-7cd30abc95d8
47a011ed-d0ff-1b30-aedd-7cd30abc95d8
47a011ed-d0ff-1b30-aedd-7cd30abc95d8
47a011ed-d0ff-1b30-aedd-7cd30abc95d8
47a011ed-d0ff-1b30-aedd-7cd30abc95d8
47a011ed-d0ff-1b30-aedd-7cd30abc95d8
47a011ed-d0ff-1b30-aedd-7cd30abc95d8
47a011ed-d0ff-1b30-aedd-7cd30abc95d8
47a011ed-d0ff-1b30-aedd-7cd30abc95d8
47a011ed-d0ff-1b30-aedd-7cd30abc95d8
47a011ed-d0ff-1b30-aedd-7cd30abc95d8
47a011ed-d0ff-1b30-aedd-7cd30abc95d8
47a011ed-d0ff-1b30-aedd-7cd30abc95d8
47a011ed-d0ff-1b30-aedd-7cd30abc95d8
47a011ed-d0ff-1b30-aedd-7cd30abc95d8
47a011ed-d0ff-1b30-aedd-7cd30abc95d8
47a011ed-d0ff-1b30-aedd-7cd30abc95d8
47a011ed-d0ff-1b30-aedd-7cd30abc95d8
47a011ed-d0ff-1b30-aedd-7cd30abc95d8
47a011ed-d0ff-1b30-aedd-7cd30abc95d8
47a011ed-d0ff-1b30-aedd-7cd30abc95d8
47a011ed-d0ff-1b30-aedd-7cd30abc95d8
47a011ed-d0ff-1b30-aedd-7cd30abc95d8
47a011ed-d0ff-1b30-aedd-7cd30abc95d8
47a011ed-d0ff-1b30-aedd-7cd30abc95d8
47a011ed-d0ff-1b30-aedd-7cd30abc95d8
47a011ed-d0ff-1b30-aedd-7cd30abc95d8
47a011ed-d0ff-1b30-aedd-7cd30abc95d8
47a011ed-d0ff-1b30-aedd-7cd30abc95d8
47a011ed-d0ff-1b30-aedd-7cd30abc95d8
47a011ed-d0ff-1b30-aedd-7cd30abc95d8
47a011ed-d0ff-1b30-aedd-7cd30abc95d8
47a011ed-d0ff-1b30-aedd-7cd30abc95d8
47a011ed-d0ff-1b30-aedd-7cd30abc95d8
47a011ed-d0ff-1b30-aedd-7cd30abc95d8
47a011ed-d0ff-1b30-aedd-7cd30abc95d8
47a011ed-d0ff-1b30-aedd-7cd30abc95d8
47a011ed-d0ff-1b30-aedd-7cd30abc95d8
47a011ed-d0ff-1b30-aedd-7cd30abc95d8
47a011ed-d0ff-1b30-aedd-7cd30abc95d8
47a011ed-d0ff-1b30-aedd-7cd30abc95d8
47a011ed-d0ff-1b30-aedd-7cd30abc95d8
47a011ed-d0ff-1b30-aedd-7cd30abc95d8
47a011ed-d0ff-1b30-aedd-7cd30abc95d8
47a011ed-d0ff-1b30-aedd-7cd30abc95d8
47a011ed-d0ff-1b30-aedd-7cd30abc95d8
47a011ed-d0ff-1b30-aedd-7cd30abc95d8
47a011ed-d0ff-1b30-aedd-7cd30abc95d8
47a011ed-d0ff-1b30-aedd-7cd30abc95d8
47a011ed-d0ff-1b30-aedd-7cd30abc95d8
47a011ed-d0ff-1b30-aedd-7cd30abc95d8
47a011ed-d0ff-1b30-aedd-7cd30abc95d8
47a011ed-d0ff-1b30-aedd-7cd30abc95d8
47a011ed-d0ff-1b30-aedd-7cd30abc95d8
47a011ed-d0ff-1b30-aedd-7cd30abc95d8
47a011ed-d0ff-1b30-aedd-7cd30abc95d8
47a011ed-d0ff-1b30-aedd-7cd30abc95d8
47a011ed-d0ff-1b30-aedd-7cd30abc95d8
47a011ed-d0ff-1b30-aedd-7cd30abc95d8
47a011ed-d0ff-1b30-aedd-7cd30abc95d8
47a011ed-d0ff-1b30-aedd-7cd30abc95d8
47a011ed-d0ff-1b30-aedd-7cd30abc95d8
47a011ed-d0ff-1b30-aedd-7cd30abc95d8
47a011ed-d0ff-1b30-aedd-7cd30abc95d8
47a011ed-d0ff-1b30-aedd-7cd30abc95d8
47a011ed-d0ff-1b30-aedd-7cd30abc95d8
47a011ed-d0ff-1b30-aedd-7cd30abc95d8
47a011ed-d0ff-1b30-aedd-7cd30abc95d8
47a011ed-d0ff-1b30-aedd-7cd30abc95d8
47a011ed-d0ff-1b30-aedd-7cd30abc95d8
47a011ed-d0ff-1b30-aedd-7cd30abc95d8
47a011ed-d0ff-1b30-aedd-7cd30abc95d8
47a011ed-d0ff-1b30-aedd-7cd30abc95d8
47a011ed-d0ff-1b30-aedd-7cd30abc95d8
47a011ed-d0ff-1b30-aedd-7cd30abc95d8
47a011ed-d0ff-1b30-aedd-7cd30abc95d8
47a011ed-d0ff-1b30-aedd-7cd30abc95d8
47a011ed-d0ff-1b30-aedd-7cd30abc95d8
47a011ed-d0ff-1b30-aedd-7cd30abc95d8
47a011ed-d0ff-1b30-aedd-7cd30abc95d8
47a011ed-d0ff-1b30-aedd-7cd30abc95d8
47a011ed-d0ff-1b30-aedd-7cd30abc95d8
47a011ed-d0ff-1b30-aedd-7cd30abc95d8
47a011ed-d0ff-1b30-aedd-7cd30abc95d8
47a011ed-d0ff-1b30-aedd-7cd30abc95d8
47a011ed-d0ff-1b30-aedd-7cd30abc95d8
47a011ed-d0ff-1b30-aedd-7cd30abc95d8
47a011ed-d0ff-1b30-aedd-7cd30abc95d8
47a011ed-d0ff-1b30-aedd-7cd30abc95d8
47a011ed-d0ff-1b30-aedd-7cd30abc95d8
47a011ed-d0ff-1b30-aedd-7cd30abc95d8
47a011ed-d0ff-1b30-aedd-7cd30abc95d8
47a011ed-d0ff-1b30-aedd-7cd30abc95d8
47a011ed-d0ff-1b30-aedd-7cd30abc95d8
47a011ed-d0ff-1b30-aedd-7cd30abc95d8
47a011ed-d0ff-1b30-aedd-7cd30abc95d8
47a011ed-d0ff-1b30-aedd-7cd30abc95d8
47a011ed-d0ff-1b30-aedd-7cd30abc95d8
47a011ed-d0ff-1b30-aedd-7cd30abc95d8
47a011ed-d0ff-1b30-aedd-7cd30abc95d8
47a011ed-d0ff-1b30-aedd-7cd30abc95d8
47a011ed-d0ff-1b30-aedd-7cd30abc95d8
47a011ed-d0ff-1b30-aedd-7cd30abc95d8
47a011ed-d0ff-1b30-aedd-7cd30abc95d8
47a011ed-d0ff-1b30-aedd-7cd30abc95d8
47a011ed-d0ff-1b30-aedd-7cd30abc95d8
47a011ed-d0ff-1b30-aedd-7cd30abc95d8
47a011ed-d0ff-1b30-aedd-7cd30abc95d8
47a011ed-d0ff-1b30-aedd-7cd30abc95d8
47a011ed-d0ff-1b30-aedd-7cd30abc95d8
47a011ed-d0ff-1b30-aedd-7cd30abc95d8
47a011ed-d0ff-1b30-aedd-7cd30abc95d8
47a011ed-d0ff-1b30-aedd-7cd30abc95d8
47a011ed-d0ff-1b30-aedd-7cd30abc95d8
47a011ed-d0ff-1b30-aedd-7cd30abc95d8
47a011ed-d0ff-1b30-aedd-7cd30abc95d8
47a011ed-d0ff-1b30-aedd-7cd30abc95d8
47a011ed-d0ff-1b30-aedd-7cd30abc95d8
47a011ed-d0ff-1b30-aedd-7cd30abc95d8
47a011ed-d0ff-1b30-aedd-7cd30abc95d8
47a011ed-d0ff-1b30-aedd-7cd30abc95d8
47a011ed-d0ff-1b30-aedd-7cd30abc95d8
47a011ed-d0ff-1b30-aedd-7cd30abc95d8
47a011ed-d0ff-1b30-aedd-7cd30abc95d8
47a011ed-d0ff-1b30-aedd-7cd30abc95d8
47a011ed-d0ff-1b30-aedd-7cd30abc95d8
47a011ed-d0ff-1b30-aedd-7cd30abc95d8
47a011ed-d0ff-1b30-aedd-7cd30abc95d8
47a011ed-d0ff-1b30-aedd-7cd30abc95d8
47a011ed-d0ff-1b30-aedd-7cd30abc95d8
47a011ed-d0ff-1b30-aedd-7cd30abc95d8
47a011ed-d0ff-1b30-aedd-7cd30abc95d8
47a011ed-d0ff-1b30-aedd-7cd30abc95d8
47a011ed-d0ff-1b30-aedd-7cd30abc95d8
47a011ed-d0ff-1b30-aedd-7cd30abc95d8
47a011ed-d0ff-1b30-aedd-7cd30abc95d8
47a011ed-d0ff-1b30-aedd-7cd30abc95d8
47a011ed-d0ff-1b30-aedd-7cd30abc95d8
47a011ed-d0ff-1b30-aedd-7cd30abc95d8
47a011ed-d0ff-1b30-aedd-7cd30abc95d8
47a011ed-d0ff-1b30-aedd-7cd30abc95d8
47a011ed-d0ff-1b30-aedd-7cd30abc95d8
47a011ed-d0ff-1b30-aedd-7cd30abc95d8
47a011ed-d0ff-1b30-aedd-7cd30abc95d8
47a011ed-d0ff-1b30-aedd-7cd30abc95d8
47a011ed-d0ff-1b30-aedd-7cd30abc95d8
47a011ed-d0ff-1b30-aedd-7cd30abc95d8
47a011ed-d0ff-1b30-aedd-7cd30abc95d8
47a011ed-d0ff-1b30-aedd-7cd30abc95d8
47a011ed-d0ff-1b30-aedd-7cd30abc95d8
47a011ed-d0ff-1b30-aedd-7cd30abc95d8
47a011ed-d0ff-1b30-aedd-7cd30abc95d8
47a011ed-d0ff-1b30-aedd-7cd30abc95d8
47a011ed-d0ff-1b30-aedd-7cd30abc95d8
47a011ed-d0ff-1b30-aedd-7cd30abc95d8
47a011ed-d0ff-1b30-aedd-7cd30abc95d8
47a011ed-d0ff-1b30-aedd-7cd30abc95d8
47a011ed-d0ff-1b30-aedd-7cd30abc95d8
47a011ed-d0ff-1b30-aedd-7cd30abc95d8
47a011ed-d0ff-1b30-aedd-7cd30abc95d8
47a011ed-d0ff-1b30-aedd-7cd30abc95d8
47a011ed-d0ff-1b30-aedd-7cd30abc95d8
47a011ed-d0ff-1b30-aedd-7cd30abc95d8
47a011ed-d0ff-1b30-aedd-7cd30abc95d8
47a011ed-d0ff-1b30-aedd-7cd30abc95d8
47a011ed-d0ff-1b30-aedd-7cd30abc95d8
47a011ed-d0ff-1b30-aedd-7cd30abc95d8
47a011ed-d0ff-1b30-aedd-7cd30abc95d8
47a011ed-d0ff-1b30-aedd-7cd30abc95d8
47a011ed-d0ff-1b30-aedd-7cd30abc95d8
47a011ed-d0ff-1b30-aedd-7cd30abc95d8
47a011ed-d0ff-1b30-aedd-7cd30abc95d8
47a011ed-d0ff-1b30-aedd-7cd30abc95d8
47a011ed-d0ff-1b30-aedd-7cd30abc95d8
47a011ed-d0ff-1b30-aedd-7cd30abc95d8
47a011ed-d0ff-1b30-aedd-7cd30abc95d8
47a011ed-d0ff-1b30-aedd-7cd30abc95d8
47a011ed-d0ff-1b30-aedd-7cd30abc95d8
47a011ed-d0ff-1b30-aedd-7cd30abc95d8
47a011ed-d0ff-1b30-aedd-7cd30abc95d8
47a011ed-d0ff-1b30-aedd-7cd30abc95d8
47a011ed-d0ff-1b30-aedd-7cd30abc95d8
47a011ed-d0ff-1b30-aedd-7cd30abc95d8
47a011ed-d0ff-1b30-aedd-7cd30abc95d8
47a011ed-d0ff-1b30-aedd-7cd30abc95d8
47a011ed-d0ff-1b30-aedd-7cd30abc95d8
47a011ed-d0ff-1b30-aedd-7cd30abc95d8
47a011ed-d0ff-1b30-aedd-7cd30abc95d8
47a011ed-d0ff-1b30-aedd-7cd30abc95d8
47a011ed-d0ff-1b30-aedd-7cd30abc95d8
47a011ed-d0ff-1b30-aedd-7cd30abc95d8
47a011ed-d0ff-1b30-aedd-7cd30abc95d8
47a011ed-d0ff-1b30-aedd-7cd30abc95d8
47a011ed-d0ff-1b30-aedd-7cd30abc95d8
47a011ed-d0ff-1b30-aedd-7cd30abc95d8
47a011ed-d0ff-1b30-aedd-7cd30abc95d8
47a011ed-d0ff-1b30-aedd-7cd30abc95d8
47a011ed-d0ff-1b30-aedd-7cd30abc95d8
47a011ed-d0ff-1b30-aedd-7cd30abc95d8
47a011ed-d0ff-1b30-aedd-7cd30abc95d8
47a011ed-d0ff-1b30-aedd-7cd30abc95d8
47a011ed-d0ff-1b30-aedd-7cd30abc95d8
47a011ed-d0ff-1b30-aedd-7cd30abc95d8
47a011ed-d0ff-1b30-aedd-7cd30abc95d8
47a011ed-d0ff-1b30-aedd-7cd30abc95d8
47a011ed-d0ff-1b30-aedd-7cd30abc95d8
47a011ed-d0ff-1b30-aedd-7cd30abc95d8
47a011ed-d0ff-1b30-aedd-7cd30abc95d8
47a011ed-d0ff-1b30-aedd-7cd30abc95d8
47a011ed-d0ff-1b30-aedd-7cd30abc95d8
47a011ed-d0ff-1b30-aedd-7cd30abc95d8
47a011ed-d0ff-1b30-aedd-7cd30abc95d8
47a011ed-d0ff-1b30-aedd-7cd30abc95d8
47a011ed-d0ff-1b30-aedd-7cd30abc95d8
47a011ed-d0ff-1b30-aedd-7cd30abc95d8
47a011ed-d0ff-1b30-aedd-7cd30abc95d8
47a011ed-d0ff-1b30-aedd-7cd30abc95d8
47a011ed-d0ff-1b30-aedd-7cd30abc95d8
47a011ed-d0ff-1b30-aedd-7cd30abc95d8
47a011ed-d0ff-1b30-aedd-7cd30abc95d8
47a011ed-d0ff-1b30-aedd-7cd30abc95d8
47a011ed-d0ff-1b30-aedd-7cd30abc95d8
47a011ed-d0ff-1b30-aedd-7cd30abc95d8
47a011ed-d0ff-1b30-aedd-7cd30abc95d8
47a011ed-d0ff-1b30-aedd-7cd30abc95d8
47a011ed-d0ff-1b30-aedd-7cd30abc95d8
47a011ed-d0ff-1b30-aedd-7cd30abc95d8
47a011ed-d0ff-1b30-aedd-7cd30abc95d8
47a011ed-d0ff-1b30-aedd-7cd30abc95d8
47a011ed-d0ff-1b30-aedd-7cd30abc95d8
47a011ed-d0ff-1b30-aedd-7cd30abc95d8
47a011ed-d0ff-1b30-aedd-7cd30abc95d8
47a011ed-d0ff-1b30-aedd-7cd30abc95d8
47a011ed-d0ff-1b30-aedd-7cd30abc95d8
47a011ed-d0ff-1b30-aedd-7cd30abc95d8
47a011ed-d0ff-1b30-aedd-7cd30abc95d8
47a011ed-d0ff-1b30-aedd-7cd30abc95d8
47a011ed-d0ff-1b30-aedd-7cd30abc95d8
47a011ed-d0ff-1b30-aedd-7cd30abc95d8
47a011ed-d0ff-1b30-aedd-7cd30abc95d8
47a011ed-d0ff-1b30-aedd-7cd30abc95d8
47a011ed-d0ff-1b30-aedd-7cd30abc95d8
47a011ed-d0ff-1b30-aedd-7cd30abc95d8
47a011ed-d0ff-1b30-aedd-7cd30abc95d8
47a011ed-d0ff-1b30-aedd-7cd30abc95d8
47a011ed-d0ff-1b30-aedd-7cd30abc95d8
47a011ed-d0ff-1b30-aedd-7cd30abc95d8
47a011ed-d0ff-1b30-aedd-7cd30abc95d8
47a011ed-d0ff-1b30-aedd-7cd30abc95d8
47a011ed-d0ff-1b30-aedd-7cd30abc95d8
47a011ed-d0ff-1b30-aedd-7cd30abc95d8
47a011ed-d0ff-1b30-aedd-7cd30abc95d8
47a011ed-d0ff-1b30-aedd-7cd30abc95d8
47a011ed-d0ff-1b30-aedd-7cd30abc95d8
47a011ed-d0ff-1b30-aedd-7cd30abc95d8
47a011ed-d0ff-1b30-aedd-7cd30abc95d8
47a011ed-d0ff-1b30-aedd-7cd30abc95d8
47a011ed-d0ff-1b30-aedd-7cd30abc95d8
47a011ed-d0ff-1b30-aedd-7cd30abc95d8
47a011ed-d0ff-1b30-aedd-7cd30abc95d8
47a011ed-d0ff-1b30-aedd-7cd30abc95d8
47a011ed-d0ff-1b30-aedd-7cd30abc95d8
47a011ed-d0ff-1b30-aedd-7cd30abc95d8
47a011ed-d0ff-1b30-aedd-7cd30abc95d8
47a011ed-d0ff-1b30-aedd-7cd30abc95d8
47a011ed-d0ff-1b30-aedd-7cd30abc95d8
47a011ed-d0ff-1b30-aedd-7cd30abc95d8
47a011ed-d0ff-1b30-aedd-7cd30abc95d8
47a011ed-d0ff-1b30-aedd-7cd30abc95d8
47a011ed-d0ff-1b30-aedd-7cd30abc95d8
47a011ed-d0ff-1b30-aedd-7cd30abc95d8
47a011ed-d0ff-1b30-aedd-7cd30abc95d8
47a011ed-d0ff-1b30-aedd-7cd30abc95d8
47a011ed-d0ff-1b30-aedd-7cd30abc95d8
47a011ed-d0ff-1b30-aedd-7cd30abc95d8
47a011ed-d0ff-1b30-aedd-7cd30abc95d8
47a011ed-d0ff-1b30-aedd-7cd30abc95d8
47a011ed-d0ff-1b30-aedd-7cd30abc95d8
47a011ed-d0ff-1b30-aedd-7cd30abc95d8
47a011ed-d0ff-1b30-aedd-7cd30abc95d8
47a011ed-d0ff-1b30-aedd-7cd30abc95d8
47a011ed-d0ff-1b30-aedd-7cd30abc95d8
47a011ed-d0ff-1b30-aedd-7cd30abc95d8
47a011ed-d0ff-1b30-aedd-7cd30abc95d8
47a011ed-d0ff-1b30-aedd-7cd30abc95d8
47a011ed-d0ff-1b30-aedd-7cd30abc95d8
47a011ed-d0ff-1b30-aedd-7cd30abc95d8
47a011ed-d0ff-1b30-aedd-7cd30abc95d8
47a011ed-d0ff-1b30-aedd-7cd30abc95d8
47a011ed-d0ff-1b30-aedd-7cd30abc95d8
47a011ed-d0ff-1b30-aedd-7cd30abc95d8
47a011ed-d0ff-1b30-aedd-7cd30abc95d8
47a011ed-d0ff-1b30-aedd-7cd30abc95d8
47a011ed-d0ff-1b30-aedd-7cd30abc95d8
47a011ed-d0ff-1b30-aedd-7cd30abc95d8
47a011ed-d0ff-1b30-aedd-7cd30abc95d8
47a011ed-d0ff-1b30-aedd-7cd30abc95d8
47a011ed-d0ff-1b30-aedd-7cd30abc95d8
47a011ed-d0ff-1b30-aedd-7cd30abc95d8
47a011ed-d0ff-1b30-aedd-7cd30abc95d8
47a011ed-d0ff-1b30-aedd-7cd30abc95d8
47a011ed-d0ff-1b30-aedd-7cd30abc95d8
47a011ed-d0ff-1b30-aedd-7cd30abc95d8
47a011ed-d0ff-1b30-aedd-7cd30abc95d8
47a011ed-d0ff-1b30-aedd-7cd30abc95d8
47a011ed-d0ff-1b30-aedd-7cd30abc95d8
47a011ed-d0ff-1b30-aedd-7cd30abc95d8
47a011ed-d0ff-1b30-aedd-7cd30abc95d8
47a011ed-d0ff-1b30-aedd-7cd30abc95d8
47a011ed-d0ff-1b30-aedd-7cd30abc95d8
47a011ed-d0ff-1b30-aedd-7cd30abc95d8
47a011ed-d0ff-1b30-aedd-7cd30abc95d8
47a011ed-d0ff-1b30-aedd-7cd30abc95d8
47a011ed-d0ff-1b30-aedd-7cd30abc95d8
47a011ed-d0ff-1b30-aedd-7cd30abc95d8
47a011ed-d0ff-1b30-aedd-7cd30abc95d8
47a011ed-d0ff-1b30-aedd-7cd30abc95d8
47a011ed-d0ff-1b30-aedd-7cd30abc95d8
47a011ed-d0ff-1b30-aedd-7cd30abc95d8
47a011ed-d0ff-1b30-aedd-7cd30abc95d8
47a011ed-d0ff-1b30-aedd-7cd30abc95d8
47a011ed-d0ff-1b30-aedd-7cd30abc95d8
47a011ed-d0ff-1b30-aedd-7cd30abc95d8
47a011ed-d0ff-1b30-aedd-7cd30abc95d8
47a011ed-d0ff-1b30-aedd-7cd30abc95d8
47a011ed-d0ff-1b30-aedd-7cd30abc95d8
47a011ed-d0ff-1b30-aedd-7cd30abc95d8
47a011ed-d0ff-1b30-aedd-7cd30abc95d8
47a011ed-d0ff-1b30-aedd-7cd30abc95d8
47a011ed-d0ff-1b30-aedd-7cd30abc95d8
47a011ed-d0ff-1b30-aedd-7cd30abc95d8
47a011ed-d0ff-1b30-aedd-7cd30abc95d8
47a011ed-d0ff-1b30-aedd-7cd30abc95d8
47a011ed-d0ff-1b30-aedd-7cd30abc95d8
47a011ed-d0ff-1b30-aedd-7cd30abc95d8
47a011ed-d0ff-1b30-aedd-7cd30abc95d8
47a011ed-d0ff-1b30-aedd-7cd30abc95d8
47a011ed-d0ff-1b30-aedd-7cd30abc95d8
47a011ed-d0ff-1b30-aedd-7cd30abc95d8
47a011ed-d0ff-1b30-aedd-7cd30abc95d8
47a011ed-d0ff-1b30-aedd-7cd30abc95d8
47a011ed-d0ff-1b30-aedd-7cd30abc95d8
47a011ed-d0ff-1b30-aedd-7cd30abc95d8
47a011ed-d0ff-1b30-aedd-7cd30abc95d8
47a011ed-d0ff-1b30-aedd-7cd30abc95d8
47a011ed-d0ff-1b30-aedd-7cd30abc95d8
47a011ed-d0ff-1b30-aedd-7cd30abc95d8
47a011ed-d0ff-1b30-aedd-7cd30abc95d8
47a011ed-d0ff-1b30-aedd-7cd30abc95d8
47a011ed-d0ff-1b30-aedd-7cd30abc95d8
47a011ed-d0ff-1b30-aedd-7cd30abc95d8
47a011ed-d0ff-1b30-aedd-7cd30abc95d8
47a011ed-d0ff-1b30-aedd-7cd30abc95d8
47a011ed-d0ff-1b30-aedd-7cd30abc95d8
47a011ed-d0ff-1b30-aedd-7cd30abc95d8
47a011ed-d0ff-1b30-aedd-7cd30abc95d8
47a011ed-d0ff-1b30-aedd-7cd30abc95d8
47a011ed-d0ff-1b30-aedd-7cd30abc95d8
47a011ed-d0ff-1b30-aedd-7cd30abc95d8
47a011ed-d0ff-1b30-aedd-7cd30abc95d8
47a011ed-d0ff-1b30-aedd-7cd30abc95d8
47a011ed-d0ff-1b30-aedd-7cd30abc95d8
47a011ed-d0ff-1b30-aedd-7cd30abc95d8
47a011ed-d0ff-1b30-aedd-7cd30abc95d8
47a011ed-d0ff-1b30-aedd-7cd30abc95d8
47a011ed-d0ff-1b30-aedd-7cd30abc95d8
47a011ed-d0ff-1b30-aedd-7cd30abc95d8
47a011ed-d0ff-1b30-aedd-7cd30abc95d8
47a011ed-d0ff-1b30-aedd-7cd30abc95d8
47a011ed-d0ff-1b30-aedd-7cd30abc95d8
47a011ed-d0ff-1b30-aedd-7cd30abc95d8
47a011ed-d0ff-1b30-aedd-7cd30abc95d8
47a011ed-d0ff-1b30-aedd-7cd30abc95d8
47a011ed-d0ff-1b30-aedd-7cd30abc95d8
47a011ed-d0ff-1b30-aedd-7cd30abc95d8
47a011ed-d0ff-1b30-aedd-7cd30abc95d8
47a011ed-d0ff-1b30-aedd-7cd30abc95d8
47a011ed-d0ff-1b30-aedd-7cd30abc95d8
47a011ed-d0ff-1b30-aedd-7cd30abc95d8
47a011ed-d0ff-1b30-aedd-7cd30abc95d8
47a011ed-d0ff-1b30-aedd-7cd30abc95d8
47a011ed-d0ff-1b30-aedd-7cd30abc95d8
47a011ed-d0ff-1b30-aedd-7cd30abc95d8
47a011ed-d0ff-1b30-aedd-7cd30abc95d8
47a011ed-d0ff-1b30-aedd-7cd30abc95d8
47a011ed-d0ff-1b30-aedd-7cd30abc95d8
47a011ed-d0ff-1b30-aedd-7cd30abc95d8
47a011ed-d0ff-1b30-aedd-7cd30abc95d8
47a011ed-d0ff-1b30-aedd-7cd30abc95d8
47a011ed-d0ff-1b30-aedd-7cd30abc95d8
47a011ed-d0ff-1b30-aedd-7cd30abc95d8
47a011ed-d0ff-1b30-aedd-7cd30abc95d8
47a011ed-d0ff-1b30-aedd-7cd30abc95d8
47a011ed-d0ff-1b30-aedd-7cd30abc95d8
47a011ed-d0ff-1b30-aedd-7cd30abc95d8
47a011ed-d0ff-1b30-aedd-7cd30abc95d8
47a011ed-d0ff-1b30-aedd-7cd30abc95d8
47a011ed-d0ff-1b30-aedd-7cd30abc95d8
47a011ed-d0ff-1b30-aedd-7cd30abc95d8
47a011ed-d0ff-1b30-aedd-7cd30abc95d8
47a011ed-d0ff-1b30-aedd-7cd30abc95d8
47a011ed-d0ff-1b30-aedd-7cd30abc95d8
47a011ed-d0ff-1b30-aedd-7cd30abc95d8
47a011ed-d0ff-1b30-aedd-7cd30abc95d8
47a011ed-d0ff-1b30-aedd-7cd30abc95d8
47a011ed-d0ff-1b30-aedd-7cd30abc95d8
47a011ed-d0ff-1b30-aedd-7cd30abc95d8
47a011ed-d0ff-1b30-aedd-7cd30abc95d8
47a011ed-d0ff-1b30-aedd-7cd30abc95d8
47a011ed-d0ff-1b30-aedd-7cd30abc95d8
47a011ed-d0ff-1b30-aedd-7cd30abc95d8
47a011ed-d0ff-1b30-aedd-7cd30abc95d8
47a011ed-d0ff-1b30-aedd-7cd30abc95d8
47a011ed-d0ff-1b30-aedd-7cd30abc95d8
47a011ed-d0ff-1b30-aedd-7cd30abc95d8
47a011ed-d0ff-1b30-aedd-7cd30abc95d8
47a011ed-d0ff-1b30-aedd-7cd30abc95d8
47a011ed-d0ff-1b30-aedd-7cd30abc95d8
47a011ed-d0ff-1b30-aedd-7cd30abc95d8
47a011ed-d0ff-1b30-aedd-7cd30abc95d8
47a011ed-d0ff-1b30-aedd-7cd30abc95d8
47a011ed-d0ff-1b30-aedd-7cd30abc95d8
47a011ed-d0ff-1b30-aedd-7cd30abc95d8
47a011ed-d0ff-1b30-aedd-7cd30abc95d8
47a011ed-d0ff-1b30-aedd-7cd30abc95d8
47a011ed-d0ff-1b30-aedd-7cd30abc95d8
47a011ed-d0ff-1b30-aedd-7cd30abc95d8
47a011ed-d0ff-1b30-aedd-7cd30abc95d8
47a011ed-d0ff-1b30-aedd-7cd30abc95d8
47a011ed-d0ff-1b30-aedd-7cd30abc95d8
47a011ed-d0ff-1b30-aedd-7cd30abc95d8
47a011ed-d0ff-1b30-aedd-7cd30abc95d8
47a011ed-d0ff-1b30-aedd-7cd30abc95d8
47a011ed-d0ff-1b30-aedd-7cd30abc95d8
47a011ed-d0ff-1b30-aedd-7cd30abc95d8
47a011ed-d0ff-1b30-aedd-7cd30abc95d8
47a011ed-d0ff-1b30-aedd-7cd30abc95d8
47a011ed-d0ff-1b30-aedd-7cd30abc95d8
47a011ed-d0ff-1b30-aedd-7cd30abc95d8
47a011ed-d0ff-1b30-aedd-7cd30abc95d8
47a011ed-d0ff-1b30-aedd-7cd30abc95d8
47a011ed-d0ff-1b30-aedd-7cd30abc95d8
47a011ed-d0ff-1b30-aedd-7cd30abc95d8
47a011ed-d0ff-1b30-aedd-7cd30abc95d8
47a011ed-d0ff-1b30-aedd-7cd30abc95d8
47a011ed-d0ff-1b30-aedd-7cd30abc95d8
47a011ed-d0ff-1b30-aedd-7cd30abc95d8
47a011ed-d0ff-1b30-aedd-7cd30abc95d8
47a011ed-d0ff-1b30-aedd-7cd30abc95d8
47a011ed-d0ff-1b30-aedd-7cd30abc95d8
47a011ed-d0ff-1b30-aedd-7cd30abc95d8
47a011ed-d0ff-1b30-aedd-7cd30abc95d8
47a011ed-d0ff-1b30-aedd-7cd30abc95d8
47a011ed-d0ff-1b30-aedd-7cd30abc95d8
47a011ed-d0ff-1b30-aedd-7cd30abc95d8
47a011ed-d0ff-1b30-aedd-7cd30abc95d8
47a011ed-d0ff-1b30-aedd-7cd30abc95d8
47a011ed-d0ff-1b30-aedd-7cd30abc95d8
47a011ed-d0ff-1b30-aedd-7cd30abc95d8
47a011ed-d0ff-1b30-aedd-7cd30abc95d8
47a011ed-d0ff-1b30-aedd-7cd30abc95d8
47a011ed-d0ff-1b30-aedd-7cd30abc95d8
47a011ed-d0ff-1b30-aedd-7cd30abc95d8
47a011ed-d0ff-1b30-aedd-7cd30abc95d8
47a011ed-d0ff-1b30-aedd-7cd30abc95d8
47a011ed-d0ff-1b30-aedd-7cd30abc95d8
47a011ed-d0ff-1b30-aedd-7cd30abc95d8
47a011ed-d0ff-1b30-aedd-7cd30abc95d8
47a011ed-d0ff-1b30-aedd-7cd30abc95d8
47a011ed-d0ff-1b30-aedd-7cd30abc95d8
47a011ed-d0ff-1b30-aedd-7cd30abc95d8
47a011ed-d0ff-1b30-aedd-7cd30abc95d8
47a011ed-d0ff-1b30-aedd-7cd30abc95d8
47a011ed-d0ff-1b30-aedd-7cd30abc95d8
47a011ed-d0ff-1b30-aedd-7cd30abc95d8
47a011ed-d0ff-1b30-aedd-7cd30abc95d8
47a011ed-d0ff-1b30-aedd-7cd30abc95d8
47a011ed-d0ff-1b30-aedd-7cd30abc95d8
47a011ed-d0ff-1b30-aedd-7cd30abc95d8
47a011ed-d0ff-1b30-aedd-7cd30abc95d8
47a011ed-d0ff-1b30-aedd-7cd30abc95d8
47a011ed-d0ff-1b30-aedd-7cd30abc95d8
47a011ed-d0ff-1b30-aedd-7cd30abc95d8
47a011ed-d0ff-1b30-aedd-7cd30abc95d8
47a011ed-d0ff-1b30-aedd-7cd30abc95d8
47a011ed-d0ff-1b30-aedd-7cd30abc95d8
47a011ed-d0ff-1b30-aedd-7cd30abc95d8
47a011ed-d0ff-1b30-aedd-7cd30abc95d8
47a011ed-d0ff-1b30-aedd-7cd30abc95d8
47a011ed-d0ff-1b30-aedd-7cd30abc95d8
47a011ed-d0ff-1b30-aedd-7cd30abc95d8
47a011ed-d0ff-1b30-aedd-7cd30abc95d8
47a011ed-d0ff-1b30-aedd-7cd30abc95d8
47a011ed-d0ff-1b30-aedd-7cd30abc95d8
47a011ed-d0ff-1b30-aedd-7cd30abc95d8
47a011ed-d0ff-1b30-aedd-7cd30abc95d8
47a011ed-d0ff-1b30-aedd-7cd30abc95d8
47a011ed-d0ff-1b30-aedd-7cd30abc95d8
select * from test1 order by id asc;
id
1b30d0ff-47a0-11ed-aedd-7cd30abc95d8
1b30d0ff-47a0-11ed-aedd-7cd30abc95d8
1b30d0ff-47a0-11ed-aedd-7cd30abc95d8
1b30d0ff-47a0-11ed-aedd-7cd30abc95d8
1b30d0ff-47a0-11ed-aedd-7cd30abc95d8
1b30d0ff-47a0-11ed-aedd-7cd30abc95d8
1b30d0ff-47a0-11ed-aedd-7cd30abc95d8
1b30d0ff-47a0-11ed-aedd-7cd30abc95d8
1b30d0ff-47a0-11ed-aedd-7cd30abc95d8
1b30d0ff-47a0-11ed-aedd-7cd30abc95d8
1b30d0ff-47a0-11ed-aedd-7cd30abc95d8
1b30d0ff-47a0-11ed-aedd-7cd30abc95d8
1b30d0ff-47a0-11ed-aedd-7cd30abc95d8
1b30d0ff-47a0-11ed-aedd-7cd30abc95d8
1b30d0ff-47a0-11ed-aedd-7cd30abc95d8
1b30d0ff-47a0-11ed-aedd-7cd30abc95d8
1b30d0ff-47a0-11ed-aedd-7cd30abc95d8
1b30d0ff-47a0-11ed-aedd-7cd30abc95d8
1b30d0ff-47a0-11ed-aedd-7cd30abc95d8
1b30d0ff-47a0-11ed-aedd-7cd30abc95d8
1b30d0ff-47a0-11ed-aedd-7cd30abc95d8
1b30d0ff-47a0-11ed-aedd-7cd30abc95d8
1b30d0ff-47a0-11ed-aedd-7cd30abc95d8
1b30d0ff-47a0-11ed-aedd-7cd30abc95d8
1b30d0ff-47a0-11ed-aedd-7cd30abc95d8
1b30d0ff-47a0-11ed-aedd-7cd30abc95d8
1b30d0ff-47a0-11ed-aedd-7cd30abc95d8
1b30d0ff-47a0-11ed-aedd-7cd30abc95d8
1b30d0ff-47a0-11ed-aedd-7cd30abc95d8
1b30d0ff-47a0-11ed-aedd-7cd30abc95d8
1b30d0ff-47a0-11ed-aedd-7cd30abc95d8
1b30d0ff-47a0-11ed-aedd-7cd30abc95d8
1b30d0ff-47a0-11ed-aedd-7cd30abc95d8
1b30d0ff-47a0-11ed-aedd-7cd30abc95d8
1b30d0ff-47a0-11ed-aedd-7cd30abc95d8
1b30d0ff-47a0-11ed-aedd-7cd30abc95d8
1b30d0ff-47a0-11ed-aedd-7cd30abc95d8
1b30d0ff-47a0-11ed-aedd-7cd30abc95d8
1b30d0ff-47a0-11ed-aedd-7cd30abc95d8
1b30d0ff-47a0-11ed-aedd-7cd30abc95d8
1b30d0ff-47a0-11ed-aedd-7cd30abc95d8
1b30d0ff-47a0-11ed-aedd-7cd30abc95d8
1b30d0ff-47a0-11ed-aedd-7cd30abc95d8
1b30d0ff-47a0-11ed-aedd-7cd30abc95d8
1b30d0ff-47a0-11ed-aedd-7cd30abc95d8
1b30d0ff-47a0-11ed-aedd-7cd30abc95d8
1b30d0ff-47a0-11ed-aedd-7cd30abc95d8
1b30d0ff-47a0-11ed-aedd-7cd30abc95d8
1b30d0ff-47a0-11ed-aedd-7cd30abc95d8
1b30d0ff-47a0-11ed-aedd-7cd30abc95d8
1b30d0ff-47a0-11ed-aedd-7cd30abc95d8
1b30d0ff-47a0-11ed-aedd-7cd30abc95d8
1b30d0ff-47a0-11ed-aedd-7cd30abc95d8
1b30d0ff-47a0-11ed-aedd-7cd30abc95d8
1b30d0ff-47a0-11ed-aedd-7cd30abc95d8
1b30d0ff-47a0-11ed-aedd-7cd30abc95d8
1b30d0ff-47a0-11ed-aedd-7cd30abc95d8
1b30d0ff-47a0-11ed-aedd-7cd30abc95d8
1b30d0ff-47a0-11ed-aedd-7cd30abc95d8
1b30d0ff-47a0-11ed-aedd-7cd30abc95d8
1b30d0ff-47a0-11ed-aedd-7cd30abc95d8
1b30d0ff-47a0-11ed-aedd-7cd30abc95d8
1b30d0ff-47a0-11ed-aedd-7cd30abc95d8
1b30d0ff-47a0-11ed-aedd-7cd30abc95d8
1b30d0ff-47a0-11ed-aedd-7cd30abc95d8
1b30d0ff-47a0-11ed-aedd-7cd30abc95d8
1b30d0ff-47a0-11ed-aedd-7cd30abc95d8
1b30d0ff-47a0-11ed-aedd-7cd30abc95d8
1b30d0ff-47a0-11ed-aedd-7cd30abc95d8
1b30d0ff-47a0-11ed-aedd-7cd30abc95d8
1b30d0ff-47a0-11ed-aedd-7cd30abc95d8
1b30d0ff-47a0-11ed-aedd-7cd30abc95d8
1b30d0ff-47a0-11ed-aedd-7cd30abc95d8
1b30d0ff-47a0-11ed-aedd-7cd30abc95d8
1b30d0ff-47a0-11ed-aedd-7cd30abc95d8
1b30d0ff-47a0-11ed-aedd-7cd30abc95d8
1b30d0ff-47a0-11ed-aedd-7cd30abc95d8
1b30d0ff-47a0-11ed-aedd-7cd30abc95d8
1b30d0ff-47a0-11ed-aedd-7cd30abc95d8
1b30d0ff-47a0-11ed-aedd-7cd30abc95d8
1b30d0ff-47a0-11ed-aedd-7cd30abc95d8
1b30d0ff-47a0-11ed-aedd-7cd30abc95d8
1b30d0ff-47a0-11ed-aedd-7cd30abc95d8
1b30d0ff-47a0-11ed-aedd-7cd30abc95d8
1b30d0ff-47a0-11ed-aedd-7cd30abc95d8
1b30d0ff-47a0-11ed-aedd-7cd30abc95d8
1b30d0ff-47a0-11ed-aedd-7cd30abc95d8
1b30d0ff-47a0-11ed-aedd-7cd30abc95d8
1b30d0ff-47a0-11ed-aedd-7cd30abc95d8
1b30d0ff-47a0-11ed-aedd-7cd30abc95d8
1b30d0ff-47a0-11ed-aedd-7cd30abc95d8
1b30d0ff-47a0-11ed-aedd-7cd30abc95d8
1b30d0ff-47a0-11ed-aedd-7cd30abc95d8
1b30d0ff-47a0-11ed-aedd-7cd30abc95d8
1b30d0ff-47a0-11ed-aedd-7cd30abc95d8
1b30d0ff-47a0-11ed-aedd-7cd30abc95d8
1b30d0ff-47a0-11ed-aedd-7cd30abc95d8
1b30d0ff-47a0-11ed-aedd-7cd30abc95d8
1b30d0ff-47a0-11ed-aedd-7cd30abc95d8
1b30d0ff-47a0-11ed-aedd-7cd30abc95d8
1b30d0ff-47a0-11ed-aedd-7cd30abc95d8
1b30d0ff-47a0-11ed-aedd-7cd30abc95d8
1b30d0ff-47a0-11ed-aedd-7cd30abc95d8
1b30d0ff-47a0-11ed-aedd-7cd30abc95d8
1b30d0ff-47a0-11ed-aedd-7cd30abc95d8
1b30d0ff-47a0-11ed-aedd-7cd30abc95d8
1b30d0ff-47a0-11ed-aedd-7cd30abc95d8
1b30d0ff-47a0-11ed-aedd-7cd30abc95d8
1b30d0ff-47a0-11ed-aedd-7cd30abc95d8
1b30d0ff-47a0-11ed-aedd-7cd30abc95d8
1b30d0ff-47a0-11ed-aedd-7cd30abc95d8
1b30d0ff-47a0-11ed-aedd-7cd30abc95d8
1b30d0ff-47a0-11ed-aedd-7cd30abc95d8
1b30d0ff-47a0-11ed-aedd-7cd30abc95d8
1b30d0ff-47a0-11ed-aedd-7cd30abc95d8
1b30d0ff-47a0-11ed-aedd-7cd30abc95d8
1b30d0ff-47a0-11ed-aedd-7cd30abc95d8
1b30d0ff-47a0-11ed-aedd-7cd30abc95d8
1b30d0ff-47a0-11ed-aedd-7cd30abc95d8
1b30d0ff-47a0-11ed-aedd-7cd30abc95d8
1b30d0ff-47a0-11ed-aedd-7cd30abc95d8
1b30d0ff-47a0-11ed-aedd-7cd30abc95d8
1b30d0ff-47a0-11ed-aedd-7cd30abc95d8
1b30d0ff-47a0-11ed-aedd-7cd30abc95d8
1b30d0ff-47a0-11ed-aedd-7cd30abc95d8
1b30d0ff-47a0-11ed-aedd-7cd30abc95d8
1b30d0ff-47a0-11ed-aedd-7cd30abc95d8
1b30d0ff-47a0-11ed-aedd-7cd30abc95d8
1b30d0ff-47a0-11ed-aedd-7cd30abc95d8
1b30d0ff-47a0-11ed-aedd-7cd30abc95d8
1b30d0ff-47a0-11ed-aedd-7cd30abc95d8
1b30d0ff-47a0-11ed-aedd-7cd30abc95d8
1b30d0ff-47a0-11ed-aedd-7cd30abc95d8
1b30d0ff-47a0-11ed-aedd-7cd30abc95d8
1b30d0ff-47a0-11ed-aedd-7cd30abc95d8
1b30d0ff-47a0-11ed-aedd-7cd30abc95d8
1b30d0ff-47a0-11ed-aedd-7cd30abc95d8
1b30d0ff-47a0-11ed-aedd-7cd30abc95d8
1b30d0ff-47a0-11ed-aedd-7cd30abc95d8
1b30d0ff-47a0-11ed-aedd-7cd30abc95d8
1b30d0ff-47a0-11ed-aedd-7cd30abc95d8
1b30d0ff-47a0-11ed-aedd-7cd30abc95d8
1b30d0ff-47a0-11ed-aedd-7cd30abc95d8
1b30d0ff-47a0-11ed-aedd-7cd30abc95d8
1b30d0ff-47a0-11ed-aedd-7cd30abc95d8
1b30d0ff-47a0-11ed-aedd-7cd30abc95d8
1b30d0ff-47a0-11ed-aedd-7cd30abc95d8
1b30d0ff-47a0-11ed-aedd-7cd30abc95d8
1b30d0ff-47a0-11ed-aedd-7cd30abc95d8
1b30d0ff-47a0-11ed-aedd-7cd30abc95d8
1b30d0ff-47a0-11ed-aedd-7cd30abc95d8
1b30d0ff-47a0-11ed-aedd-7cd30abc95d8
1b30d0ff-47a0-11ed-aedd-7cd30abc95d8
1b30d0ff-47a0-11ed-aedd-7cd30abc95d8
1b30d0ff-47a0-11ed-aedd-7cd30abc95d8
1b30d0ff-47a0-11ed-aedd-7cd30abc95d8
1b30d0ff-47a0-11ed-aedd-7cd30abc95d8
1b30d0ff-47a0-11ed-aedd-7cd30abc95d8
1b30d0ff-47a0-11ed-aedd-7cd30abc95d8
1b30d0ff-47a0-11ed-aedd-7cd30abc95d8
1b30d0ff-47a0-11ed-aedd-7cd30abc95d8
1b30d0ff-47a0-11ed-aedd-7cd30abc95d8
1b30d0ff-47a0-11ed-aedd-7cd30abc95d8
1b30d0ff-47a0-11ed-aedd-7cd30abc95d8
1b30d0ff-47a0-11ed-aedd-7cd30abc95d8
1b30d0ff-47a0-11ed-aedd-7cd30abc95d8
1b30d0ff-47a0-11ed-aedd-7cd30abc95d8
1b30d0ff-47a0-11ed-aedd-7cd30abc95d8
1b30d0ff-47a0-11ed-aedd-7cd30abc95d8
1b30d0ff-47a0-11ed-aedd-7cd30abc95d8
1b30d0ff-47a0-11ed-aedd-7cd30abc95d8
1b30d0ff-47a0-11ed-aedd-7cd30abc95d8
1b30d0ff-47a0-11ed-aedd-7cd30abc95d8
1b30d0ff-47a0-11ed-aedd-7cd30abc95d8
1b30d0ff-47a0-11ed-aedd-7cd30abc95d8
1b30d0ff-47a0-11ed-aedd-7cd30abc95d8
1b30d0ff-47a0-11ed-aedd-7cd30abc95d8
1b30d0ff-47a0-11ed-aedd-7cd30abc95d8
1b30d0ff-47a0-11ed-aedd-7cd30abc95d8
1b30d0ff-47a0-11ed-aedd-7cd30abc95d8
1b30d0ff-47a0-11ed-aedd-7cd30abc95d8
1b30d0ff-47a0-11ed-aedd-7cd30abc95d8
1b30d0ff-47a0-11ed-aedd-7cd30abc95d8
1b30d0ff-47a0-11ed-aedd-7cd30abc95d8
1b30d0ff-47a0-11ed-aedd-7cd30abc95d8
1b30d0ff-47a0-11ed-aedd-7cd30abc95d8
1b30d0ff-47a0-11ed-aedd-7cd30abc95d8
1b30d0ff-47a0-11ed-aedd-7cd30abc95d8
1b30d0ff-47a0-11ed-aedd-7cd30abc95d8
1b30d0ff-47a0-11ed-aedd-7cd30abc95d8
1b30d0ff-47a0-11ed-aedd-7cd30abc95d8
1b30d0ff-47a0-11ed-aedd-7cd30abc95d8
1b30d0ff-47a0-11ed-aedd-7cd30abc95d8
1b30d0ff-47a0-11ed-aedd-7cd30abc95d8
1b30d0ff-47a0-11ed-aedd-7cd30abc95d8
1b30d0ff-47a0-11ed-aedd-7cd30abc95d8
1b30d0ff-47a0-11ed-aedd-7cd30abc95d8
1b30d0ff-47a0-11ed-aedd-7cd30abc95d8
1b30d0ff-47a0-11ed-aedd-7cd30abc95d8
1b30d0ff-47a0-11ed-aedd-7cd30abc95d8
1b30d0ff-47a0-11ed-aedd-7cd30abc95d8
1b30d0ff-47a0-11ed-aedd-7cd30abc95d8
1b30d0ff-47a0-11ed-aedd-7cd30abc95d8
1b30d0ff-47a0-11ed-aedd-7cd30abc95d8
1b30d0ff-47a0-11ed-aedd-7cd30abc95d8
1b30d0ff-47a0-11ed-aedd-7cd30abc95d8
1b30d0ff-47a0-11ed-aedd-7cd30abc95d8
1b30d0ff-47a0-11ed-aedd-7cd30abc95d8
1b30d0ff-47a0-11ed-aedd-7cd30abc95d8
1b30d0ff-47a0-11ed-aedd-7cd30abc95d8
1b30d0ff-47a0-11ed-aedd-7cd30abc95d8
1b30d0ff-47a0-11ed-aedd-7cd30abc95d8
1b30d0ff-47a0-11ed-aedd-7cd30abc95d8
1b30d0ff-47a0-11ed-aedd-7cd30abc95d8
1b30d0ff-47a0-11ed-aedd-7cd30abc95d8
1b30d0ff-47a0-11ed-aedd-7cd30abc95d8
1b30d0ff-47a0-11ed-aedd-7cd30abc95d8
1b30d0ff-47a0-11ed-aedd-7cd30abc95d8
1b30d0ff-47a0-11ed-aedd-7cd30abc95d8
1b30d0ff-47a0-11ed-aedd-7cd30abc95d8
1b30d0ff-47a0-11ed-aedd-7cd30abc95d8
1b30d0ff-47a0-11ed-aedd-7cd30abc95d8
1b30d0ff-47a0-11ed-aedd-7cd30abc95d8
1b30d0ff-47a0-11ed-aedd-7cd30abc95d8
1b30d0ff-47a0-11ed-aedd-7cd30abc95d8
1b30d0ff-47a0-11ed-aedd-7cd30abc95d8
1b30d0ff-47a0-11ed-aedd-7cd30abc95d8
1b30d0ff-47a0-11ed-aedd-7cd30abc95d8
1b30d0ff-47a0-11ed-aedd-7cd30abc95d8
1b30d0ff-47a0-11ed-aedd-7cd30abc95d8
1b30d0ff-47a0-11ed-aedd-7cd30abc95d8
1b30d0ff-47a0-11ed-aedd-7cd30abc95d8
1b30d0ff-47a0-11ed-aedd-7cd30abc95d8
1b30d0ff-47a0-11ed-aedd-7cd30abc95d8
1b30d0ff-47a0-11ed-aedd-7cd30abc95d8
1b30d0ff-47a0-11ed-aedd-7cd30abc95d8
1b30d0ff-47a0-11ed-aedd-7cd30abc95d8
1b30d0ff-47a0-11ed-aedd-7cd30abc95d8
1b30d0ff-47a0-11ed-aedd-7cd30abc95d8
1b30d0ff-47a0-11ed-aedd-7cd30abc95d8
1b30d0ff-47a0-11ed-aedd-7cd30abc95d8
1b30d0ff-47a0-11ed-aedd-7cd30abc95d8
1b30d0ff-47a0-11ed-aedd-7cd30abc95d8
1b30d0ff-47a0-11ed-aedd-7cd30abc95d8
1b30d0ff-47a0-11ed-aedd-7cd30abc95d8
1b30d0ff-47a0-11ed-aedd-7cd30abc95d8
1b30d0ff-47a0-11ed-aedd-7cd30abc95d8
1b30d0ff-47a0-11ed-aedd-7cd30abc95d8
1b30d0ff-47a0-11ed-aedd-7cd30abc95d8
1b30d0ff-47a0-11ed-aedd-7cd30abc95d8
1b30d0ff-47a0-11ed-aedd-7cd30abc95d8
1b30d0ff-47a0-11ed-aedd-7cd30abc95d8
1b30d0ff-47a0-11ed-aedd-7cd30abc95d8
1b30d0ff-47a0-11ed-aedd-7cd30abc95d8
1b30d0ff-47a0-11ed-aedd-7cd30abc95d8
1b30d0ff-47a0-11ed-aedd-7cd30abc95d8
1b30d0ff-47a0-11ed-aedd-7cd30abc95d8
1b30d0ff-47a0-11ed-aedd-7cd30abc95d8
1b30d0ff-47a0-11ed-aedd-7cd30abc95d8
1b30d0ff-47a0-11ed-aedd-7cd30abc95d8
1b30d0ff-47a0-11ed-aedd-7cd30abc95d8
1b30d0ff-47a0-11ed-aedd-7cd30abc95d8
1b30d0ff-47a0-11ed-aedd-7cd30abc95d8
1b30d0ff-47a0-11ed-aedd-7cd30abc95d8
1b30d0ff-47a0-11ed-aedd-7cd30abc95d8
1b30d0ff-47a0-11ed-aedd-7cd30abc95d8
1b30d0ff-47a0-11ed-aedd-7cd30abc95d8
1b30d0ff-47a0-11ed-aedd-7cd30abc95d8
1b30d0ff-47a0-11ed-aedd-7cd30abc95d8
1b30d0ff-47a0-11ed-aedd-7cd30abc95d8
1b30d0ff-47a0-11ed-aedd-7cd30abc95d8
1b30d0ff-47a0-11ed-aedd-7cd30abc95d8
1b30d0ff-47a0-11ed-aedd-7cd30abc95d8
1b30d0ff-47a0-11ed-aedd-7cd30abc95d8
1b30d0ff-47a0-11ed-aedd-7cd30abc95d8
1b30d0ff-47a0-11ed-aedd-7cd30abc95d8
1b30d0ff-47a0-11ed-aedd-7cd30abc95d8
1b30d0ff-47a0-11ed-aedd-7cd30abc95d8
1b30d0ff-47a0-11ed-aedd-7cd30abc95d8
1b30d0ff-47a0-11ed-aedd-7cd30abc95d8
1b30d0ff-47a0-11ed-aedd-7cd30abc95d8
1b30d0ff-47a0-11ed-aedd-7cd30abc95d8
1b30d0ff-47a0-11ed-aedd-7cd30abc95d8
1b30d0ff-47a0-11ed-aedd-7cd30abc95d8
1b30d0ff-47a0-11ed-aedd-7cd30abc95d8
1b30d0ff-47a0-11ed-aedd-7cd30abc95d8
1b30d0ff-47a0-11ed-aedd-7cd30abc95d8
1b30d0ff-47a0-11ed-aedd-7cd30abc95d8
1b30d0ff-47a0-11ed-aedd-7cd30abc95d8
1b30d0ff-47a0-11ed-aedd-7cd30abc95d8
1b30d0ff-47a0-11ed-aedd-7cd30abc95d8
1b30d0ff-47a0-11ed-aedd-7cd30abc95d8
1b30d0ff-47a0-11ed-aedd-7cd30abc95d8
1b30d0ff-47a0-11ed-aedd-7cd30abc95d8
1b30d0ff-47a0-11ed-aedd-7cd30abc95d8
1b30d0ff-47a0-11ed-aedd-7cd30abc95d8
1b30d0ff-47a0-11ed-aedd-7cd30abc95d8
1b30d0ff-47a0-11ed-aedd-7cd30abc95d8
1b30d0ff-47a0-11ed-aedd-7cd30abc95d8
1b30d0ff-47a0-11ed-aedd-7cd30abc95d8
1b30d0ff-47a0-11ed-aedd-7cd30abc95d8
1b30d0ff-47a0-11ed-aedd-7cd30abc95d8
1b30d0ff-47a0-11ed-aedd-7cd30abc95d8
1b30d0ff-47a0-11ed-aedd-7cd30abc95d8
1b30d0ff-47a0-11ed-aedd-7cd30abc95d8
1b30d0ff-47a0-11ed-aedd-7cd30abc95d8
1b30d0ff-47a0-11ed-aedd-7cd30abc95d8
1b30d0ff-47a0-11ed-aedd-7cd30abc95d8
1b30d0ff-47a0-11ed-aedd-7cd30abc95d8
1b30d0ff-47a0-11ed-aedd-7cd30abc95d8
1b30d0ff-47a0-11ed-aedd-7cd30abc95d8
1b30d0ff-47a0-11ed-aedd-7cd30abc95d8
1b30d0ff-47a0-11ed-aedd-7cd30abc95d8
1b30d0ff-47a0-11ed-aedd-7cd30abc95d8
1b30d0ff-47a0-11ed-aedd-7cd30abc95d8
1b30d0ff-47a0-11ed-aedd-7cd30abc95d8
1b30d0ff-47a0-11ed-aedd-7cd30abc95d8
1b30d0ff-47a0-11ed-aedd-7cd30abc95d8
1b30d0ff-47a0-11ed-aedd-7cd30abc95d8
1b30d0ff-47a0-11ed-aedd-7cd30abc95d8
1b30d0ff-47a0-11ed-aedd-7cd30abc95d8
1b30d0ff-47a0-11ed-aedd-7cd30abc95d8
1b30d0ff-47a0-11ed-aedd-7cd30abc95d8
1b30d0ff-47a0-11ed-aedd-7cd30abc95d8
1b30d0ff-47a0-11ed-aedd-7cd30abc95d8
1b30d0ff-47a0-11ed-aedd-7cd30abc95d8
1b30d0ff-47a0-11ed-aedd-7cd30abc95d8
1b30d0ff-47a0-11ed-aedd-7cd30abc95d8
1b30d0ff-47a0-11ed-aedd-7cd30abc95d8
1b30d0ff-47a0-11ed-aedd-7cd30abc95d8
1b30d0ff-47a0-11ed-aedd-7cd30abc95d8
1b30d0ff-47a0-11ed-aedd-7cd30abc95d8
1b30d0ff-47a0-11ed-aedd-7cd30abc95d8
1b30d0ff-47a0-11ed-aedd-7cd30abc95d8
1b30d0ff-47a0-11ed-aedd-7cd30abc95d8
1b30d0ff-47a0-11ed-aedd-7cd30abc95d8
1b30d0ff-47a0-11ed-aedd-7cd30abc95d8
1b30d0ff-47a0-11ed-aedd-7cd30abc95d8
1b30d0ff-47a0-11ed-aedd-7cd30abc95d8
1b30d0ff-47a0-11ed-aedd-7cd30abc95d8
1b30d0ff-47a0-11ed-aedd-7cd30abc95d8
1b30d0ff-47a0-11ed-aedd-7cd30abc95d8
1b30d0ff-47a0-11ed-aedd-7cd30abc95d8
1b30d0ff-47a0-11ed-aedd-7cd30abc95d8
1b30d0ff-47a0-11ed-aedd-7cd30abc95d8
1b30d0ff-47a0-11ed-aedd-7cd30abc95d8
1b30d0ff-47a0-11ed-aedd-7cd30abc95d8
1b30d0ff-47a0-11ed-aedd-7cd30abc95d8
1b30d0ff-47a0-11ed-aedd-7cd30abc95d8
1b30d0ff-47a0-11ed-aedd-7cd30abc95d8
1b30d0ff-47a0-11ed-aedd-7cd30abc95d8
1b30d0ff-47a0-11ed-aedd-7cd30abc95d8
1b30d0ff-47a0-11ed-aedd-7cd30abc95d8
1b30d0ff-47a0-11ed-aedd-7cd30abc95d8
1b30d0ff-47a0-11ed-aedd-7cd30abc95d8
1b30d0ff-47a0-11ed-aedd-7cd30abc95d8
1b30d0ff-47a0-11ed-aedd-7cd30abc95d8
1b30d0ff-47a0-11ed-aedd-7cd30abc95d8
1b30d0ff-47a0-11ed-aedd-7cd30abc95d8
1b30d0ff-47a0-11ed-aedd-7cd30abc95d8
1b30d0ff-47a0-11ed-aedd-7cd30abc95d8
1b30d0ff-47a0-11ed-aedd-7cd30abc95d8
1b30d0ff-47a0-11ed-aedd-7cd30abc95d8
1b30d0ff-47a0-11ed-aedd-7cd30abc95d8
1b30d0ff-47a0-11ed-aedd-7cd30abc95d8
1b30d0ff-47a0-11ed-aedd-7cd30abc95d8
1b30d0ff-47a0-11ed-aedd-7cd30abc95d8
1b30d0ff-47a0-11ed-aedd-7cd30abc95d8
1b30d0ff-47a0-11ed-aedd-7cd30abc95d8
1b30d0ff-47a0-11ed-aedd-7cd30abc95d8
1b30d0ff-47a0-11ed-aedd-7cd30abc95d8
1b30d0ff-47a0-11ed-aedd-7cd30abc95d8
1b30d0ff-47a0-11ed-aedd-7cd30abc95d8
1b30d0ff-47a0-11ed-aedd-7cd30abc95d8
1b30d0ff-47a0-11ed-aedd-7cd30abc95d8
1b30d0ff-47a0-11ed-aedd-7cd30abc95d8
1b30d0ff-47a0-11ed-aedd-7cd30abc95d8
1b30d0ff-47a0-11ed-aedd-7cd30abc95d8
1b30d0ff-47a0-11ed-aedd-7cd30abc95d8
1b30d0ff-47a0-11ed-aedd-7cd30abc95d8
1b30d0ff-47a0-11ed-aedd-7cd30abc95d8
1b30d0ff-47a0-11ed-aedd-7cd30abc95d8
1b30d0ff-47a0-11ed-aedd-7cd30abc95d8
1b30d0ff-47a0-11ed-aedd-7cd30abc95d8
1b30d0ff-47a0-11ed-aedd-7cd30abc95d8
1b30d0ff-47a0-11ed-aedd-7cd30abc95d8
1b30d0ff-47a0-11ed-aedd-7cd30abc95d8
1b30d0ff-47a0-11ed-aedd-7cd30abc95d8
1b30d0ff-47a0-11ed-aedd-7cd30abc95d8
1b30d0ff-47a0-11ed-aedd-7cd30abc95d8
1b30d0ff-47a0-11ed-aedd-7cd30abc95d8
1b30d0ff-47a0-11ed-aedd-7cd30abc95d8
1b30d0ff-47a0-11ed-aedd-7cd30abc95d8
1b30d0ff-47a0-11ed-aedd-7cd30abc95d8
1b30d0ff-47a0-11ed-aedd-7cd30abc95d8
1b30d0ff-47a0-11ed-aedd-7cd30abc95d8
1b30d0ff-47a0-11ed-aedd-7cd30abc95d8
1b30d0ff-47a0-11ed-aedd-7cd30abc95d8
1b30d0ff-47a0-11ed-aedd-7cd30abc95d8
1b30d0ff-47a0-11ed-aedd-7cd30abc95d8
1b30d0ff-47a0-11ed-aedd-7cd30abc95d8
1b30d0ff-47a0-11ed-aedd-7cd30abc95d8
1b30d0ff-47a0-11ed-aedd-7cd30abc95d8
1b30d0ff-47a0-11ed-aedd-7cd30abc95d8
1b30d0ff-47a0-11ed-aedd-7cd30abc95d8
1b30d0ff-47a0-11ed-aedd-7cd30abc95d8
1b30d0ff-47a0-11ed-aedd-7cd30abc95d8
1b30d0ff-47a0-11ed-aedd-7cd30abc95d8
1b30d0ff-47a0-11ed-aedd-7cd30abc95d8
1b30d0ff-47a0-11ed-aedd-7cd30abc95d8
1b30d0ff-47a0-11ed-aedd-7cd30abc95d8
1b30d0ff-47a0-11ed-aedd-7cd30abc95d8
1b30d0ff-47a0-11ed-aedd-7cd30abc95d8
1b30d0ff-47a0-11ed-aedd-7cd30abc95d8
1b30d0ff-47a0-11ed-aedd-7cd30abc95d8
1b30d0ff-47a0-11ed-aedd-7cd30abc95d8
1b30d0ff-47a0-11ed-aedd-7cd30abc95d8
1b30d0ff-47a0-11ed-aedd-7cd30abc95d8
1b30d0ff-47a0-11ed-aedd-7cd30abc95d8
1b30d0ff-47a0-11ed-aedd-7cd30abc95d8
1b30d0ff-47a0-11ed-aedd-7cd30abc95d8
1b30d0ff-47a0-11ed-aedd-7cd30abc95d8
1b30d0ff-47a0-11ed-aedd-7cd30abc95d8
1b30d0ff-47a0-11ed-aedd-7cd30abc95d8
1b30d0ff-47a0-11ed-aedd-7cd30abc95d8
1b30d0ff-47a0-11ed-aedd-7cd30abc95d8
1b30d0ff-47a0-11ed-aedd-7cd30abc95d8
1b30d0ff-47a0-11ed-aedd-7cd30abc95d8
1b30d0ff-47a0-11ed-aedd-7cd30abc95d8
1b30d0ff-47a0-11ed-aedd-7cd30abc95d8
1b30d0ff-47a0-11ed-aedd-7cd30abc95d8
1b30d0ff-47a0-11ed-aedd-7cd30abc95d8
1b30d0ff-47a0-11ed-aedd-7cd30abc95d8
1b30d0ff-47a0-11ed-aedd-7cd30abc95d8
1b30d0ff-47a0-11ed-aedd-7cd30abc95d8
1b30d0ff-47a0-11ed-aedd-7cd30abc95d8
1b30d0ff-47a0-11ed-aedd-7cd30abc95d8
1b30d0ff-47a0-11ed-aedd-7cd30abc95d8
1b30d0ff-47a0-11ed-aedd-7cd30abc95d8
1b30d0ff-47a0-11ed-aedd-7cd30abc95d8
1b30d0ff-47a0-11ed-aedd-7cd30abc95d8
1b30d0ff-47a0-11ed-aedd-7cd30abc95d8
1b30d0ff-47a0-11ed-aedd-7cd30abc95d8
1b30d0ff-47a0-11ed-aedd-7cd30abc95d8
1b30d0ff-47a0-11ed-aedd-7cd30abc95d8
1b30d0ff-47a0-11ed-aedd-7cd30abc95d8
1b30d0ff-47a0-11ed-aedd-7cd30abc95d8
1b30d0ff-47a0-11ed-aedd-7cd30abc95d8
1b30d0ff-47a0-11ed-aedd-7cd30abc95d8
1b30d0ff-47a0-11ed-aedd-7cd30abc95d8
1b30d0ff-47a0-11ed-aedd-7cd30abc95d8
1b30d0ff-47a0-11ed-aedd-7cd30abc95d8
1b30d0ff-47a0-11ed-aedd-7cd30abc95d8
1b30d0ff-47a0-11ed-aedd-7cd30abc95d8
1b30d0ff-47a0-11ed-aedd-7cd30abc95d8
1b30d0ff-47a0-11ed-aedd-7cd30abc95d8
1b30d0ff-47a0-11ed-aedd-7cd30abc95d8
1b30d0ff-47a0-11ed-aedd-7cd30abc95d8
1b30d0ff-47a0-11ed-aedd-7cd30abc95d8
1b30d0ff-47a0-11ed-aedd-7cd30abc95d8
1b30d0ff-47a0-11ed-aedd-7cd30abc95d8
1b30d0ff-47a0-11ed-aedd-7cd30abc95d8
1b30d0ff-47a0-11ed-aedd-7cd30abc95d8
1b30d0ff-47a0-11ed-aedd-7cd30abc95d8
1b30d0ff-47a0-11ed-aedd-7cd30abc95d8
1b30d0ff-47a0-11ed-aedd-7cd30abc95d8
1b30d0ff-47a0-11ed-aedd-7cd30abc95d8
1b30d0ff-47a0-11ed-aedd-7cd30abc95d8
1b30d0ff-47a0-11ed-aedd-7cd30abc95d8
1b30d0ff-47a0-11ed-aedd-7cd30abc95d8
1b30d0ff-47a0-11ed-aedd-7cd30abc95d8
1b30d0ff-47a0-11ed-aedd-7cd30abc95d8
1b30d0ff-47a0-11ed-aedd-7cd30abc95d8
1b30d0ff-47a0-11ed-aedd-7cd30abc95d8
1b30d0ff-47a0-11ed-aedd-7cd30abc95d8
1b30d0ff-47a0-11ed-aedd-7cd30abc95d8
1b30d0ff-47a0-11ed-aedd-7cd30abc95d8
1b30d0ff-47a0-11ed-aedd-7cd30abc95d8
1b30d0ff-47a0-11ed-aedd-7cd30abc95d8
1b30d0ff-47a0-11ed-aedd-7cd30abc95d8
1b30d0ff-47a0-11ed-aedd-7cd30abc95d8
1b30d0ff-47a0-11ed-aedd-7cd30abc95d8
1b30d0ff-47a0-11ed-aedd-7cd30abc95d8
1b30d0ff-47a0-11ed-aedd-7cd30abc95d8
1b30d0ff-47a0-11ed-aedd-7cd30abc95d8
1b30d0ff-47a0-11ed-aedd-7cd30abc95d8
1b30d0ff-47a0-11ed-aedd-7cd30abc95d8
1b30d0ff-47a0-11ed-aedd-7cd30abc95d8
1b30d0ff-47a0-11ed-aedd-7cd30abc95d8
1b30d0ff-47a0-11ed-aedd-7cd30abc95d8
1b30d0ff-47a0-11ed-aedd-7cd30abc95d8
1b30d0ff-47a0-11ed-aedd-7cd30abc95d8
1b30d0ff-47a0-11ed-aedd-7cd30abc95d8
1b30d0ff-47a0-11ed-aedd-7cd30abc95d8
1b30d0ff-47a0-11ed-aedd-7cd30abc95d8
1b30d0ff-47a0-11ed-aedd-7cd30abc95d8
1b30d0ff-47a0-11ed-aedd-7cd30abc95d8
1b30d0ff-47a0-11ed-aedd-7cd30abc95d8
1b30d0ff-47a0-11ed-aedd-7cd30abc95d8
1b30d0ff-47a0-11ed-aedd-7cd30abc95d8
1b30d0ff-47a0-11ed-aedd-7cd30abc95d8
1b30d0ff-47a0-11ed-aedd-7cd30abc95d8
1b30d0ff-47a0-11ed-aedd-7cd30abc95d8
1b30d0ff-47a0-11ed-aedd-7cd30abc95d8
1b30d0ff-47a0-11ed-aedd-7cd30abc95d8
1b30d0ff-47a0-11ed-aedd-7cd30abc95d8
1b30d0ff-47a0-11ed-aedd-7cd30abc95d8
1b30d0ff-47a0-11ed-aedd-7cd30abc95d8
1b30d0ff-47a0-11ed-aedd-7cd30abc95d8
1b30d0ff-47a0-11ed-aedd-7cd30abc95d8
1b30d0ff-47a0-11ed-aedd-7cd30abc95d8
1b30d0ff-47a0-11ed-aedd-7cd30abc95d8
1b30d0ff-47a0-11ed-aedd-7cd30abc95d8
1b30d0ff-47a0-11ed-aedd-7cd30abc95d8
1b30d0ff-47a0-11ed-aedd-7cd30abc95d8
1b30d0ff-47a0-11ed-aedd-7cd30abc95d8
1b30d0ff-47a0-11ed-aedd-7cd30abc95d8
1b30d0ff-47a0-11ed-aedd-7cd30abc95d8
1b30d0ff-47a0-11ed-aedd-7cd30abc95d8
1b30d0ff-47a0-11ed-aedd-7cd30abc95d8
1b30d0ff-47a0-11ed-aedd-7cd30abc95d8
1b30d0ff-47a0-11ed-aedd-7cd30abc95d8
1b30d0ff-47a0-11ed-aedd-7cd30abc95d8
1b30d0ff-47a0-11ed-aedd-7cd30abc95d8
1b30d0ff-47a0-11ed-aedd-7cd30abc95d8
1b30d0ff-47a0-11ed-aedd-7cd30abc95d8
1b30d0ff-47a0-11ed-aedd-7cd30abc95d8
1b30d0ff-47a0-11ed-aedd-7cd30abc95d8
1b30d0ff-47a0-11ed-aedd-7cd30abc95d8
1b30d0ff-47a0-11ed-aedd-7cd30abc95d8
1b30d0ff-47a0-11ed-aedd-7cd30abc95d8
1b30d0ff-47a0-11ed-aedd-7cd30abc95d8
1b30d0ff-47a0-11ed-aedd-7cd30abc95d8
1b30d0ff-47a0-11ed-aedd-7cd30abc95d8
1b30d0ff-47a0-11ed-aedd-7cd30abc95d8
1b30d0ff-47a0-11ed-aedd-7cd30abc95d8
1b30d0ff-47a0-11ed-aedd-7cd30abc95d8
1b30d0ff-47a0-11ed-aedd-7cd30abc95d8
1b30d0ff-47a0-11ed-aedd-7cd30abc95d8
1b30d0ff-47a0-11ed-aedd-7cd30abc95d8
1b30d0ff-47a0-11ed-aedd-7cd30abc95d8
1b30d0ff-47a0-11ed-aedd-7cd30abc95d8
1b30d0ff-47a0-11ed-aedd-7cd30abc95d8
1b30d0ff-47a0-11ed-aedd-7cd30abc95d8
1b30d0ff-47a0-11ed-aedd-7cd30abc95d8
1b30d0ff-47a0-11ed-aedd-7cd30abc95d8
1b30d0ff-47a0-11ed-aedd-7cd30abc95d8
1b30d0ff-47a0-11ed-aedd-7cd30abc95d8
1b30d0ff-47a0-11ed-aedd-7cd30abc95d8
1b30d0ff-47a0-11ed-aedd-7cd30abc95d8
1b30d0ff-47a0-11ed-aedd-7cd30abc95d8
1b30d0ff-47a0-11ed-aedd-7cd30abc95d8
1b30d0ff-47a0-11ed-aedd-7cd30abc95d8
1b30d0ff-47a0-11ed-aedd-7cd30abc95d8
1b30d0ff-47a0-11ed-aedd-7cd30abc95d8
1b30d0ff-47a0-11ed-aedd-7cd30abc95d8
1b30d0ff-47a0-11ed-aedd-7cd30abc95d8
1b30d0ff-47a0-11ed-aedd-7cd30abc95d8
1b30d0ff-47a0-11ed-aedd-7cd30abc95d8
1b30d0ff-47a0-11ed-aedd-7cd30abc95d8
1b30d0ff-47a0-11ed-aedd-7cd30abc95d8
1b30d0ff-47a0-11ed-aedd-7cd30abc95d8
1b30d0ff-47a0-11ed-aedd-7cd30abc95d8
1b30d0ff-47a0-11ed-aedd-7cd30abc95d8
1b30d0ff-47a0-11ed-aedd-7cd30abc95d8
1b30d0ff-47a0-11ed-aedd-7cd30abc95d8
1b30d0ff-47a0-11ed-aedd-7cd30abc95d8
1b30d0ff-47a0-11ed-aedd-7cd30abc95d8
1b30d0ff-47a0-11ed-aedd-7cd30abc95d8
1b30d0ff-47a0-11ed-aedd-7cd30abc95d8
1b30d0ff-47a0-11ed-aedd-7cd30abc95d8
1b30d0ff-47a0-11ed-aedd-7cd30abc95d8
1b30d0ff-47a0-11ed-aedd-7cd30abc95d8
1b30d0ff-47a0-11ed-aedd-7cd30abc95d8
1b30d0ff-47a0-11ed-aedd-7cd30abc95d8
1b30d0ff-47a0-11ed-aedd-7cd30abc95d8
1b30d0ff-47a0-11ed-aedd-7cd30abc95d8
1b30d0ff-47a0-11ed-aedd-7cd30abc95d8
1b30d0ff-47a0-11ed-aedd-7cd30abc95d8
1b30d0ff-47a0-11ed-aedd-7cd30abc95d8
1b30d0ff-47a0-11ed-aedd-7cd30abc95d8
1b30d0ff-47a0-11ed-aedd-7cd30abc95d8
1b30d0ff-47a0-11ed-aedd-7cd30abc95d8
1b30d0ff-47a0-11ed-aedd-7cd30abc95d8
1b30d0ff-47a0-11ed-aedd-7cd30abc95d8
1b30d0ff-47a0-11ed-aedd-7cd30abc95d8
1b30d0ff-47a0-11ed-aedd-7cd30abc95d8
1b30d0ff-47a0-11ed-aedd-7cd30abc95d8
1b30d0ff-47a0-11ed-aedd-7cd30abc95d8
1b30d0ff-47a0-11ed-aedd-7cd30abc95d8
1b30d0ff-47a0-11ed-aedd-7cd30abc95d8
1b30d0ff-47a0-11ed-aedd-7cd30abc95d8
1b30d0ff-47a0-11ed-aedd-7cd30abc95d8
1b30d0ff-47a0-11ed-aedd-7cd30abc95d8
1b30d0ff-47a0-11ed-aedd-7cd30abc95d8
1b30d0ff-47a0-11ed-aedd-7cd30abc95d8
1b30d0ff-47a0-11ed-aedd-7cd30abc95d8
1b30d0ff-47a0-11ed-aedd-7cd30abc95d8
1b30d0ff-47a0-11ed-aedd-7cd30abc95d8
1b30d0ff-47a0-11ed-aedd-7cd30abc95d8
1b30d0ff-47a0-11ed-aedd-7cd30abc95d8
1b30d0ff-47a0-11ed-aedd-7cd30abc95d8
1b30d0ff-47a0-11ed-aedd-7cd30abc95d8
1b30d0ff-47a0-11ed-aedd-7cd30abc95d8
1b30d0ff-47a0-11ed-aedd-7cd30abc95d8
1b30d0ff-47a0-11ed-aedd-7cd30abc95d8
1b30d0ff-47a0-11ed-aedd-7cd30abc95d8
1b30d0ff-47a0-11ed-aedd-7cd30abc95d8
1b30d0ff-47a0-11ed-aedd-7cd30abc95d8
1b30d0ff-47a0-11ed-aedd-7cd30abc95d8
1b30d0ff-47a0-11ed-aedd-7cd30abc95d8
1b30d0ff-47a0-11ed-aedd-7cd30abc95d8
1b30d0ff-47a0-11ed-aedd-7cd30abc95d8
1b30d0ff-47a0-11ed-aedd-7cd30abc95d8
1b30d0ff-47a0-11ed-aedd-7cd30abc95d8
1b30d0ff-47a0-11ed-aedd-7cd30abc95d8
1b30d0ff-47a0-11ed-aedd-7cd30abc95d8
1b30d0ff-47a0-11ed-aedd-7cd30abc95d8
1b30d0ff-47a0-11ed-aedd-7cd30abc95d8
1b30d0ff-47a0-11ed-aedd-7cd30abc95d8
1b30d0ff-47a0-11ed-aedd-7cd30abc95d8
1b30d0ff-47a0-11ed-aedd-7cd30abc95d8
1b30d0ff-47a0-11ed-aedd-7cd30abc95d8
1b30d0ff-47a0-11ed-aedd-7cd30abc95d8
1b30d0ff-47a0-11ed-aedd-7cd30abc95d8
1b30d0ff-47a0-11ed-aedd-7cd30abc95d8
1b30d0ff-47a0-11ed-aedd-7cd30abc95d8
1b30d0ff-47a0-11ed-aedd-7cd30abc95d8
1b30d0ff-47a0-11ed-aedd-7cd30abc95d8
1b30d0ff-47a0-11ed-aedd-7cd30abc95d8
1b30d0ff-47a0-11ed-aedd-7cd30abc95d8
1b30d0ff-47a0-11ed-aedd-7cd30abc95d8
1b30d0ff-47a0-11ed-aedd-7cd30abc95d8
1b30d0ff-47a0-11ed-aedd-7cd30abc95d8
1b30d0ff-47a0-11ed-aedd-7cd30abc95d8
1b30d0ff-47a0-11ed-aedd-7cd30abc95d8
1b30d0ff-47a0-11ed-aedd-7cd30abc95d8
1b30d0ff-47a0-11ed-aedd-7cd30abc95d8
1b30d0ff-47a0-11ed-aedd-7cd30abc95d8
1b30d0ff-47a0-11ed-aedd-7cd30abc95d8
1b30d0ff-47a0-11ed-aedd-7cd30abc95d8
1b30d0ff-47a0-11ed-aedd-7cd30abc95d8
1b30d0ff-47a0-11ed-aedd-7cd30abc95d8
1b30d0ff-47a0-11ed-aedd-7cd30abc95d8
1b30d0ff-47a0-11ed-aedd-7cd30abc95d8
1b30d0ff-47a0-11ed-aedd-7cd30abc95d8
1b30d0ff-47a0-11ed-aedd-7cd30abc95d8
1b30d0ff-47a0-11ed-aedd-7cd30abc95d8
1b30d0ff-47a0-11ed-aedd-7cd30abc95d8
1b30d0ff-47a0-11ed-aedd-7cd30abc95d8
1b30d0ff-47a0-11ed-aedd-7cd30abc95d8
1b30d0ff-47a0-11ed-aedd-7cd30abc95d8
1b30d0ff-47a0-11ed-aedd-7cd30abc95d8
1b30d0ff-47a0-11ed-aedd-7cd30abc95d8
1b30d0ff-47a0-11ed-aedd-7cd30abc95d8
1b30d0ff-47a0-11ed-aedd-7cd30abc95d8
1b30d0ff-47a0-11ed-aedd-7cd30abc95d8
1b30d0ff-47a0-11ed-aedd-7cd30abc95d8
1b30d0ff-47a0-11ed-aedd-7cd30abc95d8
1b30d0ff-47a0-11ed-aedd-7cd30abc95d8
1b30d0ff-47a0-11ed-aedd-7cd30abc95d8
1b30d0ff-47a0-11ed-aedd-7cd30abc95d8
1b30d0ff-47a0-11ed-aedd-7cd30abc95d8
1b30d0ff-47a0-11ed-aedd-7cd30abc95d8
1b30d0ff-47a0-11ed-aedd-7cd30abc95d8
1b30d0ff-47a0-11ed-aedd-7cd30abc95d8
1b30d0ff-47a0-11ed-aedd-7cd30abc95d8
1b30d0ff-47a0-11ed-aedd-7cd30abc95d8
1b30d0ff-47a0-11ed-aedd-7cd30abc95d8
1b30d0ff-47a0-11ed-aedd-7cd30abc95d8
1b30d0ff-47a0-11ed-aedd-7cd30abc95d8
1b30d0ff-47a0-11ed-aedd-7cd30abc95d8
1b30d0ff-47a0-11ed-aedd-7cd30abc95d8
1b30d0ff-47a0-11ed-aedd-7cd30abc95d8
1b30d0ff-47a0-11ed-aedd-7cd30abc95d8
1b30d0ff-47a0-11ed-aedd-7cd30abc95d8
1b30d0ff-47a0-11ed-aedd-7cd30abc95d8
1b30d0ff-47a0-11ed-aedd-7cd30abc95d8
1b30d0ff-47a0-11ed-aedd-7cd30abc95d8
1b30d0ff-47a0-11ed-aedd-7cd30abc95d8
1b30d0ff-47a0-11ed-aedd-7cd30abc95d8
1b30d0ff-47a0-11ed-aedd-7cd30abc95d8
1b30d0ff-47a0-11ed-aedd-7cd30abc95d8
1b30d0ff-47a0-11ed-aedd-7cd30abc95d8
1b30d0ff-47a0-11ed-aedd-7cd30abc95d8
1b30d0ff-47a0-11ed-aedd-7cd30abc95d8
1b30d0ff-47a0-11ed-aedd-7cd30abc95d8
1b30d0ff-47a0-11ed-aedd-7cd30abc95d8
1b30d0ff-47a0-11ed-aedd-7cd30abc95d8
1b30d0ff-47a0-11ed-aedd-7cd30abc95d8
1b30d0ff-47a0-11ed-aedd-7cd30abc95d8
1b30d0ff-47a0-11ed-aedd-7cd30abc95d8
1b30d0ff-47a0-11ed-aedd-7cd30abc95d8
1b30d0ff-47a0-11ed-aedd-7cd30abc95d8
1b30d0ff-47a0-11ed-aedd-7cd30abc95d8
1b30d0ff-47a0-11ed-aedd-7cd30abc95d8
1b30d0ff-47a0-11ed-aedd-7cd30abc95d8
1b30d0ff-47a0-11ed-aedd-7cd30abc95d8
1b30d0ff-47a0-11ed-aedd-7cd30abc95d8
1b30d0ff-47a0-11ed-aedd-7cd30abc95d8
1b30d0ff-47a0-11ed-aedd-7cd30abc95d8
1b30d0ff-47a0-11ed-aedd-7cd30abc95d8
1b30d0ff-47a0-11ed-aedd-7cd30abc95d8
1b30d0ff-47a0-11ed-aedd-7cd30abc95d8
1b30d0ff-47a0-11ed-aedd-7cd30abc95d8
1b30d0ff-47a0-11ed-aedd-7cd30abc95d8
1b30d0ff-47a0-11ed-aedd-7cd30abc95d8
1b30d0ff-47a0-11ed-aedd-7cd30abc95d8
1b30d0ff-47a0-11ed-aedd-7cd30abc95d8
1b30d0ff-47a0-11ed-aedd-7cd30abc95d8
1b30d0ff-47a0-11ed-aedd-7cd30abc95d8
1b30d0ff-47a0-11ed-aedd-7cd30abc95d8
1b30d0ff-47a0-11ed-aedd-7cd30abc95d8
1b30d0ff-47a0-11ed-aedd-7cd30abc95d8
1b30d0ff-47a0-11ed-aedd-7cd30abc95d8
1b30d0ff-47a0-11ed-aedd-7cd30abc95d8
1b30d0ff-47a0-11ed-aedd-7cd30abc95d8
1b30d0ff-47a0-11ed-aedd-7cd30abc95d8
1b30d0ff-47a0-11ed-aedd-7cd30abc95d8
1b30d0ff-47a0-11ed-aedd-7cd30abc95d8
1b30d0ff-47a0-11ed-aedd-7cd30abc95d8
1b30d0ff-47a0-11ed-aedd-7cd30abc95d8
1b30d0ff-47a0-11ed-aedd-7cd30abc95d8
1b30d0ff-47a0-11ed-aedd-7cd30abc95d8
1b30d0ff-47a0-11ed-aedd-7cd30abc95d8
1b30d0ff-47a0-11ed-aedd-7cd30abc95d8
1b30d0ff-47a0-11ed-aedd-7cd30abc95d8
1b30d0ff-47a0-11ed-aedd-7cd30abc95d8
1b30d0ff-47a0-11ed-aedd-7cd30abc95d8
1b30d0ff-47a0-11ed-aedd-7cd30abc95d8
1b30d0ff-47a0-11ed-aedd-7cd30abc95d8
1b30d0ff-47a0-11ed-aedd-7cd30abc95d8
1b30d0ff-47a0-11ed-aedd-7cd30abc95d8
1b30d0ff-47a0-11ed-aedd-7cd30abc95d8
1b30d0ff-47a0-11ed-aedd-7cd30abc95d8
1b30d0ff-47a0-11ed-aedd-7cd30abc95d8
1b30d0ff-47a0-11ed-aedd-7cd30abc95d8
1b30d0ff-47a0-11ed-aedd-7cd30abc95d8
1b30d0ff-47a0-11ed-aedd-7cd30abc95d8
1b30d0ff-47a0-11ed-aedd-7cd30abc95d8
1b30d0ff-47a0-11ed-aedd-7cd30abc95d8
1b30d0ff-47a0-11ed-aedd-7cd30abc95d8
1b30d0ff-47a0-11ed-aedd-7cd30abc95d8
1b30d0ff-47a0-11ed-aedd-7cd30abc95d8
1b30d0ff-47a0-11ed-aedd-7cd30abc95d8
1b30d0ff-47a0-11ed-aedd-7cd30abc95d8
1b30d0ff-47a0-11ed-aedd-7cd30abc95d8
1b30d0ff-47a0-11ed-aedd-7cd30abc95d8
1b30d0ff-47a0-11ed-aedd-7cd30abc95d8
1b30d0ff-47a0-11ed-aedd-7cd30abc95d8
1b30d0ff-47a0-11ed-aedd-7cd30abc95d8
1b30d0ff-47a0-11ed-aedd-7cd30abc95d8
1b30d0ff-47a0-11ed-aedd-7cd30abc95d8
1b30d0ff-47a0-11ed-aedd-7cd30abc95d8
1b30d0ff-47a0-11ed-aedd-7cd30abc95d8
1b30d0ff-47a0-11ed-aedd-7cd30abc95d8
1b30d0ff-47a0-11ed-aedd-7cd30abc95d8
1b30d0ff-47a0-11ed-aedd-7cd30abc95d8
1b30d0ff-47a0-11ed-aedd-7cd30abc95d8
1b30d0ff-47a0-11ed-aedd-7cd30abc95d8
1b30d0ff-47a0-11ed-aedd-7cd30abc95d8
1b30d0ff-47a0-11ed-aedd-7cd30abc95d8
1b30d0ff-47a0-11ed-aedd-7cd30abc95d8
1b30d0ff-47a0-11ed-aedd-7cd30abc95d8
1b30d0ff-47a0-11ed-aedd-7cd30abc95d8
1b30d0ff-47a0-11ed-aedd-7cd30abc95d8
1b30d0ff-47a0-11ed-aedd-7cd30abc95d8
1b30d0ff-47a0-11ed-aedd-7cd30abc95d8
1b30d0ff-47a0-11ed-aedd-7cd30abc95d8
1b30d0ff-47a0-11ed-aedd-7cd30abc95d8
1b30d0ff-47a0-11ed-aedd-7cd30abc95d8
1b30d0ff-47a0-11ed-aedd-7cd30abc95d8
1b30d0ff-47a0-11ed-aedd-7cd30abc95d8
1b30d0ff-47a0-11ed-aedd-7cd30abc95d8
1b30d0ff-47a0-11ed-aedd-7cd30abc95d8
1b30d0ff-47a0-11ed-aedd-7cd30abc95d8
1b30d0ff-47a0-11ed-aedd-7cd30abc95d8
1b30d0ff-47a0-11ed-aedd-7cd30abc95d8
1b30d0ff-47a0-11ed-aedd-7cd30abc95d8
1b30d0ff-47a0-11ed-aedd-7cd30abc95d8
1b30d0ff-47a0-11ed-aedd-7cd30abc95d8
1b30d0ff-47a0-11ed-aedd-7cd30abc95d8
1b30d0ff-47a0-11ed-aedd-7cd30abc95d8
1b30d0ff-47a0-11ed-aedd-7cd30abc95d8
1b30d0ff-47a0-11ed-aedd-7cd30abc95d8
1b30d0ff-47a0-11ed-aedd-7cd30abc95d8
1b30d0ff-47a0-11ed-aedd-7cd30abc95d8
1b30d0ff-47a0-11ed-aedd-7cd30abc95d8
1b30d0ff-47a0-11ed-aedd-7cd30abc95d8
1b30d0ff-47a0-11ed-aedd-7cd30abc95d8
1b30d0ff-47a0-11ed-aedd-7cd30abc95d8
1b30d0ff-47a0-11ed-aedd-7cd30abc95d8
1b30d0ff-47a0-11ed-aedd-7cd30abc95d8
1b30d0ff-47a0-11ed-aedd-7cd30abc95d8
1b30d0ff-47a0-11ed-aedd-7cd30abc95d8
1b30d0ff-47a0-11ed-aedd-7cd30abc95d8
1b30d0ff-47a0-11ed-aedd-7cd30abc95d8
1b30d0ff-47a0-11ed-aedd-7cd30abc95d8
1b30d0ff-47a0-11ed-aedd-7cd30abc95d8
1b30d0ff-47a0-11ed-aedd-7cd30abc95d8
1b30d0ff-47a0-11ed-aedd-7cd30abc95d8
1b30d0ff-47a0-11ed-aedd-7cd30abc95d8
1b30d0ff-47a0-11ed-aedd-7cd30abc95d8
1b30d0ff-47a0-11ed-aedd-7cd30abc95d8
1b30d0ff-47a0-11ed-aedd-7cd30abc95d8
1b30d0ff-47a0-11ed-aedd-7cd30abc95d8
1b30d0ff-47a0-11ed-aedd-7cd30abc95d8
1b30d0ff-47a0-11ed-aedd-7cd30abc95d8
1b30d0ff-47a0-11ed-aedd-7cd30abc95d8
1b30d0ff-47a0-11ed-aedd-7cd30abc95d8
1b30d0ff-47a0-11ed-aedd-7cd30abc95d8
1b30d0ff-47a0-11ed-aedd-7cd30abc95d8
1b30d0ff-47a0-11ed-aedd-7cd30abc95d8
1b30d0ff-47a0-11ed-aedd-7cd30abc95d8
1b30d0ff-47a0-11ed-aedd-7cd30abc95d8
1b30d0ff-47a0-11ed-aedd-7cd30abc95d8
1b30d0ff-47a0-11ed-aedd-7cd30abc95d8
1b30d0ff-47a0-11ed-aedd-7cd30abc95d8
1b30d0ff-47a0-11ed-aedd-7cd30abc95d8
1b30d0ff-47a0-11ed-aedd-7cd30abc95d8
1b30d0ff-47a0-11ed-aedd-7cd30abc95d8
1b30d0ff-47a0-11ed-aedd-7cd30abc95d8
1b30d0ff-47a0-11ed-aedd-7cd30abc95d8
1b30d0ff-47a0-11ed-aedd-7cd30abc95d8
1b30d0ff-47a0-11ed-aedd-7cd30abc95d8
1b30d0ff-47a0-11ed-aedd-7cd30abc95d8
1b30d0ff-47a0-11ed-aedd-7cd30abc95d8
1b30d0ff-47a0-11ed-aedd-7cd30abc95d8
1b30d0ff-47a0-11ed-aedd-7cd30abc95d8
1b30d0ff-47a0-11ed-aedd-7cd30abc95d8
1b30d0ff-47a0-11ed-aedd-7cd30abc95d8
1b30d0ff-47a0-11ed-aedd-7cd30abc95d8
1b30d0ff-47a0-11ed-aedd-7cd30abc95d8
1b30d0ff-47a0-11ed-aedd-7cd30abc95d8
1b30d0ff-47a0-11ed-aedd-7cd30abc95d8
1b30d0ff-47a0-11ed-aedd-7cd30abc95d8
1b30d0ff-47a0-11ed-aedd-7cd30abc95d8
1b30d0ff-47a0-11ed-aedd-7cd30abc95d8
1b30d0ff-47a0-11ed-aedd-7cd30abc95d8
1b30d0ff-47a0-11ed-aedd-7cd30abc95d8
1b30d0ff-47a0-11ed-aedd-7cd30abc95d8
1b30d0ff-47a0-11ed-aedd-7cd30abc95d8
1b30d0ff-47a0-11ed-aedd-7cd30abc95d8
1b30d0ff-47a0-11ed-aedd-7cd30abc95d8
1b30d0ff-47a0-11ed-aedd-7cd30abc95d8
1b30d0ff-47a0-11ed-aedd-7cd30abc95d8
1b30d0ff-47a0-11ed-aedd-7cd30abc95d8
1b30d0ff-47a0-11ed-aedd-7cd30abc95d8
1b30d0ff-47a0-11ed-aedd-7cd30abc95d8
1b30d0ff-47a0-11ed-aedd-7cd30abc95d8
1b30d0ff-47a0-11ed-aedd-7cd30abc95d8
1b30d0ff-47a0-11ed-aedd-7cd30abc95d8
1b30d0ff-47a0-11ed-aedd-7cd30abc95d8
1b30d0ff-47a0-11ed-aedd-7cd30abc95d8
1b30d0ff-47a0-11ed-aedd-7cd30abc95d8
1b30d0ff-47a0-11ed-aedd-7cd30abc95d8
1b30d0ff-47a0-11ed-aedd-7cd30abc95d8
1b30d0ff-47a0-11ed-aedd-7cd30abc95d8
1b30d0ff-47a0-11ed-aedd-7cd30abc95d8
1b30d0ff-47a0-11ed-aedd-7cd30abc95d8
1b30d0ff-47a0-11ed-aedd-7cd30abc95d8
1b30d0ff-47a0-11ed-aedd-7cd30abc95d8
1b30d0ff-47a0-11ed-aedd-7cd30abc95d8
1b30d0ff-47a0-11ed-aedd-7cd30abc95d8
1b30d0ff-47a0-11ed-aedd-7cd30abc95d8
1b30d0ff-47a0-11ed-aedd-7cd30abc95d8
1b30d0ff-47a0-11ed-aedd-7cd30abc95d8
1b30d0ff-47a0-11ed-aedd-7cd30abc95d8
1b30d0ff-47a0-11ed-aedd-7cd30abc95d8
1b30d0ff-47a0-11ed-aedd-7cd30abc95d8
1b30d0ff-47a0-11ed-aedd-7cd30abc95d8
1b30d0ff-47a0-11ed-aedd-7cd30abc95d8
1b30d0ff-47a0-11ed-aedd-7cd30abc95d8
1b30d0ff-47a0-11ed-aedd-7cd30abc95d8
1b30d0ff-47a0-11ed-aedd-7cd30abc95d8
1b30d0ff-47a0-11ed-aedd-7cd30abc95d8
1b30d0ff-47a0-11ed-aedd-7cd30abc95d8
1b30d0ff-47a0-11ed-aedd-7cd30abc95d8
1b30d0ff-47a0-11ed-aedd-7cd30abc95d8
1b30d0ff-47a0-11ed-aedd-7cd30abc95d8
1b30d0ff-47a0-11ed-aedd-7cd30abc95d8
1b30d0ff-47a0-11ed-aedd-7cd30abc95d8
1b30d0ff-47a0-11ed-aedd-7cd30abc95d8
1b30d0ff-47a0-11ed-aedd-7cd30abc95d8
1b30d0ff-47a0-11ed-aedd-7cd30abc95d8
1b30d0ff-47a0-11ed-aedd-7cd30abc95d8
1b30d0ff-47a0-11ed-aedd-7cd30abc95d8
1b30d0ff-47a0-11ed-aedd-7cd30abc95d8
1b30d0ff-47a0-11ed-aedd-7cd30abc95d8
1b30d0ff-47a0-11ed-aedd-7cd30abc95d8
1b30d0ff-47a0-11ed-aedd-7cd30abc95d8
1b30d0ff-47a0-11ed-aedd-7cd30abc95d8
1b30d0ff-47a0-11ed-aedd-7cd30abc95d8
1b30d0ff-47a0-11ed-aedd-7cd30abc95d8
1b30d0ff-47a0-11ed-aedd-7cd30abc95d8
1b30d0ff-47a0-11ed-aedd-7cd30abc95d8
1b30d0ff-47a0-11ed-aedd-7cd30abc95d8
1b30d0ff-47a0-11ed-aedd-7cd30abc95d8
1b30d0ff-47a0-11ed-aedd-7cd30abc95d8
1b30d0ff-47a0-11ed-aedd-7cd30abc95d8
1b30d0ff-47a0-11ed-aedd-7cd30abc95d8
1b30d0ff-47a0-11ed-aedd-7cd30abc95d8
1b30d0ff-47a0-11ed-aedd-7cd30abc95d8
1b30d0ff-47a0-11ed-aedd-7cd30abc95d8
1b30d0ff-47a0-11ed-aedd-7cd30abc95d8
1b30d0ff-47a0-11ed-aedd-7cd30abc95d8
1b30d0ff-47a0-11ed-aedd-7cd30abc95d8
1b30d0ff-47a0-11ed-aedd-7cd30abc95d8
1b30d0ff-47a0-11ed-aedd-7cd30abc95d8
1b30d0ff-47a0-11ed-aedd-7cd30abc95d8
1b30d0ff-47a0-11ed-aedd-7cd30abc95d8
1b30d0ff-47a0-11ed-aedd-7cd30abc95d8
1b30d0ff-47a0-11ed-aedd-7cd30abc95d8
1b30d0ff-47a0-11ed-aedd-7cd30abc95d8
1b30d0ff-47a0-11ed-aedd-7cd30abc95d8
1b30d0ff-47a0-11ed-aedd-7cd30abc95d8
1b30d0ff-47a0-11ed-aedd-7cd30abc95d8
1b30d0ff-47a0-11ed-aedd-7cd30abc95d8
1b30d0ff-47a0-11ed-aedd-7cd30abc95d8
1b30d0ff-47a0-11ed-aedd-7cd30abc95d8
1b30d0ff-47a0-11ed-aedd-7cd30abc95d8
1b30d0ff-47a0-11ed-aedd-7cd30abc95d8
1b30d0ff-47a0-11ed-aedd-7cd30abc95d8
1b30d0ff-47a0-11ed-aedd-7cd30abc95d8
1b30d0ff-47a0-11ed-aedd-7cd30abc95d8
1b30d0ff-47a0-11ed-aedd-7cd30abc95d8
1b30d0ff-47a0-11ed-aedd-7cd30abc95d8
1b30d0ff-47a0-11ed-aedd-7cd30abc95d8
1b30d0ff-47a0-11ed-aedd-7cd30abc95d8
1b30d0ff-47a0-11ed-aedd-7cd30abc95d8
1b30d0ff-47a0-11ed-aedd-7cd30abc95d8
1b30d0ff-47a0-11ed-aedd-7cd30abc95d8
1b30d0ff-47a0-11ed-aedd-7cd30abc95d8
1b30d0ff-47a0-11ed-aedd-7cd30abc95d8
1b30d0ff-47a0-11ed-aedd-7cd30abc95d8
1b30d0ff-47a0-11ed-aedd-7cd30abc95d8
1b30d0ff-47a0-11ed-aedd-7cd30abc95d8
1b30d0ff-47a0-11ed-aedd-7cd30abc95d8
1b30d0ff-47a0-11ed-aedd-7cd30abc95d8
1b30d0ff-47a0-11ed-aedd-7cd30abc95d8
1b30d0ff-47a0-11ed-aedd-7cd30abc95d8
1b30d0ff-47a0-11ed-aedd-7cd30abc95d8
1b30d0ff-47a0-11ed-aedd-7cd30abc95d8
1b30d0ff-47a0-11ed-aedd-7cd30abc95d8
1b30d0ff-47a0-11ed-aedd-7cd30abc95d8
1b30d0ff-47a0-11ed-aedd-7cd30abc95d8
1b30d0ff-47a0-11ed-aedd-7cd30abc95d8
1b30d0ff-47a0-11ed-aedd-7cd30abc95d8
1b30d0ff-47a0-11ed-aedd-7cd30abc95d8
1b30d0ff-47a0-11ed-aedd-7cd30abc95d8
1b30d0ff-47a0-11ed-aedd-7cd30abc95d8
1b30d0ff-47a0-11ed-aedd-7cd30abc95d8
1b30d0ff-47a0-11ed-aedd-7cd30abc95d8
1b30d0ff-47a0-11ed-aedd-7cd30abc95d8
1b30d0ff-47a0-11ed-aedd-7cd30abc95d8
1b30d0ff-47a0-11ed-aedd-7cd30abc95d8
1b30d0ff-47a0-11ed-aedd-7cd30abc95d8
1b30d0ff-47a0-11ed-aedd-7cd30abc95d8
1b30d0ff-47a0-11ed-aedd-7cd30abc95d8
1b30d0ff-47a0-11ed-aedd-7cd30abc95d8
1b30d0ff-47a0-11ed-aedd-7cd30abc95d8
1b30d0ff-47a0-11ed-aedd-7cd30abc95d8
1b30d0ff-47a0-11ed-aedd-7cd30abc95d8
1b30d0ff-47a0-11ed-aedd-7cd30abc95d8
1b30d0ff-47a0-11ed-aedd-7cd30abc95d8
1b30d0ff-47a0-11ed-aedd-7cd30abc95d8
1b30d0ff-47a0-11ed-aedd-7cd30abc95d8
1b30d0ff-47a0-11ed-aedd-7cd30abc95d8
1b30d0ff-47a0-11ed-aedd-7cd30abc95d8
1b30d0ff-47a0-11ed-aedd-7cd30abc95d8
1b30d0ff-47a0-11ed-aedd-7cd30abc95d8
1b30d0ff-47a0-11ed-aedd-7cd30abc95d8
1b30d0ff-47a0-11ed-aedd-7cd30abc95d8
1b30d0ff-47a0-11ed-aedd-7cd30abc95d8
1b30d0ff-47a0-11ed-aedd-7cd30abc95d8
1b30d0ff-47a0-11ed-aedd-7cd30abc95d8
1b30d0ff-47a0-11ed-aedd-7cd30abc95d8
1b30d0ff-47a0-11ed-aedd-7cd30abc95d8
1b30d0ff-47a0-11ed-aedd-7cd30abc95d8
1b30d0ff-47a0-11ed-aedd-7cd30abc95d8
1b30d0ff-47a0-11ed-aedd-7cd30abc95d8
1b30d0ff-47a0-11ed-aedd-7cd30abc95d8
1b30d0ff-47a0-11ed-aedd-7cd30abc95d8
1b30d0ff-47a0-11ed-aedd-7cd30abc95d8
1b30d0ff-47a0-11ed-aedd-7cd30abc95d8
1b30d0ff-47a0-11ed-aedd-7cd30abc95d8
1b30d0ff-47a0-11ed-aedd-7cd30abc95d8
1b30d0ff-47a0-11ed-aedd-7cd30abc95d8
1b30d0ff-47a0-11ed-aedd-7cd30abc95d8
1b30d0ff-47a0-11ed-aedd-7cd30abc95d8
1b30d0ff-47a0-11ed-aedd-7cd30abc95d8
1b30d0ff-47a0-11ed-aedd-7cd30abc95d8
1b30d0ff-47a0-11ed-aedd-7cd30abc95d8
1b30d0ff-47a0-11ed-aedd-7cd30abc95d8
1b30d0ff-47a0-11ed-aedd-7cd30abc95d8
1b30d0ff-47a0-11ed-aedd-7cd30abc95d8
1b30d0ff-47a0-11ed-aedd-7cd30abc95d8
1b30d0ff-47a0-11ed-aedd-7cd30abc95d8
1b30d0ff-47a0-11ed-aedd-7cd30abc95d8
1b30d0ff-47a0-11ed-aedd-7cd30abc95d8
1b30d0ff-47a0-11ed-aedd-7cd30abc95d8
1b30d0ff-47a0-11ed-aedd-7cd30abc95d8
1b30d0ff-47a0-11ed-aedd-7cd30abc95d8
1b30d0ff-47a0-11ed-aedd-7cd30abc95d8
1b30d0ff-47a0-11ed-aedd-7cd30abc95d8
1b30d0ff-47a0-11ed-aedd-7cd30abc95d8
1b30d0ff-47a0-11ed-aedd-7cd30abc95d8
1b30d0ff-47a0-11ed-aedd-7cd30abc95d8
1b30d0ff-47a0-11ed-aedd-7cd30abc95d8
1b30d0ff-47a0-11ed-aedd-7cd30abc95d8
1b30d0ff-47a0-11ed-aedd-7cd30abc95d8
1b30d0ff-47a0-11ed-aedd-7cd30abc95d8
1b30d0ff-47a0-11ed-aedd-7cd30abc95d8
1b30d0ff-47a0-11ed-aedd-7cd30abc95d8
1b30d0ff-47a0-11ed-aedd-7cd30abc95d8
1b30d0ff-47a0-11ed-aedd-7cd30abc95d8
1b30d0ff-47a0-11ed-aedd-7cd30abc95d8
1b30d0ff-47a0-11ed-aedd-7cd30abc95d8
1b30d0ff-47a0-11ed-aedd-7cd30abc95d8
1b30d0ff-47a0-11ed-aedd-7cd30abc95d8
1b30d0ff-47a0-11ed-aedd-7cd30abc95d8
1b30d0ff-47a0-11ed-aedd-7cd30abc95d8
1b30d0ff-47a0-11ed-aedd-7cd30abc95d8
1b30d0ff-47a0-11ed-aedd-7cd30abc95d8
1b30d0ff-47a0-11ed-aedd-7cd30abc95d8
1b30d0ff-47a0-11ed-aedd-7cd30abc95d8
1b30d0ff-47a0-11ed-aedd-7cd30abc95d8
1b30d0ff-47a0-11ed-aedd-7cd30abc95d8
1b30d0ff-47a0-11ed-aedd-7cd30abc95d8
1b30d0ff-47a0-11ed-aedd-7cd30abc95d8
1b30d0ff-47a0-11ed-aedd-7cd30abc95d8
1b30d0ff-47a0-11ed-aedd-7cd30abc95d8
1b30d0ff-47a0-11ed-aedd-7cd30abc95d8
1b30d0ff-47a0-11ed-aedd-7cd30abc95d8
1b30d0ff-47a0-11ed-aedd-7cd30abc95d8
1b30d0ff-47a0-11ed-aedd-7cd30abc95d8
1b30d0ff-47a0-11ed-aedd-7cd30abc95d8
1b30d0ff-47a0-11ed-aedd-7cd30abc95d8
1b30d0ff-47a0-11ed-aedd-7cd30abc95d8
1b30d0ff-47a0-11ed-aedd-7cd30abc95d8
1b30d0ff-47a0-11ed-aedd-7cd30abc95d8
1b30d0ff-47a0-11ed-aedd-7cd30abc95d8
1b30d0ff-47a0-11ed-aedd-7cd30abc95d8
1b30d0ff-47a0-11ed-aedd-7cd30abc95d8
1b30d0ff-47a0-11ed-aedd-7cd30abc95d8
1b30d0ff-47a0-11ed-aedd-7cd30abc95d8
1b30d0ff-47a0-11ed-aedd-7cd30abc95d8
1b30d0ff-47a0-11ed-aedd-7cd30abc95d8
1b30d0ff-47a0-11ed-aedd-7cd30abc95d8
1b30d0ff-47a0-11ed-aedd-7cd30abc95d8
1b30d0ff-47a0-11ed-aedd-7cd30abc95d8
1b30d0ff-47a0-11ed-aedd-7cd30abc95d8
1b30d0ff-47a0-11ed-aedd-7cd30abc95d8
1b30d0ff-47a0-11ed-aedd-7cd30abc95d8
1b30d0ff-47a0-11ed-aedd-7cd30abc95d8
1b30d0ff-47a0-11ed-aedd-7cd30abc95d8
1b30d0ff-47a0-11ed-aedd-7cd30abc95d8
1b30d0ff-47a0-11ed-aedd-7cd30abc95d8
1b30d0ff-47a0-11ed-aedd-7cd30abc95d8
1b30d0ff-47a0-11ed-aedd-7cd30abc95d8
1b30d0ff-47a0-11ed-aedd-7cd30abc95d8
1b30d0ff-47a0-11ed-aedd-7cd30abc95d8
1b30d0ff-47a0-11ed-aedd-7cd30abc95d8
1b30d0ff-47a0-11ed-aedd-7cd30abc95d8
1b30d0ff-47a0-11ed-aedd-7cd30abc95d8
1b30d0ff-47a0-11ed-aedd-7cd30abc95d8
1b30d0ff-47a0-11ed-aedd-7cd30abc95d8
1b30d0ff-47a0-11ed-aedd-7cd30abc95d8
1b30d0ff-47a0-11ed-aedd-7cd30abc95d8
1b30d0ff-47a0-11ed-aedd-7cd30abc95d8
1b30d0ff-47a0-11ed-aedd-7cd30abc95d8
1b30d0ff-47a0-11ed-aedd-7cd30abc95d8
1b30d0ff-47a0-11ed-aedd-7cd30abc95d8
1b30d0ff-47a0-11ed-aedd-7cd30abc95d8
1b30d0ff-47a0-11ed-aedd-7cd30abc95d8
1b30d0ff-47a0-11ed-aedd-7cd30abc95d8
1b30d0ff-47a0-11ed-aedd-7cd30abc95d8
1b30d0ff-47a0-11ed-aedd-7cd30abc95d8
1b30d0ff-47a0-11ed-aedd-7cd30abc95d8
1b30d0ff-47a0-11ed-aedd-7cd30abc95d8
1b30d0ff-47a0-11ed-aedd-7cd30abc95d8
1b30d0ff-47a0-11ed-aedd-7cd30abc95d8
1b30d0ff-47a0-11ed-aedd-7cd30abc95d8
1b30d0ff-47a0-11ed-aedd-7cd30abc95d8
1b30d0ff-47a0-11ed-aedd-7cd30abc95d8
1b30d0ff-47a0-11ed-aedd-7cd30abc95d8
1b30d0ff-47a0-11ed-aedd-7cd30abc95d8
1b30d0ff-47a0-11ed-aedd-7cd30abc95d8
1b30d0ff-47a0-11ed-aedd-7cd30abc95d8
1b30d0ff-47a0-11ed-aedd-7cd30abc95d8
1b30d0ff-47a0-11ed-aedd-7cd30abc95d8
1b30d0ff-47a0-11ed-aedd-7cd30abc95d8
1b30d0ff-47a0-11ed-aedd-7cd30abc95d8
1b30d0ff-47a0-11ed-aedd-7cd30abc95d8
1b30d0ff-47a0-11ed-aedd-7cd30abc95d8
1b30d0ff-47a0-11ed-aedd-7cd30abc95d8
1b30d0ff-47a0-11ed-aedd-7cd30abc95d8
1b30d0ff-47a0-11ed-aedd-7cd30abc95d8
1b30d0ff-47a0-11ed-aedd-7cd30abc95d8
1b30d0ff-47a0-11ed-aedd-7cd30abc95d8
1b30d0ff-47a0-11ed-aedd-7cd30abc95d8
1b30d0ff-47a0-11ed-aedd-7cd30abc95d8
1b30d0ff-47a0-11ed-aedd-7cd30abc95d8
1b30d0ff-47a0-11ed-aedd-7cd30abc95d8
1b30d0ff-47a0-11ed-aedd-7cd30abc95d8
1b30d0ff-47a0-11ed-aedd-7cd30abc95d8
1b30d0ff-47a0-11ed-aedd-7cd30abc95d8
1b30d0ff-47a0-11ed-aedd-7cd30abc95d8
1b30d0ff-47a0-11ed-aedd-7cd30abc95d8
1b30d0ff-47a0-11ed-aedd-7cd30abc95d8
1b30d0ff-47a0-11ed-aedd-7cd30abc95d8
1b30d0ff-47a0-11ed-aedd-7cd30abc95d8
1b30d0ff-47a0-11ed-aedd-7cd30abc95d8
1b30d0ff-47a0-11ed-aedd-7cd30abc95d8
1b30d0ff-47a0-11ed-aedd-7cd30abc95d8
1b30d0ff-47a0-11ed-aedd-7cd30abc95d8
1b30d0ff-47a0-11ed-aedd-7cd30abc95d8
1b30d0ff-47a0-11ed-aedd-7cd30abc95d8
1b30d0ff-47a0-11ed-aedd-7cd30abc95d8
1b30d0ff-47a0-11ed-aedd-7cd30abc95d8
1b30d0ff-47a0-11ed-aedd-7cd30abc95d8
1b30d0ff-47a0-11ed-aedd-7cd30abc95d8
1b30d0ff-47a0-11ed-aedd-7cd30abc95d8
1b30d0ff-47a0-11ed-aedd-7cd30abc95d8
1b30d0ff-47a0-11ed-aedd-7cd30abc95d8
1b30d0ff-47a0-11ed-aedd-7cd30abc95d8
1b30d0ff-47a0-11ed-aedd-7cd30abc95d8
1b30d0ff-47a0-11ed-aedd-7cd30abc95d8
1b30d0ff-47a0-11ed-aedd-7cd30abc95d8
1b30d0ff-47a0-11ed-aedd-7cd30abc95d8
1b30d0ff-47a0-11ed-aedd-7cd30abc95d8
1b30d0ff-47a0-11ed-aedd-7cd30abc95d8
1b30d0ff-47a0-11ed-aedd-7cd30abc95d8
1b30d0ff-47a0-11ed-aedd-7cd30abc95d8
1b30d0ff-47a0-11ed-aedd-7cd30abc95d8
1b30d0ff-47a0-11ed-aedd-7cd30abc95d8
1b30d0ff-47a0-11ed-aedd-7cd30abc95d8
1b30d0ff-47a0-11ed-aedd-7cd30abc95d8
1b30d0ff-47a0-11ed-aedd-7cd30abc95d8
1b30d0ff-47a0-11ed-aedd-7cd30abc95d8
1b30d0ff-47a0-11ed-aedd-7cd30abc95d8
1b30d0ff-47a0-11ed-aedd-7cd30abc95d8
1b30d0ff-47a0-11ed-aedd-7cd30abc95d8
1b30d0ff-47a0-11ed-aedd-7cd30abc95d8
1b30d0ff-47a0-11ed-aedd-7cd30abc95d8
1b30d0ff-47a0-11ed-aedd-7cd30abc95d8
1b30d0ff-47a0-11ed-aedd-7cd30abc95d8
1b30d0ff-47a0-11ed-aedd-7cd30abc95d8
1b30d0ff-47a0-11ed-aedd-7cd30abc95d8
1b30d0ff-47a0-11ed-aedd-7cd30abc95d8
1b30d0ff-47a0-11ed-aedd-7cd30abc95d8
1b30d0ff-47a0-11ed-aedd-7cd30abc95d8
1b30d0ff-47a0-11ed-aedd-7cd30abc95d8
1b30d0ff-47a0-11ed-aedd-7cd30abc95d8
1b30d0ff-47a0-11ed-aedd-7cd30abc95d8
1b30d0ff-47a0-11ed-aedd-7cd30abc95d8
1b30d0ff-47a0-11ed-aedd-7cd30abc95d8
1b30d0ff-47a0-11ed-aedd-7cd30abc95d8
1b30d0ff-47a0-11ed-aedd-7cd30abc95d8
1b30d0ff-47a0-11ed-aedd-7cd30abc95d8
1b30d0ff-47a0-11ed-aedd-7cd30abc95d8
1b30d0ff-47a0-11ed-aedd-7cd30abc95d8
1b30d0ff-47a0-11ed-aedd-7cd30abc95d8
1b30d0ff-47a0-11ed-aedd-7cd30abc95d8
1b30d0ff-47a0-11ed-aedd-7cd30abc95d8
1b30d0ff-47a0-11ed-aedd-7cd30abc95d8
1b30d0ff-47a0-11ed-aedd-7cd30abc95d8
1b30d0ff-47a0-11ed-aedd-7cd30abc95d8
1b30d0ff-47a0-11ed-aedd-7cd30abc95d8
1b30d0ff-47a0-11ed-aedd-7cd30abc95d8
1b30d0ff-47a0-11ed-aedd-7cd30abc95d8
1b30d0ff-47a0-11ed-aedd-7cd30abc95d8
1b30d0ff-47a0-11ed-aedd-7cd30abc95d8
1b30d0ff-47a0-11ed-aedd-7cd30abc95d8
1b30d0ff-47a0-11ed-aedd-7cd30abc95d8
1b30d0ff-47a0-11ed-aedd-7cd30abc95d8
1b30d0ff-47a0-11ed-aedd-7cd30abc95d8
1b30d0ff-47a0-11ed-aedd-7cd30abc95d8
1b30d0ff-47a0-11ed-aedd-7cd30abc95d8
1b30d0ff-47a0-11ed-aedd-7cd30abc95d8
1b30d0ff-47a0-11ed-aedd-7cd30abc95d8
1b30d0ff-47a0-11ed-aedd-7cd30abc95d8
1b30d0ff-47a0-11ed-aedd-7cd30abc95d8
1b30d0ff-47a0-11ed-aedd-7cd30abc95d8
1b30d0ff-47a0-11ed-aedd-7cd30abc95d8
1b30d0ff-47a0-11ed-aedd-7cd30abc95d8
1b30d0ff-47a0-11ed-aedd-7cd30abc95d8
1b30d0ff-47a0-11ed-aedd-7cd30abc95d8
1b30d0ff-47a0-11ed-aedd-7cd30abc95d8
1b30d0ff-47a0-11ed-aedd-7cd30abc95d8
1b30d0ff-47a0-11ed-aedd-7cd30abc95d8
1b30d0ff-47a0-11ed-aedd-7cd30abc95d8
1b30d0ff-47a0-11ed-aedd-7cd30abc95d8
1b30d0ff-47a0-11ed-aedd-7cd30abc95d8
1b30d0ff-47a0-11ed-aedd-7cd30abc95d8
1b30d0ff-47a0-11ed-aedd-7cd30abc95d8
1b30d0ff-47a0-11ed-aedd-7cd30abc95d8
1b30d0ff-47a0-11ed-aedd-7cd30abc95d8
1b30d0ff-47a0-11ed-aedd-7cd30abc95d8
1b30d0ff-47a0-11ed-aedd-7cd30abc95d8
1b30d0ff-47a0-11ed-aedd-7cd30abc95d8
1b30d0ff-47a0-11ed-aedd-7cd30abc95d8
1b30d0ff-47a0-11ed-aedd-7cd30abc95d8
1b30d0ff-47a0-11ed-aedd-7cd30abc95d8
1b30d0ff-47a0-11ed-aedd-7cd30abc95d8
1b30d0ff-47a0-11ed-aedd-7cd30abc95d8
1b30d0ff-47a0-11ed-aedd-7cd30abc95d8
1b30d0ff-47a0-11ed-aedd-7cd30abc95d8
1b30d0ff-47a0-11ed-aedd-7cd30abc95d8
1b30d0ff-47a0-11ed-aedd-7cd30abc95d8
1b30d0ff-47a0-11ed-aedd-7cd30abc95d8
1b30d0ff-47a0-11ed-aedd-7cd30abc95d8
1b30d0ff-47a0-11ed-aedd-7cd30abc95d8
1b30d0ff-47a0-11ed-aedd-7cd30abc95d8
1b30d0ff-47a0-11ed-aedd-7cd30abc95d8
1b30d0ff-47a0-11ed-aedd-7cd30abc95d8
1b30d0ff-47a0-11ed-aedd-7cd30abc95d8
1b30d0ff-47a0-11ed-aedd-7cd30abc95d8
1b30d0ff-47a0-11ed-aedd-7cd30abc95d8
1b30d0ff-47a0-11ed-aedd-7cd30abc95d8
1b30d0ff-47a0-11ed-aedd-7cd30abc95d8
1b30d0ff-47a0-11ed-aedd-7cd30abc95d8
1b30d0ff-47a0-11ed-aedd-7cd30abc95d8
1b30d0ff-47a0-11ed-aedd-7cd30abc95d8
1b30d0ff-47a0-11ed-aedd-7cd30abc95d8
1b30d0ff-47a0-11ed-aedd-7cd30abc95d8
1b30d0ff-47a0-11ed-aedd-7cd30abc95d8
1b30d0ff-47a0-11ed-aedd-7cd30abc95d8
1b30d0ff-47a0-11ed-aedd-7cd30abc95d8
1b30d0ff-47a0-11ed-aedd-7cd30abc95d8
1b30d0ff-47a0-11ed-aedd-7cd30abc95d8
1b30d0ff-47a0-11ed-aedd-7cd30abc95d8
1b30d0ff-47a0-11ed-aedd-7cd30abc95d8
1b30d0ff-47a0-11ed-aedd-7cd30abc95d8
1b30d0ff-47a0-11ed-aedd-7cd30abc95d8
1b30d0ff-47a0-11ed-aedd-7cd30abc95d8
1b30d0ff-47a0-11ed-aedd-7cd30abc95d8
1b30d0ff-47a0-11ed-aedd-7cd30abc95d8
1b30d0ff-47a0-11ed-aedd-7cd30abc95d8
1b30d0ff-47a0-11ed-aedd-7cd30abc95d8
1b30d0ff-47a0-11ed-aedd-7cd30abc95d8
1b30d0ff-47a0-11ed-aedd-7cd30abc95d8
1b30d0ff-47a0-11ed-aedd-7cd30abc95d8
1b30d0ff-47a0-11ed-aedd-7cd30abc95d8
1b30d0ff-47a0-11ed-aedd-7cd30abc95d8
1b30d0ff-47a0-11ed-aedd-7cd30abc95d8
1b30d0ff-47a0-11ed-aedd-7cd30abc95d8
1b30d0ff-47a0-11ed-aedd-7cd30abc95d8
1b30d0ff-47a0-11ed-aedd-7cd30abc95d8
1b30d0ff-47a0-11ed-aedd-7cd30abc95d8
1b30d0ff-47a0-11ed-aedd-7cd30abc95d8
1b30d0ff-47a0-11ed-aedd-7cd30abc95d8
1b30d0ff-47a0-11ed-aedd-7cd30abc95d8
1b30d0ff-47a0-11ed-aedd-7cd30abc95d8
1b30d0ff-47a0-11ed-aedd-7cd30abc95d8
1b30d0ff-47a0-11ed-aedd-7cd30abc95d8
1b30d0ff-47a0-11ed-aedd-7cd30abc95d8
1b30d0ff-47a0-11ed-aedd-7cd30abc95d8
1b30d0ff-47a0-11ed-aedd-7cd30abc95d8
1b30d0ff-47a0-11ed-aedd-7cd30abc95d8
1b30d0ff-47a0-11ed-aedd-7cd30abc95d8
1b30d0ff-47a0-11ed-aedd-7cd30abc95d8
1b30d0ff-47a0-11ed-aedd-7cd30abc95d8
1b30d0ff-47a0-11ed-aedd-7cd30abc95d8
1b30d0ff-47a0-11ed-aedd-7cd30abc95d8
1b30d0ff-47a0-11ed-aedd-7cd30abc95d8
1b30d0ff-47a0-11ed-aedd-7cd30abc95d8
1b30d0ff-47a0-11ed-aedd-7cd30abc95d8
1b30d0ff-47a0-11ed-aedd-7cd30abc95d8
1b30d0ff-47a0-11ed-aedd-7cd30abc95d8
1b30d0ff-47a0-11ed-aedd-7cd30abc95d8
1b30d0ff-47a0-11ed-aedd-7cd30abc95d8
1b30d0ff-47a0-11ed-aedd-7cd30abc95d8
1b30d0ff-47a0-11ed-aedd-7cd30abc95d8
1b30d0ff-47a0-11ed-aedd-7cd30abc95d8
1b30d0ff-47a0-11ed-aedd-7cd30abc95d8
1b30d0ff-47a0-11ed-aedd-7cd30abc95d8
1b30d0ff-47a0-11ed-aedd-7cd30abc95d8
1b30d0ff-47a0-11ed-aedd-7cd30abc95d8
1b30d0ff-47a0-11ed-aedd-7cd30abc95d8
1b30d0ff-47a0-11ed-aedd-7cd30abc95d8
1b30d0ff-47a0-11ed-aedd-7cd30abc95d8
1b30d0ff-47a0-11ed-aedd-7cd30abc95d8
1b30d0ff-47a0-11ed-aedd-7cd30abc95d8
1b30d0ff-47a0-11ed-aedd-7cd30abc95d8
1b30d0ff-47a0-11ed-aedd-7cd30abc95d8
1b30d0ff-47a0-11ed-aedd-7cd30abc95d8
1b30d0ff-47a0-11ed-aedd-7cd30abc95d8
1b30d0ff-47a0-11ed-aedd-7cd30abc95d8
1b30d0ff-47a0-11ed-aedd-7cd30abc95d8
1b30d0ff-47a0-11ed-aedd-7cd30abc95d8
1b30d0ff-47a0-11ed-aedd-7cd30abc95d8
1b30d0ff-47a0-11ed-aedd-7cd30abc95d8
1b30d0ff-47a0-11ed-aedd-7cd30abc95d8
1b30d0ff-47a0-11ed-aedd-7cd30abc95d8
1b30d0ff-47a0-11ed-aedd-7cd30abc95d8
1b30d0ff-47a0-11ed-aedd-7cd30abc95d8
1b30d0ff-47a0-11ed-aedd-7cd30abc95d8
1b30d0ff-47a0-11ed-aedd-7cd30abc95d8
1b30d0ff-47a0-11ed-aedd-7cd30abc95d8
1b30d0ff-47a0-11ed-aedd-7cd30abc95d8
1b30d0ff-47a0-11ed-aedd-7cd30abc95d8
1b30d0ff-47a0-11ed-aedd-7cd30abc95d8
1b30d0ff-47a0-11ed-aedd-7cd30abc95d8
1b30d0ff-47a0-11ed-aedd-7cd30abc95d8
1b30d0ff-47a0-11ed-aedd-7cd30abc95d8
1b30d0ff-47a0-11ed-aedd-7cd30abc95d8
1b30d0ff-47a0-11ed-aedd-7cd30abc95d8
1b30d0ff-47a0-11ed-aedd-7cd30abc95d8
1b30d0ff-47a0-11ed-aedd-7cd30abc95d8
1b30d0ff-47a0-11ed-aedd-7cd30abc95d8
1b30d0ff-47a0-11ed-aedd-7cd30abc95d8
1b30d0ff-47a0-11ed-aedd-7cd30abc95d8
1b30d0ff-47a0-11ed-aedd-7cd30abc95d8
1b30d0ff-47a0-11ed-aedd-7cd30abc95d8
1b30d0ff-47a0-11ed-aedd-7cd30abc95d8
1b30d0ff-47a0-11ed-aedd-7cd30abc95d8
1b30d0ff-47a0-11ed-aedd-7cd30abc95d8
1b30d0ff-47a0-11ed-aedd-7cd30abc95d8
1b30d0ff-47a0-11ed-aedd-7cd30abc95d8
1b30d0ff-47a0-11ed-aedd-7cd30abc95d8
1b30d0ff-47a0-11ed-aedd-7cd30abc95d8
1b30d0ff-47a0-11ed-aedd-7cd30abc95d8
1b30d0ff-47a0-11ed-aedd-7cd30abc95d8
1b30d0ff-47a0-11ed-aedd-7cd30abc95d8
1b30d0ff-47a0-11ed-aedd-7cd30abc95d8
1b30d0ff-47a0-11ed-aedd-7cd30abc95d8
1b30d0ff-47a0-11ed-aedd-7cd30abc95d8
1b30d0ff-47a0-11ed-aedd-7cd30abc95d8
1b30d0ff-47a0-11ed-aedd-7cd30abc95d8
1b30d0ff-47a0-11ed-aedd-7cd30abc95d8
1b30d0ff-47a0-11ed-aedd-7cd30abc95d8
1b30d0ff-47a0-11ed-aedd-7cd30abc95d8
1b30d0ff-47a0-11ed-aedd-7cd30abc95d8
1b30d0ff-47a0-11ed-aedd-7cd30abc95d8
1b30d0ff-47a0-11ed-aedd-7cd30abc95d8
1b30d0ff-47a0-11ed-aedd-7cd30abc95d8
1b30d0ff-47a0-11ed-aedd-7cd30abc95d8
1b30d0ff-47a0-11ed-aedd-7cd30abc95d8
1b30d0ff-47a0-11ed-aedd-7cd30abc95d8
1b30d0ff-47a0-11ed-aedd-7cd30abc95d8
1b30d0ff-47a0-11ed-aedd-7cd30abc95d8
1b30d0ff-47a0-11ed-aedd-7cd30abc95d8
1b30d0ff-47a0-11ed-aedd-7cd30abc95d8
1b30d0ff-47a0-11ed-aedd-7cd30abc95d8
1b30d0ff-47a0-11ed-aedd-7cd30abc95d8
1b30d0ff-47a0-11ed-aedd-7cd30abc95d8
1b30d0ff-47a0-11ed-aedd-7cd30abc95d8
1b30d0ff-47a0-11ed-aedd-7cd30abc95d8
1b30d0ff-47a0-11ed-aedd-7cd30abc95d8
1b30d0ff-47a0-11ed-aedd-7cd30abc95d8
1b30d0ff-47a0-11ed-aedd-7cd30abc95d8
1b30d0ff-47a0-11ed-aedd-7cd30abc95d8
1b30d0ff-47a0-11ed-aedd-7cd30abc95d8
1b30d0ff-47a0-11ed-aedd-7cd30abc95d8
1b30d0ff-47a0-11ed-aedd-7cd30abc95d8
1b30d0ff-47a0-11ed-aedd-7cd30abc95d8
1b30d0ff-47a0-11ed-aedd-7cd30abc95d8
1b30d0ff-47a0-11ed-aedd-7cd30abc95d8
1b30d0ff-47a0-11ed-aedd-7cd30abc95d8
1b30d0ff-47a0-11ed-aedd-7cd30abc95d8
1b30d0ff-47a0-11ed-aedd-7cd30abc95d8
1b30d0ff-47a0-11ed-aedd-7cd30abc95d8
1b30d0ff-47a0-11ed-aedd-7cd30abc95d8
1b30d0ff-47a0-11ed-aedd-7cd30abc95d8
1b30d0ff-47a0-11ed-aedd-7cd30abc95d8
1b30d0ff-47a0-11ed-aedd-7cd30abc95d8
1b30d0ff-47a0-11ed-aedd-7cd30abc95d8
1b30d0ff-47a0-11ed-aedd-7cd30abc95d8
1b30d0ff-47a0-11ed-aedd-7cd30abc95d8
1b30d0ff-47a0-11ed-aedd-7cd30abc95d8
1b30d0ff-47a0-11ed-aedd-7cd30abc95d8
1b30d0ff-47a0-11ed-aedd-7cd30abc95d8
1b30d0ff-47a0-11ed-aedd-7cd30abc95d8
1b30d0ff-47a0-11ed-aedd-7cd30abc95d8
1b30d0ff-47a0-11ed-aedd-7cd30abc95d8
1b30d0ff-47a0-11ed-aedd-7cd30abc95d8
1b30d0ff-47a0-11ed-aedd-7cd30abc95d8
1b30d0ff-47a0-11ed-aedd-7cd30abc95d8
1b30d0ff-47a0-11ed-aedd-7cd30abc95d8
1b30d0ff-47a0-11ed-aedd-7cd30abc95d8
1b30d0ff-47a0-11ed-aedd-7cd30abc95d8
1b30d0ff-47a0-11ed-aedd-7cd30abc95d8
1b30d0ff-47a0-11ed-aedd-7cd30abc95d8
1b30d0ff-47a0-11ed-aedd-7cd30abc95d8
1b30d0ff-47a0-11ed-aedd-7cd30abc95d8
1b30d0ff-47a0-11ed-aedd-7cd30abc95d8
1b30d0ff-47a0-11ed-aedd-7cd30abc95d8
1b30d0ff-47a0-11ed-aedd-7cd30abc95d8
1b30d0ff-47a0-11ed-aedd-7cd30abc95d8
1b30d0ff-47a0-11ed-aedd-7cd30abc95d8
1b30d0ff-47a0-11ed-aedd-7cd30abc95d8
1b30d0ff-47a0-11ed-aedd-7cd30abc95d8
1b30d0ff-47a0-11ed-aedd-7cd30abc95d8
1b30d0ff-47a0-11ed-aedd-7cd30abc95d8
1b30d0ff-47a0-11ed-aedd-7cd30abc95d8
1b30d0ff-47a0-11ed-aedd-7cd30abc95d8
1b30d0ff-47a0-11ed-aedd-7cd30abc95d8
1b30d0ff-47a0-11ed-aedd-7cd30abc95d8
1b30d0ff-47a0-11ed-aedd-7cd30abc95d8
1b30d0ff-47a0-11ed-aedd-7cd30abc95d8
1b30d0ff-47a0-11ed-aedd-7cd30abc95d8
1b30d0ff-47a0-11ed-aedd-7cd30abc95d8
1b30d0ff-47a0-11ed-aedd-7cd30abc95d8
1b30d0ff-47a0-11ed-aedd-7cd30abc95d8
1b30d0ff-47a0-11ed-aedd-7cd30abc95d8
1b30d0ff-47a0-11ed-aedd-7cd30abc95d8
1b30d0ff-47a0-11ed-aedd-7cd30abc95d8
1b30d0ff-47a0-11ed-aedd-7cd30abc95d8
1b30d0ff-47a0-11ed-aedd-7cd30abc95d8
1b30d0ff-47a0-11ed-aedd-7cd30abc95d8
1b30d0ff-47a0-11ed-aedd-7cd30abc95d8
1b30d0ff-47a0-11ed-aedd-7cd30abc95d8
1b30d0ff-47a0-11ed-aedd-7cd30abc95d8
1b30d0ff-47a0-11ed-aedd-7cd30abc95d8
1b30d0ff-47a0-11ed-aedd-7cd30abc95d8
1b30d0ff-47a0-11ed-aedd-7cd30abc95d8
1b30d0ff-47a0-11ed-aedd-7cd30abc95d8
1b30d0ff-47a0-11ed-aedd-7cd30abc95d8
1b30d0ff-47a0-11ed-aedd-7cd30abc95d8
1b30d0ff-47a0-11ed-aedd-7cd30abc95d8
1b30d0ff-47a0-11ed-aedd-7cd30abc95d8
1b30d0ff-47a0-11ed-aedd-7cd30abc95d8
1b30d0ff-47a0-11ed-aedd-7cd30abc95d8
1b30d0ff-47a0-11ed-aedd-7cd30abc95d8
1b30d0ff-47a0-11ed-aedd-7cd30abc95d8
1b30d0ff-47a0-11ed-aedd-7cd30abc95d8
1b30d0ff-47a0-11ed-aedd-7cd30abc95d8
1b30d0ff-47a0-11ed-aedd-7cd30abc95d8
1b30d0ff-47a0-11ed-aedd-7cd30abc95d8
1b30d0ff-47a0-11ed-aedd-7cd30abc95d8
1b30d0ff-47a0-11ed-aedd-7cd30abc95d8
1b30d0ff-47a0-11ed-aedd-7cd30abc95d8
1b30d0ff-47a0-11ed-aedd-7cd30abc95d8
1b30d0ff-47a0-11ed-aedd-7cd30abc95d8
1b30d0ff-47a0-11ed-aedd-7cd30abc95d8
1b30d0ff-47a0-11ed-aedd-7cd30abc95d8
1b30d0ff-47a0-11ed-aedd-7cd30abc95d8
1b30d0ff-47a0-11ed-aedd-7cd30abc95d8
1b30d0ff-47a0-11ed-aedd-7cd30abc95d8
1b30d0ff-47a0-11ed-aedd-7cd30abc95d8
1b30d0ff-47a0-11ed-aedd-7cd30abc95d8
1b30d0ff-47a0-11ed-aedd-7cd30abc95d8
1b30d0ff-47a0-11ed-aedd-7cd30abc95d8
1b30d0ff-47a0-11ed-aedd-7cd30abc95d8
1b30d0ff-47a0-11ed-aedd-7cd30abc95d8
1b30d0ff-47a0-11ed-aedd-7cd30abc95d8
1b30d0ff-47a0-11ed-aedd-7cd30abc95d8
1b30d0ff-47a0-11ed-aedd-7cd30abc95d8
1b30d0ff-47a0-11ed-aedd-7cd30abc95d8
1b30d0ff-47a0-11ed-aedd-7cd30abc95d8
1b30d0ff-47a0-11ed-aedd-7cd30abc95d8
1b30d0ff-47a0-11ed-aedd-7cd30abc95d8
1b30d0ff-47a0-11ed-aedd-7cd30abc95d8
1b30d0ff-47a0-11ed-aedd-7cd30abc95d8
1b30d0ff-47a0-11ed-aedd-7cd30abc95d8
1b30d0ff-47a0-11ed-aedd-7cd30abc95d8
1b30d0ff-47a0-11ed-aedd-7cd30abc95d8
1b30d0ff-47a0-11ed-aedd-7cd30abc95d8
1b30d0ff-47a0-11ed-aedd-7cd30abc95d8
1b30d0ff-47a0-11ed-aedd-7cd30abc95d8
1b30d0ff-47a0-11ed-aedd-7cd30abc95d8
1b30d0ff-47a0-11ed-aedd-7cd30abc95d8
1b30d0ff-47a0-11ed-aedd-7cd30abc95d8
1b30d0ff-47a0-11ed-aedd-7cd30abc95d8
1b30d0ff-47a0-11ed-aedd-7cd30abc95d8
1b30d0ff-47a0-11ed-aedd-7cd30abc95d8
1b30d0ff-47a0-11ed-aedd-7cd30abc95d8
1b30d0ff-47a0-11ed-aedd-7cd30abc95d8
1b30d0ff-47a0-11ed-aedd-7cd30abc95d8
1b30d0ff-47a0-11ed-aedd-7cd30abc95d8
1b30d0ff-47a0-11ed-aedd-7cd30abc95d8
1b30d0ff-47a0-11ed-aedd-7cd30abc95d8
1b30d0ff-47a0-11ed-aedd-7cd30abc95d8
1b30d0ff-47a0-11ed-aedd-7cd30abc95d8
1b30d0ff-47a0-11ed-aedd-7cd30abc95d8
1b30d0ff-47a0-11ed-aedd-7cd30abc95d8
1b30d0ff-47a0-11ed-aedd-7cd30abc95d8
1b30d0ff-47a0-11ed-aedd-7cd30abc95d8
1b30d0ff-47a0-11ed-aedd-7cd30abc95d8
1b30d0ff-47a0-11ed-aedd-7cd30abc95d8
1b30d0ff-47a0-11ed-aedd-7cd30abc95d8
1b30d0ff-47a0-11ed-aedd-7cd30abc95d8
1b30d0ff-47a0-11ed-aedd-7cd30abc95d8
1b30d0ff-47a0-11ed-aedd-7cd30abc95d8
1b30d0ff-47a0-11ed-aedd-7cd30abc95d8
1b30d0ff-47a0-11ed-aedd-7cd30abc95d8
1b30d0ff-47a0-11ed-aedd-7cd30abc95d8
1b30d0ff-47a0-11ed-aedd-7cd30abc95d8
1b30d0ff-47a0-11ed-aedd-7cd30abc95d8
1b30d0ff-47a0-11ed-aedd-7cd30abc95d8
1b30d0ff-47a0-11ed-aedd-7cd30abc95d8
1b30d0ff-47a0-11ed-aedd-7cd30abc95d8
1b30d0ff-47a0-11ed-aedd-7cd30abc95d8
1b30d0ff-47a0-11ed-aedd-7cd30abc95d8
1b30d0ff-47a0-11ed-aedd-7cd30abc95d8
1b30d0ff-47a0-11ed-aedd-7cd30abc95d8
1b30d0ff-47a0-11ed-aedd-7cd30abc95d8
1b30d0ff-47a0-11ed-aedd-7cd30abc95d8
1b30d0ff-47a0-11ed-aedd-7cd30abc95d8
1b30d0ff-47a0-11ed-aedd-7cd30abc95d8
1b30d0ff-47a0-11ed-aedd-7cd30abc95d8
1b30d0ff-47a0-11ed-aedd-7cd30abc95d8
1b30d0ff-47a0-11ed-aedd-7cd30abc95d8
1b30d0ff-47a0-11ed-aedd-7cd30abc95d8
1b30d0ff-47a0-11ed-aedd-7cd30abc95d8
1b30d0ff-47a0-11ed-aedd-7cd30abc95d8
1b30d0ff-47a0-11ed-aedd-7cd30abc95d8
1b30d0ff-47a0-11ed-aedd-7cd30abc95d8
1b30d0ff-47a0-11ed-aedd-7cd30abc95d8
1b30d0ff-47a0-11ed-aedd-7cd30abc95d8
1b30d0ff-47a0-11ed-aedd-7cd30abc95d8
1b30d0ff-47a0-11ed-aedd-7cd30abc95d8
1b30d0ff-47a0-11ed-aedd-7cd30abc95d8
1b30d0ff-47a0-11ed-aedd-7cd30abc95d8
1b30d0ff-47a0-11ed-aedd-7cd30abc95d8
1b30d0ff-47a0-11ed-aedd-7cd30abc95d8
1b30d0ff-47a0-11ed-aedd-7cd30abc95d8
1b30d0ff-47a0-11ed-aedd-7cd30abc95d8
1b30d0ff-47a0-11ed-aedd-7cd30abc95d8
1b30d0ff-47a0-11ed-aedd-7cd30abc95d8
1b30d0ff-47a0-11ed-aedd-7cd30abc95d8
1b30d0ff-47a0-11ed-aedd-7cd30abc95d8
1b30d0ff-47a0-11ed-aedd-7cd30abc95d8
1b30d0ff-47a0-11ed-aedd-7cd30abc95d8
1b30d0ff-47a0-11ed-aedd-7cd30abc95d8
1b30d0ff-47a0-11ed-aedd-7cd30abc95d8
1b30d0ff-47a0-11ed-aedd-7cd30abc95d8
1b30d0ff-47a0-11ed-aedd-7cd30abc95d8
1b30d0ff-47a0-11ed-aedd-7cd30abc95d8
1b30d0ff-47a0-11ed-aedd-7cd30abc95d8
1b30d0ff-47a0-11ed-aedd-7cd30abc95d8
1b30d0ff-47a0-11ed-aedd-7cd30abc95d8
1b30d0ff-47a0-11ed-aedd-7cd30abc95d8
1b30d0ff-47a0-11ed-aedd-7cd30abc95d8
1b30d0ff-47a0-11ed-aedd-7cd30abc95d8
1b30d0ff-47a0-11ed-aedd-7cd30abc95d8
1b30d0ff-47a0-11ed-aedd-7cd30abc95d8
1b30d0ff-47a0-11ed-aedd-7cd30abc95d8
1b30d0ff-47a0-11ed-aedd-7cd30abc95d8
1b30d0ff-47a0-11ed-aedd-7cd30abc95d8
1b30d0ff-47a0-11ed-aedd-7cd30abc95d8
1b30d0ff-47a0-11ed-aedd-7cd30abc95d8
1b30d0ff-47a0-11ed-aedd-7cd30abc95d8
1b30d0ff-47a0-11ed-aedd-7cd30abc95d8
1b30d0ff-47a0-11ed-aedd-7cd30abc95d8
1b30d0ff-47a0-11ed-aedd-7cd30abc95d8
1b30d0ff-47a0-11ed-aedd-7cd30abc95d8
1b30d0ff-47a0-11ed-aedd-7cd30abc95d8
1b30d0ff-47a0-11ed-aedd-7cd30abc95d8
1b30d0ff-47a0-11ed-aedd-7cd30abc95d8
1b30d0ff-47a0-11ed-aedd-7cd30abc95d8
1b30d0ff-47a0-11ed-aedd-7cd30abc95d8
1b30d0ff-47a0-11ed-aedd-7cd30abc95d8
1b30d0ff-47a0-11ed-aedd-7cd30abc95d8
1b30d0ff-47a0-11ed-aedd-7cd30abc95d8
1b30d0ff-47a0-11ed-aedd-7cd30abc95d8
1b30d0ff-47a0-11ed-aedd-7cd30abc95d8
1b30d0ff-47a0-11ed-aedd-7cd30abc95d8
1b30d0ff-47a0-11ed-aedd-7cd30abc95d8
1b30d0ff-47a0-11ed-aedd-7cd30abc95d8
1b30d0ff-47a0-11ed-aedd-7cd30abc95d8
1b30d0ff-47a0-11ed-aedd-7cd30abc95d8
1b30d0ff-47a0-11ed-aedd-7cd30abc95d8
1b30d0ff-47a0-11ed-aedd-7cd30abc95d8
1b30d0ff-47a0-11ed-aedd-7cd30abc95d8
1b30d0ff-47a0-11ed-aedd-7cd30abc95d8
1b30d0ff-47a0-11ed-aedd-7cd30abc95d8
1b30d0ff-47a0-11ed-aedd-7cd30abc95d8
1b30d0ff-47a0-11ed-aedd-7cd30abc95d8
1b30d0ff-47a0-11ed-aedd-7cd30abc95d8
1b30d0ff-47a0-11ed-aedd-7cd30abc95d8
1b30d0ff-47a0-11ed-aedd-7cd30abc95d8
1b30d0ff-47a0-11ed-aedd-7cd30abc95d8
1b30d0ff-47a0-11ed-aedd-7cd30abc95d8
1b30d0ff-47a0-11ed-aedd-7cd30abc95d8
1b30d0ff-47a0-11ed-aedd-7cd30abc95d8
1b30d0ff-47a0-11ed-aedd-7cd30abc95d8
1b30d0ff-47a0-11ed-aedd-7cd30abc95d8
1b30d0ff-47a0-11ed-aedd-7cd30abc95d8
1b30d0ff-47a0-11ed-aedd-7cd30abc95d8
1b30d0ff-47a0-11ed-aedd-7cd30abc95d8
1b30d0ff-47a0-11ed-aedd-7cd30abc95d8
1b30d0ff-47a0-11ed-aedd-7cd30abc95d8
1b30d0ff-47a0-11ed-aedd-7cd30abc95d8
1b30d0ff-47a0-11ed-aedd-7cd30abc95d8
1b30d0ff-47a0-11ed-aedd-7cd30abc95d8
1b30d0ff-47a0-11ed-aedd-7cd30abc95d8
1b30d0ff-47a0-11ed-aedd-7cd30abc95d8
1b30d0ff-47a0-11ed-aedd-7cd30abc95d8
1b30d0ff-47a0-11ed-aedd-7cd30abc95d8
1b30d0ff-47a0-11ed-aedd-7cd30abc95d8
1b30d0ff-47a0-11ed-aedd-7cd30abc95d8
1b30d0ff-47a0-11ed-aedd-7cd30abc95d8
1b30d0ff-47a0-11ed-aedd-7cd30abc95d8
1b30d0ff-47a0-11ed-aedd-7cd30abc95d8
1b30d0ff-47a0-11ed-aedd-7cd30abc95d8
1b30d0ff-47a0-11ed-aedd-7cd30abc95d8
1b30d0ff-47a0-11ed-aedd-7cd30abc95d8
1b30d0ff-47a0-11ed-aedd-7cd30abc95d8
1b30d0ff-47a0-11ed-aedd-7cd30abc95d8
1b30d0ff-47a0-11ed-aedd-7cd30abc95d8
1b30d0ff-47a0-11ed-aedd-7cd30abc95d8
1b30d0ff-47a0-11ed-aedd-7cd30abc95d8
1b30d0ff-47a0-11ed-aedd-7cd30abc95d8
1b30d0ff-47a0-11ed-aedd-7cd30abc95d8
1b30d0ff-47a0-11ed-aedd-7cd30abc95d8
1b30d0ff-47a0-11ed-aedd-7cd30abc95d8
1b30d0ff-47a0-11ed-aedd-7cd30abc95d8
1b30d0ff-47a0-11ed-aedd-7cd30abc95d8
1b30d0ff-47a0-11ed-aedd-7cd30abc95d8
1b30d0ff-47a0-11ed-aedd-7cd30abc95d8
1b30d0ff-47a0-11ed-aedd-7cd30abc95d8
1b30d0ff-47a0-11ed-aedd-7cd30abc95d8
1b30d0ff-47a0-11ed-aedd-7cd30abc95d8
1b30d0ff-47a0-11ed-aedd-7cd30abc95d8
1b30d0ff-47a0-11ed-aedd-7cd30abc95d8
1b30d0ff-47a0-11ed-aedd-7cd30abc95d8
1b30d0ff-47a0-11ed-aedd-7cd30abc95d8
1b30d0ff-47a0-11ed-aedd-7cd30abc95d8
1b30d0ff-47a0-11ed-aedd-7cd30abc95d8
1b30d0ff-47a0-11ed-aedd-7cd30abc95d8
1b30d0ff-47a0-11ed-aedd-7cd30abc95d8
1b30d0ff-47a0-11ed-aedd-7cd30abc95d8
1b30d0ff-47a0-11ed-aedd-7cd30abc95d8
1b30d0ff-47a0-11ed-aedd-7cd30abc95d8
1b30d0ff-47a0-11ed-aedd-7cd30abc95d8
1b30d0ff-47a0-11ed-aedd-7cd30abc95d8
1b30d0ff-47a0-11ed-aedd-7cd30abc95d8
1b30d0ff-47a0-11ed-aedd-7cd30abc95d8
1b30d0ff-47a0-11ed-aedd-7cd30abc95d8
1b30d0ff-47a0-11ed-aedd-7cd30abc95d8
1b30d0ff-47a0-11ed-aedd-7cd30abc95d8
1b30d0ff-47a0-11ed-aedd-7cd30abc95d8
1b30d0ff-47a0-11ed-aedd-7cd30abc95d8
1b30d0ff-47a0-11ed-aedd-7cd30abc95d8
1b30d0ff-47a0-11ed-aedd-7cd30abc95d8
1b30d0ff-47a0-11ed-aedd-7cd30abc95d8
1b30d0ff-47a0-11ed-aedd-7cd30abc95d8
1b30d0ff-47a0-11ed-aedd-7cd30abc95d8
1b30d0ff-47a0-11ed-aedd-7cd30abc95d8
1b30d0ff-47a0-11ed-aedd-7cd30abc95d8
1b30d0ff-47a0-11ed-aedd-7cd30abc95d8
1b30d0ff-47a0-11ed-aedd-7cd30abc95d8
1b30d0ff-47a0-11ed-aedd-7cd30abc95d8
1b30d0ff-47a0-11ed-aedd-7cd30abc95d8
1b30d0ff-47a0-11ed-aedd-7cd30abc95d8
1b30d0ff-47a0-11ed-aedd-7cd30abc95d8
1b30d0ff-47a0-11ed-aedd-7cd30abc95d8
1b30d0ff-47a0-11ed-aedd-7cd30abc95d8
1b30d0ff-47a0-11ed-aedd-7cd30abc95d8
1b30d0ff-47a0-11ed-aedd-7cd30abc95d8
1b30d0ff-47a0-11ed-aedd-7cd30abc95d8
1b30d0ff-47a0-11ed-aedd-7cd30abc95d8
1b30d0ff-47a0-11ed-aedd-7cd30abc95d8
1b30d0ff-47a0-11ed-aedd-7cd30abc95d8
1b30d0ff-47a0-11ed-aedd-7cd30abc95d8
1b30d0ff-47a0-11ed-aedd-7cd30abc95d8
1b30d0ff-47a0-11ed-aedd-7cd30abc95d8
1b30d0ff-47a0-11ed-aedd-7cd30abc95d8
1b30d0ff-47a0-11ed-aedd-7cd30abc95d8
1b30d0ff-47a0-11ed-aedd-7cd30abc95d8
1b30d0ff-47a0-11ed-aedd-7cd30abc95d8
1b30d0ff-47a0-11ed-aedd-7cd30abc95d8
1b30d0ff-47a0-11ed-aedd-7cd30abc95d8
1b30d0ff-47a0-11ed-aedd-7cd30abc95d8
1b30d0ff-47a0-11ed-aedd-7cd30abc95d8
1b30d0ff-47a0-11ed-aedd-7cd30abc95d8
1b30d0ff-47a0-11ed-aedd-7cd30abc95d8
1b30d0ff-47a0-11ed-aedd-7cd30abc95d8
1b30d0ff-47a0-11ed-aedd-7cd30abc95d8
1b30d0ff-47a0-11ed-aedd-7cd30abc95d8
1b30d0ff-47a0-11ed-aedd-7cd30abc95d8
1b30d0ff-47a0-11ed-aedd-7cd30abc95d8
1b30d0ff-47a0-11ed-aedd-7cd30abc95d8
1b30d0ff-47a0-11ed-aedd-7cd30abc95d8
1b30d0ff-47a0-11ed-aedd-7cd30abc95d8
1b30d0ff-47a0-11ed-aedd-7cd30abc95d8
1b30d0ff-47a0-11ed-aedd-7cd30abc95d8
1b30d0ff-47a0-11ed-aedd-7cd30abc95d8
1b30d0ff-47a0-11ed-aedd-7cd30abc95d8
1b30d0ff-47a0-11ed-aedd-7cd30abc95d8
1b30d0ff-47a0-11ed-aedd-7cd30abc95d8
1b30d0ff-47a0-11ed-aedd-7cd30abc95d8
1b30d0ff-47a0-11ed-aedd-7cd30abc95d8
1b30d0ff-47a0-11ed-aedd-7cd30abc95d8
1b30d0ff-47a0-11ed-aedd-7cd30abc95d8
1b30d0ff-47a0-11ed-aedd-7cd30abc95d8
1b30d0ff-47a0-11ed-aedd-7cd30abc95d8
1b30d0ff-47a0-11ed-aedd-7cd30abc95d8
1b30d0ff-47a0-11ed-aedd-7cd30abc95d8
1b30d0ff-47a0-11ed-aedd-7cd30abc95d8
1b30d0ff-47a0-11ed-aedd-7cd30abc95d8
1b30d0ff-47a0-11ed-aedd-7cd30abc95d8
1b30d0ff-47a0-11ed-aedd-7cd30abc95d8
1b30d0ff-47a0-11ed-aedd-7cd30abc95d8
1b30d0ff-47a0-11ed-aedd-7cd30abc95d8
1b30d0ff-47a0-11ed-aedd-7cd30abc95d8
1b30d0ff-47a0-11ed-aedd-7cd30abc95d8
1b30d0ff-47a0-11ed-aedd-7cd30abc95d8
1b30d0ff-47a0-11ed-aedd-7cd30abc95d8
1b30d0ff-47a0-11ed-aedd-7cd30abc95d8
1b30d0ff-47a0-11ed-aedd-7cd30abc95d8
1b30d0ff-47a0-11ed-aedd-7cd30abc95d8
1b30d0ff-47a0-11ed-aedd-7cd30abc95d8
1b30d0ff-47a0-11ed-aedd-7cd30abc95d8
1b30d0ff-47a0-11ed-aedd-7cd30abc95d8
1b30d0ff-47a0-11ed-aedd-7cd30abc95d8
1b30d0ff-47a0-11ed-aedd-7cd30abc95d8
1b30d0ff-47a0-11ed-aedd-7cd30abc95d8
1b30d0ff-47a0-11ed-aedd-7cd30abc95d8
1b30d0ff-47a0-11ed-aedd-7cd30abc95d8
1b30d0ff-47a0-11ed-aedd-7cd30abc95d8
1b30d0ff-47a0-11ed-aedd-7cd30abc95d8
1b30d0ff-47a0-11ed-aedd-7cd30abc95d8
1b30d0ff-47a0-11ed-aedd-7cd30abc95d8
1b30d0ff-47a0-11ed-aedd-7cd30abc95d8
1b30d0ff-47a0-11ed-aedd-7cd30abc95d8
1b30d0ff-47a0-11ed-aedd-7cd30abc95d8
1b30d0ff-47a0-11ed-aedd-7cd30abc95d8
1b30d0ff-47a0-11ed-aedd-7cd30abc95d8
1b30d0ff-47a0-11ed-aedd-7cd30abc95d8
1b30d0ff-47a0-11ed-aedd-7cd30abc95d8
1b30d0ff-47a0-11ed-aedd-7cd30abc95d8
1b30d0ff-47a0-11ed-aedd-7cd30abc95d8
1b30d0ff-47a0-11ed-aedd-7cd30abc95d8
1b30d0ff-47a0-11ed-aedd-7cd30abc95d8
1b30d0ff-47a0-11ed-aedd-7cd30abc95d8
1b30d0ff-47a0-11ed-aedd-7cd30abc95d8
1b30d0ff-47a0-11ed-aedd-7cd30abc95d8
1b30d0ff-47a0-11ed-aedd-7cd30abc95d8
1b30d0ff-47a0-11ed-aedd-7cd30abc95d8
1b30d0ff-47a0-11ed-aedd-7cd30abc95d8
1b30d0ff-47a0-11ed-aedd-7cd30abc95d8
1b30d0ff-47a0-11ed-aedd-7cd30abc95d8
1b30d0ff-47a0-11ed-aedd-7cd30abc95d8
1b30d0ff-47a0-11ed-aedd-7cd30abc95d8
1b30d0ff-47a0-11ed-aedd-7cd30abc95d8
1b30d0ff-47a0-11ed-aedd-7cd30abc95d8
1b30d0ff-47a0-11ed-aedd-7cd30abc95d8
1b30d0ff-47a0-11ed-aedd-7cd30abc95d8
1b30d0ff-47a0-11ed-aedd-7cd30abc95d8
1b30d0ff-47a0-11ed-aedd-7cd30abc95d8
1b30d0ff-47a0-11ed-aedd-7cd30abc95d8
1b30d0ff-47a0-11ed-aedd-7cd30abc95d8
1b30d0ff-47a0-11ed-aedd-7cd30abc95d8
1b30d0ff-47a0-11ed-aedd-7cd30abc95d8
1b30d0ff-47a0-11ed-aedd-7cd30abc95d8
1b30d0ff-47a0-11ed-aedd-7cd30abc95d8
1b30d0ff-47a0-11ed-aedd-7cd30abc95d8
1b30d0ff-47a0-11ed-aedd-7cd30abc95d8
1b30d0ff-47a0-11ed-aedd-7cd30abc95d8
1b30d0ff-47a0-11ed-aedd-7cd30abc95d8
1b30d0ff-47a0-11ed-aedd-7cd30abc95d8
1b30d0ff-47a0-11ed-aedd-7cd30abc95d8
1b30d0ff-47a0-11ed-aedd-7cd30abc95d8
1b30d0ff-47a0-11ed-aedd-7cd30abc95d8
1b30d0ff-47a0-11ed-aedd-7cd30abc95d8
1b30d0ff-47a0-11ed-aedd-7cd30abc95d8
1b30d0ff-47a0-11ed-aedd-7cd30abc95d8
1b30d0ff-47a0-11ed-aedd-7cd30abc95d8
1b30d0ff-47a0-11ed-aedd-7cd30abc95d8
1b30d0ff-47a0-11ed-aedd-7cd30abc95d8
1b30d0ff-47a0-11ed-aedd-7cd30abc95d8
1b30d0ff-47a0-11ed-aedd-7cd30abc95d8
1b30d0ff-47a0-11ed-aedd-7cd30abc95d8
1b30d0ff-47a0-11ed-aedd-7cd30abc95d8
1b30d0ff-47a0-11ed-aedd-7cd30abc95d8
1b30d0ff-47a0-11ed-aedd-7cd30abc95d8
1b30d0ff-47a0-11ed-aedd-7cd30abc95d8
1b30d0ff-47a0-11ed-aedd-7cd30abc95d8
1b30d0ff-47a0-11ed-aedd-7cd30abc95d8
1b30d0ff-47a0-11ed-aedd-7cd30abc95d8
1b30d0ff-47a0-11ed-aedd-7cd30abc95d8
1b30d0ff-47a0-11ed-aedd-7cd30abc95d8
1b30d0ff-47a0-11ed-aedd-7cd30abc95d8
1b30d0ff-47a0-11ed-aedd-7cd30abc95d8
1b30d0ff-47a0-11ed-aedd-7cd30abc95d8
1b30d0ff-47a0-11ed-aedd-7cd30abc95d8
1b30d0ff-47a0-11ed-aedd-7cd30abc95d8
1b30d0ff-47a0-11ed-aedd-7cd30abc95d8
1b30d0ff-47a0-11ed-aedd-7cd30abc95d8
1b30d0ff-47a0-11ed-aedd-7cd30abc95d8
1b30d0ff-47a0-11ed-aedd-7cd30abc95d8
1b30d0ff-47a0-11ed-aedd-7cd30abc95d8
1b30d0ff-47a0-11ed-aedd-7cd30abc95d8
1b30d0ff-47a0-11ed-aedd-7cd30abc95d8
1b30d0ff-47a0-11ed-aedd-7cd30abc95d8
1b30d0ff-47a0-11ed-aedd-7cd30abc95d8
1b30d0ff-47a0-11ed-aedd-7cd30abc95d8
1b30d0ff-47a0-11ed-aedd-7cd30abc95d8
1b30d0ff-47a0-11ed-aedd-7cd30abc95d8
1b30d0ff-47a0-11ed-aedd-7cd30abc95d8
1b30d0ff-47a0-11ed-aedd-7cd30abc95d8
1b30d0ff-47a0-11ed-aedd-7cd30abc95d8
1b30d0ff-47a0-11ed-aedd-7cd30abc95d8
1b30d0ff-47a0-11ed-aedd-7cd30abc95d8
1b30d0ff-47a0-11ed-aedd-7cd30abc95d8
1b30d0ff-47a0-11ed-aedd-7cd30abc95d8
1b30d0ff-47a0-11ed-aedd-7cd30abc95d8
1b30d0ff-47a0-11ed-aedd-7cd30abc95d8
1b30d0ff-47a0-11ed-aedd-7cd30abc95d8
1b30d0ff-47a0-11ed-aedd-7cd30abc95d8
1b30d0ff-47a0-11ed-aedd-7cd30abc95d8
1b30d0ff-47a0-11ed-aedd-7cd30abc95d8
1b30d0ff-47a0-11ed-aedd-7cd30abc95d8
1b30d0ff-47a0-11ed-aedd-7cd30abc95d8
1b30d0ff-47a0-11ed-aedd-7cd30abc95d8
1b30d0ff-47a0-11ed-aedd-7cd30abc95d8
1b30d0ff-47a0-11ed-aedd-7cd30abc95d8
1b30d0ff-47a0-11ed-aedd-7cd30abc95d8
1b30d0ff-47a0-11ed-aedd-7cd30abc95d8
1b30d0ff-47a0-11ed-aedd-7cd30abc95d8
1b30d0ff-47a0-11ed-aedd-7cd30abc95d8
1b30d0ff-47a0-11ed-aedd-7cd30abc95d8
1b30d0ff-47a0-11ed-aedd-7cd30abc95d8
1b30d0ff-47a0-11ed-aedd-7cd30abc95d8
1b30d0ff-47a0-11ed-aedd-7cd30abc95d8
1b30d0ff-47a0-11ed-aedd-7cd30abc95d8
1b30d0ff-47a0-11ed-aedd-7cd30abc95d8
1b30d0ff-47a0-11ed-aedd-7cd30abc95d8
1b30d0ff-47a0-11ed-aedd-7cd30abc95d8
1b30d0ff-47a0-11ed-aedd-7cd30abc95d8
1b30d0ff-47a0-11ed-aedd-7cd30abc95d8
1b30d0ff-47a0-11ed-aedd-7cd30abc95d8
1b30d0ff-47a0-11ed-aedd-7cd30abc95d8
1b30d0ff-47a0-11ed-aedd-7cd30abc95d8
1b30d0ff-47a0-11ed-aedd-7cd30abc95d8
1b30d0ff-47a0-11ed-aedd-7cd30abc95d8
1b30d0ff-47a0-11ed-aedd-7cd30abc95d8
1b30d0ff-47a0-11ed-aedd-7cd30abc95d8
1b30d0ff-47a0-11ed-aedd-7cd30abc95d8
1b30d0ff-47a0-11ed-aedd-7cd30abc95d8
1b30d0ff-47a0-11ed-aedd-7cd30abc95d8
1b30d0ff-47a0-11ed-aedd-7cd30abc95d8
1b30d0ff-47a0-11ed-aedd-7cd30abc95d8
1b30d0ff-47a0-11ed-aedd-7cd30abc95d8
1b30d0ff-47a0-11ed-aedd-7cd30abc95d8
1b30d0ff-47a0-11ed-aedd-7cd30abc95d8
1b30d0ff-47a0-11ed-aedd-7cd30abc95d8
1b30d0ff-47a0-11ed-aedd-7cd30abc95d8
1b30d0ff-47a0-11ed-aedd-7cd30abc95d8
1b30d0ff-47a0-11ed-aedd-7cd30abc95d8
1b30d0ff-47a0-11ed-aedd-7cd30abc95d8
1b30d0ff-47a0-11ed-aedd-7cd30abc95d8
1b30d0ff-47a0-11ed-aedd-7cd30abc95d8
1b30d0ff-47a0-11ed-aedd-7cd30abc95d8
1b30d0ff-47a0-11ed-aedd-7cd30abc95d8
1b30d0ff-47a0-11ed-aedd-7cd30abc95d8
1b30d0ff-47a0-11ed-aedd-7cd30abc95d8
1b30d0ff-47a0-11ed-aedd-7cd30abc95d8
1b30d0ff-47a0-11ed-aedd-7cd30abc95d8
1b30d0ff-47a0-11ed-aedd-7cd30abc95d8
1b30d0ff-47a0-11ed-aedd-7cd30abc95d8
1b30d0ff-47a0-11ed-aedd-7cd30abc95d8
1b30d0ff-47a0-11ed-aedd-7cd30abc95d8
1b30d0ff-47a0-11ed-aedd-7cd30abc95d8
1b30d0ff-47a0-11ed-aedd-7cd30abc95d8
1b30d0ff-47a0-11ed-aedd-7cd30abc95d8
1b30d0ff-47a0-11ed-aedd-7cd30abc95d8
1b30d0ff-47a0-11ed-aedd-7cd30abc95d8
1b30d0ff-47a0-11ed-aedd-7cd30abc95d8
1b30d0ff-47a0-11ed-aedd-7cd30abc95d8
1b30d0ff-47a0-11ed-aedd-7cd30abc95d8
1b30d0ff-47a0-11ed-aedd-7cd30abc95d8
1b30d0ff-47a0-11ed-aedd-7cd30abc95d8
1b30d0ff-47a0-11ed-aedd-7cd30abc95d8
1b30d0ff-47a0-11ed-aedd-7cd30abc95d8
1b30d0ff-47a0-11ed-aedd-7cd30abc95d8
1b30d0ff-47a0-11ed-aedd-7cd30abc95d8
1b30d0ff-47a0-11ed-aedd-7cd30abc95d8
1b30d0ff-47a0-11ed-aedd-7cd30abc95d8
1b30d0ff-47a0-11ed-aedd-7cd30abc95d8
1b30d0ff-47a0-11ed-aedd-7cd30abc95d8
1b30d0ff-47a0-11ed-aedd-7cd30abc95d8
1b30d0ff-47a0-11ed-aedd-7cd30abc95d8
1b30d0ff-47a0-11ed-aedd-7cd30abc95d8
1b30d0ff-47a0-11ed-aedd-7cd30abc95d8
1b30d0ff-47a0-11ed-aedd-7cd30abc95d8
1b30d0ff-47a0-11ed-aedd-7cd30abc95d8
1b30d0ff-47a0-11ed-aedd-7cd30abc95d8
1b30d0ff-47a0-11ed-aedd-7cd30abc95d8
1b30d0ff-47a0-11ed-aedd-7cd30abc95d8
1b30d0ff-47a0-11ed-aedd-7cd30abc95d8
1b30d0ff-47a0-11ed-aedd-7cd30abc95d8
1b30d0ff-47a0-11ed-aedd-7cd30abc95d8
1b30d0ff-47a0-11ed-aedd-7cd30abc95d8
1b30d0ff-47a0-11ed-aedd-7cd30abc95d8
1b30d0ff-47a0-11ed-aedd-7cd30abc95d8
1b30d0ff-47a0-11ed-aedd-7cd30abc95d8
1b30d0ff-47a0-11ed-aedd-7cd30abc95d8
1b30d0ff-47a0-11ed-aedd-7cd30abc95d8
1b30d0ff-47a0-11ed-aedd-7cd30abc95d8
1b30d0ff-47a0-11ed-aedd-7cd30abc95d8
1b30d0ff-47a0-11ed-aedd-7cd30abc95d8
1b30d0ff-47a0-11ed-aedd-7cd30abc95d8
1b30d0ff-47a0-11ed-aedd-7cd30abc95d8
1b30d0ff-47a0-11ed-aedd-7cd30abc95d8
1b30d0ff-47a0-11ed-aedd-7cd30abc95d8
1b30d0ff-47a0-11ed-aedd-7cd30abc95d8
1b30d0ff-47a0-11ed-aedd-7cd30abc95d8
1b30d0ff-47a0-11ed-aedd-7cd30abc95d8
1b30d0ff-47a0-11ed-aedd-7cd30abc95d8
1b30d0ff-47a0-11ed-aedd-7cd30abc95d8
1b30d0ff-47a0-11ed-aedd-7cd30abc95d8
1b30d0ff-47a0-11ed-aedd-7cd30abc95d8
1b30d0ff-47a0-11ed-aedd-7cd30abc95d8
1b30d0ff-47a0-11ed-aedd-7cd30abc95d8
1b30d0ff-47a0-11ed-aedd-7cd30abc95d8
1b30d0ff-47a0-11ed-aedd-7cd30abc95d8
1b30d0ff-47a0-11ed-aedd-7cd30abc95d8
1b30d0ff-47a0-11ed-aedd-7cd30abc95d8
1b30d0ff-47a0-11ed-aedd-7cd30abc95d8
1b30d0ff-47a0-11ed-aedd-7cd30abc95d8
1b30d0ff-47a0-11ed-aedd-7cd30abc95d8
1b30d0ff-47a0-11ed-aedd-7cd30abc95d8
1b30d0ff-47a0-11ed-aedd-7cd30abc95d8
1b30d0ff-47a0-11ed-aedd-7cd30abc95d8
1b30d0ff-47a0-11ed-aedd-7cd30abc95d8
1b30d0ff-47a0-11ed-aedd-7cd30abc95d8
1b30d0ff-47a0-11ed-aedd-7cd30abc95d8
1b30d0ff-47a0-11ed-aedd-7cd30abc95d8
1b30d0ff-47a0-11ed-aedd-7cd30abc95d8
1b30d0ff-47a0-11ed-aedd-7cd30abc95d8
1b30d0ff-47a0-11ed-aedd-7cd30abc95d8
1b30d0ff-47a0-11ed-aedd-7cd30abc95d8
1b30d0ff-47a0-11ed-aedd-7cd30abc95d8
1b30d0ff-47a0-11ed-aedd-7cd30abc95d8
1b30d0ff-47a0-11ed-aedd-7cd30abc95d8
1b30d0ff-47a0-11ed-aedd-7cd30abc95d8
1b30d0ff-47a0-11ed-aedd-7cd30abc95d8
1b30d0ff-47a0-11ed-aedd-7cd30abc95d8
1b30d0ff-47a0-11ed-aedd-7cd30abc95d8
1b30d0ff-47a0-11ed-aedd-7cd30abc95d8
1b30d0ff-47a0-11ed-aedd-7cd30abc95d8
1b30d0ff-47a0-11ed-aedd-7cd30abc95d8
1b30d0ff-47a0-11ed-aedd-7cd30abc95d8
1b30d0ff-47a0-11ed-aedd-7cd30abc95d8
1b30d0ff-47a0-11ed-aedd-7cd30abc95d8
1b30d0ff-47a0-11ed-aedd-7cd30abc95d8
1b30d0ff-47a0-11ed-aedd-7cd30abc95d8
1b30d0ff-47a0-11ed-aedd-7cd30abc95d8
1b30d0ff-47a0-11ed-aedd-7cd30abc95d8
1b30d0ff-47a0-11ed-aedd-7cd30abc95d8
1b30d0ff-47a0-11ed-aedd-7cd30abc95d8
1b30d0ff-47a0-11ed-aedd-7cd30abc95d8
1b30d0ff-47a0-11ed-aedd-7cd30abc95d8
1b30d0ff-47a0-11ed-aedd-7cd30abc95d8
1b30d0ff-47a0-11ed-aedd-7cd30abc95d8
1b30d0ff-47a0-11ed-aedd-7cd30abc95d8
1b30d0ff-47a0-11ed-aedd-7cd30abc95d8
1b30d0ff-47a0-11ed-aedd-7cd30abc95d8
1b30d0ff-47a0-11ed-aedd-7cd30abc95d8
1b30d0ff-47a0-11ed-aedd-7cd30abc95d8
1b30d0ff-47a0-11ed-aedd-7cd30abc95d8
1b30d0ff-47a0-11ed-aedd-7cd30abc95d8
1b30d0ff-47a0-11ed-aedd-7cd30abc95d8
1b30d0ff-47a0-11ed-aedd-7cd30abc95d8
1b30d0ff-47a0-11ed-aedd-7cd30abc95d8
1b30d0ff-47a0-11ed-aedd-7cd30abc95d8
1b30d0ff-47a0-11ed-aedd-7cd30abc95d8
1b30d0ff-47a0-11ed-aedd-7cd30abc95d8
1b30d0ff-47a0-11ed-aedd-7cd30abc95d8
1b30d0ff-47a0-11ed-aedd-7cd30abc95d8
1b30d0ff-47a0-11ed-aedd-7cd30abc95d8
1b30d0ff-47a0-11ed-aedd-7cd30abc95d8
1b30d0ff-47a0-11ed-aedd-7cd30abc95d8
1b30d0ff-47a0-11ed-aedd-7cd30abc95d8
1b30d0ff-47a0-11ed-aedd-7cd30abc95d8
1b30d0ff-47a0-11ed-aedd-7cd30abc95d8
1b30d0ff-47a0-11ed-aedd-7cd30abc95d8
1b30d0ff-47a0-11ed-aedd-7cd30abc95d8
1b30d0ff-47a0-11ed-aedd-7cd30abc95d8
1b30d0ff-47a0-11ed-aedd-7cd30abc95d8
1b30d0ff-47a0-11ed-aedd-7cd30abc95d8
1b30d0ff-47a0-11ed-aedd-7cd30abc95d8
1b30d0ff-47a0-11ed-aedd-7cd30abc95d8
1b30d0ff-47a0-11ed-aedd-7cd30abc95d8
1b30d0ff-47a0-11ed-aedd-7cd30abc95d8
1b30d0ff-47a0-11ed-aedd-7cd30abc95d8
1b30d0ff-47a0-11ed-aedd-7cd30abc95d8
1b30d0ff-47a0-11ed-aedd-7cd30abc95d8
1b30d0ff-47a0-11ed-aedd-7cd30abc95d8
1b30d0ff-47a0-11ed-aedd-7cd30abc95d8
1b30d0ff-47a0-11ed-aedd-7cd30abc95d8
1b30d0ff-47a0-11ed-aedd-7cd30abc95d8
1b30d0ff-47a0-11ed-aedd-7cd30abc95d8
1b30d0ff-47a0-11ed-aedd-7cd30abc95d8
1b30d0ff-47a0-11ed-aedd-7cd30abc95d8
1b30d0ff-47a0-11ed-aedd-7cd30abc95d8
1b30d0ff-47a0-11ed-aedd-7cd30abc95d8
1b30d0ff-47a0-11ed-aedd-7cd30abc95d8
1b30d0ff-47a0-11ed-aedd-7cd30abc95d8
1b30d0ff-47a0-11ed-aedd-7cd30abc95d8
1b30d0ff-47a0-11ed-aedd-7cd30abc95d8
1b30d0ff-47a0-11ed-aedd-7cd30abc95d8
1b30d0ff-47a0-11ed-aedd-7cd30abc95d8
1b30d0ff-47a0-11ed-aedd-7cd30abc95d8
1b30d0ff-47a0-11ed-aedd-7cd30abc95d8
1b30d0ff-47a0-11ed-aedd-7cd30abc95d8
1b30d0ff-47a0-11ed-aedd-7cd30abc95d8
1b30d0ff-47a0-11ed-aedd-7cd30abc95d8
1b30d0ff-47a0-11ed-aedd-7cd30abc95d8
1b30d0ff-47a0-11ed-aedd-7cd30abc95d8
1b30d0ff-47a0-11ed-aedd-7cd30abc95d8
1b30d0ff-47a0-11ed-aedd-7cd30abc95d8
1b30d0ff-47a0-11ed-aedd-7cd30abc95d8
1b30d0ff-47a0-11ed-aedd-7cd30abc95d8
1b30d0ff-47a0-11ed-aedd-7cd30abc95d8
1b30d0ff-47a0-11ed-aedd-7cd30abc95d8
1b30d0ff-47a0-11ed-aedd-7cd30abc95d8
1b30d0ff-47a0-11ed-aedd-7cd30abc95d8
1b30d0ff-47a0-11ed-aedd-7cd30abc95d8
1b30d0ff-47a0-11ed-aedd-7cd30abc95d8
1b30d0ff-47a0-11ed-aedd-7cd30abc95d8
1b30d0ff-47a0-11ed-aedd-7cd30abc95d8
1b30d0ff-47a0-11ed-aedd-7cd30abc95d8
1b30d0ff-47a0-11ed-aedd-7cd30abc95d8
1b30d0ff-47a0-11ed-aedd-7cd30abc95d8
1b30d0ff-47a0-11ed-aedd-7cd30abc95d8
1b30d0ff-47a0-11ed-aedd-7cd30abc95d8
1b30d0ff-47a0-11ed-aedd-7cd30abc95d8
1b30d0ff-47a0-11ed-aedd-7cd30abc95d8
1b30d0ff-47a0-11ed-aedd-7cd30abc95d8
1b30d0ff-47a0-11ed-aedd-7cd30abc95d8
1b30d0ff-47a0-11ed-aedd-7cd30abc95d8
1b30d0ff-47a0-11ed-aedd-7cd30abc95d8
1b30d0ff-47a0-11ed-aedd-7cd30abc95d8
1b30d0ff-47a0-11ed-aedd-7cd30abc95d8
1b30d0ff-47a0-11ed-aedd-7cd30abc95d8
1b30d0ff-47a0-11ed-aedd-7cd30abc95d8
1b30d0ff-47a0-11ed-aedd-7cd30abc95d8
1b30d0ff-47a0-11ed-aedd-7cd30abc95d8
1b30d0ff-47a0-11ed-aedd-7cd30abc95d8
1b30d0ff-47a0-11ed-aedd-7cd30abc95d8
1b30d0ff-47a0-11ed-aedd-7cd30abc95d8
1b30d0ff-47a0-11ed-aedd-7cd30abc95d8
1b30d0ff-47a0-11ed-aedd-7cd30abc95d8
1b30d0ff-47a0-11ed-aedd-7cd30abc95d8
1b30d0ff-47a0-11ed-aedd-7cd30abc95d8
1b30d0ff-47a0-11ed-aedd-7cd30abc95d8
1b30d0ff-47a0-11ed-aedd-7cd30abc95d8
1b30d0ff-47a0-11ed-aedd-7cd30abc95d8
1b30d0ff-47a0-11ed-aedd-7cd30abc95d8
1b30d0ff-47a0-11ed-aedd-7cd30abc95d8
1b30d0ff-47a0-11ed-aedd-7cd30abc95d8
1b30d0ff-47a0-11ed-aedd-7cd30abc95d8
1b30d0ff-47a0-11ed-aedd-7cd30abc95d8
1b30d0ff-47a0-11ed-aedd-7cd30abc95d8
1b30d0ff-47a0-11ed-aedd-7cd30abc95d8
1b30d0ff-47a0-11ed-aedd-7cd30abc95d8
1b30d0ff-47a0-11ed-aedd-7cd30abc95d8
1b30d0ff-47a0-11ed-aedd-7cd30abc95d8
1b30d0ff-47a0-11ed-aedd-7cd30abc95d8
1b30d0ff-47a0-11ed-aedd-7cd30abc95d8
1b30d0ff-47a0-11ed-aedd-7cd30abc95d8
1b30d0ff-47a0-11ed-aedd-7cd30abc95d8
1b30d0ff-47a0-11ed-aedd-7cd30abc95d8
1b30d0ff-47a0-11ed-aedd-7cd30abc95d8
1b30d0ff-47a0-11ed-aedd-7cd30abc95d8
1b30d0ff-47a0-11ed-aedd-7cd30abc95d8
1b30d0ff-47a0-11ed-aedd-7cd30abc95d8
1b30d0ff-47a0-11ed-aedd-7cd30abc95d8
1b30d0ff-47a0-11ed-aedd-7cd30abc95d8
1b30d0ff-47a0-11ed-aedd-7cd30abc95d8
1b30d0ff-47a0-11ed-aedd-7cd30abc95d8
1b30d0ff-47a0-11ed-aedd-7cd30abc95d8
1b30d0ff-47a0-11ed-aedd-7cd30abc95d8
1b30d0ff-47a0-11ed-aedd-7cd30abc95d8
1b30d0ff-47a0-11ed-aedd-7cd30abc95d8
1b30d0ff-47a0-11ed-aedd-7cd30abc95d8
1b30d0ff-47a0-11ed-aedd-7cd30abc95d8
1b30d0ff-47a0-11ed-aedd-7cd30abc95d8
1b30d0ff-47a0-11ed-aedd-7cd30abc95d8
1b30d0ff-47a0-11ed-aedd-7cd30abc95d8
1b30d0ff-47a0-11ed-aedd-7cd30abc95d8
1b30d0ff-47a0-11ed-aedd-7cd30abc95d8
1b30d0ff-47a0-11ed-aedd-7cd30abc95d8
1b30d0ff-47a0-11ed-aedd-7cd30abc95d8
1b30d0ff-47a0-11ed-aedd-7cd30abc95d8
1b30d0ff-47a0-11ed-aedd-7cd30abc95d8
1b30d0ff-47a0-11ed-aedd-7cd30abc95d8
1b30d0ff-47a0-11ed-aedd-7cd30abc95d8
1b30d0ff-47a0-11ed-aedd-7cd30abc95d8
1b30d0ff-47a0-11ed-aedd-7cd30abc95d8
1b30d0ff-47a0-11ed-aedd-7cd30abc95d8
1b30d0ff-47a0-11ed-aedd-7cd30abc95d8
1b30d0ff-47a0-11ed-aedd-7cd30abc95d8
1b30d0ff-47a0-11ed-aedd-7cd30abc95d8
1b30d0ff-47a0-11ed-aedd-7cd30abc95d8
1b30d0ff-47a0-11ed-aedd-7cd30abc95d8
1b30d0ff-47a0-11ed-aedd-7cd30abc95d8
1b30d0ff-47a0-11ed-aedd-7cd30abc95d8
1b30d0ff-47a0-11ed-aedd-7cd30abc95d8
1b30d0ff-47a0-11ed-aedd-7cd30abc95d8
1b30d0ff-47a0-11ed-aedd-7cd30abc95d8
1b30d0ff-47a0-11ed-aedd-7cd30abc95d8
1b30d0ff-47a0-11ed-aedd-7cd30abc95d8
1b30d0ff-47a0-11ed-aedd-7cd30abc95d8
1b30d0ff-47a0-11ed-aedd-7cd30abc95d8
1b30d0ff-47a0-11ed-aedd-7cd30abc95d8
1b30d0ff-47a0-11ed-aedd-7cd30abc95d8
1b30d0ff-47a0-11ed-aedd-7cd30abc95d8
1b30d0ff-47a0-11ed-aedd-7cd30abc95d8
1b30d0ff-47a0-11ed-aedd-7cd30abc95d8
1b30d0ff-47a0-11ed-aedd-7cd30abc95d8
1b30d0ff-47a0-11ed-aedd-7cd30abc95d8
1b30d0ff-47a0-11ed-aedd-7cd30abc95d8
1b30d0ff-47a0-11ed-aedd-7cd30abc95d8
1b30d0ff-47a0-11ed-aedd-7cd30abc95d8
1b30d0ff-47a0-11ed-aedd-7cd30abc95d8
1b30d0ff-47a0-11ed-aedd-7cd30abc95d8
1b30d0ff-47a0-11ed-aedd-7cd30abc95d8
1b30d0ff-47a0-11ed-aedd-7cd30abc95d8
1b30d0ff-47a0-11ed-aedd-7cd30abc95d8
1b30d0ff-47a0-11ed-aedd-7cd30abc95d8
1b30d0ff-47a0-11ed-aedd-7cd30abc95d8
1b30d0ff-47a0-11ed-aedd-7cd30abc95d8
1b30d0ff-47a0-11ed-aedd-7cd30abc95d8
1b30d0ff-47a0-11ed-aedd-7cd30abc95d8
1b30d0ff-47a0-11ed-aedd-7cd30abc95d8
1b30d0ff-47a0-11ed-aedd-7cd30abc95d8
1b30d0ff-47a0-11ed-aedd-7cd30abc95d8
1b30d0ff-47a0-11ed-aedd-7cd30abc95d8
1b30d0ff-47a0-11ed-aedd-7cd30abc95d8
1b30d0ff-47a0-11ed-aedd-7cd30abc95d8
1b30d0ff-47a0-11ed-aedd-7cd30abc95d8
1b30d0ff-47a0-11ed-aedd-7cd30abc95d8
1b30d0ff-47a0-11ed-aedd-7cd30abc95d8
1b30d0ff-47a0-11ed-aedd-7cd30abc95d8
1b30d0ff-47a0-11ed-aedd-7cd30abc95d8
1b30d0ff-47a0-11ed-aedd-7cd30abc95d8
1b30d0ff-47a0-11ed-aedd-7cd30abc95d8
1b30d0ff-47a0-11ed-aedd-7cd30abc95d8
1b30d0ff-47a0-11ed-aedd-7cd30abc95d8
1b30d0ff-47a0-11ed-aedd-7cd30abc95d8
1b30d0ff-47a0-11ed-aedd-7cd30abc95d8
1b30d0ff-47a0-11ed-aedd-7cd30abc95d8
1b30d0ff-47a0-11ed-aedd-7cd30abc95d8
1b30d0ff-47a0-11ed-aedd-7cd30abc95d8
1b30d0ff-47a0-11ed-aedd-7cd30abc95d8
1b30d0ff-47a0-11ed-aedd-7cd30abc95d8
1b30d0ff-47a0-11ed-aedd-7cd30abc95d8
1b30d0ff-47a0-11ed-aedd-7cd30abc95d8
1b30d0ff-47a0-11ed-aedd-7cd30abc95d8
1b30d0ff-47a0-11ed-aedd-7cd30abc95d8
1b30d0ff-47a0-11ed-aedd-7cd30abc95d8
1b30d0ff-47a0-11ed-aedd-7cd30abc95d8
1b30d0ff-47a0-11ed-aedd-7cd30abc95d8
1b30d0ff-47a0-11ed-aedd-7cd30abc95d8
1b30d0ff-47a0-11ed-aedd-7cd30abc95d8
1b30d0ff-47a0-11ed-aedd-7cd30abc95d8
1b30d0ff-47a0-11ed-aedd-7cd30abc95d8
1b30d0ff-47a0-11ed-aedd-7cd30abc95d8
1b30d0ff-47a0-11ed-aedd-7cd30abc95d8
1b30d0ff-47a0-11ed-aedd-7cd30abc95d8
1b30d0ff-47a0-11ed-aedd-7cd30abc95d8
1b30d0ff-47a0-11ed-aedd-7cd30abc95d8
1b30d0ff-47a0-11ed-aedd-7cd30abc95d8
1b30d0ff-47a0-11ed-aedd-7cd30abc95d8
1b30d0ff-47a0-11ed-aedd-7cd30abc95d8
1b30d0ff-47a0-11ed-aedd-7cd30abc95d8
1b30d0ff-47a0-11ed-aedd-7cd30abc95d8
1b30d0ff-47a0-11ed-aedd-7cd30abc95d8
1b30d0ff-47a0-11ed-aedd-7cd30abc95d8
1b30d0ff-47a0-11ed-aedd-7cd30abc95d8
1b30d0ff-47a0-11ed-aedd-7cd30abc95d8
1b30d0ff-47a0-11ed-aedd-7cd30abc95d8
1b30d0ff-47a0-11ed-aedd-7cd30abc95d8
1b30d0ff-47a0-11ed-aedd-7cd30abc95d8
1b30d0ff-47a0-11ed-aedd-7cd30abc95d8
1b30d0ff-47a0-11ed-aedd-7cd30abc95d8
1b30d0ff-47a0-11ed-aedd-7cd30abc95d8
1b30d0ff-47a0-11ed-aedd-7cd30abc95d8
1b30d0ff-47a0-11ed-aedd-7cd30abc95d8
1b30d0ff-47a0-11ed-aedd-7cd30abc95d8
1b30d0ff-47a0-11ed-aedd-7cd30abc95d8
1b30d0ff-47a0-11ed-aedd-7cd30abc95d8
1b30d0ff-47a0-11ed-aedd-7cd30abc95d8
1b30d0ff-47a0-11ed-aedd-7cd30abc95d8
1b30d0ff-47a0-11ed-aedd-7cd30abc95d8
1b30d0ff-47a0-11ed-aedd-7cd30abc95d8
1b30d0ff-47a0-11ed-aedd-7cd30abc95d8
1b30d0ff-47a0-11ed-aedd-7cd30abc95d8
1b30d0ff-47a0-11ed-aedd-7cd30abc95d8
1b30d0ff-47a0-11ed-aedd-7cd30abc95d8
1b30d0ff-47a0-11ed-aedd-7cd30abc95d8
1b30d0ff-47a0-11ed-aedd-7cd30abc95d8
1b30d0ff-47a0-11ed-aedd-7cd30abc95d8
1b30d0ff-47a0-11ed-aedd-7cd30abc95d8
1b30d0ff-47a0-11ed-aedd-7cd30abc95d8
1b30d0ff-47a0-11ed-aedd-7cd30abc95d8
1b30d0ff-47a0-11ed-aedd-7cd30abc95d8
1b30d0ff-47a0-11ed-aedd-7cd30abc95d8
1b30d0ff-47a0-11ed-aedd-7cd30abc95d8
1b30d0ff-47a0-11ed-aedd-7cd30abc95d8
1b30d0ff-47a0-11ed-aedd-7cd30abc95d8
1b30d0ff-47a0-11ed-aedd-7cd30abc95d8
1b30d0ff-47a0-11ed-aedd-7cd30abc95d8
1b30d0ff-47a0-11ed-aedd-7cd30abc95d8
1b30d0ff-47a0-11ed-aedd-7cd30abc95d8
1b30d0ff-47a0-11ed-aedd-7cd30abc95d8
1b30d0ff-47a0-11ed-aedd-7cd30abc95d8
1b30d0ff-47a0-11ed-aedd-7cd30abc95d8
1b30d0ff-47a0-11ed-aedd-7cd30abc95d8
1b30d0ff-47a0-11ed-aedd-7cd30abc95d8
1b30d0ff-47a0-11ed-aedd-7cd30abc95d8
1b30d0ff-47a0-11ed-aedd-7cd30abc95d8
1b30d0ff-47a0-11ed-aedd-7cd30abc95d8
1b30d0ff-47a0-11ed-aedd-7cd30abc95d8
1b30d0ff-47a0-11ed-aedd-7cd30abc95d8
1b30d0ff-47a0-11ed-aedd-7cd30abc95d8
1b30d0ff-47a0-11ed-aedd-7cd30abc95d8
1b30d0ff-47a0-11ed-aedd-7cd30abc95d8
1b30d0ff-47a0-11ed-aedd-7cd30abc95d8
1b30d0ff-47a0-11ed-aedd-7cd30abc95d8
1b30d0ff-47a0-11ed-aedd-7cd30abc95d8
1b30d0ff-47a0-11ed-aedd-7cd30abc95d8
1b30d0ff-47a0-11ed-aedd-7cd30abc95d8
1b30d0ff-47a0-11ed-aedd-7cd30abc95d8
1b30d0ff-47a0-11ed-aedd-7cd30abc95d8
1b30d0ff-47a0-11ed-aedd-7cd30abc95d8
1b30d0ff-47a0-11ed-aedd-7cd30abc95d8
1b30d0ff-47a0-11ed-aedd-7cd30abc95d8
1b30d0ff-47a0-11ed-aedd-7cd30abc95d8
1b30d0ff-47a0-11ed-aedd-7cd30abc95d8
1b30d0ff-47a0-11ed-aedd-7cd30abc95d8
1b30d0ff-47a0-11ed-aedd-7cd30abc95d8
1b30d0ff-47a0-11ed-aedd-7cd30abc95d8
1b30d0ff-47a0-11ed-aedd-7cd30abc95d8
1b30d0ff-47a0-11ed-aedd-7cd30abc95d8
1b30d0ff-47a0-11ed-aedd-7cd30abc95d8
1b30d0ff-47a0-11ed-aedd-7cd30abc95d8
1b30d0ff-47a0-11ed-aedd-7cd30abc95d8
1b30d0ff-47a0-11ed-aedd-7cd30abc95d8
1b30d0ff-47a0-11ed-aedd-7cd30abc95d8
1b30d0ff-47a0-11ed-aedd-7cd30abc95d8
1b30d0ff-47a0-11ed-aedd-7cd30abc95d8
1b30d0ff-47a0-11ed-aedd-7cd30abc95d8
1b30d0ff-47a0-11ed-aedd-7cd30abc95d8
1b30d0ff-47a0-11ed-aedd-7cd30abc95d8
1b30d0ff-47a0-11ed-aedd-7cd30abc95d8
1b30d0ff-47a0-11ed-aedd-7cd30abc95d8
1b30d0ff-47a0-11ed-aedd-7cd30abc95d8
1b30d0ff-47a0-11ed-aedd-7cd30abc95d8
1b30d0ff-47a0-11ed-aedd-7cd30abc95d8
1b30d0ff-47a0-11ed-aedd-7cd30abc95d8
1b30d0ff-47a0-11ed-aedd-7cd30abc95d8
1b30d0ff-47a0-11ed-aedd-7cd30abc95d8
1b30d0ff-47a0-11ed-aedd-7cd30abc95d8
1b30d0ff-47a0-11ed-aedd-7cd30abc95d8
1b30d0ff-47a0-11ed-aedd-7cd30abc95d8
1b30d0ff-47a0-11ed-aedd-7cd30abc95d8
1b30d0ff-47a0-11ed-aedd-7cd30abc95d8
1b30d0ff-47a0-11ed-aedd-7cd30abc95d8
1b30d0ff-47a0-11ed-aedd-7cd30abc95d8
1b30d0ff-47a0-11ed-aedd-7cd30abc95d8
1b30d0ff-47a0-11ed-aedd-7cd30abc95d8
1b30d0ff-47a0-11ed-aedd-7cd30abc95d8
1b30d0ff-47a0-11ed-aedd-7cd30abc95d8
1b30d0ff-47a0-11ed-aedd-7cd30abc95d8
1b30d0ff-47a0-11ed-aedd-7cd30abc95d8
1b30d0ff-47a0-11ed-aedd-7cd30abc95d8
1b30d0ff-47a0-11ed-aedd-7cd30abc95d8
1b30d0ff-47a0-11ed-aedd-7cd30abc95d8
1b30d0ff-47a0-11ed-aedd-7cd30abc95d8
1b30d0ff-47a0-11ed-aedd-7cd30abc95d8
1b30d0ff-47a0-11ed-aedd-7cd30abc95d8
1b30d0ff-47a0-11ed-aedd-7cd30abc95d8
1b30d0ff-47a0-11ed-aedd-7cd30abc95d8
1b30d0ff-47a0-11ed-aedd-7cd30abc95d8
1b30d0ff-47a0-11ed-aedd-7cd30abc95d8
1b30d0ff-47a0-11ed-aedd-7cd30abc95d8
1b30d0ff-47a0-11ed-aedd-7cd30abc95d8
1b30d0ff-47a0-11ed-aedd-7cd30abc95d8
1b30d0ff-47a0-11ed-aedd-7cd30abc95d8
1b30d0ff-47a0-11ed-aedd-7cd30abc95d8
1b30d0ff-47a0-11ed-aedd-7cd30abc95d8
1b30d0ff-47a0-11ed-aedd-7cd30abc95d8
1b30d0ff-47a0-11ed-aedd-7cd30abc95d8
1b30d0ff-47a0-11ed-aedd-7cd30abc95d8
1b30d0ff-47a0-11ed-aedd-7cd30abc95d8
1b30d0ff-47a0-11ed-aedd-7cd30abc95d8
1b30d0ff-47a0-11ed-aedd-7cd30abc95d8
1b30d0ff-47a0-11ed-aedd-7cd30abc95d8
1b30d0ff-47a0-11ed-aedd-7cd30abc95d8
1b30d0ff-47a0-11ed-aedd-7cd30abc95d8
1b30d0ff-47a0-11ed-aedd-7cd30abc95d8
1b30d0ff-47a0-11ed-aedd-7cd30abc95d8
1b30d0ff-47a0-11ed-aedd-7cd30abc95d8
1b30d0ff-47a0-11ed-aedd-7cd30abc95d8
1b30d0ff-47a0-11ed-aedd-7cd30abc95d8
1b30d0ff-47a0-11ed-aedd-7cd30abc95d8
1b30d0ff-47a0-11ed-aedd-7cd30abc95d8
1b30d0ff-47a0-11ed-aedd-7cd30abc95d8
1b30d0ff-47a0-11ed-aedd-7cd30abc95d8
1b30d0ff-47a0-11ed-aedd-7cd30abc95d8
1b30d0ff-47a0-11ed-aedd-7cd30abc95d8
1b30d0ff-47a0-11ed-aedd-7cd30abc95d8
1b30d0ff-47a0-11ed-aedd-7cd30abc95d8
1b30d0ff-47a0-11ed-aedd-7cd30abc95d8
1b30d0ff-47a0-11ed-aedd-7cd30abc95d8
1b30d0ff-47a0-11ed-aedd-7cd30abc95d8
1b30d0ff-47a0-11ed-aedd-7cd30abc95d8
1b30d0ff-47a0-11ed-aedd-7cd30abc95d8
1b30d0ff-47a0-11ed-aedd-7cd30abc95d8
1b30d0ff-47a0-11ed-aedd-7cd30abc95d8
1b30d0ff-47a0-11ed-aedd-7cd30abc95d8
1b30d0ff-47a0-11ed-aedd-7cd30abc95d8
1b30d0ff-47a0-11ed-aedd-7cd30abc95d8
1b30d0ff-47a0-11ed-aedd-7cd30abc95d8
1b30d0ff-47a0-11ed-aedd-7cd30abc95d8
1b30d0ff-47a0-11ed-aedd-7cd30abc95d8
1b30d0ff-47a0-11ed-aedd-7cd30abc95d8
1b30d0ff-47a0-11ed-aedd-7cd30abc95d8
1b30d0ff-47a0-11ed-aedd-7cd30abc95d8
1b30d0ff-47a0-11ed-aedd-7cd30abc95d8
1b30d0ff-47a0-11ed-aedd-7cd30abc95d8
1b30d0ff-47a0-11ed-aedd-7cd30abc95d8
1b30d0ff-47a0-11ed-aedd-7cd30abc95d8
1b30d0ff-47a0-11ed-aedd-7cd30abc95d8
1b30d0ff-47a0-11ed-aedd-7cd30abc95d8
1b30d0ff-47a0-11ed-aedd-7cd30abc95d8
1b30d0ff-47a0-11ed-aedd-7cd30abc95d8
1b30d0ff-47a0-11ed-aedd-7cd30abc95d8
1b30d0ff-47a0-11ed-aedd-7cd30abc95d8
1b30d0ff-47a0-11ed-aedd-7cd30abc95d8
1b30d0ff-47a0-11ed-aedd-7cd30abc95d8
1b30d0ff-47a0-11ed-aedd-7cd30abc95d8
1b30d0ff-47a0-11ed-aedd-7cd30abc95d8
1b30d0ff-47a0-11ed-aedd-7cd30abc95d8
1b30d0ff-47a0-11ed-aedd-7cd30abc95d8
1b30d0ff-47a0-11ed-aedd-7cd30abc95d8
1b30d0ff-47a0-11ed-aedd-7cd30abc95d8
1b30d0ff-47a0-11ed-aedd-7cd30abc95d8
1b30d0ff-47a0-11ed-aedd-7cd30abc95d8
1b30d0ff-47a0-11ed-aedd-7cd30abc95d8
1b30d0ff-47a0-11ed-aedd-7cd30abc95d8
1b30d0ff-47a0-11ed-aedd-7cd30abc95d8
1b30d0ff-47a0-11ed-aedd-7cd30abc95d8
1b30d0ff-47a0-11ed-aedd-7cd30abc95d8
1b30d0ff-47a0-11ed-aedd-7cd30abc95d8
1b30d0ff-47a0-11ed-aedd-7cd30abc95d8
1b30d0ff-47a0-11ed-aedd-7cd30abc95d8
1b30d0ff-47a0-11ed-aedd-7cd30abc95d8
1b30d0ff-47a0-11ed-aedd-7cd30abc95d8
1b30d0ff-47a0-11ed-aedd-7cd30abc95d8
1b30d0ff-47a0-11ed-aedd-7cd30abc95d8
1b30d0ff-47a0-11ed-aedd-7cd30abc95d8
1b30d0ff-47a0-11ed-aedd-7cd30abc95d8
1b30d0ff-47a0-11ed-aedd-7cd30abc95d8
1b30d0ff-47a0-11ed-aedd-7cd30abc95d8
1b30d0ff-47a0-11ed-aedd-7cd30abc95d8
1b30d0ff-47a0-11ed-aedd-7cd30abc95d8
1b30d0ff-47a0-11ed-aedd-7cd30abc95d8
1b30d0ff-47a0-11ed-aedd-7cd30abc95d8
1b30d0ff-47a0-11ed-aedd-7cd30abc95d8
1b30d0ff-47a0-11ed-aedd-7cd30abc95d8
1b30d0ff-47a0-11ed-aedd-7cd30abc95d8
1b30d0ff-47a0-11ed-aedd-7cd30abc95d8
1b30d0ff-47a0-11ed-aedd-7cd30abc95d8
1b30d0ff-47a0-11ed-aedd-7cd30abc95d8
1b30d0ff-47a0-11ed-aedd-7cd30abc95d8
1b30d0ff-47a0-11ed-aedd-7cd30abc95d8
1b30d0ff-47a0-11ed-aedd-7cd30abc95d8
1b30d0ff-47a0-11ed-aedd-7cd30abc95d8
1b30d0ff-47a0-11ed-aedd-7cd30abc95d8
1b30d0ff-47a0-11ed-aedd-7cd30abc95d8
1b30d0ff-47a0-11ed-aedd-7cd30abc95d8
1b30d0ff-47a0-11ed-aedd-7cd30abc95d8
1b30d0ff-47a0-11ed-aedd-7cd30abc95d8
1b30d0ff-47a0-11ed-aedd-7cd30abc95d8
1b30d0ff-47a0-11ed-aedd-7cd30abc95d8
1b30d0ff-47a0-11ed-aedd-7cd30abc95d8
1b30d0ff-47a0-11ed-aedd-7cd30abc95d8
1b30d0ff-47a0-11ed-aedd-7cd30abc95d8
1b30d0ff-47a0-11ed-aedd-7cd30abc95d8
1b30d0ff-47a0-11ed-aedd-7cd30abc95d8
1b30d0ff-47a0-11ed-aedd-7cd30abc95d8
1b30d0ff-47a0-11ed-aedd-7cd30abc95d8
1b30d0ff-47a0-11ed-aedd-7cd30abc95d8
1b30d0ff-47a0-11ed-aedd-7cd30abc95d8
1b30d0ff-47a0-11ed-aedd-7cd30abc95d8
1b30d0ff-47a0-11ed-aedd-7cd30abc95d8
1b30d0ff-47a0-11ed-aedd-7cd30abc95d8
1b30d0ff-47a0-11ed-aedd-7cd30abc95d8
1b30d0ff-47a0-11ed-aedd-7cd30abc95d8
1b30d0ff-47a0-11ed-aedd-7cd30abc95d8
1b30d0ff-47a0-11ed-aedd-7cd30abc95d8
1b30d0ff-47a0-11ed-aedd-7cd30abc95d8
1b30d0ff-47a0-11ed-aedd-7cd30abc95d8
1b30d0ff-47a0-11ed-aedd-7cd30abc95d8
1b30d0ff-47a0-11ed-aedd-7cd30abc95d8
1b30d0ff-47a0-11ed-aedd-7cd30abc95d8
1b30d0ff-47a0-11ed-aedd-7cd30abc95d8
1b30d0ff-47a0-11ed-aedd-7cd30abc95d8
1b30d0ff-47a0-11ed-aedd-7cd30abc95d8
1b30d0ff-47a0-11ed-aedd-7cd30abc95d8
1b30d0ff-47a0-11ed-aedd-7cd30abc95d8
1b30d0ff-47a0-11ed-aedd-7cd30abc95d8
1b30d0ff-47a0-11ed-aedd-7cd30abc95d8
1b30d0ff-47a0-11ed-aedd-7cd30abc95d8
1b30d0ff-47a0-11ed-aedd-7cd30abc95d8
1b30d0ff-47a0-11ed-aedd-7cd30abc95d8
1b30d0ff-47a0-11ed-aedd-7cd30abc95d8
1b30d0ff-47a0-11ed-aedd-7cd30abc95d8
1b30d0ff-47a0-11ed-aedd-7cd30abc95d8
1b30d0ff-47a0-11ed-aedd-7cd30abc95d8
1b30d0ff-47a0-11ed-aedd-7cd30abc95d8
1b30d0ff-47a0-11ed-aedd-7cd30abc95d8
1b30d0ff-47a0-11ed-aedd-7cd30abc95d8
1b30d0ff-47a0-11ed-aedd-7cd30abc95d8
1b30d0ff-47a0-11ed-aedd-7cd30abc95d8
1b30d0ff-47a0-11ed-aedd-7cd30abc95d8
1b30d0ff-47a0-11ed-aedd-7cd30abc95d8
1b30d0ff-47a0-11ed-aedd-7cd30abc95d8
1b30d0ff-47a0-11ed-aedd-7cd30abc95d8
1b30d0ff-47a0-11ed-aedd-7cd30abc95d8
1b30d0ff-47a0-11ed-aedd-7cd30abc95d8
1b30d0ff-47a0-11ed-aedd-7cd30abc95d8
1b30d0ff-47a0-11ed-aedd-7cd30abc95d8
1b30d0ff-47a0-11ed-aedd-7cd30abc95d8
1b30d0ff-47a0-11ed-aedd-7cd30abc95d8
1b30d0ff-47a0-11ed-aedd-7cd30abc95d8
1b30d0ff-47a0-11ed-aedd-7cd30abc95d8
1b30d0ff-47a0-11ed-aedd-7cd30abc95d8
1b30d0ff-47a0-11ed-aedd-7cd30abc95d8
1b30d0ff-47a0-11ed-aedd-7cd30abc95d8
1b30d0ff-47a0-11ed-aedd-7cd30abc95d8
1b30d0ff-47a0-11ed-aedd-7cd30abc95d8
1b30d0ff-47a0-11ed-aedd-7cd30abc95d8
1b30d0ff-47a0-11ed-aedd-7cd30abc95d8
1b30d0ff-47a0-11ed-aedd-7cd30abc95d8
1b30d0ff-47a0-11ed-aedd-7cd30abc95d8
1b30d0ff-47a0-11ed-aedd-7cd30abc95d8
1b30d0ff-47a0-11ed-aedd-7cd30abc95d8
1b30d0ff-47a0-11ed-aedd-7cd30abc95d8
1b30d0ff-47a0-11ed-aedd-7cd30abc95d8
1b30d0ff-47a0-11ed-aedd-7cd30abc95d8
1b30d0ff-47a0-11ed-aedd-7cd30abc95d8
1b30d0ff-47a0-11ed-aedd-7cd30abc95d8
1b30d0ff-47a0-11ed-aedd-7cd30abc95d8
1b30d0ff-47a0-11ed-aedd-7cd30abc95d8
1b30d0ff-47a0-11ed-aedd-7cd30abc95d8
1b30d0ff-47a0-11ed-aedd-7cd30abc95d8
1b30d0ff-47a0-11ed-aedd-7cd30abc95d8
1b30d0ff-47a0-11ed-aedd-7cd30abc95d8
1b30d0ff-47a0-11ed-aedd-7cd30abc95d8
1b30d0ff-47a0-11ed-aedd-7cd30abc95d8
1b30d0ff-47a0-11ed-aedd-7cd30abc95d8
1b30d0ff-47a0-11ed-aedd-7cd30abc95d8
1b30d0ff-47a0-11ed-aedd-7cd30abc95d8
1b30d0ff-47a0-11ed-aedd-7cd30abc95d8
1b30d0ff-47a0-11ed-aedd-7cd30abc95d8
1b30d0ff-47a0-11ed-aedd-7cd30abc95d8
1b30d0ff-47a0-11ed-aedd-7cd30abc95d8
1b30d0ff-47a0-11ed-aedd-7cd30abc95d8
1b30d0ff-47a0-11ed-aedd-7cd30abc95d8
1b30d0ff-47a0-11ed-aedd-7cd30abc95d8
1b30d0ff-47a0-11ed-aedd-7cd30abc95d8
1b30d0ff-47a0-11ed-aedd-7cd30abc95d8
1b30d0ff-47a0-11ed-aedd-7cd30abc95d8
1b30d0ff-47a0-11ed-aedd-7cd30abc95d8
1b30d0ff-47a0-11ed-aedd-7cd30abc95d8
1b30d0ff-47a0-11ed-aedd-7cd30abc95d8
1b30d0ff-47a0-11ed-aedd-7cd30abc95d8
1b30d0ff-47a0-11ed-aedd-7cd30abc95d8
1b30d0ff-47a0-11ed-aedd-7cd30abc95d8
1b30d0ff-47a0-11ed-aedd-7cd30abc95d8
1b30d0ff-47a0-11ed-aedd-7cd30abc95d8
1b30d0ff-47a0-11ed-aedd-7cd30abc95d8
1b30d0ff-47a0-11ed-aedd-7cd30abc95d8
1b30d0ff-47a0-11ed-aedd-7cd30abc95d8
1b30d0ff-47a0-11ed-aedd-7cd30abc95d8
1b30d0ff-47a0-11ed-aedd-7cd30abc95d8
1b30d0ff-47a0-11ed-aedd-7cd30abc95d8
1b30d0ff-47a0-11ed-aedd-7cd30abc95d8
1b30d0ff-47a0-11ed-aedd-7cd30abc95d8
1b30d0ff-47a0-11ed-aedd-7cd30abc95d8
1b30d0ff-47a0-11ed-aedd-7cd30abc95d8
1b30d0ff-47a0-11ed-aedd-7cd30abc95d8
1b30d0ff-47a0-11ed-aedd-7cd30abc95d8
1b30d0ff-47a0-11ed-aedd-7cd30abc95d8
1b30d0ff-47a0-11ed-aedd-7cd30abc95d8
1b30d0ff-47a0-11ed-aedd-7cd30abc95d8
1b30d0ff-47a0-11ed-aedd-7cd30abc95d8
1b30d0ff-47a0-11ed-aedd-7cd30abc95d8
1b30d0ff-47a0-11ed-aedd-7cd30abc95d8
1b30d0ff-47a0-11ed-aedd-7cd30abc95d8
1b30d0ff-47a0-11ed-aedd-7cd30abc95d8
1b30d0ff-47a0-11ed-aedd-7cd30abc95d8
1b30d0ff-47a0-11ed-aedd-7cd30abc95d8
1b30d0ff-47a0-11ed-aedd-7cd30abc95d8
1b30d0ff-47a0-11ed-aedd-7cd30abc95d8
1b30d0ff-47a0-11ed-aedd-7cd30abc95d8
1b30d0ff-47a0-11ed-aedd-7cd30abc95d8
1b30d0ff-47a0-11ed-aedd-7cd30abc95d8
1b30d0ff-47a0-11ed-aedd-7cd30abc95d8
1b30d0ff-47a0-11ed-aedd-7cd30abc95d8
1b30d0ff-47a0-11ed-aedd-7cd30abc95d8
1b30d0ff-47a0-11ed-aedd-7cd30abc95d8
1b30d0ff-47a0-11ed-aedd-7cd30abc95d8
1b30d0ff-47a0-11ed-aedd-7cd30abc95d8
1b30d0ff-47a0-11ed-aedd-7cd30abc95d8
1b30d0ff-47a0-11ed-aedd-7cd30abc95d8
1b30d0ff-47a0-11ed-aedd-7cd30abc95d8
1b30d0ff-47a0-11ed-aedd-7cd30abc95d8
1b30d0ff-47a0-11ed-aedd-7cd30abc95d8
1b30d0ff-47a0-11ed-aedd-7cd30abc95d8
1b30d0ff-47a0-11ed-aedd-7cd30abc95d8
1b30d0ff-47a0-11ed-aedd-7cd30abc95d8
1b30d0ff-47a0-11ed-aedd-7cd30abc95d8
1b30d0ff-47a0-11ed-aedd-7cd30abc95d8
1b30d0ff-47a0-11ed-aedd-7cd30abc95d8
1b30d0ff-47a0-11ed-aedd-7cd30abc95d8
1b30d0ff-47a0-11ed-aedd-7cd30abc95d8
1b30d0ff-47a0-11ed-aedd-7cd30abc95d8
1b30d0ff-47a0-11ed-aedd-7cd30abc95d8
1b30d0ff-47a0-11ed-aedd-7cd30abc95d8
1b30d0ff-47a0-11ed-aedd-7cd30abc95d8
1b30d0ff-47a0-11ed-aedd-7cd30abc95d8
1b30d0ff-47a0-11ed-aedd-7cd30abc95d8
1b30d0ff-47a0-11ed-aedd-7cd30abc95d8
1b30d0ff-47a0-11ed-aedd-7cd30abc95d8
1b30d0ff-47a0-11ed-aedd-7cd30abc95d8
1b30d0ff-47a0-11ed-aedd-7cd30abc95d8
1b30d0ff-47a0-11ed-aedd-7cd30abc95d8
1b30d0ff-47a0-11ed-aedd-7cd30abc95d8
1b30d0ff-47a0-11ed-aedd-7cd30abc95d8
1b30d0ff-47a0-11ed-aedd-7cd30abc95d8
1b30d0ff-47a0-11ed-aedd-7cd30abc95d8
1b30d0ff-47a0-11ed-aedd-7cd30abc95d8
1b30d0ff-47a0-11ed-aedd-7cd30abc95d8
1b30d0ff-47a0-11ed-aedd-7cd30abc95d8
1b30d0ff-47a0-11ed-aedd-7cd30abc95d8
1b30d0ff-47a0-11ed-aedd-7cd30abc95d8
1b30d0ff-47a0-11ed-aedd-7cd30abc95d8
1b30d0ff-47a0-11ed-aedd-7cd30abc95d8
1b30d0ff-47a0-11ed-aedd-7cd30abc95d8
1b30d0ff-47a0-11ed-aedd-7cd30abc95d8
1b30d0ff-47a0-11ed-aedd-7cd30abc95d8
1b30d0ff-47a0-11ed-aedd-7cd30abc95d8
1b30d0ff-47a0-11ed-aedd-7cd30abc95d8
1b30d0ff-47a0-11ed-aedd-7cd30abc95d8
1b30d0ff-47a0-11ed-aedd-7cd30abc95d8
1b30d0ff-47a0-11ed-aedd-7cd30abc95d8
1b30d0ff-47a0-11ed-aedd-7cd30abc95d8
1b30d0ff-47a0-11ed-aedd-7cd30abc95d8
1b30d0ff-47a0-11ed-aedd-7cd30abc95d8
1b30d0ff-47a0-11ed-aedd-7cd30abc95d8
1b30d0ff-47a0-11ed-aedd-7cd30abc95d8
1b30d0ff-47a0-11ed-aedd-7cd30abc95d8
1b30d0ff-47a0-11ed-aedd-7cd30abc95d8
1b30d0ff-47a0-11ed-aedd-7cd30abc95d8
1b30d0ff-47a0-11ed-aedd-7cd30abc95d8
1b30d0ff-47a0-11ed-aedd-7cd30abc95d8
1b30d0ff-47a0-11ed-aedd-7cd30abc95d8
1b30d0ff-47a0-11ed-aedd-7cd30abc95d8
1b30d0ff-47a0-11ed-aedd-7cd30abc95d8
1b30d0ff-47a0-11ed-aedd-7cd30abc95d8
1b30d0ff-47a0-11ed-aedd-7cd30abc95d8
1b30d0ff-47a0-11ed-aedd-7cd30abc95d8
1b30d0ff-47a0-11ed-aedd-7cd30abc95d8
1b30d0ff-47a0-11ed-aedd-7cd30abc95d8
1b30d0ff-47a0-11ed-aedd-7cd30abc95d8
1b30d0ff-47a0-11ed-aedd-7cd30abc95d8
1b30d0ff-47a0-11ed-aedd-7cd30abc95d8
1b30d0ff-47a0-11ed-aedd-7cd30abc95d8
1b30d0ff-47a0-11ed-aedd-7cd30abc95d8
1b30d0ff-47a0-11ed-aedd-7cd30abc95d8
1b30d0ff-47a0-11ed-aedd-7cd30abc95d8
1b30d0ff-47a0-11ed-aedd-7cd30abc95d8
1b30d0ff-47a0-11ed-aedd-7cd30abc95d8
1b30d0ff-47a0-11ed-aedd-7cd30abc95d8
1b30d0ff-47a0-11ed-aedd-7cd30abc95d8
1b30d0ff-47a0-11ed-aedd-7cd30abc95d8
1b30d0ff-47a0-11ed-aedd-7cd30abc95d8
1b30d0ff-47a0-11ed-aedd-7cd30abc95d8
1b30d0ff-47a0-11ed-aedd-7cd30abc95d8
1b30d0ff-47a0-11ed-aedd-7cd30abc95d8
1b30d0ff-47a0-11ed-aedd-7cd30abc95d8
1b30d0ff-47a0-11ed-aedd-7cd30abc95d8
1b30d0ff-47a0-11ed-aedd-7cd30abc95d8
1b30d0ff-47a0-11ed-aedd-7cd30abc95d8
1b30d0ff-47a0-11ed-aedd-7cd30abc95d8
1b30d0ff-47a0-11ed-aedd-7cd30abc95d8
1b30d0ff-47a0-11ed-aedd-7cd30abc95d8
1b30d0ff-47a0-11ed-aedd-7cd30abc95d8
1b30d0ff-47a0-11ed-aedd-7cd30abc95d8
1b30d0ff-47a0-11ed-aedd-7cd30abc95d8
1b30d0ff-47a0-11ed-aedd-7cd30abc95d8
1b30d0ff-47a0-11ed-aedd-7cd30abc95d8
1b30d0ff-47a0-11ed-aedd-7cd30abc95d8
1b30d0ff-47a0-11ed-aedd-7cd30abc95d8
1b30d0ff-47a0-11ed-aedd-7cd30abc95d8
1b30d0ff-47a0-11ed-aedd-7cd30abc95d8
1b30d0ff-47a0-11ed-aedd-7cd30abc95d8
1b30d0ff-47a0-11ed-aedd-7cd30abc95d8
1b30d0ff-47a0-11ed-aedd-7cd30abc95d8
1b30d0ff-47a0-11ed-aedd-7cd30abc95d8
1b30d0ff-47a0-11ed-aedd-7cd30abc95d8
1b30d0ff-47a0-11ed-aedd-7cd30abc95d8
1b30d0ff-47a0-11ed-aedd-7cd30abc95d8
1b30d0ff-47a0-11ed-aedd-7cd30abc95d8
1b30d0ff-47a0-11ed-aedd-7cd30abc95d8
1b30d0ff-47a0-11ed-aedd-7cd30abc95d8
1b30d0ff-47a0-11ed-aedd-7cd30abc95d8
1b30d0ff-47a0-11ed-aedd-7cd30abc95d8
1b30d0ff-47a0-11ed-aedd-7cd30abc95d8
1b30d0ff-47a0-11ed-aedd-7cd30abc95d8
1b30d0ff-47a0-11ed-aedd-7cd30abc95d8
1b30d0ff-47a0-11ed-aedd-7cd30abc95d8
1b30d0ff-47a0-11ed-aedd-7cd30abc95d8
1b30d0ff-47a0-11ed-aedd-7cd30abc95d8
1b30d0ff-47a0-11ed-aedd-7cd30abc95d8
1b30d0ff-47a0-11ed-aedd-7cd30abc95d8
1b30d0ff-47a0-11ed-aedd-7cd30abc95d8
1b30d0ff-47a0-11ed-aedd-7cd30abc95d8
1b30d0ff-47a0-11ed-aedd-7cd30abc95d8
1b30d0ff-47a0-11ed-aedd-7cd30abc95d8
1b30d0ff-47a0-11ed-aedd-7cd30abc95d8
1b30d0ff-47a0-11ed-aedd-7cd30abc95d8
1b30d0ff-47a0-11ed-aedd-7cd30abc95d8
1b30d0ff-47a0-11ed-aedd-7cd30abc95d8
1b30d0ff-47a0-11ed-aedd-7cd30abc95d8
1b30d0ff-47a0-11ed-aedd-7cd30abc95d8
1b30d0ff-47a0-11ed-aedd-7cd30abc95d8
1b30d0ff-47a0-11ed-aedd-7cd30abc95d8
1b30d0ff-47a0-11ed-aedd-7cd30abc95d8
1b30d0ff-47a0-11ed-aedd-7cd30abc95d8
1b30d0ff-47a0-11ed-aedd-7cd30abc95d8
1b30d0ff-47a0-11ed-aedd-7cd30abc95d8
1b30d0ff-47a0-11ed-aedd-7cd30abc95d8
1b30d0ff-47a0-11ed-aedd-7cd30abc95d8
1b30d0ff-47a0-11ed-aedd-7cd30abc95d8
1b30d0ff-47a0-11ed-aedd-7cd30abc95d8
1b30d0ff-47a0-11ed-aedd-7cd30abc95d8
1b30d0ff-47a0-11ed-aedd-7cd30abc95d8
1b30d0ff-47a0-11ed-aedd-7cd30abc95d8
1b30d0ff-47a0-11ed-aedd-7cd30abc95d8
1b30d0ff-47a0-11ed-aedd-7cd30abc95d8
1b30d0ff-47a0-11ed-aedd-7cd30abc95d8
1b30d0ff-47a0-11ed-aedd-7cd30abc95d8
1b30d0ff-47a0-11ed-aedd-7cd30abc95d8
1b30d0ff-47a0-11ed-aedd-7cd30abc95d8
1b30d0ff-47a0-11ed-aedd-7cd30abc95d8
1b30d0ff-47a0-11ed-aedd-7cd30abc95d8
1b30d0ff-47a0-11ed-aedd-7cd30abc95d8
1b30d0ff-47a0-11ed-aedd-7cd30abc95d8
1b30d0ff-47a0-11ed-aedd-7cd30abc95d8
1b30d0ff-47a0-11ed-aedd-7cd30abc95d8
1b30d0ff-47a0-11ed-aedd-7cd30abc95d8
1b30d0ff-47a0-11ed-aedd-7cd30abc95d8
1b30d0ff-47a0-11ed-aedd-7cd30abc95d8
1b30d0ff-47a0-11ed-aedd-7cd30abc95d8
1b30d0ff-47a0-11ed-aedd-7cd30abc95d8
1b30d0ff-47a0-11ed-aedd-7cd30abc95d8
1b30d0ff-47a0-11ed-aedd-7cd30abc95d8
1b30d0ff-47a0-11ed-aedd-7cd30abc95d8
1b30d0ff-47a0-11ed-aedd-7cd30abc95d8
1b30d0ff-47a0-11ed-aedd-7cd30abc95d8
1b30d0ff-47a0-11ed-aedd-7cd30abc95d8
1b30d0ff-47a0-11ed-aedd-7cd30abc95d8
1b30d0ff-47a0-11ed-aedd-7cd30abc95d8
1b30d0ff-47a0-11ed-aedd-7cd30abc95d8
1b30d0ff-47a0-11ed-aedd-7cd30abc95d8
1b30d0ff-47a0-11ed-aedd-7cd30abc95d8
1b30d0ff-47a0-11ed-aedd-7cd30abc95d8
1b30d0ff-47a0-11ed-aedd-7cd30abc95d8
1b30d0ff-47a0-11ed-aedd-7cd30abc95d8
1b30d0ff-47a0-11ed-aedd-7cd30abc95d8
1b30d0ff-47a0-11ed-aedd-7cd30abc95d8
1b30d0ff-47a0-11ed-aedd-7cd30abc95d8
1b30d0ff-47a0-11ed-aedd-7cd30abc95d8
1b30d0ff-47a0-11ed-aedd-7cd30abc95d8
1b30d0ff-47a0-11ed-aedd-7cd30abc95d8
1b30d0ff-47a0-11ed-aedd-7cd30abc95d8
1b30d0ff-47a0-11ed-aedd-7cd30abc95d8
1b30d0ff-47a0-11ed-aedd-7cd30abc95d8
1b30d0ff-47a0-11ed-aedd-7cd30abc95d8
1b30d0ff-47a0-11ed-aedd-7cd30abc95d8
1b30d0ff-47a0-11ed-aedd-7cd30abc95d8
1b30d0ff-47a0-11ed-aedd-7cd30abc95d8
1b30d0ff-47a0-11ed-aedd-7cd30abc95d8
1b30d0ff-47a0-11ed-aedd-7cd30abc95d8
1b30d0ff-47a0-11ed-aedd-7cd30abc95d8
1b30d0ff-47a0-11ed-aedd-7cd30abc95d8
1b30d0ff-47a0-11ed-aedd-7cd30abc95d8
1b30d0ff-47a0-11ed-aedd-7cd30abc95d8
1b30d0ff-47a0-11ed-aedd-7cd30abc95d8
1b30d0ff-47a0-11ed-aedd-7cd30abc95d8
1b30d0ff-47a0-11ed-aedd-7cd30abc95d8
1b30d0ff-47a0-11ed-aedd-7cd30abc95d8
1b30d0ff-47a0-11ed-aedd-7cd30abc95d8
1b30d0ff-47a0-11ed-aedd-7cd30abc95d8
1b30d0ff-47a0-11ed-aedd-7cd30abc95d8
1b30d0ff-47a0-11ed-aedd-7cd30abc95d8
1b30d0ff-47a0-11ed-aedd-7cd30abc95d8
1b30d0ff-47a0-11ed-aedd-7cd30abc95d8
1b30d0ff-47a0-11ed-aedd-7cd30abc95d8
1b30d0ff-47a0-11ed-aedd-7cd30abc95d8
1b30d0ff-47a0-11ed-aedd-7cd30abc95d8
1b30d0ff-47a0-11ed-aedd-7cd30abc95d8
1b30d0ff-47a0-11ed-aedd-7cd30abc95d8
1b30d0ff-47a0-11ed-aedd-7cd30abc95d8
1b30d0ff-47a0-11ed-aedd-7cd30abc95d8
1b30d0ff-47a0-11ed-aedd-7cd30abc95d8
1b30d0ff-47a0-11ed-aedd-7cd30abc95d8
1b30d0ff-47a0-11ed-aedd-7cd30abc95d8
1b30d0ff-47a0-11ed-aedd-7cd30abc95d8
1b30d0ff-47a0-11ed-aedd-7cd30abc95d8
1b30d0ff-47a0-11ed-aedd-7cd30abc95d8
1b30d0ff-47a0-11ed-aedd-7cd30abc95d8
1b30d0ff-47a0-11ed-aedd-7cd30abc95d8
1b30d0ff-47a0-11ed-aedd-7cd30abc95d8
1b30d0ff-47a0-11ed-aedd-7cd30abc95d8
1b30d0ff-47a0-11ed-aedd-7cd30abc95d8
1b30d0ff-47a0-11ed-aedd-7cd30abc95d8
1b30d0ff-47a0-11ed-aedd-7cd30abc95d8
1b30d0ff-47a0-11ed-aedd-7cd30abc95d8
1b30d0ff-47a0-11ed-aedd-7cd30abc95d8
1b30d0ff-47a0-11ed-aedd-7cd30abc95d8
1b30d0ff-47a0-11ed-aedd-7cd30abc95d8
1b30d0ff-47a0-11ed-aedd-7cd30abc95d8
1b30d0ff-47a0-11ed-aedd-7cd30abc95d8
1b30d0ff-47a0-11ed-aedd-7cd30abc95d8
1b30d0ff-47a0-11ed-aedd-7cd30abc95d8
1b30d0ff-47a0-11ed-aedd-7cd30abc95d8
1b30d0ff-47a0-11ed-aedd-7cd30abc95d8
1b30d0ff-47a0-11ed-aedd-7cd30abc95d8
1b30d0ff-47a0-11ed-aedd-7cd30abc95d8
1b30d0ff-47a0-11ed-aedd-7cd30abc95d8
1b30d0ff-47a0-11ed-aedd-7cd30abc95d8
1b30d0ff-47a0-11ed-aedd-7cd30abc95d8
1b30d0ff-47a0-11ed-aedd-7cd30abc95d8
1b30d0ff-47a0-11ed-aedd-7cd30abc95d8
1b30d0ff-47a0-11ed-aedd-7cd30abc95d8
1b30d0ff-47a0-11ed-aedd-7cd30abc95d8
1b30d0ff-47a0-11ed-aedd-7cd30abc95d8
1b30d0ff-47a0-11ed-aedd-7cd30abc95d8
1b30d0ff-47a0-11ed-aedd-7cd30abc95d8
1b30d0ff-47a0-11ed-aedd-7cd30abc95d8
1b30d0ff-47a0-11ed-aedd-7cd30abc95d8
1b30d0ff-47a0-11ed-aedd-7cd30abc95d8
1b30d0ff-47a0-11ed-aedd-7cd30abc95d8
1b30d0ff-47a0-11ed-aedd-7cd30abc95d8
1b30d0ff-47a0-11ed-aedd-7cd30abc95d8
1b30d0ff-47a0-11ed-aedd-7cd30abc95d8
1b30d0ff-47a0-11ed-aedd-7cd30abc95d8
1b30d0ff-47a0-11ed-aedd-7cd30abc95d8
1b30d0ff-47a0-11ed-aedd-7cd30abc95d8
1b30d0ff-47a0-11ed-aedd-7cd30abc95d8
1b30d0ff-47a0-11ed-aedd-7cd30abc95d8
1b30d0ff-47a0-11ed-aedd-7cd30abc95d8
1b30d0ff-47a0-11ed-aedd-7cd30abc95d8
1b30d0ff-47a0-11ed-aedd-7cd30abc95d8
1b30d0ff-47a0-11ed-aedd-7cd30abc95d8
1b30d0ff-47a0-11ed-aedd-7cd30abc95d8
1b30d0ff-47a0-11ed-aedd-7cd30abc95d8
1b30d0ff-47a0-11ed-aedd-7cd30abc95d8
1b30d0ff-47a0-11ed-aedd-7cd30abc95d8
1b30d0ff-47a0-11ed-aedd-7cd30abc95d8
1b30d0ff-47a0-11ed-aedd-7cd30abc95d8
1b30d0ff-47a0-11ed-aedd-7cd30abc95d8
1b30d0ff-47a0-11ed-aedd-7cd30abc95d8
1b30d0ff-47a0-11ed-aedd-7cd30abc95d8
1b30d0ff-47a0-11ed-aedd-7cd30abc95d8
1b30d0ff-47a0-11ed-aedd-7cd30abc95d8
1b30d0ff-47a0-11ed-aedd-7cd30abc95d8
1b30d0ff-47a0-11ed-aedd-7cd30abc95d8
1b30d0ff-47a0-11ed-aedd-7cd30abc95d8
1b30d0ff-47a0-11ed-aedd-7cd30abc95d8
1b30d0ff-47a0-11ed-aedd-7cd30abc95d8
1b30d0ff-47a0-11ed-aedd-7cd30abc95d8
1b30d0ff-47a0-11ed-aedd-7cd30abc95d8
1b30d0ff-47a0-11ed-aedd-7cd30abc95d8
1b30d0ff-47a0-11ed-aedd-7cd30abc95d8
1b30d0ff-47a0-11ed-aedd-7cd30abc95d8
1b30d0ff-47a0-11ed-aedd-7cd30abc95d8
1b30d0ff-47a0-11ed-aedd-7cd30abc95d8
1b30d0ff-47a0-11ed-aedd-7cd30abc95d8
1b30d0ff-47a0-11ed-aedd-7cd30abc95d8
1b30d0ff-47a0-11ed-aedd-7cd30abc95d8
1b30d0ff-47a0-11ed-aedd-7cd30abc95d8
1b30d0ff-47a0-11ed-aedd-7cd30abc95d8
1b30d0ff-47a0-11ed-aedd-7cd30abc95d8
1b30d0ff-47a0-11ed-aedd-7cd30abc95d8
1b30d0ff-47a0-11ed-aedd-7cd30abc95d8
1b30d0ff-47a0-11ed-aedd-7cd30abc95d8
1b30d0ff-47a0-11ed-aedd-7cd30abc95d8
1b30d0ff-47a0-11ed-aedd-7cd30abc95d8
1b30d0ff-47a0-11ed-aedd-7cd30abc95d8
1b30d0ff-47a0-11ed-aedd-7cd30abc95d8
1b30d0ff-47a0-11ed-aedd-7cd30abc95d8
1b30d0ff-47a0-11ed-aedd-7cd30abc95d8
1b30d0ff-47a0-11ed-aedd-7cd30abc95d8
1b30d0ff-47a0-11ed-aedd-7cd30abc95d8
1b30d0ff-47a0-11ed-aedd-7cd30abc95d8
1b30d0ff-47a0-11ed-aedd-7cd30abc95d8
1b30d0ff-47a0-11ed-aedd-7cd30abc95d8
1b30d0ff-47a0-11ed-aedd-7cd30abc95d8
1b30d0ff-47a0-11ed-aedd-7cd30abc95d8
1b30d0ff-47a0-11ed-aedd-7cd30abc95d8
1b30d0ff-47a0-11ed-aedd-7cd30abc95d8
1b30d0ff-47a0-11ed-aedd-7cd30abc95d8
1b30d0ff-47a0-11ed-aedd-7cd30abc95d8
1b30d0ff-47a0-11ed-aedd-7cd30abc95d8
1b30d0ff-47a0-11ed-aedd-7cd30abc95d8
1b30d0ff-47a0-11ed-aedd-7cd30abc95d8
1b30d0ff-47a0-11ed-aedd-7cd30abc95d8
1b30d0ff-47a0-11ed-aedd-7cd30abc95d8
1b30d0ff-47a0-11ed-aedd-7cd30abc95d8
1b30d0ff-47a0-11ed-aedd-7cd30abc95d8
1b30d0ff-47a0-11ed-aedd-7cd30abc95d8
1b30d0ff-47a0-11ed-aedd-7cd30abc95d8
1b30d0ff-47a0-11ed-aedd-7cd30abc95d8
1b30d0ff-47a0-11ed-aedd-7cd30abc95d8
1b30d0ff-47a0-11ed-aedd-7cd30abc95d8
1b30d0ff-47a0-11ed-aedd-7cd30abc95d8
1b30d0ff-47a0-11ed-aedd-7cd30abc95d8
1b30d0ff-47a0-11ed-aedd-7cd30abc95d8
1b30d0ff-47a0-11ed-aedd-7cd30abc95d8
1b30d0ff-47a0-11ed-aedd-7cd30abc95d8
1b30d0ff-47a0-11ed-aedd-7cd30abc95d8
1b30d0ff-47a0-11ed-aedd-7cd30abc95d8
1b30d0ff-47a0-11ed-aedd-7cd30abc95d8
1b30d0ff-47a0-11ed-aedd-7cd30abc95d8
1b30d0ff-47a0-11ed-aedd-7cd30abc95d8
1b30d0ff-47a0-11ed-aedd-7cd30abc95d8
1b30d0ff-47a0-11ed-aedd-7cd30abc95d8
1b30d0ff-47a0-11ed-aedd-7cd30abc95d8
1b30d0ff-47a0-11ed-aedd-7cd30abc95d8
1b30d0ff-47a0-11ed-aedd-7cd30abc95d8
1b30d0ff-47a0-11ed-aedd-7cd30abc95d8
1b30d0ff-47a0-11ed-aedd-7cd30abc95d8
1b30d0ff-47a0-11ed-aedd-7cd30abc95d8
1b30d0ff-47a0-11ed-aedd-7cd30abc95d8
1b30d0ff-47a0-11ed-aedd-7cd30abc95d8
1b30d0ff-47a0-11ed-aedd-7cd30abc95d8
1b30d0ff-47a0-11ed-aedd-7cd30abc95d8
1b30d0ff-47a0-11ed-aedd-7cd30abc95d8
1b30d0ff-47a0-11ed-aedd-7cd30abc95d8
1b30d0ff-47a0-11ed-aedd-7cd30abc95d8
1b30d0ff-47a0-11ed-aedd-7cd30abc95d8
1b30d0ff-47a0-11ed-aedd-7cd30abc95d8
1b30d0ff-47a0-11ed-aedd-7cd30abc95d8
1b30d0ff-47a0-11ed-aedd-7cd30abc95d8
1b30d0ff-47a0-11ed-aedd-7cd30abc95d8
1b30d0ff-47a0-11ed-aedd-7cd30abc95d8
1b30d0ff-47a0-11ed-aedd-7cd30abc95d8
1b30d0ff-47a0-11ed-aedd-7cd30abc95d8
1b30d0ff-47a0-11ed-aedd-7cd30abc95d8
1b30d0ff-47a0-11ed-aedd-7cd30abc95d8
1b30d0ff-47a0-11ed-aedd-7cd30abc95d8
1b30d0ff-47a0-11ed-aedd-7cd30abc95d8
1b30d0ff-47a0-11ed-aedd-7cd30abc95d8
1b30d0ff-47a0-11ed-aedd-7cd30abc95d8
1b30d0ff-47a0-11ed-aedd-7cd30abc95d8
1b30d0ff-47a0-11ed-aedd-7cd30abc95d8
1b30d0ff-47a0-11ed-aedd-7cd30abc95d8
1b30d0ff-47a0-11ed-aedd-7cd30abc95d8
1b30d0ff-47a0-11ed-aedd-7cd30abc95d8
1b30d0ff-47a0-11ed-aedd-7cd30abc95d8
1b30d0ff-47a0-11ed-aedd-7cd30abc95d8
1b30d0ff-47a0-11ed-aedd-7cd30abc95d8
1b30d0ff-47a0-11ed-aedd-7cd30abc95d8
1b30d0ff-47a0-11ed-aedd-7cd30abc95d8
1b30d0ff-47a0-11ed-aedd-7cd30abc95d8
1b30d0ff-47a0-11ed-aedd-7cd30abc95d8
1b30d0ff-47a0-11ed-aedd-7cd30abc95d8
1b30d0ff-47a0-11ed-aedd-7cd30abc95d8
1b30d0ff-47a0-11ed-aedd-7cd30abc95d8
1b30d0ff-47a0-11ed-aedd-7cd30abc95d8
1b30d0ff-47a0-11ed-aedd-7cd30abc95d8
1b30d0ff-47a0-11ed-aedd-7cd30abc95d8
1b30d0ff-47a0-11ed-aedd-7cd30abc95d8
1b30d0ff-47a0-11ed-aedd-7cd30abc95d8
1b30d0ff-47a0-11ed-aedd-7cd30abc95d8
1b30d0ff-47a0-11ed-aedd-7cd30abc95d8
1b30d0ff-47a0-11ed-aedd-7cd30abc95d8
1b30d0ff-47a0-11ed-aedd-7cd30abc95d8
1b30d0ff-47a0-11ed-aedd-7cd30abc95d8
1b30d0ff-47a0-11ed-aedd-7cd30abc95d8
1b30d0ff-47a0-11ed-aedd-7cd30abc95d8
1b30d0ff-47a0-11ed-aedd-7cd30abc95d8
1b30d0ff-47a0-11ed-aedd-7cd30abc95d8
1b30d0ff-47a0-11ed-aedd-7cd30abc95d8
1b30d0ff-47a0-11ed-aedd-7cd30abc95d8
1b30d0ff-47a0-11ed-aedd-7cd30abc95d8
1b30d0ff-47a0-11ed-aedd-7cd30abc95d8
1b30d0ff-47a0-11ed-aedd-7cd30abc95d8
1b30d0ff-47a0-11ed-aedd-7cd30abc95d8
1b30d0ff-47a0-11ed-aedd-7cd30abc95d8
1b30d0ff-47a0-11ed-aedd-7cd30abc95d8
1b30d0ff-47a0-11ed-aedd-7cd30abc95d8
1b30d0ff-47a0-11ed-aedd-7cd30abc95d8
1b30d0ff-47a0-11ed-aedd-7cd30abc95d8
1b30d0ff-47a0-11ed-aedd-7cd30abc95d8
1b30d0ff-47a0-11ed-aedd-7cd30abc95d8
1b30d0ff-47a0-11ed-aedd-7cd30abc95d8
1b30d0ff-47a0-11ed-aedd-7cd30abc95d8
1b30d0ff-47a0-11ed-aedd-7cd30abc95d8
1b30d0ff-47a0-11ed-aedd-7cd30abc95d8
1b30d0ff-47a0-11ed-aedd-7cd30abc95d8
1b30d0ff-47a0-11ed-aedd-7cd30abc95d8
1b30d0ff-47a0-11ed-aedd-7cd30abc95d8
1b30d0ff-47a0-11ed-aedd-7cd30abc95d8
1b30d0ff-47a0-11ed-aedd-7cd30abc95d8
1b30d0ff-47a0-11ed-aedd-7cd30abc95d8
1b30d0ff-47a0-11ed-aedd-7cd30abc95d8
1b30d0ff-47a0-11ed-aedd-7cd30abc95d8
1b30d0ff-47a0-11ed-aedd-7cd30abc95d8
1b30d0ff-47a0-11ed-aedd-7cd30abc95d8
1b30d0ff-47a0-11ed-aedd-7cd30abc95d8
1b30d0ff-47a0-11ed-aedd-7cd30abc95d8
1b30d0ff-47a0-11ed-aedd-7cd30abc95d8
1b30d0ff-47a0-11ed-aedd-7cd30abc95d8
1b30d0ff-47a0-11ed-aedd-7cd30abc95d8
1b30d0ff-47a0-11ed-aedd-7cd30abc95d8
1b30d0ff-47a0-11ed-aedd-7cd30abc95d8
1b30d0ff-47a0-11ed-aedd-7cd30abc95d8
1b30d0ff-47a0-11ed-aedd-7cd30abc95d8
1b30d0ff-47a0-11ed-aedd-7cd30abc95d8
1b30d0ff-47a0-11ed-aedd-7cd30abc95d8
1b30d0ff-47a0-11ed-aedd-7cd30abc95d8
1b30d0ff-47a0-11ed-aedd-7cd30abc95d8
1b30d0ff-47a0-11ed-aedd-7cd30abc95d8
1b30d0ff-47a0-11ed-aedd-7cd30abc95d8
1b30d0ff-47a0-11ed-aedd-7cd30abc95d8
1b30d0ff-47a0-11ed-aedd-7cd30abc95d8
1b30d0ff-47a0-11ed-aedd-7cd30abc95d8
1b30d0ff-47a0-11ed-aedd-7cd30abc95d8
1b30d0ff-47a0-11ed-aedd-7cd30abc95d8
1b30d0ff-47a0-11ed-aedd-7cd30abc95d8
1b30d0ff-47a0-11ed-aedd-7cd30abc95d8
1b30d0ff-47a0-11ed-aedd-7cd30abc95d8
1b30d0ff-47a0-11ed-aedd-7cd30abc95d8
1b30d0ff-47a0-11ed-aedd-7cd30abc95d8
1b30d0ff-47a0-11ed-aedd-7cd30abc95d8
1b30d0ff-47a0-11ed-aedd-7cd30abc95d8
1b30d0ff-47a0-11ed-aedd-7cd30abc95d8
1b30d0ff-47a0-11ed-aedd-7cd30abc95d8
1b30d0ff-47a0-11ed-aedd-7cd30abc95d8
1b30d0ff-47a0-11ed-aedd-7cd30abc95d8
1b30d0ff-47a0-11ed-aedd-7cd30abc95d8
1b30d0ff-47a0-11ed-aedd-7cd30abc95d8
1b30d0ff-47a0-11ed-aedd-7cd30abc95d8
1b30d0ff-47a0-11ed-aedd-7cd30abc95d8
1b30d0ff-47a0-11ed-aedd-7cd30abc95d8
1b30d0ff-47a0-11ed-aedd-7cd30abc95d8
1b30d0ff-47a0-11ed-aedd-7cd30abc95d8
1b30d0ff-47a0-11ed-aedd-7cd30abc95d8
1b30d0ff-47a0-11ed-aedd-7cd30abc95d8
1b30d0ff-47a0-11ed-aedd-7cd30abc95d8
1b30d0ff-47a0-11ed-aedd-7cd30abc95d8
1b30d0ff-47a0-11ed-aedd-7cd30abc95d8
1b30d0ff-47a0-11ed-aedd-7cd30abc95d8
1b30d0ff-47a0-11ed-aedd-7cd30abc95d8
1b30d0ff-47a0-11ed-aedd-7cd30abc95d8
1b30d0ff-47a0-11ed-aedd-7cd30abc95d8
1b30d0ff-47a0-11ed-aedd-7cd30abc95d8
1b30d0ff-47a0-11ed-aedd-7cd30abc95d8
1b30d0ff-47a0-11ed-aedd-7cd30abc95d8
1b30d0ff-47a0-11ed-aedd-7cd30abc95d8
1b30d0ff-47a0-11ed-aedd-7cd30abc95d8
1b30d0ff-47a0-11ed-aedd-7cd30abc95d8
1b30d0ff-47a0-11ed-aedd-7cd30abc95d8
1b30d0ff-47a0-11ed-aedd-7cd30abc95d8
1b30d0ff-47a0-11ed-aedd-7cd30abc95d8
1b30d0ff-47a0-11ed-aedd-7cd30abc95d8
1b30d0ff-47a0-11ed-aedd-7cd30abc95d8
1b30d0ff-47a0-11ed-aedd-7cd30abc95d8
1b30d0ff-47a0-11ed-aedd-7cd30abc95d8
1b30d0ff-47a0-11ed-aedd-7cd30abc95d8
1b30d0ff-47a0-11ed-aedd-7cd30abc95d8
1b30d0ff-47a0-11ed-aedd-7cd30abc95d8
1b30d0ff-47a0-11ed-aedd-7cd30abc95d8
1b30d0ff-47a0-11ed-aedd-7cd30abc95d8
1b30d0ff-47a0-11ed-aedd-7cd30abc95d8
1b30d0ff-47a0-11ed-aedd-7cd30abc95d8
1b30d0ff-47a0-11ed-aedd-7cd30abc95d8
1b30d0ff-47a0-11ed-aedd-7cd30abc95d8
1b30d0ff-47a0-11ed-aedd-7cd30abc95d8
1b30d0ff-47a0-11ed-aedd-7cd30abc95d8
1b30d0ff-47a0-11ed-aedd-7cd30abc95d8
1b30d0ff-47a0-11ed-aedd-7cd30abc95d8
1b30d0ff-47a0-11ed-aedd-7cd30abc95d8
1b30d0ff-47a0-11ed-aedd-7cd30abc95d8
1b30d0ff-47a0-11ed-aedd-7cd30abc95d8
1b30d0ff-47a0-11ed-aedd-7cd30abc95d8
1b30d0ff-47a0-11ed-aedd-7cd30abc95d8
1b30d0ff-47a0-11ed-aedd-7cd30abc95d8
1b30d0ff-47a0-11ed-aedd-7cd30abc95d8
1b30d0ff-47a0-11ed-aedd-7cd30abc95d8
1b30d0ff-47a0-11ed-aedd-7cd30abc95d8
1b30d0ff-47a0-11ed-aedd-7cd30abc95d8
1b30d0ff-47a0-11ed-aedd-7cd30abc95d8
1b30d0ff-47a0-11ed-aedd-7cd30abc95d8
1b30d0ff-47a0-11ed-aedd-7cd30abc95d8
1b30d0ff-47a0-11ed-aedd-7cd30abc95d8
1b30d0ff-47a0-11ed-aedd-7cd30abc95d8
1b30d0ff-47a0-11ed-aedd-7cd30abc95d8
1b30d0ff-47a0-11ed-aedd-7cd30abc95d8
1b30d0ff-47a0-11ed-aedd-7cd30abc95d8
1b30d0ff-47a0-11ed-aedd-7cd30abc95d8
1b30d0ff-47a0-11ed-aedd-7cd30abc95d8
1b30d0ff-47a0-11ed-aedd-7cd30abc95d8
1b30d0ff-47a0-11ed-aedd-7cd30abc95d8
1b30d0ff-47a0-11ed-aedd-7cd30abc95d8
1b30d0ff-47a0-11ed-aedd-7cd30abc95d8
1b30d0ff-47a0-11ed-aedd-7cd30abc95d8
1b30d0ff-47a0-11ed-aedd-7cd30abc95d8
1b30d0ff-47a0-11ed-aedd-7cd30abc95d8
1b30d0ff-47a0-11ed-aedd-7cd30abc95d8
1b30d0ff-47a0-11ed-aedd-7cd30abc95d8
1b30d0ff-47a0-11ed-aedd-7cd30abc95d8
1b30d0ff-47a0-11ed-aedd-7cd30abc95d8
1b30d0ff-47a0-11ed-aedd-7cd30abc95d8
1b30d0ff-47a0-11ed-aedd-7cd30abc95d8
1b30d0ff-47a0-11ed-aedd-7cd30abc95d8
1b30d0ff-47a0-11ed-aedd-7cd30abc95d8
1b30d0ff-47a0-11ed-aedd-7cd30abc95d8
1b30d0ff-47a0-11ed-aedd-7cd30abc95d8
1b30d0ff-47a0-11ed-aedd-7cd30abc95d8
1b30d0ff-47a0-11ed-aedd-7cd30abc95d8
1b30d0ff-47a0-11ed-aedd-7cd30abc95d8
1b30d0ff-47a0-11ed-aedd-7cd30abc95d8
1b30d0ff-47a0-11ed-aedd-7cd30abc95d8
1b30d0ff-47a0-11ed-aedd-7cd30abc95d8
1b30d0ff-47a0-11ed-aedd-7cd30abc95d8
1b30d0ff-47a0-11ed-aedd-7cd30abc95d8
1b30d0ff-47a0-11ed-aedd-7cd30abc95d8
1b30d0ff-47a0-11ed-aedd-7cd30abc95d8
1b30d0ff-47a0-11ed-aedd-7cd30abc95d8
1b30d0ff-47a0-11ed-aedd-7cd30abc95d8
1b30d0ff-47a0-11ed-aedd-7cd30abc95d8
1b30d0ff-47a0-11ed-aedd-7cd30abc95d8
1b30d0ff-47a0-11ed-aedd-7cd30abc95d8
1b30d0ff-47a0-11ed-aedd-7cd30abc95d8
1b30d0ff-47a0-11ed-aedd-7cd30abc95d8
1b30d0ff-47a0-11ed-aedd-7cd30abc95d8
1b30d0ff-47a0-11ed-aedd-7cd30abc95d8
1b30d0ff-47a0-11ed-aedd-7cd30abc95d8
1b30d0ff-47a0-11ed-aedd-7cd30abc95d8
1b30d0ff-47a0-11ed-aedd-7cd30abc95d8
1b30d0ff-47a0-11ed-aedd-7cd30abc95d8
1b30d0ff-47a0-11ed-aedd-7cd30abc95d8
1b30d0ff-47a0-11ed-aedd-7cd30abc95d8
1b30d0ff-47a0-11ed-aedd-7cd30abc95d8
1b30d0ff-47a0-11ed-aedd-7cd30abc95d8
1b30d0ff-47a0-11ed-aedd-7cd30abc95d8
1b30d0ff-47a0-11ed-aedd-7cd30abc95d8
1b30d0ff-47a0-11ed-aedd-7cd30abc95d8
1b30d0ff-47a0-11ed-aedd-7cd30abc95d8
1b30d0ff-47a0-11ed-aedd-7cd30abc95d8
1b30d0ff-47a0-11ed-aedd-7cd30abc95d8
1b30d0ff-47a0-11ed-aedd-7cd30abc95d8
1b30d0ff-47a0-11ed-aedd-7cd30abc95d8
1b30d0ff-47a0-11ed-aedd-7cd30abc95d8
1b30d0ff-47a0-11ed-aedd-7cd30abc95d8
1b30d0ff-47a0-11ed-aedd-7cd30abc95d8
1b30d0ff-47a0-11ed-aedd-7cd30abc95d8
1b30d0ff-47a0-11ed-aedd-7cd30abc95d8
1b30d0ff-47a0-11ed-aedd-7cd30abc95d8
1b30d0ff-47a0-11ed-aedd-7cd30abc95d8
1b30d0ff-47a0-11ed-aedd-7cd30abc95d8
1b30d0ff-47a0-11ed-aedd-7cd30abc95d8
1b30d0ff-47a0-11ed-aedd-7cd30abc95d8
1b30d0ff-47a0-11ed-aedd-7cd30abc95d8
1b30d0ff-47a0-11ed-aedd-7cd30abc95d8
1b30d0ff-47a0-11ed-aedd-7cd30abc95d8
1b30d0ff-47a0-11ed-aedd-7cd30abc95d8
1b30d0ff-47a0-11ed-aedd-7cd30abc95d8
1b30d0ff-47a0-11ed-aedd-7cd30abc95d8
1b30d0ff-47a0-11ed-aedd-7cd30abc95d8
1b30d0ff-47a0-11ed-aedd-7cd30abc95d8
1b30d0ff-47a0-11ed-aedd-7cd30abc95d8
1b30d0ff-47a0-11ed-aedd-7cd30abc95d8
1b30d0ff-47a0-11ed-aedd-7cd30abc95d8
1b30d0ff-47a0-11ed-aedd-7cd30abc95d8
1b30d0ff-47a0-11ed-aedd-7cd30abc95d8
1b30d0ff-47a0-11ed-aedd-7cd30abc95d8
1b30d0ff-47a0-11ed-aedd-7cd30abc95d8
1b30d0ff-47a0-11ed-aedd-7cd30abc95d8
1b30d0ff-47a0-11ed-aedd-7cd30abc95d8
1b30d0ff-47a0-11ed-aedd-7cd30abc95d8
1b30d0ff-47a0-11ed-aedd-7cd30abc95d8
1b30d0ff-47a0-11ed-aedd-7cd30abc95d8
1b30d0ff-47a0-11ed-aedd-7cd30abc95d8
1b30d0ff-47a0-11ed-aedd-7cd30abc95d8
1b30d0ff-47a0-11ed-aedd-7cd30abc95d8
1b30d0ff-47a0-11ed-aedd-7cd30abc95d8
1b30d0ff-47a0-11ed-aedd-7cd30abc95d8
1b30d0ff-47a0-11ed-aedd-7cd30abc95d8
1b30d0ff-47a0-11ed-aedd-7cd30abc95d8
1b30d0ff-47a0-11ed-aedd-7cd30abc95d8
1b30d0ff-47a0-11ed-aedd-7cd30abc95d8
1b30d0ff-47a0-11ed-aedd-7cd30abc95d8
1b30d0ff-47a0-11ed-aedd-7cd30abc95d8
1b30d0ff-47a0-11ed-aedd-7cd30abc95d8
1b30d0ff-47a0-11ed-aedd-7cd30abc95d8
1b30d0ff-47a0-11ed-aedd-7cd30abc95d8
1b30d0ff-47a0-11ed-aedd-7cd30abc95d8
1b30d0ff-47a0-11ed-aedd-7cd30abc95d8
1b30d0ff-47a0-11ed-aedd-7cd30abc95d8
1b30d0ff-47a0-11ed-aedd-7cd30abc95d8
1b30d0ff-47a0-11ed-aedd-7cd30abc95d8
1b30d0ff-47a0-11ed-aedd-7cd30abc95d8
1b30d0ff-47a0-11ed-aedd-7cd30abc95d8
1b30d0ff-47a0-11ed-aedd-7cd30abc95d8
1b30d0ff-47a0-11ed-aedd-7cd30abc95d8
1b30d0ff-47a0-11ed-aedd-7cd30abc95d8
1b30d0ff-47a0-11ed-aedd-7cd30abc95d8
1b30d0ff-47a0-11ed-aedd-7cd30abc95d8
1b30d0ff-47a0-11ed-aedd-7cd30abc95d8
1b30d0ff-47a0-11ed-aedd-7cd30abc95d8
1b30d0ff-47a0-11ed-aedd-7cd30abc95d8
1b30d0ff-47a0-11ed-aedd-7cd30abc95d8
1b30d0ff-47a0-11ed-aedd-7cd30abc95d8
1b30d0ff-47a0-11ed-aedd-7cd30abc95d8
1b30d0ff-47a0-11ed-aedd-7cd30abc95d8
1b30d0ff-47a0-11ed-aedd-7cd30abc95d8
1b30d0ff-47a0-11ed-aedd-7cd30abc95d8
1b30d0ff-47a0-11ed-aedd-7cd30abc95d8
1b30d0ff-47a0-11ed-aedd-7cd30abc95d8
1b30d0ff-47a0-11ed-aedd-7cd30abc95d8
1b30d0ff-47a0-11ed-aedd-7cd30abc95d8
1b30d0ff-47a0-11ed-aedd-7cd30abc95d8
1b30d0ff-47a0-11ed-aedd-7cd30abc95d8
1b30d0ff-47a0-11ed-aedd-7cd30abc95d8
1b30d0ff-47a0-11ed-aedd-7cd30abc95d8
1b30d0ff-47a0-11ed-aedd-7cd30abc95d8
1b30d0ff-47a0-11ed-aedd-7cd30abc95d8
1b30d0ff-47a0-11ed-aedd-7cd30abc95d8
1b30d0ff-47a0-11ed-aedd-7cd30abc95d8
1b30d0ff-47a0-11ed-aedd-7cd30abc95d8
1b30d0ff-47a0-11ed-aedd-7cd30abc95d8
1b30d0ff-47a0-11ed-aedd-7cd30abc95d8
1b30d0ff-47a0-11ed-aedd-7cd30abc95d8
1b30d0ff-47a0-11ed-aedd-7cd30abc95d8
1b30d0ff-47a0-11ed-aedd-7cd30abc95d8
1b30d0ff-47a0-11ed-aedd-7cd30abc95d8
1b30d0ff-47a0-11ed-aedd-7cd30abc95d8
1b30d0ff-47a0-11ed-aedd-7cd30abc95d8
1b30d0ff-47a0-11ed-aedd-7cd30abc95d8
1b30d0ff-47a0-11ed-aedd-7cd30abc95d8
1b30d0ff-47a0-11ed-aedd-7cd30abc95d8
1b30d0ff-47a0-11ed-aedd-7cd30abc95d8
1b30d0ff-47a0-11ed-aedd-7cd30abc95d8
1b30d0ff-47a0-11ed-aedd-7cd30abc95d8
1b30d0ff-47a0-11ed-aedd-7cd30abc95d8
1b30d0ff-47a0-11ed-aedd-7cd30abc95d8
1b30d0ff-47a0-11ed-aedd-7cd30abc95d8
1b30d0ff-47a0-11ed-aedd-7cd30abc95d8
1b30d0ff-47a0-11ed-aedd-7cd30abc95d8
1b30d0ff-47a0-11ed-aedd-7cd30abc95d8
1b30d0ff-47a0-11ed-aedd-7cd30abc95d8
1b30d0ff-47a0-11ed-aedd-7cd30abc95d8
1b30d0ff-47a0-11ed-aedd-7cd30abc95d8
1b30d0ff-47a0-11ed-aedd-7cd30abc95d8
1b30d0ff-47a0-11ed-aedd-7cd30abc95d8
1b30d0ff-47a0-11ed-aedd-7cd30abc95d8
1b30d0ff-47a0-11ed-aedd-7cd30abc95d8
1b30d0ff-47a0-11ed-aedd-7cd30abc95d8
1b30d0ff-47a0-11ed-aedd-7cd30abc95d8
1b30d0ff-47a0-11ed-aedd-7cd30abc95d8
1b30d0ff-47a0-11ed-aedd-7cd30abc95d8
1b30d0ff-47a0-11ed-aedd-7cd30abc95d8
1b30d0ff-47a0-11ed-aedd-7cd30abc95d8
1b30d0ff-47a0-11ed-aedd-7cd30abc95d8
1b30d0ff-47a0-11ed-aedd-7cd30abc95d8
1b30d0ff-47a0-11ed-aedd-7cd30abc95d8
1b30d0ff-47a0-11ed-aedd-7cd30abc95d8
1b30d0ff-47a0-11ed-aedd-7cd30abc95d8
1b30d0ff-47a0-11ed-aedd-7cd30abc95d8
1b30d0ff-47a0-11ed-aedd-7cd30abc95d8
1b30d0ff-47a0-11ed-aedd-7cd30abc95d8
1b30d0ff-47a0-11ed-aedd-7cd30abc95d8
1b30d0ff-47a0-11ed-aedd-7cd30abc95d8
1b30d0ff-47a0-11ed-aedd-7cd30abc95d8
1b30d0ff-47a0-11ed-aedd-7cd30abc95d8
1b30d0ff-47a0-11ed-aedd-7cd30abc95d8
1b30d0ff-47a0-11ed-aedd-7cd30abc95d8
1b30d0ff-47a0-11ed-aedd-7cd30abc95d8
1b30d0ff-47a0-11ed-aedd-7cd30abc95d8
1b30d0ff-47a0-11ed-aedd-7cd30abc95d8
1b30d0ff-47a0-11ed-aedd-7cd30abc95d8
1b30d0ff-47a0-11ed-aedd-7cd30abc95d8
1b30d0ff-47a0-11ed-aedd-7cd30abc95d8
1b30d0ff-47a0-11ed-aedd-7cd30abc95d8
1b30d0ff-47a0-11ed-aedd-7cd30abc95d8
1b30d0ff-47a0-11ed-aedd-7cd30abc95d8
1b30d0ff-47a0-11ed-aedd-7cd30abc95d8
1b30d0ff-47a0-11ed-aedd-7cd30abc95d8
1b30d0ff-47a0-11ed-aedd-7cd30abc95d8
1b30d0ff-47a0-11ed-aedd-7cd30abc95d8
1b30d0ff-47a0-11ed-aedd-7cd30abc95d8
1b30d0ff-47a0-11ed-aedd-7cd30abc95d8
1b30d0ff-47a0-11ed-aedd-7cd30abc95d8
1b30d0ff-47a0-11ed-aedd-7cd30abc95d8
1b30d0ff-47a0-11ed-aedd-7cd30abc95d8
1b30d0ff-47a0-11ed-aedd-7cd30abc95d8
1b30d0ff-47a0-11ed-aedd-7cd30abc95d8
1b30d0ff-47a0-11ed-aedd-7cd30abc95d8
1b30d0ff-47a0-11ed-aedd-7cd30abc95d8
1b30d0ff-47a0-11ed-aedd-7cd30abc95d8
1b30d0ff-47a0-11ed-aedd-7cd30abc95d8
1b30d0ff-47a0-11ed-aedd-7cd30abc95d8
1b30d0ff-47a0-11ed-aedd-7cd30abc95d8
1b30d0ff-47a0-11ed-aedd-7cd30abc95d8
1b30d0ff-47a0-11ed-aedd-7cd30abc95d8
1b30d0ff-47a0-11ed-aedd-7cd30abc95d8
1b30d0ff-47a0-11ed-aedd-7cd30abc95d8
1b30d0ff-47a0-11ed-aedd-7cd30abc95d8
1b30d0ff-47a0-11ed-aedd-7cd30abc95d8
1b30d0ff-47a0-11ed-aedd-7cd30abc95d8
1b30d0ff-47a0-11ed-aedd-7cd30abc95d8
1b30d0ff-47a0-11ed-aedd-7cd30abc95d8
1b30d0ff-47a0-11ed-aedd-7cd30abc95d8
1b30d0ff-47a0-11ed-aedd-7cd30abc95d8
1b30d0ff-47a0-11ed-aedd-7cd30abc95d8
1b30d0ff-47a0-11ed-aedd-7cd30abc95d8
1b30d0ff-47a0-11ed-aedd-7cd30abc95d8
1b30d0ff-47a0-11ed-aedd-7cd30abc95d8
1b30d0ff-47a0-11ed-aedd-7cd30abc95d8
1b30d0ff-47a0-11ed-aedd-7cd30abc95d8
1b30d0ff-47a0-11ed-aedd-7cd30abc95d8
1b30d0ff-47a0-11ed-aedd-7cd30abc95d8
1b30d0ff-47a0-11ed-aedd-7cd30abc95d8
1b30d0ff-47a0-11ed-aedd-7cd30abc95d8
1b30d0ff-47a0-11ed-aedd-7cd30abc95d8
1b30d0ff-47a0-11ed-aedd-7cd30abc95d8
1b30d0ff-47a0-11ed-aedd-7cd30abc95d8
1b30d0ff-47a0-11ed-aedd-7cd30abc95d8
1b30d0ff-47a0-11ed-aedd-7cd30abc95d8
1b30d0ff-47a0-11ed-aedd-7cd30abc95d8
1b30d0ff-47a0-11ed-aedd-7cd30abc95d8
1b30d0ff-47a0-11ed-aedd-7cd30abc95d8
1b30d0ff-47a0-11ed-aedd-7cd30abc95d8
1b30d0ff-47a0-11ed-aedd-7cd30abc95d8
1b30d0ff-47a0-11ed-aedd-7cd30abc95d8
1b30d0ff-47a0-11ed-aedd-7cd30abc95d8
1b30d0ff-47a0-11ed-aedd-7cd30abc95d8
1b30d0ff-47a0-11ed-aedd-7cd30abc95d8
1b30d0ff-47a0-11ed-aedd-7cd30abc95d8
1b30d0ff-47a0-11ed-aedd-7cd30abc95d8
1b30d0ff-47a0-11ed-aedd-7cd30abc95d8
1b30d0ff-47a0-11ed-aedd-7cd30abc95d8
1b30d0ff-47a0-11ed-aedd-7cd30abc95d8
1b30d0ff-47a0-11ed-aedd-7cd30abc95d8
1b30d0ff-47a0-11ed-aedd-7cd30abc95d8
1b30d0ff-47a0-11ed-aedd-7cd30abc95d8
1b30d0ff-47a0-11ed-aedd-7cd30abc95d8
1b30d0ff-47a0-11ed-aedd-7cd30abc95d8
1b30d0ff-47a0-11ed-aedd-7cd30abc95d8
1b30d0ff-47a0-11ed-aedd-7cd30abc95d8
1b30d0ff-47a0-11ed-aedd-7cd30abc95d8
1b30d0ff-47a0-11ed-aedd-7cd30abc95d8
1b30d0ff-47a0-11ed-aedd-7cd30abc95d8
1b30d0ff-47a0-11ed-aedd-7cd30abc95d8
1b30d0ff-47a0-11ed-aedd-7cd30abc95d8
1b30d0ff-47a0-11ed-aedd-7cd30abc95d8
1b30d0ff-47a0-11ed-aedd-7cd30abc95d8
1b30d0ff-47a0-11ed-aedd-7cd30abc95d8
1b30d0ff-47a0-11ed-aedd-7cd30abc95d8
1b30d0ff-47a0-11ed-aedd-7cd30abc95d8
1b30d0ff-47a0-11ed-aedd-7cd30abc95d8
1b30d0ff-47a0-11ed-aedd-7cd30abc95d8
1b30d0ff-47a0-11ed-aedd-7cd30abc95d8
1b30d0ff-47a0-11ed-aedd-7cd30abc95d8
1b30d0ff-47a0-11ed-aedd-7cd30abc95d8
1b30d0ff-47a0-11ed-aedd-7cd30abc95d8
1b30d0ff-47a0-11ed-aedd-7cd30abc95d8
1b30d0ff-47a0-11ed-aedd-7cd30abc95d8
1b30d0ff-47a0-11ed-aedd-7cd30abc95d8
1b30d0ff-47a0-11ed-aedd-7cd30abc95d8
1b30d0ff-47a0-11ed-aedd-7cd30abc95d8
1b30d0ff-47a0-11ed-aedd-7cd30abc95d8
1b30d0ff-47a0-11ed-aedd-7cd30abc95d8
1b30d0ff-47a0-11ed-aedd-7cd30abc95d8
1b30d0ff-47a0-11ed-aedd-7cd30abc95d8
1b30d0ff-47a0-11ed-aedd-7cd30abc95d8
1b30d0ff-47a0-11ed-aedd-7cd30abc95d8
1b30d0ff-47a0-11ed-aedd-7cd30abc95d8
1b30d0ff-47a0-11ed-aedd-7cd30abc95d8
1b30d0ff-47a0-11ed-aedd-7cd30abc95d8
1b30d0ff-47a0-11ed-aedd-7cd30abc95d8
1b30d0ff-47a0-11ed-aedd-7cd30abc95d8
1b30d0ff-47a0-11ed-aedd-7cd30abc95d8
1b30d0ff-47a0-11ed-aedd-7cd30abc95d8
1b30d0ff-47a0-11ed-aedd-7cd30abc95d8
1b30d0ff-47a0-11ed-aedd-7cd30abc95d8
1b30d0ff-47a0-11ed-aedd-7cd30abc95d8
1b30d0ff-47a0-11ed-aedd-7cd30abc95d8
1b30d0ff-47a0-11ed-aedd-7cd30abc95d8
1b30d0ff-47a0-11ed-aedd-7cd30abc95d8
1b30d0ff-47a0-11ed-aedd-7cd30abc95d8
1b30d0ff-47a0-11ed-aedd-7cd30abc95d8
1b30d0ff-47a0-11ed-aedd-7cd30abc95d8
1b30d0ff-47a0-11ed-aedd-7cd30abc95d8
1b30d0ff-47a0-11ed-aedd-7cd30abc95d8
1b30d0ff-47a0-11ed-aedd-7cd30abc95d8
1b30d0ff-47a0-11ed-aedd-7cd30abc95d8
1b30d0ff-47a0-11ed-aedd-7cd30abc95d8
1b30d0ff-47a0-11ed-aedd-7cd30abc95d8
1b30d0ff-47a0-11ed-aedd-7cd30abc95d8
1b30d0ff-47a0-11ed-aedd-7cd30abc95d8
1b30d0ff-47a0-11ed-aedd-7cd30abc95d8
1b30d0ff-47a0-11ed-aedd-7cd30abc95d8
1b30d0ff-47a0-11ed-aedd-7cd30abc95d8
1b30d0ff-47a0-11ed-aedd-7cd30abc95d8
1b30d0ff-47a0-11ed-aedd-7cd30abc95d8
1b30d0ff-47a0-11ed-aedd-7cd30abc95d8
1b30d0ff-47a0-11ed-aedd-7cd30abc95d8
1b30d0ff-47a0-11ed-aedd-7cd30abc95d8
1b30d0ff-47a0-11ed-aedd-7cd30abc95d8
1b30d0ff-47a0-11ed-aedd-7cd30abc95d8
1b30d0ff-47a0-11ed-aedd-7cd30abc95d8
1b30d0ff-47a0-11ed-aedd-7cd30abc95d8
1b30d0ff-47a0-11ed-aedd-7cd30abc95d8
1b30d0ff-47a0-11ed-aedd-7cd30abc95d8
1b30d0ff-47a0-11ed-aedd-7cd30abc95d8
1b30d0ff-47a0-11ed-aedd-7cd30abc95d8
1b30d0ff-47a0-11ed-aedd-7cd30abc95d8
1b30d0ff-47a0-11ed-aedd-7cd30abc95d8
1b30d0ff-47a0-11ed-aedd-7cd30abc95d8
1b30d0ff-47a0-11ed-aedd-7cd30abc95d8
1b30d0ff-47a0-11ed-aedd-7cd30abc95d8
1b30d0ff-47a0-11ed-aedd-7cd30abc95d8
1b30d0ff-47a0-11ed-aedd-7cd30abc95d8
1b30d0ff-47a0-11ed-aedd-7cd30abc95d8
1b30d0ff-47a0-11ed-aedd-7cd30abc95d8
1b30d0ff-47a0-11ed-aedd-7cd30abc95d8
1b30d0ff-47a0-11ed-aedd-7cd30abc95d8
1b30d0ff-47a0-11ed-aedd-7cd30abc95d8
1b30d0ff-47a0-11ed-aedd-7cd30abc95d8
1b30d0ff-47a0-11ed-aedd-7cd30abc95d8
1b30d0ff-47a0-11ed-aedd-7cd30abc95d8
1b30d0ff-47a0-11ed-aedd-7cd30abc95d8
1b30d0ff-47a0-11ed-aedd-7cd30abc95d8
1b30d0ff-47a0-11ed-aedd-7cd30abc95d8
1b30d0ff-47a0-11ed-aedd-7cd30abc95d8
1b30d0ff-47a0-11ed-aedd-7cd30abc95d8
1b30d0ff-47a0-11ed-aedd-7cd30abc95d8
1b30d0ff-47a0-11ed-aedd-7cd30abc95d8
1b30d0ff-47a0-11ed-aedd-7cd30abc95d8
1b30d0ff-47a0-11ed-aedd-7cd30abc95d8
1b30d0ff-47a0-11ed-aedd-7cd30abc95d8
1b30d0ff-47a0-11ed-aedd-7cd30abc95d8
1b30d0ff-47a0-11ed-aedd-7cd30abc95d8
1b30d0ff-47a0-11ed-aedd-7cd30abc95d8
1b30d0ff-47a0-11ed-aedd-7cd30abc95d8
1b30d0ff-47a0-11ed-aedd-7cd30abc95d8
1b30d0ff-47a0-11ed-aedd-7cd30abc95d8
1b30d0ff-47a0-11ed-aedd-7cd30abc95d8
1b30d0ff-47a0-11ed-aedd-7cd30abc95d8
1b30d0ff-47a0-11ed-aedd-7cd30abc95d8
1b30d0ff-47a0-11ed-aedd-7cd30abc95d8
1b30d0ff-47a0-11ed-aedd-7cd30abc95d8
1b30d0ff-47a0-11ed-aedd-7cd30abc95d8
1b30d0ff-47a0-11ed-aedd-7cd30abc95d8
1b30d0ff-47a0-11ed-aedd-7cd30abc95d8
1b30d0ff-47a0-11ed-aedd-7cd30abc95d8
1b30d0ff-47a0-11ed-aedd-7cd30abc95d8
1b30d0ff-47a0-11ed-aedd-7cd30abc95d8
1b30d0ff-47a0-11ed-aedd-7cd30abc95d8
1b30d0ff-47a0-11ed-aedd-7cd30abc95d8
1b30d0ff-47a0-11ed-aedd-7cd30abc95d8
1b30d0ff-47a0-11ed-aedd-7cd30abc95d8
1b30d0ff-47a0-11ed-aedd-7cd30abc95d8
1b30d0ff-47a0-11ed-aedd-7cd30abc95d8
1b30d0ff-47a0-11ed-aedd-7cd30abc95d8
1b30d0ff-47a0-11ed-aedd-7cd30abc95d8
1b30d0ff-47a0-11ed-aedd-7cd30abc95d8
1b30d0ff-47a0-11ed-aedd-7cd30abc95d8
1b30d0ff-47a0-11ed-aedd-7cd30abc95d8
1b30d0ff-47a0-11ed-aedd-7cd30abc95d8
1b30d0ff-47a0-11ed-aedd-7cd30abc95d8
1b30d0ff-47a0-11ed-aedd-7cd30abc95d8
1b30d0ff-47a0-11ed-aedd-7cd30abc95d8
1b30d0ff-47a0-11ed-aedd-7cd30abc95d8
1b30d0ff-47a0-11ed-aedd-7cd30abc95d8
1b30d0ff-47a0-11ed-aedd-7cd30abc95d8
1b30d0ff-47a0-11ed-aedd-7cd30abc95d8
1b30d0ff-47a0-11ed-aedd-7cd30abc95d8
1b30d0ff-47a0-11ed-aedd-7cd30abc95d8
1b30d0ff-47a0-11ed-aedd-7cd30abc95d8
1b30d0ff-47a0-11ed-aedd-7cd30abc95d8
1b30d0ff-47a0-11ed-aedd-7cd30abc95d8
1b30d0ff-47a0-11ed-aedd-7cd30abc95d8
1b30d0ff-47a0-11ed-aedd-7cd30abc95d8
1b30d0ff-47a0-11ed-aedd-7cd30abc95d8
1b30d0ff-47a0-11ed-aedd-7cd30abc95d8
1b30d0ff-47a0-11ed-aedd-7cd30abc95d8
1b30d0ff-47a0-11ed-aedd-7cd30abc95d8
1b30d0ff-47a0-11ed-aedd-7cd30abc95d8
1b30d0ff-47a0-11ed-aedd-7cd30abc95d8
1b30d0ff-47a0-11ed-aedd-7cd30abc95d8
1b30d0ff-47a0-11ed-aedd-7cd30abc95d8
1b30d0ff-47a0-11ed-aedd-7cd30abc95d8
1b30d0ff-47a0-11ed-aedd-7cd30abc95d8
1b30d0ff-47a0-11ed-aedd-7cd30abc95d8
1b30d0ff-47a0-11ed-aedd-7cd30abc95d8
1b30d0ff-47a0-11ed-aedd-7cd30abc95d8
1b30d0ff-47a0-11ed-aedd-7cd30abc95d8
1b30d0ff-47a0-11ed-aedd-7cd30abc95d8
1b30d0ff-47a0-11ed-aedd-7cd30abc95d8
1b30d0ff-47a0-11ed-aedd-7cd30abc95d8
1b30d0ff-47a0-11ed-aedd-7cd30abc95d8
1b30d0ff-47a0-11ed-aedd-7cd30abc95d8
1b30d0ff-47a0-11ed-aedd-7cd30abc95d8
1b30d0ff-47a0-11ed-aedd-7cd30abc95d8
1b30d0ff-47a0-11ed-aedd-7cd30abc95d8
1b30d0ff-47a0-11ed-aedd-7cd30abc95d8
1b30d0ff-47a0-11ed-aedd-7cd30abc95d8
1b30d0ff-47a0-11ed-aedd-7cd30abc95d8
1b30d0ff-47a0-11ed-aedd-7cd30abc95d8
1b30d0ff-47a0-11ed-aedd-7cd30abc95d8
1b30d0ff-47a0-11ed-aedd-7cd30abc95d8
1b30d0ff-47a0-11ed-aedd-7cd30abc95d8
1b30d0ff-47a0-11ed-aedd-7cd30abc95d8
1b30d0ff-47a0-11ed-aedd-7cd30abc95d8
1b30d0ff-47a0-11ed-aedd-7cd30abc95d8
1b30d0ff-47a0-11ed-aedd-7cd30abc95d8
1b30d0ff-47a0-11ed-aedd-7cd30abc95d8
1b30d0ff-47a0-11ed-aedd-7cd30abc95d8
1b30d0ff-47a0-11ed-aedd-7cd30abc95d8
1b30d0ff-47a0-11ed-aedd-7cd30abc95d8
1b30d0ff-47a0-11ed-aedd-7cd30abc95d8
1b30d0ff-47a0-11ed-aedd-7cd30abc95d8
1b30d0ff-47a0-11ed-aedd-7cd30abc95d8
1b30d0ff-47a0-11ed-aedd-7cd30abc95d8
1b30d0ff-47a0-11ed-aedd-7cd30abc95d8
1b30d0ff-47a0-11ed-aedd-7cd30abc95d8
1b30d0ff-47a0-11ed-aedd-7cd30abc95d8
1b30d0ff-47a0-11ed-aedd-7cd30abc95d8
1b30d0ff-47a0-11ed-aedd-7cd30abc95d8
1b30d0ff-47a0-11ed-aedd-7cd30abc95d8
1b30d0ff-47a0-11ed-aedd-7cd30abc95d8
1b30d0ff-47a0-11ed-aedd-7cd30abc95d8
1b30d0ff-47a0-11ed-aedd-7cd30abc95d8
1b30d0ff-47a0-11ed-aedd-7cd30abc95d8
1b30d0ff-47a0-11ed-aedd-7cd30abc95d8
1b30d0ff-47a0-11ed-aedd-7cd30abc95d8
1b30d0ff-47a0-11ed-aedd-7cd30abc95d8
1b30d0ff-47a0-11ed-aedd-7cd30abc95d8
1b30d0ff-47a0-11ed-aedd-7cd30abc95d8
1b30d0ff-47a0-11ed-aedd-7cd30abc95d8
1b30d0ff-47a0-11ed-aedd-7cd30abc95d8
1b30d0ff-47a0-11ed-aedd-7cd30abc95d8
1b30d0ff-47a0-11ed-aedd-7cd30abc95d8
1b30d0ff-47a0-11ed-aedd-7cd30abc95d8
1b30d0ff-47a0-11ed-aedd-7cd30abc95d8
1b30d0ff-47a0-11ed-aedd-7cd30abc95d8
1b30d0ff-47a0-11ed-aedd-7cd30abc95d8
1b30d0ff-47a0-11ed-aedd-7cd30abc95d8
1b30d0ff-47a0-11ed-aedd-7cd30abc95d8
1b30d0ff-47a0-11ed-aedd-7cd30abc95d8
1b30d0ff-47a0-11ed-aedd-7cd30abc95d8
1b30d0ff-47a0-11ed-aedd-7cd30abc95d8
1b30d0ff-47a0-11ed-aedd-7cd30abc95d8
1b30d0ff-47a0-11ed-aedd-7cd30abc95d8
1b30d0ff-47a0-11ed-aedd-7cd30abc95d8
1b30d0ff-47a0-11ed-aedd-7cd30abc95d8
1b30d0ff-47a0-11ed-aedd-7cd30abc95d8
1b30d0ff-47a0-11ed-aedd-7cd30abc95d8
1b30d0ff-47a0-11ed-aedd-7cd30abc95d8
1b30d0ff-47a0-11ed-aedd-7cd30abc95d8
1b30d0ff-47a0-11ed-aedd-7cd30abc95d8
1b30d0ff-47a0-11ed-aedd-7cd30abc95d8
1b30d0ff-47a0-11ed-aedd-7cd30abc95d8
1b30d0ff-47a0-11ed-aedd-7cd30abc95d8
1b30d0ff-47a0-11ed-aedd-7cd30abc95d8
1b30d0ff-47a0-11ed-aedd-7cd30abc95d8
1b30d0ff-47a0-11ed-aedd-7cd30abc95d8
1b30d0ff-47a0-11ed-aedd-7cd30abc95d8
1b30d0ff-47a0-11ed-aedd-7cd30abc95d8
1b30d0ff-47a0-11ed-aedd-7cd30abc95d8
1b30d0ff-47a0-11ed-aedd-7cd30abc95d8
1b30d0ff-47a0-11ed-aedd-7cd30abc95d8
1b30d0ff-47a0-11ed-aedd-7cd30abc95d8
1b30d0ff-47a0-11ed-aedd-7cd30abc95d8
1b30d0ff-47a0-11ed-aedd-7cd30abc95d8
1b30d0ff-47a0-11ed-aedd-7cd30abc95d8
1b30d0ff-47a0-11ed-aedd-7cd30abc95d8
1b30d0ff-47a0-11ed-aedd-7cd30abc95d8
1b30d0ff-47a0-11ed-aedd-7cd30abc95d8
1b30d0ff-47a0-11ed-aedd-7cd30abc95d8
1b30d0ff-47a0-11ed-aedd-7cd30abc95d8
1b30d0ff-47a0-11ed-aedd-7cd30abc95d8
1b30d0ff-47a0-11ed-aedd-7cd30abc95d8
1b30d0ff-47a0-11ed-aedd-7cd30abc95d8
1b30d0ff-47a0-11ed-aedd-7cd30abc95d8
1b30d0ff-47a0-11ed-aedd-7cd30abc95d8
1b30d0ff-47a0-11ed-aedd-7cd30abc95d8
1b30d0ff-47a0-11ed-aedd-7cd30abc95d8
1b30d0ff-47a0-11ed-aedd-7cd30abc95d8
1b30d0ff-47a0-11ed-aedd-7cd30abc95d8
1b30d0ff-47a0-11ed-aedd-7cd30abc95d8
1b30d0ff-47a0-11ed-aedd-7cd30abc95d8
1b30d0ff-47a0-11ed-aedd-7cd30abc95d8
1b30d0ff-47a0-11ed-aedd-7cd30abc95d8
1b30d0ff-47a0-11ed-aedd-7cd30abc95d8
1b30d0ff-47a0-11ed-aedd-7cd30abc95d8
1b30d0ff-47a0-11ed-aedd-7cd30abc95d8
1b30d0ff-47a0-11ed-aedd-7cd30abc95d8
1b30d0ff-47a0-11ed-aedd-7cd30abc95d8
1b30d0ff-47a0-11ed-aedd-7cd30abc95d8
1b30d0ff-47a0-11ed-aedd-7cd30abc95d8
1b30d0ff-47a0-11ed-aedd-7cd30abc95d8
1b30d0ff-47a0-11ed-aedd-7cd30abc95d8
1b30d0ff-47a0-11ed-aedd-7cd30abc95d8
1b30d0ff-47a0-11ed-aedd-7cd30abc95d8
1b30d0ff-47a0-11ed-aedd-7cd30abc95d8
1b30d0ff-47a0-11ed-aedd-7cd30abc95d8
1b30d0ff-47a0-11ed-aedd-7cd30abc95d8
1b30d0ff-47a0-11ed-aedd-7cd30abc95d8
1b30d0ff-47a0-11ed-aedd-7cd30abc95d8
1b30d0ff-47a0-11ed-aedd-7cd30abc95d8
1b30d0ff-47a0-11ed-aedd-7cd30abc95d8
1b30d0ff-47a0-11ed-aedd-7cd30abc95d8
1b30d0ff-47a0-11ed-aedd-7cd30abc95d8
1b30d0ff-47a0-11ed-aedd-7cd30abc95d8
1b30d0ff-47a0-11ed-aedd-7cd30abc95d8
1b30d0ff-47a0-11ed-aedd-7cd30abc95d8
1b30d0ff-47a0-11ed-aedd-7cd30abc95d8
1b30d0ff-47a0-11ed-aedd-7cd30abc95d8
1b30d0ff-47a0-11ed-aedd-7cd30abc95d8
1b30d0ff-47a0-11ed-aedd-7cd30abc95d8
1b30d0ff-47a0-11ed-aedd-7cd30abc95d8
1b30d0ff-47a0-11ed-aedd-7cd30abc95d8
1b30d0ff-47a0-11ed-aedd-7cd30abc95d8
1b30d0ff-47a0-11ed-aedd-7cd30abc95d8
1b30d0ff-47a0-11ed-aedd-7cd30abc95d8
1b30d0ff-47a0-11ed-aedd-7cd30abc95d8
1b30d0ff-47a0-11ed-aedd-7cd30abc95d8
1b30d0ff-47a0-11ed-aedd-7cd30abc95d8
1b30d0ff-47a0-11ed-aedd-7cd30abc95d8
1b30d0ff-47a0-11ed-aedd-7cd30abc95d8
1b30d0ff-47a0-11ed-aedd-7cd30abc95d8
1b30d0ff-47a0-11ed-aedd-7cd30abc95d8
1b30d0ff-47a0-11ed-aedd-7cd30abc95d8
1b30d0ff-47a0-11ed-aedd-7cd30abc95d8
1b30d0ff-47a0-11ed-aedd-7cd30abc95d8
1b30d0ff-47a0-11ed-aedd-7cd30abc95d8
1b30d0ff-47a0-11ed-aedd-7cd30abc95d8
1b30d0ff-47a0-11ed-aedd-7cd30abc95d8
1b30d0ff-47a0-11ed-aedd-7cd30abc95d8
1b30d0ff-47a0-11ed-aedd-7cd30abc95d8
1b30d0ff-47a0-11ed-aedd-7cd30abc95d8
1b30d0ff-47a0-11ed-aedd-7cd30abc95d8
1b30d0ff-47a0-11ed-aedd-7cd30abc95d8
1b30d0ff-47a0-11ed-aedd-7cd30abc95d8
1b30d0ff-47a0-11ed-aedd-7cd30abc95d8
1b30d0ff-47a0-11ed-aedd-7cd30abc95d8
1b30d0ff-47a0-11ed-aedd-7cd30abc95d8
1b30d0ff-47a0-11ed-aedd-7cd30abc95d8
1b30d0ff-47a0-11ed-aedd-7cd30abc95d8
1b30d0ff-47a0-11ed-aedd-7cd30abc95d8
1b30d0ff-47a0-11ed-aedd-7cd30abc95d8
1b30d0ff-47a0-11ed-aedd-7cd30abc95d8
1b30d0ff-47a0-11ed-aedd-7cd30abc95d8
1b30d0ff-47a0-11ed-aedd-7cd30abc95d8
1b30d0ff-47a0-11ed-aedd-7cd30abc95d8
1b30d0ff-47a0-11ed-aedd-7cd30abc95d8
1b30d0ff-47a0-11ed-aedd-7cd30abc95d8
1b30d0ff-47a0-11ed-aedd-7cd30abc95d8
1b30d0ff-47a0-11ed-aedd-7cd30abc95d8
1b30d0ff-47a0-11ed-aedd-7cd30abc95d8
1b30d0ff-47a0-11ed-aedd-7cd30abc95d8
1b30d0ff-47a0-11ed-aedd-7cd30abc95d8
1b30d0ff-47a0-11ed-aedd-7cd30abc95d8
1b30d0ff-47a0-11ed-aedd-7cd30abc95d8
1b30d0ff-47a0-11ed-aedd-7cd30abc95d8
1b30d0ff-47a0-11ed-aedd-7cd30abc95d8
1b30d0ff-47a0-11ed-aedd-7cd30abc95d8
1b30d0ff-47a0-11ed-aedd-7cd30abc95d8
1b30d0ff-47a0-11ed-aedd-7cd30abc95d8
1b30d0ff-47a0-11ed-aedd-7cd30abc95d8
1b30d0ff-47a0-11ed-aedd-7cd30abc95d8
1b30d0ff-47a0-11ed-aedd-7cd30abc95d8
1b30d0ff-47a0-11ed-aedd-7cd30abc95d8
1b30d0ff-47a0-11ed-aedd-7cd30abc95d8
1b30d0ff-47a0-11ed-aedd-7cd30abc95d8
1b30d0ff-47a0-11ed-aedd-7cd30abc95d8
1b30d0ff-47a0-11ed-aedd-7cd30abc95d8
1b30d0ff-47a0-11ed-aedd-7cd30abc95d8
1b30d0ff-47a0-11ed-aedd-7cd30abc95d8
1b30d0ff-47a0-11ed-aedd-7cd30abc95d8
1b30d0ff-47a0-11ed-aedd-7cd30abc95d8
1b30d0ff-47a0-11ed-aedd-7cd30abc95d8
1b30d0ff-47a0-11ed-aedd-7cd30abc95d8
1b30d0ff-47a0-11ed-aedd-7cd30abc95d8
1b30d0ff-47a0-11ed-aedd-7cd30abc95d8
1b30d0ff-47a0-11ed-aedd-7cd30abc95d8
1b30d0ff-47a0-11ed-aedd-7cd30abc95d8
1b30d0ff-47a0-11ed-aedd-7cd30abc95d8
1b30d0ff-47a0-11ed-aedd-7cd30abc95d8
1b30d0ff-47a0-11ed-aedd-7cd30abc95d8
1b30d0ff-47a0-11ed-aedd-7cd30abc95d8
1b30d0ff-47a0-11ed-aedd-7cd30abc95d8
1b30d0ff-47a0-11ed-aedd-7cd30abc95d8
1b30d0ff-47a0-11ed-aedd-7cd30abc95d8
1b30d0ff-47a0-11ed-aedd-7cd30abc95d8
1b30d0ff-47a0-11ed-aedd-7cd30abc95d8
1b30d0ff-47a0-11ed-aedd-7cd30abc95d8
1b30d0ff-47a0-11ed-aedd-7cd30abc95d8
1b30d0ff-47a0-11ed-aedd-7cd30abc95d8
1b30d0ff-47a0-11ed-aedd-7cd30abc95d8
1b30d0ff-47a0-11ed-aedd-7cd30abc95d8
1b30d0ff-47a0-11ed-aedd-7cd30abc95d8
1b30d0ff-47a0-11ed-aedd-7cd30abc95d8
1b30d0ff-47a0-11ed-aedd-7cd30abc95d8
1b30d0ff-47a0-11ed-aedd-7cd30abc95d8
1b30d0ff-47a0-11ed-aedd-7cd30abc95d8
1b30d0ff-47a0-11ed-aedd-7cd30abc95d8
1b30d0ff-47a0-11ed-aedd-7cd30abc95d8
1b30d0ff-47a0-11ed-aedd-7cd30abc95d8
1b30d0ff-47a0-11ed-aedd-7cd30abc95d8
1b30d0ff-47a0-11ed-aedd-7cd30abc95d8
1b30d0ff-47a0-11ed-aedd-7cd30abc95d8
1b30d0ff-47a0-11ed-aedd-7cd30abc95d8
1b30d0ff-47a0-11ed-aedd-7cd30abc95d8
1b30d0ff-47a0-11ed-aedd-7cd30abc95d8
1b30d0ff-47a0-11ed-aedd-7cd30abc95d8
1b30d0ff-47a0-11ed-aedd-7cd30abc95d8
1b30d0ff-47a0-11ed-aedd-7cd30abc95d8
1b30d0ff-47a0-11ed-aedd-7cd30abc95d8
1b30d0ff-47a0-11ed-aedd-7cd30abc95d8
1b30d0ff-47a0-11ed-aedd-7cd30abc95d8
1b30d0ff-47a0-11ed-aedd-7cd30abc95d8
1b30d0ff-47a0-11ed-aedd-7cd30abc95d8
1b30d0ff-47a0-11ed-aedd-7cd30abc95d8
1b30d0ff-47a0-11ed-aedd-7cd30abc95d8
1b30d0ff-47a0-11ed-aedd-7cd30abc95d8
1b30d0ff-47a0-11ed-aedd-7cd30abc95d8
1b30d0ff-47a0-11ed-aedd-7cd30abc95d8
1b30d0ff-47a0-11ed-aedd-7cd30abc95d8
1b30d0ff-47a0-11ed-aedd-7cd30abc95d8
1b30d0ff-47a0-11ed-aedd-7cd30abc95d8
1b30d0ff-47a0-11ed-aedd-7cd30abc95d8
1b30d0ff-47a0-11ed-aedd-7cd30abc95d8
1b30d0ff-47a0-11ed-aedd-7cd30abc95d8
1b30d0ff-47a0-11ed-aedd-7cd30abc95d8
1b30d0ff-47a0-11ed-aedd-7cd30abc95d8
1b30d0ff-47a0-11ed-aedd-7cd30abc95d8
1b30d0ff-47a0-11ed-aedd-7cd30abc95d8
1b30d0ff-47a0-11ed-aedd-7cd30abc95d8
1b30d0ff-47a0-11ed-aedd-7cd30abc95d8
1b30d0ff-47a0-11ed-aedd-7cd30abc95d8
1b30d0ff-47a0-11ed-aedd-7cd30abc95d8
1b30d0ff-47a0-11ed-aedd-7cd30abc95d8
1b30d0ff-47a0-11ed-aedd-7cd30abc95d8
1b30d0ff-47a0-11ed-aedd-7cd30abc95d8
1b30d0ff-47a0-11ed-aedd-7cd30abc95d8
1b30d0ff-47a0-11ed-aedd-7cd30abc95d8
1b30d0ff-47a0-11ed-aedd-7cd30abc95d8
1b30d0ff-47a0-11ed-aedd-7cd30abc95d8
1b30d0ff-47a0-11ed-aedd-7cd30abc95d8
1b30d0ff-47a0-11ed-aedd-7cd30abc95d8
1b30d0ff-47a0-11ed-aedd-7cd30abc95d8
1b30d0ff-47a0-11ed-aedd-7cd30abc95d8
1b30d0ff-47a0-11ed-aedd-7cd30abc95d8
1b30d0ff-47a0-11ed-aedd-7cd30abc95d8
1b30d0ff-47a0-11ed-aedd-7cd30abc95d8
1b30d0ff-47a0-11ed-aedd-7cd30abc95d8
1b30d0ff-47a0-11ed-aedd-7cd30abc95d8
1b30d0ff-47a0-11ed-aedd-7cd30abc95d8
1b30d0ff-47a0-11ed-aedd-7cd30abc95d8
1b30d0ff-47a0-11ed-aedd-7cd30abc95d8
1b30d0ff-47a0-11ed-aedd-7cd30abc95d8
1b30d0ff-47a0-11ed-aedd-7cd30abc95d8
1b30d0ff-47a0-11ed-aedd-7cd30abc95d8
1b30d0ff-47a0-11ed-aedd-7cd30abc95d8
1b30d0ff-47a0-11ed-aedd-7cd30abc95d8
1b30d0ff-47a0-11ed-aedd-7cd30abc95d8
1b30d0ff-47a0-11ed-aedd-7cd30abc95d8
1b30d0ff-47a0-11ed-aedd-7cd30abc95d8
1b30d0ff-47a0-11ed-aedd-7cd30abc95d8
1b30d0ff-47a0-11ed-aedd-7cd30abc95d8
1b30d0ff-47a0-11ed-aedd-7cd30abc95d8
1b30d0ff-47a0-11ed-aedd-7cd30abc95d8
1b30d0ff-47a0-11ed-aedd-7cd30abc95d8
1b30d0ff-47a0-11ed-aedd-7cd30abc95d8
1b30d0ff-47a0-11ed-aedd-7cd30abc95d8
1b30d0ff-47a0-11ed-aedd-7cd30abc95d8
1b30d0ff-47a0-11ed-aedd-7cd30abc95d8
1b30d0ff-47a0-11ed-aedd-7cd30abc95d8
1b30d0ff-47a0-11ed-aedd-7cd30abc95d8
1b30d0ff-47a0-11ed-aedd-7cd30abc95d8
1b30d0ff-47a0-11ed-aedd-7cd30abc95d8
1b30d0ff-47a0-11ed-aedd-7cd30abc95d8
1b30d0ff-47a0-11ed-aedd-7cd30abc95d8
1b30d0ff-47a0-11ed-aedd-7cd30abc95d8
1b30d0ff-47a0-11ed-aedd-7cd30abc95d8
1b30d0ff-47a0-11ed-aedd-7cd30abc95d8
1b30d0ff-47a0-11ed-aedd-7cd30abc95d8
1b30d0ff-47a0-11ed-aedd-7cd30abc95d8
1b30d0ff-47a0-11ed-aedd-7cd30abc95d8
1b30d0ff-47a0-11ed-aedd-7cd30abc95d8
1b30d0ff-47a0-11ed-aedd-7cd30abc95d8
1b30d0ff-47a0-11ed-aedd-7cd30abc95d8
1b30d0ff-47a0-11ed-aedd-7cd30abc95d8
1b30d0ff-47a0-11ed-aedd-7cd30abc95d8
1b30d0ff-47a0-11ed-aedd-7cd30abc95d8
1b30d0ff-47a0-11ed-aedd-7cd30abc95d8
1b30d0ff-47a0-11ed-aedd-7cd30abc95d8
1b30d0ff-47a0-11ed-aedd-7cd30abc95d8
1b30d0ff-47a0-11ed-aedd-7cd30abc95d8
1b30d0ff-47a0-11ed-aedd-7cd30abc95d8
1b30d0ff-47a0-11ed-aedd-7cd30abc95d8
1b30d0ff-47a0-11ed-aedd-7cd30abc95d8
1b30d0ff-47a0-11ed-aedd-7cd30abc95d8
1b30d0ff-47a0-11ed-aedd-7cd30abc95d8
1b30d0ff-47a0-11ed-aedd-7cd30abc95d8
1b30d0ff-47a0-11ed-aedd-7cd30abc95d8
1b30d0ff-47a0-11ed-aedd-7cd30abc95d8
1b30d0ff-47a0-11ed-aedd-7cd30abc95d8
1b30d0ff-47a0-11ed-aedd-7cd30abc95d8
1b30d0ff-47a0-11ed-aedd-7cd30abc95d8
1b30d0ff-47a0-11ed-aedd-7cd30abc95d8
1b30d0ff-47a0-11ed-aedd-7cd30abc95d8
1b30d0ff-47a0-11ed-aedd-7cd30abc95d8
1b30d0ff-47a0-11ed-aedd-7cd30abc95d8
1b30d0ff-47a0-11ed-aedd-7cd30abc95d8
1b30d0ff-47a0-11ed-aedd-7cd30abc95d8
1b30d0ff-47a0-11ed-aedd-7cd30abc95d8
1b30d0ff-47a0-11ed-aedd-7cd30abc95d8
1b30d0ff-47a0-11ed-aedd-7cd30abc95d8
1b30d0ff-47a0-11ed-aedd-7cd30abc95d8
1b30d0ff-47a0-11ed-aedd-7cd30abc95d8
1b30d0ff-47a0-11ed-aedd-7cd30abc95d8
1b30d0ff-47a0-11ed-aedd-7cd30abc95d8
1b30d0ff-47a0-11ed-aedd-7cd30abc95d8
1b30d0ff-47a0-11ed-aedd-7cd30abc95d8
1b30d0ff-47a0-11ed-aedd-7cd30abc95d8
1b30d0ff-47a0-11ed-aedd-7cd30abc95d8
1b30d0ff-47a0-11ed-aedd-7cd30abc95d8
1b30d0ff-47a0-11ed-aedd-7cd30abc95d8
1b30d0ff-47a0-11ed-aedd-7cd30abc95d8
1b30d0ff-47a0-11ed-aedd-7cd30abc95d8
1b30d0ff-47a0-11ed-aedd-7cd30abc95d8
1b30d0ff-47a0-11ed-aedd-7cd30abc95d8
1b30d0ff-47a0-11ed-aedd-7cd30abc95d8
1b30d0ff-47a0-11ed-aedd-7cd30abc95d8
1b30d0ff-47a0-11ed-aedd-7cd30abc95d8
1b30d0ff-47a0-11ed-aedd-7cd30abc95d8
1b30d0ff-47a0-11ed-aedd-7cd30abc95d8
1b30d0ff-47a0-11ed-aedd-7cd30abc95d8
1b30d0ff-47a0-11ed-aedd-7cd30abc95d8
1b30d0ff-47a0-11ed-aedd-7cd30abc95d8
1b30d0ff-47a0-11ed-aedd-7cd30abc95d8
1b30d0ff-47a0-11ed-aedd-7cd30abc95d8
1b30d0ff-47a0-11ed-aedd-7cd30abc95d8
1b30d0ff-47a0-11ed-aedd-7cd30abc95d8
1b30d0ff-47a0-11ed-aedd-7cd30abc95d8
1b30d0ff-47a0-11ed-aedd-7cd30abc95d8
1b30d0ff-47a0-11ed-aedd-7cd30abc95d8
1b30d0ff-47a0-11ed-aedd-7cd30abc95d8
1b30d0ff-47a0-11ed-aedd-7cd30abc95d8
1b30d0ff-47a0-11ed-aedd-7cd30abc95d8
1b30d0ff-47a0-11ed-aedd-7cd30abc95d8
1b30d0ff-47a0-11ed-aedd-7cd30abc95d8
1b30d0ff-47a0-11ed-aedd-7cd30abc95d8
1b30d0ff-47a0-11ed-aedd-7cd30abc95d8
1b30d0ff-47a0-11ed-aedd-7cd30abc95d8
1b30d0ff-47a0-11ed-aedd-7cd30abc95d8
1b30d0ff-47a0-11ed-aedd-7cd30abc95d8
1b30d0ff-47a0-11ed-aedd-7cd30abc95d8
1b30d0ff-47a0-11ed-aedd-7cd30abc95d8
1b30d0ff-47a0-11ed-aedd-7cd30abc95d8
1b30d0ff-47a0-11ed-aedd-7cd30abc95d8
1b30d0ff-47a0-11ed-aedd-7cd30abc95d8
1b30d0ff-47a0-11ed-aedd-7cd30abc95d8
1b30d0ff-47a0-11ed-aedd-7cd30abc95d8
1b30d0ff-47a0-11ed-aedd-7cd30abc95d8
1b30d0ff-47a0-11ed-aedd-7cd30abc95d8
1b30d0ff-47a0-11ed-aedd-7cd30abc95d8
1b30d0ff-47a0-11ed-aedd-7cd30abc95d8
1b30d0ff-47a0-11ed-aedd-7cd30abc95d8
1b30d0ff-47a0-11ed-aedd-7cd30abc95d8
1b30d0ff-47a0-11ed-aedd-7cd30abc95d8
1b30d0ff-47a0-11ed-aedd-7cd30abc95d8
1b30d0ff-47a0-11ed-aedd-7cd30abc95d8
1b30d0ff-47a0-11ed-aedd-7cd30abc95d8
1b30d0ff-47a0-11ed-aedd-7cd30abc95d8
1b30d0ff-47a0-11ed-aedd-7cd30abc95d8
1b30d0ff-47a0-11ed-aedd-7cd30abc95d8
1b30d0ff-47a0-11ed-aedd-7cd30abc95d8
1b30d0ff-47a0-11ed-aedd-7cd30abc95d8
1b30d0ff-47a0-11ed-aedd-7cd30abc95d8
1b30d0ff-47a0-11ed-aedd-7cd30abc95d8
1b30d0ff-47a0-11ed-aedd-7cd30abc95d8
1b30d0ff-47a0-11ed-aedd-7cd30abc95d8
1b30d0ff-47a0-11ed-aedd-7cd30abc95d8
1b30d0ff-47a0-11ed-aedd-7cd30abc95d8
1b30d0ff-47a0-11ed-aedd-7cd30abc95d8
1b30d0ff-47a0-11ed-aedd-7cd30abc95d8
1b30d0ff-47a0-11ed-aedd-7cd30abc95d8
1b30d0ff-47a0-11ed-aedd-7cd30abc95d8
1b30d0ff-47a0-11ed-aedd-7cd30abc95d8
1b30d0ff-47a0-11ed-aedd-7cd30abc95d8
1b30d0ff-47a0-11ed-aedd-7cd30abc95d8
1b30d0ff-47a0-11ed-aedd-7cd30abc95d8
1b30d0ff-47a0-11ed-aedd-7cd30abc95d8
1b30d0ff-47a0-11ed-aedd-7cd30abc95d8
1b30d0ff-47a0-11ed-aedd-7cd30abc95d8
1b30d0ff-47a0-11ed-aedd-7cd30abc95d8
1b30d0ff-47a0-11ed-aedd-7cd30abc95d8
1b30d0ff-47a0-11ed-aedd-7cd30abc95d8
1b30d0ff-47a0-11ed-aedd-7cd30abc95d8
1b30d0ff-47a0-11ed-aedd-7cd30abc95d8
1b30d0ff-47a0-11ed-aedd-7cd30abc95d8
1b30d0ff-47a0-11ed-aedd-7cd30abc95d8
1b30d0ff-47a0-11ed-aedd-7cd30abc95d8
1b30d0ff-47a0-11ed-aedd-7cd30abc95d8
1b30d0ff-47a0-11ed-aedd-7cd30abc95d8
1b30d0ff-47a0-11ed-aedd-7cd30abc95d8
1b30d0ff-47a0-11ed-aedd-7cd30abc95d8
1b30d0ff-47a0-11ed-aedd-7cd30abc95d8
1b30d0ff-47a0-11ed-aedd-7cd30abc95d8
1b30d0ff-47a0-11ed-aedd-7cd30abc95d8
1b30d0ff-47a0-11ed-aedd-7cd30abc95d8
1b30d0ff-47a0-11ed-aedd-7cd30abc95d8
1b30d0ff-47a0-11ed-aedd-7cd30abc95d8
1b30d0ff-47a0-11ed-aedd-7cd30abc95d8
1b30d0ff-47a0-11ed-aedd-7cd30abc95d8
1b30d0ff-47a0-11ed-aedd-7cd30abc95d8
1b30d0ff-47a0-11ed-aedd-7cd30abc95d8
1b30d0ff-47a0-11ed-aedd-7cd30abc95d8
1b30d0ff-47a0-11ed-aedd-7cd30abc95d8
1b30d0ff-47a0-11ed-aedd-7cd30abc95d8
1b30d0ff-47a0-11ed-aedd-7cd30abc95d8
1b30d0ff-47a0-11ed-aedd-7cd30abc95d8
1b30d0ff-47a0-11ed-aedd-7cd30abc95d8
1b30d0ff-47a0-11ed-aedd-7cd30abc95d8
1b30d0ff-47a0-11ed-aedd-7cd30abc95d8
1b30d0ff-47a0-11ed-aedd-7cd30abc95d8
1b30d0ff-47a0-11ed-aedd-7cd30abc95d8
1b30d0ff-47a0-11ed-aedd-7cd30abc95d8
1b30d0ff-47a0-11ed-aedd-7cd30abc95d8
1b30d0ff-47a0-11ed-aedd-7cd30abc95d8
1b30d0ff-47a0-11ed-aedd-7cd30abc95d8
1b30d0ff-47a0-11ed-aedd-7cd30abc95d8
1b30d0ff-47a0-11ed-aedd-7cd30abc95d8
1b30d0ff-47a0-11ed-aedd-7cd30abc95d8
1b30d0ff-47a0-11ed-aedd-7cd30abc95d8
1b30d0ff-47a0-11ed-aedd-7cd30abc95d8
1b30d0ff-47a0-11ed-aedd-7cd30abc95d8
1b30d0ff-47a0-11ed-aedd-7cd30abc95d8
1b30d0ff-47a0-11ed-aedd-7cd30abc95d8
1b30d0ff-47a0-11ed-aedd-7cd30abc95d8
1b30d0ff-47a0-11ed-aedd-7cd30abc95d8
1b30d0ff-47a0-11ed-aedd-7cd30abc95d8
1b30d0ff-47a0-11ed-aedd-7cd30abc95d8
1b30d0ff-47a0-11ed-aedd-7cd30abc95d8
1b30d0ff-47a0-11ed-aedd-7cd30abc95d8
1b30d0ff-47a0-11ed-aedd-7cd30abc95d8
1b30d0ff-47a0-11ed-aedd-7cd30abc95d8
1b30d0ff-47a0-11ed-aedd-7cd30abc95d8
1b30d0ff-47a0-11ed-aedd-7cd30abc95d8
1b30d0ff-47a0-11ed-aedd-7cd30abc95d8
1b30d0ff-47a0-11ed-aedd-7cd30abc95d8
1b30d0ff-47a0-11ed-aedd-7cd30abc95d8
1b30d0ff-47a0-11ed-aedd-7cd30abc95d8
1b30d0ff-47a0-11ed-aedd-7cd30abc95d8
1b30d0ff-47a0-11ed-aedd-7cd30abc95d8
1b30d0ff-47a0-11ed-aedd-7cd30abc95d8
1b30d0ff-47a0-11ed-aedd-7cd30abc95d8
1b30d0ff-47a0-11ed-aedd-7cd30abc95d8
1b30d0ff-47a0-11ed-aedd-7cd30abc95d8
1b30d0ff-47a0-11ed-aedd-7cd30abc95d8
1b30d0ff-47a0-11ed-aedd-7cd30abc95d8
1b30d0ff-47a0-11ed-aedd-7cd30abc95d8
1b30d0ff-47a0-11ed-aedd-7cd30abc95d8
1b30d0ff-47a0-11ed-aedd-7cd30abc95d8
1b30d0ff-47a0-11ed-aedd-7cd30abc95d8
1b30d0ff-47a0-11ed-aedd-7cd30abc95d8
1b30d0ff-47a0-11ed-aedd-7cd30abc95d8
1b30d0ff-47a0-11ed-aedd-7cd30abc95d8
1b30d0ff-47a0-11ed-aedd-7cd30abc95d8
1b30d0ff-47a0-11ed-aedd-7cd30abc95d8
1b30d0ff-47a0-11ed-aedd-7cd30abc95d8
1b30d0ff-47a0-11ed-aedd-7cd30abc95d8
1b30d0ff-47a0-11ed-aedd-7cd30abc95d8
1b30d0ff-47a0-11ed-aedd-7cd30abc95d8
1b30d0ff-47a0-11ed-aedd-7cd30abc95d8
1b30d0ff-47a0-11ed-aedd-7cd30abc95d8
1b30d0ff-47a0-11ed-aedd-7cd30abc95d8
1b30d0ff-47a0-11ed-aedd-7cd30abc95d8
1b30d0ff-47a0-11ed-aedd-7cd30abc95d8
1b30d0ff-47a0-11ed-aedd-7cd30abc95d8
1b30d0ff-47a0-11ed-aedd-7cd30abc95d8
1b30d0ff-47a0-11ed-aedd-7cd30abc95d8
1b30d0ff-47a0-11ed-aedd-7cd30abc95d8
1b30d0ff-47a0-11ed-aedd-7cd30abc95d8
1b30d0ff-47a0-11ed-aedd-7cd30abc95d8
1b30d0ff-47a0-11ed-aedd-7cd30abc95d8
1b30d0ff-47a0-11ed-aedd-7cd30abc95d8
1b30d0ff-47a0-11ed-aedd-7cd30abc95d8
1b30d0ff-47a0-11ed-aedd-7cd30abc95d8
1b30d0ff-47a0-11ed-aedd-7cd30abc95d8
1b30d0ff-47a0-11ed-aedd-7cd30abc95d8
1b30d0ff-47a0-11ed-aedd-7cd30abc95d8
1b30d0ff-47a0-11ed-aedd-7cd30abc95d8
1b30d0ff-47a0-11ed-aedd-7cd30abc95d8
1b30d0ff-47a0-11ed-aedd-7cd30abc95d8
1b30d0ff-47a0-11ed-aedd-7cd30abc95d8
1b30d0ff-47a0-11ed-aedd-7cd30abc95d8
1b30d0ff-47a0-11ed-aedd-7cd30abc95d8
1b30d0ff-47a0-11ed-aedd-7cd30abc95d8
1b30d0ff-47a0-11ed-aedd-7cd30abc95d8
1b30d0ff-47a0-11ed-aedd-7cd30abc95d8
1b30d0ff-47a0-11ed-aedd-7cd30abc95d8
1b30d0ff-47a0-11ed-aedd-7cd30abc95d8
1b30d0ff-47a0-11ed-aedd-7cd30abc95d8
1b30d0ff-47a0-11ed-aedd-7cd30abc95d8
1b30d0ff-47a0-11ed-aedd-7cd30abc95d8
1b30d0ff-47a0-11ed-aedd-7cd30abc95d8
1b30d0ff-47a0-11ed-aedd-7cd30abc95d8
1b30d0ff-47a0-11ed-aedd-7cd30abc95d8
1b30d0ff-47a0-11ed-aedd-7cd30abc95d8
1b30d0ff-47a0-11ed-aedd-7cd30abc95d8
1b30d0ff-47a0-11ed-aedd-7cd30abc95d8
1b30d0ff-47a0-11ed-aedd-7cd30abc95d8
1b30d0ff-47a0-11ed-aedd-7cd30abc95d8
1b30d0ff-47a0-11ed-aedd-7cd30abc95d8
1b30d0ff-47a0-11ed-aedd-7cd30abc95d8
1b30d0ff-47a0-11ed-aedd-7cd30abc95d8
1b30d0ff-47a0-11ed-aedd-7cd30abc95d8
1b30d0ff-47a0-11ed-aedd-7cd30abc95d8
1b30d0ff-47a0-11ed-aedd-7cd30abc95d8
1b30d0ff-47a0-11ed-aedd-7cd30abc95d8
1b30d0ff-47a0-11ed-aedd-7cd30abc95d8
1b30d0ff-47a0-11ed-aedd-7cd30abc95d8
1b30d0ff-47a0-11ed-aedd-7cd30abc95d8
1b30d0ff-47a0-11ed-aedd-7cd30abc95d8
1b30d0ff-47a0-11ed-aedd-7cd30abc95d8
1b30d0ff-47a0-11ed-aedd-7cd30abc95d8
1b30d0ff-47a0-11ed-aedd-7cd30abc95d8
1b30d0ff-47a0-11ed-aedd-7cd30abc95d8
1b30d0ff-47a0-11ed-aedd-7cd30abc95d8
1b30d0ff-47a0-11ed-aedd-7cd30abc95d8
1b30d0ff-47a0-11ed-aedd-7cd30abc95d8
1b30d0ff-47a0-11ed-aedd-7cd30abc95d8
1b30d0ff-47a0-11ed-aedd-7cd30abc95d8
1b30d0ff-47a0-11ed-aedd-7cd30abc95d8
1b30d0ff-47a0-11ed-aedd-7cd30abc95d8
1b30d0ff-47a0-11ed-aedd-7cd30abc95d8
1b30d0ff-47a0-11ed-aedd-7cd30abc95d8
1b30d0ff-47a0-11ed-aedd-7cd30abc95d8
1b30d0ff-47a0-11ed-aedd-7cd30abc95d8
1b30d0ff-47a0-11ed-aedd-7cd30abc95d8
1b30d0ff-47a0-11ed-aedd-7cd30abc95d8
1b30d0ff-47a0-11ed-aedd-7cd30abc95d8
1b30d0ff-47a0-11ed-aedd-7cd30abc95d8
1b30d0ff-47a0-11ed-aedd-7cd30abc95d8
1b30d0ff-47a0-11ed-aedd-7cd30abc95d8
1b30d0ff-47a0-11ed-aedd-7cd30abc95d8
1b30d0ff-47a0-11ed-aedd-7cd30abc95d8
1b30d0ff-47a0-11ed-aedd-7cd30abc95d8
1b30d0ff-47a0-11ed-aedd-7cd30abc95d8
1b30d0ff-47a0-11ed-aedd-7cd30abc95d8
1b30d0ff-47a0-11ed-aedd-7cd30abc95d8
1b30d0ff-47a0-11ed-aedd-7cd30abc95d8
1b30d0ff-47a0-11ed-aedd-7cd30abc95d8
1b30d0ff-47a0-11ed-aedd-7cd30abc95d8
1b30d0ff-47a0-11ed-aedd-7cd30abc95d8
1b30d0ff-47a0-11ed-aedd-7cd30abc95d8
1b30d0ff-47a0-11ed-aedd-7cd30abc95d8
1b30d0ff-47a0-11ed-aedd-7cd30abc95d8
1b30d0ff-47a0-11ed-aedd-7cd30abc95d8
1b30d0ff-47a0-11ed-aedd-7cd30abc95d8
1b30d0ff-47a0-11ed-aedd-7cd30abc95d8
1b30d0ff-47a0-11ed-aedd-7cd30abc95d8
1b30d0ff-47a0-11ed-aedd-7cd30abc95d8
1b30d0ff-47a0-11ed-aedd-7cd30abc95d8
1b30d0ff-47a0-11ed-aedd-7cd30abc95d8
1b30d0ff-47a0-11ed-aedd-7cd30abc95d8
1b30d0ff-47a0-11ed-aedd-7cd30abc95d8
1b30d0ff-47a0-11ed-aedd-7cd30abc95d8
1b30d0ff-47a0-11ed-aedd-7cd30abc95d8
1b30d0ff-47a0-11ed-aedd-7cd30abc95d8
1b30d0ff-47a0-11ed-aedd-7cd30abc95d8
1b30d0ff-47a0-11ed-aedd-7cd30abc95d8
1b30d0ff-47a0-11ed-aedd-7cd30abc95d8
1b30d0ff-47a0-11ed-aedd-7cd30abc95d8
1b30d0ff-47a0-11ed-aedd-7cd30abc95d8
1b30d0ff-47a0-11ed-aedd-7cd30abc95d8
1b30d0ff-47a0-11ed-aedd-7cd30abc95d8
1b30d0ff-47a0-11ed-aedd-7cd30abc95d8
1b30d0ff-47a0-11ed-aedd-7cd30abc95d8
1b30d0ff-47a0-11ed-aedd-7cd30abc95d8
1b30d0ff-47a0-11ed-aedd-7cd30abc95d8
1b30d0ff-47a0-11ed-aedd-7cd30abc95d8
1b30d0ff-47a0-11ed-aedd-7cd30abc95d8
1b30d0ff-47a0-11ed-aedd-7cd30abc95d8
1b30d0ff-47a0-11ed-aedd-7cd30abc95d8
1b30d0ff-47a0-11ed-aedd-7cd30abc95d8
1b30d0ff-47a0-11ed-aedd-7cd30abc95d8
1b30d0ff-47a0-11ed-aedd-7cd30abc95d8
1b30d0ff-47a0-11ed-aedd-7cd30abc95d8
1b30d0ff-47a0-11ed-aedd-7cd30abc95d8
1b30d0ff-47a0-11ed-aedd-7cd30abc95d8
47a011ed-d0ff-1b30-aedd-7cd30abc95d8
47a011ed-d0ff-1b30-aedd-7cd30abc95d8
47a011ed-d0ff-1b30-aedd-7cd30abc95d8
47a011ed-d0ff-1b30-aedd-7cd30abc95d8
47a011ed-d0ff-1b30-aedd-7cd30abc95d8
47a011ed-d0ff-1b30-aedd-7cd30abc95d8
47a011ed-d0ff-1b30-aedd-7cd30abc95d8
47a011ed-d0ff-1b30-aedd-7cd30abc95d8
47a011ed-d0ff-1b30-aedd-7cd30abc95d8
47a011ed-d0ff-1b30-aedd-7cd30abc95d8
47a011ed-d0ff-1b30-aedd-7cd30abc95d8
47a011ed-d0ff-1b30-aedd-7cd30abc95d8
47a011ed-d0ff-1b30-aedd-7cd30abc95d8
47a011ed-d0ff-1b30-aedd-7cd30abc95d8
47a011ed-d0ff-1b30-aedd-7cd30abc95d8
47a011ed-d0ff-1b30-aedd-7cd30abc95d8
47a011ed-d0ff-1b30-aedd-7cd30abc95d8
47a011ed-d0ff-1b30-aedd-7cd30abc95d8
47a011ed-d0ff-1b30-aedd-7cd30abc95d8
47a011ed-d0ff-1b30-aedd-7cd30abc95d8
47a011ed-d0ff-1b30-aedd-7cd30abc95d8
47a011ed-d0ff-1b30-aedd-7cd30abc95d8
47a011ed-d0ff-1b30-aedd-7cd30abc95d8
47a011ed-d0ff-1b30-aedd-7cd30abc95d8
47a011ed-d0ff-1b30-aedd-7cd30abc95d8
47a011ed-d0ff-1b30-aedd-7cd30abc95d8
47a011ed-d0ff-1b30-aedd-7cd30abc95d8
47a011ed-d0ff-1b30-aedd-7cd30abc95d8
47a011ed-d0ff-1b30-aedd-7cd30abc95d8
47a011ed-d0ff-1b30-aedd-7cd30abc95d8
47a011ed-d0ff-1b30-aedd-7cd30abc95d8
47a011ed-d0ff-1b30-aedd-7cd30abc95d8
47a011ed-d0ff-1b30-aedd-7cd30abc95d8
47a011ed-d0ff-1b30-aedd-7cd30abc95d8
47a011ed-d0ff-1b30-aedd-7cd30abc95d8
47a011ed-d0ff-1b30-aedd-7cd30abc95d8
47a011ed-d0ff-1b30-aedd-7cd30abc95d8
47a011ed-d0ff-1b30-aedd-7cd30abc95d8
47a011ed-d0ff-1b30-aedd-7cd30abc95d8
47a011ed-d0ff-1b30-aedd-7cd30abc95d8
47a011ed-d0ff-1b30-aedd-7cd30abc95d8
47a011ed-d0ff-1b30-aedd-7cd30abc95d8
47a011ed-d0ff-1b30-aedd-7cd30abc95d8
47a011ed-d0ff-1b30-aedd-7cd30abc95d8
47a011ed-d0ff-1b30-aedd-7cd30abc95d8
47a011ed-d0ff-1b30-aedd-7cd30abc95d8
47a011ed-d0ff-1b30-aedd-7cd30abc95d8
47a011ed-d0ff-1b30-aedd-7cd30abc95d8
47a011ed-d0ff-1b30-aedd-7cd30abc95d8
47a011ed-d0ff-1b30-aedd-7cd30abc95d8
47a011ed-d0ff-1b30-aedd-7cd30abc95d8
47a011ed-d0ff-1b30-aedd-7cd30abc95d8
47a011ed-d0ff-1b30-aedd-7cd30abc95d8
47a011ed-d0ff-1b30-aedd-7cd30abc95d8
47a011ed-d0ff-1b30-aedd-7cd30abc95d8
47a011ed-d0ff-1b30-aedd-7cd30abc95d8
47a011ed-d0ff-1b30-aedd-7cd30abc95d8
47a011ed-d0ff-1b30-aedd-7cd30abc95d8
47a011ed-d0ff-1b30-aedd-7cd30abc95d8
47a011ed-d0ff-1b30-aedd-7cd30abc95d8
47a011ed-d0ff-1b30-aedd-7cd30abc95d8
47a011ed-d0ff-1b30-aedd-7cd30abc95d8
47a011ed-d0ff-1b30-aedd-7cd30abc95d8
47a011ed-d0ff-1b30-aedd-7cd30abc95d8
47a011ed-d0ff-1b30-aedd-7cd30abc95d8
47a011ed-d0ff-1b30-aedd-7cd30abc95d8
47a011ed-d0ff-1b30-aedd-7cd30abc95d8
47a011ed-d0ff-1b30-aedd-7cd30abc95d8
47a011ed-d0ff-1b30-aedd-7cd30abc95d8
47a011ed-d0ff-1b30-aedd-7cd30abc95d8
47a011ed-d0ff-1b30-aedd-7cd30abc95d8
47a011ed-d0ff-1b30-aedd-7cd30abc95d8
47a011ed-d0ff-1b30-aedd-7cd30abc95d8
47a011ed-d0ff-1b30-aedd-7cd30abc95d8
47a011ed-d0ff-1b30-aedd-7cd30abc95d8
47a011ed-d0ff-1b30-aedd-7cd30abc95d8
47a011ed-d0ff-1b30-aedd-7cd30abc95d8
47a011ed-d0ff-1b30-aedd-7cd30abc95d8
47a011ed-d0ff-1b30-aedd-7cd30abc95d8
47a011ed-d0ff-1b30-aedd-7cd30abc95d8
47a011ed-d0ff-1b30-aedd-7cd30abc95d8
47a011ed-d0ff-1b30-aedd-7cd30abc95d8
47a011ed-d0ff-1b30-aedd-7cd30abc95d8
47a011ed-d0ff-1b30-aedd-7cd30abc95d8
47a011ed-d0ff-1b30-aedd-7cd30abc95d8
47a011ed-d0ff-1b30-aedd-7cd30abc95d8
47a011ed-d0ff-1b30-aedd-7cd30abc95d8
47a011ed-d0ff-1b30-aedd-7cd30abc95d8
47a011ed-d0ff-1b30-aedd-7cd30abc95d8
47a011ed-d0ff-1b30-aedd-7cd30abc95d8
47a011ed-d0ff-1b30-aedd-7cd30abc95d8
47a011ed-d0ff-1b30-aedd-7cd30abc95d8
47a011ed-d0ff-1b30-aedd-7cd30abc95d8
47a011ed-d0ff-1b30-aedd-7cd30abc95d8
47a011ed-d0ff-1b30-aedd-7cd30abc95d8
47a011ed-d0ff-1b30-aedd-7cd30abc95d8
47a011ed-d0ff-1b30-aedd-7cd30abc95d8
47a011ed-d0ff-1b30-aedd-7cd30abc95d8
47a011ed-d0ff-1b30-aedd-7cd30abc95d8
47a011ed-d0ff-1b30-aedd-7cd30abc95d8
47a011ed-d0ff-1b30-aedd-7cd30abc95d8
47a011ed-d0ff-1b30-aedd-7cd30abc95d8
47a011ed-d0ff-1b30-aedd-7cd30abc95d8
47a011ed-d0ff-1b30-aedd-7cd30abc95d8
47a011ed-d0ff-1b30-aedd-7cd30abc95d8
47a011ed-d0ff-1b30-aedd-7cd30abc95d8
47a011ed-d0ff-1b30-aedd-7cd30abc95d8
47a011ed-d0ff-1b30-aedd-7cd30abc95d8
47a011ed-d0ff-1b30-aedd-7cd30abc95d8
47a011ed-d0ff-1b30-aedd-7cd30abc95d8
47a011ed-d0ff-1b30-aedd-7cd30abc95d8
47a011ed-d0ff-1b30-aedd-7cd30abc95d8
47a011ed-d0ff-1b30-aedd-7cd30abc95d8
47a011ed-d0ff-1b30-aedd-7cd30abc95d8
47a011ed-d0ff-1b30-aedd-7cd30abc95d8
47a011ed-d0ff-1b30-aedd-7cd30abc95d8
47a011ed-d0ff-1b30-aedd-7cd30abc95d8
47a011ed-d0ff-1b30-aedd-7cd30abc95d8
47a011ed-d0ff-1b30-aedd-7cd30abc95d8
47a011ed-d0ff-1b30-aedd-7cd30abc95d8
47a011ed-d0ff-1b30-aedd-7cd30abc95d8
47a011ed-d0ff-1b30-aedd-7cd30abc95d8
47a011ed-d0ff-1b30-aedd-7cd30abc95d8
47a011ed-d0ff-1b30-aedd-7cd30abc95d8
47a011ed-d0ff-1b30-aedd-7cd30abc95d8
47a011ed-d0ff-1b30-aedd-7cd30abc95d8
47a011ed-d0ff-1b30-aedd-7cd30abc95d8
47a011ed-d0ff-1b30-aedd-7cd30abc95d8
47a011ed-d0ff-1b30-aedd-7cd30abc95d8
47a011ed-d0ff-1b30-aedd-7cd30abc95d8
47a011ed-d0ff-1b30-aedd-7cd30abc95d8
47a011ed-d0ff-1b30-aedd-7cd30abc95d8
47a011ed-d0ff-1b30-aedd-7cd30abc95d8
47a011ed-d0ff-1b30-aedd-7cd30abc95d8
47a011ed-d0ff-1b30-aedd-7cd30abc95d8
47a011ed-d0ff-1b30-aedd-7cd30abc95d8
47a011ed-d0ff-1b30-aedd-7cd30abc95d8
47a011ed-d0ff-1b30-aedd-7cd30abc95d8
47a011ed-d0ff-1b30-aedd-7cd30abc95d8
47a011ed-d0ff-1b30-aedd-7cd30abc95d8
47a011ed-d0ff-1b30-aedd-7cd30abc95d8
47a011ed-d0ff-1b30-aedd-7cd30abc95d8
47a011ed-d0ff-1b30-aedd-7cd30abc95d8
47a011ed-d0ff-1b30-aedd-7cd30abc95d8
47a011ed-d0ff-1b30-aedd-7cd30abc95d8
47a011ed-d0ff-1b30-aedd-7cd30abc95d8
47a011ed-d0ff-1b30-aedd-7cd30abc95d8
47a011ed-d0ff-1b30-aedd-7cd30abc95d8
47a011ed-d0ff-1b30-aedd-7cd30abc95d8
47a011ed-d0ff-1b30-aedd-7cd30abc95d8
47a011ed-d0ff-1b30-aedd-7cd30abc95d8
47a011ed-d0ff-1b30-aedd-7cd30abc95d8
47a011ed-d0ff-1b30-aedd-7cd30abc95d8
47a011ed-d0ff-1b30-aedd-7cd30abc95d8
47a011ed-d0ff-1b30-aedd-7cd30abc95d8
47a011ed-d0ff-1b30-aedd-7cd30abc95d8
47a011ed-d0ff-1b30-aedd-7cd30abc95d8
47a011ed-d0ff-1b30-aedd-7cd30abc95d8
47a011ed-d0ff-1b30-aedd-7cd30abc95d8
47a011ed-d0ff-1b30-aedd-7cd30abc95d8
47a011ed-d0ff-1b30-aedd-7cd30abc95d8
47a011ed-d0ff-1b30-aedd-7cd30abc95d8
47a011ed-d0ff-1b30-aedd-7cd30abc95d8
47a011ed-d0ff-1b30-aedd-7cd30abc95d8
47a011ed-d0ff-1b30-aedd-7cd30abc95d8
47a011ed-d0ff-1b30-aedd-7cd30abc95d8
47a011ed-d0ff-1b30-aedd-7cd30abc95d8
47a011ed-d0ff-1b30-aedd-7cd30abc95d8
47a011ed-d0ff-1b30-aedd-7cd30abc95d8
47a011ed-d0ff-1b30-aedd-7cd30abc95d8
47a011ed-d0ff-1b30-aedd-7cd30abc95d8
47a011ed-d0ff-1b30-aedd-7cd30abc95d8
47a011ed-d0ff-1b30-aedd-7cd30abc95d8
47a011ed-d0ff-1b30-aedd-7cd30abc95d8
47a011ed-d0ff-1b30-aedd-7cd30abc95d8
47a011ed-d0ff-1b30-aedd-7cd30abc95d8
47a011ed-d0ff-1b30-aedd-7cd30abc95d8
47a011ed-d0ff-1b30-aedd-7cd30abc95d8
47a011ed-d0ff-1b30-aedd-7cd30abc95d8
47a011ed-d0ff-1b30-aedd-7cd30abc95d8
47a011ed-d0ff-1b30-aedd-7cd30abc95d8
47a011ed-d0ff-1b30-aedd-7cd30abc95d8
47a011ed-d0ff-1b30-aedd-7cd30abc95d8
47a011ed-d0ff-1b30-aedd-7cd30abc95d8
47a011ed-d0ff-1b30-aedd-7cd30abc95d8
47a011ed-d0ff-1b30-aedd-7cd30abc95d8
47a011ed-d0ff-1b30-aedd-7cd30abc95d8
47a011ed-d0ff-1b30-aedd-7cd30abc95d8
47a011ed-d0ff-1b30-aedd-7cd30abc95d8
47a011ed-d0ff-1b30-aedd-7cd30abc95d8
47a011ed-d0ff-1b30-aedd-7cd30abc95d8
47a011ed-d0ff-1b30-aedd-7cd30abc95d8
47a011ed-d0ff-1b30-aedd-7cd30abc95d8
47a011ed-d0ff-1b30-aedd-7cd30abc95d8
47a011ed-d0ff-1b30-aedd-7cd30abc95d8
47a011ed-d0ff-1b30-aedd-7cd30abc95d8
47a011ed-d0ff-1b30-aedd-7cd30abc95d8
47a011ed-d0ff-1b30-aedd-7cd30abc95d8
47a011ed-d0ff-1b30-aedd-7cd30abc95d8
47a011ed-d0ff-1b30-aedd-7cd30abc95d8
47a011ed-d0ff-1b30-aedd-7cd30abc95d8
47a011ed-d0ff-1b30-aedd-7cd30abc95d8
47a011ed-d0ff-1b30-aedd-7cd30abc95d8
47a011ed-d0ff-1b30-aedd-7cd30abc95d8
47a011ed-d0ff-1b30-aedd-7cd30abc95d8
47a011ed-d0ff-1b30-aedd-7cd30abc95d8
47a011ed-d0ff-1b30-aedd-7cd30abc95d8
47a011ed-d0ff-1b30-aedd-7cd30abc95d8
47a011ed-d0ff-1b30-aedd-7cd30abc95d8
47a011ed-d0ff-1b30-aedd-7cd30abc95d8
47a011ed-d0ff-1b30-aedd-7cd30abc95d8
47a011ed-d0ff-1b30-aedd-7cd30abc95d8
47a011ed-d0ff-1b30-aedd-7cd30abc95d8
47a011ed-d0ff-1b30-aedd-7cd30abc95d8
47a011ed-d0ff-1b30-aedd-7cd30abc95d8
47a011ed-d0ff-1b30-aedd-7cd30abc95d8
47a011ed-d0ff-1b30-aedd-7cd30abc95d8
47a011ed-d0ff-1b30-aedd-7cd30abc95d8
47a011ed-d0ff-1b30-aedd-7cd30abc95d8
47a011ed-d0ff-1b30-aedd-7cd30abc95d8
47a011ed-d0ff-1b30-aedd-7cd30abc95d8
47a011ed-d0ff-1b30-aedd-7cd30abc95d8
47a011ed-d0ff-1b30-aedd-7cd30abc95d8
47a011ed-d0ff-1b30-aedd-7cd30abc95d8
47a011ed-d0ff-1b30-aedd-7cd30abc95d8
47a011ed-d0ff-1b30-aedd-7cd30abc95d8
47a011ed-d0ff-1b30-aedd-7cd30abc95d8
47a011ed-d0ff-1b30-aedd-7cd30abc95d8
47a011ed-d0ff-1b30-aedd-7cd30abc95d8
47a011ed-d0ff-1b30-aedd-7cd30abc95d8
47a011ed-d0ff-1b30-aedd-7cd30abc95d8
47a011ed-d0ff-1b30-aedd-7cd30abc95d8
47a011ed-d0ff-1b30-aedd-7cd30abc95d8
47a011ed-d0ff-1b30-aedd-7cd30abc95d8
47a011ed-d0ff-1b30-aedd-7cd30abc95d8
47a011ed-d0ff-1b30-aedd-7cd30abc95d8
47a011ed-d0ff-1b30-aedd-7cd30abc95d8
47a011ed-d0ff-1b30-aedd-7cd30abc95d8
47a011ed-d0ff-1b30-aedd-7cd30abc95d8
47a011ed-d0ff-1b30-aedd-7cd30abc95d8
47a011ed-d0ff-1b30-aedd-7cd30abc95d8
47a011ed-d0ff-1b30-aedd-7cd30abc95d8
47a011ed-d0ff-1b30-aedd-7cd30abc95d8
47a011ed-d0ff-1b30-aedd-7cd30abc95d8
47a011ed-d0ff-1b30-aedd-7cd30abc95d8
47a011ed-d0ff-1b30-aedd-7cd30abc95d8
47a011ed-d0ff-1b30-aedd-7cd30abc95d8
47a011ed-d0ff-1b30-aedd-7cd30abc95d8
47a011ed-d0ff-1b30-aedd-7cd30abc95d8
47a011ed-d0ff-1b30-aedd-7cd30abc95d8
47a011ed-d0ff-1b30-aedd-7cd30abc95d8
47a011ed-d0ff-1b30-aedd-7cd30abc95d8
47a011ed-d0ff-1b30-aedd-7cd30abc95d8
47a011ed-d0ff-1b30-aedd-7cd30abc95d8
47a011ed-d0ff-1b30-aedd-7cd30abc95d8
47a011ed-d0ff-1b30-aedd-7cd30abc95d8
47a011ed-d0ff-1b30-aedd-7cd30abc95d8
47a011ed-d0ff-1b30-aedd-7cd30abc95d8
47a011ed-d0ff-1b30-aedd-7cd30abc95d8
47a011ed-d0ff-1b30-aedd-7cd30abc95d8
47a011ed-d0ff-1b30-aedd-7cd30abc95d8
47a011ed-d0ff-1b30-aedd-7cd30abc95d8
47a011ed-d0ff-1b30-aedd-7cd30abc95d8
47a011ed-d0ff-1b30-aedd-7cd30abc95d8
47a011ed-d0ff-1b30-aedd-7cd30abc95d8
47a011ed-d0ff-1b30-aedd-7cd30abc95d8
47a011ed-d0ff-1b30-aedd-7cd30abc95d8
47a011ed-d0ff-1b30-aedd-7cd30abc95d8
47a011ed-d0ff-1b30-aedd-7cd30abc95d8
47a011ed-d0ff-1b30-aedd-7cd30abc95d8
47a011ed-d0ff-1b30-aedd-7cd30abc95d8
47a011ed-d0ff-1b30-aedd-7cd30abc95d8
47a011ed-d0ff-1b30-aedd-7cd30abc95d8
47a011ed-d0ff-1b30-aedd-7cd30abc95d8
47a011ed-d0ff-1b30-aedd-7cd30abc95d8
47a011ed-d0ff-1b30-aedd-7cd30abc95d8
47a011ed-d0ff-1b30-aedd-7cd30abc95d8
47a011ed-d0ff-1b30-aedd-7cd30abc95d8
47a011ed-d0ff-1b30-aedd-7cd30abc95d8
47a011ed-d0ff-1b30-aedd-7cd30abc95d8
47a011ed-d0ff-1b30-aedd-7cd30abc95d8
47a011ed-d0ff-1b30-aedd-7cd30abc95d8
47a011ed-d0ff-1b30-aedd-7cd30abc95d8
47a011ed-d0ff-1b30-aedd-7cd30abc95d8
47a011ed-d0ff-1b30-aedd-7cd30abc95d8
47a011ed-d0ff-1b30-aedd-7cd30abc95d8
47a011ed-d0ff-1b30-aedd-7cd30abc95d8
47a011ed-d0ff-1b30-aedd-7cd30abc95d8
47a011ed-d0ff-1b30-aedd-7cd30abc95d8
47a011ed-d0ff-1b30-aedd-7cd30abc95d8
47a011ed-d0ff-1b30-aedd-7cd30abc95d8
47a011ed-d0ff-1b30-aedd-7cd30abc95d8
47a011ed-d0ff-1b30-aedd-7cd30abc95d8
47a011ed-d0ff-1b30-aedd-7cd30abc95d8
47a011ed-d0ff-1b30-aedd-7cd30abc95d8
47a011ed-d0ff-1b30-aedd-7cd30abc95d8
47a011ed-d0ff-1b30-aedd-7cd30abc95d8
47a011ed-d0ff-1b30-aedd-7cd30abc95d8
47a011ed-d0ff-1b30-aedd-7cd30abc95d8
47a011ed-d0ff-1b30-aedd-7cd30abc95d8
47a011ed-d0ff-1b30-aedd-7cd30abc95d8
47a011ed-d0ff-1b30-aedd-7cd30abc95d8
47a011ed-d0ff-1b30-aedd-7cd30abc95d8
47a011ed-d0ff-1b30-aedd-7cd30abc95d8
47a011ed-d0ff-1b30-aedd-7cd30abc95d8
47a011ed-d0ff-1b30-aedd-7cd30abc95d8
47a011ed-d0ff-1b30-aedd-7cd30abc95d8
47a011ed-d0ff-1b30-aedd-7cd30abc95d8
47a011ed-d0ff-1b30-aedd-7cd30abc95d8
47a011ed-d0ff-1b30-aedd-7cd30abc95d8
47a011ed-d0ff-1b30-aedd-7cd30abc95d8
47a011ed-d0ff-1b30-aedd-7cd30abc95d8
47a011ed-d0ff-1b30-aedd-7cd30abc95d8
47a011ed-d0ff-1b30-aedd-7cd30abc95d8
47a011ed-d0ff-1b30-aedd-7cd30abc95d8
47a011ed-d0ff-1b30-aedd-7cd30abc95d8
47a011ed-d0ff-1b30-aedd-7cd30abc95d8
47a011ed-d0ff-1b30-aedd-7cd30abc95d8
47a011ed-d0ff-1b30-aedd-7cd30abc95d8
47a011ed-d0ff-1b30-aedd-7cd30abc95d8
47a011ed-d0ff-1b30-aedd-7cd30abc95d8
47a011ed-d0ff-1b30-aedd-7cd30abc95d8
47a011ed-d0ff-1b30-aedd-7cd30abc95d8
47a011ed-d0ff-1b30-aedd-7cd30abc95d8
47a011ed-d0ff-1b30-aedd-7cd30abc95d8
47a011ed-d0ff-1b30-aedd-7cd30abc95d8
47a011ed-d0ff-1b30-aedd-7cd30abc95d8
47a011ed-d0ff-1b30-aedd-7cd30abc95d8
47a011ed-d0ff-1b30-aedd-7cd30abc95d8
47a011ed-d0ff-1b30-aedd-7cd30abc95d8
47a011ed-d0ff-1b30-aedd-7cd30abc95d8
47a011ed-d0ff-1b30-aedd-7cd30abc95d8
47a011ed-d0ff-1b30-aedd-7cd30abc95d8
47a011ed-d0ff-1b30-aedd-7cd30abc95d8
47a011ed-d0ff-1b30-aedd-7cd30abc95d8
47a011ed-d0ff-1b30-aedd-7cd30abc95d8
47a011ed-d0ff-1b30-aedd-7cd30abc95d8
47a011ed-d0ff-1b30-aedd-7cd30abc95d8
47a011ed-d0ff-1b30-aedd-7cd30abc95d8
47a011ed-d0ff-1b30-aedd-7cd30abc95d8
47a011ed-d0ff-1b30-aedd-7cd30abc95d8
47a011ed-d0ff-1b30-aedd-7cd30abc95d8
47a011ed-d0ff-1b30-aedd-7cd30abc95d8
47a011ed-d0ff-1b30-aedd-7cd30abc95d8
47a011ed-d0ff-1b30-aedd-7cd30abc95d8
47a011ed-d0ff-1b30-aedd-7cd30abc95d8
47a011ed-d0ff-1b30-aedd-7cd30abc95d8
47a011ed-d0ff-1b30-aedd-7cd30abc95d8
47a011ed-d0ff-1b30-aedd-7cd30abc95d8
47a011ed-d0ff-1b30-aedd-7cd30abc95d8
47a011ed-d0ff-1b30-aedd-7cd30abc95d8
47a011ed-d0ff-1b30-aedd-7cd30abc95d8
47a011ed-d0ff-1b30-aedd-7cd30abc95d8
47a011ed-d0ff-1b30-aedd-7cd30abc95d8
47a011ed-d0ff-1b30-aedd-7cd30abc95d8
47a011ed-d0ff-1b30-aedd-7cd30abc95d8
47a011ed-d0ff-1b30-aedd-7cd30abc95d8
47a011ed-d0ff-1b30-aedd-7cd30abc95d8
47a011ed-d0ff-1b30-aedd-7cd30abc95d8
47a011ed-d0ff-1b30-aedd-7cd30abc95d8
47a011ed-d0ff-1b30-aedd-7cd30abc95d8
47a011ed-d0ff-1b30-aedd-7cd30abc95d8
47a011ed-d0ff-1b30-aedd-7cd30abc95d8
47a011ed-d0ff-1b30-aedd-7cd30abc95d8
47a011ed-d0ff-1b30-aedd-7cd30abc95d8
47a011ed-d0ff-1b30-aedd-7cd30abc95d8
47a011ed-d0ff-1b30-aedd-7cd30abc95d8
47a011ed-d0ff-1b30-aedd-7cd30abc95d8
47a011ed-d0ff-1b30-aedd-7cd30abc95d8
47a011ed-d0ff-1b30-aedd-7cd30abc95d8
47a011ed-d0ff-1b30-aedd-7cd30abc95d8
47a011ed-d0ff-1b30-aedd-7cd30abc95d8
47a011ed-d0ff-1b30-aedd-7cd30abc95d8
47a011ed-d0ff-1b30-aedd-7cd30abc95d8
47a011ed-d0ff-1b30-aedd-7cd30abc95d8
47a011ed-d0ff-1b30-aedd-7cd30abc95d8
47a011ed-d0ff-1b30-aedd-7cd30abc95d8
47a011ed-d0ff-1b30-aedd-7cd30abc95d8
47a011ed-d0ff-1b30-aedd-7cd30abc95d8
47a011ed-d0ff-1b30-aedd-7cd30abc95d8
47a011ed-d0ff-1b30-aedd-7cd30abc95d8
47a011ed-d0ff-1b30-aedd-7cd30abc95d8
47a011ed-d0ff-1b30-aedd-7cd30abc95d8
47a011ed-d0ff-1b30-aedd-7cd30abc95d8
47a011ed-d0ff-1b30-aedd-7cd30abc95d8
47a011ed-d0ff-1b30-aedd-7cd30abc95d8
47a011ed-d0ff-1b30-aedd-7cd30abc95d8
47a011ed-d0ff-1b30-aedd-7cd30abc95d8
47a011ed-d0ff-1b30-aedd-7cd30abc95d8
47a011ed-d0ff-1b30-aedd-7cd30abc95d8
47a011ed-d0ff-1b30-aedd-7cd30abc95d8
47a011ed-d0ff-1b30-aedd-7cd30abc95d8
47a011ed-d0ff-1b30-aedd-7cd30abc95d8
47a011ed-d0ff-1b30-aedd-7cd30abc95d8
47a011ed-d0ff-1b30-aedd-7cd30abc95d8
47a011ed-d0ff-1b30-aedd-7cd30abc95d8
47a011ed-d0ff-1b30-aedd-7cd30abc95d8
47a011ed-d0ff-1b30-aedd-7cd30abc95d8
47a011ed-d0ff-1b30-aedd-7cd30abc95d8
47a011ed-d0ff-1b30-aedd-7cd30abc95d8
47a011ed-d0ff-1b30-aedd-7cd30abc95d8
47a011ed-d0ff-1b30-aedd-7cd30abc95d8
47a011ed-d0ff-1b30-aedd-7cd30abc95d8
47a011ed-d0ff-1b30-aedd-7cd30abc95d8
47a011ed-d0ff-1b30-aedd-7cd30abc95d8
47a011ed-d0ff-1b30-aedd-7cd30abc95d8
47a011ed-d0ff-1b30-aedd-7cd30abc95d8
47a011ed-d0ff-1b30-aedd-7cd30abc95d8
47a011ed-d0ff-1b30-aedd-7cd30abc95d8
47a011ed-d0ff-1b30-aedd-7cd30abc95d8
47a011ed-d0ff-1b30-aedd-7cd30abc95d8
47a011ed-d0ff-1b30-aedd-7cd30abc95d8
47a011ed-d0ff-1b30-aedd-7cd30abc95d8
47a011ed-d0ff-1b30-aedd-7cd30abc95d8
47a011ed-d0ff-1b30-aedd-7cd30abc95d8
47a011ed-d0ff-1b30-aedd-7cd30abc95d8
47a011ed-d0ff-1b30-aedd-7cd30abc95d8
47a011ed-d0ff-1b30-aedd-7cd30abc95d8
47a011ed-d0ff-1b30-aedd-7cd30abc95d8
47a011ed-d0ff-1b30-aedd-7cd30abc95d8
47a011ed-d0ff-1b30-aedd-7cd30abc95d8
47a011ed-d0ff-1b30-aedd-7cd30abc95d8
47a011ed-d0ff-1b30-aedd-7cd30abc95d8
47a011ed-d0ff-1b30-aedd-7cd30abc95d8
47a011ed-d0ff-1b30-aedd-7cd30abc95d8
47a011ed-d0ff-1b30-aedd-7cd30abc95d8
47a011ed-d0ff-1b30-aedd-7cd30abc95d8
47a011ed-d0ff-1b30-aedd-7cd30abc95d8
47a011ed-d0ff-1b30-aedd-7cd30abc95d8
47a011ed-d0ff-1b30-aedd-7cd30abc95d8
47a011ed-d0ff-1b30-aedd-7cd30abc95d8
47a011ed-d0ff-1b30-aedd-7cd30abc95d8
47a011ed-d0ff-1b30-aedd-7cd30abc95d8
47a011ed-d0ff-1b30-aedd-7cd30abc95d8
47a011ed-d0ff-1b30-aedd-7cd30abc95d8
47a011ed-d0ff-1b30-aedd-7cd30abc95d8
47a011ed-d0ff-1b30-aedd-7cd30abc95d8
47a011ed-d0ff-1b30-aedd-7cd30abc95d8
47a011ed-d0ff-1b30-aedd-7cd30abc95d8
47a011ed-d0ff-1b30-aedd-7cd30abc95d8
47a011ed-d0ff-1b30-aedd-7cd30abc95d8
47a011ed-d0ff-1b30-aedd-7cd30abc95d8
47a011ed-d0ff-1b30-aedd-7cd30abc95d8
47a011ed-d0ff-1b30-aedd-7cd30abc95d8
47a011ed-d0ff-1b30-aedd-7cd30abc95d8
47a011ed-d0ff-1b30-aedd-7cd30abc95d8
47a011ed-d0ff-1b30-aedd-7cd30abc95d8
47a011ed-d0ff-1b30-aedd-7cd30abc95d8
47a011ed-d0ff-1b30-aedd-7cd30abc95d8
47a011ed-d0ff-1b30-aedd-7cd30abc95d8
47a011ed-d0ff-1b30-aedd-7cd30abc95d8
47a011ed-d0ff-1b30-aedd-7cd30abc95d8
47a011ed-d0ff-1b30-aedd-7cd30abc95d8
47a011ed-d0ff-1b30-aedd-7cd30abc95d8
47a011ed-d0ff-1b30-aedd-7cd30abc95d8
47a011ed-d0ff-1b30-aedd-7cd30abc95d8
47a011ed-d0ff-1b30-aedd-7cd30abc95d8
47a011ed-d0ff-1b30-aedd-7cd30abc95d8
47a011ed-d0ff-1b30-aedd-7cd30abc95d8
47a011ed-d0ff-1b30-aedd-7cd30abc95d8
47a011ed-d0ff-1b30-aedd-7cd30abc95d8
47a011ed-d0ff-1b30-aedd-7cd30abc95d8
47a011ed-d0ff-1b30-aedd-7cd30abc95d8
47a011ed-d0ff-1b30-aedd-7cd30abc95d8
47a011ed-d0ff-1b30-aedd-7cd30abc95d8
47a011ed-d0ff-1b30-aedd-7cd30abc95d8
47a011ed-d0ff-1b30-aedd-7cd30abc95d8
47a011ed-d0ff-1b30-aedd-7cd30abc95d8
47a011ed-d0ff-1b30-aedd-7cd30abc95d8
47a011ed-d0ff-1b30-aedd-7cd30abc95d8
47a011ed-d0ff-1b30-aedd-7cd30abc95d8
47a011ed-d0ff-1b30-aedd-7cd30abc95d8
47a011ed-d0ff-1b30-aedd-7cd30abc95d8
47a011ed-d0ff-1b30-aedd-7cd30abc95d8
47a011ed-d0ff-1b30-aedd-7cd30abc95d8
47a011ed-d0ff-1b30-aedd-7cd30abc95d8
47a011ed-d0ff-1b30-aedd-7cd30abc95d8
47a011ed-d0ff-1b30-aedd-7cd30abc95d8
47a011ed-d0ff-1b30-aedd-7cd30abc95d8
47a011ed-d0ff-1b30-aedd-7cd30abc95d8
47a011ed-d0ff-1b30-aedd-7cd30abc95d8
47a011ed-d0ff-1b30-aedd-7cd30abc95d8
47a011ed-d0ff-1b30-aedd-7cd30abc95d8
47a011ed-d0ff-1b30-aedd-7cd30abc95d8
47a011ed-d0ff-1b30-aedd-7cd30abc95d8
47a011ed-d0ff-1b30-aedd-7cd30abc95d8
47a011ed-d0ff-1b30-aedd-7cd30abc95d8
47a011ed-d0ff-1b30-aedd-7cd30abc95d8
47a011ed-d0ff-1b30-aedd-7cd30abc95d8
47a011ed-d0ff-1b30-aedd-7cd30abc95d8
47a011ed-d0ff-1b30-aedd-7cd30abc95d8
47a011ed-d0ff-1b30-aedd-7cd30abc95d8
47a011ed-d0ff-1b30-aedd-7cd30abc95d8
47a011ed-d0ff-1b30-aedd-7cd30abc95d8
47a011ed-d0ff-1b30-aedd-7cd30abc95d8
47a011ed-d0ff-1b30-aedd-7cd30abc95d8
47a011ed-d0ff-1b30-aedd-7cd30abc95d8
47a011ed-d0ff-1b30-aedd-7cd30abc95d8
47a011ed-d0ff-1b30-aedd-7cd30abc95d8
47a011ed-d0ff-1b30-aedd-7cd30abc95d8
47a011ed-d0ff-1b30-aedd-7cd30abc95d8
47a011ed-d0ff-1b30-aedd-7cd30abc95d8
47a011ed-d0ff-1b30-aedd-7cd30abc95d8
47a011ed-d0ff-1b30-aedd-7cd30abc95d8
47a011ed-d0ff-1b30-aedd-7cd30abc95d8
47a011ed-d0ff-1b30-aedd-7cd30abc95d8
47a011ed-d0ff-1b30-aedd-7cd30abc95d8
47a011ed-d0ff-1b30-aedd-7cd30abc95d8
47a011ed-d0ff-1b30-aedd-7cd30abc95d8
47a011ed-d0ff-1b30-aedd-7cd30abc95d8
47a011ed-d0ff-1b30-aedd-7cd30abc95d8
47a011ed-d0ff-1b30-aedd-7cd30abc95d8
47a011ed-d0ff-1b30-aedd-7cd30abc95d8
47a011ed-d0ff-1b30-aedd-7cd30abc95d8
47a011ed-d0ff-1b30-aedd-7cd30abc95d8
47a011ed-d0ff-1b30-aedd-7cd30abc95d8
47a011ed-d0ff-1b30-aedd-7cd30abc95d8
47a011ed-d0ff-1b30-aedd-7cd30abc95d8
47a011ed-d0ff-1b30-aedd-7cd30abc95d8
47a011ed-d0ff-1b30-aedd-7cd30abc95d8
47a011ed-d0ff-1b30-aedd-7cd30abc95d8
47a011ed-d0ff-1b30-aedd-7cd30abc95d8
47a011ed-d0ff-1b30-aedd-7cd30abc95d8
47a011ed-d0ff-1b30-aedd-7cd30abc95d8
47a011ed-d0ff-1b30-aedd-7cd30abc95d8
47a011ed-d0ff-1b30-aedd-7cd30abc95d8
47a011ed-d0ff-1b30-aedd-7cd30abc95d8
47a011ed-d0ff-1b30-aedd-7cd30abc95d8
47a011ed-d0ff-1b30-aedd-7cd30abc95d8
47a011ed-d0ff-1b30-aedd-7cd30abc95d8
47a011ed-d0ff-1b30-aedd-7cd30abc95d8
47a011ed-d0ff-1b30-aedd-7cd30abc95d8
47a011ed-d0ff-1b30-aedd-7cd30abc95d8
47a011ed-d0ff-1b30-aedd-7cd30abc95d8
47a011ed-d0ff-1b30-aedd-7cd30abc95d8
47a011ed-d0ff-1b30-aedd-7cd30abc95d8
47a011ed-d0ff-1b30-aedd-7cd30abc95d8
47a011ed-d0ff-1b30-aedd-7cd30abc95d8
47a011ed-d0ff-1b30-aedd-7cd30abc95d8
47a011ed-d0ff-1b30-aedd-7cd30abc95d8
47a011ed-d0ff-1b30-aedd-7cd30abc95d8
47a011ed-d0ff-1b30-aedd-7cd30abc95d8
47a011ed-d0ff-1b30-aedd-7cd30abc95d8
47a011ed-d0ff-1b30-aedd-7cd30abc95d8
47a011ed-d0ff-1b30-aedd-7cd30abc95d8
47a011ed-d0ff-1b30-aedd-7cd30abc95d8
47a011ed-d0ff-1b30-aedd-7cd30abc95d8
47a011ed-d0ff-1b30-aedd-7cd30abc95d8
47a011ed-d0ff-1b30-aedd-7cd30abc95d8
47a011ed-d0ff-1b30-aedd-7cd30abc95d8
47a011ed-d0ff-1b30-aedd-7cd30abc95d8
47a011ed-d0ff-1b30-aedd-7cd30abc95d8
47a011ed-d0ff-1b30-aedd-7cd30abc95d8
47a011ed-d0ff-1b30-aedd-7cd30abc95d8
47a011ed-d0ff-1b30-aedd-7cd30abc95d8
47a011ed-d0ff-1b30-aedd-7cd30abc95d8
47a011ed-d0ff-1b30-aedd-7cd30abc95d8
47a011ed-d0ff-1b30-aedd-7cd30abc95d8
47a011ed-d0ff-1b30-aedd-7cd30abc95d8
47a011ed-d0ff-1b30-aedd-7cd30abc95d8
47a011ed-d0ff-1b30-aedd-7cd30abc95d8
47a011ed-d0ff-1b30-aedd-7cd30abc95d8
47a011ed-d0ff-1b30-aedd-7cd30abc95d8
47a011ed-d0ff-1b30-aedd-7cd30abc95d8
47a011ed-d0ff-1b30-aedd-7cd30abc95d8
47a011ed-d0ff-1b30-aedd-7cd30abc95d8
47a011ed-d0ff-1b30-aedd-7cd30abc95d8
47a011ed-d0ff-1b30-aedd-7cd30abc95d8
47a011ed-d0ff-1b30-aedd-7cd30abc95d8
47a011ed-d0ff-1b30-aedd-7cd30abc95d8
47a011ed-d0ff-1b30-aedd-7cd30abc95d8
47a011ed-d0ff-1b30-aedd-7cd30abc95d8
47a011ed-d0ff-1b30-aedd-7cd30abc95d8
47a011ed-d0ff-1b30-aedd-7cd30abc95d8
47a011ed-d0ff-1b30-aedd-7cd30abc95d8
47a011ed-d0ff-1b30-aedd-7cd30abc95d8
47a011ed-d0ff-1b30-aedd-7cd30abc95d8
47a011ed-d0ff-1b30-aedd-7cd30abc95d8
47a011ed-d0ff-1b30-aedd-7cd30abc95d8
47a011ed-d0ff-1b30-aedd-7cd30abc95d8
47a011ed-d0ff-1b30-aedd-7cd30abc95d8
47a011ed-d0ff-1b30-aedd-7cd30abc95d8
47a011ed-d0ff-1b30-aedd-7cd30abc95d8
47a011ed-d0ff-1b30-aedd-7cd30abc95d8
47a011ed-d0ff-1b30-aedd-7cd30abc95d8
47a011ed-d0ff-1b30-aedd-7cd30abc95d8
47a011ed-d0ff-1b30-aedd-7cd30abc95d8
47a011ed-d0ff-1b30-aedd-7cd30abc95d8
47a011ed-d0ff-1b30-aedd-7cd30abc95d8
47a011ed-d0ff-1b30-aedd-7cd30abc95d8
47a011ed-d0ff-1b30-aedd-7cd30abc95d8
47a011ed-d0ff-1b30-aedd-7cd30abc95d8
47a011ed-d0ff-1b30-aedd-7cd30abc95d8
47a011ed-d0ff-1b30-aedd-7cd30abc95d8
47a011ed-d0ff-1b30-aedd-7cd30abc95d8
47a011ed-d0ff-1b30-aedd-7cd30abc95d8
47a011ed-d0ff-1b30-aedd-7cd30abc95d8
47a011ed-d0ff-1b30-aedd-7cd30abc95d8
47a011ed-d0ff-1b30-aedd-7cd30abc95d8
47a011ed-d0ff-1b30-aedd-7cd30abc95d8
47a011ed-d0ff-1b30-aedd-7cd30abc95d8
47a011ed-d0ff-1b30-aedd-7cd30abc95d8
47a011ed-d0ff-1b30-aedd-7cd30abc95d8
47a011ed-d0ff-1b30-aedd-7cd30abc95d8
47a011ed-d0ff-1b30-aedd-7cd30abc95d8
47a011ed-d0ff-1b30-aedd-7cd30abc95d8
47a011ed-d0ff-1b30-aedd-7cd30abc95d8
47a011ed-d0ff-1b30-aedd-7cd30abc95d8
47a011ed-d0ff-1b30-aedd-7cd30abc95d8
47a011ed-d0ff-1b30-aedd-7cd30abc95d8
47a011ed-d0ff-1b30-aedd-7cd30abc95d8
47a011ed-d0ff-1b30-aedd-7cd30abc95d8
47a011ed-d0ff-1b30-aedd-7cd30abc95d8
47a011ed-d0ff-1b30-aedd-7cd30abc95d8
47a011ed-d0ff-1b30-aedd-7cd30abc95d8
47a011ed-d0ff-1b30-aedd-7cd30abc95d8
47a011ed-d0ff-1b30-aedd-7cd30abc95d8
47a011ed-d0ff-1b30-aedd-7cd30abc95d8
47a011ed-d0ff-1b30-aedd-7cd30abc95d8
47a011ed-d0ff-1b30-aedd-7cd30abc95d8
47a011ed-d0ff-1b30-aedd-7cd30abc95d8
47a011ed-d0ff-1b30-aedd-7cd30abc95d8
47a011ed-d0ff-1b30-aedd-7cd30abc95d8
47a011ed-d0ff-1b30-aedd-7cd30abc95d8
47a011ed-d0ff-1b30-aedd-7cd30abc95d8
47a011ed-d0ff-1b30-aedd-7cd30abc95d8
47a011ed-d0ff-1b30-aedd-7cd30abc95d8
47a011ed-d0ff-1b30-aedd-7cd30abc95d8
47a011ed-d0ff-1b30-aedd-7cd30abc95d8
47a011ed-d0ff-1b30-aedd-7cd30abc95d8
47a011ed-d0ff-1b30-aedd-7cd30abc95d8
47a011ed-d0ff-1b30-aedd-7cd30abc95d8
47a011ed-d0ff-1b30-aedd-7cd30abc95d8
47a011ed-d0ff-1b30-aedd-7cd30abc95d8
47a011ed-d0ff-1b30-aedd-7cd30abc95d8
47a011ed-d0ff-1b30-aedd-7cd30abc95d8
47a011ed-d0ff-1b30-aedd-7cd30abc95d8
47a011ed-d0ff-1b30-aedd-7cd30abc95d8
47a011ed-d0ff-1b30-aedd-7cd30abc95d8
47a011ed-d0ff-1b30-aedd-7cd30abc95d8
47a011ed-d0ff-1b30-aedd-7cd30abc95d8
47a011ed-d0ff-1b30-aedd-7cd30abc95d8
47a011ed-d0ff-1b30-aedd-7cd30abc95d8
47a011ed-d0ff-1b30-aedd-7cd30abc95d8
47a011ed-d0ff-1b30-aedd-7cd30abc95d8
47a011ed-d0ff-1b30-aedd-7cd30abc95d8
47a011ed-d0ff-1b30-aedd-7cd30abc95d8
47a011ed-d0ff-1b30-aedd-7cd30abc95d8
47a011ed-d0ff-1b30-aedd-7cd30abc95d8
47a011ed-d0ff-1b30-aedd-7cd30abc95d8
47a011ed-d0ff-1b30-aedd-7cd30abc95d8
47a011ed-d0ff-1b30-aedd-7cd30abc95d8
47a011ed-d0ff-1b30-aedd-7cd30abc95d8
47a011ed-d0ff-1b30-aedd-7cd30abc95d8
47a011ed-d0ff-1b30-aedd-7cd30abc95d8
47a011ed-d0ff-1b30-aedd-7cd30abc95d8
47a011ed-d0ff-1b30-aedd-7cd30abc95d8
47a011ed-d0ff-1b30-aedd-7cd30abc95d8
47a011ed-d0ff-1b30-aedd-7cd30abc95d8
47a011ed-d0ff-1b30-aedd-7cd30abc95d8
47a011ed-d0ff-1b30-aedd-7cd30abc95d8
47a011ed-d0ff-1b30-aedd-7cd30abc95d8
47a011ed-d0ff-1b30-aedd-7cd30abc95d8
47a011ed-d0ff-1b30-aedd-7cd30abc95d8
47a011ed-d0ff-1b30-aedd-7cd30abc95d8
47a011ed-d0ff-1b30-aedd-7cd30abc95d8
47a011ed-d0ff-1b30-aedd-7cd30abc95d8
47a011ed-d0ff-1b30-aedd-7cd30abc95d8
47a011ed-d0ff-1b30-aedd-7cd30abc95d8
47a011ed-d0ff-1b30-aedd-7cd30abc95d8
47a011ed-d0ff-1b30-aedd-7cd30abc95d8
47a011ed-d0ff-1b30-aedd-7cd30abc95d8
47a011ed-d0ff-1b30-aedd-7cd30abc95d8
47a011ed-d0ff-1b30-aedd-7cd30abc95d8
47a011ed-d0ff-1b30-aedd-7cd30abc95d8
47a011ed-d0ff-1b30-aedd-7cd30abc95d8
47a011ed-d0ff-1b30-aedd-7cd30abc95d8
47a011ed-d0ff-1b30-aedd-7cd30abc95d8
47a011ed-d0ff-1b30-aedd-7cd30abc95d8
47a011ed-d0ff-1b30-aedd-7cd30abc95d8
47a011ed-d0ff-1b30-aedd-7cd30abc95d8
47a011ed-d0ff-1b30-aedd-7cd30abc95d8
47a011ed-d0ff-1b30-aedd-7cd30abc95d8
47a011ed-d0ff-1b30-aedd-7cd30abc95d8
47a011ed-d0ff-1b30-aedd-7cd30abc95d8
47a011ed-d0ff-1b30-aedd-7cd30abc95d8
47a011ed-d0ff-1b30-aedd-7cd30abc95d8
47a011ed-d0ff-1b30-aedd-7cd30abc95d8
47a011ed-d0ff-1b30-aedd-7cd30abc95d8
47a011ed-d0ff-1b30-aedd-7cd30abc95d8
47a011ed-d0ff-1b30-aedd-7cd30abc95d8
47a011ed-d0ff-1b30-aedd-7cd30abc95d8
47a011ed-d0ff-1b30-aedd-7cd30abc95d8
47a011ed-d0ff-1b30-aedd-7cd30abc95d8
47a011ed-d0ff-1b30-aedd-7cd30abc95d8
47a011ed-d0ff-1b30-aedd-7cd30abc95d8
47a011ed-d0ff-1b30-aedd-7cd30abc95d8
47a011ed-d0ff-1b30-aedd-7cd30abc95d8
47a011ed-d0ff-1b30-aedd-7cd30abc95d8
47a011ed-d0ff-1b30-aedd-7cd30abc95d8
47a011ed-d0ff-1b30-aedd-7cd30abc95d8
47a011ed-d0ff-1b30-aedd-7cd30abc95d8
47a011ed-d0ff-1b30-aedd-7cd30abc95d8
47a011ed-d0ff-1b30-aedd-7cd30abc95d8
47a011ed-d0ff-1b30-aedd-7cd30abc95d8
47a011ed-d0ff-1b30-aedd-7cd30abc95d8
47a011ed-d0ff-1b30-aedd-7cd30abc95d8
47a011ed-d0ff-1b30-aedd-7cd30abc95d8
47a011ed-d0ff-1b30-aedd-7cd30abc95d8
47a011ed-d0ff-1b30-aedd-7cd30abc95d8
47a011ed-d0ff-1b30-aedd-7cd30abc95d8
47a011ed-d0ff-1b30-aedd-7cd30abc95d8
47a011ed-d0ff-1b30-aedd-7cd30abc95d8
47a011ed-d0ff-1b30-aedd-7cd30abc95d8
47a011ed-d0ff-1b30-aedd-7cd30abc95d8
47a011ed-d0ff-1b30-aedd-7cd30abc95d8
47a011ed-d0ff-1b30-aedd-7cd30abc95d8
47a011ed-d0ff-1b30-aedd-7cd30abc95d8
47a011ed-d0ff-1b30-aedd-7cd30abc95d8
47a011ed-d0ff-1b30-aedd-7cd30abc95d8
47a011ed-d0ff-1b30-aedd-7cd30abc95d8
47a011ed-d0ff-1b30-aedd-7cd30abc95d8
47a011ed-d0ff-1b30-aedd-7cd30abc95d8
47a011ed-d0ff-1b30-aedd-7cd30abc95d8
47a011ed-d0ff-1b30-aedd-7cd30abc95d8
47a011ed-d0ff-1b30-aedd-7cd30abc95d8
47a011ed-d0ff-1b30-aedd-7cd30abc95d8
47a011ed-d0ff-1b30-aedd-7cd30abc95d8
47a011ed-d0ff-1b30-aedd-7cd30abc95d8
47a011ed-d0ff-1b30-aedd-7cd30abc95d8
47a011ed-d0ff-1b30-aedd-7cd30abc95d8
47a011ed-d0ff-1b30-aedd-7cd30abc95d8
47a011ed-d0ff-1b30-aedd-7cd30abc95d8
47a011ed-d0ff-1b30-aedd-7cd30abc95d8
47a011ed-d0ff-1b30-aedd-7cd30abc95d8
47a011ed-d0ff-1b30-aedd-7cd30abc95d8
47a011ed-d0ff-1b30-aedd-7cd30abc95d8
47a011ed-d0ff-1b30-aedd-7cd30abc95d8
47a011ed-d0ff-1b30-aedd-7cd30abc95d8
47a011ed-d0ff-1b30-aedd-7cd30abc95d8
47a011ed-d0ff-1b30-aedd-7cd30abc95d8
47a011ed-d0ff-1b30-aedd-7cd30abc95d8
47a011ed-d0ff-1b30-aedd-7cd30abc95d8
47a011ed-d0ff-1b30-aedd-7cd30abc95d8
47a011ed-d0ff-1b30-aedd-7cd30abc95d8
47a011ed-d0ff-1b30-aedd-7cd30abc95d8
47a011ed-d0ff-1b30-aedd-7cd30abc95d8
47a011ed-d0ff-1b30-aedd-7cd30abc95d8
47a011ed-d0ff-1b30-aedd-7cd30abc95d8
47a011ed-d0ff-1b30-aedd-7cd30abc95d8
47a011ed-d0ff-1b30-aedd-7cd30abc95d8
47a011ed-d0ff-1b30-aedd-7cd30abc95d8
47a011ed-d0ff-1b30-aedd-7cd30abc95d8
47a011ed-d0ff-1b30-aedd-7cd30abc95d8
47a011ed-d0ff-1b30-aedd-7cd30abc95d8
47a011ed-d0ff-1b30-aedd-7cd30abc95d8
47a011ed-d0ff-1b30-aedd-7cd30abc95d8
47a011ed-d0ff-1b30-aedd-7cd30abc95d8
47a011ed-d0ff-1b30-aedd-7cd30abc95d8
47a011ed-d0ff-1b30-aedd-7cd30abc95d8
47a011ed-d0ff-1b30-aedd-7cd30abc95d8
47a011ed-d0ff-1b30-aedd-7cd30abc95d8
47a011ed-d0ff-1b30-aedd-7cd30abc95d8
47a011ed-d0ff-1b30-aedd-7cd30abc95d8
47a011ed-d0ff-1b30-aedd-7cd30abc95d8
47a011ed-d0ff-1b30-aedd-7cd30abc95d8
47a011ed-d0ff-1b30-aedd-7cd30abc95d8
47a011ed-d0ff-1b30-aedd-7cd30abc95d8
47a011ed-d0ff-1b30-aedd-7cd30abc95d8
47a011ed-d0ff-1b30-aedd-7cd30abc95d8
47a011ed-d0ff-1b30-aedd-7cd30abc95d8
47a011ed-d0ff-1b30-aedd-7cd30abc95d8
47a011ed-d0ff-1b30-aedd-7cd30abc95d8
47a011ed-d0ff-1b30-aedd-7cd30abc95d8
47a011ed-d0ff-1b30-aedd-7cd30abc95d8
47a011ed-d0ff-1b30-aedd-7cd30abc95d8
47a011ed-d0ff-1b30-aedd-7cd30abc95d8
47a011ed-d0ff-1b30-aedd-7cd30abc95d8
47a011ed-d0ff-1b30-aedd-7cd30abc95d8
47a011ed-d0ff-1b30-aedd-7cd30abc95d8
47a011ed-d0ff-1b30-aedd-7cd30abc95d8
47a011ed-d0ff-1b30-aedd-7cd30abc95d8
47a011ed-d0ff-1b30-aedd-7cd30abc95d8
47a011ed-d0ff-1b30-aedd-7cd30abc95d8
47a011ed-d0ff-1b30-aedd-7cd30abc95d8
47a011ed-d0ff-1b30-aedd-7cd30abc95d8
47a011ed-d0ff-1b30-aedd-7cd30abc95d8
47a011ed-d0ff-1b30-aedd-7cd30abc95d8
47a011ed-d0ff-1b30-aedd-7cd30abc95d8
47a011ed-d0ff-1b30-aedd-7cd30abc95d8
47a011ed-d0ff-1b30-aedd-7cd30abc95d8
47a011ed-d0ff-1b30-aedd-7cd30abc95d8
47a011ed-d0ff-1b30-aedd-7cd30abc95d8
47a011ed-d0ff-1b30-aedd-7cd30abc95d8
47a011ed-d0ff-1b30-aedd-7cd30abc95d8
47a011ed-d0ff-1b30-aedd-7cd30abc95d8
47a011ed-d0ff-1b30-aedd-7cd30abc95d8
47a011ed-d0ff-1b30-aedd-7cd30abc95d8
47a011ed-d0ff-1b30-aedd-7cd30abc95d8
47a011ed-d0ff-1b30-aedd-7cd30abc95d8
47a011ed-d0ff-1b30-aedd-7cd30abc95d8
47a011ed-d0ff-1b30-aedd-7cd30abc95d8
47a011ed-d0ff-1b30-aedd-7cd30abc95d8
47a011ed-d0ff-1b30-aedd-7cd30abc95d8
47a011ed-d0ff-1b30-aedd-7cd30abc95d8
47a011ed-d0ff-1b30-aedd-7cd30abc95d8
47a011ed-d0ff-1b30-aedd-7cd30abc95d8
47a011ed-d0ff-1b30-aedd-7cd30abc95d8
47a011ed-d0ff-1b30-aedd-7cd30abc95d8
47a011ed-d0ff-1b30-aedd-7cd30abc95d8
47a011ed-d0ff-1b30-aedd-7cd30abc95d8
47a011ed-d0ff-1b30-aedd-7cd30abc95d8
47a011ed-d0ff-1b30-aedd-7cd30abc95d8
47a011ed-d0ff-1b30-aedd-7cd30abc95d8
47a011ed-d0ff-1b30-aedd-7cd30abc95d8
47a011ed-d0ff-1b30-aedd-7cd30abc95d8
47a011ed-d0ff-1b30-aedd-7cd30abc95d8
47a011ed-d0ff-1b30-aedd-7cd30abc95d8
47a011ed-d0ff-1b30-aedd-7cd30abc95d8
47a011ed-d0ff-1b30-aedd-7cd30abc95d8
47a011ed-d0ff-1b30-aedd-7cd30abc95d8
47a011ed-d0ff-1b30-aedd-7cd30abc95d8
47a011ed-d0ff-1b30-aedd-7cd30abc95d8
47a011ed-d0ff-1b30-aedd-7cd30abc95d8
47a011ed-d0ff-1b30-aedd-7cd30abc95d8
47a011ed-d0ff-1b30-aedd-7cd30abc95d8
47a011ed-d0ff-1b30-aedd-7cd30abc95d8
47a011ed-d0ff-1b30-aedd-7cd30abc95d8
47a011ed-d0ff-1b30-aedd-7cd30abc95d8
47a011ed-d0ff-1b30-aedd-7cd30abc95d8
47a011ed-d0ff-1b30-aedd-7cd30abc95d8
47a011ed-d0ff-1b30-aedd-7cd30abc95d8
47a011ed-d0ff-1b30-aedd-7cd30abc95d8
47a011ed-d0ff-1b30-aedd-7cd30abc95d8
47a011ed-d0ff-1b30-aedd-7cd30abc95d8
47a011ed-d0ff-1b30-aedd-7cd30abc95d8
47a011ed-d0ff-1b30-aedd-7cd30abc95d8
47a011ed-d0ff-1b30-aedd-7cd30abc95d8
47a011ed-d0ff-1b30-aedd-7cd30abc95d8
47a011ed-d0ff-1b30-aedd-7cd30abc95d8
47a011ed-d0ff-1b30-aedd-7cd30abc95d8
47a011ed-d0ff-1b30-aedd-7cd30abc95d8
47a011ed-d0ff-1b30-aedd-7cd30abc95d8
47a011ed-d0ff-1b30-aedd-7cd30abc95d8
47a011ed-d0ff-1b30-aedd-7cd30abc95d8
47a011ed-d0ff-1b30-aedd-7cd30abc95d8
47a011ed-d0ff-1b30-aedd-7cd30abc95d8
47a011ed-d0ff-1b30-aedd-7cd30abc95d8
47a011ed-d0ff-1b30-aedd-7cd30abc95d8
47a011ed-d0ff-1b30-aedd-7cd30abc95d8
47a011ed-d0ff-1b30-aedd-7cd30abc95d8
47a011ed-d0ff-1b30-aedd-7cd30abc95d8
47a011ed-d0ff-1b30-aedd-7cd30abc95d8
47a011ed-d0ff-1b30-aedd-7cd30abc95d8
47a011ed-d0ff-1b30-aedd-7cd30abc95d8
47a011ed-d0ff-1b30-aedd-7cd30abc95d8
47a011ed-d0ff-1b30-aedd-7cd30abc95d8
47a011ed-d0ff-1b30-aedd-7cd30abc95d8
47a011ed-d0ff-1b30-aedd-7cd30abc95d8
47a011ed-d0ff-1b30-aedd-7cd30abc95d8
47a011ed-d0ff-1b30-aedd-7cd30abc95d8
47a011ed-d0ff-1b30-aedd-7cd30abc95d8
47a011ed-d0ff-1b30-aedd-7cd30abc95d8
47a011ed-d0ff-1b30-aedd-7cd30abc95d8
47a011ed-d0ff-1b30-aedd-7cd30abc95d8
47a011ed-d0ff-1b30-aedd-7cd30abc95d8
47a011ed-d0ff-1b30-aedd-7cd30abc95d8
47a011ed-d0ff-1b30-aedd-7cd30abc95d8
47a011ed-d0ff-1b30-aedd-7cd30abc95d8
47a011ed-d0ff-1b30-aedd-7cd30abc95d8
47a011ed-d0ff-1b30-aedd-7cd30abc95d8
47a011ed-d0ff-1b30-aedd-7cd30abc95d8
47a011ed-d0ff-1b30-aedd-7cd30abc95d8
47a011ed-d0ff-1b30-aedd-7cd30abc95d8
47a011ed-d0ff-1b30-aedd-7cd30abc95d8
47a011ed-d0ff-1b30-aedd-7cd30abc95d8
47a011ed-d0ff-1b30-aedd-7cd30abc95d8
47a011ed-d0ff-1b30-aedd-7cd30abc95d8
47a011ed-d0ff-1b30-aedd-7cd30abc95d8
47a011ed-d0ff-1b30-aedd-7cd30abc95d8
47a011ed-d0ff-1b30-aedd-7cd30abc95d8
47a011ed-d0ff-1b30-aedd-7cd30abc95d8
47a011ed-d0ff-1b30-aedd-7cd30abc95d8
47a011ed-d0ff-1b30-aedd-7cd30abc95d8
47a011ed-d0ff-1b30-aedd-7cd30abc95d8
47a011ed-d0ff-1b30-aedd-7cd30abc95d8
47a011ed-d0ff-1b30-aedd-7cd30abc95d8
47a011ed-d0ff-1b30-aedd-7cd30abc95d8
47a011ed-d0ff-1b30-aedd-7cd30abc95d8
47a011ed-d0ff-1b30-aedd-7cd30abc95d8
47a011ed-d0ff-1b30-aedd-7cd30abc95d8
47a011ed-d0ff-1b30-aedd-7cd30abc95d8
47a011ed-d0ff-1b30-aedd-7cd30abc95d8
47a011ed-d0ff-1b30-aedd-7cd30abc95d8
47a011ed-d0ff-1b30-aedd-7cd30abc95d8
47a011ed-d0ff-1b30-aedd-7cd30abc95d8
47a011ed-d0ff-1b30-aedd-7cd30abc95d8
47a011ed-d0ff-1b30-aedd-7cd30abc95d8
47a011ed-d0ff-1b30-aedd-7cd30abc95d8
47a011ed-d0ff-1b30-aedd-7cd30abc95d8
47a011ed-d0ff-1b30-aedd-7cd30abc95d8
47a011ed-d0ff-1b30-aedd-7cd30abc95d8
47a011ed-d0ff-1b30-aedd-7cd30abc95d8
47a011ed-d0ff-1b30-aedd-7cd30abc95d8
47a011ed-d0ff-1b30-aedd-7cd30abc95d8
47a011ed-d0ff-1b30-aedd-7cd30abc95d8
47a011ed-d0ff-1b30-aedd-7cd30abc95d8
47a011ed-d0ff-1b30-aedd-7cd30abc95d8
47a011ed-d0ff-1b30-aedd-7cd30abc95d8
47a011ed-d0ff-1b30-aedd-7cd30abc95d8
47a011ed-d0ff-1b30-aedd-7cd30abc95d8
47a011ed-d0ff-1b30-aedd-7cd30abc95d8
47a011ed-d0ff-1b30-aedd-7cd30abc95d8
47a011ed-d0ff-1b30-aedd-7cd30abc95d8
47a011ed-d0ff-1b30-aedd-7cd30abc95d8
47a011ed-d0ff-1b30-aedd-7cd30abc95d8
47a011ed-d0ff-1b30-aedd-7cd30abc95d8
47a011ed-d0ff-1b30-aedd-7cd30abc95d8
47a011ed-d0ff-1b30-aedd-7cd30abc95d8
47a011ed-d0ff-1b30-aedd-7cd30abc95d8
47a011ed-d0ff-1b30-aedd-7cd30abc95d8
47a011ed-d0ff-1b30-aedd-7cd30abc95d8
47a011ed-d0ff-1b30-aedd-7cd30abc95d8
47a011ed-d0ff-1b30-aedd-7cd30abc95d8
47a011ed-d0ff-1b30-aedd-7cd30abc95d8
47a011ed-d0ff-1b30-aedd-7cd30abc95d8
47a011ed-d0ff-1b30-aedd-7cd30abc95d8
47a011ed-d0ff-1b30-aedd-7cd30abc95d8
47a011ed-d0ff-1b30-aedd-7cd30abc95d8
47a011ed-d0ff-1b30-aedd-7cd30abc95d8
47a011ed-d0ff-1b30-aedd-7cd30abc95d8
47a011ed-d0ff-1b30-aedd-7cd30abc95d8
47a011ed-d0ff-1b30-aedd-7cd30abc95d8
47a011ed-d0ff-1b30-aedd-7cd30abc95d8
47a011ed-d0ff-1b30-aedd-7cd30abc95d8
47a011ed-d0ff-1b30-aedd-7cd30abc95d8
47a011ed-d0ff-1b30-aedd-7cd30abc95d8
47a011ed-d0ff-1b30-aedd-7cd30abc95d8
47a011ed-d0ff-1b30-aedd-7cd30abc95d8
47a011ed-d0ff-1b30-aedd-7cd30abc95d8
47a011ed-d0ff-1b30-aedd-7cd30abc95d8
47a011ed-d0ff-1b30-aedd-7cd30abc95d8
47a011ed-d0ff-1b30-aedd-7cd30abc95d8
47a011ed-d0ff-1b30-aedd-7cd30abc95d8
47a011ed-d0ff-1b30-aedd-7cd30abc95d8
47a011ed-d0ff-1b30-aedd-7cd30abc95d8
47a011ed-d0ff-1b30-aedd-7cd30abc95d8
47a011ed-d0ff-1b30-aedd-7cd30abc95d8
47a011ed-d0ff-1b30-aedd-7cd30abc95d8
47a011ed-d0ff-1b30-aedd-7cd30abc95d8
47a011ed-d0ff-1b30-aedd-7cd30abc95d8
47a011ed-d0ff-1b30-aedd-7cd30abc95d8
47a011ed-d0ff-1b30-aedd-7cd30abc95d8
47a011ed-d0ff-1b30-aedd-7cd30abc95d8
47a011ed-d0ff-1b30-aedd-7cd30abc95d8
47a011ed-d0ff-1b30-aedd-7cd30abc95d8
47a011ed-d0ff-1b30-aedd-7cd30abc95d8
47a011ed-d0ff-1b30-aedd-7cd30abc95d8
47a011ed-d0ff-1b30-aedd-7cd30abc95d8
47a011ed-d0ff-1b30-aedd-7cd30abc95d8
47a011ed-d0ff-1b30-aedd-7cd30abc95d8
47a011ed-d0ff-1b30-aedd-7cd30abc95d8
47a011ed-d0ff-1b30-aedd-7cd30abc95d8
47a011ed-d0ff-1b30-aedd-7cd30abc95d8
47a011ed-d0ff-1b30-aedd-7cd30abc95d8
47a011ed-d0ff-1b30-aedd-7cd30abc95d8
47a011ed-d0ff-1b30-aedd-7cd30abc95d8
47a011ed-d0ff-1b30-aedd-7cd30abc95d8
47a011ed-d0ff-1b30-aedd-7cd30abc95d8
47a011ed-d0ff-1b30-aedd-7cd30abc95d8
47a011ed-d0ff-1b30-aedd-7cd30abc95d8
47a011ed-d0ff-1b30-aedd-7cd30abc95d8
47a011ed-d0ff-1b30-aedd-7cd30abc95d8
47a011ed-d0ff-1b30-aedd-7cd30abc95d8
47a011ed-d0ff-1b30-aedd-7cd30abc95d8
47a011ed-d0ff-1b30-aedd-7cd30abc95d8
47a011ed-d0ff-1b30-aedd-7cd30abc95d8
47a011ed-d0ff-1b30-aedd-7cd30abc95d8
47a011ed-d0ff-1b30-aedd-7cd30abc95d8
47a011ed-d0ff-1b30-aedd-7cd30abc95d8
47a011ed-d0ff-1b30-aedd-7cd30abc95d8
47a011ed-d0ff-1b30-aedd-7cd30abc95d8
47a011ed-d0ff-1b30-aedd-7cd30abc95d8
47a011ed-d0ff-1b30-aedd-7cd30abc95d8
47a011ed-d0ff-1b30-aedd-7cd30abc95d8
47a011ed-d0ff-1b30-aedd-7cd30abc95d8
47a011ed-d0ff-1b30-aedd-7cd30abc95d8
47a011ed-d0ff-1b30-aedd-7cd30abc95d8
47a011ed-d0ff-1b30-aedd-7cd30abc95d8
47a011ed-d0ff-1b30-aedd-7cd30abc95d8
47a011ed-d0ff-1b30-aedd-7cd30abc95d8
47a011ed-d0ff-1b30-aedd-7cd30abc95d8
47a011ed-d0ff-1b30-aedd-7cd30abc95d8
47a011ed-d0ff-1b30-aedd-7cd30abc95d8
47a011ed-d0ff-1b30-aedd-7cd30abc95d8
47a011ed-d0ff-1b30-aedd-7cd30abc95d8
47a011ed-d0ff-1b30-aedd-7cd30abc95d8
47a011ed-d0ff-1b30-aedd-7cd30abc95d8
47a011ed-d0ff-1b30-aedd-7cd30abc95d8
47a011ed-d0ff-1b30-aedd-7cd30abc95d8
47a011ed-d0ff-1b30-aedd-7cd30abc95d8
drop PROCEDURE procedure_1;
drop table test1;
#function-10-1     存储过程=====>if条件语句
drop table test1;
drop table test2;
drop table test3;
create table test1(uuid1 varchar(50));
create table test2(uuid2 varchar(50));
create table test3(uuid3 varchar(50));
drop procedure procedure_1;
create procedure procedure_1(aa int,bb int)
begin
if aa = bb then
insert into test1 values(bin_to_uuid(uuid_to_bin('972d531f-47a1-11ed-aedd-7cd30abc95d8')));
insert into test1 values(bin_to_uuid(uuid_to_bin('972d531f-47a1-11ed-aedd-7cd30abc95d8')));
insert into test1 values(bin_to_uuid(uuid_to_bin('972d531f-47a1-11ed-aedd-7cd30abc95d8')));
insert into test1 values(bin_to_uuid(uuid_to_bin('972d531f-47a1-11ed-aedd-7cd30abc95d8')));
elseif aa > bb then
insert into test2 values(bin_to_uuid(uuid_to_bin('e6c39b4d-47a1-11ed-aedd-7cd30abc95d8',0)));
insert into test2 values(bin_to_uuid(uuid_to_bin('e6c39b4d-47a1-11ed-aedd-7cd30abc95d8',-3)));
insert into test2 values(bin_to_uuid(uuid_to_bin('e6c39b4d-47a1-11ed-aedd-7cd30abc95d8',9)));
insert into test2 values(bin_to_uuid(uuid_to_bin('e6c39b4d-47a1-11ed-aedd-7cd30abc95d8',9.5)));
else
insert into test3 values(bin_to_uuid(uuid_to_bin('054818d4-47a2-11ed-aedd-7cd30abc95d8',0),51));
insert into test3 values(bin_to_uuid(uuid_to_bin('054818d4-47a2-11ed-aedd-7cd30abc95d8',-3),2));
insert into test3 values(bin_to_uuid(uuid_to_bin('054818d4-47a2-11ed-aedd-7cd30abc95d8',9),-21));
insert into test3 values(bin_to_uuid(uuid_to_bin('054818d4-47a2-11ed-aedd-7cd30abc95d8',null),4));
end if;
end;
/
call procedure_1(1,3);
select * from test3 order by uuid3 asc;
uuid3
054818d4-47a2-11ed-aedd-7cd30abc95d8
054818d4-47a2-11ed-aedd-7cd30abc95d8
47a211ed-18d4-0548-aedd-7cd30abc95d8
47a211ed-18d4-0548-aedd-7cd30abc95d8
call procedure_1(3,3);
select * from test1 order by uuid1 asc;
uuid1
972d531f-47a1-11ed-aedd-7cd30abc95d8
972d531f-47a1-11ed-aedd-7cd30abc95d8
972d531f-47a1-11ed-aedd-7cd30abc95d8
972d531f-47a1-11ed-aedd-7cd30abc95d8
call procedure_1(3,1);
select * from test2 order by uuid2 asc;
uuid2
11ed47a1-e6c3-9b4d-aedd-7cd30abc95d8
11ed47a1-e6c3-9b4d-aedd-7cd30abc95d8
11ed47a1-e6c3-9b4d-aedd-7cd30abc95d8
e6c39b4d-47a1-11ed-aedd-7cd30abc95d8
drop procedure procedure_1;
drop table test1;
drop table test2;
drop table test3;
#function-10-2     函数=====>while循环
drop table test1;
create table test1(id int,h1 varchar(50));
insert into test1 values(1,bin_to_uuid(uuid_to_bin('8b40c560-47a5-11ed-aedd-7cd30abc95d8')));
insert into test1 values(2,bin_to_uuid(uuid_to_bin('8b40c560-47a5-11ed-aedd-7cd30abc95d8',0.5)));
insert into test1 values(3,bin_to_uuid(uuid_to_bin('8b40c560-47a5-11ed-aedd-7cd30abc95d8',87),23));
select * from test1 order by id asc;
id	h1
1	8b40c560-47a5-11ed-aedd-7cd30abc95d8
2	11ed47a5-8b40-c560-aedd-7cd30abc95d8
3	8b40c560-47a5-11ed-aedd-7cd30abc95d8
drop FUNCTION FUNCTION_1;
CREATE FUNCTION FUNCTION_1() RETURNS int
BEGIN
DECLARE v1 decimal(50,1) DEFAULT 20;
WHILE v1<30 DO
UPDATE test1 SET h1=h1+9 where id=bin_to_uuid(uuid_to_bin('8b40c560-47a5-11ed-aedd-7cd30abc95d8',0.5));
SET v1=v1+5;
END WHILE;
RETURN bin_to_uuid(uuid_to_bin('8b40c560-47a5-11ed-aedd-7cd30abc95d8',87));
END;
/
select function_1();
drop FUNCTION FUNCTION_1;
CREATE FUNCTION FUNCTION_1() RETURNS varchar(100)
BEGIN
DECLARE v1 decimal(20,1) DEFAULT 10;
WHILE v1<30 DO
UPDATE test1 SET h1=bin_to_uuid(uuid_to_bin('8b40c560-47a5-11ed-aedd-7cd30abc95d8',2));
SET v1=v1+5;
END WHILE;
RETURN bin_to_uuid(uuid_to_bin('8b40c560-47a5-11ed-aedd-7cd30abc95d8',2));
END;
/
select function_1();
function_1()
11ed47a5-8b40-c560-aedd-7cd30abc95d8
drop FUNCTION FUNCTION_1;
drop table test1;
#function-10-2     函数=====>repeat循环
drop table test1;
create table test1(id int,h1 varchar(50));
insert into test1 values(1,bin_to_uuid(uuid_to_bin('8b40c560-47a5-11ed-aedd-7cd30abc95d8')));
insert into test1 values(2,bin_to_uuid(uuid_to_bin('8b40c560-47a5-11ed-aedd-7cd30abc95d8',23)));
insert into test1 values(3,bin_to_uuid(uuid_to_bin('8b40c560-47a5-11ed-aedd-7cd30abc95d8',23),33));
select * from test1 order by id asc;
id	h1
1	8b40c560-47a5-11ed-aedd-7cd30abc95d8
2	11ed47a5-8b40-c560-aedd-7cd30abc95d8
3	8b40c560-47a5-11ed-aedd-7cd30abc95d8
CREATE FUNCTION function_1() RETURNS varchar(50)
begin
declare i varchar(50);
set i = 1;
repeat
update test1 set h1=h1+10;
set i = i + 1;
until i > 50 end repeat;
RETURN bin_to_uuid(uuid_to_bin('8b40c560-47a5-11ed-aedd-7cd30abc95d8',99),21);
end;
/
select function_1();
ERROR 01000: Data truncated for column 'h1' at row 1
drop FUNCTION FUNCTION_1;
drop table test1;
#function-10-2     函数=====>loop循环
drop table test1;
create table test1(id int,h1 varchar(50));
insert into test1 values(1,3);
insert into test1 values(1,5);
select * from test1 order by id asc;
id	h1
1	3
1	5
drop function function_1;
CREATE FUNCTION function_1() RETURNS varchar(50)
BEGIN
DECLARE i int DEFAULT 2;
loop1:LOOP
IF i<0 THEN
UPDATE test1 SET h1=h1+1 where id<15;
LEAVE loop1;
END IF;
SET i = i-2;
END LOOP;
RETURN bin_to_uuid(uuid_to_bin('8b40c560-47a5-11ed-aedd-7cd30abc95d8',null),32);
END;
/
select function_1();
function_1()
47a511ed-c560-8b40-aedd-7cd30abc95d8
drop FUNCTION FUNCTION_1;
drop table test1;
#function-10-3     触发器=====>insert
drop table test1;
drop table test2;
create table test1(c1 int PRIMARY key AUTO_INCREMENT,c2 bigint(30));
create table test2(c1 int PRIMARY key AUTO_INCREMENT,c2 varchar(50));
insert into test1(c2) values(2),(4),(6);
select * from test1 order by c1 asc;
c1	c2
1	2
2	4
3	6
drop TRIGGER TRIGGER_1;
CREATE TRIGGER TRIGGER_1 BEFORE insert ON test1
FOR EACH ROW
BEGIN
insert into test2(c2) values(bin_to_uuid(uuid_to_bin('8b40c560-47a5-11ed-aedd-7cd30abc95d8')));
insert into test2(c2) values(bin_to_uuid(uuid_to_bin('8b40c560-47a5-11ed-aedd-7cd30abc95d8',66)));
insert into test2(c2) values(bin_to_uuid(uuid_to_bin('8b40c560-47a5-11ed-aedd-7cd30abc95d8',-2)));
insert into test2(c2) values(bin_to_uuid(uuid_to_bin('8b40c560-47a5-11ed-aedd-7cd30abc95d8',null)));
insert into test2(c2) values(bin_to_uuid(uuid_to_bin('8b40c560-47a5-11ed-aedd-7cd30abc95d8'),44));
insert into test2(c2) values(bin_to_uuid(uuid_to_bin('8b40c560-47a5-11ed-aedd-7cd30abc95d8'),-44));
insert into test2(c2) values(bin_to_uuid(uuid_to_bin('8b40c560-47a5-11ed-aedd-7cd30abc95d8'),-4.4));
END
/
select * from test1 order by c1 asc;
c1	c2
1	2
2	4
3	6
select * from test2 order by c1 asc;
c1	c2
insert into test1(c2) values(7);
select * from test1 order by c1 asc;
c1	c2
1	2
2	4
3	6
4	7
select * from test2 order by c1 asc;
c1	c2
1	8b40c560-47a5-11ed-aedd-7cd30abc95d8
2	11ed47a5-8b40-c560-aedd-7cd30abc95d8
3	11ed47a5-8b40-c560-aedd-7cd30abc95d8
4	8b40c560-47a5-11ed-aedd-7cd30abc95d8
5	47a511ed-c560-8b40-aedd-7cd30abc95d8
6	47a511ed-c560-8b40-aedd-7cd30abc95d8
7	47a511ed-c560-8b40-aedd-7cd30abc95d8
#function-10-3     触发器=====>update
drop table test1;
drop table test2;
create table test1(c1 int PRIMARY key AUTO_INCREMENT,c2 bigint(30));
create table test2(c1 int PRIMARY key AUTO_INCREMENT,c2 varchar(50));
insert into test2(c2) values(bin_to_uuid(uuid_to_bin('8b40c560-47a5-11ed-aedd-7cd30abc95d8')));
insert into test1(c2) values(2),(4),(6);
select * from test1 order by c1 asc;
c1	c2
1	2
2	4
3	6
drop TRIGGER TRIGGER_1;
CREATE TRIGGER TRIGGER_1 BEFORE update ON test1
FOR EACH ROW
BEGIN
update test2 set c2=bin_to_uuid(uuid_to_bin('8b40c560-47a5-11ed-aedd-7cd30abc95d8',66)) where c2=bin_to_uuid(uuid_to_bin('8b40c560-47a5-11ed-aedd-7cd30abc95d8'));
update test2 set c2=bin_to_uuid(uuid_to_bin('8b40c560-47a5-11ed-aedd-7cd30abc95d8',-6)) where c2=bin_to_uuid(uuid_to_bin('8b40c560-47a5-11ed-aedd-7cd30abc95d8',66));
update test2 set c2=bin_to_uuid(uuid_to_bin('8b40c560-47a5-11ed-aedd-7cd30abc95d8',0.5)) where c2=bin_to_uuid(uuid_to_bin('8b40c560-47a5-11ed-aedd-7cd30abc95d8',-6));
update test2 set c2=bin_to_uuid(uuid_to_bin('8b40c560-47a5-11ed-aedd-7cd30abc95d8',null)) where c2=bin_to_uuid(uuid_to_bin('8b40c560-47a5-11ed-aedd-7cd30abc95d8',0.5));
update test2 set c2=bin_to_uuid(uuid_to_bin('8b40c560-47a5-11ed-aedd-7cd30abc95d8',2),5) where c2=bin_to_uuid(uuid_to_bin('8b40c560-47a5-11ed-aedd-7cd30abc95d8',null));
END
/
update test1 set c2=7 where c2=6;
select * from test1 order by c1 asc;
c1	c2
1	2
2	4
3	7
select * from test2 order by c1 asc;
c1	c2
1	8b40c560-47a5-11ed-aedd-7cd30abc95d8
#function-10-3     触发器=====>delete
drop table test1;
drop table test2;
create table test1(c1 int PRIMARY key AUTO_INCREMENT,c2 bigint(30));
create table test2(c1 int PRIMARY key AUTO_INCREMENT,c2 varchar(50));
insert into test2(c2) values(bin_to_uuid(uuid_to_bin('8b40c560-47a5-11ed-aedd-7cd30abc95d8',9)));
insert into test2(c2) values(bin_to_uuid(uuid_to_bin('8b40c560-47a5-11ed-aedd-7cd30abc95d8',-9)));
insert into test2(c2) values(bin_to_uuid(uuid_to_bin('8b40c560-47a5-11ed-aedd-7cd30abc95d8',0.6)));
insert into test2(c2) values(bin_to_uuid(uuid_to_bin('8b40c560-47a5-11ed-aedd-7cd30abc95d8',null)));
insert into test2(c2) values(bin_to_uuid(uuid_to_bin('8b40c560-47a5-11ed-aedd-7cd30abc95d8',5.1)));
insert into test2(c2) values(bin_to_uuid(uuid_to_bin('8b40c560-47a5-11ed-aedd-7cd30abc95d8'),31));
insert into test1(c2) values(2),(4),(6);
select * from test1 order by c1 asc;
c1	c2
1	2
2	4
3	6
select * from test2 order by c1 asc;
c1	c2
1	11ed47a5-8b40-c560-aedd-7cd30abc95d8
2	11ed47a5-8b40-c560-aedd-7cd30abc95d8
3	11ed47a5-8b40-c560-aedd-7cd30abc95d8
4	8b40c560-47a5-11ed-aedd-7cd30abc95d8
5	11ed47a5-8b40-c560-aedd-7cd30abc95d8
6	47a511ed-c560-8b40-aedd-7cd30abc95d8
drop TRIGGER TRIGGER_1;
CREATE TRIGGER TRIGGER_1 BEFORE DELETE ON test1
FOR EACH ROW
BEGIN
delete from test2 where c2=bin_to_uuid(uuid_to_bin('8b40c560-47a5-11ed-aedd-7cd30abc95d8',5.1));
delete from test2 where c2=bin_to_uuid(uuid_to_bin('8b40c560-47a5-11ed-aedd-7cd30abc95d8',null));
delete from test2 where c2=bin_to_uuid(uuid_to_bin('8b40c560-47a5-11ed-aedd-7cd30abc95d8'),31);
END
/
delete from test1 where  c2=6;
select * from test1 order by c1 asc;
c1	c2
1	2
2	4
select * from test2 order by c1 asc;
c1	c2
drop table test1;
drop table test2;
# Clean up users
drop user hjw@'%' ;
