#Environmental cleaning
drop user hjw@'%';
create user hjw identified by 'hjw';
grant all on *.* to hjw WITH GRANT OPTION;
#function-5    dml语句
#function-6    视图
#function-7    索引
#function-5-1    insert语句
#function-5-1-1    数值类型
drop table test1;
create table test1(c1 bigint PRIMARY key AUTO_INCREMENT,c2 bigint,c3 TINYINT(100),
c4 SMALLINT ,c5 MEDIUMINT,c6 FLOAT,c7 DOUBLE,c8 DECIMAL);
insert into test1(c2) values(bin_to_uuid(uuid_to_bin('5fd29c12-493f-11ed-9307-7cd30abc95d8')));
insert into test1(c2) values(bin_to_uuid(uuid_to_bin('5fd29c12-493f-11ed-9307-7cd30abc95d8'),23));
insert into test1(c3) values(bin_to_uuid(uuid_to_bin('5fd29c12-493f-11ed-9307-7cd30abc95d8')));
insert into test1(c3) values(bin_to_uuid(uuid_to_bin('5fd29c12-493f-11ed-9307-7cd30abc95d8'),23));
insert into test1(c4) values(bin_to_uuid(uuid_to_bin('5fd29c12-493f-11ed-9307-7cd30abc95d8')));
insert into test1(c4) values(bin_to_uuid(uuid_to_bin('5fd29c12-493f-11ed-9307-7cd30abc95d8'),23));
insert into test1(c5) values(bin_to_uuid(uuid_to_bin('5fd29c12-493f-11ed-9307-7cd30abc95d8')));
insert into test1(c5) values(bin_to_uuid(uuid_to_bin('5fd29c12-493f-11ed-9307-7cd30abc95d8'),23));
insert into test1(c6) values(bin_to_uuid(uuid_to_bin('5fd29c12-493f-11ed-9307-7cd30abc95d8')));
insert into test1(c6) values(bin_to_uuid(uuid_to_bin('5fd29c12-493f-11ed-9307-7cd30abc95d8'),23));
insert into test1(c7) values(bin_to_uuid(uuid_to_bin('5fd29c12-493f-11ed-9307-7cd30abc95d8')));
insert into test1(c7) values(bin_to_uuid(uuid_to_bin('5fd29c12-493f-11ed-9307-7cd30abc95d8'),23));
insert into test1(c8) values(bin_to_uuid(uuid_to_bin('5fd29c12-493f-11ed-9307-7cd30abc95d8')));
insert into test1(c8) values(bin_to_uuid(uuid_to_bin('5fd29c12-493f-11ed-9307-7cd30abc95d8'),23));
select * from test1 order by c1 asc;
c1	c2	c3	c4	c5	c6	c7	c8
#function-5-1-2    字符串类型
drop table test1;
create table test1(c1 bigint PRIMARY key AUTO_INCREMENT,c2 char(50),c3 varchar(50),
c4 TINYBLOB ,c5 TINYTEXT,c6 BLOB,c7 TEXT,c8 MEDIUMBLOB,c9 MEDIUMTEXT,c10 LONGBLOB,c11 LONGTEXT);
insert into test1(c2) values(bin_to_uuid(uuid_to_bin('5fd29c12-493f-11ed-9307-7cd30abc95d8')));
insert into test1(c2) values(bin_to_uuid(uuid_to_bin('5fd29c12-493f-11ed-9307-7cd30abc95d8'),23));
insert into test1(c3) values(bin_to_uuid(uuid_to_bin('6fd29c12-493f-11ed-9307-7cd30abc95d8')));
insert into test1(c3) values(bin_to_uuid(uuid_to_bin('6fd29c12-493f-11ed-9307-7cd30abc95d8'),-34));
insert into test1(c4) values(bin_to_uuid(uuid_to_bin('7fd29c12-493f-11ed-9307-7cd30abc95d8')));
insert into test1(c4) values(bin_to_uuid(uuid_to_bin('7fd29c12-493f-11ed-9307-7cd30abc95d8'),-55.5));
insert into test1(c5) values(bin_to_uuid(uuid_to_bin('8fd29c12-493f-11ed-9307-7cd30abc95d8')));
insert into test1(c5) values(bin_to_uuid(uuid_to_bin('8fd29c12-493f-11ed-9307-7cd30abc95d8'),32));
insert into test1(c6) values(bin_to_uuid(uuid_to_bin('9fd29c12-493f-11ed-9307-7cd30abc95d8')));
insert into test1(c6) values(bin_to_uuid(uuid_to_bin('9fd29c12-493f-11ed-9307-7cd30abc95d8'),'as'));
insert into test1(c7) values(bin_to_uuid(uuid_to_bin('10d29c12-493f-11ed-9307-7cd30abc95d8')));
insert into test1(c7) values(bin_to_uuid(uuid_to_bin('10d29c12-493f-11ed-9307-7cd30abc95d8'),-2.1));
insert into test1(c8) values(bin_to_uuid(uuid_to_bin('11d29c12-493f-11ed-9307-7cd30abc95d8')));
insert into test1(c8) values(bin_to_uuid(uuid_to_bin('11d29c12-493f-11ed-9307-7cd30abc95d8'),'null'));
insert into test1(c9) values(bin_to_uuid(uuid_to_bin('12d29c12-493f-11ed-9307-7cd30abc95d8')));
insert into test1(c9) values(bin_to_uuid(uuid_to_bin('12d29c12-493f-11ed-9307-7cd30abc95d8'),null));
insert into test1(c10) values(bin_to_uuid(uuid_to_bin('13d29c12-493f-11ed-9307-7cd30abc95d8')));
insert into test1(c10) values(bin_to_uuid(uuid_to_bin('13d29c12-493f-11ed-9307-7cd30abc95d8'),127));
insert into test1(c11) values(bin_to_uuid(uuid_to_bin('14d29c12-493f-11ed-9307-7cd30abc95d8')));
insert into test1(c11) values(bin_to_uuid(uuid_to_bin('14d29c12-493f-11ed-9307-7cd30abc95d8'),127));
select c2 from test1 order by c1 asc;
c2
5fd29c12-493f-11ed-9307-7cd30abc95d8
493f11ed-9c12-5fd2-9307-7cd30abc95d8
NULL
NULL
NULL
NULL
NULL
NULL
NULL
NULL
NULL
NULL
NULL
NULL
NULL
NULL
NULL
NULL
select c3 from test1 order by c1 asc;
c3
NULL
NULL
6fd29c12-493f-11ed-9307-7cd30abc95d8
493f11ed-9c12-6fd2-9307-7cd30abc95d8
NULL
NULL
NULL
NULL
NULL
NULL
NULL
NULL
NULL
NULL
NULL
NULL
NULL
NULL
select c4 from test1 order by c1 asc;
c4
NULL
NULL
NULL
NULL
7fd29c12-493f-11ed-9307-7cd30abc95d8
493f11ed-9c12-7fd2-9307-7cd30abc95d8
NULL
NULL
NULL
NULL
NULL
NULL
NULL
NULL
NULL
NULL
NULL
NULL
select c5 from test1 order by c1 asc;
c5
NULL
NULL
NULL
NULL
NULL
NULL
8fd29c12-493f-11ed-9307-7cd30abc95d8
493f11ed-9c12-8fd2-9307-7cd30abc95d8
NULL
NULL
NULL
NULL
NULL
NULL
NULL
NULL
NULL
NULL
select c6 from test1 order by c1 asc;
c6
NULL
NULL
NULL
NULL
NULL
NULL
NULL
NULL
9fd29c12-493f-11ed-9307-7cd30abc95d8
NULL
NULL
NULL
NULL
NULL
NULL
NULL
NULL
NULL
select c7 from test1 order by c1 asc;
c7
NULL
NULL
NULL
NULL
NULL
NULL
NULL
NULL
NULL
10d29c12-493f-11ed-9307-7cd30abc95d8
493f11ed-9c12-10d2-9307-7cd30abc95d8
NULL
NULL
NULL
NULL
NULL
NULL
NULL
select c8 from test1 order by c1 asc;
c8
NULL
NULL
NULL
NULL
NULL
NULL
NULL
NULL
NULL
NULL
NULL
11d29c12-493f-11ed-9307-7cd30abc95d8
NULL
NULL
NULL
NULL
NULL
NULL
select c9 from test1 order by c1 asc;
c9
NULL
NULL
NULL
NULL
NULL
NULL
NULL
NULL
NULL
NULL
NULL
NULL
12d29c12-493f-11ed-9307-7cd30abc95d8
12d29c12-493f-11ed-9307-7cd30abc95d8
NULL
NULL
NULL
NULL
select c10 from test1 order by c1 asc;
c10
NULL
NULL
NULL
NULL
NULL
NULL
NULL
NULL
NULL
NULL
NULL
NULL
NULL
NULL
13d29c12-493f-11ed-9307-7cd30abc95d8
493f11ed-9c12-13d2-9307-7cd30abc95d8
NULL
NULL
select c11 from test1 order by c1 asc;
c11
NULL
NULL
NULL
NULL
NULL
NULL
NULL
NULL
NULL
NULL
NULL
NULL
NULL
NULL
NULL
NULL
14d29c12-493f-11ed-9307-7cd30abc95d8
493f11ed-9c12-14d2-9307-7cd30abc95d8
#function-5-1-3    时间日期类型
drop table test1;
create table test1(c1 bigint PRIMARY key AUTO_INCREMENT,c2 date,c3 time,
c4 year ,c5 DATETIME,c6 TIMESTAMP);
insert into test1(c2) values(bin_to_uuid(uuid_to_bin('5fd29c12-493f-11ed-9307-7cd30abc95d8')));
insert into test1(c3) values(bin_to_uuid(uuid_to_bin('6fd29c12-493f-11ed-9307-7cd30abc95d8')));
insert into test1(c4) values(bin_to_uuid(uuid_to_bin('7fd29c12-493f-11ed-9307-7cd30abc95d8')));
insert into test1(c5) values(bin_to_uuid(uuid_to_bin('8fd29c12-493f-11ed-9307-7cd30abc95d8')));
insert into test1(c6) values(bin_to_uuid(uuid_to_bin('9fd29c12-493f-11ed-9307-7cd30abc95d8')));
select c1,c2 from test1 order by c1 asc;
c1	c2
1	NULL
select c1,c3 from test1 order by c1 asc;
c1	c3
1	00:00:06
select c1,c4 from test1 order by c1 asc;
c1	c4
1	NULL
select c1,c5 from test1 order by c1 asc;
c1	c5
1	NULL
select c1,c6 from test1 order by c1 asc;
c1	c6
1	NULL
#function-5-1-4    json类型
drop table test1;
create table test1(c1 bigint PRIMARY key AUTO_INCREMENT,c2 json);
insert into test1(c2) values(bin_to_uuid(uuid_to_bin('5fd29c12-493f-11ed-9307-7cd30abc95d8')));
drop table test1;
#function-5-2    select语句
drop table test1;
create table test1(c1 bigint PRIMARY key AUTO_INCREMENT,c2 char(50),c3 varchar(50),
c4 TINYBLOB ,c5 TINYTEXT,c6 BLOB,c7 TEXT,c8 MEDIUMBLOB,c9 MEDIUMTEXT,c10 LONGBLOB,c11 LONGTEXT);
insert into test1(c2,c3,c4,c5,c6,c7,c8,c9,c10,c11) values(
bin_to_uuid(uuid_to_bin('5fd29c12-493f-11ed-9307-7cd30abc95d8')),
bin_to_uuid(uuid_to_bin('6fd29c12-493f-11ed-9307-7cd30abc95d8')),
bin_to_uuid(uuid_to_bin('7fd29c12-493f-11ed-9307-7cd30abc95d8')),
bin_to_uuid(uuid_to_bin('8fd29c12-493f-11ed-9307-7cd30abc95d8')),
bin_to_uuid(uuid_to_bin('9fd29c12-493f-11ed-9307-7cd30abc95d8')),
bin_to_uuid(uuid_to_bin('10d29c12-493f-11ed-9307-7cd30abc95d8')),
bin_to_uuid(uuid_to_bin('11d29c12-493f-11ed-9307-7cd30abc95d8')),
bin_to_uuid(uuid_to_bin('12d29c12-493f-11ed-9307-7cd30abc95d8')),
bin_to_uuid(uuid_to_bin('13d29c12-493f-11ed-9307-7cd30abc95d8')),
bin_to_uuid(uuid_to_bin('14d29c12-493f-11ed-9307-7cd30abc95d8'))
),
(
bin_to_uuid(uuid_to_bin('5fd29c12-493f-11ed-9307-7cd30abc95d8'),23),
bin_to_uuid(uuid_to_bin('6fd29c12-493f-11ed-9307-7cd30abc95d8'),4),
bin_to_uuid(uuid_to_bin('7fd29c12-493f-11ed-9307-7cd30abc95d8'),20.5),
bin_to_uuid(uuid_to_bin('8fd29c12-493f-11ed-9307-7cd30abc95d8'),2),
bin_to_uuid(uuid_to_bin('9fd29c12-493f-11ed-9307-7cd30abc95d8'),-25),
bin_to_uuid(uuid_to_bin('10d29c12-493f-11ed-9307-7cd30abc95d8'),53),
bin_to_uuid(uuid_to_bin('11d29c12-493f-11ed-9307-7cd30abc95d8'),34),
bin_to_uuid(uuid_to_bin('12d29c12-493f-11ed-9307-7cd30abc95d8'),24),
bin_to_uuid(uuid_to_bin('13d29c12-493f-11ed-9307-7cd30abc95d8'),0.7),
bin_to_uuid(uuid_to_bin('14d29c12-493f-11ed-9307-7cd30abc95d8'),0.9)
);
select c2 from test1 order by c1 asc;
c2
5fd29c12-493f-11ed-9307-7cd30abc95d8
493f11ed-9c12-5fd2-9307-7cd30abc95d8
select c3 from test1 order by c1 asc;
c3
6fd29c12-493f-11ed-9307-7cd30abc95d8
493f11ed-9c12-6fd2-9307-7cd30abc95d8
select c4 from test1 order by c1 asc;
c4
7fd29c12-493f-11ed-9307-7cd30abc95d8
493f11ed-9c12-7fd2-9307-7cd30abc95d8
select c5 from test1 order by c1 asc;
c5
8fd29c12-493f-11ed-9307-7cd30abc95d8
493f11ed-9c12-8fd2-9307-7cd30abc95d8
select c6 from test1 order by c1 asc;
c6
9fd29c12-493f-11ed-9307-7cd30abc95d8
493f11ed-9c12-9fd2-9307-7cd30abc95d8
select c7 from test1 order by c1 asc;
c7
10d29c12-493f-11ed-9307-7cd30abc95d8
493f11ed-9c12-10d2-9307-7cd30abc95d8
select c8 from test1 order by c1 asc;
c8
11d29c12-493f-11ed-9307-7cd30abc95d8
493f11ed-9c12-11d2-9307-7cd30abc95d8
select c9 from test1 order by c1 asc;
c9
12d29c12-493f-11ed-9307-7cd30abc95d8
493f11ed-9c12-12d2-9307-7cd30abc95d8
select c10 from test1 order by c1 asc;
c10
13d29c12-493f-11ed-9307-7cd30abc95d8
493f11ed-9c12-13d2-9307-7cd30abc95d8
select c11 from test1 order by c1 asc;
c11
14d29c12-493f-11ed-9307-7cd30abc95d8
493f11ed-9c12-14d2-9307-7cd30abc95d8
select * from test1 order by c1 asc;
c1	c2	c3	c4	c5	c6	c7	c8	c9	c10	c11
1	5fd29c12-493f-11ed-9307-7cd30abc95d8	6fd29c12-493f-11ed-9307-7cd30abc95d8	7fd29c12-493f-11ed-9307-7cd30abc95d8	8fd29c12-493f-11ed-9307-7cd30abc95d8	9fd29c12-493f-11ed-9307-7cd30abc95d8	10d29c12-493f-11ed-9307-7cd30abc95d8	11d29c12-493f-11ed-9307-7cd30abc95d8	12d29c12-493f-11ed-9307-7cd30abc95d8	13d29c12-493f-11ed-9307-7cd30abc95d8	14d29c12-493f-11ed-9307-7cd30abc95d8
2	493f11ed-9c12-5fd2-9307-7cd30abc95d8	493f11ed-9c12-6fd2-9307-7cd30abc95d8	493f11ed-9c12-7fd2-9307-7cd30abc95d8	493f11ed-9c12-8fd2-9307-7cd30abc95d8	493f11ed-9c12-9fd2-9307-7cd30abc95d8	493f11ed-9c12-10d2-9307-7cd30abc95d8	493f11ed-9c12-11d2-9307-7cd30abc95d8	493f11ed-9c12-12d2-9307-7cd30abc95d8	493f11ed-9c12-13d2-9307-7cd30abc95d8	493f11ed-9c12-14d2-9307-7cd30abc95d8
select * from test1 where c4= bin_to_uuid(uuid_to_bin('7fd29c12-493f-11ed-9307-7cd30abc95d8'),20.5);
c1	c2	c3	c4	c5	c6	c7	c8	c9	c10	c11
2	493f11ed-9c12-5fd2-9307-7cd30abc95d8	493f11ed-9c12-6fd2-9307-7cd30abc95d8	493f11ed-9c12-7fd2-9307-7cd30abc95d8	493f11ed-9c12-8fd2-9307-7cd30abc95d8	493f11ed-9c12-9fd2-9307-7cd30abc95d8	493f11ed-9c12-10d2-9307-7cd30abc95d8	493f11ed-9c12-11d2-9307-7cd30abc95d8	493f11ed-9c12-12d2-9307-7cd30abc95d8	493f11ed-9c12-13d2-9307-7cd30abc95d8	493f11ed-9c12-14d2-9307-7cd30abc95d8
select * from test1 where c11= bin_to_uuid(uuid_to_bin('14d29c12-493f-11ed-9307-7cd30abc95d8'),0.9);
c1	c2	c3	c4	c5	c6	c7	c8	c9	c10	c11
2	493f11ed-9c12-5fd2-9307-7cd30abc95d8	493f11ed-9c12-6fd2-9307-7cd30abc95d8	493f11ed-9c12-7fd2-9307-7cd30abc95d8	493f11ed-9c12-8fd2-9307-7cd30abc95d8	493f11ed-9c12-9fd2-9307-7cd30abc95d8	493f11ed-9c12-10d2-9307-7cd30abc95d8	493f11ed-9c12-11d2-9307-7cd30abc95d8	493f11ed-9c12-12d2-9307-7cd30abc95d8	493f11ed-9c12-13d2-9307-7cd30abc95d8	493f11ed-9c12-14d2-9307-7cd30abc95d8
select * from test1 where c5= bin_to_uuid(uuid_to_bin('8fd29c12-493f-11ed-9307-7cd30abc95d8'),2) 
and c7=bin_to_uuid(uuid_to_bin('10d29c12-493f-11ed-9307-7cd30abc95d8'),53)
and c8=bin_to_uuid(uuid_to_bin('11d29c12-493f-11ed-9307-7cd30abc95d8'));
c1	c2	c3	c4	c5	c6	c7	c8	c9	c10	c11
select * from test1 where c5= bin_to_uuid(uuid_to_bin('8fd29c12-493f-11ed-9307-7cd30abc95d8'),2) 
and c7=bin_to_uuid(uuid_to_bin('10d29c12-493f-11ed-9307-7cd30abc95d8'),53)
or c8=bin_to_uuid(uuid_to_bin('11d29c12-493f-11ed-9307-7cd30abc95d8'));
c1	c2	c3	c4	c5	c6	c7	c8	c9	c10	c11
1	5fd29c12-493f-11ed-9307-7cd30abc95d8	6fd29c12-493f-11ed-9307-7cd30abc95d8	7fd29c12-493f-11ed-9307-7cd30abc95d8	8fd29c12-493f-11ed-9307-7cd30abc95d8	9fd29c12-493f-11ed-9307-7cd30abc95d8	10d29c12-493f-11ed-9307-7cd30abc95d8	11d29c12-493f-11ed-9307-7cd30abc95d8	12d29c12-493f-11ed-9307-7cd30abc95d8	13d29c12-493f-11ed-9307-7cd30abc95d8	14d29c12-493f-11ed-9307-7cd30abc95d8
2	493f11ed-9c12-5fd2-9307-7cd30abc95d8	493f11ed-9c12-6fd2-9307-7cd30abc95d8	493f11ed-9c12-7fd2-9307-7cd30abc95d8	493f11ed-9c12-8fd2-9307-7cd30abc95d8	493f11ed-9c12-9fd2-9307-7cd30abc95d8	493f11ed-9c12-10d2-9307-7cd30abc95d8	493f11ed-9c12-11d2-9307-7cd30abc95d8	493f11ed-9c12-12d2-9307-7cd30abc95d8	493f11ed-9c12-13d2-9307-7cd30abc95d8	493f11ed-9c12-14d2-9307-7cd30abc95d8
select * from test1 where c5= bin_to_uuid(uuid_to_bin('8fd29c12-493f-11ed-9307-7cd30abc95d8'),2) 
or c7=bin_to_uuid(uuid_to_bin('10d29c12-493f-11ed-9307-7cd30abc95d8'),53)
or c8=bin_to_uuid(uuid_to_bin('11d29c12-493f-11ed-9307-7cd30abc95d8'));
c1	c2	c3	c4	c5	c6	c7	c8	c9	c10	c11
1	5fd29c12-493f-11ed-9307-7cd30abc95d8	6fd29c12-493f-11ed-9307-7cd30abc95d8	7fd29c12-493f-11ed-9307-7cd30abc95d8	8fd29c12-493f-11ed-9307-7cd30abc95d8	9fd29c12-493f-11ed-9307-7cd30abc95d8	10d29c12-493f-11ed-9307-7cd30abc95d8	11d29c12-493f-11ed-9307-7cd30abc95d8	12d29c12-493f-11ed-9307-7cd30abc95d8	13d29c12-493f-11ed-9307-7cd30abc95d8	14d29c12-493f-11ed-9307-7cd30abc95d8
2	493f11ed-9c12-5fd2-9307-7cd30abc95d8	493f11ed-9c12-6fd2-9307-7cd30abc95d8	493f11ed-9c12-7fd2-9307-7cd30abc95d8	493f11ed-9c12-8fd2-9307-7cd30abc95d8	493f11ed-9c12-9fd2-9307-7cd30abc95d8	493f11ed-9c12-10d2-9307-7cd30abc95d8	493f11ed-9c12-11d2-9307-7cd30abc95d8	493f11ed-9c12-12d2-9307-7cd30abc95d8	493f11ed-9c12-13d2-9307-7cd30abc95d8	493f11ed-9c12-14d2-9307-7cd30abc95d8
select * from test1 order by bin_to_uuid(uuid_to_bin('10d29c12-493f-11ed-9307-7cd30abc95d8')) asc;
c1	c2	c3	c4	c5	c6	c7	c8	c9	c10	c11
1	5fd29c12-493f-11ed-9307-7cd30abc95d8	6fd29c12-493f-11ed-9307-7cd30abc95d8	7fd29c12-493f-11ed-9307-7cd30abc95d8	8fd29c12-493f-11ed-9307-7cd30abc95d8	9fd29c12-493f-11ed-9307-7cd30abc95d8	10d29c12-493f-11ed-9307-7cd30abc95d8	11d29c12-493f-11ed-9307-7cd30abc95d8	12d29c12-493f-11ed-9307-7cd30abc95d8	13d29c12-493f-11ed-9307-7cd30abc95d8	14d29c12-493f-11ed-9307-7cd30abc95d8
2	493f11ed-9c12-5fd2-9307-7cd30abc95d8	493f11ed-9c12-6fd2-9307-7cd30abc95d8	493f11ed-9c12-7fd2-9307-7cd30abc95d8	493f11ed-9c12-8fd2-9307-7cd30abc95d8	493f11ed-9c12-9fd2-9307-7cd30abc95d8	493f11ed-9c12-10d2-9307-7cd30abc95d8	493f11ed-9c12-11d2-9307-7cd30abc95d8	493f11ed-9c12-12d2-9307-7cd30abc95d8	493f11ed-9c12-13d2-9307-7cd30abc95d8	493f11ed-9c12-14d2-9307-7cd30abc95d8
select * from test1 order by bin_to_uuid(uuid_to_bin('10d29c12-493f-11ed-9307-7cd30abc95d8')) desc;
c1	c2	c3	c4	c5	c6	c7	c8	c9	c10	c11
1	5fd29c12-493f-11ed-9307-7cd30abc95d8	6fd29c12-493f-11ed-9307-7cd30abc95d8	7fd29c12-493f-11ed-9307-7cd30abc95d8	8fd29c12-493f-11ed-9307-7cd30abc95d8	9fd29c12-493f-11ed-9307-7cd30abc95d8	10d29c12-493f-11ed-9307-7cd30abc95d8	11d29c12-493f-11ed-9307-7cd30abc95d8	12d29c12-493f-11ed-9307-7cd30abc95d8	13d29c12-493f-11ed-9307-7cd30abc95d8	14d29c12-493f-11ed-9307-7cd30abc95d8
2	493f11ed-9c12-5fd2-9307-7cd30abc95d8	493f11ed-9c12-6fd2-9307-7cd30abc95d8	493f11ed-9c12-7fd2-9307-7cd30abc95d8	493f11ed-9c12-8fd2-9307-7cd30abc95d8	493f11ed-9c12-9fd2-9307-7cd30abc95d8	493f11ed-9c12-10d2-9307-7cd30abc95d8	493f11ed-9c12-11d2-9307-7cd30abc95d8	493f11ed-9c12-12d2-9307-7cd30abc95d8	493f11ed-9c12-13d2-9307-7cd30abc95d8	493f11ed-9c12-14d2-9307-7cd30abc95d8
select * from test1 order by (select c2 from test1 order by  bin_to_uuid(uuid_to_bin('10d29c12-493f-11ed-9307-7cd30abc95d8')) 
asc LIMIT 1) asc limit 1;
c1	c2	c3	c4	c5	c6	c7	c8	c9	c10	c11
1	5fd29c12-493f-11ed-9307-7cd30abc95d8	6fd29c12-493f-11ed-9307-7cd30abc95d8	7fd29c12-493f-11ed-9307-7cd30abc95d8	8fd29c12-493f-11ed-9307-7cd30abc95d8	9fd29c12-493f-11ed-9307-7cd30abc95d8	10d29c12-493f-11ed-9307-7cd30abc95d8	11d29c12-493f-11ed-9307-7cd30abc95d8	12d29c12-493f-11ed-9307-7cd30abc95d8	13d29c12-493f-11ed-9307-7cd30abc95d8	14d29c12-493f-11ed-9307-7cd30abc95d8
select * from test1 group by bin_to_uuid(uuid_to_bin('11d29c12-493f-11ed-9307-7cd30abc95d8')) 
HAVING bin_to_uuid(uuid_to_bin('11d29c12-493f-11ed-9307-7cd30abc95d8'),34) order by c1 asc;
c1	c2	c3	c4	c5	c6	c7	c8	c9	c10	c11
1	5fd29c12-493f-11ed-9307-7cd30abc95d8	6fd29c12-493f-11ed-9307-7cd30abc95d8	7fd29c12-493f-11ed-9307-7cd30abc95d8	8fd29c12-493f-11ed-9307-7cd30abc95d8	9fd29c12-493f-11ed-9307-7cd30abc95d8	10d29c12-493f-11ed-9307-7cd30abc95d8	11d29c12-493f-11ed-9307-7cd30abc95d8	12d29c12-493f-11ed-9307-7cd30abc95d8	13d29c12-493f-11ed-9307-7cd30abc95d8	14d29c12-493f-11ed-9307-7cd30abc95d8
Warnings:
Warning	1292	Truncated incorrect DOUBLE value: '493f11ed-9c12-11d2-9307-7cd30abc95d8'
select * from test1 group by bin_to_uuid(uuid_to_bin('11d29c12-493f-11ed-9307-7cd30abc95d8')) 
HAVING c8 order by c1 asc;
c1	c2	c3	c4	c5	c6	c7	c8	c9	c10	c11
1	5fd29c12-493f-11ed-9307-7cd30abc95d8	6fd29c12-493f-11ed-9307-7cd30abc95d8	7fd29c12-493f-11ed-9307-7cd30abc95d8	8fd29c12-493f-11ed-9307-7cd30abc95d8	9fd29c12-493f-11ed-9307-7cd30abc95d8	10d29c12-493f-11ed-9307-7cd30abc95d8	11d29c12-493f-11ed-9307-7cd30abc95d8	12d29c12-493f-11ed-9307-7cd30abc95d8	13d29c12-493f-11ed-9307-7cd30abc95d8	14d29c12-493f-11ed-9307-7cd30abc95d8
Warnings:
Warning	1292	Truncated incorrect DOUBLE value: '11d29c12-493f-11ed-9307-7cd30abc95d8'
select CASE c2 WHEN bin_to_uuid(uuid_to_bin('5fd29c12-493f-11ed-9307-7cd30abc95d8')) THEN '男'  WHEN 0 THEN 
bin_to_uuid(uuid_to_bin('5fd29c12-493f-11ed-9307-7cd30abc95d8'),23) ELSE '其他' END  from test1 order by c2 asc;
CASE c2 WHEN bin_to_uuid(uuid_to_bin('5fd29c12-493f-11ed-9307-7cd30abc95d8')) THEN '男'  WHEN 0 THEN 
bin_to_uuid(uuid_to_bin('5fd29c12-493f-11ed-9307-7cd30abc95d8'),23) ELSE '其他' END
其他
男
Warnings:
Warning	1292	Truncated incorrect DECIMAL value: '493f11ed-9c12-5fd2-9307-7cd30abc95d8'
select CASE c4 WHEN bin_to_uuid(uuid_to_bin('7fd29c12-493f-11ed-9307-7cd30abc95d8'),20.5) THEN '男'  WHEN 0 THEN 
bin_to_uuid(uuid_to_bin('5fd29c12-493f-11ed-9307-7cd30abc95d8'),23) ELSE '其他' END  from test1 order by c4 asc;
CASE c4 WHEN bin_to_uuid(uuid_to_bin('7fd29c12-493f-11ed-9307-7cd30abc95d8'),20.5) THEN '男'  WHEN 0 THEN 
bin_to_uuid(uuid_to_bin('5fd29c12-493f-11ed-9307-7cd30abc95d8'),23) ELSE '其他' END
男
其他
Warnings:
Warning	1292	Truncated incorrect DECIMAL value: '7fd29c12-493f-11ed-9307-7cd30abc95d8'
select * from test1 where EXISTS(select c2 from test1 where c2=bin_to_uuid(uuid_to_bin('5fd29c12-493f-11ed-9307-7cd30abc95d8'),23));
c1	c2	c3	c4	c5	c6	c7	c8	c9	c10	c11
1	5fd29c12-493f-11ed-9307-7cd30abc95d8	6fd29c12-493f-11ed-9307-7cd30abc95d8	7fd29c12-493f-11ed-9307-7cd30abc95d8	8fd29c12-493f-11ed-9307-7cd30abc95d8	9fd29c12-493f-11ed-9307-7cd30abc95d8	10d29c12-493f-11ed-9307-7cd30abc95d8	11d29c12-493f-11ed-9307-7cd30abc95d8	12d29c12-493f-11ed-9307-7cd30abc95d8	13d29c12-493f-11ed-9307-7cd30abc95d8	14d29c12-493f-11ed-9307-7cd30abc95d8
2	493f11ed-9c12-5fd2-9307-7cd30abc95d8	493f11ed-9c12-6fd2-9307-7cd30abc95d8	493f11ed-9c12-7fd2-9307-7cd30abc95d8	493f11ed-9c12-8fd2-9307-7cd30abc95d8	493f11ed-9c12-9fd2-9307-7cd30abc95d8	493f11ed-9c12-10d2-9307-7cd30abc95d8	493f11ed-9c12-11d2-9307-7cd30abc95d8	493f11ed-9c12-12d2-9307-7cd30abc95d8	493f11ed-9c12-13d2-9307-7cd30abc95d8	493f11ed-9c12-14d2-9307-7cd30abc95d8
select * from test1 where not EXISTS(select c2 from test1 where c2=bin_to_uuid(uuid_to_bin('5fd29c12-493f-11ed-9307-7cd30abc95d8'),23));
c1	c2	c3	c4	c5	c6	c7	c8	c9	c10	c11
select * from test1 where c2 in(select c2 from test1 where c2=bin_to_uuid(uuid_to_bin('5fd29c12-493f-11ed-9307-7cd30abc95d8'),23));
c1	c2	c3	c4	c5	c6	c7	c8	c9	c10	c11
2	493f11ed-9c12-5fd2-9307-7cd30abc95d8	493f11ed-9c12-6fd2-9307-7cd30abc95d8	493f11ed-9c12-7fd2-9307-7cd30abc95d8	493f11ed-9c12-8fd2-9307-7cd30abc95d8	493f11ed-9c12-9fd2-9307-7cd30abc95d8	493f11ed-9c12-10d2-9307-7cd30abc95d8	493f11ed-9c12-11d2-9307-7cd30abc95d8	493f11ed-9c12-12d2-9307-7cd30abc95d8	493f11ed-9c12-13d2-9307-7cd30abc95d8	493f11ed-9c12-14d2-9307-7cd30abc95d8
select * from test1 where c2 not in(select c2 from test1 where c2=bin_to_uuid(uuid_to_bin('5fd29c12-493f-11ed-9307-7cd30abc95d8'),23));
c1	c2	c3	c4	c5	c6	c7	c8	c9	c10	c11
1	5fd29c12-493f-11ed-9307-7cd30abc95d8	6fd29c12-493f-11ed-9307-7cd30abc95d8	7fd29c12-493f-11ed-9307-7cd30abc95d8	8fd29c12-493f-11ed-9307-7cd30abc95d8	9fd29c12-493f-11ed-9307-7cd30abc95d8	10d29c12-493f-11ed-9307-7cd30abc95d8	11d29c12-493f-11ed-9307-7cd30abc95d8	12d29c12-493f-11ed-9307-7cd30abc95d8	13d29c12-493f-11ed-9307-7cd30abc95d8	14d29c12-493f-11ed-9307-7cd30abc95d8
select * from test1 where c2 =any(select c2 from test1 where c2=bin_to_uuid(uuid_to_bin('5fd29c12-493f-11ed-9307-7cd30abc95d8'),23));
c1	c2	c3	c4	c5	c6	c7	c8	c9	c10	c11
2	493f11ed-9c12-5fd2-9307-7cd30abc95d8	493f11ed-9c12-6fd2-9307-7cd30abc95d8	493f11ed-9c12-7fd2-9307-7cd30abc95d8	493f11ed-9c12-8fd2-9307-7cd30abc95d8	493f11ed-9c12-9fd2-9307-7cd30abc95d8	493f11ed-9c12-10d2-9307-7cd30abc95d8	493f11ed-9c12-11d2-9307-7cd30abc95d8	493f11ed-9c12-12d2-9307-7cd30abc95d8	493f11ed-9c12-13d2-9307-7cd30abc95d8	493f11ed-9c12-14d2-9307-7cd30abc95d8
select * from test1 where c2 >any(select c2 from test1 where c2=bin_to_uuid(uuid_to_bin('5fd29c12-493f-11ed-9307-7cd30abc95d8'),23));
c1	c2	c3	c4	c5	c6	c7	c8	c9	c10	c11
1	5fd29c12-493f-11ed-9307-7cd30abc95d8	6fd29c12-493f-11ed-9307-7cd30abc95d8	7fd29c12-493f-11ed-9307-7cd30abc95d8	8fd29c12-493f-11ed-9307-7cd30abc95d8	9fd29c12-493f-11ed-9307-7cd30abc95d8	10d29c12-493f-11ed-9307-7cd30abc95d8	11d29c12-493f-11ed-9307-7cd30abc95d8	12d29c12-493f-11ed-9307-7cd30abc95d8	13d29c12-493f-11ed-9307-7cd30abc95d8	14d29c12-493f-11ed-9307-7cd30abc95d8
select * from test1 where c2 <any(select c2 from test1 where c2=bin_to_uuid(uuid_to_bin('5fd29c12-493f-11ed-9307-7cd30abc95d8'),23));
c1	c2	c3	c4	c5	c6	c7	c8	c9	c10	c11
select * from test1 where c2 =all(select c2 from test1 where c2=bin_to_uuid(uuid_to_bin('5fd29c12-493f-11ed-9307-7cd30abc95d8'),23));
c1	c2	c3	c4	c5	c6	c7	c8	c9	c10	c11
2	493f11ed-9c12-5fd2-9307-7cd30abc95d8	493f11ed-9c12-6fd2-9307-7cd30abc95d8	493f11ed-9c12-7fd2-9307-7cd30abc95d8	493f11ed-9c12-8fd2-9307-7cd30abc95d8	493f11ed-9c12-9fd2-9307-7cd30abc95d8	493f11ed-9c12-10d2-9307-7cd30abc95d8	493f11ed-9c12-11d2-9307-7cd30abc95d8	493f11ed-9c12-12d2-9307-7cd30abc95d8	493f11ed-9c12-13d2-9307-7cd30abc95d8	493f11ed-9c12-14d2-9307-7cd30abc95d8
select * from test1 where c2 >all(select c2 from test1 where c2=bin_to_uuid(uuid_to_bin('5fd29c12-493f-11ed-9307-7cd30abc95d8'),23));
c1	c2	c3	c4	c5	c6	c7	c8	c9	c10	c11
1	5fd29c12-493f-11ed-9307-7cd30abc95d8	6fd29c12-493f-11ed-9307-7cd30abc95d8	7fd29c12-493f-11ed-9307-7cd30abc95d8	8fd29c12-493f-11ed-9307-7cd30abc95d8	9fd29c12-493f-11ed-9307-7cd30abc95d8	10d29c12-493f-11ed-9307-7cd30abc95d8	11d29c12-493f-11ed-9307-7cd30abc95d8	12d29c12-493f-11ed-9307-7cd30abc95d8	13d29c12-493f-11ed-9307-7cd30abc95d8	14d29c12-493f-11ed-9307-7cd30abc95d8
select * from test1 where c2 <all(select c2 from test1 where c2=bin_to_uuid(uuid_to_bin('5fd29c12-493f-11ed-9307-7cd30abc95d8'),23));
c1	c2	c3	c4	c5	c6	c7	c8	c9	c10	c11
select c2 from test1 where c2 like '%5%';
c2
5fd29c12-493f-11ed-9307-7cd30abc95d8
493f11ed-9c12-5fd2-9307-7cd30abc95d8
select c2 from test1 where c2 like '%-%';
c2
5fd29c12-493f-11ed-9307-7cd30abc95d8
493f11ed-9c12-5fd2-9307-7cd30abc95d8
#function-5-3    update语句
drop table test1;
create table test1(c1 int PRIMARY key AUTO_INCREMENT,c2 varchar(100),c3 varchar(100));
insert into test1(c2,c3) values(bin_to_uuid(uuid_to_bin('661be1c9-3f0b-11ed-8ff3-7cd30abc95d8')),bin_to_uuid(uuid_to_bin('658517a8-3f0b-11ed-9291-b8599f1d613a')));
insert into test1(c2,c3) values(bin_to_uuid(uuid_to_bin('7945c0ae-3f0b-11ed-8ff3-7cd30abc95d8')),bin_to_uuid(uuid_to_bin('7e915fff-3f0b-11ed-9291-b8599f1d613a')));
insert into test1(c2,c3) values(bin_to_uuid(uuid_to_bin('84cb3d42-3f0b-11ed-8ff3-7cd30abc95d8')),bin_to_uuid(uuid_to_bin('867c697c-3f0b-11ed-9291-b8599f1d613a')));
insert into test1(c2,c3) values(bin_to_uuid(uuid_to_bin('854dc29c-3f0b-11ed-8ff3-7cd30abc95d8')),bin_to_uuid(uuid_to_bin('86d336c9-3f0b-11ed-9291-b8599f1d613a')));
insert into test1(c2,c3) values(bin_to_uuid(uuid_to_bin('854dc29c-3f0b-11ed-8ff3-7cd30abc95d8'),22),bin_to_uuid(uuid_to_bin('86d336c9-3f0b-11ed-9291-b8599f1d613a'),-20));
select * from test1 order by c1 asc;
c1	c2	c3
1	661be1c9-3f0b-11ed-8ff3-7cd30abc95d8	658517a8-3f0b-11ed-9291-b8599f1d613a
2	7945c0ae-3f0b-11ed-8ff3-7cd30abc95d8	7e915fff-3f0b-11ed-9291-b8599f1d613a
3	84cb3d42-3f0b-11ed-8ff3-7cd30abc95d8	867c697c-3f0b-11ed-9291-b8599f1d613a
4	854dc29c-3f0b-11ed-8ff3-7cd30abc95d8	86d336c9-3f0b-11ed-9291-b8599f1d613a
5	3f0b11ed-c29c-854d-8ff3-7cd30abc95d8	3f0b11ed-36c9-86d3-9291-b8599f1d613a
update test1 set c2=bin_to_uuid(uuid_to_bin('99cb3d42-3f0b-11ed-8ff3-7cd30abc95d8'))+bin_to_uuid(uuid_to_bin('84cb3d42-3f0b-11ed-8ff3-7cd30abc95d8')) where
c3=bin_to_uuid(uuid_to_bin('658517a8-3f0b-11ed-9291-b8599f1d613a'));
Warnings:
Warning	1292	Truncated incorrect DOUBLE value: '99cb3d42-3f0b-11ed-8ff3-7cd30abc95d8'
Warning	1292	Truncated incorrect DOUBLE value: '84cb3d42-3f0b-11ed-8ff3-7cd30abc95d8'
select * from test1 order by c1 asc;
c1	c2	c3
1	183	658517a8-3f0b-11ed-9291-b8599f1d613a
2	7945c0ae-3f0b-11ed-8ff3-7cd30abc95d8	7e915fff-3f0b-11ed-9291-b8599f1d613a
3	84cb3d42-3f0b-11ed-8ff3-7cd30abc95d8	867c697c-3f0b-11ed-9291-b8599f1d613a
4	854dc29c-3f0b-11ed-8ff3-7cd30abc95d8	86d336c9-3f0b-11ed-9291-b8599f1d613a
5	3f0b11ed-c29c-854d-8ff3-7cd30abc95d8	3f0b11ed-36c9-86d3-9291-b8599f1d613a
update test1 set c2=bin_to_uuid(uuid_to_bin('66cb3d42-3f0b-11ed-8ff3-7cd30abc95d8'))-bin_to_uuid(uuid_to_bin('84cb3d42-3f0b-11ed-8ff3-7cd30abc95d8')) where
c3=bin_to_uuid(uuid_to_bin('658517a8-3f0b-11ed-9291-b8599f1d613a'));
Warnings:
Warning	1292	Truncated incorrect DOUBLE value: '66cb3d42-3f0b-11ed-8ff3-7cd30abc95d8'
Warning	1292	Truncated incorrect DOUBLE value: '84cb3d42-3f0b-11ed-8ff3-7cd30abc95d8'
select * from test1 order by c1 asc;
c1	c2	c3
1	-18	658517a8-3f0b-11ed-9291-b8599f1d613a
2	7945c0ae-3f0b-11ed-8ff3-7cd30abc95d8	7e915fff-3f0b-11ed-9291-b8599f1d613a
3	84cb3d42-3f0b-11ed-8ff3-7cd30abc95d8	867c697c-3f0b-11ed-9291-b8599f1d613a
4	854dc29c-3f0b-11ed-8ff3-7cd30abc95d8	86d336c9-3f0b-11ed-9291-b8599f1d613a
5	3f0b11ed-c29c-854d-8ff3-7cd30abc95d8	3f0b11ed-36c9-86d3-9291-b8599f1d613a
update test1 set c2=bin_to_uuid(uuid_to_bin('16cb3d42-3f0b-11ed-8ff3-7cd30abc95d8'))*bin_to_uuid(uuid_to_bin('84cb3d42-3f0b-11ed-8ff3-7cd30abc95d8')) where
c3=bin_to_uuid(uuid_to_bin('658517a8-3f0b-11ed-9291-b8599f1d613a'));
Warnings:
Warning	1292	Truncated incorrect DOUBLE value: '16cb3d42-3f0b-11ed-8ff3-7cd30abc95d8'
Warning	1292	Truncated incorrect DOUBLE value: '84cb3d42-3f0b-11ed-8ff3-7cd30abc95d8'
select * from test1 order by c1 asc;
c1	c2	c3
1	1344	658517a8-3f0b-11ed-9291-b8599f1d613a
2	7945c0ae-3f0b-11ed-8ff3-7cd30abc95d8	7e915fff-3f0b-11ed-9291-b8599f1d613a
3	84cb3d42-3f0b-11ed-8ff3-7cd30abc95d8	867c697c-3f0b-11ed-9291-b8599f1d613a
4	854dc29c-3f0b-11ed-8ff3-7cd30abc95d8	86d336c9-3f0b-11ed-9291-b8599f1d613a
5	3f0b11ed-c29c-854d-8ff3-7cd30abc95d8	3f0b11ed-36c9-86d3-9291-b8599f1d613a
update test1 set c2=bin_to_uuid(uuid_to_bin('99cb3d42-3f0b-11ed-8ff3-7cd30abc95d8'))/bin_to_uuid(uuid_to_bin('84cb3d42-3f0b-11ed-8ff3-7cd30abc95d8')) where
c3=bin_to_uuid(uuid_to_bin('658517a8-3f0b-11ed-9291-b8599f1d613a'));
Warnings:
Warning	1292	Truncated incorrect DOUBLE value: '99cb3d42-3f0b-11ed-8ff3-7cd30abc95d8'
Warning	1292	Truncated incorrect DOUBLE value: '84cb3d42-3f0b-11ed-8ff3-7cd30abc95d8'
select * from test1 order by c1 asc;
c1	c2	c3
1	1.1785714285714286	658517a8-3f0b-11ed-9291-b8599f1d613a
2	7945c0ae-3f0b-11ed-8ff3-7cd30abc95d8	7e915fff-3f0b-11ed-9291-b8599f1d613a
3	84cb3d42-3f0b-11ed-8ff3-7cd30abc95d8	867c697c-3f0b-11ed-9291-b8599f1d613a
4	854dc29c-3f0b-11ed-8ff3-7cd30abc95d8	86d336c9-3f0b-11ed-9291-b8599f1d613a
5	3f0b11ed-c29c-854d-8ff3-7cd30abc95d8	3f0b11ed-36c9-86d3-9291-b8599f1d613a
update test1 set c2=bin_to_uuid(uuid_to_bin('86cb3d42-3f0b-11ed-8ff3-7cd30abc95d8'))+5 where c3=bin_to_uuid(uuid_to_bin('658517a8-3f0b-11ed-9291-b8599f1d613a'));
Warnings:
Warning	1292	Truncated incorrect DOUBLE value: '86cb3d42-3f0b-11ed-8ff3-7cd30abc95d8'
select * from test1 order by c1 asc;
c1	c2	c3
1	91	658517a8-3f0b-11ed-9291-b8599f1d613a
2	7945c0ae-3f0b-11ed-8ff3-7cd30abc95d8	7e915fff-3f0b-11ed-9291-b8599f1d613a
3	84cb3d42-3f0b-11ed-8ff3-7cd30abc95d8	867c697c-3f0b-11ed-9291-b8599f1d613a
4	854dc29c-3f0b-11ed-8ff3-7cd30abc95d8	86d336c9-3f0b-11ed-9291-b8599f1d613a
5	3f0b11ed-c29c-854d-8ff3-7cd30abc95d8	3f0b11ed-36c9-86d3-9291-b8599f1d613a
update test1 set c2=bin_to_uuid(uuid_to_bin('44cb3d42-3f0b-11ed-8ff3-7cd30abc95d8')),c3=bin_to_uuid(uuid_to_bin('10cb3d42-3f0b-11ed-8ff3-7cd30abc95d8'))
where c3=bin_to_uuid(uuid_to_bin('658517a8-3f0b-11ed-9291-b8599f1d613a'));
select * from test1 order by c1 asc;
c1	c2	c3
1	44cb3d42-3f0b-11ed-8ff3-7cd30abc95d8	10cb3d42-3f0b-11ed-8ff3-7cd30abc95d8
2	7945c0ae-3f0b-11ed-8ff3-7cd30abc95d8	7e915fff-3f0b-11ed-9291-b8599f1d613a
3	84cb3d42-3f0b-11ed-8ff3-7cd30abc95d8	867c697c-3f0b-11ed-9291-b8599f1d613a
4	854dc29c-3f0b-11ed-8ff3-7cd30abc95d8	86d336c9-3f0b-11ed-9291-b8599f1d613a
5	3f0b11ed-c29c-854d-8ff3-7cd30abc95d8	3f0b11ed-36c9-86d3-9291-b8599f1d613a
update test1 set c2=bin_to_uuid(uuid_to_bin('44cb3d42-3f0b-11ed-8ff3-7cd30abc95d8'),34),c3=bin_to_uuid(uuid_to_bin('10cb3d42-3f0b-11ed-8ff3-7cd30abc95d8'))
where c3=(select bin_to_uuid(uuid_to_bin('658517a8-3f0b-11ed-9291-b8599f1d613a')) from test1 LIMIT 1);
select * from test1 order by c1 asc;
c1	c2	c3
1	44cb3d42-3f0b-11ed-8ff3-7cd30abc95d8	10cb3d42-3f0b-11ed-8ff3-7cd30abc95d8
2	7945c0ae-3f0b-11ed-8ff3-7cd30abc95d8	7e915fff-3f0b-11ed-9291-b8599f1d613a
3	84cb3d42-3f0b-11ed-8ff3-7cd30abc95d8	867c697c-3f0b-11ed-9291-b8599f1d613a
4	854dc29c-3f0b-11ed-8ff3-7cd30abc95d8	86d336c9-3f0b-11ed-9291-b8599f1d613a
5	3f0b11ed-c29c-854d-8ff3-7cd30abc95d8	3f0b11ed-36c9-86d3-9291-b8599f1d613a
#function-5-4    delete语句
DELETE from test1 where c2=bin_to_uuid(uuid_to_bin('854dc29c-3f0b-11ed-8ff3-7cd30abc95d8'));
select * from test1 order by c1 asc;
c1	c2	c3
1	44cb3d42-3f0b-11ed-8ff3-7cd30abc95d8	10cb3d42-3f0b-11ed-8ff3-7cd30abc95d8
2	7945c0ae-3f0b-11ed-8ff3-7cd30abc95d8	7e915fff-3f0b-11ed-9291-b8599f1d613a
3	84cb3d42-3f0b-11ed-8ff3-7cd30abc95d8	867c697c-3f0b-11ed-9291-b8599f1d613a
5	3f0b11ed-c29c-854d-8ff3-7cd30abc95d8	3f0b11ed-36c9-86d3-9291-b8599f1d613a
DELETE from test1 where c2=(select * from (select c2 from test1 where c2=bin_to_uuid(uuid_to_bin('84cb3d42-3f0b-11ed-8ff3-7cd30abc95d8')))as a) ;
select * from test1 order by c1 asc;
c1	c2	c3
1	44cb3d42-3f0b-11ed-8ff3-7cd30abc95d8	10cb3d42-3f0b-11ed-8ff3-7cd30abc95d8
2	7945c0ae-3f0b-11ed-8ff3-7cd30abc95d8	7e915fff-3f0b-11ed-9291-b8599f1d613a
5	3f0b11ed-c29c-854d-8ff3-7cd30abc95d8	3f0b11ed-36c9-86d3-9291-b8599f1d613a
DELETE from test1 where c2=bin_to_uuid(uuid_to_bin('7945c0ae-3f0b-11ed-8ff3-7cd30abc95d8')) and c3=bin_to_uuid(uuid_to_bin('10CB3D423F0B11ED8FF37CD30ABC95D8'));
select * from test1 order by c1 asc;
c1	c2	c3
1	44cb3d42-3f0b-11ed-8ff3-7cd30abc95d8	10cb3d42-3f0b-11ed-8ff3-7cd30abc95d8
2	7945c0ae-3f0b-11ed-8ff3-7cd30abc95d8	7e915fff-3f0b-11ed-9291-b8599f1d613a
5	3f0b11ed-c29c-854d-8ff3-7cd30abc95d8	3f0b11ed-36c9-86d3-9291-b8599f1d613a
DELETE from test1 where c2=bin_to_uuid(uuid_to_bin('7945c0ae-3f0b-11ed-8ff3-7cd30abc95d8')) or c3=bin_to_uuid(uuid_to_bin('10CB3D423F0B11ED8FF37CD30ABC95D8'));
select * from test1 order by c1 asc;
c1	c2	c3
5	3f0b11ed-c29c-854d-8ff3-7cd30abc95d8	3f0b11ed-36c9-86d3-9291-b8599f1d613a
drop table test1;
#function-6    视图
#function-6     视图=====>insert+select
drop table test1;
drop view view_1;
create table test1(c1 bigint PRIMARY key AUTO_INCREMENT,c2 char(50),c3 varchar(50),
c4 TINYBLOB ,c5 TINYTEXT,c6 BLOB,c7 TEXT,c8 MEDIUMBLOB,c9 MEDIUMTEXT,c10 LONGBLOB,c11 LONGTEXT);
insert into test1(c2,c3,c4,c5,c6,c7,c8,c9,c10,c11) values(
bin_to_uuid(uuid_to_bin('5fd29c12-493f-11ed-9307-7cd30abc95d8')),
bin_to_uuid(uuid_to_bin('6fd29c12-493f-11ed-9307-7cd30abc95d8')),
bin_to_uuid(uuid_to_bin('7fd29c12-493f-11ed-9307-7cd30abc95d8')),
bin_to_uuid(uuid_to_bin('8fd29c12-493f-11ed-9307-7cd30abc95d8')),
bin_to_uuid(uuid_to_bin('9fd29c12-493f-11ed-9307-7cd30abc95d8')),
bin_to_uuid(uuid_to_bin('10d29c12-493f-11ed-9307-7cd30abc95d8')),
bin_to_uuid(uuid_to_bin('11d29c12-493f-11ed-9307-7cd30abc95d8')),
bin_to_uuid(uuid_to_bin('12d29c12-493f-11ed-9307-7cd30abc95d8')),
bin_to_uuid(uuid_to_bin('13d29c12-493f-11ed-9307-7cd30abc95d8')),
bin_to_uuid(uuid_to_bin('14d29c12-493f-11ed-9307-7cd30abc95d8'))
),
(
bin_to_uuid(uuid_to_bin('5fd29c12-493f-11ed-9307-7cd30abc95d8'),23),
bin_to_uuid(uuid_to_bin('6fd29c12-493f-11ed-9307-7cd30abc95d8'),4),
bin_to_uuid(uuid_to_bin('7fd29c12-493f-11ed-9307-7cd30abc95d8'),20.5),
bin_to_uuid(uuid_to_bin('8fd29c12-493f-11ed-9307-7cd30abc95d8'),2),
bin_to_uuid(uuid_to_bin('9fd29c12-493f-11ed-9307-7cd30abc95d8'),-25),
bin_to_uuid(uuid_to_bin('10d29c12-493f-11ed-9307-7cd30abc95d8'),53),
bin_to_uuid(uuid_to_bin('11d29c12-493f-11ed-9307-7cd30abc95d8'),34),
bin_to_uuid(uuid_to_bin('12d29c12-493f-11ed-9307-7cd30abc95d8'),24),
bin_to_uuid(uuid_to_bin('13d29c12-493f-11ed-9307-7cd30abc95d8'),0.7),
bin_to_uuid(uuid_to_bin('14d29c12-493f-11ed-9307-7cd30abc95d8'),0.9)
);
CREATE view view_1 as select * from test1;
select * from view_1;
c1	c2	c3	c4	c5	c6	c7	c8	c9	c10	c11
1	5fd29c12-493f-11ed-9307-7cd30abc95d8	6fd29c12-493f-11ed-9307-7cd30abc95d8	7fd29c12-493f-11ed-9307-7cd30abc95d8	8fd29c12-493f-11ed-9307-7cd30abc95d8	9fd29c12-493f-11ed-9307-7cd30abc95d8	10d29c12-493f-11ed-9307-7cd30abc95d8	11d29c12-493f-11ed-9307-7cd30abc95d8	12d29c12-493f-11ed-9307-7cd30abc95d8	13d29c12-493f-11ed-9307-7cd30abc95d8	14d29c12-493f-11ed-9307-7cd30abc95d8
2	493f11ed-9c12-5fd2-9307-7cd30abc95d8	493f11ed-9c12-6fd2-9307-7cd30abc95d8	493f11ed-9c12-7fd2-9307-7cd30abc95d8	493f11ed-9c12-8fd2-9307-7cd30abc95d8	493f11ed-9c12-9fd2-9307-7cd30abc95d8	493f11ed-9c12-10d2-9307-7cd30abc95d8	493f11ed-9c12-11d2-9307-7cd30abc95d8	493f11ed-9c12-12d2-9307-7cd30abc95d8	493f11ed-9c12-13d2-9307-7cd30abc95d8	493f11ed-9c12-14d2-9307-7cd30abc95d8
select * from view_1 where c4= bin_to_uuid(uuid_to_bin('7fd29c12-493f-11ed-9307-7cd30abc95d8'),20.5);
c1	c2	c3	c4	c5	c6	c7	c8	c9	c10	c11
2	493f11ed-9c12-5fd2-9307-7cd30abc95d8	493f11ed-9c12-6fd2-9307-7cd30abc95d8	493f11ed-9c12-7fd2-9307-7cd30abc95d8	493f11ed-9c12-8fd2-9307-7cd30abc95d8	493f11ed-9c12-9fd2-9307-7cd30abc95d8	493f11ed-9c12-10d2-9307-7cd30abc95d8	493f11ed-9c12-11d2-9307-7cd30abc95d8	493f11ed-9c12-12d2-9307-7cd30abc95d8	493f11ed-9c12-13d2-9307-7cd30abc95d8	493f11ed-9c12-14d2-9307-7cd30abc95d8
select * from view_1 where c11= bin_to_uuid(uuid_to_bin('14d29c12-493f-11ed-9307-7cd30abc95d8'),0.9);
c1	c2	c3	c4	c5	c6	c7	c8	c9	c10	c11
2	493f11ed-9c12-5fd2-9307-7cd30abc95d8	493f11ed-9c12-6fd2-9307-7cd30abc95d8	493f11ed-9c12-7fd2-9307-7cd30abc95d8	493f11ed-9c12-8fd2-9307-7cd30abc95d8	493f11ed-9c12-9fd2-9307-7cd30abc95d8	493f11ed-9c12-10d2-9307-7cd30abc95d8	493f11ed-9c12-11d2-9307-7cd30abc95d8	493f11ed-9c12-12d2-9307-7cd30abc95d8	493f11ed-9c12-13d2-9307-7cd30abc95d8	493f11ed-9c12-14d2-9307-7cd30abc95d8
select * from view_1 where c5= bin_to_uuid(uuid_to_bin('8fd29c12-493f-11ed-9307-7cd30abc95d8'),2) 
and c7=bin_to_uuid(uuid_to_bin('10d29c12-493f-11ed-9307-7cd30abc95d8'),53)
and c8=bin_to_uuid(uuid_to_bin('11d29c12-493f-11ed-9307-7cd30abc95d8'));
c1	c2	c3	c4	c5	c6	c7	c8	c9	c10	c11
select * from view_1 where c5= bin_to_uuid(uuid_to_bin('8fd29c12-493f-11ed-9307-7cd30abc95d8'),2) 
and c7=bin_to_uuid(uuid_to_bin('10d29c12-493f-11ed-9307-7cd30abc95d8'),53)
or c8=bin_to_uuid(uuid_to_bin('11d29c12-493f-11ed-9307-7cd30abc95d8'));
c1	c2	c3	c4	c5	c6	c7	c8	c9	c10	c11
1	5fd29c12-493f-11ed-9307-7cd30abc95d8	6fd29c12-493f-11ed-9307-7cd30abc95d8	7fd29c12-493f-11ed-9307-7cd30abc95d8	8fd29c12-493f-11ed-9307-7cd30abc95d8	9fd29c12-493f-11ed-9307-7cd30abc95d8	10d29c12-493f-11ed-9307-7cd30abc95d8	11d29c12-493f-11ed-9307-7cd30abc95d8	12d29c12-493f-11ed-9307-7cd30abc95d8	13d29c12-493f-11ed-9307-7cd30abc95d8	14d29c12-493f-11ed-9307-7cd30abc95d8
2	493f11ed-9c12-5fd2-9307-7cd30abc95d8	493f11ed-9c12-6fd2-9307-7cd30abc95d8	493f11ed-9c12-7fd2-9307-7cd30abc95d8	493f11ed-9c12-8fd2-9307-7cd30abc95d8	493f11ed-9c12-9fd2-9307-7cd30abc95d8	493f11ed-9c12-10d2-9307-7cd30abc95d8	493f11ed-9c12-11d2-9307-7cd30abc95d8	493f11ed-9c12-12d2-9307-7cd30abc95d8	493f11ed-9c12-13d2-9307-7cd30abc95d8	493f11ed-9c12-14d2-9307-7cd30abc95d8
select * from view_1 where c5= bin_to_uuid(uuid_to_bin('8fd29c12-493f-11ed-9307-7cd30abc95d8'),2) 
or c7=bin_to_uuid(uuid_to_bin('10d29c12-493f-11ed-9307-7cd30abc95d8'),53)
or c8=bin_to_uuid(uuid_to_bin('11d29c12-493f-11ed-9307-7cd30abc95d8'));
c1	c2	c3	c4	c5	c6	c7	c8	c9	c10	c11
1	5fd29c12-493f-11ed-9307-7cd30abc95d8	6fd29c12-493f-11ed-9307-7cd30abc95d8	7fd29c12-493f-11ed-9307-7cd30abc95d8	8fd29c12-493f-11ed-9307-7cd30abc95d8	9fd29c12-493f-11ed-9307-7cd30abc95d8	10d29c12-493f-11ed-9307-7cd30abc95d8	11d29c12-493f-11ed-9307-7cd30abc95d8	12d29c12-493f-11ed-9307-7cd30abc95d8	13d29c12-493f-11ed-9307-7cd30abc95d8	14d29c12-493f-11ed-9307-7cd30abc95d8
2	493f11ed-9c12-5fd2-9307-7cd30abc95d8	493f11ed-9c12-6fd2-9307-7cd30abc95d8	493f11ed-9c12-7fd2-9307-7cd30abc95d8	493f11ed-9c12-8fd2-9307-7cd30abc95d8	493f11ed-9c12-9fd2-9307-7cd30abc95d8	493f11ed-9c12-10d2-9307-7cd30abc95d8	493f11ed-9c12-11d2-9307-7cd30abc95d8	493f11ed-9c12-12d2-9307-7cd30abc95d8	493f11ed-9c12-13d2-9307-7cd30abc95d8	493f11ed-9c12-14d2-9307-7cd30abc95d8
select * from view_1 order by bin_to_uuid(uuid_to_bin('10d29c12-493f-11ed-9307-7cd30abc95d8')) asc;
c1	c2	c3	c4	c5	c6	c7	c8	c9	c10	c11
1	5fd29c12-493f-11ed-9307-7cd30abc95d8	6fd29c12-493f-11ed-9307-7cd30abc95d8	7fd29c12-493f-11ed-9307-7cd30abc95d8	8fd29c12-493f-11ed-9307-7cd30abc95d8	9fd29c12-493f-11ed-9307-7cd30abc95d8	10d29c12-493f-11ed-9307-7cd30abc95d8	11d29c12-493f-11ed-9307-7cd30abc95d8	12d29c12-493f-11ed-9307-7cd30abc95d8	13d29c12-493f-11ed-9307-7cd30abc95d8	14d29c12-493f-11ed-9307-7cd30abc95d8
2	493f11ed-9c12-5fd2-9307-7cd30abc95d8	493f11ed-9c12-6fd2-9307-7cd30abc95d8	493f11ed-9c12-7fd2-9307-7cd30abc95d8	493f11ed-9c12-8fd2-9307-7cd30abc95d8	493f11ed-9c12-9fd2-9307-7cd30abc95d8	493f11ed-9c12-10d2-9307-7cd30abc95d8	493f11ed-9c12-11d2-9307-7cd30abc95d8	493f11ed-9c12-12d2-9307-7cd30abc95d8	493f11ed-9c12-13d2-9307-7cd30abc95d8	493f11ed-9c12-14d2-9307-7cd30abc95d8
select * from view_1 order by bin_to_uuid(uuid_to_bin('10d29c12-493f-11ed-9307-7cd30abc95d8')) desc;
c1	c2	c3	c4	c5	c6	c7	c8	c9	c10	c11
1	5fd29c12-493f-11ed-9307-7cd30abc95d8	6fd29c12-493f-11ed-9307-7cd30abc95d8	7fd29c12-493f-11ed-9307-7cd30abc95d8	8fd29c12-493f-11ed-9307-7cd30abc95d8	9fd29c12-493f-11ed-9307-7cd30abc95d8	10d29c12-493f-11ed-9307-7cd30abc95d8	11d29c12-493f-11ed-9307-7cd30abc95d8	12d29c12-493f-11ed-9307-7cd30abc95d8	13d29c12-493f-11ed-9307-7cd30abc95d8	14d29c12-493f-11ed-9307-7cd30abc95d8
2	493f11ed-9c12-5fd2-9307-7cd30abc95d8	493f11ed-9c12-6fd2-9307-7cd30abc95d8	493f11ed-9c12-7fd2-9307-7cd30abc95d8	493f11ed-9c12-8fd2-9307-7cd30abc95d8	493f11ed-9c12-9fd2-9307-7cd30abc95d8	493f11ed-9c12-10d2-9307-7cd30abc95d8	493f11ed-9c12-11d2-9307-7cd30abc95d8	493f11ed-9c12-12d2-9307-7cd30abc95d8	493f11ed-9c12-13d2-9307-7cd30abc95d8	493f11ed-9c12-14d2-9307-7cd30abc95d8
select * from view_1 order by (select c2 from view_1 order by  bin_to_uuid(uuid_to_bin('10d29c12-493f-11ed-9307-7cd30abc95d8')) 
asc LIMIT 1) asc limit 1;
c1	c2	c3	c4	c5	c6	c7	c8	c9	c10	c11
1	5fd29c12-493f-11ed-9307-7cd30abc95d8	6fd29c12-493f-11ed-9307-7cd30abc95d8	7fd29c12-493f-11ed-9307-7cd30abc95d8	8fd29c12-493f-11ed-9307-7cd30abc95d8	9fd29c12-493f-11ed-9307-7cd30abc95d8	10d29c12-493f-11ed-9307-7cd30abc95d8	11d29c12-493f-11ed-9307-7cd30abc95d8	12d29c12-493f-11ed-9307-7cd30abc95d8	13d29c12-493f-11ed-9307-7cd30abc95d8	14d29c12-493f-11ed-9307-7cd30abc95d8
select * from view_1 group by bin_to_uuid(uuid_to_bin('11d29c12-493f-11ed-9307-7cd30abc95d8')) 
HAVING bin_to_uuid(uuid_to_bin('11d29c12-493f-11ed-9307-7cd30abc95d8'),34) order by c1 asc;
c1	c2	c3	c4	c5	c6	c7	c8	c9	c10	c11
1	5fd29c12-493f-11ed-9307-7cd30abc95d8	6fd29c12-493f-11ed-9307-7cd30abc95d8	7fd29c12-493f-11ed-9307-7cd30abc95d8	8fd29c12-493f-11ed-9307-7cd30abc95d8	9fd29c12-493f-11ed-9307-7cd30abc95d8	10d29c12-493f-11ed-9307-7cd30abc95d8	11d29c12-493f-11ed-9307-7cd30abc95d8	12d29c12-493f-11ed-9307-7cd30abc95d8	13d29c12-493f-11ed-9307-7cd30abc95d8	14d29c12-493f-11ed-9307-7cd30abc95d8
Warnings:
Warning	1292	Truncated incorrect DOUBLE value: '493f11ed-9c12-11d2-9307-7cd30abc95d8'
select * from view_1 group by bin_to_uuid(uuid_to_bin('11d29c12-493f-11ed-9307-7cd30abc95d8')) 
HAVING c8 order by c1 asc;
c1	c2	c3	c4	c5	c6	c7	c8	c9	c10	c11
1	5fd29c12-493f-11ed-9307-7cd30abc95d8	6fd29c12-493f-11ed-9307-7cd30abc95d8	7fd29c12-493f-11ed-9307-7cd30abc95d8	8fd29c12-493f-11ed-9307-7cd30abc95d8	9fd29c12-493f-11ed-9307-7cd30abc95d8	10d29c12-493f-11ed-9307-7cd30abc95d8	11d29c12-493f-11ed-9307-7cd30abc95d8	12d29c12-493f-11ed-9307-7cd30abc95d8	13d29c12-493f-11ed-9307-7cd30abc95d8	14d29c12-493f-11ed-9307-7cd30abc95d8
Warnings:
Warning	1292	Truncated incorrect DOUBLE value: '11d29c12-493f-11ed-9307-7cd30abc95d8'
select CASE c2 WHEN bin_to_uuid(uuid_to_bin('5fd29c12-493f-11ed-9307-7cd30abc95d8')) THEN '男'  WHEN 0 THEN 
bin_to_uuid(uuid_to_bin('5fd29c12-493f-11ed-9307-7cd30abc95d8'),23) ELSE '其他' END  from view_1 order by c2 asc;
CASE c2 WHEN bin_to_uuid(uuid_to_bin('5fd29c12-493f-11ed-9307-7cd30abc95d8')) THEN '男'  WHEN 0 THEN 
bin_to_uuid(uuid_to_bin('5fd29c12-493f-11ed-9307-7cd30abc95d8'),23) ELSE '其他' END
其他
男
Warnings:
Warning	1292	Truncated incorrect DECIMAL value: '493f11ed-9c12-5fd2-9307-7cd30abc95d8'
select CASE c4 WHEN bin_to_uuid(uuid_to_bin('7fd29c12-493f-11ed-9307-7cd30abc95d8'),20.5) THEN '男'  WHEN 0 THEN 
bin_to_uuid(uuid_to_bin('5fd29c12-493f-11ed-9307-7cd30abc95d8'),23) ELSE '其他' END  from view_1 order by c4 asc;
CASE c4 WHEN bin_to_uuid(uuid_to_bin('7fd29c12-493f-11ed-9307-7cd30abc95d8'),20.5) THEN '男'  WHEN 0 THEN 
bin_to_uuid(uuid_to_bin('5fd29c12-493f-11ed-9307-7cd30abc95d8'),23) ELSE '其他' END
男
其他
Warnings:
Warning	1292	Truncated incorrect DECIMAL value: '7fd29c12-493f-11ed-9307-7cd30abc95d8'
select * from view_1 where EXISTS(select c2 from view_1 where c2=bin_to_uuid(uuid_to_bin('5fd29c12-493f-11ed-9307-7cd30abc95d8'),23));
c1	c2	c3	c4	c5	c6	c7	c8	c9	c10	c11
1	5fd29c12-493f-11ed-9307-7cd30abc95d8	6fd29c12-493f-11ed-9307-7cd30abc95d8	7fd29c12-493f-11ed-9307-7cd30abc95d8	8fd29c12-493f-11ed-9307-7cd30abc95d8	9fd29c12-493f-11ed-9307-7cd30abc95d8	10d29c12-493f-11ed-9307-7cd30abc95d8	11d29c12-493f-11ed-9307-7cd30abc95d8	12d29c12-493f-11ed-9307-7cd30abc95d8	13d29c12-493f-11ed-9307-7cd30abc95d8	14d29c12-493f-11ed-9307-7cd30abc95d8
2	493f11ed-9c12-5fd2-9307-7cd30abc95d8	493f11ed-9c12-6fd2-9307-7cd30abc95d8	493f11ed-9c12-7fd2-9307-7cd30abc95d8	493f11ed-9c12-8fd2-9307-7cd30abc95d8	493f11ed-9c12-9fd2-9307-7cd30abc95d8	493f11ed-9c12-10d2-9307-7cd30abc95d8	493f11ed-9c12-11d2-9307-7cd30abc95d8	493f11ed-9c12-12d2-9307-7cd30abc95d8	493f11ed-9c12-13d2-9307-7cd30abc95d8	493f11ed-9c12-14d2-9307-7cd30abc95d8
select * from view_1 where not EXISTS(select c2 from view_1 where c2=bin_to_uuid(uuid_to_bin('5fd29c12-493f-11ed-9307-7cd30abc95d8'),23));
c1	c2	c3	c4	c5	c6	c7	c8	c9	c10	c11
select * from view_1 where c2 in(select c2 from view_1 where c2=bin_to_uuid(uuid_to_bin('5fd29c12-493f-11ed-9307-7cd30abc95d8'),23));
c1	c2	c3	c4	c5	c6	c7	c8	c9	c10	c11
2	493f11ed-9c12-5fd2-9307-7cd30abc95d8	493f11ed-9c12-6fd2-9307-7cd30abc95d8	493f11ed-9c12-7fd2-9307-7cd30abc95d8	493f11ed-9c12-8fd2-9307-7cd30abc95d8	493f11ed-9c12-9fd2-9307-7cd30abc95d8	493f11ed-9c12-10d2-9307-7cd30abc95d8	493f11ed-9c12-11d2-9307-7cd30abc95d8	493f11ed-9c12-12d2-9307-7cd30abc95d8	493f11ed-9c12-13d2-9307-7cd30abc95d8	493f11ed-9c12-14d2-9307-7cd30abc95d8
select * from view_1 where c2 not in(select c2 from view_1 where c2=bin_to_uuid(uuid_to_bin('5fd29c12-493f-11ed-9307-7cd30abc95d8'),23));
c1	c2	c3	c4	c5	c6	c7	c8	c9	c10	c11
1	5fd29c12-493f-11ed-9307-7cd30abc95d8	6fd29c12-493f-11ed-9307-7cd30abc95d8	7fd29c12-493f-11ed-9307-7cd30abc95d8	8fd29c12-493f-11ed-9307-7cd30abc95d8	9fd29c12-493f-11ed-9307-7cd30abc95d8	10d29c12-493f-11ed-9307-7cd30abc95d8	11d29c12-493f-11ed-9307-7cd30abc95d8	12d29c12-493f-11ed-9307-7cd30abc95d8	13d29c12-493f-11ed-9307-7cd30abc95d8	14d29c12-493f-11ed-9307-7cd30abc95d8
select * from view_1 where c2 =any(select c2 from view_1 where c2=bin_to_uuid(uuid_to_bin('5fd29c12-493f-11ed-9307-7cd30abc95d8'),23));
c1	c2	c3	c4	c5	c6	c7	c8	c9	c10	c11
2	493f11ed-9c12-5fd2-9307-7cd30abc95d8	493f11ed-9c12-6fd2-9307-7cd30abc95d8	493f11ed-9c12-7fd2-9307-7cd30abc95d8	493f11ed-9c12-8fd2-9307-7cd30abc95d8	493f11ed-9c12-9fd2-9307-7cd30abc95d8	493f11ed-9c12-10d2-9307-7cd30abc95d8	493f11ed-9c12-11d2-9307-7cd30abc95d8	493f11ed-9c12-12d2-9307-7cd30abc95d8	493f11ed-9c12-13d2-9307-7cd30abc95d8	493f11ed-9c12-14d2-9307-7cd30abc95d8
select * from view_1 where c2 >any(select c2 from view_1 where c2=bin_to_uuid(uuid_to_bin('5fd29c12-493f-11ed-9307-7cd30abc95d8'),23));
c1	c2	c3	c4	c5	c6	c7	c8	c9	c10	c11
1	5fd29c12-493f-11ed-9307-7cd30abc95d8	6fd29c12-493f-11ed-9307-7cd30abc95d8	7fd29c12-493f-11ed-9307-7cd30abc95d8	8fd29c12-493f-11ed-9307-7cd30abc95d8	9fd29c12-493f-11ed-9307-7cd30abc95d8	10d29c12-493f-11ed-9307-7cd30abc95d8	11d29c12-493f-11ed-9307-7cd30abc95d8	12d29c12-493f-11ed-9307-7cd30abc95d8	13d29c12-493f-11ed-9307-7cd30abc95d8	14d29c12-493f-11ed-9307-7cd30abc95d8
select * from view_1 where c2 <any(select c2 from view_1 where c2=bin_to_uuid(uuid_to_bin('5fd29c12-493f-11ed-9307-7cd30abc95d8'),23));
c1	c2	c3	c4	c5	c6	c7	c8	c9	c10	c11
select * from view_1 where c2 =all(select c2 from view_1 where c2=bin_to_uuid(uuid_to_bin('5fd29c12-493f-11ed-9307-7cd30abc95d8'),23));
c1	c2	c3	c4	c5	c6	c7	c8	c9	c10	c11
2	493f11ed-9c12-5fd2-9307-7cd30abc95d8	493f11ed-9c12-6fd2-9307-7cd30abc95d8	493f11ed-9c12-7fd2-9307-7cd30abc95d8	493f11ed-9c12-8fd2-9307-7cd30abc95d8	493f11ed-9c12-9fd2-9307-7cd30abc95d8	493f11ed-9c12-10d2-9307-7cd30abc95d8	493f11ed-9c12-11d2-9307-7cd30abc95d8	493f11ed-9c12-12d2-9307-7cd30abc95d8	493f11ed-9c12-13d2-9307-7cd30abc95d8	493f11ed-9c12-14d2-9307-7cd30abc95d8
select * from view_1 where c2 >all(select c2 from view_1 where c2=bin_to_uuid(uuid_to_bin('5fd29c12-493f-11ed-9307-7cd30abc95d8'),23));
c1	c2	c3	c4	c5	c6	c7	c8	c9	c10	c11
1	5fd29c12-493f-11ed-9307-7cd30abc95d8	6fd29c12-493f-11ed-9307-7cd30abc95d8	7fd29c12-493f-11ed-9307-7cd30abc95d8	8fd29c12-493f-11ed-9307-7cd30abc95d8	9fd29c12-493f-11ed-9307-7cd30abc95d8	10d29c12-493f-11ed-9307-7cd30abc95d8	11d29c12-493f-11ed-9307-7cd30abc95d8	12d29c12-493f-11ed-9307-7cd30abc95d8	13d29c12-493f-11ed-9307-7cd30abc95d8	14d29c12-493f-11ed-9307-7cd30abc95d8
select * from view_1 where c2 <all(select c2 from view_1 where c2=bin_to_uuid(uuid_to_bin('5fd29c12-493f-11ed-9307-7cd30abc95d8'),23));
c1	c2	c3	c4	c5	c6	c7	c8	c9	c10	c11
select c2 from view_1 where c2 like '%5%';
c2
5fd29c12-493f-11ed-9307-7cd30abc95d8
493f11ed-9c12-5fd2-9307-7cd30abc95d8
select c2 from view_1 where c2 like '%-%';
c2
5fd29c12-493f-11ed-9307-7cd30abc95d8
493f11ed-9c12-5fd2-9307-7cd30abc95d8
drop view view_1;
drop table test1;
create table test1(c1 int PRIMARY key AUTO_INCREMENT,c2 varchar(100),c3 varchar(100));
insert into test1(c2,c3) values(bin_to_uuid(uuid_to_bin('661be1c9-3f0b-11ed-8ff3-7cd30abc95d8')),bin_to_uuid(uuid_to_bin('658517a8-3f0b-11ed-9291-b8599f1d613a')));
insert into test1(c2,c3) values(bin_to_uuid(uuid_to_bin('7945c0ae-3f0b-11ed-8ff3-7cd30abc95d8')),bin_to_uuid(uuid_to_bin('7e915fff-3f0b-11ed-9291-b8599f1d613a')));
insert into test1(c2,c3) values(bin_to_uuid(uuid_to_bin('84cb3d42-3f0b-11ed-8ff3-7cd30abc95d8')),bin_to_uuid(uuid_to_bin('867c697c-3f0b-11ed-9291-b8599f1d613a')));
insert into test1(c2,c3) values(bin_to_uuid(uuid_to_bin('854dc29c-3f0b-11ed-8ff3-7cd30abc95d8')),bin_to_uuid(uuid_to_bin('86d336c9-3f0b-11ed-9291-b8599f1d613a')));
insert into test1(c2,c3) values(bin_to_uuid(uuid_to_bin('854dc29c-3f0b-11ed-8ff3-7cd30abc95d8'),22),bin_to_uuid(uuid_to_bin('86d336c9-3f0b-11ed-9291-b8599f1d613a'),-20));
create view view_1 as select * from test1;
select * from view_1 order by c1 asc;
c1	c2	c3
1	661be1c9-3f0b-11ed-8ff3-7cd30abc95d8	658517a8-3f0b-11ed-9291-b8599f1d613a
2	7945c0ae-3f0b-11ed-8ff3-7cd30abc95d8	7e915fff-3f0b-11ed-9291-b8599f1d613a
3	84cb3d42-3f0b-11ed-8ff3-7cd30abc95d8	867c697c-3f0b-11ed-9291-b8599f1d613a
4	854dc29c-3f0b-11ed-8ff3-7cd30abc95d8	86d336c9-3f0b-11ed-9291-b8599f1d613a
5	3f0b11ed-c29c-854d-8ff3-7cd30abc95d8	3f0b11ed-36c9-86d3-9291-b8599f1d613a
#function-6     视图=====>update
update view_1 set c2=bin_to_uuid(uuid_to_bin('99cb3d42-3f0b-11ed-8ff3-7cd30abc95d8'))+bin_to_uuid(uuid_to_bin('84cb3d42-3f0b-11ed-8ff3-7cd30abc95d8')) where
c3=bin_to_uuid(uuid_to_bin('658517a8-3f0b-11ed-9291-b8599f1d613a'));
Warnings:
Warning	1292	Truncated incorrect DOUBLE value: '99cb3d42-3f0b-11ed-8ff3-7cd30abc95d8'
Warning	1292	Truncated incorrect DOUBLE value: '84cb3d42-3f0b-11ed-8ff3-7cd30abc95d8'
select * from view_1 order by c1 asc;
c1	c2	c3
1	183	658517a8-3f0b-11ed-9291-b8599f1d613a
2	7945c0ae-3f0b-11ed-8ff3-7cd30abc95d8	7e915fff-3f0b-11ed-9291-b8599f1d613a
3	84cb3d42-3f0b-11ed-8ff3-7cd30abc95d8	867c697c-3f0b-11ed-9291-b8599f1d613a
4	854dc29c-3f0b-11ed-8ff3-7cd30abc95d8	86d336c9-3f0b-11ed-9291-b8599f1d613a
5	3f0b11ed-c29c-854d-8ff3-7cd30abc95d8	3f0b11ed-36c9-86d3-9291-b8599f1d613a
update view_1 set c2=bin_to_uuid(uuid_to_bin('66cb3d42-3f0b-11ed-8ff3-7cd30abc95d8'))-bin_to_uuid(uuid_to_bin('84cb3d42-3f0b-11ed-8ff3-7cd30abc95d8')) where
c3=bin_to_uuid(uuid_to_bin('658517a8-3f0b-11ed-9291-b8599f1d613a'));
Warnings:
Warning	1292	Truncated incorrect DOUBLE value: '66cb3d42-3f0b-11ed-8ff3-7cd30abc95d8'
Warning	1292	Truncated incorrect DOUBLE value: '84cb3d42-3f0b-11ed-8ff3-7cd30abc95d8'
select * from view_1 order by c1 asc;
c1	c2	c3
1	-18	658517a8-3f0b-11ed-9291-b8599f1d613a
2	7945c0ae-3f0b-11ed-8ff3-7cd30abc95d8	7e915fff-3f0b-11ed-9291-b8599f1d613a
3	84cb3d42-3f0b-11ed-8ff3-7cd30abc95d8	867c697c-3f0b-11ed-9291-b8599f1d613a
4	854dc29c-3f0b-11ed-8ff3-7cd30abc95d8	86d336c9-3f0b-11ed-9291-b8599f1d613a
5	3f0b11ed-c29c-854d-8ff3-7cd30abc95d8	3f0b11ed-36c9-86d3-9291-b8599f1d613a
update view_1 set c2=bin_to_uuid(uuid_to_bin('16cb3d42-3f0b-11ed-8ff3-7cd30abc95d8'))*bin_to_uuid(uuid_to_bin('84cb3d42-3f0b-11ed-8ff3-7cd30abc95d8')) where
c3=bin_to_uuid(uuid_to_bin('658517a8-3f0b-11ed-9291-b8599f1d613a'));
Warnings:
Warning	1292	Truncated incorrect DOUBLE value: '16cb3d42-3f0b-11ed-8ff3-7cd30abc95d8'
Warning	1292	Truncated incorrect DOUBLE value: '84cb3d42-3f0b-11ed-8ff3-7cd30abc95d8'
select * from view_1 order by c1 asc;
c1	c2	c3
1	1344	658517a8-3f0b-11ed-9291-b8599f1d613a
2	7945c0ae-3f0b-11ed-8ff3-7cd30abc95d8	7e915fff-3f0b-11ed-9291-b8599f1d613a
3	84cb3d42-3f0b-11ed-8ff3-7cd30abc95d8	867c697c-3f0b-11ed-9291-b8599f1d613a
4	854dc29c-3f0b-11ed-8ff3-7cd30abc95d8	86d336c9-3f0b-11ed-9291-b8599f1d613a
5	3f0b11ed-c29c-854d-8ff3-7cd30abc95d8	3f0b11ed-36c9-86d3-9291-b8599f1d613a
update view_1 set c2=bin_to_uuid(uuid_to_bin('99cb3d42-3f0b-11ed-8ff3-7cd30abc95d8'))/bin_to_uuid(uuid_to_bin('84cb3d42-3f0b-11ed-8ff3-7cd30abc95d8')) where
c3=bin_to_uuid(uuid_to_bin('658517a8-3f0b-11ed-9291-b8599f1d613a'));
Warnings:
Warning	1292	Truncated incorrect DOUBLE value: '99cb3d42-3f0b-11ed-8ff3-7cd30abc95d8'
Warning	1292	Truncated incorrect DOUBLE value: '84cb3d42-3f0b-11ed-8ff3-7cd30abc95d8'
select * from view_1 order by c1 asc;
c1	c2	c3
1	1.1785714285714286	658517a8-3f0b-11ed-9291-b8599f1d613a
2	7945c0ae-3f0b-11ed-8ff3-7cd30abc95d8	7e915fff-3f0b-11ed-9291-b8599f1d613a
3	84cb3d42-3f0b-11ed-8ff3-7cd30abc95d8	867c697c-3f0b-11ed-9291-b8599f1d613a
4	854dc29c-3f0b-11ed-8ff3-7cd30abc95d8	86d336c9-3f0b-11ed-9291-b8599f1d613a
5	3f0b11ed-c29c-854d-8ff3-7cd30abc95d8	3f0b11ed-36c9-86d3-9291-b8599f1d613a
update view_1 set c2=bin_to_uuid(uuid_to_bin('86cb3d42-3f0b-11ed-8ff3-7cd30abc95d8'))+5 where c3=bin_to_uuid(uuid_to_bin('658517a8-3f0b-11ed-9291-b8599f1d613a'));
Warnings:
Warning	1292	Truncated incorrect DOUBLE value: '86cb3d42-3f0b-11ed-8ff3-7cd30abc95d8'
select * from view_1 order by c1 asc;
c1	c2	c3
1	91	658517a8-3f0b-11ed-9291-b8599f1d613a
2	7945c0ae-3f0b-11ed-8ff3-7cd30abc95d8	7e915fff-3f0b-11ed-9291-b8599f1d613a
3	84cb3d42-3f0b-11ed-8ff3-7cd30abc95d8	867c697c-3f0b-11ed-9291-b8599f1d613a
4	854dc29c-3f0b-11ed-8ff3-7cd30abc95d8	86d336c9-3f0b-11ed-9291-b8599f1d613a
5	3f0b11ed-c29c-854d-8ff3-7cd30abc95d8	3f0b11ed-36c9-86d3-9291-b8599f1d613a
update view_1 set c2=bin_to_uuid(uuid_to_bin('44cb3d42-3f0b-11ed-8ff3-7cd30abc95d8')),c3=bin_to_uuid(uuid_to_bin('10cb3d42-3f0b-11ed-8ff3-7cd30abc95d8'))
where c3=bin_to_uuid(uuid_to_bin('658517a8-3f0b-11ed-9291-b8599f1d613a'));
select * from view_1 order by c1 asc;
c1	c2	c3
1	44cb3d42-3f0b-11ed-8ff3-7cd30abc95d8	10cb3d42-3f0b-11ed-8ff3-7cd30abc95d8
2	7945c0ae-3f0b-11ed-8ff3-7cd30abc95d8	7e915fff-3f0b-11ed-9291-b8599f1d613a
3	84cb3d42-3f0b-11ed-8ff3-7cd30abc95d8	867c697c-3f0b-11ed-9291-b8599f1d613a
4	854dc29c-3f0b-11ed-8ff3-7cd30abc95d8	86d336c9-3f0b-11ed-9291-b8599f1d613a
5	3f0b11ed-c29c-854d-8ff3-7cd30abc95d8	3f0b11ed-36c9-86d3-9291-b8599f1d613a
update view_1 set c2=bin_to_uuid(uuid_to_bin('44cb3d42-3f0b-11ed-8ff3-7cd30abc95d8'),34),c3=bin_to_uuid(uuid_to_bin('10cb3d42-3f0b-11ed-8ff3-7cd30abc95d8'))
where c3=(select bin_to_uuid(uuid_to_bin('658517a8-3f0b-11ed-9291-b8599f1d613a')) from view_1 LIMIT 1);
select * from view_1 order by c1 asc;
c1	c2	c3
1	44cb3d42-3f0b-11ed-8ff3-7cd30abc95d8	10cb3d42-3f0b-11ed-8ff3-7cd30abc95d8
2	7945c0ae-3f0b-11ed-8ff3-7cd30abc95d8	7e915fff-3f0b-11ed-9291-b8599f1d613a
3	84cb3d42-3f0b-11ed-8ff3-7cd30abc95d8	867c697c-3f0b-11ed-9291-b8599f1d613a
4	854dc29c-3f0b-11ed-8ff3-7cd30abc95d8	86d336c9-3f0b-11ed-9291-b8599f1d613a
5	3f0b11ed-c29c-854d-8ff3-7cd30abc95d8	3f0b11ed-36c9-86d3-9291-b8599f1d613a
#function-6     视图=====>delete
DELETE from view_1 where c2=bin_to_uuid(uuid_to_bin('854dc29c-3f0b-11ed-8ff3-7cd30abc95d8'));
select * from view_1 order by c1 asc;
c1	c2	c3
1	44cb3d42-3f0b-11ed-8ff3-7cd30abc95d8	10cb3d42-3f0b-11ed-8ff3-7cd30abc95d8
2	7945c0ae-3f0b-11ed-8ff3-7cd30abc95d8	7e915fff-3f0b-11ed-9291-b8599f1d613a
3	84cb3d42-3f0b-11ed-8ff3-7cd30abc95d8	867c697c-3f0b-11ed-9291-b8599f1d613a
5	3f0b11ed-c29c-854d-8ff3-7cd30abc95d8	3f0b11ed-36c9-86d3-9291-b8599f1d613a
DELETE from view_1 where c2=(select * from (select c2 from view_1 where c2=bin_to_uuid(uuid_to_bin('84cb3d42-3f0b-11ed-8ff3-7cd30abc95d8')))as a) ;
select * from view_1 order by c1 asc;
c1	c2	c3
1	44cb3d42-3f0b-11ed-8ff3-7cd30abc95d8	10cb3d42-3f0b-11ed-8ff3-7cd30abc95d8
2	7945c0ae-3f0b-11ed-8ff3-7cd30abc95d8	7e915fff-3f0b-11ed-9291-b8599f1d613a
5	3f0b11ed-c29c-854d-8ff3-7cd30abc95d8	3f0b11ed-36c9-86d3-9291-b8599f1d613a
DELETE from view_1 where c2=bin_to_uuid(uuid_to_bin('7945c0ae-3f0b-11ed-8ff3-7cd30abc95d8')) and c3=bin_to_uuid(uuid_to_bin('10CB3D423F0B11ED8FF37CD30ABC95D8'));
select * from view_1 order by c1 asc;
c1	c2	c3
1	44cb3d42-3f0b-11ed-8ff3-7cd30abc95d8	10cb3d42-3f0b-11ed-8ff3-7cd30abc95d8
2	7945c0ae-3f0b-11ed-8ff3-7cd30abc95d8	7e915fff-3f0b-11ed-9291-b8599f1d613a
5	3f0b11ed-c29c-854d-8ff3-7cd30abc95d8	3f0b11ed-36c9-86d3-9291-b8599f1d613a
DELETE from view_1 where c2=bin_to_uuid(uuid_to_bin('7945c0ae-3f0b-11ed-8ff3-7cd30abc95d8')) or c3=bin_to_uuid(uuid_to_bin('10CB3D423F0B11ED8FF37CD30ABC95D8'));
select * from view_1 order by c1 asc;
c1	c2	c3
5	3f0b11ed-c29c-854d-8ff3-7cd30abc95d8	3f0b11ed-36c9-86d3-9291-b8599f1d613a
drop view view_1;
drop table test1;
#function-7     索引=====>唯一索引
drop table test1;
create table test1(c1 int PRIMARY key AUTO_INCREMENT,c2 varchar(100),c3 varchar(100));
insert into test1(c2,c3) values(bin_to_uuid(uuid_to_bin('661be1c9-3f0b-11ed-8ff3-7cd30abc95d8')),bin_to_uuid(uuid_to_bin('658517a8-3f0b-11ed-9291-b8599f1d613a')));
insert into test1(c2,c3) values(bin_to_uuid(uuid_to_bin('7945c0ae-3f0b-11ed-8ff3-7cd30abc95d8'),35),bin_to_uuid(uuid_to_bin('7e915fff-3f0b-11ed-9291-b8599f1d613a')));
insert into test1(c2,c3) values(bin_to_uuid(uuid_to_bin('84cb3d42-3f0b-11ed-8ff3-7cd30abc95d8')),bin_to_uuid(uuid_to_bin('867c697c-3f0b-11ed-9291-b8599f1d613a'),-21));
insert into test1(c2,c3) values(bin_to_uuid(uuid_to_bin('854dc29c-3f0b-11ed-8ff3-7cd30abc95d8'),null),bin_to_uuid(uuid_to_bin('86d336c9-3f0b-11ed-9291-b8599f1d613a')));
select * from test1 order by c1 asc;
c1	c2	c3
1	661be1c9-3f0b-11ed-8ff3-7cd30abc95d8	658517a8-3f0b-11ed-9291-b8599f1d613a
2	3f0b11ed-c0ae-7945-8ff3-7cd30abc95d8	7e915fff-3f0b-11ed-9291-b8599f1d613a
3	84cb3d42-3f0b-11ed-8ff3-7cd30abc95d8	3f0b11ed-697c-867c-9291-b8599f1d613a
4	854dc29c-3f0b-11ed-8ff3-7cd30abc95d8	86d336c9-3f0b-11ed-9291-b8599f1d613a
create UNIQUE index index_1 on test1(c2);
insert into test1(c2,c3) values(bin_to_uuid(uuid_to_bin('854dc29c-3f0b-11ed-8ff3-7cd30abc95d8')),bin_to_uuid(uuid_to_bin('86d336c9-3f0b-11ed-9291-b8599f1d613a')));
insert into test1(c2,c3) select c2,c3 from test1;
insert into test1(c2,c3) values(bin_to_uuid(uuid_to_bin('84cb3d43-3f0b-11ed-8ff3-7cd30abc95d8')),bin_to_uuid(uuid_to_bin('867c699c-3f0b-11ed-9291-b8599f1d613a')));
select c2,c3 from test1 order by c2 asc;
c2	c3
3f0b11ed-c0ae-7945-8ff3-7cd30abc95d8	7e915fff-3f0b-11ed-9291-b8599f1d613a
661be1c9-3f0b-11ed-8ff3-7cd30abc95d8	658517a8-3f0b-11ed-9291-b8599f1d613a
84cb3d42-3f0b-11ed-8ff3-7cd30abc95d8	3f0b11ed-697c-867c-9291-b8599f1d613a
84cb3d43-3f0b-11ed-8ff3-7cd30abc95d8	867c699c-3f0b-11ed-9291-b8599f1d613a
854dc29c-3f0b-11ed-8ff3-7cd30abc95d8	86d336c9-3f0b-11ed-9291-b8599f1d613a
update test1 set c2=bin_to_uuid(uuid_to_bin('7945c0ae-3f0b-11ed-8ff3-7cd30abc95d8')) where c3=bin_to_uuid(uuid_to_bin('7e915fff-3f0b-11ed-9291-b8599f1d613a'));
select c2,c3 from test1 order by c2 asc;
c2	c3
661be1c9-3f0b-11ed-8ff3-7cd30abc95d8	658517a8-3f0b-11ed-9291-b8599f1d613a
7945c0ae-3f0b-11ed-8ff3-7cd30abc95d8	7e915fff-3f0b-11ed-9291-b8599f1d613a
84cb3d42-3f0b-11ed-8ff3-7cd30abc95d8	3f0b11ed-697c-867c-9291-b8599f1d613a
84cb3d43-3f0b-11ed-8ff3-7cd30abc95d8	867c699c-3f0b-11ed-9291-b8599f1d613a
854dc29c-3f0b-11ed-8ff3-7cd30abc95d8	86d336c9-3f0b-11ed-9291-b8599f1d613a
update test1 set c2=bin_to_uuid(uuid_to_bin('7945c0ae-3f0b-11ed-8ff3-7cd30abc95d8')) where c2=bin_to_uuid(uuid_to_bin('854dc29c-3f0b-11ed-8ff3-7cd30abc95d8'));
update test1 set c2=(select c2 from test1 where c2=bin_to_uuid(uuid_to_bin('7945c0ae-3f0b-11ed-8ff3-7cd30abc95d8'))) where c2=bin_to_uuid(uuid_to_bin('854dc29c-3f0b-11ed-8ff3-7cd30abc95d8'));
drop table test1;
#function-7     索引=====>复合索引
drop table test1;
create table test1(c1 int PRIMARY key AUTO_INCREMENT,c2 varchar(100),c3 varchar(100));
insert into test1(c2,c3) values(bin_to_uuid(uuid_to_bin('661be1c9-3f0b-11ed-8ff3-7cd30abc95d8')),bin_to_uuid(uuid_to_bin('658517a8-3f0b-11ed-9291-b8599f1d613a')));
insert into test1(c2,c3) values(bin_to_uuid(uuid_to_bin('7945c0ae-3f0b-11ed-8ff3-7cd30abc95d8'),null),bin_to_uuid(uuid_to_bin('7e915fff-3f0b-11ed-9291-b8599f1d613a')));
insert into test1(c2,c3) values(bin_to_uuid(uuid_to_bin('84cb3d42-3f0b-11ed-8ff3-7cd30abc95d8'),-3),bin_to_uuid(uuid_to_bin('867c697c-3f0b-11ed-9291-b8599f1d613a')));
insert into test1(c2,c3) values(bin_to_uuid(uuid_to_bin('854dc29c-3f0b-11ed-8ff3-7cd30abc95d8'),5.1),bin_to_uuid(uuid_to_bin('86d336c9-3f0b-11ed-9291-b8599f1d613a')));
select * from test1 order by c1 asc;
c1	c2	c3
1	661be1c9-3f0b-11ed-8ff3-7cd30abc95d8	658517a8-3f0b-11ed-9291-b8599f1d613a
2	7945c0ae-3f0b-11ed-8ff3-7cd30abc95d8	7e915fff-3f0b-11ed-9291-b8599f1d613a
3	3f0b11ed-3d42-84cb-8ff3-7cd30abc95d8	867c697c-3f0b-11ed-9291-b8599f1d613a
4	3f0b11ed-c29c-854d-8ff3-7cd30abc95d8	86d336c9-3f0b-11ed-9291-b8599f1d613a
create index index_1 on test1(c2,c3);
insert into test1(c2,c3) values(bin_to_uuid(uuid_to_bin('854dc29c-3f0b-11ed-8ff3-7cd30abc95d8')),bin_to_uuid(uuid_to_bin('86d336c9-3f0b-11ed-9291-b8599f1d613a')));
insert into test1(c2,c3) select c2,c3 from test1;
insert into test1(c2,c3) values(bin_to_uuid(uuid_to_bin('84cb3d43-3f0b-11ed-8ff3-7cd30abc95d8')),bin_to_uuid(uuid_to_bin('867c699c-3f0b-11ed-9291-b8599f1d613a')));
select c2,c3 from test1 order by c2 asc;
c2	c3
3f0b11ed-3d42-84cb-8ff3-7cd30abc95d8	867c697c-3f0b-11ed-9291-b8599f1d613a
3f0b11ed-3d42-84cb-8ff3-7cd30abc95d8	867c697c-3f0b-11ed-9291-b8599f1d613a
3f0b11ed-c29c-854d-8ff3-7cd30abc95d8	86d336c9-3f0b-11ed-9291-b8599f1d613a
3f0b11ed-c29c-854d-8ff3-7cd30abc95d8	86d336c9-3f0b-11ed-9291-b8599f1d613a
661be1c9-3f0b-11ed-8ff3-7cd30abc95d8	658517a8-3f0b-11ed-9291-b8599f1d613a
661be1c9-3f0b-11ed-8ff3-7cd30abc95d8	658517a8-3f0b-11ed-9291-b8599f1d613a
7945c0ae-3f0b-11ed-8ff3-7cd30abc95d8	7e915fff-3f0b-11ed-9291-b8599f1d613a
7945c0ae-3f0b-11ed-8ff3-7cd30abc95d8	7e915fff-3f0b-11ed-9291-b8599f1d613a
84cb3d43-3f0b-11ed-8ff3-7cd30abc95d8	867c699c-3f0b-11ed-9291-b8599f1d613a
854dc29c-3f0b-11ed-8ff3-7cd30abc95d8	86d336c9-3f0b-11ed-9291-b8599f1d613a
854dc29c-3f0b-11ed-8ff3-7cd30abc95d8	86d336c9-3f0b-11ed-9291-b8599f1d613a
update test1 set c2=bin_to_uuid(uuid_to_bin('7945c0ae-3f0b-11ed-8ff3-7cd30abc95d8')) where c3=bin_to_uuid(uuid_to_bin('7e915fff-3f0b-11ed-9291-b8599f1d613a'));
select c2,c3 from test1 order by c2 asc;
c2	c3
3f0b11ed-3d42-84cb-8ff3-7cd30abc95d8	867c697c-3f0b-11ed-9291-b8599f1d613a
3f0b11ed-3d42-84cb-8ff3-7cd30abc95d8	867c697c-3f0b-11ed-9291-b8599f1d613a
3f0b11ed-c29c-854d-8ff3-7cd30abc95d8	86d336c9-3f0b-11ed-9291-b8599f1d613a
3f0b11ed-c29c-854d-8ff3-7cd30abc95d8	86d336c9-3f0b-11ed-9291-b8599f1d613a
661be1c9-3f0b-11ed-8ff3-7cd30abc95d8	658517a8-3f0b-11ed-9291-b8599f1d613a
661be1c9-3f0b-11ed-8ff3-7cd30abc95d8	658517a8-3f0b-11ed-9291-b8599f1d613a
7945c0ae-3f0b-11ed-8ff3-7cd30abc95d8	7e915fff-3f0b-11ed-9291-b8599f1d613a
7945c0ae-3f0b-11ed-8ff3-7cd30abc95d8	7e915fff-3f0b-11ed-9291-b8599f1d613a
84cb3d43-3f0b-11ed-8ff3-7cd30abc95d8	867c699c-3f0b-11ed-9291-b8599f1d613a
854dc29c-3f0b-11ed-8ff3-7cd30abc95d8	86d336c9-3f0b-11ed-9291-b8599f1d613a
854dc29c-3f0b-11ed-8ff3-7cd30abc95d8	86d336c9-3f0b-11ed-9291-b8599f1d613a
update test1 set c2=bin_to_uuid(uuid_to_bin('7945c0ae-3f0b-11ed-8ff3-7cd30abc95d8')) where c2=bin_to_uuid(uuid_to_bin('854dc29c-3f0b-11ed-8ff3-7cd30abc95d8'));
select c2,c3 from test1 order by c2 asc;
c2	c3
3f0b11ed-3d42-84cb-8ff3-7cd30abc95d8	867c697c-3f0b-11ed-9291-b8599f1d613a
3f0b11ed-3d42-84cb-8ff3-7cd30abc95d8	867c697c-3f0b-11ed-9291-b8599f1d613a
3f0b11ed-c29c-854d-8ff3-7cd30abc95d8	86d336c9-3f0b-11ed-9291-b8599f1d613a
3f0b11ed-c29c-854d-8ff3-7cd30abc95d8	86d336c9-3f0b-11ed-9291-b8599f1d613a
661be1c9-3f0b-11ed-8ff3-7cd30abc95d8	658517a8-3f0b-11ed-9291-b8599f1d613a
661be1c9-3f0b-11ed-8ff3-7cd30abc95d8	658517a8-3f0b-11ed-9291-b8599f1d613a
7945c0ae-3f0b-11ed-8ff3-7cd30abc95d8	7e915fff-3f0b-11ed-9291-b8599f1d613a
7945c0ae-3f0b-11ed-8ff3-7cd30abc95d8	7e915fff-3f0b-11ed-9291-b8599f1d613a
7945c0ae-3f0b-11ed-8ff3-7cd30abc95d8	86d336c9-3f0b-11ed-9291-b8599f1d613a
7945c0ae-3f0b-11ed-8ff3-7cd30abc95d8	86d336c9-3f0b-11ed-9291-b8599f1d613a
84cb3d43-3f0b-11ed-8ff3-7cd30abc95d8	867c699c-3f0b-11ed-9291-b8599f1d613a
update test1 set c2=(select c2 from test1 where c2=bin_to_uuid(uuid_to_bin('7945c0ae-3f0b-11ed-8ff3-7cd30abc95d8'))) where c2=bin_to_uuid(uuid_to_bin('854dc29c-3f0b-11ed-8ff3-7cd30abc95d8'));
update test1 set c2=bin_to_uuid(uuid_to_bin('7945c0ae-3f0b-11ed-8ff3-7cd30abc95d8')),c3=bin_to_uuid(uuid_to_bin('7e915fff-3f0b-11ed-9291-b8599f1d613a')) where c2=bin_to_uuid(uuid_to_bin('854dc29c-3f0b-11ed-8ff3-7cd30abc95d8'));
select c2,c3 from test1 order by c2 asc;
c2	c3
3f0b11ed-3d42-84cb-8ff3-7cd30abc95d8	867c697c-3f0b-11ed-9291-b8599f1d613a
3f0b11ed-3d42-84cb-8ff3-7cd30abc95d8	867c697c-3f0b-11ed-9291-b8599f1d613a
3f0b11ed-c29c-854d-8ff3-7cd30abc95d8	86d336c9-3f0b-11ed-9291-b8599f1d613a
3f0b11ed-c29c-854d-8ff3-7cd30abc95d8	86d336c9-3f0b-11ed-9291-b8599f1d613a
661be1c9-3f0b-11ed-8ff3-7cd30abc95d8	658517a8-3f0b-11ed-9291-b8599f1d613a
661be1c9-3f0b-11ed-8ff3-7cd30abc95d8	658517a8-3f0b-11ed-9291-b8599f1d613a
7945c0ae-3f0b-11ed-8ff3-7cd30abc95d8	7e915fff-3f0b-11ed-9291-b8599f1d613a
7945c0ae-3f0b-11ed-8ff3-7cd30abc95d8	7e915fff-3f0b-11ed-9291-b8599f1d613a
7945c0ae-3f0b-11ed-8ff3-7cd30abc95d8	86d336c9-3f0b-11ed-9291-b8599f1d613a
7945c0ae-3f0b-11ed-8ff3-7cd30abc95d8	86d336c9-3f0b-11ed-9291-b8599f1d613a
84cb3d43-3f0b-11ed-8ff3-7cd30abc95d8	867c699c-3f0b-11ed-9291-b8599f1d613a
drop table test1;
#function-7     索引=====>普通索引
drop table test1;
create table test1(c1 int PRIMARY key AUTO_INCREMENT,c2 varchar(100),c3 varchar(100));
insert into test1(c2,c3) values(bin_to_uuid(uuid_to_bin('661be1c9-3f0b-11ed-8ff3-7cd30abc95d8')),bin_to_uuid(uuid_to_bin('658517a8-3f0b-11ed-9291-b8599f1d613a')));
insert into test1(c2,c3) values(bin_to_uuid(uuid_to_bin('7945c0ae-3f0b-11ed-8ff3-7cd30abc95d8'),null),bin_to_uuid(uuid_to_bin('7e915fff-3f0b-11ed-9291-b8599f1d613a')));
insert into test1(c2,c3) values(bin_to_uuid(uuid_to_bin('84cb3d42-3f0b-11ed-8ff3-7cd30abc95d8'),3.0),bin_to_uuid(uuid_to_bin('867c697c-3f0b-11ed-9291-b8599f1d613a')));
insert into test1(c2,c3) values(bin_to_uuid(uuid_to_bin('854dc29c-3f0b-11ed-8ff3-7cd30abc95d8'),-null),bin_to_uuid(uuid_to_bin('86d336c9-3f0b-11ed-9291-b8599f1d613a')));
select * from test1 order by c1 asc;
c1	c2	c3
1	661be1c9-3f0b-11ed-8ff3-7cd30abc95d8	658517a8-3f0b-11ed-9291-b8599f1d613a
2	7945c0ae-3f0b-11ed-8ff3-7cd30abc95d8	7e915fff-3f0b-11ed-9291-b8599f1d613a
3	3f0b11ed-3d42-84cb-8ff3-7cd30abc95d8	867c697c-3f0b-11ed-9291-b8599f1d613a
4	854dc29c-3f0b-11ed-8ff3-7cd30abc95d8	86d336c9-3f0b-11ed-9291-b8599f1d613a
create index index_1 on test1(c2);
insert into test1(c2,c3) values(bin_to_uuid(uuid_to_bin('854dc29c-3f0b-11ed-8ff3-7cd30abc95d8')),bin_to_uuid(uuid_to_bin('86d336c9-3f0b-11ed-9291-b8599f1d613a')));
insert into test1(c2,c3) select c2,c3 from test1;
insert into test1(c2,c3) values(bin_to_uuid(uuid_to_bin('84cb3d43-3f0b-11ed-8ff3-7cd30abc95d8')),bin_to_uuid(uuid_to_bin('867c699c-3f0b-11ed-9291-b8599f1d613a')));
select c2,c3 from test1 order by c2 asc;
c2	c3
3f0b11ed-3d42-84cb-8ff3-7cd30abc95d8	867c697c-3f0b-11ed-9291-b8599f1d613a
3f0b11ed-3d42-84cb-8ff3-7cd30abc95d8	867c697c-3f0b-11ed-9291-b8599f1d613a
661be1c9-3f0b-11ed-8ff3-7cd30abc95d8	658517a8-3f0b-11ed-9291-b8599f1d613a
661be1c9-3f0b-11ed-8ff3-7cd30abc95d8	658517a8-3f0b-11ed-9291-b8599f1d613a
7945c0ae-3f0b-11ed-8ff3-7cd30abc95d8	7e915fff-3f0b-11ed-9291-b8599f1d613a
7945c0ae-3f0b-11ed-8ff3-7cd30abc95d8	7e915fff-3f0b-11ed-9291-b8599f1d613a
84cb3d43-3f0b-11ed-8ff3-7cd30abc95d8	867c699c-3f0b-11ed-9291-b8599f1d613a
854dc29c-3f0b-11ed-8ff3-7cd30abc95d8	86d336c9-3f0b-11ed-9291-b8599f1d613a
854dc29c-3f0b-11ed-8ff3-7cd30abc95d8	86d336c9-3f0b-11ed-9291-b8599f1d613a
854dc29c-3f0b-11ed-8ff3-7cd30abc95d8	86d336c9-3f0b-11ed-9291-b8599f1d613a
854dc29c-3f0b-11ed-8ff3-7cd30abc95d8	86d336c9-3f0b-11ed-9291-b8599f1d613a
update test1 set c2=bin_to_uuid(uuid_to_bin('7945c0ae-3f0b-11ed-8ff3-7cd30abc95d8')) where c3=bin_to_uuid(uuid_to_bin('7e915fff-3f0b-11ed-9291-b8599f1d613a'));
select c2,c3 from test1 order by c2 asc;
c2	c3
3f0b11ed-3d42-84cb-8ff3-7cd30abc95d8	867c697c-3f0b-11ed-9291-b8599f1d613a
3f0b11ed-3d42-84cb-8ff3-7cd30abc95d8	867c697c-3f0b-11ed-9291-b8599f1d613a
661be1c9-3f0b-11ed-8ff3-7cd30abc95d8	658517a8-3f0b-11ed-9291-b8599f1d613a
661be1c9-3f0b-11ed-8ff3-7cd30abc95d8	658517a8-3f0b-11ed-9291-b8599f1d613a
7945c0ae-3f0b-11ed-8ff3-7cd30abc95d8	7e915fff-3f0b-11ed-9291-b8599f1d613a
7945c0ae-3f0b-11ed-8ff3-7cd30abc95d8	7e915fff-3f0b-11ed-9291-b8599f1d613a
84cb3d43-3f0b-11ed-8ff3-7cd30abc95d8	867c699c-3f0b-11ed-9291-b8599f1d613a
854dc29c-3f0b-11ed-8ff3-7cd30abc95d8	86d336c9-3f0b-11ed-9291-b8599f1d613a
854dc29c-3f0b-11ed-8ff3-7cd30abc95d8	86d336c9-3f0b-11ed-9291-b8599f1d613a
854dc29c-3f0b-11ed-8ff3-7cd30abc95d8	86d336c9-3f0b-11ed-9291-b8599f1d613a
854dc29c-3f0b-11ed-8ff3-7cd30abc95d8	86d336c9-3f0b-11ed-9291-b8599f1d613a
update test1 set c2=bin_to_uuid(uuid_to_bin('7945c0ae-3f0b-11ed-8ff3-7cd30abc95d8')) where c2=bin_to_uuid(uuid_to_bin('854dc29c-3f0b-11ed-8ff3-7cd30abc95d8'));
update test1 set c2=(select c2 from test1 where c2=bin_to_uuid(uuid_to_bin('7945c0ae-3f0b-11ed-8ff3-7cd30abc95d8')) LIMIT 1) where c2=bin_to_uuid(uuid_to_bin('854dc29c-3f0b-11ed-8ff3-7cd30abc95d8')) LIMIT 1;
drop table test1;
# Clean up users
drop user hjw@'%' ;
