alter system set _ob_enable_prepared_statement = true;
set ob_enable_index_direct_select=1;
alter system set merger_check_interval = '10s' tenant sys;
alter system set merger_check_interval = '10s' tenant all_user;
alter system set merger_check_interval = '10s' tenant all_meta;
drop table if exists test,test2,test3;
create table test(a varchar(4096) primary key);
create table test2(a varchar(262145) primary key);
ERROR 42000: Column length too big for column 'a' (max = 262144)
create table test2(a int primary key,b varchar(16384) );
create index idx on test2(b);
ERROR 42000: Specified key was too long; max key length is 16384 bytes
alter system major freeze tenant = sys;
alter system major freeze tenant = all_user;
alter system major freeze tenant = all_meta;
insert into  test2 values(1,'1') ;
insert into  test2 values(2,'2') ;
insert into  test2 values(3,'3') ;
insert into  test2 values(4,'4') ;
insert into  test2 values(5,'5') ;
insert into  test2 values(6,'6') ;
insert into  test2 values(7,'7') ;
insert into  test2 values(8,'8') ;
insert into  test2 values(9,'9') ;
insert into  test2 values(10,'0') ;
length(b)
401
length(b)
801
length(b)
1201
length(b)
1601
length(b)
2001
length(b)
2401
length(b)
2801
length(b)
3201
length(b)
3601
length(b)
4001
length(b)
4401
length(b)
4801
length(b)
5201
length(b)
5601
length(b)
6001
length(b)
6401
length(b)
6801
length(b)
7201
length(b)
7601
length(b)
8001
length(b)
8401
length(b)
8801
length(b)
9201
length(b)
9601
length(b)
10001
length(b)
10401
length(b)
10801
length(b)
11201
length(b)
11601
length(b)
12001
length(b)
12401
length(b)
12801
length(b)
13201
length(b)
13601
length(b)
14001
length(b)
14401
length(b)
14801
length(b)
15201
length(b)
15601
length(b)
16001
update test2 set b=concat(b,'abcdefghijk123456789abcdefghijk123456789abcdefghijk123456789abcdefghijk123456789abcdefghijk123456789abcdefghijk123456789abcdefghijk123456789abcdefghijk123456789abcdefghijk123456789abcdefghijk123456789abcdefghijk123456789abcdefghijk123456789abcdefghijk123456789abcdefghijk123456789abcdefghijk123456789abcdefghijk123456789abcdefghijk123456789abcdefghijk123456789abcdefghijk123456789abcdefghijk123456789') where a=1;
ERROR 22001: Data too long for column
update test2 set b=concat(b,substr('abcdefghijk123456789abcdefghijk123456789abcdefghijk123456789abcdefghijk123456789abcdefghijk123456789abcdefghijk123456789abcdefghijk123456789abcdefghijk123456789abcdefghijk123456789abcdefghijk123456789abcdefghijk123456789abcdefghijk123456789abcdefghijk123456789abcdefghijk123456789abcdefghijk123456789abcdefghijk123456789abcdefghijk123456789abcdefghijk123456789abcdefghijk123456789abcdefghijk123456789',1,383)) where a=2;
update test2 set b=concat(b,substr('abcdefghijk123456789abcdefghijk123456789abcdefghijk123456789abcdefghijk123456789abcdefghijk123456789abcdefghijk123456789abcdefghijk123456789abcdefghijk123456789abcdefghijk123456789abcdefghijk123456789abcdefghijk123456789abcdefghijk123456789abcdefghijk123456789abcdefghijk123456789abcdefghijk123456789abcdefghijk123456789abcdefghijk123456789abcdefghijk123456789abcdefghijk123456789abcdefghijk123456789',1,385)) where a=2;
ERROR 22001: Data too long for column
update test2 set b=concat(b,substr('abcdefghijk123456789abcdefghijk123456789abcdefghijk123456789abcdefghijk123456789abcdefghijk123456789abcdefghijk123456789abcdefghijk123456789abcdefghijk123456789abcdefghijk123456789abcdefghijk123456789abcdefghijk123456789abcdefghijk123456789abcdefghijk123456789abcdefghijk123456789abcdefghijk123456789abcdefghijk123456789abcdefghijk123456789abcdefghijk123456789abcdefghijk123456789abcdefghijk123456789',1,386)) where a=2;
ERROR 22001: Data too long for column
update test2 set b=concat(b,substr('abcdefghijk123456789abcdefghijk123456789abcdefghijk123456789abcdefghijk123456789abcdefghijk123456789abcdefghijk123456789abcdefghijk123456789abcdefghijk123456789abcdefghijk123456789abcdefghijk123456789abcdefghijk123456789abcdefghijk123456789abcdefghijk123456789abcdefghijk123456789abcdefghijk123456789abcdefghijk123456789abcdefghijk123456789abcdefghijk123456789abcdefghijk123456789abcdefghijk123456789',1,383)) where a=3;
update test2 set b=concat(b,substr('abcdefghijk123456789abcdefghijk123456789abcdefghijk123456789abcdefghijk123456789abcdefghijk123456789abcdefghijk123456789abcdefghijk123456789abcdefghijk123456789abcdefghijk123456789abcdefghijk123456789abcdefghijk123456789abcdefghijk123456789abcdefghijk123456789abcdefghijk123456789abcdefghijk123456789abcdefghijk123456789abcdefghijk123456789abcdefghijk123456789abcdefghijk123456789abcdefghijk123456789',1,383)) where a=4;
update test2 set b=concat(b,substr('abcdefghijk123456789abcdefghijk123456789abcdefghijk123456789abcdefghijk123456789abcdefghijk123456789abcdefghijk123456789abcdefghijk123456789abcdefghijk123456789abcdefghijk123456789abcdefghijk123456789abcdefghijk123456789abcdefghijk123456789abcdefghijk123456789abcdefghijk123456789abcdefghijk123456789abcdefghijk123456789abcdefghijk123456789abcdefghijk123456789abcdefghijk123456789abcdefghijk123456789',1,383)) where a=5;
update test2 set b=concat(b,substr('abcdefghijk123456789abcdefghijk123456789abcdefghijk123456789abcdefghijk123456789abcdefghijk123456789abcdefghijk123456789abcdefghijk123456789abcdefghijk123456789abcdefghijk123456789abcdefghijk123456789abcdefghijk123456789abcdefghijk123456789abcdefghijk123456789abcdefghijk123456789abcdefghijk123456789abcdefghijk123456789abcdefghijk123456789abcdefghijk123456789abcdefghijk123456789abcdefghijk123456789',1,383)) where a=6;
update test2 set b=concat(b,substr('abcdefghijk123456789abcdefghijk123456789abcdefghijk123456789abcdefghijk123456789abcdefghijk123456789abcdefghijk123456789abcdefghijk123456789abcdefghijk123456789abcdefghijk123456789abcdefghijk123456789abcdefghijk123456789abcdefghijk123456789abcdefghijk123456789abcdefghijk123456789abcdefghijk123456789abcdefghijk123456789abcdefghijk123456789abcdefghijk123456789abcdefghijk123456789abcdefghijk123456789',1,383)) where a=7;
update test2 set b=concat(b,substr('abcdefghijk123456789abcdefghijk123456789abcdefghijk123456789abcdefghijk123456789abcdefghijk123456789abcdefghijk123456789abcdefghijk123456789abcdefghijk123456789abcdefghijk123456789abcdefghijk123456789abcdefghijk123456789abcdefghijk123456789abcdefghijk123456789abcdefghijk123456789abcdefghijk123456789abcdefghijk123456789abcdefghijk123456789abcdefghijk123456789abcdefghijk123456789abcdefghijk123456789',1,383)) where a=8;
update test2 set b=concat(b,substr('abcdefghijk123456789abcdefghijk123456789abcdefghijk123456789abcdefghijk123456789abcdefghijk123456789abcdefghijk123456789abcdefghijk123456789abcdefghijk123456789abcdefghijk123456789abcdefghijk123456789abcdefghijk123456789abcdefghijk123456789abcdefghijk123456789abcdefghijk123456789abcdefghijk123456789abcdefghijk123456789abcdefghijk123456789abcdefghijk123456789abcdefghijk123456789abcdefghijk123456789',1,383)) where a=1;
update test2 set b=concat(b,substr('abcdefghijk123456789abcdefghijk123456789abcdefghijk123456789abcdefghijk123456789abcdefghijk123456789abcdefghijk123456789abcdefghijk123456789abcdefghijk123456789abcdefghijk123456789abcdefghijk123456789abcdefghijk123456789abcdefghijk123456789abcdefghijk123456789abcdefghijk123456789abcdefghijk123456789abcdefghijk123456789abcdefghijk123456789abcdefghijk123456789abcdefghijk123456789abcdefghijk123456789',1,383)) where a=9;
update test2 set b=concat(b,'abcdefagfdgadfglkdfajglkjdfakgljdfklgjdfakjgdkajfgdkjfagakldjfgkfdjagdfakljgadkljgdfkagjakldjfgdklajgdfakjakjgdklfjdafdgdfjkgghijk123456789abcdefghijk12345678912345') where a=1;
ERROR 22001: Data too long for column
update test2 set b=concat(b,'abcdefghijk123456789abcd') where a=3;
ERROR 22001: Data too long for column
update test2 set b=concat(b,'abcdefghijk123456789abcd') where a=3;
ERROR 22001: Data too long for column
update test2 set b=concat(b,'abcdefghijk123456789abcd') where a=3;
ERROR 22001: Data too long for column
select count(*) from test2;
count(*)
10
select a,length(b) from test2;
a	length(b)
1	16384
2	16384
3	16384
4	16384
5	16384
6	16384
7	16384
8	16384
9	16384
10	16001
delete from test2 where a in(1) ;
alter table test2 set EXPIRE_INFO (a >= 5);
alter system major freeze tenant = sys;
alter system major freeze tenant = all_user;
alter system major freeze tenant = all_meta;
prepare stmt1 from select a,length(b) from  test2  where a=3 and b like concat('3',concat(?,'%'));
set @x='abcdefghijk123456789abcdefghijk123456789abcdefghijk123456789abcdefghijk123456789abcdefghijk123456789abcdefghijk123456789abcdefghijk123456789abcdefghijk123456789abcdefghijk123456789abcdefghijk123456789abcdefghijk123456789abcdefghijk123456789abcdefghijk123456789abcdefghijk123456789abcdefghijk123456789abcdefghijk123456789abcdefghijk123456789abcdefghijk123456789abcdefghijk123456789abcdefghijk123456789';
execute stmt1 using @x;
a	length(b)
3	16384
alter table test2 set EXPIRE_INFO (length(b) <26264);
alter system major freeze tenant = sys;
alter system major freeze tenant = all_user;
alter system major freeze tenant = all_meta;
select a,length(b) from test2;
a	length(b)
2	16384
3	16384
4	16384
5	16384
6	16384
7	16384
8	16384
9	16384
10	16001
delete from test2 where a=1;
select *  from test2 where a=1;
a	b
delete from test2 where a in (2,3);
select * from test2 where a in (2,3);
a	b
alter system set _ob_enable_prepared_statement = false;
