alter system set _ob_enable_prepared_statement = true;
drop table if exists t1, t2;
create table t1( a int primary key,b varchar(255),c int);
insert into t1 values(1,'a',2),(2,'b',3),(3,'c',4);
prepare stmt1 from update t1 set b='ok' where a=?;
set @a=1;
execute stmt1 using @a;
alter table t1 add d int;
execute stmt1 using @a;
select * from t1;
a	b	c	d
1	ok	2	NULL
2	b	3	NULL
3	c	4	NULL
deallocate prepare stmt1;
prepare stmt2 from update t1 set b='ok' where a=?;
set @a=1;
execute stmt2 using @a;
alter table t1 drop d ;
execute stmt2 using @a ;
select * from t1;
a	b	c
1	ok	2
2	b	3
3	c	4
deallocate prepare stmt2;
prepare stmt3 from update t1 set b='ok' where a=?;
set @a=1;
execute stmt3 using @a;
alter table t1 drop b ;
execute stmt3 using @a;
ERROR 42S22: Unknown column 'b' in 'field list'
select * from t1;
a	c
1	2
2	3
3	4
deallocate prepare stmt3;
alter table t1 add b int;
prepare stmt4 from update t1 set b=2 where a=?;
set @a=1;
execute stmt4 using @a;
alter table t1 drop a ;
ERROR 0A000: Not supported feature or function
execute stmt4 using @a;
select * from t1;
a	c	b
1	2	2
2	3	NULL
3	4	NULL
deallocate prepare stmt4;
drop table t1;
create table t1( a int primary key,b varchar(255),c int);
insert into t1 values(1,'a',2),(2,'b',3),(3,'c',4);
prepare stmt5 from update t1 set b='ok' where a=?;
set @a=1;
execute stmt5 using @a;
alter table t1 add d int;
alter table t1 drop d ;
execute stmt5 using @a;
select * from t1;
a	b	c
1	ok	2
2	b	3
3	c	4
deallocate prepare stmt5;
prepare stmt6 from update t1 set b='ok' where a=?;
set @a=1;
execute stmt6 using @a;
alter table t1 drop c ;
alter table t1 add c int;
execute stmt6 using @a;
select * from t1;
a	b	c
1	ok	NULL
2	b	NULL
3	c	NULL
deallocate prepare stmt6;
prepare stmt7 from update t1 set b='ok' where a=?;
set @a=1;
execute stmt7 using @a;
alter table t1 drop b ;
alter table t1 add b varchar(255);
execute stmt7 using @a;
select * from t1;
a	c	b
1	NULL	ok
2	NULL	NULL
3	NULL	NULL
deallocate prepare stmt7;
prepare stmt8 from update t1 set b='ok' where a=?;
set @a=1;
execute stmt8 using @a;
alter table t1 drop b ;
alter table t1 add b int;
execute stmt8 using @a;
ERROR HY000: Incorrect integer value
select * from t1;
a	c	b
1	NULL	NULL
2	NULL	NULL
3	NULL	NULL
deallocate prepare stmt8;
prepare stmt9 from update t1 set b='ok' where a=?;
set @a=1;
execute stmt9 using @a;
ERROR HY000: Incorrect integer value
alter table t1 drop a ;
ERROR 0A000: Not supported feature or function
alter table t1 add a int;
ERROR 42S21: Duplicate column name 'a'
execute stmt9 using @a;
ERROR HY000: Incorrect integer value
select * from t1;
a	c	b
1	NULL	NULL
2	NULL	NULL
3	NULL	NULL
deallocate prepare stmt9;
prepare stmt10 from update t1 set b='ok' where a=?;
set @a=1;
execute stmt10 using @a;
ERROR HY000: Incorrect integer value
alter table t1 drop a ;
ERROR 0A000: Not supported feature or function
alter table t1 add a varchar(255);
ERROR 42S21: Duplicate column name 'a'
execute stmt10 using @a;
ERROR HY000: Incorrect integer value
select * from t1;
a	c	b
1	NULL	NULL
2	NULL	NULL
3	NULL	NULL
deallocate prepare stmt10;
prepare stmt11 from update t1 set b='ok' where a=?;
set @a=1;
execute stmt11 using @a;
ERROR HY000: Incorrect integer value
drop table t1;
execute stmt11 using @a;
ERROR 42S02: Table 'test.t1' doesn't exist
deallocate prepare stmt11;
create table t1( a int primary key,b varchar(255),c int);
insert into t1 values(1,'a',2),(2,'b',3),(3,'c',4);
prepare stmt12 from update t1 set b='ok' where a=?;
set @a=1;
execute stmt12 using @a;
drop table t1;
create table t1( a int primary key,b varchar(255),c int);
execute stmt12 using @a;
select * from t1;
a	b	c
deallocate prepare stmt12;
drop table t1;
create table t1( a int primary key,b varchar(255),c int);
insert into t1 values(1,'a',2),(2,'b',3),(3,'c',4);
prepare stmt13 from update t1 set b='ok',c=2 where a=?;
set @a=1;
execute stmt13 using @a;
drop table t1;
create table t1( a int primary key,b varchar(255));
execute stmt13 using @a;
ERROR 42S22: Unknown column 'c' in 'field list'
select * from t1;
a	b
deallocate prepare stmt13;
drop table t1;
create table t1( a int primary key,b varchar(255),c int);
insert into t1 values(1,'a',2),(2,'b',3),(3,'c',4);
prepare stmt14 from update t1 set b='ok' where a=?;
set @a=1;
execute stmt14 using @a;
drop table t1;
create table t2( a int primary key,b varchar(255));
execute stmt14 using @a;
ERROR 42S02: Table 'test.t1' doesn't exist
deallocate prepare stmt14;
drop table if exists tbl1;
create table tbl1 (pk int,i1 int, v2 varchar(80), i3 char(20),i4 float, d4 datetime(6),i5 decimal(5,3),i6 bool, primary key(pk));
insert into tbl1 values(1,1,'abc12','1agc',1.25,'2014-01-01 12:00:00',23.23,1),
(2,10,'23abc12','4agc1',-0.25,'2015-11-01 12:00:00',-23.230,0),
(3,201,'xx23abc12','cagc1',-2.25,'2015-11-21 11:20:10',3.231,1),
(4,80,'zx23abc12','zcagc1',2.25,'2013-01-21 11:20:10',-3.231,1),
(5,53,'cx23abc12','rcagc1',109.25,'2016-01-22 11:20:10',-13.131,0),
(6,78,'tx23abc12','icagc1',-109.25,'2014-09-16 16:24:00',-13.531,1),
(7,400,'yx23abc12','ocagc1',85.85,'2014-09-17 16:20:21',-93.131,0),
(8,50,'vx23abc12','wcagc1',-85.85,'2014-09-10 16:20:21',93.131,1),
(9,610,'ukx23abc12','pecagc1',-1.85,'2014-09-19 16:20:21',99.131,0),
(10,42,'kx23abc12','ecagc1',-85.86,'2014-09-18 16:20:21',-99.131,1),
(11,NULL,NULL,NULL,NULL,NULL,NULL,NULL);
create  index idx_1 on tbl1(i1);
select date_sub(null, INTERVAL -6 DAY);
date_sub(null, INTERVAL -6 DAY)
NULL
select * from tbl1;
pk	i1	v2	i3	i4	d4	i5	i6
1	1	abc12	1agc	1.25	2014-01-01 12:00:00.0	23.230	1
2	10	23abc12	4agc1	-0.25	2015-11-01 12:00:00.0	-23.230	0
3	201	xx23abc12	cagc1	-2.25	2015-11-21 11:20:10.0	3.231	1
4	80	zx23abc12	zcagc1	2.25	2013-01-21 11:20:10.0	-3.231	1
5	53	cx23abc12	rcagc1	109.25	2016-01-22 11:20:10.0	-13.131	0
6	78	tx23abc12	icagc1	-109.25	2014-09-16 16:24:00.0	-13.531	1
7	400	yx23abc12	ocagc1	85.85	2014-09-17 16:20:21.0	-93.131	0
8	50	vx23abc12	wcagc1	-85.85	2014-09-10 16:20:21.0	93.131	1
9	610	ukx23abc12	pecagc1	-1.85	2014-09-19 16:20:21.0	99.131	0
10	42	kx23abc12	ecagc1	-85.86	2014-09-18 16:20:21.0	-99.131	1
11	NULL	NULL	NULL	NULL	NULL	NULL	NULL
update  tbl1 set i1=i1-20 where pk<=11 limit 20;
update  tbl1 set i1=i1+20 where pk<=11 limit 20;
select * from tbl1;
pk	i1	v2	i3	i4	d4	i5	i6
1	1	abc12	1agc	1.25	2014-01-01 12:00:00.0	23.230	1
2	10	23abc12	4agc1	-0.25	2015-11-01 12:00:00.0	-23.230	0
3	201	xx23abc12	cagc1	-2.25	2015-11-21 11:20:10.0	3.231	1
4	80	zx23abc12	zcagc1	2.25	2013-01-21 11:20:10.0	-3.231	1
5	53	cx23abc12	rcagc1	109.25	2016-01-22 11:20:10.0	-13.131	0
6	78	tx23abc12	icagc1	-109.25	2014-09-16 16:24:00.0	-13.531	1
7	400	yx23abc12	ocagc1	85.85	2014-09-17 16:20:21.0	-93.131	0
8	50	vx23abc12	wcagc1	-85.85	2014-09-10 16:20:21.0	93.131	1
9	610	ukx23abc12	pecagc1	-1.85	2014-09-19 16:20:21.0	99.131	0
10	42	kx23abc12	ecagc1	-85.86	2014-09-18 16:20:21.0	-99.131	1
11	NULL	NULL	NULL	NULL	NULL	NULL	NULL
update  tbl1 set v2=concat(v2,'abc') where i1<=100 order by i1 limit 10;
update  tbl1 set v2=substr(v2,1,10) where i1<=100 order by i1 limit 10;
select * from tbl1;
pk	i1	v2	i3	i4	d4	i5	i6
1	1	abc12abc	1agc	1.25	2014-01-01 12:00:00.0	23.230	1
2	10	23abc12abc	4agc1	-0.25	2015-11-01 12:00:00.0	-23.230	0
3	201	xx23abc12	cagc1	-2.25	2015-11-21 11:20:10.0	3.231	1
4	80	zx23abc12a	zcagc1	2.25	2013-01-21 11:20:10.0	-3.231	1
5	53	cx23abc12a	rcagc1	109.25	2016-01-22 11:20:10.0	-13.131	0
6	78	tx23abc12a	icagc1	-109.25	2014-09-16 16:24:00.0	-13.531	1
7	400	yx23abc12	ocagc1	85.85	2014-09-17 16:20:21.0	-93.131	0
8	50	vx23abc12a	wcagc1	-85.85	2014-09-10 16:20:21.0	93.131	1
9	610	ukx23abc12	pecagc1	-1.85	2014-09-19 16:20:21.0	99.131	0
10	42	kx23abc12a	ecagc1	-85.86	2014-09-18 16:20:21.0	-99.131	1
11	NULL	NULL	NULL	NULL	NULL	NULL	NULL
update  tbl1 set i4=i4*2 limit 100;
select * from tbl1;
pk	i1	v2	i3	i4	d4	i5	i6
1	1	abc12abc	1agc	2.5	2014-01-01 12:00:00.0	23.230	1
2	10	23abc12abc	4agc1	-0.5	2015-11-01 12:00:00.0	-23.230	0
3	201	xx23abc12	cagc1	-4.5	2015-11-21 11:20:10.0	3.231	1
4	80	zx23abc12a	zcagc1	4.5	2013-01-21 11:20:10.0	-3.231	1
5	53	cx23abc12a	rcagc1	218.5	2016-01-22 11:20:10.0	-13.131	0
6	78	tx23abc12a	icagc1	-218.5	2014-09-16 16:24:00.0	-13.531	1
7	400	yx23abc12	ocagc1	171.7	2014-09-17 16:20:21.0	-93.131	0
8	50	vx23abc12a	wcagc1	-171.7	2014-09-10 16:20:21.0	93.131	1
9	610	ukx23abc12	pecagc1	-3.7	2014-09-19 16:20:21.0	99.131	0
10	42	kx23abc12a	ecagc1	-171.72	2014-09-18 16:20:21.0	-99.131	1
11	NULL	NULL	NULL	NULL	NULL	NULL	NULL
update  tbl1 set i4=i4/2 limit 100;
select * from tbl1;
pk	i1	v2	i3	i4	d4	i5	i6
1	1	abc12abc	1agc	1.25	2014-01-01 12:00:00.0	23.230	1
2	10	23abc12abc	4agc1	-0.25	2015-11-01 12:00:00.0	-23.230	0
3	201	xx23abc12	cagc1	-2.25	2015-11-21 11:20:10.0	3.231	1
4	80	zx23abc12a	zcagc1	2.25	2013-01-21 11:20:10.0	-3.231	1
5	53	cx23abc12a	rcagc1	109.25	2016-01-22 11:20:10.0	-13.131	0
6	78	tx23abc12a	icagc1	-109.25	2014-09-16 16:24:00.0	-13.531	1
7	400	yx23abc12	ocagc1	85.85	2014-09-17 16:20:21.0	-93.131	0
8	50	vx23abc12a	wcagc1	-85.85	2014-09-10 16:20:21.0	93.131	1
9	610	ukx23abc12	pecagc1	-1.85	2014-09-19 16:20:21.0	99.131	0
10	42	kx23abc12a	ecagc1	-85.86	2014-09-18 16:20:21.0	-99.131	1
11	NULL	NULL	NULL	NULL	NULL	NULL	NULL
update  tbl1 set d4=date_sub(d4, INTERVAL -6 DAY) limit 5,6;
update  tbl1 set d4=date_sub(d4, INTERVAL -6 DAY) where d4 is not null limit 5,6;
update  tbl1 set d4=date_add(d4, INTERVAL -6 DAY) limit 5,6;
update  tbl1 set d4=date_add(d4, INTERVAL -6 DAY) where d4 is not null limit 5,6;
update  tbl1 set i5=i5+0.05 limit 0,10;
update  tbl1 set i5=i5-0.05 order by i5 desc limit 0,10;
update  tbl1 set i6=i6 and 1 order by i6 asc limit 0,10;
select * from tbl1;
pk	i1	v2	i3	i4	d4	i5	i6
1	1	abc12abc	1agc	1.25	2014-01-01 12:00:00.0	23.230	1
2	10	23abc12abc	4agc1	-0.25	2015-11-01 12:00:00.0	-23.230	0
3	201	xx23abc12	cagc1	-2.25	2015-11-21 11:20:10.0	3.231	1
4	80	zx23abc12a	zcagc1	2.25	2013-01-21 11:20:10.0	-3.231	1
5	53	cx23abc12a	rcagc1	109.25	2016-01-22 11:20:10.0	-13.131	0
6	78	tx23abc12a	icagc1	-109.25	2014-09-16 16:24:00.0	-13.531	1
7	400	yx23abc12	ocagc1	85.85	2014-09-17 16:20:21.0	-93.131	0
8	50	vx23abc12a	wcagc1	-85.85	2014-09-10 16:20:21.0	93.131	1
9	610	ukx23abc12	pecagc1	-1.85	2014-09-19 16:20:21.0	99.131	0
10	42	kx23abc12a	ecagc1	-85.86	2014-09-18 16:20:21.0	-99.131	1
11	NULL	NULL	NULL	NULL	NULL	NULL	NULL
update  tbl1 set i1=i1+1-1 where i1>10 and i1<=1000 order by i1 limit 3,10;
delete from tbl1  where i1>10 and i1<=1000 order by i1 limit 10,10;
update  tbl1 set i1=i1+1-1 where  i1>10+1 and i1<1000 order by i1;
update  tbl1  set i1=i1+1-1 where i1 between 10+1 and 1000 order by i1 limit 3,10;
delete from tbl1  where i1 between 10+1 and 1000 order by i1 limit 10,10;
prepare stmt1 from update tbl1 set i1=i1-100 where i1>?+1 and i1<?-10 order by ? limit ?,?;
set @a=10;
set @b=1000;
set @c='i1';
set @d=0;
set @e=10;
execute stmt1 using @a, @b,@c,@d,@e;
set @c='v2';
set @a=10;
set @b=1000;
execute stmt1 using @a, @b,@c,@d,@e;
prepare stmt2 from delete from tbl1  where i1>?+1 and i1<?-10 order by ? limit ?,?;
set @a=10;
set @b=1000;
set @c='i1';
set @d=0;
set @e=10;
execute stmt2 using @a, @b,@c,@d,@e;
set @a=-110;
execute stmt2 using @a, @b,@c,@d,@e;
delete from tbl1 limit 100;
insert into tbl1 values(1,1,'abc12','1agc',1.25,'2014-01-01 12:00:00',23.23,1),
(2,10,'23abc12','4agc1',-0.25,'2015-11-01 12:00:00',-23.230,0),
(3,201,'xx23abc12','cagc1',-2.25,'2015-11-21 11:20:10',3.231,1),
(4,80,'zx23abc12','zcagc1',2.25,'2013-01-21 11:20:10',-3.231,1),
(5,53,'cx23abc12','rcagc1',109.25,'2016-01-22 11:20:10',-13.131,0),
(6,78,'tx23abc12','icagc1',-109.25,'2014-09-16 16:24:00',-13.531,1);
insert into tbl1 values(7,400,'yx23abc12','ocagc1',85.85,'2014-09-17 16:20:21',-93.131,0),
(8,50,'vx23abc12','wcagc1',-85.85,'2014-09-10 16:20:21',93.131,1),
(9,610,'ukx23abc12','pecagc1',-1.85,'2014-09-19 16:20:21',99.131,0),
(10,42,'kx23abc12','ecagc1',-85.86,'2014-09-18 16:20:21',-99.131,1);
select * from tbl1;
pk	i1	v2	i3	i4	d4	i5	i6
1	1	abc12	1agc	1.25	2014-01-01 12:00:00.0	23.230	1
2	10	23abc12	4agc1	-0.25	2015-11-01 12:00:00.0	-23.230	0
3	201	xx23abc12	cagc1	-2.25	2015-11-21 11:20:10.0	3.231	1
4	80	zx23abc12	zcagc1	2.25	2013-01-21 11:20:10.0	-3.231	1
5	53	cx23abc12	rcagc1	109.25	2016-01-22 11:20:10.0	-13.131	0
6	78	tx23abc12	icagc1	-109.25	2014-09-16 16:24:00.0	-13.531	1
7	400	yx23abc12	ocagc1	85.85	2014-09-17 16:20:21.0	-93.131	0
8	50	vx23abc12	wcagc1	-85.85	2014-09-10 16:20:21.0	93.131	1
9	610	ukx23abc12	pecagc1	-1.85	2014-09-19 16:20:21.0	99.131	0
10	42	kx23abc12	ecagc1	-85.86	2014-09-18 16:20:21.0	-99.131	1
update  tbl1 set i1=i1-100 where i1>=10+1 and i1<=(1000*2) +null limit 10;
update  tbl1 set i1=i1-100 where i1>=10+1 and i1<=(1000*2) +null order by i1 desc limit 10;
update tbl1 set i1=i1-100 where i1>=10+1 and i1<=(1000*2) or i1 is null limit 3;
select * from tbl1;
pk	i1	v2	i3	i4	d4	i5	i6
1	1	abc12	1agc	1.25	2014-01-01 12:00:00.0	23.230	1
2	10	23abc12	4agc1	-0.25	2015-11-01 12:00:00.0	-23.230	0
3	201	xx23abc12	cagc1	-2.25	2015-11-21 11:20:10.0	3.231	1
4	80	zx23abc12	zcagc1	2.25	2013-01-21 11:20:10.0	-3.231	1
5	-47	cx23abc12	rcagc1	109.25	2016-01-22 11:20:10.0	-13.131	0
6	78	tx23abc12	icagc1	-109.25	2014-09-16 16:24:00.0	-13.531	1
7	400	yx23abc12	ocagc1	85.85	2014-09-17 16:20:21.0	-93.131	0
8	-50	vx23abc12	wcagc1	-85.85	2014-09-10 16:20:21.0	93.131	1
9	610	ukx23abc12	pecagc1	-1.85	2014-09-19 16:20:21.0	99.131	0
10	-58	kx23abc12	ecagc1	-85.86	2014-09-18 16:20:21.0	-99.131	1
update tbl1 set i1=i1+100 where i1>=10+1 and i1<=(1000*2) or i1 is null limit 0,3;
select * from tbl1;
pk	i1	v2	i3	i4	d4	i5	i6
1	1	abc12	1agc	1.25	2014-01-01 12:00:00.0	23.230	1
2	10	23abc12	4agc1	-0.25	2015-11-01 12:00:00.0	-23.230	0
3	301	xx23abc12	cagc1	-2.25	2015-11-21 11:20:10.0	3.231	1
4	180	zx23abc12	zcagc1	2.25	2013-01-21 11:20:10.0	-3.231	1
5	-47	cx23abc12	rcagc1	109.25	2016-01-22 11:20:10.0	-13.131	0
6	178	tx23abc12	icagc1	-109.25	2014-09-16 16:24:00.0	-13.531	1
7	400	yx23abc12	ocagc1	85.85	2014-09-17 16:20:21.0	-93.131	0
8	-50	vx23abc12	wcagc1	-85.85	2014-09-10 16:20:21.0	93.131	1
9	610	ukx23abc12	pecagc1	-1.85	2014-09-19 16:20:21.0	99.131	0
10	-58	kx23abc12	ecagc1	-85.86	2014-09-18 16:20:21.0	-99.131	1
update  tbl1 set i1=i1+1-1 where i1>=10+1 and i1<=(1000*2) or i1 is (null+1) limit 10,1;
ERROR 42000: You have an error in your SQL syntax; check the manual that corresponds to your OceanBase version for the right syntax to use near '(null+1) limit 10,1' at line 1
update tbl1 set i1=i1+100-100  where i1>=10+1 and i1<=(1000*2) and i1 is not  null order by v2 limit 15;
prepare stmt1 from update  tbl1 set i1=i1+10-10  where i1>=?+1 and i1<=(?*2) and i5  between ? and ? order by ? limit ?,?;
set @a=10;
set @b=1000;
set @c=0;
set @d=1000;
set @e='v2';
set @f=1;
set @g=10;
execute stmt1 using @a, @b,@c,@d,@e,@f,@g;
set @b=1000-1+1;
set @c=0+1000-1+1-1000;
set @d=1000-1+1;
execute stmt1 using @a, @b,@c,@d,@e,@f,@g;
drop table if exists t1,t2,t3,t4,t5,t6;
create table t1(i1 int, f1 float, s1 varchar(1024), d1 datetime(6), i2 int, f2 float,s2 varchar(1024), d2 datetime(6),primary key(i1,s1,d1));
prepare stmt_update from update t1 set i2=?,f2=?,s2=?,d2=? where i1=? and f1=? and s1=? and d1=?;
prepare stmt_replace from replace into t1 values(?,?,?,?,?,?,?,?);
set @i1=10;
set @f1=10.5;
set @s1='abcdefg';
set @d1=timestamp'2020-02-02 20:00:00';
set @i2=9;
set @f2=9.5;
set @s2='abcdefgh';
set @d2=timestamp'2020-02-01 20:00:00';
execute stmt_replace using @i1,@f1,@s1,@d1,@i2,@f2,@s2,@d2;
set @i1=9;
set @f1=9.5;
set @s1='abcdefg';
set @d1=timestamp'2020-02-02 20:00:00';
set @i2=8;
set @f2=8.5;
set @s2='abcdefgh';
set @d2=timestamp'2020-02-01 20:00:00';
execute stmt_replace using @i1,@f1,@s1,@d1,@i2,@f2,@s2,@d2;
set @i1=8;
set @f1=8.5;
set @s1='abcdefg';
set @d1=timestamp'2020-02-02 20:00:00';
set @i2=7;
set @f2=7.5;
set @s2='abcdefgh';
set @d2=timestamp'2020-02-01 20:00:00';
execute stmt_replace using @i1,@f1,@s1,@d1,@i2,@f2,@s2,@d2;
set @i1=7;
set @f1=7.5;
set @s1='abcdefg';
set @d1=timestamp'2020-02-02 20:00:00';
set @i2=6;
set @f2=6.5;
set @s2='abcdefgh';
set @d2=timestamp'2020-02-01 20:00:00';
execute stmt_replace using @i1,@f1,@s1,@d1,@i2,@f2,@s2,@d2;
set @i1=6;
set @f1=6.5;
set @s1='abcdefg';
set @d1=timestamp'2020-02-02 20:00:00';
set @i2=5;
set @f2=5.5;
set @s2='abcdefgh';
set @d2=timestamp'2020-02-01 20:00:00';
execute stmt_replace using @i1,@f1,@s1,@d1,@i2,@f2,@s2,@d2;
set @i1=5;
set @f1=5.5;
set @s1='abcdefg';
set @d1=timestamp'2020-02-02 20:00:00';
set @i2=4;
set @f2=4.5;
set @s2='abcdefgh';
set @d2=timestamp'2020-02-01 20:00:00';
execute stmt_replace using @i1,@f1,@s1,@d1,@i2,@f2,@s2,@d2;
set @i1=4;
set @f1=4.5;
set @s1='abcdefg';
set @d1=timestamp'2020-02-02 20:00:00';
set @i2=3;
set @f2=3.5;
set @s2='abcdefgh';
set @d2=timestamp'2020-02-01 20:00:00';
execute stmt_replace using @i1,@f1,@s1,@d1,@i2,@f2,@s2,@d2;
set @i1=3;
set @f1=3.5;
set @s1='abcdefg';
set @d1=timestamp'2020-02-02 20:00:00';
set @i2=2;
set @f2=2.5;
set @s2='abcdefgh';
set @d2=timestamp'2020-02-01 20:00:00';
execute stmt_replace using @i1,@f1,@s1,@d1,@i2,@f2,@s2,@d2;
set @i1=2;
set @f1=2.5;
set @s1='abcdefg';
set @d1=timestamp'2020-02-02 20:00:00';
set @i2=1;
set @f2=1.5;
set @s2='abcdefgh';
set @d2=timestamp'2020-02-01 20:00:00';
execute stmt_replace using @i1,@f1,@s1,@d1,@i2,@f2,@s2,@d2;
set @i1=1;
set @f1=1.5;
set @s1='abcdefg';
set @d1=timestamp'2020-02-02 20:00:00';
set @i2=0;
set @f2=0.5;
set @s2='abcdefgh';
set @d2=timestamp'2020-02-01 20:00:00';
execute stmt_replace using @i1,@f1,@s1,@d1,@i2,@f2,@s2,@d2;
set @i1=10;
set @f1=10.5;
set @s1='abcdefg';
set @d1=timestamp'2020-02-02 20:00:00';
set @i2=9;
set @f2=9.5;
set @s2='abcdefgh';
set @d2=timestamp'2020-02-01 20:00:00';
execute stmt_update using @i1,@f1,@s1,@d1,@i2,@f2,@s2,@d2;
set @i1=9;
set @f1=9.5;
set @s1='abcdefg';
set @d1=timestamp'2020-02-02 20:00:00';
set @i2=8;
set @f2=8.5;
set @s2='abcdefgh';
set @d2=timestamp'2020-02-01 20:00:00';
execute stmt_update using @i1,@f1,@s1,@d1,@i2,@f2,@s2,@d2;
set @i1=8;
set @f1=8.5;
set @s1='abcdefg';
set @d1=timestamp'2020-02-02 20:00:00';
set @i2=7;
set @f2=7.5;
set @s2='abcdefgh';
set @d2=timestamp'2020-02-01 20:00:00';
execute stmt_update using @i1,@f1,@s1,@d1,@i2,@f2,@s2,@d2;
set @i1=7;
set @f1=7.5;
set @s1='abcdefg';
set @d1=timestamp'2020-02-02 20:00:00';
set @i2=6;
set @f2=6.5;
set @s2='abcdefgh';
set @d2=timestamp'2020-02-01 20:00:00';
execute stmt_update using @i1,@f1,@s1,@d1,@i2,@f2,@s2,@d2;
set @i1=6;
set @f1=6.5;
set @s1='abcdefg';
set @d1=timestamp'2020-02-02 20:00:00';
set @i2=5;
set @f2=5.5;
set @s2='abcdefgh';
set @d2=timestamp'2020-02-01 20:00:00';
execute stmt_update using @i1,@f1,@s1,@d1,@i2,@f2,@s2,@d2;
set @i1=5;
set @f1=5.5;
set @s1='abcdefg';
set @d1=timestamp'2020-02-02 20:00:00';
set @i2=4;
set @f2=4.5;
set @s2='abcdefgh';
set @d2=timestamp'2020-02-01 20:00:00';
execute stmt_update using @i1,@f1,@s1,@d1,@i2,@f2,@s2,@d2;
set @i1=4;
set @f1=4.5;
set @s1='abcdefg';
set @d1=timestamp'2020-02-02 20:00:00';
set @i2=3;
set @f2=3.5;
set @s2='abcdefgh';
set @d2=timestamp'2020-02-01 20:00:00';
execute stmt_update using @i1,@f1,@s1,@d1,@i2,@f2,@s2,@d2;
set @i1=3;
set @f1=3.5;
set @s1='abcdefg';
set @d1=timestamp'2020-02-02 20:00:00';
set @i2=2;
set @f2=2.5;
set @s2='abcdefgh';
set @d2=timestamp'2020-02-01 20:00:00';
execute stmt_update using @i1,@f1,@s1,@d1,@i2,@f2,@s2,@d2;
set @i1=2;
set @f1=2.5;
set @s1='abcdefg';
set @d1=timestamp'2020-02-02 20:00:00';
set @i2=1;
set @f2=1.5;
set @s2='abcdefgh';
set @d2=timestamp'2020-02-01 20:00:00';
execute stmt_update using @i1,@f1,@s1,@d1,@i2,@f2,@s2,@d2;
set @i1=1;
set @f1=1.5;
set @s1='abcdefg';
set @d1=timestamp'2020-02-02 20:00:00';
set @i2=0;
set @f2=0.5;
set @s2='abcdefgh';
set @d2=timestamp'2020-02-01 20:00:00';
execute stmt_update using @i1,@f1,@s1,@d1,@i2,@f2,@s2,@d2;
select * from t1;
i1	f1	s1	d1	i2	f2	s2	d2
1	1.5	abcdefg	2020-02-02 20:00:00.0	0	0.5	abcdefgh	2020-02-01 20:00:00.0
2	2.5	abcdefg	2020-02-02 20:00:00.0	1	1.5	abcdefgh	2020-02-01 20:00:00.0
3	3.5	abcdefg	2020-02-02 20:00:00.0	2	2.5	abcdefgh	2020-02-01 20:00:00.0
4	4.5	abcdefg	2020-02-02 20:00:00.0	3	3.5	abcdefgh	2020-02-01 20:00:00.0
5	5.5	abcdefg	2020-02-02 20:00:00.0	4	4.5	abcdefgh	2020-02-01 20:00:00.0
6	6.5	abcdefg	2020-02-02 20:00:00.0	5	5.5	abcdefgh	2020-02-01 20:00:00.0
7	7.5	abcdefg	2020-02-02 20:00:00.0	6	6.5	abcdefgh	2020-02-01 20:00:00.0
8	8.5	abcdefg	2020-02-02 20:00:00.0	7	7.5	abcdefgh	2020-02-01 20:00:00.0
9	9.5	abcdefg	2020-02-02 20:00:00.0	8	8.5	abcdefgh	2020-02-01 20:00:00.0
10	10.5	abcdefg	2020-02-02 20:00:00.0	9	9.5	abcdefgh	2020-02-01 20:00:00.0
drop table t1;
create table t2(i1 int, f1 float, s1 varchar(1024), d1 datetime(6), i2 int, f2 float,s2 varchar(1024), d2 datetime(6),primary key(i1,s1,d1));
prepare stmt_update_i1  from update t2 set i2=?,f2=?,s2=?,d2=? where i1=? and f1=? and s1=? and d1=? and i2=?;
prepare stmt_replace from replace into t2 values(?,?,?,?,?,?,?,?);
set @i1=10;
set @f1=10.5;
set @s1='abcdefg';
set @d1=timestamp'2020-02-02 20:00:00';
set @i2=9;
set @f2=9.5;
set @s2='abcdefgh';
set @d2=timestamp'2020-02-01 20:00:00';
execute stmt_replace using @i1,@f1,@s1,@d1,@i2,@f2,@s2,@d2;
set @i1=9;
set @f1=9.5;
set @s1='abcdefg';
set @d1=timestamp'2020-02-02 20:00:00';
set @i2=8;
set @f2=8.5;
set @s2='abcdefgh';
set @d2=timestamp'2020-02-01 20:00:00';
execute stmt_replace using @i1,@f1,@s1,@d1,@i2,@f2,@s2,@d2;
set @i1=8;
set @f1=8.5;
set @s1='abcdefg';
set @d1=timestamp'2020-02-02 20:00:00';
set @i2=7;
set @f2=7.5;
set @s2='abcdefgh';
set @d2=timestamp'2020-02-01 20:00:00';
execute stmt_replace using @i1,@f1,@s1,@d1,@i2,@f2,@s2,@d2;
set @i1=7;
set @f1=7.5;
set @s1='abcdefg';
set @d1=timestamp'2020-02-02 20:00:00';
set @i2=6;
set @f2=6.5;
set @s2='abcdefgh';
set @d2=timestamp'2020-02-01 20:00:00';
execute stmt_replace using @i1,@f1,@s1,@d1,@i2,@f2,@s2,@d2;
set @i1=6;
set @f1=6.5;
set @s1='abcdefg';
set @d1=timestamp'2020-02-02 20:00:00';
set @i2=5;
set @f2=5.5;
set @s2='abcdefgh';
set @d2=timestamp'2020-02-01 20:00:00';
execute stmt_replace using @i1,@f1,@s1,@d1,@i2,@f2,@s2,@d2;
set @i1=5;
set @f1=5.5;
set @s1='abcdefg';
set @d1=timestamp'2020-02-02 20:00:00';
set @i2=4;
set @f2=4.5;
set @s2='abcdefgh';
set @d2=timestamp'2020-02-01 20:00:00';
execute stmt_replace using @i1,@f1,@s1,@d1,@i2,@f2,@s2,@d2;
set @i1=4;
set @f1=4.5;
set @s1='abcdefg';
set @d1=timestamp'2020-02-02 20:00:00';
set @i2=3;
set @f2=3.5;
set @s2='abcdefgh';
set @d2=timestamp'2020-02-01 20:00:00';
execute stmt_replace using @i1,@f1,@s1,@d1,@i2,@f2,@s2,@d2;
set @i1=3;
set @f1=3.5;
set @s1='abcdefg';
set @d1=timestamp'2020-02-02 20:00:00';
set @i2=2;
set @f2=2.5;
set @s2='abcdefgh';
set @d2=timestamp'2020-02-01 20:00:00';
execute stmt_replace using @i1,@f1,@s1,@d1,@i2,@f2,@s2,@d2;
set @i1=2;
set @f1=2.5;
set @s1='abcdefg';
set @d1=timestamp'2020-02-02 20:00:00';
set @i2=1;
set @f2=1.5;
set @s2='abcdefgh';
set @d2=timestamp'2020-02-01 20:00:00';
execute stmt_replace using @i1,@f1,@s1,@d1,@i2,@f2,@s2,@d2;
set @i1=1;
set @f1=1.5;
set @s1='abcdefg';
set @d1=timestamp'2020-02-02 20:00:00';
set @i2=0;
set @f2=0.5;
set @s2='abcdefgh';
set @d2=timestamp'2020-02-01 20:00:00';
execute stmt_replace using @i1,@f1,@s1,@d1,@i2,@f2,@s2,@d2;
set @f1=10.5;
set @s1='abcdefg';
set @d1=timestamp'2020-02-02 20:00:00';
set @i2=9;
set @f2=9.5;
set @s2='abcdefgh';
set @d2=timestamp'2020-02-01 20:00:00';
execute stmt_update_i1 using @i2,@f2,@s2,@d2,@i1,@f1,@s1,@d1,@i2;
set @f1=9.5;
set @s1='abcdefg';
set @d1=timestamp'2020-02-02 20:00:00';
set @i2=8;
set @f2=8.5;
set @s2='abcdefgh';
set @d2=timestamp'2020-02-01 20:00:00';
execute stmt_update_i1 using @i2,@f2,@s2,@d2,@i1,@f1,@s1,@d1,@i2;
set @f1=8.5;
set @s1='abcdefg';
set @d1=timestamp'2020-02-02 20:00:00';
set @i2=7;
set @f2=7.5;
set @s2='abcdefgh';
set @d2=timestamp'2020-02-01 20:00:00';
execute stmt_update_i1 using @i2,@f2,@s2,@d2,@i1,@f1,@s1,@d1,@i2;
set @f1=7.5;
set @s1='abcdefg';
set @d1=timestamp'2020-02-02 20:00:00';
set @i2=6;
set @f2=6.5;
set @s2='abcdefgh';
set @d2=timestamp'2020-02-01 20:00:00';
execute stmt_update_i1 using @i2,@f2,@s2,@d2,@i1,@f1,@s1,@d1,@i2;
set @f1=6.5;
set @s1='abcdefg';
set @d1=timestamp'2020-02-02 20:00:00';
set @i2=5;
set @f2=5.5;
set @s2='abcdefgh';
set @d2=timestamp'2020-02-01 20:00:00';
execute stmt_update_i1 using @i2,@f2,@s2,@d2,@i1,@f1,@s1,@d1,@i2;
set @f1=5.5;
set @s1='abcdefg';
set @d1=timestamp'2020-02-02 20:00:00';
set @i2=4;
set @f2=4.5;
set @s2='abcdefgh';
set @d2=timestamp'2020-02-01 20:00:00';
execute stmt_update_i1 using @i2,@f2,@s2,@d2,@i1,@f1,@s1,@d1,@i2;
set @f1=4.5;
set @s1='abcdefg';
set @d1=timestamp'2020-02-02 20:00:00';
set @i2=3;
set @f2=3.5;
set @s2='abcdefgh';
set @d2=timestamp'2020-02-01 20:00:00';
execute stmt_update_i1 using @i2,@f2,@s2,@d2,@i1,@f1,@s1,@d1,@i2;
set @f1=3.5;
set @s1='abcdefg';
set @d1=timestamp'2020-02-02 20:00:00';
set @i2=2;
set @f2=2.5;
set @s2='abcdefgh';
set @d2=timestamp'2020-02-01 20:00:00';
execute stmt_update_i1 using @i2,@f2,@s2,@d2,@i1,@f1,@s1,@d1,@i2;
set @f1=2.5;
set @s1='abcdefg';
set @d1=timestamp'2020-02-02 20:00:00';
set @i2=1;
set @f2=1.5;
set @s2='abcdefgh';
set @d2=timestamp'2020-02-01 20:00:00';
execute stmt_update_i1 using @i2,@f2,@s2,@d2,@i1,@f1,@s1,@d1,@i2;
set @f1=1.5;
set @s1='abcdefg';
set @d1=timestamp'2020-02-02 20:00:00';
set @i2=0;
set @f2=0.5;
set @s2='abcdefgh';
set @d2=timestamp'2020-02-01 20:00:00';
execute stmt_update_i1 using @i2,@f2,@s2,@d2,@i1,@f1,@s1,@d1,@i2;
select * from t2;
i1	f1	s1	d1	i2	f2	s2	d2
1	1.5	abcdefg	2020-02-02 20:00:00.0	0	0.5	abcdefgh	2020-02-01 20:00:00.0
2	2.5	abcdefg	2020-02-02 20:00:00.0	1	1.5	abcdefgh	2020-02-01 20:00:00.0
3	3.5	abcdefg	2020-02-02 20:00:00.0	2	2.5	abcdefgh	2020-02-01 20:00:00.0
4	4.5	abcdefg	2020-02-02 20:00:00.0	3	3.5	abcdefgh	2020-02-01 20:00:00.0
5	5.5	abcdefg	2020-02-02 20:00:00.0	4	4.5	abcdefgh	2020-02-01 20:00:00.0
6	6.5	abcdefg	2020-02-02 20:00:00.0	5	5.5	abcdefgh	2020-02-01 20:00:00.0
7	7.5	abcdefg	2020-02-02 20:00:00.0	6	6.5	abcdefgh	2020-02-01 20:00:00.0
8	8.5	abcdefg	2020-02-02 20:00:00.0	7	7.5	abcdefgh	2020-02-01 20:00:00.0
9	9.5	abcdefg	2020-02-02 20:00:00.0	8	8.5	abcdefgh	2020-02-01 20:00:00.0
10	10.5	abcdefg	2020-02-02 20:00:00.0	9	9.5	abcdefgh	2020-02-01 20:00:00.0
drop table t2;
create table t3(i1 int, f1 float, s1 varchar(1024), d1 datetime(6), i2 int, f2 float,s2 varchar(1024), d2 datetime(6),primary key(i1,s1,d1));
prepare stmt_update_f1  from update t3 set i2=?,f2=?,s2=?,d2=? where i1=? and f1=? and s1=? and d1=? and f2=?;
prepare stmt_replace from replace into t3 values(?,?,?,?,?,?,?,?);
set @i1=10;
set @f1=10.5;
set @s1='abcdefg';
set @d1=timestamp'2020-02-02 20:00:00';
set @i2=9;
set @f2=9.5;
set @s2='abcdefgh';
set @d2=timestamp'2020-02-01 20:00:00';
execute stmt_replace using @i1,@f1,@s1,@d1,@i2,@f2,@s2,@d2;
set @i1=9;
set @f1=9.5;
set @s1='abcdefg';
set @d1=timestamp'2020-02-02 20:00:00';
set @i2=8;
set @f2=8.5;
set @s2='abcdefgh';
set @d2=timestamp'2020-02-01 20:00:00';
execute stmt_replace using @i1,@f1,@s1,@d1,@i2,@f2,@s2,@d2;
set @i1=8;
set @f1=8.5;
set @s1='abcdefg';
set @d1=timestamp'2020-02-02 20:00:00';
set @i2=7;
set @f2=7.5;
set @s2='abcdefgh';
set @d2=timestamp'2020-02-01 20:00:00';
execute stmt_replace using @i1,@f1,@s1,@d1,@i2,@f2,@s2,@d2;
set @i1=7;
set @f1=7.5;
set @s1='abcdefg';
set @d1=timestamp'2020-02-02 20:00:00';
set @i2=6;
set @f2=6.5;
set @s2='abcdefgh';
set @d2=timestamp'2020-02-01 20:00:00';
execute stmt_replace using @i1,@f1,@s1,@d1,@i2,@f2,@s2,@d2;
set @i1=6;
set @f1=6.5;
set @s1='abcdefg';
set @d1=timestamp'2020-02-02 20:00:00';
set @i2=5;
set @f2=5.5;
set @s2='abcdefgh';
set @d2=timestamp'2020-02-01 20:00:00';
execute stmt_replace using @i1,@f1,@s1,@d1,@i2,@f2,@s2,@d2;
set @i1=5;
set @f1=5.5;
set @s1='abcdefg';
set @d1=timestamp'2020-02-02 20:00:00';
set @i2=4;
set @f2=4.5;
set @s2='abcdefgh';
set @d2=timestamp'2020-02-01 20:00:00';
execute stmt_replace using @i1,@f1,@s1,@d1,@i2,@f2,@s2,@d2;
set @i1=4;
set @f1=4.5;
set @s1='abcdefg';
set @d1=timestamp'2020-02-02 20:00:00';
set @i2=3;
set @f2=3.5;
set @s2='abcdefgh';
set @d2=timestamp'2020-02-01 20:00:00';
execute stmt_replace using @i1,@f1,@s1,@d1,@i2,@f2,@s2,@d2;
set @i1=3;
set @f1=3.5;
set @s1='abcdefg';
set @d1=timestamp'2020-02-02 20:00:00';
set @i2=2;
set @f2=2.5;
set @s2='abcdefgh';
set @d2=timestamp'2020-02-01 20:00:00';
execute stmt_replace using @i1,@f1,@s1,@d1,@i2,@f2,@s2,@d2;
set @i1=2;
set @f1=2.5;
set @s1='abcdefg';
set @d1=timestamp'2020-02-02 20:00:00';
set @i2=1;
set @f2=1.5;
set @s2='abcdefgh';
set @d2=timestamp'2020-02-01 20:00:00';
execute stmt_replace using @i1,@f1,@s1,@d1,@i2,@f2,@s2,@d2;
set @i1=1;
set @f1=1.5;
set @s1='abcdefg';
set @d1=timestamp'2020-02-02 20:00:00';
set @i2=0;
set @f2=0.5;
set @s2='abcdefgh';
set @d2=timestamp'2020-02-01 20:00:00';
execute stmt_replace using @i1,@f1,@s1,@d1,@i2,@f2,@s2,@d2;
set @i1=10;
set @s1='abcdefg';
set @d1=timestamp'2020-02-02 20:00:00';
set @i2=9;
set @f2=9.5;
set @s2='abcdefgh';
set @d2=timestamp'2020-02-01 20:00:00';
execute stmt_update_f1 using @i2,@f2,@s2,@d2,@i1,@f1,@s1,@d1,@f2;
set @i1=9;
set @s1='abcdefg';
set @d1=timestamp'2020-02-02 20:00:00';
set @i2=8;
set @f2=8.5;
set @s2='abcdefgh';
set @d2=timestamp'2020-02-01 20:00:00';
execute stmt_update_f1 using @i2,@f2,@s2,@d2,@i1,@f1,@s1,@d1,@f2;
set @i1=8;
set @s1='abcdefg';
set @d1=timestamp'2020-02-02 20:00:00';
set @i2=7;
set @f2=7.5;
set @s2='abcdefgh';
set @d2=timestamp'2020-02-01 20:00:00';
execute stmt_update_f1 using @i2,@f2,@s2,@d2,@i1,@f1,@s1,@d1,@f2;
set @i1=7;
set @s1='abcdefg';
set @d1=timestamp'2020-02-02 20:00:00';
set @i2=6;
set @f2=6.5;
set @s2='abcdefgh';
set @d2=timestamp'2020-02-01 20:00:00';
execute stmt_update_f1 using @i2,@f2,@s2,@d2,@i1,@f1,@s1,@d1,@f2;
set @i1=6;
set @s1='abcdefg';
set @d1=timestamp'2020-02-02 20:00:00';
set @i2=5;
set @f2=5.5;
set @s2='abcdefgh';
set @d2=timestamp'2020-02-01 20:00:00';
execute stmt_update_f1 using @i2,@f2,@s2,@d2,@i1,@f1,@s1,@d1,@f2;
set @i1=5;
set @s1='abcdefg';
set @d1=timestamp'2020-02-02 20:00:00';
set @i2=4;
set @f2=4.5;
set @s2='abcdefgh';
set @d2=timestamp'2020-02-01 20:00:00';
execute stmt_update_f1 using @i2,@f2,@s2,@d2,@i1,@f1,@s1,@d1,@f2;
set @i1=4;
set @s1='abcdefg';
set @d1=timestamp'2020-02-02 20:00:00';
set @i2=3;
set @f2=3.5;
set @s2='abcdefgh';
set @d2=timestamp'2020-02-01 20:00:00';
execute stmt_update_f1 using @i2,@f2,@s2,@d2,@i1,@f1,@s1,@d1,@f2;
set @i1=3;
set @s1='abcdefg';
set @d1=timestamp'2020-02-02 20:00:00';
set @i2=2;
set @f2=2.5;
set @s2='abcdefgh';
set @d2=timestamp'2020-02-01 20:00:00';
execute stmt_update_f1 using @i2,@f2,@s2,@d2,@i1,@f1,@s1,@d1,@f2;
set @i1=2;
set @s1='abcdefg';
set @d1=timestamp'2020-02-02 20:00:00';
set @i2=1;
set @f2=1.5;
set @s2='abcdefgh';
set @d2=timestamp'2020-02-01 20:00:00';
execute stmt_update_f1 using @i2,@f2,@s2,@d2,@i1,@f1,@s1,@d1,@f2;
set @i1=1;
set @s1='abcdefg';
set @d1=timestamp'2020-02-02 20:00:00';
set @i2=0;
set @f2=0.5;
set @s2='abcdefgh';
set @d2=timestamp'2020-02-01 20:00:00';
execute stmt_update_f1 using @i2,@f2,@s2,@d2,@i1,@f1,@s1,@d1,@f2;
select * from t3;
i1	f1	s1	d1	i2	f2	s2	d2
1	1.5	abcdefg	2020-02-02 20:00:00.0	0	0.5	abcdefgh	2020-02-01 20:00:00.0
2	2.5	abcdefg	2020-02-02 20:00:00.0	1	1.5	abcdefgh	2020-02-01 20:00:00.0
3	3.5	abcdefg	2020-02-02 20:00:00.0	2	2.5	abcdefgh	2020-02-01 20:00:00.0
4	4.5	abcdefg	2020-02-02 20:00:00.0	3	3.5	abcdefgh	2020-02-01 20:00:00.0
5	5.5	abcdefg	2020-02-02 20:00:00.0	4	4.5	abcdefgh	2020-02-01 20:00:00.0
6	6.5	abcdefg	2020-02-02 20:00:00.0	5	5.5	abcdefgh	2020-02-01 20:00:00.0
7	7.5	abcdefg	2020-02-02 20:00:00.0	6	6.5	abcdefgh	2020-02-01 20:00:00.0
8	8.5	abcdefg	2020-02-02 20:00:00.0	7	7.5	abcdefgh	2020-02-01 20:00:00.0
9	9.5	abcdefg	2020-02-02 20:00:00.0	8	8.5	abcdefgh	2020-02-01 20:00:00.0
10	10.5	abcdefg	2020-02-02 20:00:00.0	9	9.5	abcdefgh	2020-02-01 20:00:00.0
drop table t3;
create table t4(i1 int, f1 float, s1 varchar(1024), d1 datetime(6), i2 int, f2 float,s2 varchar(1024), d2 datetime(6),primary key(i1,s1,d1));
prepare stmt_update_d1  from update t4 set i2=?,f2=?,s2=?,d2=? where i1=? and f1=? and s1=? and d1=? and d2=?;
prepare stmt_replace from replace into t4 values(?,?,?,?,?,?,?,?);
set @i1=10;
set @f1=10.5;
set @s1='abcdefg';
set @d1=timestamp'2020-02-02 20:00:00';
set @i2=9;
set @f2=9.5;
set @s2='abcdefgh';
set @d2=timestamp'2020-02-01 20:00:00';
execute stmt_replace using @i1,@f1,@s1,@d1,@i2,@f2,@s2,@d2;
set @i1=9;
set @f1=9.5;
set @s1='abcdefg';
set @d1=timestamp'2020-02-02 20:00:00';
set @i2=8;
set @f2=8.5;
set @s2='abcdefgh';
set @d2=timestamp'2020-02-01 20:00:00';
execute stmt_replace using @i1,@f1,@s1,@d1,@i2,@f2,@s2,@d2;
set @i1=8;
set @f1=8.5;
set @s1='abcdefg';
set @d1=timestamp'2020-02-02 20:00:00';
set @i2=7;
set @f2=7.5;
set @s2='abcdefgh';
set @d2=timestamp'2020-02-01 20:00:00';
execute stmt_replace using @i1,@f1,@s1,@d1,@i2,@f2,@s2,@d2;
set @i1=7;
set @f1=7.5;
set @s1='abcdefg';
set @d1=timestamp'2020-02-02 20:00:00';
set @i2=6;
set @f2=6.5;
set @s2='abcdefgh';
set @d2=timestamp'2020-02-01 20:00:00';
execute stmt_replace using @i1,@f1,@s1,@d1,@i2,@f2,@s2,@d2;
set @i1=6;
set @f1=6.5;
set @s1='abcdefg';
set @d1=timestamp'2020-02-02 20:00:00';
set @i2=5;
set @f2=5.5;
set @s2='abcdefgh';
set @d2=timestamp'2020-02-01 20:00:00';
execute stmt_replace using @i1,@f1,@s1,@d1,@i2,@f2,@s2,@d2;
set @i1=5;
set @f1=5.5;
set @s1='abcdefg';
set @d1=timestamp'2020-02-02 20:00:00';
set @i2=4;
set @f2=4.5;
set @s2='abcdefgh';
set @d2=timestamp'2020-02-01 20:00:00';
execute stmt_replace using @i1,@f1,@s1,@d1,@i2,@f2,@s2,@d2;
set @i1=4;
set @f1=4.5;
set @s1='abcdefg';
set @d1=timestamp'2020-02-02 20:00:00';
set @i2=3;
set @f2=3.5;
set @s2='abcdefgh';
set @d2=timestamp'2020-02-01 20:00:00';
execute stmt_replace using @i1,@f1,@s1,@d1,@i2,@f2,@s2,@d2;
set @i1=3;
set @f1=3.5;
set @s1='abcdefg';
set @d1=timestamp'2020-02-02 20:00:00';
set @i2=2;
set @f2=2.5;
set @s2='abcdefgh';
set @d2=timestamp'2020-02-01 20:00:00';
execute stmt_replace using @i1,@f1,@s1,@d1,@i2,@f2,@s2,@d2;
set @i1=2;
set @f1=2.5;
set @s1='abcdefg';
set @d1=timestamp'2020-02-02 20:00:00';
set @i2=1;
set @f2=1.5;
set @s2='abcdefgh';
set @d2=timestamp'2020-02-01 20:00:00';
execute stmt_replace using @i1,@f1,@s1,@d1,@i2,@f2,@s2,@d2;
set @i1=1;
set @f1=1.5;
set @s1='abcdefg';
set @d1=timestamp'2020-02-02 20:00:00';
set @i2=0;
set @f2=0.5;
set @s2='abcdefgh';
set @d2=timestamp'2020-02-01 20:00:00';
execute stmt_replace using @i1,@f1,@s1,@d1,@i2,@f2,@s2,@d2;
select * from t4;
i1	f1	s1	d1	i2	f2	s2	d2
1	1.5	abcdefg	2020-02-02 20:00:00.0	0	0.5	abcdefgh	2020-02-01 20:00:00.0
2	2.5	abcdefg	2020-02-02 20:00:00.0	1	1.5	abcdefgh	2020-02-01 20:00:00.0
3	3.5	abcdefg	2020-02-02 20:00:00.0	2	2.5	abcdefgh	2020-02-01 20:00:00.0
4	4.5	abcdefg	2020-02-02 20:00:00.0	3	3.5	abcdefgh	2020-02-01 20:00:00.0
5	5.5	abcdefg	2020-02-02 20:00:00.0	4	4.5	abcdefgh	2020-02-01 20:00:00.0
6	6.5	abcdefg	2020-02-02 20:00:00.0	5	5.5	abcdefgh	2020-02-01 20:00:00.0
7	7.5	abcdefg	2020-02-02 20:00:00.0	6	6.5	abcdefgh	2020-02-01 20:00:00.0
8	8.5	abcdefg	2020-02-02 20:00:00.0	7	7.5	abcdefgh	2020-02-01 20:00:00.0
9	9.5	abcdefg	2020-02-02 20:00:00.0	8	8.5	abcdefgh	2020-02-01 20:00:00.0
10	10.5	abcdefg	2020-02-02 20:00:00.0	9	9.5	abcdefgh	2020-02-01 20:00:00.0
drop table t4;
create table t5(i1 int, f1 float, s1 varchar(1024), d1 datetime(6), i2 int, f2 float,s2 varchar(1024), d2 datetime(6),primary key(i1,s1,d1));
prepare stmt_update_s1  from update t5 set i2=?,f2=?,s2=?,d2=? where i1=? and f1=? and s1=? and d1=? and s2=?;
prepare stmt_replace from replace into t5 values(?,?,?,?,?,?,?,?);
set @i1=10;
set @f1=10.5;
set @s1='abcdefg';
set @d1=timestamp'2020-02-02 20:00:00';
set @i2=9;
set @f2=9.5;
set @s2='abcdefgh';
set @d2=timestamp'2020-02-01 20:00:00';
execute stmt_replace using @i1,@f1,@s1,@d1,@i2,@f2,@s2,@d2;
set @i1=9;
set @f1=9.5;
set @s1='abcdefg';
set @d1=timestamp'2020-02-02 20:00:00';
set @i2=8;
set @f2=8.5;
set @s2='abcdefgh';
set @d2=timestamp'2020-02-01 20:00:00';
execute stmt_replace using @i1,@f1,@s1,@d1,@i2,@f2,@s2,@d2;
set @i1=8;
set @f1=8.5;
set @s1='abcdefg';
set @d1=timestamp'2020-02-02 20:00:00';
set @i2=7;
set @f2=7.5;
set @s2='abcdefgh';
set @d2=timestamp'2020-02-01 20:00:00';
execute stmt_replace using @i1,@f1,@s1,@d1,@i2,@f2,@s2,@d2;
set @i1=7;
set @f1=7.5;
set @s1='abcdefg';
set @d1=timestamp'2020-02-02 20:00:00';
set @i2=6;
set @f2=6.5;
set @s2='abcdefgh';
set @d2=timestamp'2020-02-01 20:00:00';
execute stmt_replace using @i1,@f1,@s1,@d1,@i2,@f2,@s2,@d2;
set @i1=6;
set @f1=6.5;
set @s1='abcdefg';
set @d1=timestamp'2020-02-02 20:00:00';
set @i2=5;
set @f2=5.5;
set @s2='abcdefgh';
set @d2=timestamp'2020-02-01 20:00:00';
execute stmt_replace using @i1,@f1,@s1,@d1,@i2,@f2,@s2,@d2;
set @i1=5;
set @f1=5.5;
set @s1='abcdefg';
set @d1=timestamp'2020-02-02 20:00:00';
set @i2=4;
set @f2=4.5;
set @s2='abcdefgh';
set @d2=timestamp'2020-02-01 20:00:00';
execute stmt_replace using @i1,@f1,@s1,@d1,@i2,@f2,@s2,@d2;
set @i1=4;
set @f1=4.5;
set @s1='abcdefg';
set @d1=timestamp'2020-02-02 20:00:00';
set @i2=3;
set @f2=3.5;
set @s2='abcdefgh';
set @d2=timestamp'2020-02-01 20:00:00';
execute stmt_replace using @i1,@f1,@s1,@d1,@i2,@f2,@s2,@d2;
set @i1=3;
set @f1=3.5;
set @s1='abcdefg';
set @d1=timestamp'2020-02-02 20:00:00';
set @i2=2;
set @f2=2.5;
set @s2='abcdefgh';
set @d2=timestamp'2020-02-01 20:00:00';
execute stmt_replace using @i1,@f1,@s1,@d1,@i2,@f2,@s2,@d2;
set @i1=2;
set @f1=2.5;
set @s1='abcdefg';
set @d1=timestamp'2020-02-02 20:00:00';
set @i2=1;
set @f2=1.5;
set @s2='abcdefgh';
set @d2=timestamp'2020-02-01 20:00:00';
execute stmt_replace using @i1,@f1,@s1,@d1,@i2,@f2,@s2,@d2;
set @i1=1;
set @f1=1.5;
set @s1='abcdefg';
set @d1=timestamp'2020-02-02 20:00:00';
set @i2=0;
set @f2=0.5;
set @s2='abcdefgh';
set @d2=timestamp'2020-02-01 20:00:00';
execute stmt_replace using @i1,@f1,@s1,@d1,@i2,@f2,@s2,@d2;
set @i1=10;
set @f1=10.5;
set @s1='abcdefg';
set @d1=timestamp'2020-02-02 20:00:00';
set @i2=9;
set @f2=9.5;
set @s2='abcdefgh';
set @d2=timestamp'2020-02-01 20:00:00';
execute stmt_update_s1 using @i2,@f2,@s2,@d2,@i1,@f1,@s1,@d1,@s2;
set @i1=9;
set @f1=9.5;
set @s1='abcdefg';
set @d1=timestamp'2020-02-02 20:00:00';
set @i2=8;
set @f2=8.5;
set @s2='abcdefgh';
set @d2=timestamp'2020-02-01 20:00:00';
execute stmt_update_s1 using @i2,@f2,@s2,@d2,@i1,@f1,@s1,@d1,@s2;
set @i1=8;
set @f1=8.5;
set @s1='abcdefg';
set @d1=timestamp'2020-02-02 20:00:00';
set @i2=7;
set @f2=7.5;
set @s2='abcdefgh';
set @d2=timestamp'2020-02-01 20:00:00';
execute stmt_update_s1 using @i2,@f2,@s2,@d2,@i1,@f1,@s1,@d1,@s2;
set @i1=7;
set @f1=7.5;
set @s1='abcdefg';
set @d1=timestamp'2020-02-02 20:00:00';
set @i2=6;
set @f2=6.5;
set @s2='abcdefgh';
set @d2=timestamp'2020-02-01 20:00:00';
execute stmt_update_s1 using @i2,@f2,@s2,@d2,@i1,@f1,@s1,@d1,@s2;
set @i1=6;
set @f1=6.5;
set @s1='abcdefg';
set @d1=timestamp'2020-02-02 20:00:00';
set @i2=5;
set @f2=5.5;
set @s2='abcdefgh';
set @d2=timestamp'2020-02-01 20:00:00';
execute stmt_update_s1 using @i2,@f2,@s2,@d2,@i1,@f1,@s1,@d1,@s2;
set @i1=5;
set @f1=5.5;
set @s1='abcdefg';
set @d1=timestamp'2020-02-02 20:00:00';
set @i2=4;
set @f2=4.5;
set @s2='abcdefgh';
set @d2=timestamp'2020-02-01 20:00:00';
execute stmt_update_s1 using @i2,@f2,@s2,@d2,@i1,@f1,@s1,@d1,@s2;
set @i1=4;
set @f1=4.5;
set @s1='abcdefg';
set @d1=timestamp'2020-02-02 20:00:00';
set @i2=3;
set @f2=3.5;
set @s2='abcdefgh';
set @d2=timestamp'2020-02-01 20:00:00';
execute stmt_update_s1 using @i2,@f2,@s2,@d2,@i1,@f1,@s1,@d1,@s2;
set @i1=3;
set @f1=3.5;
set @s1='abcdefg';
set @d1=timestamp'2020-02-02 20:00:00';
set @i2=2;
set @f2=2.5;
set @s2='abcdefgh';
set @d2=timestamp'2020-02-01 20:00:00';
execute stmt_update_s1 using @i2,@f2,@s2,@d2,@i1,@f1,@s1,@d1,@s2;
set @i1=2;
set @f1=2.5;
set @s1='abcdefg';
set @d1=timestamp'2020-02-02 20:00:00';
set @i2=1;
set @f2=1.5;
set @s2='abcdefgh';
set @d2=timestamp'2020-02-01 20:00:00';
execute stmt_update_s1 using @i2,@f2,@s2,@d2,@i1,@f1,@s1,@d1,@s2;
set @i1=1;
set @f1=1.5;
set @s1='abcdefg';
set @d1=timestamp'2020-02-02 20:00:00';
set @i2=0;
set @f2=0.5;
set @s2='abcdefgh';
set @d2=timestamp'2020-02-01 20:00:00';
execute stmt_update_s1 using @i2,@f2,@s2,@d2,@i1,@f1,@s1,@d1,@s2;
select * from t5;
i1	f1	s1	d1	i2	f2	s2	d2
1	1.5	abcdefg	2020-02-02 20:00:00.0	0	0.5	abcdefgh	2020-02-01 20:00:00.0
2	2.5	abcdefg	2020-02-02 20:00:00.0	1	1.5	abcdefgh	2020-02-01 20:00:00.0
3	3.5	abcdefg	2020-02-02 20:00:00.0	2	2.5	abcdefgh	2020-02-01 20:00:00.0
4	4.5	abcdefg	2020-02-02 20:00:00.0	3	3.5	abcdefgh	2020-02-01 20:00:00.0
5	5.5	abcdefg	2020-02-02 20:00:00.0	4	4.5	abcdefgh	2020-02-01 20:00:00.0
6	6.5	abcdefg	2020-02-02 20:00:00.0	5	5.5	abcdefgh	2020-02-01 20:00:00.0
7	7.5	abcdefg	2020-02-02 20:00:00.0	6	6.5	abcdefgh	2020-02-01 20:00:00.0
8	8.5	abcdefg	2020-02-02 20:00:00.0	7	7.5	abcdefgh	2020-02-01 20:00:00.0
9	9.5	abcdefg	2020-02-02 20:00:00.0	8	8.5	abcdefgh	2020-02-01 20:00:00.0
10	10.5	abcdefg	2020-02-02 20:00:00.0	9	9.5	abcdefgh	2020-02-01 20:00:00.0
drop table t5;
create table t6(i1 int, f1 float, s1 varchar(1024), d1 datetime(6), i2 int, f2 float,s2 varchar(1024), d2 datetime(6),primary key(i1,s1,d1));
prepare stmt_update_all from update t6 set i2=?,f2=?,s2=?,d2=? where i1=? and f1=? and s1=? and d1=? and i2=? and f2=? and s2=? and d2=?;
prepare stmt_replace from replace into t6 values(?,?,?,?,?,?,?,?);
set @i1=10;
set @f1=10.5;
set @s1='abcdefg';
set @d1=timestamp'2020-02-02 20:00:00';
set @i2=9;
set @f2=9.5;
set @s2='abcdefgh';
set @d2=timestamp'2020-02-01 20:00:00';
execute stmt_replace using @i1,@f1,@s1,@d1,@i2,@f2,@s2,@d2;
set @i1=9;
set @f1=9.5;
set @s1='abcdefg';
set @d1=timestamp'2020-02-02 20:00:00';
set @i2=8;
set @f2=8.5;
set @s2='abcdefgh';
set @d2=timestamp'2020-02-01 20:00:00';
execute stmt_replace using @i1,@f1,@s1,@d1,@i2,@f2,@s2,@d2;
set @i1=8;
set @f1=8.5;
set @s1='abcdefg';
set @d1=timestamp'2020-02-02 20:00:00';
set @i2=7;
set @f2=7.5;
set @s2='abcdefgh';
set @d2=timestamp'2020-02-01 20:00:00';
execute stmt_replace using @i1,@f1,@s1,@d1,@i2,@f2,@s2,@d2;
set @i1=7;
set @f1=7.5;
set @s1='abcdefg';
set @d1=timestamp'2020-02-02 20:00:00';
set @i2=6;
set @f2=6.5;
set @s2='abcdefgh';
set @d2=timestamp'2020-02-01 20:00:00';
execute stmt_replace using @i1,@f1,@s1,@d1,@i2,@f2,@s2,@d2;
set @i1=6;
set @f1=6.5;
set @s1='abcdefg';
set @d1=timestamp'2020-02-02 20:00:00';
set @i2=5;
set @f2=5.5;
set @s2='abcdefgh';
set @d2=timestamp'2020-02-01 20:00:00';
execute stmt_replace using @i1,@f1,@s1,@d1,@i2,@f2,@s2,@d2;
set @i1=5;
set @f1=5.5;
set @s1='abcdefg';
set @d1=timestamp'2020-02-02 20:00:00';
set @i2=4;
set @f2=4.5;
set @s2='abcdefgh';
set @d2=timestamp'2020-02-01 20:00:00';
execute stmt_replace using @i1,@f1,@s1,@d1,@i2,@f2,@s2,@d2;
set @i1=4;
set @f1=4.5;
set @s1='abcdefg';
set @d1=timestamp'2020-02-02 20:00:00';
set @i2=3;
set @f2=3.5;
set @s2='abcdefgh';
set @d2=timestamp'2020-02-01 20:00:00';
execute stmt_replace using @i1,@f1,@s1,@d1,@i2,@f2,@s2,@d2;
set @i1=3;
set @f1=3.5;
set @s1='abcdefg';
set @d1=timestamp'2020-02-02 20:00:00';
set @i2=2;
set @f2=2.5;
set @s2='abcdefgh';
set @d2=timestamp'2020-02-01 20:00:00';
execute stmt_replace using @i1,@f1,@s1,@d1,@i2,@f2,@s2,@d2;
set @i1=2;
set @f1=2.5;
set @s1='abcdefg';
set @d1=timestamp'2020-02-02 20:00:00';
set @i2=1;
set @f2=1.5;
set @s2='abcdefgh';
set @d2=timestamp'2020-02-01 20:00:00';
execute stmt_replace using @i1,@f1,@s1,@d1,@i2,@f2,@s2,@d2;
set @i1=1;
set @f1=1.5;
set @s1='abcdefg';
set @d1=timestamp'2020-02-02 20:00:00';
set @i2=0;
set @f2=0.5;
set @s2='abcdefgh';
set @d2=timestamp'2020-02-01 20:00:00';
execute stmt_replace using @i1,@f1,@s1,@d1,@i2,@f2,@s2,@d2;
set @i1=10;
set @f1=10.5;
set @s1='abcdefg';
set @d1=timestamp'2020-02-02 20:00:00';
set @i2=9;
set @f2=9.5;
set @s2='abcdefgh';
set @d2=timestamp'2020-02-01 20:00:00';
set @i3=8;
set @f3=8.5;
set @s3='abcdefgh';
set @d3=timestamp'2020-02-01 20:00:00';
execute stmt_update_all using @i3,@f3,@s3,@d3,@i1,@f1,@s1,@d1,@i2,@f2,@s2,@d2;
set @i1=8;
set @f1=8.5;
set @s1='abcdefg';
set @d1=timestamp'2020-02-02 20:00:00';
set @i2=7;
set @f2=7.5;
set @s2='abcdefgh';
set @d2=timestamp'2020-02-01 20:00:00';
set @i3=6;
set @f3=6.5;
set @s3='abcdefgh';
set @d3=timestamp'2020-02-01 20:00:00';
execute stmt_update_all using @i3,@f3,@s3,@d3,@i1,@f1,@s1,@d1,@i2,@f2,@s2,@d2;
set @i1=6;
set @f1=6.5;
set @s1='abcdefg';
set @d1=timestamp'2020-02-02 20:00:00';
set @i2=5;
set @f2=5.5;
set @s2='abcdefgh';
set @d2=timestamp'2020-02-01 20:00:00';
set @i3=4;
set @f3=4.5;
set @s3='abcdefgh';
set @d3=timestamp'2020-02-01 20:00:00';
execute stmt_update_all using @i3,@f3,@s3,@d3,@i1,@f1,@s1,@d1,@i2,@f2,@s2,@d2;
set @i1=4;
set @f1=4.5;
set @s1='abcdefg';
set @d1=timestamp'2020-02-02 20:00:00';
set @i2=3;
set @f2=3.5;
set @s2='abcdefgh';
set @d2=timestamp'2020-02-01 20:00:00';
set @i3=2;
set @f3=2.5;
set @s3='abcdefgh';
set @d3=timestamp'2020-02-01 20:00:00';
execute stmt_update_all using @i3,@f3,@s3,@d3,@i1,@f1,@s1,@d1,@i2,@f2,@s2,@d2;
set @i1=2;
set @f1=2.5;
set @s1='abcdefg';
set @d1=timestamp'2020-02-02 20:00:00';
set @i2=1;
set @f2=1.5;
set @s2='abcdefgh';
set @d2=timestamp'2020-02-01 20:00:00';
set @i3=0;
set @f3=0.5;
set @s3='abcdefgh';
set @d3=timestamp'2020-02-01 20:00:00';
execute stmt_update_all using @i3,@f3,@s3,@d3,@i1,@f1,@s1,@d1,@i2,@f2,@s2,@d2;
select * from t6;
i1	f1	s1	d1	i2	f2	s2	d2
1	1.5	abcdefg	2020-02-02 20:00:00.0	0	0.5	abcdefgh	2020-02-01 20:00:00.0
2	2.5	abcdefg	2020-02-02 20:00:00.0	0	0.5	abcdefgh	2020-02-01 20:00:00.0
3	3.5	abcdefg	2020-02-02 20:00:00.0	2	2.5	abcdefgh	2020-02-01 20:00:00.0
4	4.5	abcdefg	2020-02-02 20:00:00.0	2	2.5	abcdefgh	2020-02-01 20:00:00.0
5	5.5	abcdefg	2020-02-02 20:00:00.0	4	4.5	abcdefgh	2020-02-01 20:00:00.0
6	6.5	abcdefg	2020-02-02 20:00:00.0	4	4.5	abcdefgh	2020-02-01 20:00:00.0
7	7.5	abcdefg	2020-02-02 20:00:00.0	6	6.5	abcdefgh	2020-02-01 20:00:00.0
8	8.5	abcdefg	2020-02-02 20:00:00.0	6	6.5	abcdefgh	2020-02-01 20:00:00.0
9	9.5	abcdefg	2020-02-02 20:00:00.0	8	8.5	abcdefgh	2020-02-01 20:00:00.0
10	10.5	abcdefg	2020-02-02 20:00:00.0	8	8.5	abcdefgh	2020-02-01 20:00:00.0
drop table t6;
alter system set _ob_enable_prepared_statement = false;
