alter system set _ob_enable_prepared_statement = true;
alter system set enable_sql_audit='false';
alter system flush sql audit global;
drop user user4;
drop user user5;
drop user user6;
create user user4 identified by 'user4';
grant all on test.* to user4;
create user user5 identified by 'user5';
grant all on test.* to user5;
create user user6 identified by 'user6';
grant all on test.* to user6;
drop table if exists t1,t2,t3,t4,t5,t6;
create table t1 (c1 int primary key);
create table t3 (c1 int primary key);
alter system set enable_sql_audit='True';
drop table if exists t2, t3, t4;
create table t3 (c1 int);
create /*ps_sql_audit_test*/ table t2 (c1 int primary key);
select user_name, query_sql, db_name, ret_code from oceanbase.__all_virtual_sql_audit where query_sql like '%ps_sql_audit_test%';
user_name	query_sql	db_name	ret_code
admin	create /*ps_sql_audit_test*/ table t2 (c1 int primary key)	test	0
admin	select user_name, query_sql, db_name, ret_code from oceanbase.__all_virtual_sql_audit where query_sql like '%ps_sql_audit_test%'	test	0
help 'alter table';
select user_name, query_sql, db_name, ret_code from oceanbase.__all_virtual_sql_audit where query_sql like 'help \'alter table\'';
user_name	query_sql	db_name	ret_code
admin	help 'alter table'	test	0
alter table t2 rename to t4;
select user_name, query_sql, db_name, ret_code from oceanbase.__all_virtual_sql_audit where query_sql like 'alter table t2 rename to t4';
user_name	query_sql	db_name	ret_code
admin	alter table t2 rename to t4	test	0
alter table t3 set COMPRESSION = 'none';
select user_name, query_sql, db_name, ret_code from oceanbase.__all_virtual_sql_audit where query_sql like 'alter table t3 set COMPRESSION = \'none\'';
user_name	query_sql	db_name	ret_code
admin	alter table t3 set COMPRESSION = 'none'	test	0
insert into t1 values(1),(1);
select user_name, query_sql, db_name, ret_code from oceanbase.__all_virtual_sql_audit where query_sql like 'insert into t1 values(1),(1)'
select * from t1,t3;
select user_name, query_sql, db_name, ret_code from oceanbase.__all_virtual_sql_audit where query_sql like 'select * from t1,t3';
user_name	query_sql	db_name	ret_code
insert into t3 values (1);
select user_name, query_sql, db_name, ret_code from oceanbase.__all_virtual_sql_audit where query_sql like 'insert into t3 values (1)';
user_name	query_sql	db_name	ret_code
admin	insert into t3 values (1)	test	0
admin	insert into t3 values (1)	test	0
update t3 set c1=2 where c1=1;
select user_name, query_sql, db_name, ret_code from oceanbase.__all_virtual_sql_audit where query_sql like 'update t3 set c1=2 where c1=1';
user_name	query_sql	db_name	ret_code
admin	update t3 set c1=2 where c1=1	test	0
admin	update t3 set c1=2 where c1=1	test	0
grant all privileges on t3 to 'user4';
select user_name, query_sql, db_name, ret_code from oceanbase.__all_virtual_sql_audit where query_sql like 'grant all privileges on t3 to \'user4\'';
user_name	query_sql	db_name	ret_code
admin	grant all privileges on t3 to 'user4'	test	0
grant all privileges on t3 to 'user5';
select user_name, query_sql, db_name, ret_code from oceanbase.__all_virtual_sql_audit where query_sql like 'grant all privileges on t3 to \'user5\'';
user_name	query_sql	db_name	ret_code
admin	grant all privileges on t3 to 'user5'	test	0
begin;
select * from t3 where c1=2 for update wait 5;
c1
begin;
update t3 set c1=3 where c1=2;
rollback;
commit;
select * from t3;
c1
2
select user_name, query_sql, db_name, ret_code from oceanbase.__all_virtual_sql_audit where query_sql like 'select * from t3';
user_name	query_sql	db_name	ret_code
admin	select * from t3	test	0
admin	select * from t3	test	0
drop table if exists tbl_for_ps_sql_audit_mysqltest;
create table tbl_for_ps_sql_audit_mysqltest (c1 int);
prepare stmt from select ? from tbl_for_ps_sql_audit_mysqltest;
set @a=1;
execute stmt using @a;
?
select user_name, query_sql, db_name, ret_code from oceanbase.__all_virtual_sql_audit where query_sql like '%select%tbl_for_ps_sql_audit_mysqltest%';
user_name	query_sql	db_name	ret_code
admin	select ? from tbl_for_ps_sql_audit_mysqltest	test	0
admin	select ? from tbl_for_ps_sql_audit_mysqltest	test	0
admin	select user_name, query_sql, db_name, ret_code from oceanbase.__all_virtual_sql_audit where query_sql like '%select%tbl_for_ps_sql_audit_mysqltest%'	test	0
alter system set _ob_enable_prepared_statement = false;
