########utf8||DDL-Mysql全量表达式验证generated_column-1-1-2及之下所有####################
drop database  IF EXISTS  ob35x;
create database ob35x  character set utf8;
use ob35x;
SET NAMES utf8;
drop table if exists triangle;
CREATE TABLE triangle (
sidea DOUBLE,
sideb DOUBLE,
sidec DOUBLE AS (SQRT(sidea * sidea + sideb * sideb))
)DEFAULT CHARACTER SET = utf8;
INSERT INTO triangle (sidea, sideb) VALUES(1,1),(3,4),(6,8);
SELECT * FROM triangle;
sidea	sideb	sidec
1	1	1.4142135623730951
3	4	5
6	8	10
drop table if exists triangle;
drop table if exists mail;
create table mail
(
t int,
srcuser varchar(100) primary key,
srchost char(200),
dstuser varchar(200),
dsthost char(200),
tablesize decimal(10,2)
);
alter table mail drop column c18;
ERROR 42000: Can't DROP 'c18'; check that column/key exists
ALTER TABLE mail ADD c18 varchar(200) GENERATED ALWAYS AS (cast(srcuser as CHAR)) VIRTUAL;
alter table mail drop column c19;
ERROR 42000: Can't DROP 'c19'; check that column/key exists
ALTER TABLE mail ADD c19 varchar(200) GENERATED ALWAYS AS (cast(dstuser as CHAR)) VIRTUAL;
insert into mail(t,srcuser,srchost,dstuser,dsthost,tablesize) values(1,'中文测试1','中文测试2','中文测试3','中文测试4',100);
insert into mail(t,srcuser,srchost,dstuser,dsthost,tablesize) values(3,01245,'中文测试9','中文测试10','中文测试11',300);
insert into mail(t,srcuser,srchost,dstuser,dsthost,tablesize) values(4,'','中文测试12','中文测试13','中文测试14',400);
insert into mail(t,srcuser,srchost,dstuser,dsthost,tablesize) values(5,'哈哈哈哈hhhh','中文测试12','中文测试13','中文测试14',500);
insert into mail(t,srcuser,srchost,dstuser,dsthost,tablesize) values(6,'hhhh465456\\','中文测试12','中文测试13','中文测试14',600);
insert into mail(t,srcuser,srchost,dstuser,dsthost,tablesize) values(7,'abc def ghi','中文测试12','中文测试13','中文测试14',700);
insert into mail(t,srcuser,srchost,dstuser,dsthost,tablesize) values(9,'бжb','中文测试12','中文测试13','中文测试14',900);
select t.srcuser as 中文测试ing from mail t where t.c18 ='中文测试1';
中文测试ing
中文测试1
select t.srcuser as 中文测试ing from mail t where t.c18 !='中文测试1';
中文测试ing

1245
abc def ghi
hhhh465456\
бжb
哈哈哈哈hhhh
select t.srcuser as 中文测试ing from mail t where t.c18 <>'中文测试1';
中文测试ing

1245
abc def ghi
hhhh465456\
бжb
哈哈哈哈hhhh
select t.srcuser as 中文测试ing from mail t where t.c18 <'中文测试1';
中文测试ing

1245
abc def ghi
hhhh465456\
бжb
select t.srcuser as 中文测试ing from mail t where t.c18 >='中文测试1';
中文测试ing
中文测试1
哈哈哈哈hhhh
select t.srcuser as 中文测试ing from mail t where t.c18 in ('中文测试1');
中文测试ing
中文测试1
select t.srcuser as 中文测试ing from mail t where t.c18 not in ('中文测试1');
中文测试ing

1245
abc def ghi
hhhh465456\
бжb
哈哈哈哈hhhh
select t.srcuser as 中文测试ing from mail t where t.c18 >='中文测试1' and t.srcuser <='中文测试1';
中文测试ing
中文测试1
select t.srcuser as 中文测试ing from mail t where t.c18 >='中文测试1' or t.srcuser <='中文测试1';
中文测试ing

1245
abc def ghi
hhhh465456\
бжb
中文测试1
哈哈哈哈hhhh
select t.srcuser as 中文测试ing from mail t where t.c18 like'中文测试%';
中文测试ing
中文测试1
select t.srcuser as 中文测试ing from mail t where t.c18 =NULL;
中文测试ing
select t.srcuser as 中文测试ing from mail t where t.c18 !=NULL;
中文测试ing
select t.srcuser as 中文测试ing from mail t where t.c18 <>NULL;
中文测试ing
select t.srcuser as 中文测试ing from mail t where t.c18 <NULL;
中文测试ing
select t.srcuser as 中文测试ing from mail t where t.c18 >=NULL;
中文测试ing
select t.srcuser as 中文测试ing from mail t where t.c18 in (NULL);
中文测试ing
select t.srcuser as 中文测试ing from mail t where t.c18 not in (NULL);
中文测试ing
select t.srcuser as 中文测试ing from mail t where t.c18 >=NULL and t.srcuser <=NULL;
中文测试ing
select t.srcuser as 中文测试ing from mail t where t.c18 >=NULL or t.srcuser <=NULL;
中文测试ing
select t.srcuser as 中文测试ing from mail t where t.c18 like 'NULL%';
中文测试ing
select t.srcuser as 中文测试ing from mail t where t.c18 ='';
中文测试ing

select t.srcuser as 中文测试ing from mail t where t.c18 !='';
中文测试ing
1245
abc def ghi
hhhh465456\
бжb
中文测试1
哈哈哈哈hhhh
select t.srcuser as 中文测试ing from mail t where t.c18 <>'';
中文测试ing
1245
abc def ghi
hhhh465456\
бжb
中文测试1
哈哈哈哈hhhh
select t.srcuser as 中文测试ing from mail t where t.c18 <'';
中文测试ing
select t.srcuser as 中文测试ing from mail t where t.c18 >='';
中文测试ing

1245
abc def ghi
hhhh465456\
бжb
中文测试1
哈哈哈哈hhhh
select t.srcuser as 中文测试ing from mail t where t.c18 in ('');
中文测试ing

select t.srcuser as 中文测试ing from mail t where t.c18 not in ('');
中文测试ing
1245
abc def ghi
hhhh465456\
бжb
中文测试1
哈哈哈哈hhhh
select t.srcuser as 中文测试ing from mail t where t.c18 >='' and t.srcuser <='';
中文测试ing

select t.srcuser as 中文测试ing from mail t where t.c18 >='' or t.srcuser <='';
中文测试ing

1245
abc def ghi
hhhh465456\
бжb
中文测试1
哈哈哈哈hhhh
select t.srcuser as 中文测试ing from mail t where t.c18 like'%';
中文测试ing

1245
abc def ghi
hhhh465456\
бжb
中文测试1
哈哈哈哈hhhh
select t.srcuser as 中文测试ing from mail t where t.c18 ='01245';
中文测试ing
select t.srcuser as 中文测试ing from mail t where t.c18 !='01245';
中文测试ing

1245
abc def ghi
hhhh465456\
бжb
中文测试1
哈哈哈哈hhhh
select t.srcuser as 中文测试ing from mail t where t.c18 <>'01245';
中文测试ing

1245
abc def ghi
hhhh465456\
бжb
中文测试1
哈哈哈哈hhhh
select t.srcuser as 中文测试ing from mail t where t.c18 <'01245';
中文测试ing

select t.srcuser as 中文测试ing from mail t where t.c18 >='01245';
中文测试ing
1245
abc def ghi
hhhh465456\
бжb
中文测试1
哈哈哈哈hhhh
select t.srcuser as 中文测试ing from mail t where t.c18 in ('01245');
中文测试ing
select t.srcuser as 中文测试ing from mail t where t.c18 not in ('01245');
中文测试ing

1245
abc def ghi
hhhh465456\
бжb
中文测试1
哈哈哈哈hhhh
select t.srcuser as 中文测试ing from mail t where t.c18 >='01245' and t.srcuser <='01245';
中文测试ing
select t.srcuser as 中文测试ing from mail t where t.c18 >='01245' or t.srcuser <='01245';
中文测试ing

1245
abc def ghi
hhhh465456\
бжb
中文测试1
哈哈哈哈hhhh
select t.srcuser as 中文测试ing from mail t where t.c18 like'01245%';
中文测试ing
select t.srcuser as 中文测试ing from mail t where t.c19 ='中文测试1';
中文测试ing
select t.srcuser as 中文测试ing from mail t where t.c19 !='中文测试1';
中文测试ing

1245
abc def ghi
hhhh465456\
бжb
中文测试1
哈哈哈哈hhhh
select t.srcuser as 中文测试ing from mail t where t.c19 <>'中文测试1';
中文测试ing

1245
abc def ghi
hhhh465456\
бжb
中文测试1
哈哈哈哈hhhh
select t.srcuser as 中文测试ing from mail t where t.c19 <'中文测试1';
中文测试ing
select t.srcuser as 中文测试ing from mail t where t.c19 >='中文测试1';
中文测试ing

1245
abc def ghi
hhhh465456\
бжb
中文测试1
哈哈哈哈hhhh
select t.srcuser as 中文测试ing from mail t where t.c19 in ('中文测试1');
中文测试ing
select t.srcuser as 中文测试ing from mail t where t.c19 not in ('中文测试1');
中文测试ing

1245
abc def ghi
hhhh465456\
бжb
中文测试1
哈哈哈哈hhhh
select t.srcuser as 中文测试ing from mail t where t.c19 >='中文测试1' and t.srcuser <='中文测试1';
中文测试ing

1245
abc def ghi
hhhh465456\
бжb
中文测试1
select t.srcuser as 中文测试ing from mail t where t.c19 >='中文测试1' or t.srcuser <='中文测试1';
中文测试ing

1245
abc def ghi
hhhh465456\
бжb
中文测试1
哈哈哈哈hhhh
select t.srcuser as 中文测试ing from mail t where t.c19 like'中文测试%';
中文测试ing

1245
abc def ghi
hhhh465456\
бжb
中文测试1
哈哈哈哈hhhh
select t.srcuser as 中文测试ing from mail t where t.c19 =NULL;
中文测试ing
select t.srcuser as 中文测试ing from mail t where t.c19 !=NULL;
中文测试ing
select t.srcuser as 中文测试ing from mail t where t.c19 <>NULL;
中文测试ing
select t.srcuser as 中文测试ing from mail t where t.c19 <NULL;
中文测试ing
select t.srcuser as 中文测试ing from mail t where t.c19 >=NULL;
中文测试ing
select t.srcuser as 中文测试ing from mail t where t.c19 in (NULL);
中文测试ing
select t.srcuser as 中文测试ing from mail t where t.c19 not in (NULL);
中文测试ing
select t.srcuser as 中文测试ing from mail t where t.c19 >=NULL and t.srcuser <=NULL;
中文测试ing
select t.srcuser as 中文测试ing from mail t where t.c19 >=NULL or t.srcuser <=NULL;
中文测试ing
select t.srcuser as 中文测试ing from mail t where t.c19 like 'NULL%';
中文测试ing
select t.srcuser as 中文测试ing from mail t where t.c19 ='';
中文测试ing
select t.srcuser as 中文测试ing from mail t where t.c19 !='';
中文测试ing

1245
abc def ghi
hhhh465456\
бжb
中文测试1
哈哈哈哈hhhh
select t.srcuser as 中文测试ing from mail t where t.c19 <>'';
中文测试ing

1245
abc def ghi
hhhh465456\
бжb
中文测试1
哈哈哈哈hhhh
select t.srcuser as 中文测试ing from mail t where t.c19 <'';
中文测试ing
select t.srcuser as 中文测试ing from mail t where t.c19 >='';
中文测试ing

1245
abc def ghi
hhhh465456\
бжb
中文测试1
哈哈哈哈hhhh
select t.srcuser as 中文测试ing from mail t where t.c19 in ('');
中文测试ing
select t.srcuser as 中文测试ing from mail t where t.c19 not in ('');
中文测试ing

1245
abc def ghi
hhhh465456\
бжb
中文测试1
哈哈哈哈hhhh
select t.srcuser as 中文测试ing from mail t where t.c19 >='' and t.srcuser <='';
中文测试ing

select t.srcuser as 中文测试ing from mail t where t.c19 >='' or t.srcuser <='';
中文测试ing

1245
abc def ghi
hhhh465456\
бжb
中文测试1
哈哈哈哈hhhh
select t.srcuser as 中文测试ing from mail t where t.c19 like'%';
中文测试ing

1245
abc def ghi
hhhh465456\
бжb
中文测试1
哈哈哈哈hhhh
select t.srcuser as 中文测试ing from mail t where t.c19 ='01245';
中文测试ing
select t.srcuser as 中文测试ing from mail t where t.c19 !='01245';
中文测试ing

1245
abc def ghi
hhhh465456\
бжb
中文测试1
哈哈哈哈hhhh
select t.srcuser as 中文测试ing from mail t where t.c19 <>'01245';
中文测试ing

1245
abc def ghi
hhhh465456\
бжb
中文测试1
哈哈哈哈hhhh
select t.srcuser as 中文测试ing from mail t where t.c19 <'01245';
中文测试ing
select t.srcuser as 中文测试ing from mail t where t.c19 >='01245';
中文测试ing

1245
abc def ghi
hhhh465456\
бжb
中文测试1
哈哈哈哈hhhh
select t.srcuser as 中文测试ing from mail t where t.c19 in ('01245');
中文测试ing
select t.srcuser as 中文测试ing from mail t where t.c19 not in ('01245');
中文测试ing

1245
abc def ghi
hhhh465456\
бжb
中文测试1
哈哈哈哈hhhh
select t.srcuser as 中文测试ing from mail t where t.c19 >='01245' and t.srcuser <='01245';
中文测试ing

select t.srcuser as 中文测试ing from mail t where t.c19 >='01245' or t.srcuser <='01245';
中文测试ing

1245
abc def ghi
hhhh465456\
бжb
中文测试1
哈哈哈哈hhhh
select t.srcuser as 中文测试ing from mail t where t.c19 like'01245%';
中文测试ing
SELECT c18,c19,srcuser, COUNT(*) FROM  mail GROUP BY srcuser having COUNT(*) >1;
c18	c19	srcuser	COUNT(*)
SELECT c18,c19,srcuser, COUNT(*) FROM  mail GROUP BY srcuser,c18,c19 having COUNT(*) >1;
c18	c19	srcuser	COUNT(*)
SELECT ROUND( MAX( t ) ) FROM mail WHERE c18 = ( LENGTH( SUBSTR( '中文测试1' , 1, 20) ) ) GROUP BY t,c18 HAVING MAX( t ) < 172 ORDER BY c18;
ROUND( MAX( t ) )
Warnings:
Warning	1292	Truncated incorrect DECIMAL value: 'abc def ghi'
Warning	1292	Truncated incorrect DECIMAL value: 'hhhh465456\'
Warning	1292	Truncated incorrect DECIMAL value: 'бжb'
Warning	1292	Truncated incorrect DECIMAL value: '中文测试1'
Warning	1292	Truncated incorrect DECIMAL value: '哈哈哈哈hhhh'
drop table if exists mail2;
create table mail2
(
t2 int,
srcuser2 varchar(100) primary key,
srchost2 char(200),
dstuser2 varchar(200),
dsthost2 char(200),
size2 int
);
alter table mail2 drop column c20;
ALTER TABLE mail2 ADD c20 varchar(200) GENERATED ALWAYS AS (cast(srcuser2 as CHAR)) VIRTUAL;
alter table mail2 drop column c21;
ALTER TABLE mail2 ADD c21 varchar(200) GENERATED ALWAYS AS (cast(srcuser2 as CHAR)) VIRTUAL;
insert into mail2(t2,srcuser2,srchost2,dstuser2,dsthost2,size2) values(1,'中文测试1','中文测试2','中文测试3','中文测试4',100);
insert into mail2(t2,srcuser2,srchost2,dstuser2,dsthost2,size2) values(3,01245,'中文测试9','中文测试10','中文测试11',300);
insert into mail2(t2,srcuser2,srchost2,dstuser2,dsthost2,size2) values(4,'','中文测试12','中文测试13','中文测试14',400);
insert into mail2(t2,srcuser2,srchost2,dstuser2,dsthost2,size2) values(5,'哈哈哈哈','中文测试12','中文测试13','中文测试14',500);
insert into mail2(t2,srcuser2,srchost2,dstuser2,dsthost2,size2) values(6,'hahaha','中文测试12','中文测试13','中文测试14',600);
insert into mail2(t2,srcuser2,srchost2,dstuser2,dsthost2,size2) values(7,'','','中文测试13','中文测试14',600);
ERROR 23000: Duplicate entry '' for key 'PRIMARY'
count(*)
3
count(*)
7
count(*)
5
count(*)
4
count(*)
2
count(*)
5
7
count(*)
2
4
count(*)
1
t	srcuser	srchost	dstuser	dsthost	tablesize	c18	c19	t2	srcuser2	srchost2	dstuser2	dsthost2	size2	c20	c21
1	中文测试1	中文测试2	中文测试3	中文测试4	100.00	中文测试1	中文测试3	1	中文测试1	中文测试2	中文测试3	中文测试4	100	中文测试1	中文测试1
count(*)
1
t	srcuser	srchost	dstuser	dsthost	tablesize	c18	c19	t2	srcuser2	srchost2	dstuser2	dsthost2	size2	c20	c21
7	abc def ghi	中文测试12	中文测试13	中文测试14	700.00	abc def ghi	中文测试13	NULL	NULL	NULL	NULL	NULL	NULL	NULL	NULL
6	hhhh465456\	中文测试12	中文测试13	中文测试14	600.00	hhhh465456\	中文测试13	NULL	NULL	NULL	NULL	NULL	NULL	NULL	NULL
9	бжb	中文测试12	中文测试13	中文测试14	900.00	бжb	中文测试13	NULL	NULL	NULL	NULL	NULL	NULL	NULL	NULL
5	哈哈哈哈hhhh	中文测试12	中文测试13	中文测试14	500.00	哈哈哈哈hhhh	中文测试13	NULL	NULL	NULL	NULL	NULL	NULL	NULL	NULL
c18
abc def ghi
hhhh465456\
бжb
哈哈哈哈hhhh
count(*)
0
t	srcuser	srchost	dstuser	dsthost	tablesize	c18	c19	t2	srcuser2	srchost2	dstuser2	dsthost2	size2	c20	c21
NULL	NULL	NULL	NULL	NULL	NULL	NULL	NULL	6	hahaha	中文测试12	中文测试13	中文测试14	600	hahaha	hahaha
NULL	NULL	NULL	NULL	NULL	NULL	NULL	NULL	5	哈哈哈哈	中文测试12	中文测试13	中文测试14	500	哈哈哈哈	哈哈哈哈
t	srcuser	srchost	dstuser	dsthost	tablesize	c18	c19	t2	srcuser2	srchost2	dstuser2	dsthost2	size2	c20	c21
count(*)
2
count(*)
1
7
count(*)
0
4
count(*)
0
t	srcuser	srchost	dstuser	dsthost	tablesize	c18	c19	t2	srcuser2	srchost2	dstuser2	dsthost2	size2	c20	c21
count(*)
0
t	srcuser	srchost	dstuser	dsthost	tablesize	c18	c19	t2	srcuser2	srchost2	dstuser2	dsthost2	size2	c20	c21
4		中文测试12	中文测试13	中文测试14	400.00		中文测试13	NULL	NULL	NULL	NULL	NULL	NULL	NULL	NULL
3	1245	中文测试9	中文测试10	中文测试11	300.00	1245	中文测试10	NULL	NULL	NULL	NULL	NULL	NULL	NULL	NULL
7	abc def ghi	中文测试12	中文测试13	中文测试14	700.00	abc def ghi	中文测试13	NULL	NULL	NULL	NULL	NULL	NULL	NULL	NULL
6	hhhh465456\	中文测试12	中文测试13	中文测试14	600.00	hhhh465456\	中文测试13	NULL	NULL	NULL	NULL	NULL	NULL	NULL	NULL
9	бжb	中文测试12	中文测试13	中文测试14	900.00	бжb	中文测试13	NULL	NULL	NULL	NULL	NULL	NULL	NULL	NULL
1	中文测试1	中文测试2	中文测试3	中文测试4	100.00	中文测试1	中文测试3	NULL	NULL	NULL	NULL	NULL	NULL	NULL	NULL
5	哈哈哈哈hhhh	中文测试12	中文测试13	中文测试14	500.00	哈哈哈哈hhhh	中文测试13	NULL	NULL	NULL	NULL	NULL	NULL	NULL	NULL
c18
abc def ghi
бжb
哈哈哈哈hhhh
hhhh465456\
count(*)
0
t	srcuser	srchost	dstuser	dsthost	tablesize	c18	c19	t2	srcuser2	srchost2	dstuser2	dsthost2	size2	c20	c21
NULL	NULL	NULL	NULL	NULL	NULL	NULL	NULL	6	hahaha	中文测试12	中文测试13	中文测试14	600	hahaha	hahaha
NULL	NULL	NULL	NULL	NULL	NULL	NULL	NULL	5	哈哈哈哈	中文测试12	中文测试13	中文测试14	500	哈哈哈哈	哈哈哈哈
t	srcuser	srchost	dstuser	dsthost	tablesize	c18	c19	t2	srcuser2	srchost2	dstuser2	dsthost2	size2	c20	c21
count(*)
5
count(*)
0
7
count(*)
0
7
t	srcuser	srchost	dstuser	dsthost	tablesize	c18	c19	t2	srcuser2	srchost2	dstuser2	dsthost2	size2	c20	c21
7	abc def ghi	中文测试12	中文测试13	中文测试14	700.00	abc def ghi	中文测试13	NULL	NULL	NULL	NULL	NULL	NULL	NULL	NULL
6	hhhh465456\	中文测试12	中文测试13	中文测试14	600.00	hhhh465456\	中文测试13	NULL	NULL	NULL	NULL	NULL	NULL	NULL	NULL
9	бжb	中文测试12	中文测试13	中文测试14	900.00	бжb	中文测试13	NULL	NULL	NULL	NULL	NULL	NULL	NULL	NULL
5	哈哈哈哈hhhh	中文测试12	中文测试13	中文测试14	500.00	哈哈哈哈hhhh	中文测试13	NULL	NULL	NULL	NULL	NULL	NULL	NULL	NULL
count(*)
0
count(*)
7
count(*)
5
count(*)
7
count(*)
5
count(*)
5
7
count(*)
5
7
count(*)
0
t	srcuser	srchost	dstuser	dsthost	tablesize	c18	c19	t2	srcuser2	srchost2	dstuser2	dsthost2	size2	c20	c21
count(*)
0
t	srcuser	srchost	dstuser	dsthost	tablesize	c18	c19	t2	srcuser2	srchost2	dstuser2	dsthost2	size2	c20	c21
4		中文测试12	中文测试13	中文测试14	400.00		中文测试13	NULL	NULL	NULL	NULL	NULL	NULL	NULL	NULL
3	1245	中文测试9	中文测试10	中文测试11	300.00	1245	中文测试10	NULL	NULL	NULL	NULL	NULL	NULL	NULL	NULL
7	abc def ghi	中文测试12	中文测试13	中文测试14	700.00	abc def ghi	中文测试13	NULL	NULL	NULL	NULL	NULL	NULL	NULL	NULL
6	hhhh465456\	中文测试12	中文测试13	中文测试14	600.00	hhhh465456\	中文测试13	NULL	NULL	NULL	NULL	NULL	NULL	NULL	NULL
9	бжb	中文测试12	中文测试13	中文测试14	900.00	бжb	中文测试13	NULL	NULL	NULL	NULL	NULL	NULL	NULL	NULL
1	中文测试1	中文测试2	中文测试3	中文测试4	100.00	中文测试1	中文测试3	NULL	NULL	NULL	NULL	NULL	NULL	NULL	NULL
5	哈哈哈哈hhhh	中文测试12	中文测试13	中文测试14	500.00	哈哈哈哈hhhh	中文测试13	NULL	NULL	NULL	NULL	NULL	NULL	NULL	NULL
c19
中文测试13
中文测试10
中文测试13
中文测试13
中文测试13
中文测试3
中文测试13
count(*)
0
t	srcuser	srchost	dstuser	dsthost	tablesize	c18	c19	t2	srcuser2	srchost2	dstuser2	dsthost2	size2	c20	c21
NULL	NULL	NULL	NULL	NULL	NULL	NULL	NULL	4		中文测试12	中文测试13	中文测试14	400		
NULL	NULL	NULL	NULL	NULL	NULL	NULL	NULL	3	1245	中文测试9	中文测试10	中文测试11	300	1245	1245
NULL	NULL	NULL	NULL	NULL	NULL	NULL	NULL	6	hahaha	中文测试12	中文测试13	中文测试14	600	hahaha	hahaha
NULL	NULL	NULL	NULL	NULL	NULL	NULL	NULL	1	中文测试1	中文测试2	中文测试3	中文测试4	100	中文测试1	中文测试1
NULL	NULL	NULL	NULL	NULL	NULL	NULL	NULL	5	哈哈哈哈	中文测试12	中文测试13	中文测试14	500	哈哈哈哈	哈哈哈哈
t	srcuser	srchost	dstuser	dsthost	tablesize	c18	c19	t2	srcuser2	srchost2	dstuser2	dsthost2	size2	c20	c21
NULL	NULL	NULL	NULL	NULL	NULL	NULL	NULL	1	中文测试1	中文测试2	中文测试3	中文测试4	100	中文测试1	中文测试1
count(*)
5
count(*)
0
7
count(*)
0
7
count(*)
0
t	srcuser	srchost	dstuser	dsthost	tablesize	c18	c19	t2	srcuser2	srchost2	dstuser2	dsthost2	size2	c20	c21
count(*)
0
t	srcuser	srchost	dstuser	dsthost	tablesize	c18	c19	t2	srcuser2	srchost2	dstuser2	dsthost2	size2	c20	c21
4		中文测试12	中文测试13	中文测试14	400.00		中文测试13	NULL	NULL	NULL	NULL	NULL	NULL	NULL	NULL
3	1245	中文测试9	中文测试10	中文测试11	300.00	1245	中文测试10	NULL	NULL	NULL	NULL	NULL	NULL	NULL	NULL
7	abc def ghi	中文测试12	中文测试13	中文测试14	700.00	abc def ghi	中文测试13	NULL	NULL	NULL	NULL	NULL	NULL	NULL	NULL
6	hhhh465456\	中文测试12	中文测试13	中文测试14	600.00	hhhh465456\	中文测试13	NULL	NULL	NULL	NULL	NULL	NULL	NULL	NULL
9	бжb	中文测试12	中文测试13	中文测试14	900.00	бжb	中文测试13	NULL	NULL	NULL	NULL	NULL	NULL	NULL	NULL
1	中文测试1	中文测试2	中文测试3	中文测试4	100.00	中文测试1	中文测试3	NULL	NULL	NULL	NULL	NULL	NULL	NULL	NULL
5	哈哈哈哈hhhh	中文测试12	中文测试13	中文测试14	500.00	哈哈哈哈hhhh	中文测试13	NULL	NULL	NULL	NULL	NULL	NULL	NULL	NULL
c19
中文测试13
中文测试10
中文测试13
中文测试13
中文测试13
中文测试3
中文测试13
count(*)
0
t	srcuser	srchost	dstuser	dsthost	tablesize	c18	c19	t2	srcuser2	srchost2	dstuser2	dsthost2	size2	c20	c21
NULL	NULL	NULL	NULL	NULL	NULL	NULL	NULL	4		中文测试12	中文测试13	中文测试14	400		
NULL	NULL	NULL	NULL	NULL	NULL	NULL	NULL	3	1245	中文测试9	中文测试10	中文测试11	300	1245	1245
NULL	NULL	NULL	NULL	NULL	NULL	NULL	NULL	6	hahaha	中文测试12	中文测试13	中文测试14	600	hahaha	hahaha
NULL	NULL	NULL	NULL	NULL	NULL	NULL	NULL	1	中文测试1	中文测试2	中文测试3	中文测试4	100	中文测试1	中文测试1
NULL	NULL	NULL	NULL	NULL	NULL	NULL	NULL	5	哈哈哈哈	中文测试12	中文测试13	中文测试14	500	哈哈哈哈	哈哈哈哈
t	srcuser	srchost	dstuser	dsthost	tablesize	c18	c19	t2	srcuser2	srchost2	dstuser2	dsthost2	size2	c20	c21
NULL	NULL	NULL	NULL	NULL	NULL	NULL	NULL	1	中文测试1	中文测试2	中文测试3	中文测试4	100	中文测试1	中文测试1
count(*)
0
count(*)
0
17
count(*)
0
7
t	srcuser	srchost	dstuser	dsthost	tablesize	c18	c19	t2	srcuser2	srchost2	dstuser2	dsthost2	size2	c20	c21
4		中文测试12	中文测试13	中文测试14	400.00		中文测试13	NULL	NULL	NULL	NULL	NULL	NULL	NULL	NULL
3	1245	中文测试9	中文测试10	中文测试11	300.00	1245	中文测试10	NULL	NULL	NULL	NULL	NULL	NULL	NULL	NULL
7	abc def ghi	中文测试12	中文测试13	中文测试14	700.00	abc def ghi	中文测试13	NULL	NULL	NULL	NULL	NULL	NULL	NULL	NULL
6	hhhh465456\	中文测试12	中文测试13	中文测试14	600.00	hhhh465456\	中文测试13	NULL	NULL	NULL	NULL	NULL	NULL	NULL	NULL
9	бжb	中文测试12	中文测试13	中文测试14	900.00	бжb	中文测试13	NULL	NULL	NULL	NULL	NULL	NULL	NULL	NULL
1	中文测试1	中文测试2	中文测试3	中文测试4	100.00	中文测试1	中文测试3	NULL	NULL	NULL	NULL	NULL	NULL	NULL	NULL
5	哈哈哈哈hhhh	中文测试12	中文测试13	中文测试14	500.00	哈哈哈哈hhhh	中文测试13	NULL	NULL	NULL	NULL	NULL	NULL	NULL	NULL
select t.c18 as 生成列1,t.c19 as 生成列2 from mail t order by t.c18;
生成列1	生成列2
	中文测试13
1245	中文测试10
abc def ghi	中文测试13
hhhh465456\	中文测试13
бжb	中文测试13
中文测试1	中文测试3
哈哈哈哈hhhh	中文测试13
select t.c20 as 生成列1,t.c21 as 生成列2 from mail2 t order by t.c20;
生成列1	生成列2
	
1245	1245
hahaha	hahaha
中文测试1	中文测试1
哈哈哈哈	哈哈哈哈
SELECT * FROM  (SELECT * from mail e RIGHT JOIN mail2 d on e.c19 = d.c21 WHERE e.c19 is NULL and d.c21 like '中文测%') E;
t	srcuser	srchost	dstuser	dsthost	tablesize	c18	c19	t2	srcuser2	srchost2	dstuser2	dsthost2	size2	c20	c21
NULL	NULL	NULL	NULL	NULL	NULL	NULL	NULL	1	中文测试1	中文测试2	中文测试3	中文测试4	100	中文测试1	中文测试1
select concat(t.c18,t.c19) from mail t where concat(t.c18,t.c19) like '哈哈哈哈hhhh中文%';
concat(t.c18,t.c19)
哈哈哈哈hhhh中文测试13
select distinct(concat(t.c18,t.c19)) from mail t where concat(t.c18,t.c19) like '哈哈哈哈hhhh中文%';
(concat(t.c18,t.c19))
哈哈哈哈hhhh中文测试13
select distinct(t.c18) from mail t where concat(t.c18,t.c19) like '哈哈哈哈hhhh中文%';
c18
哈哈哈哈hhhh
select avg(t.c18) from mail t where concat(t.c18,t.c19) like '哈哈哈哈hhhh中文%';
avg(t.c18)
0
Warnings:
Warning	1292	Truncated incorrect DOUBLE value: '哈哈哈哈hhhh'
drop table if exists mail;
drop table if exists mail2;
drop table if exists mail4;
create table mail4
(
c0 int,
c1 varchar(200),
c2 varchar(20),
c3 blob,
c4 TEXT,
c5 date,
c6 timestamp,
c7 char(200),
c8 CHAR(200)
);
insert into mail4 values(1,'中文测试001','中文测试001','aaabbb','中文测试1','2006-06-04','20060604','a','bb');
insert into mail4 values(2,'中文测试002','中文测试002','aaabbb','中文测试002','2006-06-04','20060604','c','ee');
insert into mail4 values(3,'中文测试003','中文测试001','aaabbb','中文测试003','2006-06-04','20060604','d','ff');
insert into mail4 values(4,'aaabbb','中文测试001','aaabbb','中文测试1','2006-06-04','20060604','a','cc');
insert into mail4 values(5,'a','中文测试001','aaabbb','中文测试1','2006-06-04','20060604','a','bb');
insert into mail4 values(6,'bb','中文测试001','aaabbb','中文测试1','2006-06-04','20060604','a','bb');
insert into mail4 values(7,'20060604','20060604','aaabbb','中文测试1','2006-06-04','20060604','a','bb');
insert into mail4 values(8,'2006-06-04','aaabbb','aaabbb','中文测试1','2006-06-04','20060604','a','bb');
insert into mail4 values(9,'中文测试009','aaabbb','200','中文测试1','2006-06-04','20060604','a','200');
insert into mail4 values(10,'中文测试010','aaabbb','300','中文测试1','2006-06-04','20060604','a','300');
drop table if exists mailbakup;
create table mailbakup
(
c0 int,
c1 varchar(200),
c2 varchar(20),
c3 blob,
c4 TEXT,
c5 date,
c6 timestamp,
c7 char(200),
c8 CHAR(200)
);
alter table mailbakup drop column c20;
ALTER TABLE mailbakup ADD c20 varchar(200) GENERATED ALWAYS AS (cast(c1 as char)) VIRTUAL;
insert into mailbakup(c0,c1,c2,c3,c4,c5,c6,c7,c8) select * from mail4;
select * from mailbakup;
c0	c1	c2	c3	c4	c5	c6	c7	c8	c20
1	中文测试001	中文测试001	aaabbb	中文测试1	2006-06-04	2006-06-04 00:00:00	a	bb	中文测试001
2	中文测试002	中文测试002	aaabbb	中文测试002	2006-06-04	2006-06-04 00:00:00	c	ee	中文测试002
3	中文测试003	中文测试001	aaabbb	中文测试003	2006-06-04	2006-06-04 00:00:00	d	ff	中文测试003
4	aaabbb	中文测试001	aaabbb	中文测试1	2006-06-04	2006-06-04 00:00:00	a	cc	aaabbb
5	a	中文测试001	aaabbb	中文测试1	2006-06-04	2006-06-04 00:00:00	a	bb	a
6	bb	中文测试001	aaabbb	中文测试1	2006-06-04	2006-06-04 00:00:00	a	bb	bb
7	20060604	20060604	aaabbb	中文测试1	2006-06-04	2006-06-04 00:00:00	a	bb	20060604
8	2006-06-04	aaabbb	aaabbb	中文测试1	2006-06-04	2006-06-04 00:00:00	a	bb	2006-06-04
9	中文测试009	aaabbb	200	中文测试1	2006-06-04	2006-06-04 00:00:00	a	200	中文测试009
10	中文测试010	aaabbb	300	中文测试1	2006-06-04	2006-06-04 00:00:00	a	300	中文测试010
SELECT e.c1,count(e.c2) from mailbakup e INNER JOIN mailbakup d on e.c20 = d.c20 where e.c1 = d.c1 and e.c1 ='中文测试1' group by e.c1 having count(e.c20) > 1 order by e.c1;
c1	count(e.c2)
update mailbakup t set t.c20 = '中文测试xxx' where t.c2 = '中文测试001';
ERROR HY000: The value specified for generated column 'c20' in table 't' is not allowed
update mailbakup t set t.c20 = '中文测试yyy' where t.c1 in ('a','aaabbb');
ERROR HY000: The value specified for generated column 'c20' in table 't' is not allowed
update (select e.c1 c1old,e.c20 c2new from mailbakup e where e.c1 = 'bb') set c1old = c2new;
ERROR HY000: The target table ANONYMOUS_VIEW1 of the UPDATE is not updatable
update mailbakup t set (t.c1,t.c20) = (select e.c1,e.c20 from mailbakup e where e.c1 = 'a') where t.c1 = 'a';
ERROR 42000: You have an error in your SQL syntax; check the manual that corresponds to your OceanBase version for the right syntax to use near '(t.c1,t.c20) = (select e.c1,e.c20 from mailbakup e where e.c1 = 'a') where t.c1 ' at line 1
select * from mailbakup e where e.c20 = '中文测试001';
c0	c1	c2	c3	c4	c5	c6	c7	c8	c20
1	中文测试001	中文测试001	aaabbb	中文测试1	2006-06-04	2006-06-04 00:00:00	a	bb	中文测试001
drop table mailbakup;
drop table mail4;
########清空回收站，删除测试数据库，表等 ##########
drop database  IF EXISTS  ob35x;
