create table t1(pk int primary key, c1 int,c2 int);
create index ia on t1(c1);
insert into t1 values(1,9,1),(2,8,2),(3,7,3),(4,6,6),(5,5,5);
alter system major freeze tenant = sys;
alter system major freeze tenant = all_user;
alter system major freeze tenant = all_meta;
select * from t1 where c1 between 0 and 10;
pk	c1	c2
5	5	5
4	6	6
3	7	3
2	8	2
1	9	1
select * from t1 where c1 between length('') and length('0123456789');
pk	c1	c2
5	5	5
4	6	6
3	7	3
2	8	2
1	9	1
select * from t1 where length('') <= c1 and length('0123456789') >= c1;
pk	c1	c2
5	5	5
4	6	6
3	7	3
2	8	2
1	9	1
select * from t1 where length('') <= c1 and c1<=10;
pk	c1	c2
5	5	5
4	6	6
3	7	3
2	8	2
1	9	1
select * from t1 where c1>=0 and length('0123456789') >= c1;
pk	c1	c2
5	5	5
4	6	6
3	7	3
2	8	2
1	9	1
select * from t1 where c1 >= length('') and c1 <= length('0123456789');
pk	c1	c2
5	5	5
4	6	6
3	7	3
2	8	2
1	9	1
select * from t1 where c1>= '0' and c1<= '10';
pk	c1	c2
5	5	5
4	6	6
3	7	3
2	8	2
1	9	1
select * from t1 where c1>= substr('a0a000',2,1) and c1<= substr('10a0000',1,2);
pk	c1	c2
5	5	5
4	6	6
3	7	3
2	8	2
1	9	1
select * from t1 where c1>= cast(substr('a0a000',2,1)  as signed int) and c1<= cast(substr('10a0000',1,2) as signed int);
pk	c1	c2
5	5	5
4	6	6
3	7	3
2	8	2
1	9	1
select /*+ index(t1 primary) */* from t1 where c1>= '0' and c1<= '10';
pk	c1	c2
1	9	1
2	8	2
3	7	3
4	6	6
5	5	5
select /*+ index(t1 ia) */* from t1 where c1>= '0' and c1<= '10';
pk	c1	c2
5	5	5
4	6	6
3	7	3
2	8	2
1	9	1
select /*+ index(t1 primary) */* from t1 where c1>= substr('a0a000',2,1) and c1<= substr('10a0000',1,2);
pk	c1	c2
1	9	1
2	8	2
3	7	3
4	6	6
5	5	5
select /*+ index(t1 ia) */* from t1 where c1>= substr('a0a000',2,1) and c1<= substr('10a0000',1,2);
pk	c1	c2
5	5	5
4	6	6
3	7	3
2	8	2
1	9	1
update t1 set c1=2 where c1=length('01234567');
select * from t1 ;
pk	c1	c2
1	9	1
2	2	2
3	7	3
4	6	6
5	5	5
update t1 set c1=2 where c1=length('01');
select * from t1 where c1 between 1 and 10 ;
pk	c1	c2
2	2	2
5	5	5
4	6	6
3	7	3
1	9	1
update t1 set c1=2 where c1=length('01');
select * from t1 where c1 between 5-4 and 5*2;
pk	c1	c2
2	2	2
5	5	5
4	6	6
3	7	3
1	9	1
select c1   from t1 where c1=length('01');
c1
2
select * from t1 where c1 between 5-4 and 5*2;
pk	c1	c2
2	2	2
5	5	5
4	6	6
3	7	3
1	9	1
update t1 set c1=8 where c1=length('01');
update t1 set c1=3 where c1=length('0123456');
select * from t1;
pk	c1	c2
1	9	1
2	8	2
3	3	3
4	6	6
5	5	5
