result_format: 4
drop table if exists t0, t1, t2, gen_t;
create table t1(a int primary key, b int, c int, index i1(b));
insert into t1 values(1, 1, 1);
select /*+index(t1 i1)*/ a, b from t1 where b=1;
+---+------+
| a | b    |
+---+------+
| 1 |    1 |
+---+------+
select /*+index(t1 i1)*/ a, b, c from t1 where b=1;
+---+------+------+
| a | b    | c    |
+---+------+------+
| 1 |    1 |    1 |
+---+------+------+
select /*+index(t1 i1)*/ a, b, c from t1 where b=1 and a=0;
+---+------+------+
| a | b    | c    |
+---+------+------+
+---+------+------+
select /*+index(t1 i1)*/ a, b, c from t1 where b=1 and c=1;
+---+------+------+
| a | b    | c    |
+---+------+------+
| 1 |    1 |    1 |
+---+------+------+
select /*+index(t1 i1)*/ a, b, c from t1 where b=1 and c=0;
+---+------+------+
| a | b    | c    |
+---+------+------+
+---+------+------+
drop table t1;

create table t1(a int, b int, c int, d int, e int, primary key(a,b,c,d), key k1(b) local, key k2(c,b) local, key k3(c,d,b) local) partition by hash(b) partitions 2;
insert into t1 values(1,1,1,1,1),(2,2,2,2,2),(3,3,3,3,3),(4,4,4,4,4),(5,5,5,5,5),(6,6,6,6,6),(7,7,7,7,7),(8,8,8,8,8),(9,9,9,9,9),(10,10,10,10,10);
select/*+index(t1 primary)*/ * from t1 where a in (1,2,3,4,5) order by a,b,c,d;
+---+---+---+---+------+
| a | b | c | d | e    |
+---+---+---+---+------+
| 1 | 1 | 1 | 1 |    1 |
| 2 | 2 | 2 | 2 |    2 |
| 3 | 3 | 3 | 3 |    3 |
| 4 | 4 | 4 | 4 |    4 |
| 5 | 5 | 5 | 5 |    5 |
+---+---+---+---+------+
select/*+index(t1 k1)*/ * from t1 where b in (1,2,3,4,5) order by a,b,c,d;
+---+---+---+---+------+
| a | b | c | d | e    |
+---+---+---+---+------+
| 1 | 1 | 1 | 1 |    1 |
| 2 | 2 | 2 | 2 |    2 |
| 3 | 3 | 3 | 3 |    3 |
| 4 | 4 | 4 | 4 |    4 |
| 5 | 5 | 5 | 5 |    5 |
+---+---+---+---+------+
select/*+index(t1 k2)*/ * from t1 where (c,b) in ((1,1),(2,2),(3,3),(4,4),(5,5)) order by a,b,c,d;
+---+---+---+---+------+
| a | b | c | d | e    |
+---+---+---+---+------+
| 1 | 1 | 1 | 1 |    1 |
| 2 | 2 | 2 | 2 |    2 |
| 3 | 3 | 3 | 3 |    3 |
| 4 | 4 | 4 | 4 |    4 |
| 5 | 5 | 5 | 5 |    5 |
+---+---+---+---+------+
select/*+index(t1 k3)*/ * from t1 where (c,b) in ((1,1),(2,2),(3,3),(4,4),(5,5)) order by a,b,c,d;
+---+---+---+---+------+
| a | b | c | d | e    |
+---+---+---+---+------+
| 1 | 1 | 1 | 1 |    1 |
| 2 | 2 | 2 | 2 |    2 |
| 3 | 3 | 3 | 3 |    3 |
| 4 | 4 | 4 | 4 |    4 |
| 5 | 5 | 5 | 5 |    5 |
+---+---+---+---+------+
select/*+index(t1 k3)*/ * from t1 where (c,d,b) in ((1,1,1),(2,2,2),(3,3,3),(4,4,4),(5,5,5)) order by a,b,c,d;
+---+---+---+---+------+
| a | b | c | d | e    |
+---+---+---+---+------+
| 1 | 1 | 1 | 1 |    1 |
| 2 | 2 | 2 | 2 |    2 |
| 3 | 3 | 3 | 3 |    3 |
| 4 | 4 | 4 | 4 |    4 |
| 5 | 5 | 5 | 5 |    5 |
+---+---+---+---+------+
drop table t1;

create table gen_t(a int, b int, c int generated always as (a+1), d int);
insert into gen_t(a,b,d) values(1,1,1);
update gen_t set a=1, d=0;
select * from gen_t;
+------+------+------+------+
| a    | b    | c    | d    |
+------+------+------+------+
|    1 |    1 |    2 |    0 |
+------+------+------+------+
drop table gen_t;

create table t1(a int primary key, b int, c int generated always as (a+1), d int);
insert into t1(a,b,d) values(1,1,1);
update t1 set a=1, d=0 where a=1;
select * from t1;
+---+------+------+------+
| a | b    | c    | d    |
+---+------+------+------+
| 1 |    1 |    2 |    0 |
+---+------+------+------+
drop table t1;

create table t1 (c1 int, c2 int, c3 int,c4 int, primary key(c1,c2));
create index i1 on t1(c3) storing(c4);
insert into t1 values(1,1,1,1),(2,2,2,2);
insert into t1 values(3,100,100,100),(4,100,100,100);
insert into t1(c1,c2) values(5,100),(6,100);
insert into t1(c1,c2) values(6,200),(6,300);
insert into t1(c1,c2) values(7,100),(8,100);
select * from t1;
+----+-----+------+------+
| c1 | c2  | c3   | c4   |
+----+-----+------+------+
|  1 |   1 |    1 |    1 |
|  2 |   2 |    2 |    2 |
|  3 | 100 |  100 |  100 |
|  4 | 100 |  100 |  100 |
|  5 | 100 | NULL | NULL |
|  6 | 100 | NULL | NULL |
|  6 | 200 | NULL | NULL |
|  6 | 300 | NULL | NULL |
|  7 | 100 | NULL | NULL |
|  8 | 100 | NULL | NULL |
+----+-----+------+------+
select /*+index(t1 i1)*/ c1, c2, c3, c4 from t1;
+----+-----+------+------+
| c1 | c2  | c3   | c4   |
+----+-----+------+------+
|  1 |   1 |    1 |    1 |
|  2 |   2 |    2 |    2 |
|  3 | 100 |  100 |  100 |
|  4 | 100 |  100 |  100 |
|  5 | 100 | NULL | NULL |
|  6 | 100 | NULL | NULL |
|  6 | 200 | NULL | NULL |
|  6 | 300 | NULL | NULL |
|  7 | 100 | NULL | NULL |
|  8 | 100 | NULL | NULL |
+----+-----+------+------+
drop table t1;

create table t1(a int primary key, b int, index i1(b));
insert into t1 values(1, 1);
select /*+index(t1 i1)*/ a, b from t1 where b=1;
+---+------+
| a | b    |
+---+------+
| 1 |    1 |
+---+------+
update /*+index(t1 i1)*/ t1 set a=2 where b=1;
select /*+index(t1 i1)*/ * from t1 where b=1 for update;
+---+------+
| a | b    |
+---+------+
| 2 |    1 |
+---+------+
drop table t1;

create table t1(a int, b int, c int, d int, e int, primary key(a), key k1(b) local, key k2(c,b) local, key k3(c,d,b) local);
insert into t1 values(1,1,1,1,1),(2,2,2,2,2),(3,3,3,3,3),(4,4,4,4,4),(5,5,5,5,5),(6,6,6,6,6),(7,7,7,7,7),(8,8,8,8,8),(9,9,9,9,9),(10,10,10,10,10);
alter system set_tp tp_no = 400, error_code = 3, frequency = 1;
select /*+index(t1 k1)*/ * from t1 where a>1;
+----+------+------+------+------+
| a  | b    | c    | d    | e    |
+----+------+------+------+------+
|  2 |    2 |    2 |    2 |    2 |
|  3 |    3 |    3 |    3 |    3 |
|  4 |    4 |    4 |    4 |    4 |
|  5 |    5 |    5 |    5 |    5 |
|  6 |    6 |    6 |    6 |    6 |
|  7 |    7 |    7 |    7 |    7 |
|  8 |    8 |    8 |    8 |    8 |
|  9 |    9 |    9 |    9 |    9 |
| 10 |   10 |   10 |   10 |   10 |
+----+------+------+------+------+
select /*+index(t1 k1)*/ * from t1 where a>1 limit 2;
+---+------+------+------+------+
| a | b    | c    | d    | e    |
+---+------+------+------+------+
| 2 |    2 |    2 |    2 |    2 |
| 3 |    3 |    3 |    3 |    3 |
+---+------+------+------+------+
select /*+index(t1 k1)*/ * from t1 where b>1 limit 2;
+---+------+------+------+------+
| a | b    | c    | d    | e    |
+---+------+------+------+------+
| 2 |    2 |    2 |    2 |    2 |
| 3 |    3 |    3 |    3 |    3 |
+---+------+------+------+------+
select /*+index(t1 k2)*/ * from t1 where b>1 limit 2;
+---+------+------+------+------+
| a | b    | c    | d    | e    |
+---+------+------+------+------+
| 2 |    2 |    2 |    2 |    2 |
| 3 |    3 |    3 |    3 |    3 |
+---+------+------+------+------+
select /*+index(t1 k1)*/ * from t1 where d>1 limit 2;
+---+------+------+------+------+
| a | b    | c    | d    | e    |
+---+------+------+------+------+
| 2 |    2 |    2 |    2 |    2 |
| 3 |    3 |    3 |    3 |    3 |
+---+------+------+------+------+
select /*+index(t1 k3)*/ * from t1 where d>1 limit 2;
+---+------+------+------+------+
| a | b    | c    | d    | e    |
+---+------+------+------+------+
| 2 |    2 |    2 |    2 |    2 |
| 3 |    3 |    3 |    3 |    3 |
+---+------+------+------+------+
alter system set_tp tp_no = 400, error_code = 0, frequency = 1;
alter system set _rowsets_max_rows = 8;
select /*+index(t1 k1)*/ * from t1 where a>1 limit 2;
+---+------+------+------+------+
| a | b    | c    | d    | e    |
+---+------+------+------+------+
| 2 |    2 |    2 |    2 |    2 |
| 3 |    3 |    3 |    3 |    3 |
+---+------+------+------+------+
select /*+index(t1 k1)*/ * from t1 where b>1 limit 2;
+---+------+------+------+------+
| a | b    | c    | d    | e    |
+---+------+------+------+------+
| 2 |    2 |    2 |    2 |    2 |
| 3 |    3 |    3 |    3 |    3 |
+---+------+------+------+------+
select /*+index(t1 k2)*/ * from t1 where b>1 limit 2;
+---+------+------+------+------+
| a | b    | c    | d    | e    |
+---+------+------+------+------+
| 2 |    2 |    2 |    2 |    2 |
| 3 |    3 |    3 |    3 |    3 |
+---+------+------+------+------+
select /*+index(t1 k1)*/ * from t1 where d>1 limit 2;
+---+------+------+------+------+
| a | b    | c    | d    | e    |
+---+------+------+------+------+
| 2 |    2 |    2 |    2 |    2 |
| 3 |    3 |    3 |    3 |    3 |
+---+------+------+------+------+
select /*+index(t1 k3)*/ * from t1 where d>1 limit 2;
+---+------+------+------+------+
| a | b    | c    | d    | e    |
+---+------+------+------+------+
| 2 |    2 |    2 |    2 |    2 |
| 3 |    3 |    3 |    3 |    3 |
+---+------+------+------+------+
alter system set _rowsets_max_rows = 256;
drop table t1;

CREATE TABLE `t0` (   `c0` mediumint(9) DEFAULT NULL,   `c1` smallint(69) DEFAULT NULL,   UNIQUE KEY `c1` (`c1`) BLOCK_SIZE 16384 LOCAL,   KEY `i300` (`c0`, `c1`) BLOCK_SIZE 16384 GLOBAL  partition by hash(c0) (partition p0, partition p1, partition p2, partition p3, partition p4, partition p5, partition p6, partition p7, partition p8, partition p9, partition p10, partition p11, partition p12, partition p13, partition p14, partition p15, partition p16, partition p17) ) DEFAULT CHARSET = utf8mb4 ROW_FORMAT = DYNAMIC COMPRESSION = 'lz4_1.0' REPLICA_NUM = 1 BLOCK_SIZE = 16384 USE_BLOOM_FILTER = FALSE TABLET_SIZE = 134217728 PCTFREE = 0  partition by hash(c1) (partition p0, partition p1, partition p2, partition p3, partition p4, partition p5, partition p6, partition p7, partition p8, partition p9, partition p10, partition p11, partition p12, partition p13, partition p14, partition p15, partition p16, partition p17, partition p18);
insert into t0 values (NULL,-1),(NULL,0),(0,NULL),(-1,NULL),(5608353,NULL);
CREATE TABLE `t1` (   `c0` mediumint(9) DEFAULT NULL,   `c1` smallint(69) DEFAULT NULL ) DEFAULT CHARSET = utf8mb4 ROW_FORMAT = DYNAMIC COMPRESSION = 'zstd_1.3.8' REPLICA_NUM = 1 BLOCK_SIZE = 16384 USE_BLOOM_FILTER = FALSE TABLET_SIZE = 134217728 PCTFREE = 0  partition by hash(c1) (partition p0, partition p1, partition p2, partition p3, partition p4, partition p5, partition p6, partition p7, partition p8, partition p9, partition p10, partition p11, partition p12, partition p13, partition p14, partition p15, partition p16, partition p17, partition p18);
insert into t1 values (-3374633,NULL),(0,NULL),(5608353,NULL),(5608353,NULL),(-1,NULL),(0,NULL),(1,NULL),(-1,NULL),(-2984123,NULL),(0,NULL),(0,NULL),(1,NULL),(5608353,NULL),(1,NULL),(-1,NULL),(5608353,NULL),(-1,NULL),(0,NULL),(-1,NULL),(1,NULL),(1,NULL),(4111626,NULL),(0,NULL),(5273196,NULL),(5608353,NULL),(5608353,NULL),(-1,NULL),(0,NULL),(NULL,0),(-686674,NULL),(-7365184,NULL),(5608353,NULL),(1,NULL),(0,NULL),(5608353,NULL),(-7289883,NULL),(1,NULL),(7875961,NULL),(NULL,0),(NULL,0),(5608353,NULL),(-1,NULL),(NULL,0),(-1,NULL),(5608353,NULL),(0,NULL),(5608353,NULL),(1,NULL),(0,NULL),(-6472305,NULL),(1,NULL),(-1,NULL),(6700529,NULL),(0,NULL),(NULL,1),(NULL,-1),(NULL,-1),(NULL,-1),(0,-1),(NULL,-1);
CREATE TABLE `t2` (   `c0` mediumint(9) DEFAULT NULL,   `c1` smallint(69) DEFAULT NULL,   UNIQUE KEY `c1` (`c1`) BLOCK_SIZE 16384 LOCAL ) DEFAULT CHARSET = utf8mb4 ROW_FORMAT = DYNAMIC COMPRESSION = 'none' REPLICA_NUM = 1 BLOCK_SIZE = 16384 USE_BLOOM_FILTER = FALSE TABLET_SIZE = 134217728 PCTFREE = 0  partition by hash(c1) (partition p0, partition p1, partition p2, partition p3, partition p4, partition p5, partition p6, partition p7, partition p8, partition p9, partition p10, partition p11, partition p12, partition p13, partition p14, partition p15, partition p16, partition p17, partition p18);
insert into t2 values (1,NULL),(1,NULL),(0,NULL),(5608353,NULL),(-1,NULL),(1,NULL),(0,NULL),(0,NULL),(-1,NULL),(1,NULL),(5608353,NULL),(-1,NULL),(4607494,NULL),(1,NULL),(-1,NULL),(-1,NULL),(5608353,NULL),(1,NULL),(5608353,NULL),(0,NULL),(5608353,NULL),(1,NULL),(5608353,NULL),(-1,NULL),(6219124,NULL),(1,NULL),(-1121542,NULL),(5608353,NULL),(0,NULL),(0,NULL),(0,NULL),(1,NULL),(5608353,NULL),(5608353,NULL),(0,NULL),(1,NULL),(1,NULL),(-1,NULL),(-1,NULL),(5608353,NULL),(NULL,0),(5608353,NULL),(-2527028,NULL),(5608353,NULL),(-7602513,NULL),(0,NULL),(0,NULL),(1,NULL),(0,NULL),(-2223660,NULL),(826760,NULL),(NULL,1),(NULL,-1);
SELECT count(*) as rowCount FROM (SELECT DISTINCT t0.c0 AS t0c0, t0.c1 AS t0c1, t2.c0 AS t2c0, t2.c1 AS t2c1, t1.c0 AS t1c0, t1.c1 AS t1c1 FROM t0, t2, t1 WHERE ((+ (t1.c1))) IS NULL ORDER BY t1.c0 ASC, t2.c1 DESC) as result WHERE result.t0c0 = FALSE AND result.t0c1 IS NULL AND result.t2c0 IS NULL AND result.t2c1 = FALSE AND result.t1c0 = 5608353 AND result.t1c1 IS NULL;
+----------+
| rowCount |
+----------+
|        1 |
+----------+
SELECT /*+ USE_HASH (t1, t2) */ ALL t2.c0 FROM t1,  t2 LEFT  OUTER JOIN t0 ON (t0.c0) = (t2.c0) WHERE (t0.c1) = (t2.c0);
+------+
| c0   |
+------+
+------+
drop table t0;
drop table t1;
drop table t2;

bugfix:
## table_name
drop table `t1```;

create table `t1```(c1 int);
insert into `t1``` values (1);
create index i1 on `t1```(c1);
drop table `t1```;

## index_name
create table t1(c1 int);
insert into t1 values (1);
create index `i1``` on t1(c1);
drop table t1;

create table if not exists `ｔ９` ( `Ｃ１` char(5) ) default charset=utf8mb4 default collate=utf8mb4_general_ci;
create index `Ｃ１` on `ｔ９` (`Ｃ１` ASC) ;
drop table `ｔ９`;

## database
drop database `d1```;
create database `d1```;
use `d1```;
create table t1(c1 int);
insert into t1 values (1);
create index i1 on t1(c1);
drop database `d1```;
