drop table if exists t1;
drop table if exists t2;
create table t1 (c1 int, c2 varchar(20), c3 date, c4 varchar(200), c5 int, primary key(c1,c2)) partition by key(c2) partitions 4;
create unique index idx_c3 on t1(c3) global;
create unique index idx_c4 on t1(c4) global;
create index c5_idx_01 on t1(c5) partition by hash(c5) partitions 3;
insert into t1 values(1, 'aaa', '2020-01-01', 'aa', 1), (2, 'bbb', '2020-2-2', 'bb', 2), (4, 'ddd', '2020-4-4', 'dd',4),(6,'fff', '2020-6-6', 'ff',6),(8,'hhh','2020-8-8', 'hh',8);
insert into t1 values(1, 'aaa-2', '2020-02-01', 'aa', 100), (4, 'ddd', '2020-4-14', 'dd-2',400),(5, 'eee', '2020-5-5', 'ee', 5),(6, 'fff-2', '2020-6-6', 'ff-2', 600),(7, 'ggg', '2020-7-7', 'gg', 7),(8,'hhh-2', '2020-8-18', 'hh', 800),(9, 'iii', '2020-9-9','ii',9),(10, 'jjj','2020-9-19', 'ii', 99),(9, 'iii-2', '2020-9-9', 'ii-3', 199) ON DUPLICATE KEY UPDATE c5 = values(c5) + 100;
select * from t1 order by c1;
c1	c2	c3	c4	c5
1	aaa	2020-01-01	aa	200
2	bbb	2020-02-02	bb	2
4	ddd	2020-04-04	dd	500
5	eee	2020-05-05	ee	5
6	fff	2020-06-06	ff	700
7	ggg	2020-07-07	gg	7
8	hhh	2020-08-08	hh	900
9	iii	2020-09-09	ii	299
set ob_enable_index_direct_select =1;
c1	c2	c3
1	aaa	2020-01-01
2	bbb	2020-02-02
4	ddd	2020-04-04
5	eee	2020-05-05
6	fff	2020-06-06
7	ggg	2020-07-07
8	hhh	2020-08-08
9	iii	2020-09-09
c1	c2	c4
1	aaa	aa
2	bbb	bb
4	ddd	dd
5	eee	ee
6	fff	ff
7	ggg	gg
8	hhh	hh
9	iii	ii
c1	c2	c5
1	aaa	200
2	bbb	2
4	ddd	500
5	eee	5
6	fff	700
7	ggg	7
8	hhh	900
9	iii	299
delete from t1;
insert into t1 values(1, 'aaa', '2020-01-01', 'aa', 1), (2, 'bbb', '2020-2-2', 'bb', 2), (4, 'ddd', '2020-4-4', 'dd',4),(6,'fff', '2020-6-6', 'ff',6),(8,'hhh','2020-8-8', 'hh',8);
insert into t1 values(1, 'aaa', '2020-01-01', 'aa', 1), (2, 'bbb', '2020-2-2', 'bb', 2), (4, 'ddd', '2020-4-4', 'dd',4),(6,'fff', '2020-6-6', 'ff',6),(8,'hhh','2020-8-8', 'hh',8) ON DUPLICATE KEY UPDATE c2 = concat(c2, '--3'), c5 = c5 + 10000;
select * from t1 order by c1;
c1	c2	c3	c4	c5
1	aaa--3	2020-01-01	aa	10001
2	bbb--3	2020-02-02	bb	10002
4	ddd--3	2020-04-04	dd	10004
6	fff--3	2020-06-06	ff	10006
8	hhh--3	2020-08-08	hh	10008
set ob_enable_index_direct_select =1;
c1	c2	c3
1	aaa--3	2020-01-01
2	bbb--3	2020-02-02
4	ddd--3	2020-04-04
6	fff--3	2020-06-06
8	hhh--3	2020-08-08
c1	c2	c4
1	aaa--3	aa
2	bbb--3	bb
4	ddd--3	dd
6	fff--3	ff
8	hhh--3	hh
c1	c2	c5
1	aaa--3	10001
2	bbb--3	10002
4	ddd--3	10004
6	fff--3	10006
8	hhh--3	10008
delete from t1;
insert into t1 values(1, 'aaa', '2020-01-01', 'aa', 1), (2, 'bbb', '2020-2-2', 'bb', 2), (4, 'ddd', '2020-4-4', 'dd',4),(6,'fff', '2020-6-6', 'ff',6),(8,'hhh','2020-8-8', 'hh',8);
insert into t1 values(4, 'ddd-new', '2020-4-4', 'dd-new', 4) ON DUPLICATE KEY UPDATE c2 = concat(c2, '--3'),  c4 = 'ff';
ERROR 23000: Duplicate entry 'ff' for key 'idx_c4'
insert into t1 values(4, 'ddd-new', '2020-4-4', 'dd-new', 4) ON DUPLICATE KEY UPDATE c2 = concat(c2, '--3'),  c4 = concat(values(c4), '--new--dkz');
select * from t1;
c1	c2	c3	c4	c5
8	hhh	2020-08-08	hh	8
4	ddd--3	2020-04-04	dd-new--new--dkz	4
1	aaa	2020-01-01	aa	1
2	bbb	2020-02-02	bb	2
6	fff	2020-06-06	ff	6
set ob_enable_index_direct_select =1;
c1	c2	c3
1	aaa	2020-01-01
2	bbb	2020-02-02
4	ddd--3	2020-04-04
6	fff	2020-06-06
8	hhh	2020-08-08
c1	c2	c4
1	aaa	aa
2	bbb	bb
4	ddd--3	dd-new--new--dkz
6	fff	ff
8	hhh	hh
c1	c2	c5
1	aaa	1
2	bbb	2
4	ddd--3	4
6	fff	6
8	hhh	8
drop table t1;
create table t1(c1 varchar(200), c2 date, c3 int, c4 int, c5 varchar(200), c6 int, primary key(c1, c2, c3)) partition by key(c2) partitions 4;
create unique index idx_c4 on t1(c4) global;
create index t1_c5_01 on t1(c5) partition by key(c5) partitions 4;
create index t1_c6_01 on t1(c6) partition by hash(c6) partitions 4;
insert into t1 values('aa', '2020-1-1', 1, 1, 'aaaaa', 1), ('cc', '2020-3-3', 3, 3, 'cccccc', 3),('ee', '2020-5-5', 5, 5, 'eeeee', 5),('ff', '2020-5-6', 6, 6, 'fffff', 6),('jjjj', '2020-5-10', 10, 10, 'jjjjj', 10);
insert into t1 values('aaa', '2021-1-1', 21, 21, 'aaa-2', 21), ('ccc', '2021-3-3', 23, 23, 'cccc-2', 23),('eee', '2021-5-5', 25, 25, 'eeeee-2', 25),('fff', '2021-5-6', 26, 26, 'fffff-2', 26),('jjjj2', '2021-5-10', 210, 210, 'jjjjj-2', 210);
insert into t1 values('bb', '2020-2-2',2,2,'bbbbb',2),('cc', '2020-3-3', 3, 3333, 'cccccc-3', 3333),('dd', '2020-4-4',4,4,'ddddd', 4),('dd', '2020-4-4', 4, 4,'dddd-2', 4),('dd', '2020-4-14', 14, 4, 'dddd-3', 4), ('dd', '2020-4-14', 114, 4,'dddddd-4', 4), ('ff','2020-5-6', 6, 6, 'ffff-2',6),('gg', '2020-5-7', 7,7,'gg-3',7),('jj', '2020-5-10', 1010,10,'jjjj-2',10) ON DUPLICATE KEY UPDATE c6 = c6 + 10000;
select * from t1 order by c2;
c1	c2	c3	c4	c5	c6
aa	2020-01-01	1	1	aaaaa	1
bb	2020-02-02	2	2	bbbbb	2
cc	2020-03-03	3	3	cccccc	10003
dd	2020-04-04	4	4	ddddd	30004
ee	2020-05-05	5	5	eeeee	5
ff	2020-05-06	6	6	fffff	10006
gg	2020-05-07	7	7	gg-3	7
jjjj	2020-05-10	10	10	jjjjj	10010
aaa	2021-01-01	21	21	aaa-2	21
ccc	2021-03-03	23	23	cccc-2	23
eee	2021-05-05	25	25	eeeee-2	25
fff	2021-05-06	26	26	fffff-2	26
jjjj2	2021-05-10	210	210	jjjjj-2	210
set ob_enable_index_direct_select =1;
c1	c2	c3	c4
aa	2020-01-01	1	1
aaa	2021-01-01	21	21
bb	2020-02-02	2	2
cc	2020-03-03	3	3
ccc	2021-03-03	23	23
dd	2020-04-04	4	4
ee	2020-05-05	5	5
eee	2021-05-05	25	25
ff	2020-05-06	6	6
fff	2021-05-06	26	26
gg	2020-05-07	7	7
jjjj	2020-05-10	10	10
jjjj2	2021-05-10	210	210
c1	c2	c3	c5
aa	2020-01-01	1	aaaaa
aaa	2021-01-01	21	aaa-2
bb	2020-02-02	2	bbbbb
cc	2020-03-03	3	cccccc
ccc	2021-03-03	23	cccc-2
dd	2020-04-04	4	ddddd
ee	2020-05-05	5	eeeee
eee	2021-05-05	25	eeeee-2
ff	2020-05-06	6	fffff
fff	2021-05-06	26	fffff-2
gg	2020-05-07	7	gg-3
jjjj	2020-05-10	10	jjjjj
jjjj2	2021-05-10	210	jjjjj-2
c1	c2	c3	c6
aa	2020-01-01	1	1
aaa	2021-01-01	21	21
bb	2020-02-02	2	2
cc	2020-03-03	3	10003
ccc	2021-03-03	23	23
dd	2020-04-04	4	30004
ee	2020-05-05	5	5
eee	2021-05-05	25	25
ff	2020-05-06	6	10006
fff	2021-05-06	26	26
gg	2020-05-07	7	7
jjjj	2020-05-10	10	10010
jjjj2	2021-05-10	210	210
insert into t1 values('dkz', '2021-1-1', 21, 21, 'dkz-2', 21), ('dkz-2','2021-1-2', 22, 21, 'dkz-3', 22),('dkz-3', '2021-1-3', 23, 21, 'dkz-5', 25),('ee', '2021-5-1', 25,25, 'eee-5',225),('ffffff','2021-5-6',26,26,'fff-66',26) ,('xxx', '2021-2-10', 29,29,'xxx-2',29), ('jjj-3', '2021-5-20', 30, 210, 'jjj-3', 220)ON DUPLICATE KEY UPDATE c5 = concat(c5, '--4'), c3 = c3+ 1000;
select * from t1 order by c2;
c1	c2	c3	c4	c5	c6
aa	2020-01-01	1	1	aaaaa	1
bb	2020-02-02	2	2	bbbbb	2
cc	2020-03-03	3	3	cccccc	10003
dd	2020-04-04	4	4	ddddd	30004
ee	2020-05-05	5	5	eeeee	5
ff	2020-05-06	6	6	fffff	10006
gg	2020-05-07	7	7	gg-3	7
jjjj	2020-05-10	10	10	jjjjj	10010
aaa	2021-01-01	3021	21	aaa-2--4--4--4	21
xxx	2021-02-10	29	29	xxx-2	29
ccc	2021-03-03	23	23	cccc-2	23
eee	2021-05-05	1025	25	eeeee-2--4	25
fff	2021-05-06	1026	26	fffff-2--4	26
jjjj2	2021-05-10	1210	210	jjjjj-2--4	210
c1	c2	c3	c4
aa	2020-01-01	1	1
aaa	2021-01-01	3021	21
bb	2020-02-02	2	2
cc	2020-03-03	3	3
ccc	2021-03-03	23	23
dd	2020-04-04	4	4
ee	2020-05-05	5	5
eee	2021-05-05	1025	25
ff	2020-05-06	6	6
fff	2021-05-06	1026	26
gg	2020-05-07	7	7
jjjj	2020-05-10	10	10
jjjj2	2021-05-10	1210	210
xxx	2021-02-10	29	29
c1	c2	c3	c5
aa	2020-01-01	1	aaaaa
aaa	2021-01-01	3021	aaa-2--4--4--4
bb	2020-02-02	2	bbbbb
cc	2020-03-03	3	cccccc
ccc	2021-03-03	23	cccc-2
dd	2020-04-04	4	ddddd
ee	2020-05-05	5	eeeee
eee	2021-05-05	1025	eeeee-2--4
ff	2020-05-06	6	fffff
fff	2021-05-06	1026	fffff-2--4
gg	2020-05-07	7	gg-3
jjjj	2020-05-10	10	jjjjj
jjjj2	2021-05-10	1210	jjjjj-2--4
xxx	2021-02-10	29	xxx-2
c1	c2	c3	c6
aa	2020-01-01	1	1
aaa	2021-01-01	3021	21
bb	2020-02-02	2	2
cc	2020-03-03	3	10003
ccc	2021-03-03	23	23
dd	2020-04-04	4	30004
ee	2020-05-05	5	5
eee	2021-05-05	1025	25
ff	2020-05-06	6	10006
fff	2021-05-06	1026	26
gg	2020-05-07	7	7
jjjj	2020-05-10	10	10010
jjjj2	2021-05-10	1210	210
xxx	2021-02-10	29	29
delete from t1;
insert into t1 values('aa', '2020-1-1', 1, 1, 'aaaaa', 1), ('cc', '2020-3-3', 3, 3, 'cccccc', 3),('ee', '2020-5-5', 5, 5, 'eeeee', 5),('ff', '2020-5-6', 6, 6, 'fffff', 6),('jjjj', '2020-5-10', 10, 10, 'jjjjj', 10);
insert into t1 values('aa', '2020-2-2', 111, 1, '555', 1), ('4', '2020-4-4',4,4,'4',4), ('ee-new', '2020-5-15', 5, 5, 'eeeee', 5)ON DUPLICATE KEY UPDATE c1 = concat(c1, '--3'), c3 = c3+ 10000;
select * from t1 order by c2;
c1	c2	c3	c4	c5	c6
aa--3	2020-01-01	10001	1	aaaaa	1
cc	2020-03-03	3	3	cccccc	3
4	2020-04-04	4	4	4	4
ee--3	2020-05-05	10005	5	eeeee	5
ff	2020-05-06	6	6	fffff	6
jjjj	2020-05-10	10	10	jjjjj	10
c1	c2	c3	c4
4	2020-04-04	4	4
aa--3	2020-01-01	10001	1
cc	2020-03-03	3	3
ee--3	2020-05-05	10005	5
ff	2020-05-06	6	6
jjjj	2020-05-10	10	10
c1	c2	c3	c5
4	2020-04-04	4	4
aa--3	2020-01-01	10001	aaaaa
cc	2020-03-03	3	cccccc
ee--3	2020-05-05	10005	eeeee
ff	2020-05-06	6	fffff
jjjj	2020-05-10	10	jjjjj
c1	c2	c3	c6
4	2020-04-04	4	4
aa--3	2020-01-01	10001	1
cc	2020-03-03	3	3
ee--3	2020-05-05	10005	5
ff	2020-05-06	6	6
jjjj	2020-05-10	10	10
drop table t1;
