#Environmental cleaning
drop user zhe123@'%';
drop database zhe123;
create database zhe123;
create user zhe123 identified by 'zhe123';
grant all on *.* to zhe123 WITH GRANT OPTION;
#cte-2-2 数据截断,递归部分为列生成比非递归部分更宽的值
set sql_mode = "";
WITH RECURSIVE cte AS
(
SELECT 1 AS n, 'abc' AS str
UNION ALL
SELECT n + 1, CONCAT(str, str) FROM cte WHERE n < 3
)
SELECT * FROM cte;
n	str
1	abc
2	abc
3	abc
set sql_mode = 'STRICT_ALL_TABLES,NO_ZERO_IN_DATE';
#CAST() 在非递归中使用SELECT以使str列变宽
WITH RECURSIVE cte AS
(
SELECT 1 AS n, cast('abc' as char(20))AS str
UNION ALL
SELECT n + 1, CONCAT(str, str) FROM cte WHERE n < 3
)
SELECT * FROM cte;
n	str
1	abc
2	abcabc
3	abcabcabcabc
#数据较长时，层次查询
drop table  c;
create table c(id int PRIMARY KEY,ParentID int,name int);
drop procedure test1;
create procedure test1(in i INTEGER)
BEGIN
DECLARE  v_i INTEGER;
set v_i = 0;
while v_i <= i do
insert into c values(v_i+1,v_i,v_i+1000);
set v_i = v_i + 1;
end while;
END;
//
call test1(47);
select * from c;
id	ParentID	name
1	0	1000
2	1	1001
3	2	1002
4	3	1003
5	4	1004
6	5	1005
7	6	1006
8	7	1007
9	8	1008
10	9	1009
11	10	1010
12	11	1011
13	12	1012
14	13	1013
15	14	1014
16	15	1015
17	16	1016
18	17	1017
19	18	1018
20	19	1019
21	20	1020
22	21	1021
23	22	1022
24	23	1023
25	24	1024
26	25	1025
27	26	1026
28	27	1027
29	28	1028
30	29	1029
31	30	1030
32	31	1031
33	32	1032
34	33	1033
35	34	1034
36	35	1035
37	36	1036
38	37	1037
39	38	1038
40	39	1039
41	40	1040
42	41	1041
43	42	1042
44	43	1043
45	44	1044
46	45	1045
47	46	1046
48	47	1047
with recursive r as
(
select id,ParentID,name from c where id =11
union all
select c.* from c,r where c.id=r.ParentID
) select * from r order by id;
id	ParentID	name
1	0	1000
2	1	1001
3	2	1002
4	3	1003
5	4	1004
6	5	1005
7	6	1006
8	7	1007
9	8	1008
10	9	1009
11	10	1010
with recursive r as
(
select id,cast(name as char(1000)) as name from c where id=35
union all
select c.id,CONCAT(r.name, '>', c.name) as name from c,r where r.id = c.ParentID
)select id,name from r;
id	name
35	1034
36	1034>1035
37	1034>1035>1036
38	1034>1035>1036>1037
39	1034>1035>1036>1037>1038
40	1034>1035>1036>1037>1038>1039
41	1034>1035>1036>1037>1038>1039>1040
42	1034>1035>1036>1037>1038>1039>1040>1041
43	1034>1035>1036>1037>1038>1039>1040>1041>1042
44	1034>1035>1036>1037>1038>1039>1040>1041>1042>1043
45	1034>1035>1036>1037>1038>1039>1040>1041>1042>1043>1044
46	1034>1035>1036>1037>1038>1039>1040>1041>1042>1043>1044>1045
47	1034>1035>1036>1037>1038>1039>1040>1041>1042>1043>1044>1045>1046
48	1034>1035>1036>1037>1038>1039>1040>1041>1042>1043>1044>1045>1046>1047
#cte-2-3 限制CTE递归相关配置
set max_execution_time=1;
#error 0,1193
#mysql is 3024
with recursive r as
(
select id,ParentID,name from c where id =11
union all
select r.* from c,r where c.id=r.ParentID
) select * from r order by id;
set max_execution_time=1000;
#error 0,1193
#mysql is 3636
with recursive r as
(
select id,ParentID,name from c where id =11
union all
select r.* from c,r where c.id=r.ParentID
) select * from r order by id;
drop table rockets;
CREATE TABLE rockets
(origin CHAR(20), destination CHAR(20), trip_time INT);
INSERT INTO rockets VALUES 
('地球', '火星', 2),
('火星', '木星', 3),
('木星', '土星', 4);
WITH RECURSIVE all_destinations AS
(
SELECT destination AS planet
FROM rockets
WHERE origin='地球' 
UNION ALL
SELECT r.destination
FROM rockets r, all_destinations d
WHERE r.origin=d.planet
)
SELECT /*+ MAX_EXECUTION_TIME(100) */ * FROM all_destinations;
planet
火星
木星
土星
WITH RECURSIVE all_destinations AS
(
SELECT destination AS planet
FROM rockets
WHERE origin='地球' 
UNION ALL
SELECT r.destination
FROM rockets r, all_destinations d
WHERE r.origin=d.planet
)
SELECT /*+ MAX_EXECUTION_TIME(100) */ * FROM all_destinations;
planet
火星
木星
土星
#不指定hint
WITH RECURSIVE all_destinations AS
(
SELECT destination AS planet
FROM rockets
WHERE origin='地球' 
UNION ALL
SELECT r.destination
FROM rockets r, all_destinations d
WHERE r.origin=d.planet
)
SELECT * FROM all_destinations;
planet
火星
木星
土星
#cte-2-5 在SELECT, UPDATE, 和 DELETE  语句之后
DROP TABLE numbers;
CREATE TABLE numbers(n int(5) PRIMARY KEY,name varchar(10));
insert into numbers values(6,'');
select * from rockets;
origin	destination	trip_time
地球	火星	2
火星	木星	3
木星	土星	4
#UPDATE
WITH RECURSIVE my_cte(n) AS
(
SELECT 1
UNION ALL
SELECT 1+n FROM my_cte WHERE n<6
)
UPDATE rockets, my_cte
SET rockets.trip_time=4
WHERE rockets.trip_time=my_cte.n*my_cte.n;
#DELETE
WITH RECURSIVE my_cte(n) AS
(
SELECT 1
UNION ALL
SELECT 1+n FROM my_cte WHERE n<6
)
DELETE FROM rockets
WHERE rockets.trip_time > (SELECT AVG(n) FROM my_cte);
select * from rockets;
origin	destination	trip_time
地球	火星	2
火星	木星	3
DELETE FROM rockets 
WHERE rockets.trip_time >
(
WITH RECURSIVE my_cte(n) AS
(
SELECT 1
UNION ALL
SELECT 1+n FROM my_cte WHERE n<3
)
SELECT MAX(n) FROM my_cte
);
INSERT INTO rockets VALUES ('木星', '土星', 4);
#cte-2-6 在INSERT,REPLACE,CREATE,DECLARE,EXPLAIN之后，在SELECT语句之前
DROP TABLE sales;
create table sales (date date,price DECIMAL(9,2));
insert into sales values
(str_to_date('2017-01-03','%Y-%m-%d'),100.00),
(str_to_date('2017-01-03','%Y-%m-%d'),200.00),
(str_to_date('2017-01-06','%Y-%m-%d'),50.00),
(str_to_date('2017-01-08','%Y-%m-%d'),10.00),
(str_to_date('2017-01-08','%Y-%m-%d'),20.00),
(str_to_date('2017-01-08','%Y-%m-%d'),150.00),
(str_to_date('2017-01-10','%Y-%m-%d'),5.00);
WITH RECURSIVE dates (date) AS
(
SELECT MIN(date) FROM sales
UNION ALL
SELECT date + INTERVAL 1 DAY FROM dates
WHERE date + INTERVAL 1 DAY <= (SELECT MAX(date) FROM sales)
)
SELECT dates.date, COALESCE(SUM(price), 0) AS sum_price
FROM dates LEFT JOIN sales ON dates.date = sales.date
GROUP BY dates.date
ORDER BY dates.date;
date	sum_price
2017-01-03	300.00
2017-01-04	0.00
2017-01-05	0.00
2017-01-06	50.00
2017-01-07	0.00
2017-01-08	180.00
2017-01-09	0.00
2017-01-10	5.00
#CREATE TABEL
DROP TABLE numbers1;
CREATE TABLE numbers1
WITH RECURSIVE dates (date) AS
(
SELECT MIN(date) FROM sales
UNION ALL
SELECT date + INTERVAL 1 DAY FROM dates
WHERE date + INTERVAL 1 DAY <= (SELECT MAX(date) FROM sales)
)
SELECT dates.date, COALESCE(SUM(price), 0) AS sum_price
FROM dates LEFT JOIN sales ON dates.date = sales.date
GROUP BY dates.date
ORDER BY dates.date;
DROP TABLE numbers1;
create table numbers1 (date date,sum_price DECIMAL(9,2));
#INSERT
INSERT INTO numbers1
WITH RECURSIVE dates (date) AS
(
SELECT MIN(date) FROM sales
UNION ALL
SELECT date + INTERVAL 1 DAY FROM dates
WHERE date + INTERVAL 1 DAY <= (SELECT MAX(date) FROM sales)
)
SELECT dates.date, COALESCE(SUM(price), 0) AS sum_price
FROM dates LEFT JOIN sales ON dates.date = sales.date
GROUP BY dates.date
ORDER BY dates.date;
#REPLACE
REPLACE INTO numbers1
WITH RECURSIVE dates (date) AS
(
SELECT MIN(date) FROM sales
UNION ALL
SELECT date + INTERVAL 1 DAY FROM dates
WHERE date + INTERVAL 1 DAY <= (SELECT MAX(date) FROM sales)
)
SELECT dates.date, COALESCE(SUM(price), 0) AS sum_price
FROM dates LEFT JOIN sales ON dates.date = sales.date
GROUP BY dates.date
ORDER BY dates.date;
#CREATE VIEW
DROP VIEW numbers2;
CREATE VIEW numbers2 AS
WITH RECURSIVE dates (date) AS
(
SELECT MIN(date) FROM sales
UNION ALL
SELECT date + INTERVAL 1 DAY FROM dates
WHERE date + INTERVAL 1 DAY <= (SELECT MAX(date) FROM sales)
)
SELECT dates.date, COALESCE(SUM(price), 0) AS sum_price
FROM dates LEFT JOIN sales ON dates.date = sales.date
GROUP BY dates.date
ORDER BY dates.date;
#DECLARE CURSOR 
#EXPLAIN 
EXPLAIN 
WITH RECURSIVE my_cte(n) AS
(
SELECT 1
UNION ALL
SELECT 1+n FROM my_cte WHERE n<6
)
SELECT * FROM my_cte;
Query Plan
=====================================================
|ID|OPERATOR           |NAME  |EST.ROWS|EST.TIME(us)|
-----------------------------------------------------
|0 |RECURSIVE UNION ALL|      |8       |2           |
|1 |├─EXPRESSION       |      |1       |1           |
|2 |└─TABLE FULL SCAN  |my_cte|1       |1           |
=====================================================
Outputs & filters:
-------------------------------------
  0 - output([UNION([1])]), filter(nil), rowset=16
  1 - output([1]), filter(nil)
      values({1})
  2 - output([column_conv(BIGINT,PS:(20,0),NULL,1 + my_cte.n)]), filter([my_cte.n < 6]), rowset=16
      access([my_cte.n])
      is_index_back=false, is_global_index=false, filter_before_indexback[false], 
      range_key(nil), range(MIN ; MAX)
#cte-2-7 作为子查询返回值嵌套在sql中
select n from numbers;
n
6
SELECT * FROM rockets;
origin	destination	trip_time
地球	火星	2
火星	木星	3
木星	土星	4
#SELECT
SELECT * FROM rockets
WHERE origin=
(
WITH RECURSIVE descendants AS
(
SELECT origin, 1 as level
FROM rockets
WHERE origin='木星'
	UNION ALL
SELECT t.origin, d.level+1
FROM descendants d, rockets t
WHERE t.destination=d.origin
)
SELECT origin FROM descendants WHERE level=3 ORDER BY level
);
origin	destination	trip_time
地球	火星	2
#UPDATE
UPDATE rockets
SET destination=
(
WITH RECURSIVE descendants AS
(
SELECT origin, CAST(origin AS CHAR(500)) AS path
FROM rockets
WHERE origin='木星'
	UNION ALL
SELECT t.origin, CONCAT(d.path, ',', t.origin)
FROM descendants d, rockets t
WHERE t.destination=d.origin
)
SELECT path FROM descendants WHERE origin='地球' ORDER BY path
)
WHERE origin='地球';
UPDATE rockets
SET destination='木星,火星' WHERE origin=
(
WITH RECURSIVE descendants AS
(
SELECT origin, 1 as level
FROM rockets
WHERE origin='木星'
	UNION ALL
SELECT t.origin, d.level+1
FROM descendants d, rockets t
WHERE t.destination=d.origin
)
SELECT origin FROM descendants WHERE level=2 ORDER BY level
);
UPDATE rockets
SET trip_time=
(
WITH RECURSIVE fibonacci (n, fib_n, next_fib_n) AS
(
SELECT 1, 0, 1
UNION ALL
SELECT n + 1, next_fib_n, fib_n + next_fib_n
FROM fibonacci WHERE n < 10
)
SELECT MAX(next_fib_n) FROM fibonacci
)
WHERE trip_time=
(
WITH RECURSIVE my_cte(n) AS
(
SELECT 1
UNION ALL
SELECT 1+n FROM my_cte WHERE n<3
)
SELECT MAX(n) FROM my_cte
);
#DELETE
DELETE FROM rockets WHERE destination in 
(
WITH RECURSIVE all_destinations AS
(
SELECT destination AS planet
FROM rockets
WHERE origin='地球' 
UNION ALL
SELECT r.destination
FROM rockets r, all_destinations d
WHERE r.origin=d.planet
)
SELECT * FROM all_destinations
);
INSERT INTO rockets VALUES ('地球', '火星', 9);
#其他例子：传递闭包
WITH RECURSIVE all_destinations AS
(
SELECT destination AS planet
FROM rockets
WHERE origin='地球' 
UNION ALL
SELECT r.destination
FROM rockets r, all_destinations d
WHERE r.origin=d.planet
)
SELECT * FROM all_destinations;
planet
火星
木星,火星
WITH RECURSIVE all_destinations AS
(
SELECT destination AS planet
FROM rockets
WHERE origin='地球' 
UNION ALL
SELECT r.destination
FROM rockets r, all_destinations d
WHERE r.origin=d.planet
)
SELECT /*+ SET_VAR(cte_max_recursion_depth = 1M) */ * FROM all_destinations;
planet
火星
木星,火星
WITH RECURSIVE all_destinations AS
(
SELECT destination AS planet
FROM rockets
WHERE origin='地球' 
UNION ALL
SELECT r.destination
FROM rockets r, all_destinations d
WHERE r.origin=d.planet
)
SELECT * FROM all_destinations;
planet
火星
木星,火星
#循环避免,OB不支持DISTINCE
WITH RECURSIVE all_destinations AS
(
SELECT destination AS planet, trip_time AS total_time 
FROM rockets
WHERE origin='地球' 
UNION DISTINCT
SELECT r.destination, d.total_time+r.trip_time
FROM rockets r, all_destinations d
WHERE r.origin=d.planet
)
SELECT * FROM all_destinations;
WITH RECURSIVE all_destinations AS
(
SELECT destination AS planet, trip_time AS total_time,
CAST(destination AS CHAR(500)) AS path
FROM rockets
WHERE origin='地球' 
UNION ALL
SELECT r.destination, d.total_time+r.trip_time,
CONCAT(d.path, ',', r.destination)
FROM rockets r, all_destinations d
WHERE r.origin=d.planet
AND FIND_IN_SET(r.destination, d.path)=0
)
SELECT * FROM all_destinations;
planet	total_time	path
火星	9	火星
木星,火星	64	火星,木星,火星
WITH RECURSIVE all_destinations AS
(
SELECT destination AS planet, trip_time AS total_time,
CAST(destination AS CHAR(500)) AS path, 0 AS is_cycle
FROM rockets
WHERE origin='地球' 
UNION ALL
SELECT r.destination, d.total_time+r.trip_time,
CONCAT(d.path, ',', r.destination),
FIND_IN_SET(r.destination, d.path)!=0
FROM rockets r, all_destinations d
WHERE r.origin=d.planet
AND is_cycle=0
)
SELECT * FROM all_destinations ;
planet	total_time	path	is_cycle
火星	9	火星	0
木星,火星	64	火星,木星,火星	0
#end释放空间、断开连接、删除用户
purge recyclebin;
drop database zhe123;
drop user zhe123;
Warnings:
Warning	4005	User 'zhe123'@'%' is referenced as a definer account in a stored routine.
