drop table tbl1;
create table tbl1(c1 char(10));
alter system flush sql audit global;
alter system set _query_record_size_limit = 65536;
select c1 from tbl1;
c1
select QUERY_SQL,stmt_type from oceanbase.gv$ob_sql_audit where QUERY_SQL like "select c1 from tbl1%" limit 1;
QUERY_SQL	stmt_type
select c1 from tbl1	SELECT
insert into tbl1 values('a');
select QUERY_SQL,stmt_type from oceanbase.gv$ob_sql_audit where QUERY_SQL like "insert into tbl1 values('a')%" limit 1;
QUERY_SQL	stmt_type
insert into tbl1 values('a')	INSERT
INSERT INTO tbl1 SELECT 1;
select QUERY_SQL,stmt_type from oceanbase.gv$ob_sql_audit where QUERY_SQL like "INSERT INTO tbl1 SELECT%" limit 1;
QUERY_SQL	stmt_type
INSERT INTO tbl1 SELECT 1	INSERT
drop table lyq_test1;
create table lyq_test1(c1 char(10));
drop table lyq_test2;
create table lyq_test2(c1 char(10));
INSERT ALL INTO lyq_test1 VALUES(1) INTO lyq_test2 VALUES(2) SELECT * FROM lyq_test;
ERROR 42000: You have an error in your SQL syntax; check the manual that corresponds to your OceanBase version for the right syntax to use near 'ALL INTO lyq_test1 VALUES(1) INTO lyq_test2 VALUES(2) SELECT * FROM lyq_test' at line 1
select QUERY_SQL,stmt_type from oceanbase.gv$ob_sql_audit where QUERY_SQL like "INSERT ALL INTO%" limit 1;
QUERY_SQL	stmt_type
INSERT ALL INTO lyq_test1 VALUES(1) INTO lyq_test2 VALUES(2) SELECT * FROM lyq_test	NONE
replace into tbl1 (c1) values ('b');
select QUERY_SQL,stmt_type from oceanbase.gv$ob_sql_audit where QUERY_SQL like "replace into tbl1 (c1) values ('b')%" limit 1;
QUERY_SQL	stmt_type
replace into tbl1 (c1) values ('b')	INSERT
DELETE FROM tbl1 WHERE c1 = 'b';
select QUERY_SQL,stmt_type from oceanbase.gv$ob_sql_audit where QUERY_SQL like "DELETE FROM tbl1 WHERE c1 = 'b'%" limit 1;
QUERY_SQL	stmt_type
DELETE FROM tbl1 WHERE c1 = 'b'	DELETE
UPDATE tbl1 SET c1 = 'UPDATE'  WHERE c1 = 'b';
select QUERY_SQL,stmt_type from oceanbase.gv$ob_sql_audit where QUERY_SQL like "UPDATE tbl1 SET c1 = 'UPDATE'  WHERE c1 = 'b'%" limit 1;
QUERY_SQL	stmt_type
UPDATE tbl1 SET c1 = 'UPDATE'  WHERE c1 = 'b'	UPDATE
EXPLAIN basic SELECT * FROM tbl1;
select QUERY_SQL,stmt_type from oceanbase.gv$ob_sql_audit where QUERY_SQL like "EXPLAIN SELECT * FROM tbl1%" limit 1;
QUERY_SQL	stmt_type
EXPLAIN FORMAT=JSON SELECT * FROM tbl1;
select QUERY_SQL,stmt_type from oceanbase.gv$ob_sql_audit where QUERY_SQL like "EXPLAIN FORMAT=JSON SELECT * FROM tbl1%" limit 1;
QUERY_SQL	stmt_type
EXPLAIN FORMAT=JSON SELECT * FROM tbl1	SELECT
drop table tbl1;
create table tbl1(c1 char(10));
select QUERY_SQL,stmt_type from oceanbase.gv$ob_sql_audit where QUERY_SQL like "create table tbl1(c1 char(10))%" limit 1;
QUERY_SQL	stmt_type
create table tbl1(c1 char(10))	CREATE_TABLE
drop table tbl1;
create table tbl1(c1 char(10));
select QUERY_SQL,stmt_type from oceanbase.gv$ob_sql_audit where QUERY_SQL like "drop table tbl1%" limit 1;
QUERY_SQL	stmt_type
drop table tbl1	DROP_TABLE
ALTER TABLE tbl1 ADD c3 INT;
select QUERY_SQL,stmt_type from oceanbase.gv$ob_sql_audit where QUERY_SQL like "ALTER TABLE tbl1 ADD c3 INT%" limit 1;
QUERY_SQL	stmt_type
ALTER TABLE tbl1 ADD c3 INT	ALTER_TABLE
ALTER TABLE tbl1 CHANGE COLUMN c1 c4 VARCHAR(50);
select QUERY_SQL,stmt_type from oceanbase.gv$ob_sql_audit where QUERY_SQL like "ALTER TABLE tbl1 CHANGE COLUMN c1 c4 VARCHAR(50)%" limit 1;
QUERY_SQL	stmt_type
ALTER TABLE tbl1 CHANGE COLUMN c1 c4 VARCHAR(50)	ALTER_TABLE
CREATE INDEX tbl1_index ON tbl1 (c3 ASC);
select QUERY_SQL,stmt_type from oceanbase.gv$ob_sql_audit where QUERY_SQL like "CREATE INDEX tbl1_index ON tbl1 (c3 ASC)%" limit 1;
QUERY_SQL	stmt_type
CREATE INDEX tbl1_index ON tbl1 (c3 ASC)	CREATE_INDEX
DROP INDEX tbl1_index ON tbl1;
select QUERY_SQL,stmt_type from oceanbase.gv$ob_sql_audit where QUERY_SQL = "DROP INDEX tbl1_index ON tbl1" limit 1;
QUERY_SQL	stmt_type
DROP INDEX tbl1_index ON tbl1	DROP_INDEX
CREATE OR REPLACE VIEW v(vc1, vc2) AS SELECT c4, c3 FROM tbl1;
select QUERY_SQL,stmt_type from oceanbase.gv$ob_sql_audit where QUERY_SQL like "CREATE OR REPLACE VIEW v(vc1, vc2) AS SELECT c4, c3 FROM tbl1%" limit 1;
QUERY_SQL	stmt_type
CREATE OR REPLACE VIEW v(vc1, vc2) AS SELECT c4, c3 FROM tbl1	CREATE_VIEW
CREATE OR REPLACE VIEW view1 AS SELECT * FROM tbl1 WHERE c4 > 0 WITH LOCAL CHECK OPTION;
select QUERY_SQL,stmt_type from oceanbase.gv$ob_sql_audit where QUERY_SQL like "CREATE OR REPLACE VIEW view1 AS SELECT * FROM tbl1 WHERE c4 > 0 WITH LOCAL CHECK OPTION%" limit 1;
QUERY_SQL	stmt_type
CREATE OR REPLACE VIEW view1 AS SELECT * FROM tbl1 WHERE c4 > 0 WITH LOCAL CHECK OPTION	CREATE_VIEW
CREATE OR REPLACE VIEW view2 AS SELECT * FROM view1 WHERE c4 > 1 WITH CASCADED CHECK OPTION;
select QUERY_SQL,stmt_type from oceanbase.gv$ob_sql_audit where QUERY_SQL like "CREATE OR REPLACE VIEW view2 AS SELECT * FROM view1 WHERE c4 > 1 WITH CASCADED CHECK OPTION%" limit 1;
QUERY_SQL	stmt_type
CREATE OR REPLACE VIEW view2 AS SELECT * FROM view1 WHERE c4 > 1 WITH CASCADED CHECK OPTION	CREATE_VIEW
ALTER VIEW view2 AS SELECT * FROM tbl1;
select QUERY_SQL,stmt_type from oceanbase.gv$ob_sql_audit where QUERY_SQL like "ALTER VIEW view2 AS SELECT * FROM tbl1%" limit 1;
QUERY_SQL	stmt_type
ALTER VIEW view2 AS SELECT * FROM tbl1	CREATE_VIEW
DROP VIEW view2;
select QUERY_SQL,stmt_type from oceanbase.gv$ob_sql_audit where QUERY_SQL like "DROP VIEW view2%" limit 1;
QUERY_SQL	stmt_type
DROP VIEW view2	DROP_VIEW
show tables;
select QUERY_SQL,stmt_type from oceanbase.gv$ob_sql_audit where QUERY_SQL like "show tables%" limit 1;
QUERY_SQL	stmt_type
show tables	SHOW_TABLES
SHOW DATABASES;
select QUERY_SQL,stmt_type from oceanbase.gv$ob_sql_audit where QUERY_SQL like "SHOW DATABASES%" limit 1;
QUERY_SQL	stmt_type
SHOW DATABASES	SHOW_DATABASES
SHOW COLUMNS FROM tbl1;
Field	Type	Null	Key	Default	Extra
c4	varchar(50)	YES		NULL	
c3	int(11)	YES		NULL	
select QUERY_SQL,stmt_type from oceanbase.gv$ob_sql_audit where QUERY_SQL like "SHOW COLUMNS FROM tbl1%" limit 1;
QUERY_SQL	stmt_type
SHOW COLUMNS FROM tbl1	SHOW_COLUMNS
SHOW TABLE STATUS FROM mysql;
select QUERY_SQL,stmt_type from oceanbase.gv$ob_sql_audit where QUERY_SQL like "SHOW TABLE STATUS FROM mysql%" limit 1;
QUERY_SQL	stmt_type
SHOW TABLE STATUS FROM mysql	SHOW_TABLE_STATUS
show schemas;
select QUERY_SQL,stmt_type from oceanbase.gv$ob_sql_audit where QUERY_SQL like "show schemas%" limit 1;
QUERY_SQL	stmt_type
show schemas	SHOW_DATABASES
show create database mysql;
select QUERY_SQL,stmt_type from oceanbase.gv$ob_sql_audit where QUERY_SQL like "show create database mysql%" limit 1;
QUERY_SQL	stmt_type
show create database mysql	SHOW_CREATE_DATABASE
show create table tbl1;
select QUERY_SQL,stmt_type from oceanbase.gv$ob_sql_audit where QUERY_SQL like "show create table tbl1%" limit 1;
QUERY_SQL	stmt_type
show create table tbl1	SHOW_CREATE_TABLE
show create view view1;
select QUERY_SQL,stmt_type from oceanbase.gv$ob_sql_audit where QUERY_SQL like "show create view view1%" limit 1;
QUERY_SQL	stmt_type
show create view view1	SHOW_CREATE_VIEW
SHOW CREATE PROCEDURE p;
ERROR 42000: procedure/function does not exist
select QUERY_SQL,stmt_type from oceanbase.gv$ob_sql_audit where QUERY_SQL like "SHOW CREATE PROCEDURE p%" limit 1;
QUERY_SQL	stmt_type
SHOW CREATE PROCEDURE p	SHOW_CREATE_PROCEDURE
show indexes from tbl1;
Table	Non_unique	Key_name	Seq_in_index	Column_name	Collation	Cardinality	Sub_part	Packed	Null	Index_type	Comment	Index_comment	Visible	Expression
select QUERY_SQL,stmt_type from oceanbase.gv$ob_sql_audit where QUERY_SQL like "show indexes from tbl1%" limit 1;
QUERY_SQL	stmt_type
show indexes from tbl1	SHOW_INDEXES
show warnings limit 1;
select QUERY_SQL,stmt_type from oceanbase.gv$ob_sql_audit where QUERY_SQL like "show warnings limit 1%" limit 1;
QUERY_SQL	stmt_type
show warnings limit 1	SHOW_WARNINGS
show errors limit 1;
select QUERY_SQL,stmt_type from oceanbase.gv$ob_sql_audit where QUERY_SQL like "show errors limit 1%" limit 1;
QUERY_SQL	stmt_type
show errors limit 1	SHOW_ERRORS
show charset where Charset = 'gbk';
select QUERY_SQL,stmt_type from oceanbase.gv$ob_sql_audit where QUERY_SQL like "show charset where Charset = 'gbk'%" limit 1;
QUERY_SQL	stmt_type
show charset where Charset = 'gbk'	SHOW_CHARSET
show collation where Collation = 'binary';
select QUERY_SQL,stmt_type from oceanbase.gv$ob_sql_audit where QUERY_SQL like "show collation where Collation = 'binary'%" limit 1;
QUERY_SQL	stmt_type
show collation where Collation = 'binary'	SHOW_COLLATION
show tablegroups where table_name = 'help_category';
select QUERY_SQL,stmt_type from oceanbase.gv$ob_sql_audit where QUERY_SQL like "show tablegroups where table_name = 'help_category'%" limit 1;
QUERY_SQL	stmt_type
show tablegroups where table_name = 'help_category'	SHOW_TABLEGROUPS
show status;
select QUERY_SQL,stmt_type from oceanbase.gv$ob_sql_audit where QUERY_SQL like "show status%" limit 1;
QUERY_SQL	stmt_type
show status	SHOW_STATUS
show tenant;
select QUERY_SQL,stmt_type from oceanbase.gv$ob_sql_audit where QUERY_SQL like "show tenant%" limit 1;
QUERY_SQL	stmt_type
show tenant	SHOW_TENANT
show trace;
select QUERY_SQL,stmt_type from oceanbase.gv$ob_sql_audit where QUERY_SQL like "show trace%" limit 1;
QUERY_SQL	stmt_type
show trace	SHOW_TRACE
show procedure status;
select QUERY_SQL,stmt_type from oceanbase.gv$ob_sql_audit where QUERY_SQL like "show procedure status%" limit 1;
QUERY_SQL	stmt_type
show procedure status	SHOW_PROCEDURE_STATUS
CREATE TABLEGROUP myTableGroup1;
select QUERY_SQL,stmt_type from oceanbase.gv$ob_sql_audit where QUERY_SQL like "CREATE TABLEGROUP myTableGroup1%" limit 1;
QUERY_SQL	stmt_type
CREATE TABLEGROUP myTableGroup1	CREATE_TABLEGROUP
ALTER TABLEGROUP myTableGroup1 SHARDING = 'PARTITION';
select QUERY_SQL,stmt_type from oceanbase.gv$ob_sql_audit where QUERY_SQL like "ALTER TABLEGROUP myTableGroup1 SHARDING = 'PARTITION'%" limit 1;
QUERY_SQL	stmt_type
ALTER TABLEGROUP myTableGroup1 SHARDING = 'PARTITION'	ALTER_TABLEGROUP
drop tableGROUP myTableGroup1;
select QUERY_SQL,stmt_type from oceanbase.gv$ob_sql_audit where QUERY_SQL like "drop tableGROUP myTableGroup1%" limit 1;
QUERY_SQL	stmt_type
drop tableGROUP myTableGroup1	DROP_TABLEGROUP
TRUNCATE TABLE tbl1;
select QUERY_SQL,stmt_type from oceanbase.gv$ob_sql_audit where QUERY_SQL = "TRUNCATE TABLE tbl1" limit 1;
QUERY_SQL	stmt_type
TRUNCATE TABLE tbl1	TRUNCATE_TABLE
drop table tbl2;
RENAME TABLE tbl1 TO tbl2;
select QUERY_SQL,stmt_type from oceanbase.gv$ob_sql_audit where QUERY_SQL like "RENAME TABLE tbl1 TO tbl2%" limit 1;
QUERY_SQL	stmt_type
RENAME TABLE tbl1 TO tbl2	RENAME_TABLE
CREATE TABLE tbl1 LIKE tbl2;
select QUERY_SQL,stmt_type from oceanbase.gv$ob_sql_audit where QUERY_SQL like "CREATE TABLE tbl1 LIKE tbl2%" limit 1;
QUERY_SQL	stmt_type
CREATE TABLE tbl1 LIKE tbl2	CREATE_TABLE_LIKE
CREATE OUTLINE outline1 ON SELECT /*+max_concurrent(1)*/ * FROM tbl1 WHERE c4 =1;
select QUERY_SQL,stmt_type from oceanbase.gv$ob_sql_audit where QUERY_SQL like "CREATE OUTLINE outline1 ON SELECT /*+max_concurrent(1)*/ * FROM tbl1 WHERE c4 =1%" limit 1;
QUERY_SQL	stmt_type
CREATE OUTLINE outline1 ON SELECT /*+max_concurrent(1)*/ * FROM tbl1 WHERE c4 =1	SELECT
ALTER OUTLINE outline1 ADD SELECT /*+max_concurrent(1)*/ * FROM tbl1 WHERE c4 =?;
select QUERY_SQL,stmt_type from oceanbase.gv$ob_sql_audit where QUERY_SQL like "ALTER OUTLINE outline1 ADD SELECT /*+max_concurrent(1)*/ * FROM tbl1 WHERE c4 =?%" limit 1;
QUERY_SQL	stmt_type
ALTER OUTLINE outline1 ADD SELECT /*+max_concurrent(1)*/ * FROM tbl1 WHERE c4 =?	SELECT
DROP OUTLINE outline1;
select QUERY_SQL,stmt_type from oceanbase.gv$ob_sql_audit where QUERY_SQL like "DROP OUTLINE outline1%" limit 1;
QUERY_SQL	stmt_type
DROP OUTLINE outline1	DROP_OUTLINE
PURGE RECYCLEBIN;
select QUERY_SQL,stmt_type from oceanbase.gv$ob_sql_audit where QUERY_SQL like "PURGE RECYCLEBIN%" limit 1;
QUERY_SQL	stmt_type
PURGE RECYCLEBIN	PURGE_RECYCLEBIN
SHOW RECYCLEBIN;
OBJECT_NAME	ORIGINAL_NAME	TYPE	CREATETIME
select QUERY_SQL,stmt_type from oceanbase.gv$ob_sql_audit where QUERY_SQL like "SHOW RECYCLEBIN%" limit 1;
QUERY_SQL	stmt_type
SHOW RECYCLEBIN	SHOW_RECYCLEBIN
DROP PACKAGE obdemo_pack;
ERROR 42000: PACKAGE 'test.obdemo_pack' does not exist
select QUERY_SQL,stmt_type from oceanbase.gv$ob_sql_audit where QUERY_SQL like  "DROP PACKAGE obdemo_pack%" limit 1;
QUERY_SQL	stmt_type
DROP PACKAGE obdemo_pack	DROP_PACKAGE
CREATE SEQUENCE seq1 START WITH 1 MINVALUE 1 MAXVALUE 10 INCREMENT BY 2 NOCYCLE NOORDER CACHE 30;
select QUERY_SQL,stmt_type from oceanbase.gv$ob_sql_audit where QUERY_SQL like "CREATE SEQUENCE seq1 START WITH 1 MINVALUE 1 MAXVALUE 10 INCREMENT BY 2 NOCYCLE NOORDER CACHE 30%" limit 1;
QUERY_SQL	stmt_type
CREATE SEQUENCE seq1 START WITH 1 MINVALUE 1 MAXVALUE 10 INCREMENT BY 2 NOCYCLE NOORDER CACHE 30	NONE
ALTER SEQUENCE seq1 MAXVALUE 1024 CYCLE;
select QUERY_SQL,stmt_type from oceanbase.gv$ob_sql_audit where QUERY_SQL like "ALTER SEQUENCE seq1 MAXVALUE 1024 CYCLE%" limit 1;
QUERY_SQL	stmt_type
ALTER SEQUENCE seq1 MAXVALUE 1024 CYCLE	NONE
DROP SEQUENCE seq1;
select QUERY_SQL,stmt_type from oceanbase.gv$ob_sql_audit where QUERY_SQL like "DROP SEQUENCE seq1%" limit 1;
QUERY_SQL	stmt_type
DROP SEQUENCE seq1	NONE
alter system flush sql audit global;
