#Environmental cleaning
drop user hjw@'%';
create user hjw identified by 'hjw';
grant all on *.* to hjw WITH GRANT OPTION;
#log-6   参数数值大小要求
#log-7   运算符对比
#log-8   参数特殊值
#log-9   sql静态
#log-10  视图的增删改查
#log-11  索引的增删改查
#log-12  约束的创建和增删改查
#log-6    参数数值大小要求
#log-6-1
SELECT log(22,'-1e-120');
log(22,'-1e-120')
NULL
SELECT log('22',-1e-128);
log('22',-1e-128)
NULL
SELECT log(22,'-1e-129');
log(22,'-1e-129')
NULL
SELECT log('22',-1e-130);
log('22',-1e-130)
NULL
SELECT log(22,'-1e-131');
log(22,'-1e-131')
NULL
SELECT log('22',-1e-1000);
log('22',-1e-1000)
NULL
SELECT log('-1e-120',55);
log('-1e-120',55)
NULL
SELECT log(-1e-128,'55');
log(-1e-128,'55')
NULL
SELECT log('-1e-129',55);
log('-1e-129',55)
NULL
SELECT log(-1e-130,'55');
log(-1e-130,'55')
NULL
SELECT log('-1e-131',55);
log('-1e-131',55)
NULL
SELECT log(-1e-1000,'55');
log(-1e-1000,'55')
NULL
#log-6-3
select log(9999999999999999999999999999999999999999999999999999999999999999999999);
log(9999999999999999999999999999999999999999999999999999999999999999999999)
161.1809565095832
select log(0.00000000000000000000000000000000000000000000000000000000000000000001);
log(0.00000000000000000000000000000000000000000000000000000000000000000001)
-156.5757863235951
select log(-0.0000000000000000000000000000000000000000000000000000000000000000000);
log(-0.0000000000000000000000000000000000000000000000000000000000000000000)
NULL
select log(-999999999999999999999999999999999999999999999999999999999999999999999);
log(-999999999999999999999999999999999999999999999999999999999999999999999)
NULL
drop table a;
create table a(id int(20),banji int(20));
insert into a(id,banji)value(1,6556);
insert into a(id,banji)value(2,2563);
select log(0.00000000000000000000000000000000000000000000000000000000000000000001) from a;
log(0.00000000000000000000000000000000000000000000000000000000000000000001)
-156.5757863235951
-156.5757863235951
select log(9999999999999999999999999999999999999999999999999999999999999999999999) from a;
log(9999999999999999999999999999999999999999999999999999999999999999999999)
161.1809565095832
161.1809565095832
select log(-0.00000000000000000000000000000000000000000000000000000000000000000001) from a;
log(-0.00000000000000000000000000000000000000000000000000000000000000000001)
NULL
NULL
drop table a;
#log-6-2
SELECT log(1e33f,9999999999999);
SELECT log(1e33f,0000000000001);
SELECT log(lef,999999999999999);
SELECT log(lef,000000000000001);
#log-7  算数运算符
#log-7-1
select log(1+2);
log(1+2)
1.0986122886681098
select log(1*2);
log(1*2)
0.6931471805599453
select log(1/2);
log(1/2)
-0.6931471805599453
select log(1-2);
log(1-2)
NULL
select log(1+2,2+1);
log(1+2,2+1)
1
select log(1*2,2*1);
log(1*2,2*1)
1
select log(1/2,2/1);
log(1/2,2/1)
-1
select log(1-2,2-1);
log(1-2,2-1)
NULL
select log2(1+2);
log2(1+2)
1.5849625007211563
select log2(1*2);
log2(1*2)
1
select log2(1/2);
log2(1/2)
-1
select log2(1-2);
log2(1-2)
NULL
select log10(1+2);
log10(1+2)
0.47712125471966244
select log10(1*2);
log10(1*2)
0.3010299956639812
select log10(1/2);
log10(1/2)
-0.3010299956639812
select log10(1-2);
log10(1-2)
NULL
select log2(1+2,2+1);
select log2(1*2,2*1);
select log2(1/2,2/1);
select log2(1-2,2-1);
create table a(id int(2),name varchar(20));
insert into a (id,name)value (1,"zhangsan");
insert into a (id,name)value (2,"lisi");
select log(1+2) from a;
log(1+2)
1.0986122886681098
1.0986122886681098
select log(1*2) from a;
log(1*2)
0.6931471805599453
0.6931471805599453
select log(1/2) from a;
log(1/2)
-0.6931471805599453
-0.6931471805599453
select log(1-2) from a;
log(1-2)
NULL
NULL
drop table a;
#log-7-2   对比运算符
select log(1>2);
log(1>2)
NULL
select log(1>=2);
log(1>=2)
NULL
select log(1<2);
log(1<2)
0
select log(1<=2);
log(1<=2)
0
select log(1=2);
log(1=2)
NULL
select log(1!=2);
log(1!=2)
0
select log2(1>=2);
log2(1>=2)
NULL
select log2(1<2);
log2(1<2)
0
select log2(1<=2);
log2(1<=2)
0
select log2(1=2);
log2(1=2)
NULL
select log2(1!=2);
log2(1!=2)
0
select log(1><2);
select log2(1><2);
#log-8  参数特殊值;
drop table a;
create table a(id int(20),banji int(20));
insert into a(id,banji)value(1,6556);
insert into a(id,banji)value(2,2563);
select log(%) from a;
select log(@) from a;
log(@)
NULL
NULL
select log(!) from a;
select log(%,6) from a;
select log(@,6) from a;
log(@,6)
NULL
NULL
drop table a;
create table a(id int(10),fenshu int(20));
insert into a (id,fenshu)value (1,99);
insert into a (id,fenshu)value (2,100);
select log(!,6) from a;
select log(%,6a6) from a;
select log(!,6a6) from a;
select log2(%) from a;
select log2(@) from a;
log2(@)
NULL
NULL
select log2(!) from a;
SELECT log2(7,'-9e120') FROM a;
SELECT log2('7',-9e125) FROM a;
SELECT log2(7,'-1e126') FROM a;
SELECT log2('7',-1e140) FROM a;
drop table a;
SELECT log(-1.50e1,3a-30);
SELECT log('-1.50e1',3a-30);
SELECT log('1',3a-30);
SELECT log(1,3a-30);
SELECT log(-1,3a-30);
SELECT log('-1','3a-30');
log('-1','3a-30')
NULL
SELECT log('0a-12','3a-30');
log('0a-12','3a-30')
NULL
SELECT log(0e-12,'3a-30');
log(0e-12,'3a-30')
NULL
SELECT log('0','3a-30');
log('0','3a-30')
NULL
SELECT log(0,'3a-30');
log(0,'3a-30')
NULL
SELECT log(0f,'3a30');
SELECT log(0d,'3a-30');
SELECT log('-1.50d',3a-30);
SELECT log('','');
log('','')
NULL
SELECT log('',1);
log('',1)
NULL
SELECT log(5,'');
log(5,'')
NULL
SELECT log(NULL,NULL);
log(NULL,NULL)
NULL
SELECT log(NULL,1);
log(NULL,1)
NULL
SELECT log(5,NULL);
log(5,NULL)
NULL
SELECT log('10f',1),log(2,'10d');
log('10f',1)	log(2,'10d')
0	3.3219280948873626
SELECT MOD(log('   123   ','12')/10,2);
MOD(log('   123   ','12')/10,2)
0.0516378107379407
select log('汉字');
log('汉字')
NULL
select log(汉字);
#log-9   sql静态 单列/多列的查询
#log-9-1  insert  
#log-9-1-1  value
drop table a;
create table a(id int(2),name varchar(20));
insert into a (id,name)value (1,"zhangsan");
insert into a (id,name)value (2,"lisi");
select * from a;
id	name
1	zhangsan
2	lisi
insert into a (id,name)values (3,"log");
SELECT (SELECT log(6))from a;
(SELECT log(6))
1.791759469228055
1.791759469228055
1.791759469228055
select * from a;
id	name
1	zhangsan
2	lisi
3	log
insert into a (id,name)value (SELECT log(6),"xiaobai");
insert into a (id,name)value (SELECT log(6)),select log("xiaocai");
insert into a (id,name)value (SELECT log(6,'8'),select log('jiugui'));
insert into a (id)value (SELECT log2(7,*));
insert into a (id,name)value (SELECT log2('7',*),select log2(4,'*'));
insert into a (id,name)value (SELECT log2(^,*));
insert into a (id)value (SELECT log(a));
insert into a (id,name)value (SELECT log(a),select log('b'));
drop table a;
#9-1-2   insert into
drop table a;
create table a(id int(2),name varchar(20));
insert into a (id,name)value (1,"zhangsan");
insert into a (id,name)value (2,"lisi");
DELETE FROM a WHERE 1=1;
INSERT INTO a VALUE(0.6931471,1.94591123);
INSERT INTO a(id) VALUE(6.9314718);
INSERT INTO a(id) SELECT id FROM a WHERE id<>1 GROUP BY id,name HAVING log(id,name) IS NOT NULL;
SELECT * FROM a;
id	name
1	1.94591123
7	NULL
drop table a;
#log-9-2 update
drop table test1;
create table test1(f1 int(10),f2 int(10));
DELETE FROM test1 WHERE 1=1;
INSERT INTO test1 VALUE('20.1','30');
UPDATE test1 SET f1 = log(5,55) WHERE f1>log(10,111);
SELECT * FROM test1;
f1	f2
2	30
UPDATE test1 SET f1 = log(6,425d),f2=log(f2,5f)/10 WHERE f1>log(10,99);
SELECT * FROM test1;
f1	f2
2	30
DELETE FROM test1 WHERE 1=1;
INSERT INTO test1 VALUES('20.1','30');
INSERT INTO test1 VALUES('20.2',NULL);
INSERT INTO test1 VALUES(5.5,99);
UPDATE test1 SET f1 = '5' WHERE f1=55;
SELECT * FROM test1;
f1	f2
20	30
20	NULL
6	99
drop table test1;
#log-9-3
drop table test1;
create table test1(f1 int(10),f2 int(10));
DELETE FROM test1 WHERE 1=1;
INSERT INTO test1 VALUES('20.1','30');
DELETE FROM test1 WHERE log(f1,f2)<>1;
SELECT * FROM test1;
f1	f2
INSERT INTO test1 VALUES('20.1','30');
DELETE FROM test1 WHERE f1=20.1>0;
SELECT * FROM test1;
f1	f2
20	30
INSERT INTO test1 VALUES('20.1','30');
SELECT * FROM test1;
f1	f2
20	30
20	30
DELETE FROM test1 WHERE f1=20.1 >= 0;
INSERT INTO test1 VALUES('20.1','30');
DELETE FROM test1 WHERE f2=30<0;
SELECT * FROM test1;
f1	f2
20	30
INSERT INTO test1 VALUES('20.1','30');
DELETE FROM test1 WHERE f2=30 <= 0;
SELECT * FROM test1;
f1	f2
20	30
20	30
INSERT INTO test1 VALUES('20.1','30');
DELETE FROM test1 WHERE f1=30 = 30;
SELECT * FROM test1;
f1	f2
20	30
20	30
20	30
INSERT INTO test1 VALUES('20.1','30');
DELETE FROM test1 WHERE f1=30 != 30;
SELECT * FROM test1;
f1	f2
DROP TABLE test1;
#log-9-4  select
drop table test1;
CREATE TABLE test1(f1 varchar(30),f2 varchar(30));
INSERT INTO test1 VALUES('20.1','30');
INSERT INTO test1 VALUES('20.1','40');
INSERT INTO test1 VALUES('0.1','30');
INSERT INTO test1 VALUES('0.1','40');
#9-4-1      select
SELECT log(f1,f2) FROM test1;
log(f1,f2)
1.1334604999062354
1.2293315209217535
-1.4771212547196626
-1.6020599913279625
#9-4-2      from
SELECT log(m+10,n+5),log(n+5,m+10) FROM (SELECT log(f1,f2) m,log(f2,f1) n FROM test1);
log(m+10,n+5)	log(n+5,m+10)
0.7352585372977971	1.3600658125986185
0.7277870397898952	1.3740283150531092
0.6832101257595342	1.4636785409002626
0.6936558275860951	1.441637135061598
#9-4-3      where
SELECT * FROM test1 WHERE log(f1,f2)>log(f2,f1) AND log(f1,f2) IN (log(20.1,40),log(0.1,30));
f1	f2
20.1	40
#9-4-4      group by having
SELECT * FROM test1 GROUP by f2;
f1	f2
20.1	30
20.1	40
SELECT * FROM test1 HAVING f2;
f1	f2
20.1	30
20.1	40
0.1	30
0.1	40
SELECT * FROM test1 GROUP BY f1,f2 HAVING log(round(f1,3),f2)*log(round(f2,3),f2)<>0;
f1	f2
20.1	30
20.1	40
0.1	30
0.1	40
#9-4-5      order by
SELECT f1,log(f2,f1) FROM test1 ORDER BY log(f1,f2) DESC;
f1	log(f2,f1)
20.1	0.8134502231344394
20.1	0.8822539471668613
0.1	-0.6769924925288454
0.1	-0.6241963505817848
#9-4-6      case when
SELECT sum(CASE WHEN log(f1,f2)>0 THEN 2 ELSE 1 END ) FROM test1;
sum(CASE WHEN log(f1,f2)>0 THEN 2 ELSE 1 END )
6
SELECT sum(log(CASE WHEN  log(f1,f2)>0 THEN 2 ELSE 3 END,10)/log(f2,f1)) FROM test1;
sum(log(CASE WHEN  log(f1,f2)>0 THEN 2 ELSE 3 END,10)/log(f2,f1))
1.3953591406424972
SELECT sum(log(CASE f2 WHEN '30' THEN log(f1,f2+11) WHEN '40' THEN log(f1+100,f2) ELSE 10 END,55)/log(f1,f2)) t1 FROM  test1 WHERE f1>1;
t1
4.091132050434389
SELECT sum(log(CASE log(f2,f1) WHEN log(30,0.1) THEN 2 ELSE 3 END,555)) FROM test1;
sum(log(CASE log(f2,f1) WHEN log(30,0.1) THEN 2 ELSE 3 END,555))
26.371661908046068
#9-4-7      distinct
SELECT DISTINCT log(f1,f2) FROM test1;
log(f1,f2)
1.1334604999062354
1.2293315209217535
-1.4771212547196626
-1.6020599913279625
DROP TABLE test1;
#log-10  视图的增删改查
drop table b;
drop view shitu;
CREATE TABLE b(f1 int(10),f2 int(10));
INSERT INTO b VALUES(20.1,10);
INSERT INTO b VALUES(20.1,40);
INSERT INTO b VALUES(20.1,30);
INSERT INTO b VALUES(20.1,40);
CREATE OR REPLACE VIEW shitu AS SELECT * FROM b;
#log-10-1  select
SELECT log(f1,33),log(f2,33) FROM shitu;
log(f1,33)	log(f2,33)
1.167162897810756	1.5185139398778873
1.167162897810756	0.9478508595793452
1.167162897810756	1.0280225370977285
1.167162897810756	0.9478508595793452
SELECT * FROM shitu GROUP BY f1,f2 HAVING log(3333333333333333333333333333333333333,round(f1,3))*log(3,round(f2,3))<>0;
f1	f2
20	10
20	40
20	30
SELECT f1,log(f2,50) FROM shitu ORDER BY log(f2,22222222222222222222222222222222222222222222222222) DESC;
f1	log(f2,50)
20	1.6989700043360185
20	1.1501899379671847
20	1.060490876454462
20	1.060490876454462
SELECT sum(CASE WHEN log(5,f1)>0 THEN 2 ELSE 1 END ) FROM shitu;
sum(CASE WHEN log(5,f1)>0 THEN 2 ELSE 1 END )
8
SELECT sum(log((CASE WHEN  log(3,f1)>0 THEN 2 ELSE 1 END),50)/log(f2,60)) FROM shitu;
sum(log((CASE WHEN  log(3,f1)>0 THEN 2 ELSE 1 END),50)/log(f2,60))
18.032272854318585
SELECT sum(log(2.8,(CASE f2 WHEN 10 THEN log(f1,20) WHEN 30 THEN log(f1+100,30) ELSE 10 END))/log(f1,55)) t1 FROM  shitu;
t1
3.095393087285223
SELECT sum(log(9,(CASE log(f2,20) WHEN log(f2,20) THEN 1 ELSE 2 END))) FROM shitut;
SELECT DISTINCT log(f1,100) FROM shitu;
log(f1,100)
1.537243573680482
SELECT log(10,f1) FROM shitu WHERE log(2.5,f1)>log(2.5,f2) AND log(5.5,f1)=SOME(log(5.5,f1),log(5.5,f2)) GROUP BY log(10,f1) HAVING log(10,f1)>0;
SELECT b(log(3,f1)),shitu.* FROM shitu WHERE table(log(3,f1*f2),5)!=log(3,f1+f2) GROUP BY f1,f2 HAVING log(3,f1)>0;
WITH a AS (SELECT log(f2,100) m FROM shitu), b AS (SELECT log(f2,100) n,log(f2,20)*12 FROM shitu) SELECT a.*,b.* FROM a INNER JOIN b ON a.m=b.n;
m	n	log(f2,20)*12
1.2483927011635698	1.2483927011635698	9.745178103490709
1.2483927011635698	1.2483927011635698	9.745178103490709
1.2483927011635698	1.2483927011635698	9.745178103490709
1.2483927011635698	1.2483927011635698	9.745178103490709
1.353984985057691	1.353984985057691	10.56945047543222
2	2	15.612359947967771
#log-10-2  insert
drop table b;
drop view shitu;
CREATE TABLE b(f1 int(10),f2 int(10));
INSERT INTO b VALUES(20.1,10);
INSERT INTO b VALUES(20.1,40);
INSERT INTO b VALUES(20.1,30);
INSERT INTO b VALUES(20.1,40);
CREATE OR REPLACE VIEW shitu AS SELECT * FROM b;
DELETE FROM b WHERE 1=1;
INSERT INTO shitu VALUE(f1(log(2,88),7),f1(log(7,20),5)||'123');
INSERT INTO shitu(f1) VALUE(f1(log(2,30)*10-log(55,1),7));
INSERT INTO shitu(f1) SELECT f1 FROM shitu WHERE f1>1 GROUP BY f1 HAVING log(5,f1) IS NOT NULL;
SELECT * FROM shitu;
f1	f2
drop view shitu;
drop table b;
#log-10-3   update
drop table b;
drop view shitu;
CREATE TABLE b(f1 int(10),f2 int(10));
INSERT INTO b VALUES(20.1,10);
INSERT INTO b VALUES(20.1,40);
INSERT INTO b VALUES(20.1,30);
INSERT INTO b VALUES(20.1,40);
CREATE OR REPLACE VIEW shitu AS SELECT * FROM b;
select * from shitu;
f1	f2
20	10
20	40
20	30
20	40
UPDATE shitu set f1=20.999 where f1=20.1;
select * from shitu;
f1	f2
20	10
20	40
20	30
20	40
UPDATE shitu SET f1 = log(6,20),f2=log(1.5,f2)/10 WHERE f1<log(10,1000);
select * from shitu;
f1	f2
20	10
20	40
20	30
20	40
UPDATE shitu SET f1 = log((SELECT sum(log(f2,10)) FROM shitu WHERE f1>0),3);
select * from shitu;
f1	f2
1	10
1	40
1	30
1	40
UPDATE shitu SET f1 = log((SELECT f2 FROM shitu WHERE f1>0 GROUP BY f2 HAVING log(f2,100) IS NOT NULL),3);
UPDATE shitu SET f1 = log((SELECT * FROM (SELECT log(f2,100) FROM shitu WHERE f2 BETWEEN log(0.1,1) AND log(3,1e20) ORDER BY log(f1,100) DESC)),3);
drop view shitu;
drop table b;
#log-10-4   delete
drop table b;
drop view shitu;
CREATE TABLE b(f1 int(10),f2 int(10));
INSERT INTO b VALUES(20.1,10);
INSERT INTO b VALUES(20.1,40);
INSERT INTO b VALUES(20.1,30);
INSERT INTO b VALUES(20.1,40);
CREATE OR REPLACE VIEW shitu AS SELECT * FROM b;
DELETE FROM shitu WHERE 1=1;
DELETE FROM shitu WHERE log(f1,20)<>0;
SELECT * FROM shitu;
f1	f2
drop table b;
DROP view shitu;
#log-11  索引的增删改查
drop table b;
CREATE TABLE b(f1 int(10),f2 int(10));
SELECT * from b;
f1	f2
CREATE INDEX b ON b(f1);
SELECT * from b;
f1	f2
INSERT INTO b VALUES(log(0.3,101),log(3,101));
SELECT * FROM b;
f1	f2
-4	4
UPDATE b SET f1=log(1.5,2222);
SELECT * FROM b;
f1	f2
19	4
SELECT log(f1,f2),log(f2,f1+10) FROM b;
log(f1,f2)	log(f2,f1+10)
0.4708178267332765	2.4289904975637864
DELETE FROM b WHERE log(f1,10)>0;
SELECT * FROM b;
f1	f2
drop table b;
#log-12  约束的创建和增删改查
#log-12-1  约束的创建
drop table hz;
create table hz(id int(10),name varchar(10),fenshu int(10),banji int(10),xuexiao varchar(10));
insert into hz(id,name,fenshu,banji,xuexiao)value(1,"zhansan",99,6224,"ligong"),(2,"xiaoli",100,6223,"henankeji"),(3,"xiaoai",99,6223,"nongye"),(4,"xiaocao",100,6224,"zheda");
#外键
drop table book;
create table book(id int(10) references book(id));
drop table book;
#log-12-2  约束的增删改查
drop table hz;
create table hz(f1 int(10));
INSERT INTO hz(f1) VALUES(log(1.5,15));
SELECT * FROM hz;
f1
7
INSERT INTO hz(f1) VALUES(log(10,100));
SELECT * FROM hz;
f1
7
2
UPDATE hz SET f1 = log(2,14)+1 WHERE f1 = log(1.5,15);
SELECT * FROM hz;
f1
7
2
UPDATE hz SET f1 = log(1.1,555) WHERE f1 = log(2,14)+1;
SELECT * FROM hz;
f1
7
2
SELECT * FROM hz;
f1
7
2
DELETE FROM hz WHERE log(f1,44)<>0;
SELECT * FROM hz;
f1
SELECT * FROM hz;
f1
drop table hz;
# Clean up users
drop user hjw@'%' ;
