alter system set _enable_add_fulltext_index_to_existing_table = true;
drop table if exists customers;
CREATE TABLE customers (
id BIGINT not null primary key,
modified  BIGINT not null,
custinfo JSON,
INDEX zips1( (CAST(custinfo->'$.zipcode' AS UNSIGNED ARRAY)) )
);
INSERT INTO customers VALUES 
(10, 21, '{"user":"Jack","user_id":37,"zipcode":[94582,94536]}'),
(11, 22, '{"user":"Jill","user_id":22,"zipcode":[94568,94507,94582]}'),
(12, 23, '{"user":"Bob","user_id":31,"zipcode":[94477,94507]}'),
(13, 24, '{"user":"Mary","user_id":72,"zipcode":[94536]}'),
(14, 25, '{"user":"Ted","user_id":56,"zipcode":[94507,94582]}');
update customers set custinfo = '{"user":"Jack","user_id":37,"zipcode":[32668,82468]}' where id = 10;
drop table customers;
drop table if exists index_test1;
CREATE TABLE index_test1 (
id BIGINT not null primary key,
c1 BIGINT not null,
c2 BIGINT not null,
c3 BIGINT not null,
custinfo JSON,
INDEX zips1( (CAST(custinfo->'$.zipcode' AS char(16) ARRAY)) )
);
INSERT INTO index_test1 VALUES 
(10, 21, 31, 41, '{"user":"Jack","user_id":37,"zipcode":["pk10_1", "pk10_2"]}'),
(11, 22, 32, 42, '{"user":"Jill","user_id":22,"zipcode":["pk11_1", "pk11_2", "pk11_3"]}'),
(12, 23, 33, 43, '{"user":"Bob","user_id":31,"zipcode":["pk12_1", "pk12_2", "pk12_3"]}'),
(13, 24, 34, 44, '{"user":"Mary","user_id":72,"zipcode":["pk13_1", "pk13_2", "pk13_3"]}'),
(14, 25, 35, 45, '{"user":"Ted","user_id":56,"zipcode":["pk14_1", "pk14_2"]}');
update index_test1 set custinfo = '{"user":"Jack","user_id":37,"zipcode":["pk10_1_new", "pk10_2_new"]}' where id = 10;
drop table index_test1;
drop table if exists index_test2;
CREATE TABLE index_test2 (
id BIGINT not null primary key,
modified  BIGINT not null,
custinfo JSON,
INDEX zips1( (CAST(custinfo->'$.zipcode' AS DOUBLE ARRAY)) )
);
INSERT INTO index_test2 VALUES 
(10, 21, '{"user":"Jack","user_id":37,"zipcode":[9.4582, 9.4536]}'),
(11, 22, '{"user":"Jill","user_id":22,"zipcode":[9.4568, 9.4507, 9.4582]}'),
(12, 23, '{"user":"Bob","user_id":31,"zipcode":[9.4477, 9.4507]}'),
(13, 24, '{"user":"Mary","user_id":72,"zipcode":[9.4536]}'),
(14, 25, '{"user":"Ted","user_id":56,"zipcode":[9.4507, 9.4582]}');
update index_test2 set custinfo = '{"user":"Jack","user_id":37,"zipcode":[3.2668, 8.2468]}' where id = 10;
drop table index_test2;
drop table if exists customers;
CREATE TABLE customers (
id BIGINT not null primary key,
c1 BIGINT not null,
modified  BIGINT not null,
custinfo JSON,
INDEX comp(c1, modified,
(CAST(custinfo->'$.zipcode' AS UNSIGNED ARRAY)) )
);
INSERT INTO customers VALUES 
(10, 21, 101, '{"user":"Jack","user_id":37,"zipcode":[94582,94536]}'),
(11, 22, 102, '{"user":"Jill","user_id":22,"zipcode":[94568,94507,94582]}'),
(12, 23, 103, '{"user":"Bob","user_id":31,"zipcode":[94477,94507]}'),
(13, 24, 104, '{"user":"Mary","user_id":72,"zipcode":[94536]}'),
(14, 25, 105, '{"user":"Ted","user_id":56,"zipcode":[94507,94582]}');
update customers set custinfo = '{"user":"Jack","user_id":37,"zipcode":[32668,82468]}' where id = 10;
drop table customers;
drop table if exists customers;
CREATE TABLE customers (
id BIGINT not null primary key,
modified  BIGINT not null,
custinfo JSON,
UNIQUE INDEX zips1( (CAST(custinfo->'$.zipcode' AS UNSIGNED ARRAY)) )
);
INSERT INTO customers VALUES 
(10, 21, '{"user":"Jack","user_id":37,"zipcode":[94582,94536]}');
INSERT INTO customers VALUES 
(11, 22, '{"user":"Jill","user_id":22,"zipcode":[94568,94507,94582]}');
ERROR 23000: Duplicate entry '94582' for key 'zips1'
drop table customers;
drop table if exists long_pk_test;
CREATE TABLE long_pk_test (
id varchar(128) not null primary key,
modified  BIGINT not null,
custinfo JSON,
INDEX zips1( (CAST(custinfo->'$.zipcode' AS UNSIGNED ARRAY)) )
);
INSERT INTO long_pk_test VALUES 
('1001along_test_as_primary_key_for_test_multivlaue_key', 21, '{"user":"Jack","user_id":37,"zipcode":[94582,94536, 98214,93942, 92273, 96213]}'),
('1002along_test_as_primary_key_for_test_multivlaue_key', 21, '{"user":"Jack","user_id":37,"zipcode":[94582,94536]}'),
('1003along_test_as_primary_key_for_test_multivlaue_key', 22, '{"user":"Jill","user_id":22,"zipcode":[94568,94507,94582]}'),
('1004along_test_as_primary_key_for_test_multivlaue_key', 23, '{"user":"Bob","user_id":31,"zipcode":[94477,94507]}'),
('1005along_test_as_primary_key_for_test_multivlaue_key', 24, '{"user":"Mary","user_id":72,"zipcode":[94536]}'),
('1006along_test_as_primary_key_for_test_multivlaue_key', 25, '{"user":"Ted","user_id":56,"zipcode":[94507,94582]}');
drop table long_pk_test;
drop table if exists test_array;
create table test_array(id int,a varchar(50),j json,INDEX index_1( (CAST(j->'$.*' AS UNSIGNED ARRAY))) );
drop table if exists test_array;
drop table if exists test_array;
create table test_array(id int,a varchar(50),j json,INDEX index_1( (CAST(j->'$.key' AS UNSIGNED ARRAY))) );
insert into test_array values(1,'test','{"key":[1,2,3,4]}');
insert into test_array values(1,'test','{"key":"8.36"}');
ERROR 42000: Invalid JSON value for CAST for functional index.
replace into test_array values(1,'test','{"key":[{}]}');
ERROR 42000: This version of MySQL doesn't yet support CAST-ing JSON OBJECT type to array
update test_array set j='{"key":[[1,2]]}';
ERROR 42000: Cannot store an array or an object in a scalar key part of the index.
drop table if exists test_array;
drop table if exists test_array;
create table test_array(id int,a varchar(50),j json,INDEX index_1( (CAST(j->'$.key' AS UNSIGNED ARRAY))) );
insert into test_array values(1,'test','{"key":{}}');
ERROR 42000: This version of MySQL doesn't yet support CAST-ing JSON OBJECT type to array
insert into test_array values(1,'test','{"key":[null]}');
ERROR 42000: Invalid JSON value for CAST for functional index.
insert into test_array values(1,'test','{"key":null}');
ERROR 42000: Invalid JSON value for CAST for functional index.
insert into test_array values(1,'test','{"key":false}');
drop table if exists test_array;
drop table if exists test_array;
create table test_array(id int,a varchar(50),j json, INDEX index_1( (CAST(j->'$.key' AS UNSIGNED ARRAY))) );
insert into test_array values(1,'test','{"key":[1,2,3]}');
insert into  test_array values(1,'test','{"key1":[1,2,3]}');
update test_array set j='[1,2,4]';
drop table if exists test_array;
alter system set default_table_store_format = 'column';
drop table if exists test_array;
drop function if exists f1;
CREATE TABLE test_array (   `sidea` time DEFAULT NULL,   `sideb` time DEFAULT NULL,   `sidec` text GENERATED ALWAYS AS ((`sidea` + `sideb`)) VIRTUAL );
CREATE FUNCTION `f1`() RETURNS varchar(65525) RETURN 'Hello';
SELECT * FROM test_array WHERE "777" MEMBER OF (f1->"$[*]");
sidea	sideb	sidec
drop table if exists test_array;
drop table if exists test_array;
create table test_array(id int,a varchar(50),j json,INDEX index_1( (CAST(j->'$[*]' AS UNSIGNED ARRAY))) );
insert into test_array values(1,'test','[1,2,3,4]');
drop table if exists test_array;
drop table if exists compare_const;
create table compare_const (c1 json not null);
select * from compare_const where compare_const.c1 BETWEEN "false" AND "\"json string2\"";
c1
drop table compare_const;
drop table if exists table_events;
CREATE TABLE table_events( 
id int auto_increment primary key, 
event_name varchar(255), 
visitor varchar(255), 
properties json, 
browser json,
INDEX idx_features((CAST(properties->'$.amount' AS char(500) ARRAY)))  ,
INDEX idx_features2((CAST(browser->'$.name' AS char(500) ARRAY)))
);
INSERT INTO table_events(event_name, visitor,properties, browser) 
VALUES (
'pageview', 
'1',
'{ "page": "/" }',
'{ "name": "Safari", "os": "Mac", "resolution": { "x": 1920, "y": 1080 } }'
);
drop table table_events;
drop table if exists customers7;
CREATE TABLE customers7 (
id BIGINT NOT NULL AUTO_INCREMENT PRIMARY KEY,
modified DATETIME DEFAULT CURRENT_TIMESTAMP ON UPDATE CURRENT_TIMESTAMP,
custinfo JSON,
UNIQUE INDEX zips1( (CAST(custinfo->'$.zipcode' AS UNSIGNED ARRAY)) )
);
INSERT INTO customers7 VALUES
(NULl, NOW(), '{"user":"Jack","user_id":37,"zipcode":[99582,94536]}'),
(NULl, NOW(), '{"user":"Jill","user_id":22,"zipcode":[94568,94507,94582]}'),
(NULl, NOW(), '{"user":"Bob","user_id":31,"zipcode":[94477,94517]}'),
(NULl, NOW(), '{"user":"Mary","user_id":72,"zipcode":[94566]}'),
(NULl, NOW(), '{"user":"Ted","user_id":56,"zipcode":[94508,94583]}');
drop table customers7;
drop table if exists test;
create table test(id int,a varchar(50),j json,INDEX index_1( (CAST(j->'$.key' AS DECIMAL ARRAY))) );
insert into test values(1,'test','{"key":[1,4]}');
drop table test;
create table test(id int,a varchar(50),j json,INDEX index_1( (CAST(j->>'$[*]' AS UNSIGNED ARRAY))) );
insert into test values(1,'test','[true,false]');
insert into test values(1,'test','[true]');
insert into test values(1,'test','[false]');
drop table test;
create table test(id int,a varchar(50),j json, INDEX index_1( (CAST(j->'$.key' AS BINARY(20) ARRAY))) );
insert into test values(1,'test','{"key":["test","test1"]}');
select * from test where json_array('test' ) MEMBER OF (j->'$.key');
id	a	j
select * from test where cast('["test","test1"]' as json) MEMBER OF (j->'$.key');
id	a	j
drop table test;
create table test(id int,a varchar(50),j json, INDEX index_1( (CAST(j->>'$[*]' AS DATETIME(4) ARRAY))) );
insert into test values(1,'test','[1]');
ERROR 42000: Invalid JSON value for CAST for functional index.
drop table test;
create table test(id int,a varchar(50),j json, INDEX index_1( (CAST(j->'$[*]' AS DECIMAL ARRAY)))) ;
insert into test values(1,'test','{"key":[23]}');
delete from test;
drop table test;
drop table if exists t_multivalue;
drop table if exists articles;
CREATE TABLE `t_multivalue` (
`c1` int(11) NOT NULL,
`id` bigint(20) NOT NULL,
`modified` bigint(20) NOT NULL,
`custinfo` json DEFAULT NULL,
PRIMARY KEY (`c1`),
INDEX `multi_zips` ((cast(`custinfo`->'$.zipcode' AS unsigned ARRAY)))
) DEFAULT CHARSET = utf8mb4 ROW_FORMAT = DYNAMIC COMPRESSION = 'lz4_1.0' REPLICA_NUM = 3 BLOCK_SIZE = 16384 USE_BLOOM_FILTER = FALSE TABLET_SIZE = 134217728 PCTFREE = 0
partition by hash(c1)
(partition `p0`,
partition `p1`,
partition `p2`);
CREATE TABLE `articles` (
`id` int(10) unsigned NOT NULL AUTO_INCREMENT,
`tid` int(11) NOT NULL,
`title` varchar(200) DEFAULT NULL,
`content` text DEFAULT NULL,
PRIMARY KEY (`id`, `tid`),
FULLTEXT KEY `ctx1` (`title`, `content`) WITH PARSER space BLOCK_SIZE 16384,
FULLTEXT KEY `ctx2` (`title`, `content`) WITH PARSER space BLOCK_SIZE 16384,
FULLTEXT KEY `ctx3` (`title`, `content`) WITH PARSER space BLOCK_SIZE 16384,
KEY `idx1` (`title`) BLOCK_SIZE 16384 GLOBAL,
KEY `idx2` (`title`, `id`) BLOCK_SIZE 16384 LOCAL
) AUTO_INCREMENT = 4 AUTO_INCREMENT_MODE = 'ORDER' DEFAULT CHARSET = utf8mb4 ROW_FORMAT = DYNAMIC COMPRESSION = 'lz4_1.0' REPLICA_NUM = 3 BLOCK_SIZE = 16384 USE_BLOOM_FILTER = FALSE TABLET_SIZE = 134217728 PCTFREE = 0
partition by hash(id) subpartition by hash(tid) subpartition template (
subpartition `p0`,
subpartition `p1`)
(partition `p0`,
partition `p1`,
partition `p2`);
select   subq_0.c2 as c0,  subq_0.c8 as c1,  subq_0.c3 as c2,  (select modified from t_multivalue order by 1 desc  limit 1 offset 3)  as c3,  nullif( cast(cast(ifnull( count( cast(99 as DECIMAL)) over (partition by subq_0.c7,subq_0.c3 order by subq_0.c12), 29) as DECIMAL) as DECIMAL), cast(cast(null as CHAR) as CHAR)) as c4 from  (select   12 as c0,  if( 50 = 27 , ref_0.custinfo , cast(null as JSON) )  as c1,  6 as c2,  case when EXISTS ( select   18 as c0,  26 as c1,  37 as c2,  88 as c3,  43 as c4,  90 as c5,  38 as c6,  78 as c7,  96 as c8 from  t_multivalue as ref_1 where ((EXISTS ( select   83 as c0,  17 as c1,  77 as c2 from  t_multivalue as ref_2 where 65 DIV 30 limit 102))  or (0))  or ((24 in ( 29,  79))  or (cast(null as CHAR) not  in ( cast(null as CHAR),  cast(null as CHAR)))) limit 74) then cast(ifnull(73, 86) as DECIMAL) else 59 end  as c3,  21 as c4,  52 as c5,  if( EXISTS ( select   63 as c0,  39 as c1,  34 as c2,  100 as c3,  63 as c4,  47 as c5,  37 as c6,  15 as c7,  40 as c8,  88 as c9,  87 as c10,  91 as c11,  56 as c12,  32 as c13,  95 as c14,  61 as c15,  95 as c16 from  articles as ref_3 where 35 in ( 47,  90,  60) limit 135) ,  avg( cast(36 as DECIMAL)) over (partition by ref_0.modified order by ref_0.c1) , ref_0.id )  as c6,  ref_0.c1 as c7,  25 as c8,  19 as c9,  70 as c10,  case when EXISTS ( select distinct  44 as c0,  68 as c1,  4 as c2,  32 as c3,  38 as c4,  24 as c5,  6 as c6,  41 as c7,  86 as c8,  61 as c9,  36 as c10,  94 as c11,  6 as c12,  85 as c13,  87 as c14,  10 as c15 from  t_multivalue as ref_4 where EXISTS ( select   52 as c0,  11 as c1,  71 as c2,  19 as c3,  83 as c4,  72 as c5,  77 as c6,  90 as c7,  100 as c8,  5 as c9,  4 as c10,  100 as c11,  4 as c12,  80 as c13,  90 as c14,  64 as c15,  70 as c16,  80 as c17,  75 as c18 from  articles as ref_5 where EXISTS ( select   100 as c0,  54 as c1 from  articles as ref_6 where EXISTS ( select   31 as c0 from  t_multivalue as ref_7 where EXISTS ( select distinct  32 as c0,  73 as c1,  1 as c2,  89 as c3 from  articles as ref_8 where cast(null as CHAR) not  in ( cast(null as CHAR),  "\\I\\0\\\r\\\026\\H\\<\\\022\\2\\7\\=\\'%",  cast(null as CHAR)) limit 88))) limit 143) limit 102) then ref_0.modified else ref_0.modified end  as c11,  99 as c12 from  t_multivalue as ref_0 where ref_0.c1 not  in ( 82,  case when EXISTS ( select   86 as c0 from  t_multivalue as ref_9 where EXISTS ( select distinct  26 as c0 from  articles as ref_10 where 72 MOD 73 limit 132) limit 74) then 19 else 88 end ) limit 84) as subq_0 where subq_0.c5 < cast(coalesce(cast(nullif(31, 66) as DECIMAL), 39) as DECIMAL);
c0	c1	c2	c3	c4
drop table if exists t_multivalue;
drop table if exists articles;
set binlog_row_image='MINIMAL';
drop table if exists items;
CREATE TABLE items (
id INT AUTO_INCREMENT PRIMARY KEY,
name VARCHAR(255) NOT NULL,
attributes JSON,
UNIQUE  INDEX idx_sizes( (CAST(JSON_EXTRACT(attributes, '$.size') AS UNSIGNED ARRAY)) )
);
INSERT INTO items (name, attributes) VALUES 
('Item A', '{"size": [1, 22, 3]}'),
('Item B', '{"size": [11, 7]}'),
('Item C', '{"size": [92, 90, 4, 5]}'),
('Item D', '{"size": [99]}'), 
('Item E', '{"size": [2, 6]}');
delete from items;
truncate table items;
drop table if exists items;
drop table if exists adb_tb_sycm_grd_kw_ext_algo_1d_new;
CREATE TABLE `adb_tb_sycm_grd_kw_ext_algo_1d_new` (
`auto_id` bigint(20) NOT NULL COMMENT '自增列',
`se_keyword` varchar(2000) COLLATE utf8mb4_bin DEFAULT NULL COMMENT 'key.搜索词',
`keyword_list` json DEFAULT NULL,
`is_lgt_keyword` text COLLATE utf8mb4_bin DEFAULT NULL COMMENT 'prp.是否长尾词',
`cate_id` bigint(20) DEFAULT NULL COMMENT 'prp.类目ID',
`cate_level1_id` bigint(20) DEFAULT NULL COMMENT 'prp.一级类目ID',
`cate_level2_id` bigint(20) DEFAULT NULL COMMENT 'prp.二级类目ID',
`pay_ord_amt_1d_038` double DEFAULT NULL COMMENT 'met.最近1天全引导支付金额',
`pay_ord_byr_cnt_1d_037` bigint(20) DEFAULT NULL COMMENT 'met.最近1天全引导支付买家数',
`se_spv_1d_021` bigint(20) DEFAULT NULL COMMENT 'met.最近1天搜索SPV',
`se_ipv_uv_1d_003` bigint(20) DEFAULT NULL COMMENT 'met.最近1天搜索L-I的IPV_UV',
`se_ipv_1d_010` bigint(20) DEFAULT NULL COMMENT 'met.最近1天搜索L-I的IPV ',
`se_ipv_1d_028` bigint(20) DEFAULT NULL COMMENT 'met.最近1天天猫商城搜索全引导搜索IPV',
`pay_ord_amt_1d_034` double DEFAULT NULL COMMENT 'met.最近1天pc端全引导支付金额',
`pay_ord_byr_cnt_1d_750` bigint(20) DEFAULT NULL COMMENT 'met.最近1天PC全引导支付买家数',
`se_spv_pc_1d_006` bigint(20) DEFAULT NULL COMMENT 'met.最近1天PC端搜索SPV',
`se_ipv_uv_pc_1d_010` bigint(20) DEFAULT NULL COMMENT 'met.最近1天PC端搜索引导IPV_UV',
`se_ipv_pc_1d_005` bigint(20) DEFAULT NULL COMMENT 'met.最近1天PC端搜索引导IPV',
`se_ipv_pc_1d_028` bigint(20) DEFAULT NULL COMMENT 'met.最近1天PC端天猫商城搜索全引导IPV_PC',
`pay_ord_amt_1d_059` double DEFAULT NULL COMMENT 'met.最近1天无线端全引导支付金额',
`pay_ord_byr_cnt_1d_053` bigint(20) DEFAULT NULL COMMENT 'met.最近1天无线端全引导支付买家数',
`se_spv_1d_005` bigint(20) DEFAULT NULL COMMENT 'met.最近1天无线端搜索SPV',
`se_ipv_uv_1d_015` bigint(20) DEFAULT NULL COMMENT 'met.最近1天无线端搜索引导IPV_UV',
`se_ipv_1d_013` bigint(20) DEFAULT NULL COMMENT 'met.最近1天无线端搜索引导IPV',
`se_ipv_1d_029` bigint(20) DEFAULT NULL COMMENT 'met.最近1天无线端天猫商城全引导搜索IPV',
`adm_ppc_1d_001` double DEFAULT NULL COMMENT 'met.最近1天P4P广告每点击消耗',
`se_uv_1d_005` bigint(20) DEFAULT NULL COMMENT 'met.最近1天搜索UV',
`se_uv_pc_1d_003` bigint(20) DEFAULT NULL COMMENT 'met.最近1天PC端搜索UV',
`se_uv_1d_007` bigint(20) DEFAULT NULL COMMENT 'met.最近1天无线端搜索UV',
`se_uv_1d_042` bigint(20) DEFAULT NULL COMMENT 'met.最近1天搜索UV上1天变化量',
`se_uv_pc_1d_021` bigint(20) DEFAULT NULL COMMENT 'met.最近1天PC端搜索UV上1天变化量',
`se_uv_1d_008` bigint(20) DEFAULT NULL COMMENT 'met.最近1天无线端搜索UV上1天变化',
`se_uv_ex_1w_001` bigint(20) DEFAULT NULL COMMENT 'met.最近7天较上7天搜索UV变化量',
`se_uv_ex_1w_002` bigint(20) DEFAULT NULL COMMENT 'met.最近7天PC端较上7天搜索UV变化量',
`se_uv_ex_1w_003` bigint(20) DEFAULT NULL COMMENT 'met.最近7天无线端较上7天搜索UV变化量',
`stat_date` bigint(20) NOT NULL DEFAULT '0' COMMENT '统计日期',
PRIMARY KEY (`auto_id`, `stat_date`),
index index_t101(stat_date, (CAST(keyword_list->'$' as char(256) ARRAY)), se_keyword)
);
INSERT INTO `adb_tb_sycm_grd_kw_ext_algo_1d_new` (`auto_id`,`se_keyword`,`keyword_list`,`is_lgt_keyword`,`cate_id`,`cate_level1_id`,`cate_level2_id`,`pay_ord_amt_1d_038`,`pay_ord_byr_cnt_1d_037`,`se_spv_1d_021`,`se_ipv_uv_1d_003`,`se_ipv_1d_010`,`se_ipv_1d_028`,`pay_ord_amt_1d_034`,`pay_ord_byr_cnt_1d_750`,`se_spv_pc_1d_006`,`se_ipv_uv_pc_1d_010`,`se_ipv_pc_1d_005`,`se_ipv_pc_1d_028`,`pay_ord_amt_1d_059`,`pay_ord_byr_cnt_1d_053`,`se_spv_1d_005`,`se_ipv_uv_1d_015`,`se_ipv_1d_013`,`se_ipv_1d_029`,`adm_ppc_1d_001`,`se_uv_1d_005`,`se_uv_pc_1d_003`,`se_uv_1d_007`,`se_uv_1d_042`,`se_uv_pc_1d_021`,`se_uv_1d_008`,`se_uv_ex_1w_001`,`se_uv_ex_1w_002`,`se_uv_ex_1w_003`,`stat_date`) VALUES (8768097,'Кросовки','["К","р","о","с","о","в","к","и"]','Y',null,null,null,null,null,321,null,null,null,null,null,null,null,null,null,null,null,1215,null,null,null,null,2820,null,3149,7,null,5,null,null,null,20240815);
drop table adb_tb_sycm_grd_kw_ext_algo_1d_new;
drop table if exists customers;
CREATE TABLE customers (
id BIGINT NOT NULL AUTO_INCREMENT PRIMARY KEY,
modified DATETIME DEFAULT CURRENT_TIMESTAMP ON UPDATE CURRENT_TIMESTAMP,
custinfo JSON,
INDEX zips( (CAST(custinfo->'$.zipcode' AS UNSIGNED ARRAY)) )
);
INSERT INTO customers VALUES
(NULL, NOW(), '{"user":"Jack","user_id":37,"zipcode":[94582,94536]}'),
(NULL, NOW(), '{"user":"Jill","user_id":22,"zipcode":[94568,94507,94582]}'),
(NULL, NOW(), '{"user":"Bob","user_id":31,"zipcode":[94477,94507]}'),
(NULL, NOW(), '{"user":"Mary","user_id":72,"zipcode":[94536]}'),
(NULL, NOW(), '{"user":"Ted","user_id":56,"zipcode":[94507,94582]}');
select /*+read_consistency(weak) */ id ,custinfo FROM customers WHERE JSON_CONTAINS(custinfo->'$.zipcode', CAST('[94507,94582]' AS JSON));
id	custinfo
2	{"user": "Jill", "user_id": 22, "zipcode": [94568, 94507, 94582]}
5	{"user": "Ted", "user_id": 56, "zipcode": [94507, 94582]}
delete from customers where JSON_CONTAINS(custinfo->'$.zipcode', CAST('[94582]' AS JSON));
INSERT INTO customers VALUES
(NULL, NOW(), '{"user":"Jack","user_id":37,"zipcode":[]}');
select /*+read_consistency(weak) */ id ,custinfo FROM customers WHERE JSON_CONTAINS(custinfo->'$.zipcode', CAST('null' AS JSON));
id	custinfo
delete from customers;
INSERT INTO customers VALUES
(NULL, NOW(), '{"user":"Jack","user_id":37,"zipcode":[94582,94536]}'),
(NULL, NOW(), '{"user":"Jill","user_id":22,"zipcode":[94568,94507,94582]}'),
(NULL, NOW(), '{"user":"Bob","user_id":31,"zipcode":[94477,94507]}'),
(NULL, NOW(), '{"user":"Mary","user_id":72,"zipcode":[94536]}'),
(NULL, NOW(), '{"user":"Ted","user_id":56,"zipcode":[94507,94582]}');
select /*+read_consistency(weak) */ id ,custinfo FROM customers WHERE JSON_CONTAINS(custinfo->'$.zipcode', CAST('[94507,94582]' AS JSON));
id	custinfo
8	{"user": "Jill", "user_id": 22, "zipcode": [94568, 94507, 94582]}
11	{"user": "Ted", "user_id": 56, "zipcode": [94507, 94582]}
delete from customers where JSON_CONTAINS(custinfo->'$.zipcode', CAST('[94582]' AS JSON));
drop table if exists customers;
drop table if exists tt1;
create table tt1(id int , a varchar(50),j json,j1 json,  index index_1(id,(CAST(j->'$[*]' AS unsigned ARRAY))));
insert into tt1 values(1,'test','[1,3,4,6]','{}');
insert into tt1 values(1,'test','[1,3,4,6,7]','{}');
replace into tt1 values(1,'test','[1,3,4,6,7]','{}');
replace into tt1 values(2,'test2','{"key":[90,567]}','[1,2,3,5]');
update tt1  set j='[90,3,4]' ,id=3,a='test1',j1='[10,30,40]' where id=1;
drop table if exists tt1;
drop table if exists tt2;
create table tt2(id int,a varchar(50),j json, INDEX index_1( (CAST(j->'$[*]' AS DECIMAL ARRAY)))) ;
insert into tt2 values(1,'test','{"key":[23]}');
delete from tt2;
drop table tt2;
create table tt2(id int,a varchar(50),j json, UNIQUE INDEX index_1(a, (CAST(j->'$[*]' AS DECIMAL ARRAY))) );
insert into tt2 values(1,'test','{"key":[11]}');
delete from tt2;
drop table if exists tt2;
select cast('[1.34,2.345,3.67,4.12]' AS UNSIGNED ARRAY);
ERROR 42000: You have an error in your SQL syntax; check the manual that corresponds to your OceanBase version for the right syntax to use near ''[1.34,2.345,3.67,4.12]' AS UNSIGNED ARRAY)' at line 2
alter system set default_table_store_format = 'row';
alter system set _enable_add_fulltext_index_to_existing_table = false;
