#Environmental cleaning
drop user hjw@'%';
create user hjw identified by 'hjw';
grant all on *.* to hjw WITH GRANT OPTION;
#ln-1    参数个数要求
#ln-2    常规操作
#ln-3    参数数值大小要求
#ln-4    参数为特殊值
#ln-5    运算符
LN-1        #参数个数要求
SELECT ln(0);
ln(0)
NULL
SELECT ln(66);
ln(66)
4.189654742026425
SELECT ln(-8);
ln(-8)
NULL
SELECT ln(0.55);
ln(0.55)
-0.5978370007556204
SELECT ln('%');
ln('%')
NULL
select ln('汉字');
ln('汉字')
NULL
SELECT ln();
SELECT ln2(0);
SELECT ln(6,0);
SELECT ln(66,98);
SELECT ln(66,98,70);
drop table a;
create table a(id int(10),fenshu int(10),banji int(10));
insert into a(id,fenshu,banji)value(1,87,6228);
insert into a(id,fenshu,banji)value(2,78,6229);
insert into a(id,fenshu,banji)value(3,100,6229);
insert into a(id,fenshu,banji)value(4,70,6228);
insert into a(id,fenshu,banji)value(5,ln(70),6228);
select * from a;
id	fenshu	banji
1	87	6228
2	78	6229
3	100	6229
4	70	6228
5	4	6228
insert into a(id,fenshu,banji)value(6,ln(70),ln(6228));
select * from a;
id	fenshu	banji
1	87	6228
2	78	6229
3	100	6229
4	70	6228
5	4	6228
6	4	9
insert into a(id,fenshu,banji)value(7,ln(70),ln(6228));
select * from a;
id	fenshu	banji
1	87	6228
2	78	6229
3	100	6229
4	70	6228
5	4	6228
6	4	9
7	4	9
insert into a(id,fenshu,banji)value(8,ln(120/30),ln(6228));
insert into a(id,fenshu,banji)value(8,ln( ),6228);
select * from a;
id	fenshu	banji
1	87	6228
2	78	6229
3	100	6229
4	70	6228
5	4	6228
6	4	9
7	4	9
8	1	9
insert into a(id,fenshu,banji)value(9,ln(120,30),ln(6228));
select * from a;
id	fenshu	banji
1	87	6228
2	78	6229
3	100	6229
4	70	6228
5	4	6228
6	4	9
7	4	9
8	1	9
drop table a;
LN-2        #常规操作
LN-2-1      #符合操作
drop table a;
create table a(id int(10),fenshu int(10),banji int(10));
insert into a(id,fenshu,banji)value(1,0,-6228);
insert into a(id,fenshu,banji)value(2,-78,6229);
insert into a(id,fenshu,banji)value(3,100,0.6229);
insert into a(id,fenshu,banji)value(4,+70,6228);
insert into a(id,fenshu,banji)value(5,-0.0001,6229);
select * from a;
id	fenshu	banji
1	0	-6228
2	-78	6229
3	100	1
4	70	6228
5	0	6229
SELECT ln(0) from a;
ln(0)
NULL
NULL
NULL
NULL
NULL
select ln(100) from a;
ln(100)
4.605170185988092
4.605170185988092
4.605170185988092
4.605170185988092
4.605170185988092
SELECT ln(+70) from a;
ln(+70)
4.248495242049359
4.248495242049359
4.248495242049359
4.248495242049359
4.248495242049359
SELECT ln(6228) from a;
ln(6228)
8.73681053295389
8.73681053295389
8.73681053295389
8.73681053295389
8.73681053295389
select ln(-78) from a;
ln(-78)
NULL
NULL
NULL
NULL
NULL
select ln(-6228) from a;
ln(-6228)
NULL
NULL
NULL
NULL
NULL
select ln(0.6229) from a;
ln(0.6229)
-0.4733692867220372
-0.4733692867220372
-0.4733692867220372
-0.4733692867220372
-0.4733692867220372
select ln(-0.0001) from a;
ln(-0.0001)
NULL
NULL
NULL
NULL
NULL
select ln(banji) from a;
ln(banji)
NULL
8.736971085254146
0
8.73681053295389
8.736971085254146
select * from a where banji=ln(6229);
id	fenshu	banji
select ln(fenshu) from a where banji=6229;
ln(fenshu)
NULL
NULL
select ln(fenshu),banji from a where banji=6228;
ln(fenshu)	banji
4.248495242049359	6228
SELECT ln(avg(fenshu)),banji from a group by banji;
ln(avg(fenshu))	banji
NULL	-6228
NULL	6229
4.605170185988092	1
4.248495242049359	6228
SELECT fenshu,banji from a where banji=6228 order by ln(fenshu) desc;
fenshu	banji
70	6228
select * from a order by ln(fenshu) desc;
id	fenshu	banji
3	100	1
4	70	6228
1	0	-6228
2	-78	6229
5	0	6229
LN-2-2    #非法行为ln
SELECT ln2(+70) from a;
SELECT ln2(+70,0) from a;
select ln2(100,-78) from a;
select ln2(0) from a;
select ln2( ) from a;
select ln2('汉字') from a;
SELECT ln(0,6229) from a;
select ln(100,-78) from a;
SELECT ln(+70,0) from a;
SELECT ln(6228,0.6229) from a;
select ln(-6228,-78) from a;
select ln(0.6229,-0.0001) from a;
select ln(0,-0.0001) from a;
SELECT ln(0,6229) from a;
select ln(100,-78) from a;
SELECT ln(+70,0) from a;
SELECT ln(6228,0.6229) from a;
select ln(-6228,-78) from a;
select ln(0.6229,-0.0001) from a;
select ln(0,-0.0001) from a;
select ln(100, ) from a;
SELECT ln(+70,'汉字') from a;
SELECT ln(  ,  ) from a;
select ln(0.6229,-0.0001,5) from a;
SELECT fenshu FROM a WHERE fenshu=ln(4, );
SELECT fenshu FROM a WHERE fenshu=ln( );
select * from a where fenshu=ln(100,-78,+70);
SELECT fenshu FROM a WHERE fenshu=ln( , , ,);
drop table a;
LN-3        #参数数值大小要求
LN-3-1      #参数符合要求
drop table b;
create table b(id int(10),name varchar(10));
insert into b(id,name)value(1,"zhangsan");
insert into b(id,name)value(1.2,"xiaoli");
insert into b(id,name)value(0.33,"xiaobai");
insert into b(id,name)value(44,"xiaohu");
insert into b(id,name)value(5,"xiaocao");
select * from b;
id	name
1	zhangsan
1	xiaoli
0	xiaobai
44	xiaohu
5	xiaocao
SELECT ln(1) FROM b;
ln(1)
0
0
0
0
0
SELECT ln(0.33) FROM b;
ln(0.33)
-1.1086626245216111
-1.1086626245216111
-1.1086626245216111
-1.1086626245216111
-1.1086626245216111
SELECT ln('xoaoli123') FROM b;
ln('xoaoli123')
NULL
NULL
NULL
NULL
NULL
SELECT ln(3e-30) FROM b;
ln(3e-30)
-67.97894050115326
-67.97894050115326
-67.97894050115326
-67.97894050115326
-67.97894050115326
SELECT ln('0') FROM b;
ln('0')
NULL
NULL
NULL
NULL
NULL
insert into b(id,name)value(ln(0.33),"xiaobai");
select * from b;
id	name
1	zhangsan
1	xiaoli
0	xiaobai
44	xiaohu
5	xiaocao
-1	xiaobai
insert into b(id,name)value(ln(-0.33),"xiaobai");
select * from b;
id	name
1	zhangsan
1	xiaoli
0	xiaobai
44	xiaohu
5	xiaocao
-1	xiaobai
NULL	xiaobai
insert into b(id,name)value(ln(null),"xiaobai");
select * from b;
id	name
1	zhangsan
1	xiaoli
0	xiaobai
44	xiaohu
5	xiaocao
-1	xiaobai
NULL	xiaobai
NULL	xiaobai
insert into b(id,name)value(ln(5),"xiaocao");
select * from b;
id	name
1	zhangsan
1	xiaoli
0	xiaobai
44	xiaohu
5	xiaocao
-1	xiaobai
NULL	xiaobai
NULL	xiaobai
2	xiaocao
LN-3-2      #参数不符合要求
SELECT ln(0f) FROM b;
SELECT ln(0-12e) FROM b;
SELECT ln(e0-12) FROM b;
SELECT ln(-3e-30-e) FROM b;
SELECT ln(-0.5f3e30) FROM b;
SELECT ln(-1.50d3e-30) FROM b;
SELECT ln('-1.50e1'3e-30) FROM b;
SELECT ln('1'3e-30) FROM b;
SELECT ln(1f'3e30') FROM b;
SELECT ln(1e03e-30) FROM b;
SELECT ln(5e00d) FROM b;
SELECT ln(5e00e24) FROM b;
SELECT ln('5e0'0e23) FROM b;
SELECT ln(0.3e1-1f) FROM b;
insert into b(id,name)value(6,ln('xiaobai'));
insert into b(ln(id),name)value(0.33,"xiaobai");
insert into b(id,name)value ln('(5,"xiaocao")');
insert into b(id,name)value(ln( ),"xiaobai");
LN-3-3        #除0以外边界值
SELECT ln(0.000000000000000000000000000000000000000000000000000000000000000000000000000000000000000000000000000000000000001) FROM b;
ln(0.000000000000000000000000000000000000000000000000000000000000000000000000000000000000000000000000000000000000001)
-255.58694532233906
-255.58694532233906
-255.58694532233906
-255.58694532233906
-255.58694532233906
-255.58694532233906
-255.58694532233906
-255.58694532233906
-255.58694532233906
SELECT ln(999999999999999999999999999999999999999900000000000000000000000000000000000000000000000000000000000000000000000000000000000000.99999999999999999999999999999999999999999999999999999999999999999999999999999999999999999999999999999999999999999999999999999) FROM b;
ln(999999999999999999999999999999999999999900000000000000000000000000000000000000000000000000000000000000000000000000000000000000.99999999999999999999999999999999999999999999999999999999999999999999999999999999999999999999999999999999999999999999999999999
290.12572171724975
290.12572171724975
290.12572171724975
290.12572171724975
290.12572171724975
290.12572171724975
290.12572171724975
290.12572171724975
290.12572171724975
SELECT ln(-0.000000000000000000000000000000000000000000000000000000000000000000000000000000000000000000000000000000000000001) FROM b;
ln(-0.000000000000000000000000000000000000000000000000000000000000000000000000000000000000000000000000000000000000001)
NULL
NULL
NULL
NULL
NULL
NULL
NULL
NULL
NULL
SELECT ln(-999999999999999999999999999999999999999900000000000000000000000000000000000000000000000000000000000000000000000000000000000000.99999999999999999999999999999999999999999999999999999999999999999999999999999999999999999999999999999999999999999999999999999) FROM b;
ln(-999999999999999999999999999999999999999900000000000000000000000000000000000000000000000000000000000000000000000000000000000000.9999999999999999999999999999999999999999999999999999999999999999999999999999999999999999999999999999999999999999999999999999
NULL
NULL
NULL
NULL
NULL
NULL
NULL
NULL
NULL
SELECT ln(ln(0.000000000000000000000000000000000000000000000000000000000000000000000000000000000000000000000000000000000000001)) FROM b;
ln(ln(0.000000000000000000000000000000000000000000000000000000000000000000000000000000000000000000000000000000000000001))
NULL
NULL
NULL
NULL
NULL
NULL
NULL
NULL
NULL
SELECT ln('99-∞') FROM b;
ln('99-∞')
4.59511985013459
4.59511985013459
4.59511985013459
4.59511985013459
4.59511985013459
4.59511985013459
4.59511985013459
4.59511985013459
4.59511985013459
SELECT ln('-∞99') FROM b;
ln('-∞99')
NULL
NULL
NULL
NULL
NULL
NULL
NULL
NULL
NULL
drop table b;
LN-4        #参数为特殊值
drop table d;
create table d(id int(10),banji int(10));
insert into d(id,banji)value(1,6556);
insert into d(id,banji)value(2,2563);
select * from d;
id	banji
1	6556
2	2563
select ln('%') from d;
ln('%')
NULL
NULL
select ln('@') from d;
ln('@')
NULL
NULL
select ln('!') from d;
ln('!')
NULL
NULL
select ln('*') from d;
ln('*')
NULL
NULL
select ln('^') from d;
ln('^')
NULL
NULL
select ln('汉字') from d;
ln('汉字')
NULL
NULL
select ln('abcdf') from d;
ln('abcdf')
NULL
NULL
select ln(' ') from d;
ln(' ')
NULL
NULL
insert into d(id,banji)value(ln('6'),ln('6556'));
select * from d;
id	banji
1	6556
2	2563
2	9
select ln(%) from d;
select ln(@) from d;
ln(@)
NULL
NULL
NULL
select ln(!) from d;
select ln(*) from d;
select ln(^) from d;
select ln(汉字) from d;
select ln( ) from d;
select ln(abcdf) from d;
insert into d(id,banji)value(ln('6556'),@);
insert into d(id,banji)value(ln('6556'),2%);
insert into d(id,banji)value(ln('6556!'),6556);
insert into d(id,banji)value(ln('6556'),ln( ));
insert into d(id,banji)value(ln('*'),ln('6556'));
drop table d;
LN-5          #运算符
LN-5-1        #算术运算符
drop table e;
create table e(id int(2),name varchar(20),fenshu int(20));
insert into e (id,name,fenshu)value (1,"zhangsan",99);
insert into e (id,name,fenshu)value (2,"lisi",79);
select * from e;
id	name	fenshu
1	zhangsan	99
2	lisi	79
select ln(1+2) from e;
ln(1+2)
1.0986122886681098
1.0986122886681098
select ln(1*2) from e;
ln(1*2)
0.6931471805599453
0.6931471805599453
select ln(1/2) from e;
ln(1/2)
-0.6931471805599453
-0.6931471805599453
select ln(2-1) from e;
ln(2-1)
0
0
select ln(1+2);
ln(1+2)
1.0986122886681098
select ln(1*2);
ln(1*2)
0.6931471805599453
select ln(1/2);
ln(1/2)
-0.6931471805599453
select ln(1-2);
ln(1-2)
NULL
insert into e value (3,"xiaohu",ln(399+99));
select * from e;
id	name	fenshu
1	zhangsan	99
2	lisi	79
3	xiaohu	6
insert into e value (ln(3+999),"xiaohu",ln(99999-99));
select * from e;
id	name	fenshu
1	zhangsan	99
2	lisi	79
3	xiaohu	6
7	xiaohu	12
insert into e value (ln(3+888),"xiaoli",ln(9*99));
select * from e;
id	name	fenshu
1	zhangsan	99
2	lisi	79
3	xiaohu	6
7	xiaohu	12
7	xiaoli	7
insert into e value (ln(3+555),"xiaoai",ln(99999/99));
select * from e;
id	name	fenshu
1	zhangsan	99
2	lisi	79
3	xiaohu	6
7	xiaohu	12
7	xiaoli	7
6	xiaoai	7
DELETE from e where name="xiaohu" and fenshu=ln(99999/99);
select * from e;
id	name	fenshu
1	zhangsan	99
2	lisi	79
3	xiaohu	6
7	xiaohu	12
7	xiaoli	7
6	xiaoai	7
DELETE from e where fenshu=ln(9*99);
select * from e;
id	name	fenshu
1	zhangsan	99
2	lisi	79
3	xiaohu	6
7	xiaohu	12
7	xiaoli	7
6	xiaoai	7
DELETE from e where fenshu=ln(99999-99);
select * from e;
id	name	fenshu
1	zhangsan	99
2	lisi	79
3	xiaohu	6
7	xiaohu	12
7	xiaoli	7
6	xiaoai	7
DELETE from e where fenshu=ln(399+99);
select * from e;
id	name	fenshu
1	zhangsan	99
2	lisi	79
3	xiaohu	6
7	xiaohu	12
7	xiaoli	7
6	xiaoai	7
UPDATE e set fenshu=ln(9+1) where fenshu=7;
select * from e;
id	name	fenshu
1	zhangsan	99
2	lisi	79
3	xiaohu	6
7	xiaohu	12
7	xiaoli	2
6	xiaoai	2
UPDATE e set fenshu=ln(999-99) where fenshu=12;
select * from e;
id	name	fenshu
1	zhangsan	99
2	lisi	79
3	xiaohu	6
7	xiaohu	7
7	xiaoli	2
6	xiaoai	2
UPDATE e set fenshu=ln(1*9) where fenshu=7;
select * from e;
id	name	fenshu
1	zhangsan	99
2	lisi	79
3	xiaohu	6
7	xiaohu	2
7	xiaoli	2
6	xiaoai	2
UPDATE e set fenshu=ln(9/2) where fenshu=5;
select * from e;
id	name	fenshu
1	zhangsan	99
2	lisi	79
3	xiaohu	6
7	xiaohu	2
7	xiaoli	2
6	xiaoai	2
drop table e;
LN-5-2        #比较运算符
drop table f;
create table f(id int(2),name varchar(20),fenshu int(20));
insert into f (id,name,fenshu)value (1,"zhangsan",99);
insert into f (id,name,fenshu)value (2,"lisi",79);
insert into f (id,name,fenshu)value (3,"lisi",89);
insert into f (id,name,fenshu)value (4,"lisi",79);
select * from f;
id	name	fenshu
1	zhangsan	99
2	lisi	79
3	lisi	89
4	lisi	79
select ln(99>79);
ln(99>79)
0
select ln(79>=79);
ln(79>=79)
0
select ln(79<89);
ln(79<89)
0
select ln(79<=79);
ln(79<=79)
0
select ln(79=79);
ln(79=79)
0
select ln(89!=99);
ln(89!=99)
0
select ln(99)>ln(79);
ln(99)>ln(79)
1
select ln(79)>=ln(79);
ln(79)>=ln(79)
1
select ln(79)<ln(89);
ln(79)<ln(89)
1
select ln(79)<=ln(79);
ln(79)<=ln(79)
1
select ln(79)=ln(79);
ln(79)=ln(79)
1
select ln(89)!=ln(99);
ln(89)!=ln(99)
1
select ln(99><79);
select ln(99)><ln(79);
SELECT * FROM f WHERE ln(fenshu*10)>(SELECT ln(fenshu)+1 FROM f WHERE id=4);
id	name	fenshu
1	zhangsan	99
2	lisi	79
3	lisi	89
4	lisi	79
SELECT * FROM f WHERE ln(fenshu*20)>=(SELECT ln(fenshu)+1 FROM f WHERE id=1);
id	name	fenshu
1	zhangsan	99
2	lisi	79
3	lisi	89
4	lisi	79
SELECT * FROM f WHERE ln(fenshu*1)<(SELECT ln(fenshu)+999 FROM f WHERE id=2);
id	name	fenshu
1	zhangsan	99
2	lisi	79
3	lisi	89
4	lisi	79
SELECT * FROM f WHERE ln(fenshu*1)<=(SELECT ln(fenshu)+699 FROM f WHERE id=4);
id	name	fenshu
1	zhangsan	99
2	lisi	79
3	lisi	89
4	lisi	79
SELECT * FROM f WHERE ln(fenshu*20)=(SELECT ln(fenshu*20) FROM f WHERE id=3);
id	name	fenshu
3	lisi	89
SELECT * FROM f WHERE ln(fenshu*20)!=(SELECT ln(fenshu)+1 FROM f WHERE id=2);
id	name	fenshu
1	zhangsan	99
2	lisi	79
3	lisi	89
4	lisi	79
SELECT * FROM f WHERE ln(fenshu)<>(SELECT ln(fenshu/0) FROM f WHERE id=4);
id	name	fenshu
drop table f;
# Clean up users
drop user hjw@'%' ;
