call oceanbase.drop_tenant_force('tenant1');
call oceanbase.create_mysql_tenant_mini('tenant1');
select case when tenant_id > 1000 then 1000 else tenant_id end tenant_id, label, ctx_name, mod_type, mod_id, mod_name, used, count from __all_virtual_memory_info
where label like '%TZ%' and SVR_IP=HOST_IP() and SVR_PORT=RPC_PORT() order by tenant_id, label;
tenant_id	label	ctx_name	mod_type	mod_id	mod_name	used	count
500	HasNodTzInfM	DEFAULT_CTX_ID	user	0	HasNodTzInfM	7880	1
500	ObTZIDHashNode	DEFAULT_CTX_ID	user	0	ObTZIDHashNode	64512	8
500	ObTZNameHashNod	DEFAULT_CTX_ID	user	0	ObTZNameHashNod	96768	12
500	ObTZNameIDInfo	DEFAULT_CTX_ID	user	0	ObTZNameIDInfo	72576	9
500	TenantTZ	DEFAULT_CTX_ID	user	0	TenantTZ	22400	7
500	TZInfoArray	DEFAULT_CTX_ID	user	0	TZInfoArray	16756992	1082
500	TZInfoMgrMap	DEFAULT_CTX_ID	user	0	TZInfoMgrMap	2097216	2
tenant_id	label	ctx_name	mod_type	mod_id	mod_name	used	count
500	HasNodTzInfM	DEFAULT_CTX_ID	user	0	HasNodTzInfM	7880	1
500	ObTZIDHashNode	DEFAULT_CTX_ID	user	0	ObTZIDHashNode	72576	9
500	ObTZNameHashNod	DEFAULT_CTX_ID	user	0	ObTZNameHashNod	104832	13
500	ObTZNameIDInfo	DEFAULT_CTX_ID	user	0	ObTZNameIDInfo	80640	10
500	TenantTZ	DEFAULT_CTX_ID	user	0	TenantTZ	22400	7
500	TZInfoArray	DEFAULT_CTX_ID	user	0	TZInfoArray	16756992	1082
500	TZInfoMgrMap	DEFAULT_CTX_ID	user	0	TZInfoMgrMap	2097216	2
call oceanbase.drop_tenant_force('tenant1');
call oceanbase.drop_tenant_force('tenant2');
call oceanbase.create_mysql_tenant_mini('tenant2');
select case when tenant_id > 1000 then 1000 else tenant_id end tenant_id, label, ctx_name, mod_type, mod_id, mod_name, used, count from __all_virtual_memory_info
where label like '%TZ%' and SVR_IP=HOST_IP() and SVR_PORT=RPC_PORT() order by tenant_id, label;
tenant_id	label	ctx_name	mod_type	mod_id	mod_name	used	count
500	HasNodTzInfM	DEFAULT_CTX_ID	user	0	HasNodTzInfM	7880	1
500	ObTZIDHashNode	DEFAULT_CTX_ID	user	0	ObTZIDHashNode	72576	9
500	ObTZNameHashNod	DEFAULT_CTX_ID	user	0	ObTZNameHashNod	104832	13
500	ObTZNameIDInfo	DEFAULT_CTX_ID	user	0	ObTZNameIDInfo	80640	10
500	TenantTZ	DEFAULT_CTX_ID	user	0	TenantTZ	22400	7
500	TZInfoArray	DEFAULT_CTX_ID	user	0	TZInfoArray	16756992	1082
500	TZInfoMgrMap	DEFAULT_CTX_ID	user	0	TZInfoMgrMap	2097216	2
alter system change tenant 'tenant2';
delete from __all_tenant_time_zone where time_zone_id = 1;
update __all_sys_stat set value = value + 1 where name = 'current_timezone_version';
alter system change tenant sys;
select case when tenant_id > 1000 then 1000 else tenant_id end tenant_id, label, ctx_name, mod_type, mod_id, mod_name, used, count from __all_virtual_memory_info
where label like '%TZ%' and SVR_IP=HOST_IP() and SVR_PORT=RPC_PORT() order by tenant_id, label;
tenant_id	label	ctx_name	mod_type	mod_id	mod_name	used	count
500	HasNodTzInfM	DEFAULT_CTX_ID	user	0	HasNodTzInfM	7880	1
500	ObTZIDHashNode	DEFAULT_CTX_ID	user	0	ObTZIDHashNode	72576	9
500	ObTZNameHashNod	DEFAULT_CTX_ID	user	0	ObTZNameHashNod	104832	13
500	ObTZNameIDInfo	DEFAULT_CTX_ID	user	0	ObTZNameIDInfo	80640	10
500	TenantTZ	DEFAULT_CTX_ID	user	0	TenantTZ	22400	7
500	TZInfoArray	DEFAULT_CTX_ID	user	0	TZInfoArray	16756992	1082
500	TZInfoMgrMap	DEFAULT_CTX_ID	user	0	TZInfoMgrMap	2097216	2
call oceanbase.drop_tenant_force('tenant2');
call oceanbase.drop_tenant_force('tenant3');
call oceanbase.create_mysql_tenant_mini('tenant3');
select case when tenant_id > 1000 then 1000 else tenant_id end tenant_id, label, ctx_name, mod_type, mod_id, mod_name, used, count from __all_virtual_memory_info
where label like '%TZ%' and SVR_IP=HOST_IP() and SVR_PORT=RPC_PORT() order by tenant_id, label;
tenant_id	label	ctx_name	mod_type	mod_id	mod_name	used	count
500	HasNodTzInfM	DEFAULT_CTX_ID	user	0	HasNodTzInfM	7880	1
500	ObTZIDHashNode	DEFAULT_CTX_ID	user	0	ObTZIDHashNode	129024	16
500	ObTZNameHashNod	DEFAULT_CTX_ID	user	0	ObTZNameHashNod	193536	24
500	ObTZNameIDInfo	DEFAULT_CTX_ID	user	0	ObTZNameIDInfo	145152	18
500	TenantTZ	DEFAULT_CTX_ID	user	0	TenantTZ	22400	7
500	TZInfoArray	DEFAULT_CTX_ID	user	0	TZInfoArray	33530112	2166
500	TZInfoMgrMap	DEFAULT_CTX_ID	user	0	TZInfoMgrMap	4194432	4
set time_zone = 'shanting';
call oceanbase.drop_tenant_force('tenant3');
call oceanbase.drop_tenant_force('tenant4');
call oceanbase.create_mysql_tenant_mini('tenant4');
select case when tenant_id > 1000 then 1000 else tenant_id end tenant_id, label, ctx_name, mod_type, mod_id, mod_name, used, count from __all_virtual_memory_info
where label like '%TZ%' and SVR_IP=HOST_IP() and SVR_PORT=RPC_PORT() order by tenant_id, label;
tenant_id	label	ctx_name	mod_type	mod_id	mod_name	used	count
500	HasNodTzInfM	DEFAULT_CTX_ID	user	0	HasNodTzInfM	7880	1
500	ObTZIDHashNode	DEFAULT_CTX_ID	user	0	ObTZIDHashNode	129024	16
500	ObTZNameHashNod	DEFAULT_CTX_ID	user	0	ObTZNameHashNod	185472	23
500	ObTZNameIDInfo	DEFAULT_CTX_ID	user	0	ObTZNameIDInfo	145152	18
500	TenantTZ	DEFAULT_CTX_ID	user	0	TenantTZ	22400	7
500	TZInfoArray	DEFAULT_CTX_ID	user	0	TZInfoArray	33497856	2162
500	TZInfoMgrMap	DEFAULT_CTX_ID	user	0	TZInfoMgrMap	4194432	4
set time_zone = 'test1';
ERROR HY000: Unknown or incorrect time zone: 'test1'
call oceanbase.drop_tenant_force('tenant4');
call oceanbase.drop_tenant_force('tenant5');
call oceanbase.create_mysql_tenant_mini('tenant5');
select case when tenant_id > 1000 then 1000 else tenant_id end tenant_id, label, ctx_name, mod_type, mod_id, mod_name, used, count from __all_virtual_memory_info
where label like '%TZ%' and SVR_IP=HOST_IP() and SVR_PORT=RPC_PORT() order by tenant_id, label;
tenant_id	label	ctx_name	mod_type	mod_id	mod_name	used	count
500	HasNodTzInfM	DEFAULT_CTX_ID	user	0	HasNodTzInfM	7880	1
500	ObTZIDHashNode	DEFAULT_CTX_ID	user	0	ObTZIDHashNode	129024	16
500	ObTZNameHashNod	DEFAULT_CTX_ID	user	0	ObTZNameHashNod	185472	23
500	ObTZNameIDInfo	DEFAULT_CTX_ID	user	0	ObTZNameIDInfo	145152	18
500	TenantTZ	DEFAULT_CTX_ID	user	0	TenantTZ	22400	7
500	TZInfoArray	DEFAULT_CTX_ID	user	0	TZInfoArray	33513984	2164
500	TZInfoMgrMap	DEFAULT_CTX_ID	user	0	TZInfoMgrMap	4194432	4
set time_zone = 'Asia/Singapore';
ERROR HY000: Unknown or incorrect time zone: 'Asia/Singapore'
set time_zone = 'Asia/SingaporeTemp';
call oceanbase.drop_tenant_force('tenant5');
call oceanbase.drop_tenant_force('tenant6');
call oceanbase.create_mysql_tenant_mini('tenant6');
select case when tenant_id > 1000 then 1000 else tenant_id end tenant_id, label, ctx_name, mod_type, mod_id, mod_name, used, count from __all_virtual_memory_info
where label like '%TZ%' and SVR_IP=HOST_IP() and SVR_PORT=RPC_PORT() order by tenant_id, label;
tenant_id	label	ctx_name	mod_type	mod_id	mod_name	used	count
500	HasNodTzInfM	DEFAULT_CTX_ID	user	0	HasNodTzInfM	7880	1
500	ObTZIDHashNode	DEFAULT_CTX_ID	user	0	ObTZIDHashNode	129024	16
500	ObTZNameHashNod	DEFAULT_CTX_ID	user	0	ObTZNameHashNod	185472	23
500	ObTZNameIDInfo	DEFAULT_CTX_ID	user	0	ObTZNameIDInfo	145152	18
500	TenantTZ	DEFAULT_CTX_ID	user	0	TenantTZ	22400	7
500	TZInfoArray	DEFAULT_CTX_ID	user	0	TZInfoArray	33513984	2164
500	TZInfoMgrMap	DEFAULT_CTX_ID	user	0	TZInfoMgrMap	4194432	4
set time_zone = 'Africa/Accra';
set time_zone = 'Africa/Abidjan';
call oceanbase.drop_tenant_force('tenant6');
call oceanbase.drop_tenant_force('tenant7');
call oceanbase.create_mysql_tenant_mini('tenant7');
select case when tenant_id > 1000 then 1000 else tenant_id end tenant_id, label, ctx_name, mod_type, mod_id, mod_name, used, count from __all_virtual_memory_info
where label like '%TZ%' and SVR_IP=HOST_IP() and SVR_PORT=RPC_PORT() order by tenant_id, label;
tenant_id	label	ctx_name	mod_type	mod_id	mod_name	used	count
500	HasNodTzInfM	DEFAULT_CTX_ID	user	0	HasNodTzInfM	7880	1
500	ObTZIDHashNode	DEFAULT_CTX_ID	user	0	ObTZIDHashNode	129024	16
500	ObTZNameHashNod	DEFAULT_CTX_ID	user	0	ObTZNameHashNod	185472	23
500	ObTZNameIDInfo	DEFAULT_CTX_ID	user	0	ObTZNameIDInfo	145152	18
500	TenantTZ	DEFAULT_CTX_ID	user	0	TenantTZ	22400	7
500	TZInfoArray	DEFAULT_CTX_ID	user	0	TZInfoArray	33513984	2164
500	TZInfoMgrMap	DEFAULT_CTX_ID	user	0	TZInfoMgrMap	4194432	4
set time_zone = 'Africa/Accra';
set time_zone = 'Africa/Abidjan';
call oceanbase.drop_tenant_force('tenant7');
call oceanbase.drop_tenant_force('tenant8');
call oceanbase.create_mysql_tenant_mini('tenant8');
select case when tenant_id > 1000 then 1000 else tenant_id end tenant_id, label, ctx_name, mod_type, mod_id, mod_name, used, count from __all_virtual_memory_info
where label like '%TZ%' and SVR_IP=HOST_IP() and SVR_PORT=RPC_PORT() order by tenant_id, label;
tenant_id	label	ctx_name	mod_type	mod_id	mod_name	used	count
500	HasNodTzInfM	DEFAULT_CTX_ID	user	0	HasNodTzInfM	7880	1
500	ObTZIDHashNode	DEFAULT_CTX_ID	user	0	ObTZIDHashNode	129024	16
500	ObTZNameHashNod	DEFAULT_CTX_ID	user	0	ObTZNameHashNod	185472	23
500	ObTZNameIDInfo	DEFAULT_CTX_ID	user	0	ObTZNameIDInfo	145152	18
500	TenantTZ	DEFAULT_CTX_ID	user	0	TenantTZ	22400	7
500	TZInfoArray	DEFAULT_CTX_ID	user	0	TZInfoArray	33513984	2164
500	TZInfoMgrMap	DEFAULT_CTX_ID	user	0	TZInfoMgrMap	4194432	4
set time_zone = 'Africa/Accra';
set time_zone = 'Africa/Abidjan';
call oceanbase.drop_tenant_force('tenant8');
call oceanbase.drop_tenant_force('tenant9');
call oceanbase.create_mysql_tenant_mini('tenant9');
select case when tenant_id > 1000 then 1000 else tenant_id end tenant_id, label, ctx_name, mod_type, mod_id, mod_name, used, count from __all_virtual_memory_info
where label like '%TZ%' and SVR_IP=HOST_IP() and SVR_PORT=RPC_PORT() order by tenant_id, label;
tenant_id	label	ctx_name	mod_type	mod_id	mod_name	used	count
500	HasNodTzInfM	DEFAULT_CTX_ID	user	0	HasNodTzInfM	7880	1
500	ObTZIDHashNode	DEFAULT_CTX_ID	user	0	ObTZIDHashNode	129024	16
500	ObTZNameHashNod	DEFAULT_CTX_ID	user	0	ObTZNameHashNod	185472	23
500	ObTZNameIDInfo	DEFAULT_CTX_ID	user	0	ObTZNameIDInfo	145152	18
500	TenantTZ	DEFAULT_CTX_ID	user	0	TenantTZ	22400	7
500	TZInfoArray	DEFAULT_CTX_ID	user	0	TZInfoArray	33513984	2164
500	TZInfoMgrMap	DEFAULT_CTX_ID	user	0	TZInfoMgrMap	4194432	4
set time_zone = 'Africa/Accra';
set time_zone = 'Africa/Abidjan';
call oceanbase.drop_tenant_force('tenant9');
call oceanbase.drop_tenant_force('tenant10');
call oceanbase.create_mysql_tenant_mini('tenant10');
select case when tenant_id > 1000 then 1000 else tenant_id end tenant_id, label, ctx_name, mod_type, mod_id, mod_name, used, count from __all_virtual_memory_info
where label like '%TZ%' and SVR_IP=HOST_IP() and SVR_PORT=RPC_PORT() order by tenant_id, label;
tenant_id	label	ctx_name	mod_type	mod_id	mod_name	used	count
500	HasNodTzInfM	DEFAULT_CTX_ID	user	0	HasNodTzInfM	7880	1
500	ObTZIDHashNode	DEFAULT_CTX_ID	user	0	ObTZIDHashNode	129024	16
500	ObTZNameHashNod	DEFAULT_CTX_ID	user	0	ObTZNameHashNod	185472	23
500	ObTZNameIDInfo	DEFAULT_CTX_ID	user	0	ObTZNameIDInfo	145152	18
500	TenantTZ	DEFAULT_CTX_ID	user	0	TenantTZ	22400	7
500	TZInfoArray	DEFAULT_CTX_ID	user	0	TZInfoArray	33513984	2164
500	TZInfoMgrMap	DEFAULT_CTX_ID	user	0	TZInfoMgrMap	4194432	4
set time_zone = 'Africa/Accra';
set time_zone = 'Africa/Abidjan';
call oceanbase.drop_tenant_force('tenant10');
call oceanbase.drop_tenant_force('tenant11');
call oceanbase.create_mysql_tenant_mini('tenant11');
select case when tenant_id > 1000 then 1000 else tenant_id end tenant_id, label, ctx_name, mod_type, mod_id, mod_name, used, count from __all_virtual_memory_info
where label like '%TZ%' and SVR_IP=HOST_IP() and SVR_PORT=RPC_PORT() order by tenant_id, label;
tenant_id	label	ctx_name	mod_type	mod_id	mod_name	used	count
500	HasNodTzInfM	DEFAULT_CTX_ID	user	0	HasNodTzInfM	7880	1
500	ObTZIDHashNode	DEFAULT_CTX_ID	user	0	ObTZIDHashNode	129024	16
500	ObTZNameHashNod	DEFAULT_CTX_ID	user	0	ObTZNameHashNod	185472	23
500	ObTZNameIDInfo	DEFAULT_CTX_ID	user	0	ObTZNameIDInfo	145152	18
500	TenantTZ	DEFAULT_CTX_ID	user	0	TenantTZ	22400	7
500	TZInfoArray	DEFAULT_CTX_ID	user	0	TZInfoArray	33513984	2164
500	TZInfoMgrMap	DEFAULT_CTX_ID	user	0	TZInfoMgrMap	4194432	4
set time_zone = 'Africa/Accra';
set time_zone = 'Africa/Abidjan';
call oceanbase.drop_tenant_force('tenant11');
call oceanbase.drop_tenant_force('tenant12');
call oceanbase.create_mysql_tenant_mini('tenant12');
select case when tenant_id > 1000 then 1000 else tenant_id end tenant_id, label, ctx_name, mod_type, mod_id, mod_name, used, count from __all_virtual_memory_info
where label like '%TZ%' and SVR_IP=HOST_IP() and SVR_PORT=RPC_PORT() order by tenant_id, label;
tenant_id	label	ctx_name	mod_type	mod_id	mod_name	used	count
500	HasNodTzInfM	DEFAULT_CTX_ID	user	0	HasNodTzInfM	7880	1
500	ObTZIDHashNode	DEFAULT_CTX_ID	user	0	ObTZIDHashNode	129024	16
500	ObTZNameHashNod	DEFAULT_CTX_ID	user	0	ObTZNameHashNod	185472	23
500	ObTZNameIDInfo	DEFAULT_CTX_ID	user	0	ObTZNameIDInfo	145152	18
500	TenantTZ	DEFAULT_CTX_ID	user	0	TenantTZ	22400	7
500	TZInfoArray	DEFAULT_CTX_ID	user	0	TZInfoArray	33513984	2164
500	TZInfoMgrMap	DEFAULT_CTX_ID	user	0	TZInfoMgrMap	4194432	4
set time_zone = 'Africa/Accra';
set time_zone = 'Africa/Abidjan';
call oceanbase.drop_tenant_force('tenant12');
tenant_id	svr_ip	svr_port	ctx_id	label	ctx_name	mod_type	mod_id	mod_name	zone	hold	used	count
500	100.88.108.16	15304	0	TZInfoArray	DEFAULT_CTX_ID	user	0	TZInfoArray	zone1	16998016	16756992	1082
500	100.88.108.16	15304	0	TZInfoMgrMap	DEFAULT_CTX_ID	user	0	TZInfoMgrMap	zone1	1056768	1048608	1
500	100.88.108.16	15304	0	ObTZNameHashNod	DEFAULT_CTX_ID	user	0	ObTZNameHashNod	zone1	105664	104832	13
500	100.88.108.16	15304	0	ObTZNameIDInfo	DEFAULT_CTX_ID	user	0	ObTZNameIDInfo	zone1	81280	80640	10
500	100.88.108.16	15304	0	ObTZIDHashNode	DEFAULT_CTX_ID	user	0	ObTZIDHashNode	zone1	73152	72576	9
500	100.88.108.16	15304	0	TenantTZ	DEFAULT_CTX_ID	user	0	TenantTZ	zone1	16320	16000	5
500	100.88.108.16	15304	0	HasNodTzInfM	DEFAULT_CTX_ID	user	0	HasNodTzInfM	zone1	7952	7880	1
