drop database if exists db1;
create database db1;
use db1;
result_format: 4
alter system flush plan cache global;
affected rows: 0

alter system set _rowsets_enabled=false;
affected rows: 0

set autocommit = false;
affected rows: 0
alter system set ob_enable_batched_multi_statement=true;
affected rows: 0

#insert完整写法.
create table t1(c1 int not null primary key ,c2 int not null);
affected rows: 0
insert into t1(c1,c2) values(1,1);insert into t1(c1,c2) values(2,2);insert into t1(c1,c2) values(3,3);//
affected rows: 1
affected rows: 1
affected rows: 1
select * from t1;
+----+----+
| c1 | c2 |
+----+----+
|  1 |  1 |
|  2 |  2 |
|  3 |  3 |
+----+----+
affected rows: 3
select hit_count, is_batched_multi_stmt, statement, query_sql from oceanbase.GV$OB_PLAN_CACHE_PLAN_STAT where statement like 'insert into t1(c1,c2) %' order by hit_count;
+-----------+-----------------------+-----------------------------------+--------------------------------------------------------------------------------------------------------+
| hit_count | is_batched_multi_stmt | statement                         | query_sql                                                                                              |
+-----------+-----------------------+-----------------------------------+--------------------------------------------------------------------------------------------------------+
|         0 |                     1 | insert into t1(c1,c2) values(?,?) | insert into t1(c1,c2) values(1,1);insert into t1(c1,c2) values(2,2);insert into t1(c1,c2) values(3,3); |
+-----------+-----------------------+-----------------------------------+--------------------------------------------------------------------------------------------------------+
affected rows: 1
rollback;
affected rows: 0

#insert完整写法value值进行运算符计算
alter system flush plan cache global;
affected rows: 0
insert into t1(c1,c2) values(1*1,1*2);insert into t1(c1,c2) values(2*2,2*3);insert into t1(c1,c2) values(3*3,3*4);//
affected rows: 1
affected rows: 1
affected rows: 1
insert into t1(c1,c2) values(10/1,11/1);insert into t1(c1,c2) values(13/1,14/1);insert into t1(c1,c2) values(15/1,16/1);//
affected rows: 1
affected rows: 1
affected rows: 1
insert into t1(c1,c2) values(15%10,13%5);insert into t1(c1,c2) values(31%8,35%9);insert into t1(c1,c2) values(120%100,121%100);//
affected rows: 1
affected rows: 1
affected rows: 1
select * from t1;
+----+----+
| c1 | c2 |
+----+----+
|  1 |  2 |
|  4 |  6 |
|  5 |  3 |
|  7 |  8 |
|  9 | 12 |
| 10 | 11 |
| 13 | 14 |
| 15 | 16 |
| 20 | 21 |
+----+----+
affected rows: 9
select hit_count, is_batched_multi_stmt, statement, query_sql from oceanbase.GV$OB_PLAN_CACHE_PLAN_STAT where statement like 'insert into t1(c1,c2) %' order by hit_count;
+-----------+-----------------------+---------------------------------------+---------------------------------------------------------------------------------------------------------------------------------+
| hit_count | is_batched_multi_stmt | statement                             | query_sql                                                                                                                       |
+-----------+-----------------------+---------------------------------------+---------------------------------------------------------------------------------------------------------------------------------+
|         0 |                     1 | insert into t1(c1,c2) values(?*?,?*?) | insert into t1(c1,c2) values(1*1,1*2);insert into t1(c1,c2) values(2*2,2*3);insert into t1(c1,c2) values(3*3,3*4);              |
|         0 |                     1 | insert into t1(c1,c2) values(?/?,?/?) | insert into t1(c1,c2) values(10/1,11/1);insert into t1(c1,c2) values(13/1,14/1);insert into t1(c1,c2) values(15/1,16/1);        |
|         0 |                     1 | insert into t1(c1,c2) values(?%?,?%?) | insert into t1(c1,c2) values(15%10,13%5);insert into t1(c1,c2) values(31%8,35%9);insert into t1(c1,c2) values(120%100,121%100); |
+-----------+-----------------------+---------------------------------------+---------------------------------------------------------------------------------------------------------------------------------+
affected rows: 3
rollback;
affected rows: 0

drop table t1;
affected rows: 0


#insert 单列或多列
create table t2(c1 int primary key auto_increment,c2 int,c3 datetime default '2020-02-02');
affected rows: 0
insert into t2(c1) values(1+1);insert into t2(c1) values(2+2);insert into t2(c1) values(3+3);//
affected rows: 1
affected rows: 1
affected rows: 1
insert into t2(c1) values(11*1);insert into t2(c1) values(12*2);insert into t2(c1) values(13*3);//
affected rows: 1
affected rows: 1
affected rows: 1
insert into t2(c1) values(111-1);insert into t2(c1) values(112-1);insert into t2(c1) values(113-1);//
affected rows: 1
affected rows: 1
affected rows: 1
insert into t2(c1) values(100/1);insert into t2(c1) values(100/2);insert into t2(c1) values(100/3);//
affected rows: 1
affected rows: 1
affected rows: 1
insert into t2(c1) values(99%20);insert into t2(c1) values(98%20);insert into t2(c1) values(97%20);//
affected rows: 1
affected rows: 1
affected rows: 1
select * from t2;
+-----+------+---------------------+
| c1  | c2   | c3                  |
+-----+------+---------------------+
|   2 | NULL | 2020-02-02 00:00:00 |
|   4 | NULL | 2020-02-02 00:00:00 |
|   6 | NULL | 2020-02-02 00:00:00 |
|  11 | NULL | 2020-02-02 00:00:00 |
|  17 | NULL | 2020-02-02 00:00:00 |
|  18 | NULL | 2020-02-02 00:00:00 |
|  19 | NULL | 2020-02-02 00:00:00 |
|  24 | NULL | 2020-02-02 00:00:00 |
|  33 | NULL | 2020-02-02 00:00:00 |
|  39 | NULL | 2020-02-02 00:00:00 |
|  50 | NULL | 2020-02-02 00:00:00 |
| 100 | NULL | 2020-02-02 00:00:00 |
| 110 | NULL | 2020-02-02 00:00:00 |
| 111 | NULL | 2020-02-02 00:00:00 |
| 112 | NULL | 2020-02-02 00:00:00 |
+-----+------+---------------------+
affected rows: 15
select hit_count, is_batched_multi_stmt, statement, query_sql from oceanbase.GV$OB_PLAN_CACHE_PLAN_STAT where statement like 'insert into t2(c1) %' order by hit_count;
+-----------+-----------------------+--------------------------------+-----------------------------------------------------------------------------------------------------+
| hit_count | is_batched_multi_stmt | statement                      | query_sql                                                                                           |
+-----------+-----------------------+--------------------------------+-----------------------------------------------------------------------------------------------------+
|         0 |                     1 | insert into t2(c1) values(?+?) | insert into t2(c1) values(1+1);insert into t2(c1) values(2+2);insert into t2(c1) values(3+3);       |
|         0 |                     1 | insert into t2(c1) values(?*?) | insert into t2(c1) values(11*1);insert into t2(c1) values(12*2);insert into t2(c1) values(13*3);    |
|         0 |                     1 | insert into t2(c1) values(?-?) | insert into t2(c1) values(111-1);insert into t2(c1) values(112-1);insert into t2(c1) values(113-1); |
|         0 |                     1 | insert into t2(c1) values(?/?) | insert into t2(c1) values(100/1);insert into t2(c1) values(100/2);insert into t2(c1) values(100/3); |
|         0 |                     1 | insert into t2(c1) values(?%?) | insert into t2(c1) values(99%20);insert into t2(c1) values(98%20);insert into t2(c1) values(97%20); |
+-----------+-----------------------+--------------------------------+-----------------------------------------------------------------------------------------------------+
affected rows: 5
rollback;
affected rows: 0

#insert 多列非全部列
alter system flush plan cache global;
affected rows: 0
insert into t2(c1,c2) values(1-2,2-4);insert into t2(c1,c2) values(2-5,3-7);insert into t2(c1,c2) values(10-5,1-7);//
affected rows: 1
affected rows: 1
affected rows: 1
insert into t2(c1,c2) values(1*1,1*2);insert into t2(c1,c2) values(2*2,2*3);insert into t2(c1,c2) values(3*3,3*4);//
affected rows: 1
affected rows: 1
affected rows: 1
insert into t2(c1,c2) values(10/1,11/1);insert into t2(c1,c2) values(13/1,14/1);insert into t2(c1,c2) values(15/1,16/1);//
affected rows: 1
affected rows: 1
affected rows: 1
insert into t2(c1,c2) values(122%200,131%20);insert into t2(c1,c2) values(132%20,135%20);insert into t2(c1,c2) values(120%100,121%100);//
affected rows: 1
affected rows: 1
affected rows: 1
select * from t2;
+-----+------+---------------------+
| c1  | c2   | c3                  |
+-----+------+---------------------+
|  -3 |   -4 | 2020-02-02 00:00:00 |
|  -1 |   -2 | 2020-02-02 00:00:00 |
|   1 |    2 | 2020-02-02 00:00:00 |
|   4 |    6 | 2020-02-02 00:00:00 |
|   5 |   -6 | 2020-02-02 00:00:00 |
|   9 |   12 | 2020-02-02 00:00:00 |
|  10 |   11 | 2020-02-02 00:00:00 |
|  12 |   15 | 2020-02-02 00:00:00 |
|  13 |   14 | 2020-02-02 00:00:00 |
|  15 |   16 | 2020-02-02 00:00:00 |
|  20 |   21 | 2020-02-02 00:00:00 |
| 122 |   11 | 2020-02-02 00:00:00 |
+-----+------+---------------------+
affected rows: 12
select hit_count, is_batched_multi_stmt, statement, query_sql from oceanbase.GV$OB_PLAN_CACHE_PLAN_STAT where statement like 'insert into t2(c1,c2) %'order by hit_count;
+-----------+-----------------------+---------------------------------------+-----------------------------------------------------------------------------------------------------------------------------------------+
| hit_count | is_batched_multi_stmt | statement                             | query_sql                                                                                                                               |
+-----------+-----------------------+---------------------------------------+-----------------------------------------------------------------------------------------------------------------------------------------+
|         0 |                     1 | insert into t2(c1,c2) values(?-?,?-?) | insert into t2(c1,c2) values(1-2,2-4);insert into t2(c1,c2) values(2-5,3-7);insert into t2(c1,c2) values(10-5,1-7);                     |
|         0 |                     1 | insert into t2(c1,c2) values(?*?,?*?) | insert into t2(c1,c2) values(1*1,1*2);insert into t2(c1,c2) values(2*2,2*3);insert into t2(c1,c2) values(3*3,3*4);                      |
|         0 |                     1 | insert into t2(c1,c2) values(?/?,?/?) | insert into t2(c1,c2) values(10/1,11/1);insert into t2(c1,c2) values(13/1,14/1);insert into t2(c1,c2) values(15/1,16/1);                |
|         0 |                     1 | insert into t2(c1,c2) values(?%?,?%?) | insert into t2(c1,c2) values(122%200,131%20);insert into t2(c1,c2) values(132%20,135%20);insert into t2(c1,c2) values(120%100,121%100); |
+-----------+-----------------------+---------------------------------------+-----------------------------------------------------------------------------------------------------------------------------------------+
affected rows: 4
rollback;
affected rows: 0

drop table t2;
affected rows: 0

#insert into  set.....  
create table t3(c1 int primary key,c2 varchar(60) not null);
affected rows: 0
alter system flush plan cache global;
affected rows: 0
insert into t3 set c1 = 1,c2 = 'AA'; insert into t3 set c1 = 3,c2 = '张';insert into t3 set c1 = 5,c2 = '666';//
affected rows: 1
affected rows: 1
affected rows: 1
insert into t3 set c1 = 1*11,c2 = 'BB'; insert into t3 set c1 = 3*33,c2 = '王';insert into t3 set c1 = 5*55,c2 = '777';//
affected rows: 1
affected rows: 1
affected rows: 1
insert into t3 set c1 = 2+10,c2 = 'CC'; insert into t3 set c1 = 3+13,c2 = '李';insert into t3 set c1 = 5+15,c2 = '888';//
affected rows: 1
affected rows: 1
affected rows: 1
insert into t3 set c1 = 100/1,c2 = 'DD'; insert into t3 set c1 = 100/3,c2 = '赵';insert into t3 set c1 = 100/4,c2 = '2.12.21';//
affected rows: 1
affected rows: 1
affected rows: 1
commit;
affected rows: 0
select * from t3;
+-----+---------+
| c1  | c2      |
+-----+---------+
|   1 | AA      |
|   3 | 张      |
|   5 | 666     |
|  11 | BB      |
|  12 | CC      |
|  16 | 李      |
|  20 | 888     |
|  25 | 2.12.21 |
|  33 | 赵      |
|  99 | 王      |
| 100 | DD      |
| 275 | 777     |
+-----+---------+
affected rows: 12
select hit_count, is_batched_multi_stmt, statement, query_sql from oceanbase.GV$OB_PLAN_CACHE_PLAN_STAT where statement like 'insert into t3 set %' order by hit_count;
+-----------+-----------------------+------------------------------------+---------------------------------------------------------------------------------------------------------------------------------+
| hit_count | is_batched_multi_stmt | statement                          | query_sql                                                                                                                       |
+-----------+-----------------------+------------------------------------+---------------------------------------------------------------------------------------------------------------------------------+
|         0 |                     1 | insert into t3 set c1 = ?,c2 = ?   | insert into t3 set c1 = 1,c2 = 'AA'; insert into t3 set c1 = 3,c2 = '张';insert into t3 set c1 = 5,c2 = '666';                  |
|         0 |                     1 | insert into t3 set c1 = ?*?,c2 = ? | insert into t3 set c1 = 1*11,c2 = 'BB'; insert into t3 set c1 = 3*33,c2 = '王';insert into t3 set c1 = 5*55,c2 = '777';         |
|         0 |                     1 | insert into t3 set c1 = ?+?,c2 = ? | insert into t3 set c1 = 2+10,c2 = 'CC'; insert into t3 set c1 = 3+13,c2 = '李';insert into t3 set c1 = 5+15,c2 = '888';         |
|         0 |                     1 | insert into t3 set c1 = ?/?,c2 = ? | insert into t3 set c1 = 100/1,c2 = 'DD'; insert into t3 set c1 = 100/3,c2 = '赵';insert into t3 set c1 = 100/4,c2 = '2.12.21';  |
+-----------+-----------------------+------------------------------------+---------------------------------------------------------------------------------------------------------------------------------+
affected rows: 4
delete from t3;
affected rows: 12
commit;
affected rows: 0
drop table t3;
affected rows: 0

#insert ignore into....
create table t4(a1 varchar(60) not null,c2 char(60) not null);
affected rows: 0
alter system flush plan cache global;
affected rows: 0
insert ignore into t4 values('ABC','#%#%');insert ignore into t4 values('DDD','王五');insert ignore into t4 values('23FAD','/*-+52');//
affected rows: 1
affected rows: 1
affected rows: 1
commit;
affected rows: 0
select * from t4;
+-------+--------+
| a1    | c2     |
+-------+--------+
| ABC   | #%#%   |
| DDD   | 王五   |
| 23FAD | /*-+52 |
+-------+--------+
affected rows: 3
select hit_count, is_batched_multi_stmt, statement, query_sql from oceanbase.GV$OB_PLAN_CACHE_PLAN_STAT where statement like 'insert ignore into %' order by hit_count;
+-----------+-----------------------+-----------------------------------+-----------------------------------------------------------------------------------------------------------------------------------------+
| hit_count | is_batched_multi_stmt | statement                         | query_sql                                                                                                                               |
+-----------+-----------------------+-----------------------------------+-----------------------------------------------------------------------------------------------------------------------------------------+
|         0 |                     1 | insert ignore into t4 values(?,?) | insert ignore into t4 values('ABC','#%#%');insert ignore into t4 values('DDD','王五');insert ignore into t4 values('23FAD','/*-+52');   |
+-----------+-----------------------+-----------------------------------+-----------------------------------------------------------------------------------------------------------------------------------------+
affected rows: 1
delete from t4;
affected rows: 3
commit;
affected rows: 0

create table t5(c1 int not null primary key,c2 int not null);
affected rows: 0
alter system flush plan cache global;
affected rows: 0
insert ignore into t5 values(1-2,2-4);insert ignore into t5 values(2-5,3-7);insert ignore into t5 values(10-5,1-7);//
affected rows: 1
affected rows: 1
affected rows: 1
insert ignore into t5 values(10*10,10*20);insert ignore into t5 values(10*10,10*20);insert ignore into t5 values(30*3,30*4);//
affected rows: 1
affected rows: 1
affected rows: 1
insert ignore into t5 values(10/1,11/1);insert ignore into t5 values(13/1,14/1);insert ignore into t5 values(13/1,14/1);//
affected rows: 1
affected rows: 1
affected rows: 1
insert ignore into t5 values(15%10,13%5);insert ignore into t5 values(31%8,35%9);insert ignore into t5 values(120%100,121%100);//
affected rows: 1
affected rows: 1
affected rows: 1
commit;
affected rows: 0
select * from t5;
+-----+-----+
| c1  | c2  |
+-----+-----+
|  -3 |  -4 |
|  -1 |  -2 |
|   5 |  -6 |
|   7 |   8 |
|  10 |  11 |
|  13 |  14 |
|  20 |  21 |
|  90 | 120 |
| 100 | 200 |
+-----+-----+
affected rows: 9
select hit_count, is_batched_multi_stmt, statement, query_sql from oceanbase.GV$OB_PLAN_CACHE_PLAN_STAT where statement like 'insert ignore into %' order by hit_count;
+-----------+-----------------------+---------------------------------------+---------------------------------------------------------------------------------------------------------------------------------+
| hit_count | is_batched_multi_stmt | statement                             | query_sql                                                                                                                       |
+-----------+-----------------------+---------------------------------------+---------------------------------------------------------------------------------------------------------------------------------+
|         0 |                     1 | insert ignore into t5 values(?-?,?-?) | insert ignore into t5 values(1-2,2-4);insert ignore into t5 values(2-5,3-7);insert ignore into t5 values(10-5,1-7);             |
|         0 |                     1 | insert ignore into t5 values(?*?,?*?) | insert ignore into t5 values(10*10,10*20);insert ignore into t5 values(10*10,10*20);insert ignore into t5 values(30*3,30*4);    |
|         0 |                     1 | insert ignore into t5 values(?/?,?/?) | insert ignore into t5 values(10/1,11/1);insert ignore into t5 values(13/1,14/1);insert ignore into t5 values(13/1,14/1);        |
|         0 |                     1 | insert ignore into t5 values(?%?,?%?) | insert ignore into t5 values(15%10,13%5);insert ignore into t5 values(31%8,35%9);insert ignore into t5 values(120%100,121%100); |
+-----------+-----------------------+---------------------------------------+---------------------------------------------------------------------------------------------------------------------------------+
affected rows: 4
delete from t5;
affected rows: 9
commit;
affected rows: 0
drop table t5;
affected rows: 0


#多个insert间 插入delete语句(没有进行batch 优化)
create table t6 (c1 int,c2 int);
affected rows: 0
insert into t6 values(1,1),(2,2),(3,3),(4,4),(5,5);
affected rows: 5
info: Records: 5  Duplicates: 0  Warnings: 0
commit;
affected rows: 0
alter system flush plan cache global;
affected rows: 0
insert into t6 values(10,10);delete from t6 where c1 = 1;insert into t6 values(11,11);//
affected rows: 1
affected rows: 1
affected rows: 1
select hit_count, is_batched_multi_stmt, statement, query_sql from oceanbase.GV$OB_PLAN_CACHE_PLAN_STAT where statement like 'insert into t6 %' order by hit_count;
+-----------+-----------------------+-----------------------------+-------------------------------+
| hit_count | is_batched_multi_stmt | statement                   | query_sql                     |
+-----------+-----------------------+-----------------------------+-------------------------------+
|         1 |                     0 | insert into t6 values(?,?); | insert into t6 values(10,10); |
+-----------+-----------------------+-----------------------------+-------------------------------+
affected rows: 1
select * from t6;
+------+------+
| c1   | c2   |
+------+------+
|    2 |    2 |
|    3 |    3 |
|    4 |    4 |
|    5 |    5 |
|   10 |   10 |
|   11 |   11 |
+------+------+
affected rows: 6
rollback;
affected rows: 0

alter system flush plan cache global;
affected rows: 0
#多个insert间 插入update(没有进行batch优化)
insert into t6 values(10,10);update  t6 set c1 = 0 where c1 = 2;insert into t6 values(11,11);//
affected rows: 1
affected rows: 1
info:  Rows matched: 1  Changed: 1  Warnings: 0
affected rows: 1
select hit_count, is_batched_multi_stmt, statement, query_sql from oceanbase.GV$OB_PLAN_CACHE_PLAN_STAT where statement like 'insert into t6 %' order by hit_count;
+-----------+-----------------------+-----------------------------+-------------------------------+
| hit_count | is_batched_multi_stmt | statement                   | query_sql                     |
+-----------+-----------------------+-----------------------------+-------------------------------+
|         1 |                     0 | insert into t6 values(?,?); | insert into t6 values(10,10); |
+-----------+-----------------------+-----------------------------+-------------------------------+
affected rows: 1
commit;
affected rows: 0
select * from t6;
+------+------+
| c1   | c2   |
+------+------+
|    1 |    1 |
|    0 |    2 |
|    3 |    3 |
|    4 |    4 |
|    5 |    5 |
|   10 |   10 |
|   11 |   11 |
+------+------+
affected rows: 7
delete from t6;
affected rows: 7
commit;
affected rows: 0
drop table t6;
affected rows: 0


#insert into select ....(子查询)
drop table if exists t7,t8,t9,t10;
affected rows: 0
Warnings:
Note	1051	Unknown table 'db1.t7'
Note	1051	Unknown table 'db1.t8'
Note	1051	Unknown table 'db1.t9'
Note	1051	Unknown table 'db1.t10'
create table t7(c1 int not null primary key ,c2 varchar(20) not null);
affected rows: 0
insert into t7 values(0,'牛二'),(1,'张三'),(2,'李四'),(3,'王五'),(4,'马六'),(5,'田七'),(7,'腊八');
affected rows: 7
info: Records: 7  Duplicates: 0  Warnings: 0
commit;
affected rows: 0
create table t8(a1 int not null,a2 varchar(20));
affected rows: 0
insert into t8 values(1,'abc'),(2,'def'),(3,'ghi'),(4,'jkl'),(5,null),(6,'mno');
affected rows: 6
info: Records: 6  Duplicates: 0  Warnings: 0
commit;
affected rows: 0
create table t9(b1 int,b2 varchar(20));
affected rows: 0
create table t10(d1 int,d2 varchar(20),d3 int,d4 varchar(20));
affected rows: 0

#insert + select + order by
insert into t9 select * from t7 where c1 = 1 order by c2;insert into t9 select * from t7 where c1 = 2 order by c2;insert into t9 select * from t7 where c1 = 3 order by c2;//
affected rows: 1
affected rows: 1
affected rows: 1
select * from t9;
+------+--------+
| b1   | b2     |
+------+--------+
|    1 | 张三   |
|    2 | 李四   |
|    3 | 王五   |
+------+--------+
affected rows: 3
select hit_count, is_batched_multi_stmt, statement, query_sql from oceanbase.GV$OB_PLAN_CACHE_PLAN_STAT where statement like 'insert into t9 select * from t7 where c1 = % order by c2' order by hit_count;
+-----------+-----------------------+-----------+-----------+
| hit_count | is_batched_multi_stmt | statement | query_sql |
+-----------+-----------------------+-----------+-----------+
+-----------+-----------------------+-----------+-----------+
affected rows: 0
rollback;
affected rows: 0

#insert + select + limit
insert into t9 select * from t7 where c1 = 1 limit 1;insert into t9 select * from t7 where c1 = 2 limit 1;insert into t9 select * from t7 where c1 = 3 limit 1;//
affected rows: 1
affected rows: 1
affected rows: 1
select * from t9;
+------+--------+
| b1   | b2     |
+------+--------+
|    1 | 张三   |
|    2 | 李四   |
|    3 | 王五   |
+------+--------+
affected rows: 3
select hit_count, is_batched_multi_stmt, statement, query_sql from oceanbase.GV$OB_PLAN_CACHE_PLAN_STAT where statement like 'insert into t9 select * from t7 where c1 = % order by c2' order by hit_count;
+-----------+-----------------------+-----------+-----------+
| hit_count | is_batched_multi_stmt | statement | query_sql |
+-----------+-----------------------+-----------+-----------+
+-----------+-----------------------+-----------+-----------+
affected rows: 0
rollback;
affected rows: 0


#in关键字  (plan cache命中两次,没有进行batch优化)
alter system flush plan cache global;
affected rows: 0
insert into t9 select c1,c2 from t7 where c1 in (select a1 from t8 where a1 = 1);insert into t9 select c1,c2 from t7 where c1 in (select a1 from t8 where a1 = 2);insert into t9 select c1,c2 from t7 where c1 in (select a1 from t8 where a1 = 3);//
affected rows: 1
affected rows: 1
affected rows: 1
select * from t9;
+------+--------+
| b1   | b2     |
+------+--------+
|    1 | 张三   |
|    2 | 李四   |
|    3 | 王五   |
+------+--------+
affected rows: 3
select hit_count, is_batched_multi_stmt, statement, query_sql from oceanbase.GV$OB_PLAN_CACHE_PLAN_STAT where statement like 'insert into t9 % where c1 in %' order by hit_count;
+-----------+-----------------------+-----------------------------------------------------------------------------------+-----------------------------------------------------------------------------------+
| hit_count | is_batched_multi_stmt | statement                                                                         | query_sql                                                                         |
+-----------+-----------------------+-----------------------------------------------------------------------------------+-----------------------------------------------------------------------------------+
|         2 |                     0 | insert into t9 select c1,c2 from t7 where c1 in (select a1 from t8 where a1 = ?); | insert into t9 select c1,c2 from t7 where c1 in (select a1 from t8 where a1 = 1); |
+-----------+-----------------------+-----------------------------------------------------------------------------------+-----------------------------------------------------------------------------------+
affected rows: 1
rollback;
affected rows: 0

#not in关键字 (plan cache命中一次,没有进行batch优化)
insert into t9 select c1,c2 from t7 where c1 not in (select a1 from t8 where a1 = 1 order by a2);insert into t9 select c1,c2 from t7 where c1 not in (select a1 from t8 where a1 = 2 order by a2);insert into t9 select c1,c2 from t7 where c1 in (select a1 from t8 where a1 = 3 order by a2);//
affected rows: 6
info:  Records: 6  Duplicates: 0  Warnings: 0
affected rows: 6
info:  Records: 6  Duplicates: 0  Warnings: 0
affected rows: 1
select * from t9;
+------+--------+
| b1   | b2     |
+------+--------+
|    0 | 牛二   |
|    2 | 李四   |
|    3 | 王五   |
|    4 | 马六   |
|    5 | 田七   |
|    7 | 腊八   |
|    0 | 牛二   |
|    1 | 张三   |
|    3 | 王五   |
|    4 | 马六   |
|    5 | 田七   |
|    7 | 腊八   |
|    3 | 王五   |
+------+--------+
affected rows: 13
select hit_count, is_batched_multi_stmt, statement, query_sql from oceanbase.GV$OB_PLAN_CACHE_PLAN_STAT where statement like 'insert into t9 % where c1 not in %' order by hit_count;
+-----------+-----------------------+---------------------------------------------------------------------------------------------------+---------------------------------------------------------------------------------------------------+
| hit_count | is_batched_multi_stmt | statement                                                                                         | query_sql                                                                                         |
+-----------+-----------------------+---------------------------------------------------------------------------------------------------+---------------------------------------------------------------------------------------------------+
|         1 |                     0 | insert into t9 select c1,c2 from t7 where c1 not in (select a1 from t8 where a1 = ? order by a2); | insert into t9 select c1,c2 from t7 where c1 not in (select a1 from t8 where a1 = 1 order by a2); |
+-----------+-----------------------+---------------------------------------------------------------------------------------------------+---------------------------------------------------------------------------------------------------+
affected rows: 1
rollback;
affected rows: 0


#any关键字 (plan cache命中两次,没有进行batch优化)
insert into t9 select c1,c2 from t7 where c1 = any (select a1 from t8 where a1 = 1);insert into t9 select c1,c2 from t7 where c1 = any (select a1 from t8 where a1 = 2);insert into t9 select c1,c2 from t7 where c1 = any (select a1 from t8 where a1 = 3);//
affected rows: 1
affected rows: 1
affected rows: 1
select * from t9;
+------+--------+
| b1   | b2     |
+------+--------+
|    1 | 张三   |
|    2 | 李四   |
|    3 | 王五   |
+------+--------+
affected rows: 3
select hit_count, is_batched_multi_stmt, statement, query_sql from oceanbase.GV$OB_PLAN_CACHE_PLAN_STAT where statement like 'insert into t9 % where c1 = any %' order by hit_count;
+-----------+-----------------------+--------------------------------------------------------------------------------------+--------------------------------------------------------------------------------------+
| hit_count | is_batched_multi_stmt | statement                                                                            | query_sql                                                                            |
+-----------+-----------------------+--------------------------------------------------------------------------------------+--------------------------------------------------------------------------------------+
|         2 |                     0 | insert into t9 select c1,c2 from t7 where c1 = any (select a1 from t8 where a1 = ?); | insert into t9 select c1,c2 from t7 where c1 = any (select a1 from t8 where a1 = 1); |
+-----------+-----------------------+--------------------------------------------------------------------------------------+--------------------------------------------------------------------------------------+
affected rows: 1
rollback;
affected rows: 0


#all (plan cache命中两次,没有进行batch优化)
insert into t9 select c1,c2 from t7 where c1 = all (select a1 from t8 where a1 = 1) order by c2;insert into t9 select c1,c2 from t7 where c1 = all (select a1 from t8 where a1 = 2) order by c2;insert into t9 select c1,c2 from t7 where c1 = all (select a1 from t8 where a1 = 3) order by c2;//
affected rows: 1
affected rows: 1
affected rows: 1
select * from t9;
+------+--------+
| b1   | b2     |
+------+--------+
|    1 | 张三   |
|    2 | 李四   |
|    3 | 王五   |
+------+--------+
affected rows: 3
select hit_count, is_batched_multi_stmt, statement, query_sql from oceanbase.GV$OB_PLAN_CACHE_PLAN_STAT where statement like 'insert into t9 % where c1 = all %' order by hit_count;
+-----------+-----------------------+--------------------------------------------------------------------------------------------------+--------------------------------------------------------------------------------------------------+
| hit_count | is_batched_multi_stmt | statement                                                                                        | query_sql                                                                                        |
+-----------+-----------------------+--------------------------------------------------------------------------------------------------+--------------------------------------------------------------------------------------------------+
|         2 |                     0 | insert into t9 select c1,c2 from t7 where c1 = all (select a1 from t8 where a1 = ?) order by c2; | insert into t9 select c1,c2 from t7 where c1 = all (select a1 from t8 where a1 = 1) order by c2; |
+-----------+-----------------------+--------------------------------------------------------------------------------------------------+--------------------------------------------------------------------------------------------------+
affected rows: 1
rollback;
affected rows: 0

#some  (命中1次，没有进行batch优化)
insert into t9 select c1,c2 from t7 where c1 = some (select min(a1) from t8);insert into t9 select c1,c2 from t7 where c1 = some(select max(a1)from t8);insert into t9 select c1,c2 from t7 where c1 = some (select min(a1) from t8);//
affected rows: 1
affected rows: 0
affected rows: 1
select * from t9;
+------+--------+
| b1   | b2     |
+------+--------+
|    1 | 张三   |
|    1 | 张三   |
+------+--------+
affected rows: 2
select hit_count, is_batched_multi_stmt, statement, query_sql from oceanbase.GV$OB_PLAN_CACHE_PLAN_STAT where statement like 'insert into t9 % where c1 = some %' order by hit_count;
+-----------+-----------------------+-------------------------------------------------------------------------------+-------------------------------------------------------------------------------+
| hit_count | is_batched_multi_stmt | statement                                                                     | query_sql                                                                     |
+-----------+-----------------------+-------------------------------------------------------------------------------+-------------------------------------------------------------------------------+
|         1 |                     0 | insert into t9 select c1,c2 from t7 where c1 = some (select min(a1) from t8); | insert into t9 select c1,c2 from t7 where c1 = some (select min(a1) from t8); |
+-----------+-----------------------+-------------------------------------------------------------------------------+-------------------------------------------------------------------------------+
affected rows: 1
rollback;
affected rows: 0

#exists (命中0次，没有进行batch优化)
insert into t9 select c1,c2 from t7 where exists (select max(a1) from t8) limit 1;insert into t9 select c1,c2 from t7 where exists (select min(a1) from t8) limit 1;insert into t9 select c1,c2 from t7 where exists (select avg(a1) from t8) limit 1;//
affected rows: 1
affected rows: 1
affected rows: 1
select * from t9;
+------+--------+
| b1   | b2     |
+------+--------+
|    0 | 牛二   |
|    0 | 牛二   |
|    0 | 牛二   |
+------+--------+
affected rows: 3
select hit_count, is_batched_multi_stmt, statement, query_sql from oceanbase.GV$OB_PLAN_CACHE_PLAN_STAT where statement like 'insert into t9 % where exists %' order by hit_count;
+-----------+-----------------------+------------------------------------------------------------------------------------+------------------------------------------------------------------------------------+
| hit_count | is_batched_multi_stmt | statement                                                                          | query_sql                                                                          |
+-----------+-----------------------+------------------------------------------------------------------------------------+------------------------------------------------------------------------------------+
|         0 |                     0 | insert into t9 select c1,c2 from t7 where exists (select max(a1) from t8) limit ?; | insert into t9 select c1,c2 from t7 where exists (select max(a1) from t8) limit 1; |
|         0 |                     0 | insert into t9 select c1,c2 from t7 where exists (select min(a1) from t8) limit ?; | insert into t9 select c1,c2 from t7 where exists (select min(a1) from t8) limit 1; |
|         0 |                     0 | insert into t9 select c1,c2 from t7 where exists (select avg(a1) from t8) limit ?; | insert into t9 select c1,c2 from t7 where exists (select avg(a1) from t8) limit 1; |
+-----------+-----------------------+------------------------------------------------------------------------------------+------------------------------------------------------------------------------------+
affected rows: 3
rollback;
affected rows: 0

#not exists
insert into t9 select c1,c2 from t7 where not exists (select max(a1) from t8) limit 1;insert into t9 select c1,c2 from t7 where not exists (select min(a1) from t8) limit 1;insert into t9 select c1,c2 from t7 where not exists (select avg(a1) from t8) limit 1;//
affected rows: 0
affected rows: 0
affected rows: 0
select * from t9;
+------+------+
| b1   | b2   |
+------+------+
+------+------+
affected rows: 0
select hit_count, is_batched_multi_stmt, statement, query_sql from oceanbase.GV$OB_PLAN_CACHE_PLAN_STAT where statement like 'insert into t9 % where not exists %' order by hit_count;
+-----------+-----------------------+----------------------------------------------------------------------------------------+----------------------------------------------------------------------------------------+
| hit_count | is_batched_multi_stmt | statement                                                                              | query_sql                                                                              |
+-----------+-----------------------+----------------------------------------------------------------------------------------+----------------------------------------------------------------------------------------+
|         0 |                     0 | insert into t9 select c1,c2 from t7 where not exists (select max(a1) from t8) limit ?; | insert into t9 select c1,c2 from t7 where not exists (select max(a1) from t8) limit 1; |
|         0 |                     0 | insert into t9 select c1,c2 from t7 where not exists (select min(a1) from t8) limit ?; | insert into t9 select c1,c2 from t7 where not exists (select min(a1) from t8) limit 1; |
|         0 |                     0 | insert into t9 select c1,c2 from t7 where not exists (select avg(a1) from t8) limit ?; | insert into t9 select c1,c2 from t7 where not exists (select avg(a1) from t8) limit 1; |
+-----------+-----------------------+----------------------------------------------------------------------------------------+----------------------------------------------------------------------------------------+
affected rows: 3
rollback;
affected rows: 0

#like   (命中两次,没有进行batch 优化)
insert into t9 select * from t7 where c1 like (select a1 from t8 where a1 = 3);insert into t9 select * from t7 where c1 like (select a1 from t8 where a1 = 4);insert into t9 select * from t7 where c1 like (select a1 from t8 where a1 = 5);//
affected rows: 1
affected rows: 1
affected rows: 1
select * from t9;
+------+--------+
| b1   | b2     |
+------+--------+
|    3 | 王五   |
|    4 | 马六   |
|    5 | 田七   |
+------+--------+
affected rows: 3
select hit_count, is_batched_multi_stmt, statement, query_sql from oceanbase.GV$OB_PLAN_CACHE_PLAN_STAT where statement like 'insert into t9 % where c1 like %' order by hit_count;
+-----------+-----------------------+---------------------------------------------------------------------------------+---------------------------------------------------------------------------------+
| hit_count | is_batched_multi_stmt | statement                                                                       | query_sql                                                                       |
+-----------+-----------------------+---------------------------------------------------------------------------------+---------------------------------------------------------------------------------+
|         2 |                     0 | insert into t9 select * from t7 where c1 like (select a1 from t8 where a1 = ?); | insert into t9 select * from t7 where c1 like (select a1 from t8 where a1 = 3); |
+-----------+-----------------------+---------------------------------------------------------------------------------+---------------------------------------------------------------------------------+
affected rows: 1
rollback;
affected rows: 0

#运算符
# "=" (命中3次,没有进行batch优化)
alter system flush plan cache global;
affected rows: 0
insert into t9 select 3*3*3+6,c2 from t7 where c1 = (select a1 from t8 where a1 = 1);insert into t9 select 2*2*2+4,c2 from t7 where c1 = (select a1 from t8 where a1 = 2);//
affected rows: 1
affected rows: 1
insert into t9 select 4*4*4+8,c2 from t7 where c1 = (select a1 from t8 where a1 = 3);insert into t9 select 5*5*5+10,c2 from t7 where c1 = (select a1 from t8 where a1 = 4);//
affected rows: 1
affected rows: 1
select * from t9;
+------+--------+
| b1   | b2     |
+------+--------+
|   33 | 张三   |
|   12 | 李四   |
|   72 | 王五   |
|  135 | 马六   |
+------+--------+
affected rows: 4
select hit_count, is_batched_multi_stmt, statement, query_sql from oceanbase.GV$OB_PLAN_CACHE_PLAN_STAT where statement like 'insert into t9 % where c1 = %' order by hit_count;
+-----------+-----------------------+---------------------------------------------------------------------------------------+---------------------------------------------------------------------------------------+
| hit_count | is_batched_multi_stmt | statement                                                                             | query_sql                                                                             |
+-----------+-----------------------+---------------------------------------------------------------------------------------+---------------------------------------------------------------------------------------+
|         3 |                     0 | insert into t9 select ?*?*?+?,c2 from t7 where c1 = (select a1 from t8 where a1 = ?); | insert into t9 select 3*3*3+6,c2 from t7 where c1 = (select a1 from t8 where a1 = 1); |
+-----------+-----------------------+---------------------------------------------------------------------------------------+---------------------------------------------------------------------------------------+
affected rows: 1
rollback;
affected rows: 0


# ">" (命中0次，没有进行batch优化)
insert into t9 select * from t7 where c1 > (select a1 from t8 where a1 = 3);insert into t9 select * from t7 where c1 > (select a1 from t8 where a1 = 4);//
affected rows: 3
info:  Records: 3  Duplicates: 0  Warnings: 0
affected rows: 2
info: Records: 2  Duplicates: 0  Warnings: 0
insert into t9 select * from t7 where c1 > (select a1 from t8 where a1 = 5);insert into t9 select * from t7 where c1 > (select a1 from t8 where a1 = 6);//
affected rows: 1
affected rows: 1
select * from t9;
+------+--------+
| b1   | b2     |
+------+--------+
|    4 | 马六   |
|    5 | 田七   |
|    7 | 腊八   |
|    5 | 田七   |
|    7 | 腊八   |
|    7 | 腊八   |
|    7 | 腊八   |
+------+--------+
affected rows: 7
select hit_count, is_batched_multi_stmt, statement, query_sql from oceanbase.GV$OB_PLAN_CACHE_PLAN_STAT where statement like 'insert into t9 % where c1 > %' order by hit_count;
+-----------+-----------------------+------------------------------------------------------------------------------+------------------------------------------------------------------------------+
| hit_count | is_batched_multi_stmt | statement                                                                    | query_sql                                                                    |
+-----------+-----------------------+------------------------------------------------------------------------------+------------------------------------------------------------------------------+
|         3 |                     0 | insert into t9 select * from t7 where c1 > (select a1 from t8 where a1 = ?); | insert into t9 select * from t7 where c1 > (select a1 from t8 where a1 = 3); |
+-----------+-----------------------+------------------------------------------------------------------------------+------------------------------------------------------------------------------+
affected rows: 1
rollback;
affected rows: 0

#">=" (命中3次，没有进行batch优化)
insert into t9 select 10+10,c2 from t7 where c1 >= (select a1 from t8 where a1 = 3);insert into t9 select 30+30,c2 from t7 where c1 >= (select a1 from t8 where a1 = 4);//
affected rows: 4
info:  Records: 4  Duplicates: 0  Warnings: 0
affected rows: 3
info: Records: 3  Duplicates: 0  Warnings: 0
insert into t9 select 20+20,c2 from t7 where c1 >= (select a1 from t8 where a1 = 5);insert into t9 select 40+40,c2 from t7 where c1 >= (select a1 from t8 where a1 = 6);//
affected rows: 2
info:  Records: 2  Duplicates: 0  Warnings: 0
affected rows: 1
select * from t9;
+------+--------+
| b1   | b2     |
+------+--------+
|   20 | 王五   |
|   20 | 马六   |
|   20 | 田七   |
|   20 | 腊八   |
|   60 | 马六   |
|   60 | 田七   |
|   60 | 腊八   |
|   40 | 田七   |
|   40 | 腊八   |
|   80 | 腊八   |
+------+--------+
affected rows: 10
select hit_count, is_batched_multi_stmt, statement, query_sql from oceanbase.GV$OB_PLAN_CACHE_PLAN_STAT where statement like 'insert into t9 % where c1 >= %' order by hit_count;
+-----------+-----------------------+------------------------------------------------------------------------------------+--------------------------------------------------------------------------------------+
| hit_count | is_batched_multi_stmt | statement                                                                          | query_sql                                                                            |
+-----------+-----------------------+------------------------------------------------------------------------------------+--------------------------------------------------------------------------------------+
|         3 |                     0 | insert into t9 select ?+?,c2 from t7 where c1 >= (select a1 from t8 where a1 = ?); | insert into t9 select 10+10,c2 from t7 where c1 >= (select a1 from t8 where a1 = 3); |
+-----------+-----------------------+------------------------------------------------------------------------------------+--------------------------------------------------------------------------------------+
affected rows: 1
rollback;
affected rows: 0

#"<" (命中0次,没有进行batch优化)
insert into t9 select 8/8,c2  from t7 where c1 < (select a1 from t8 where a1 = 3)limit 1;insert into t9 select 8/4,c2  from t7 where c1 < (select a1 from t8 where a1 = 4)limit 1;//
affected rows: 1
affected rows: 1
insert into t9 select 9/3,c2  from t7 where c1 < (select a1 from t8 where a1 = 5)limit 1;insert into t9 select 8/2,c2  from t7 where c1 < (select a1 from t8 where a1 = 6)limit 1;//
affected rows: 1
affected rows: 1
select * from t9;
+------+--------+
| b1   | b2     |
+------+--------+
|    1 | 牛二   |
|    2 | 牛二   |
|    3 | 牛二   |
|    4 | 牛二   |
+------+--------+
affected rows: 4
select hit_count, is_batched_multi_stmt, statement, query_sql from oceanbase.GV$OB_PLAN_CACHE_PLAN_STAT where statement like 'insert into t9 % where c1 < %' order by hit_count;
+-----------+-----------------------+-------------------------------------------------------------------------------------------+-------------------------------------------------------------------------------------------+
| hit_count | is_batched_multi_stmt | statement                                                                                 | query_sql                                                                                 |
+-----------+-----------------------+-------------------------------------------------------------------------------------------+-------------------------------------------------------------------------------------------+
|         3 |                     0 | insert into t9 select ?/?,c2  from t7 where c1 < (select a1 from t8 where a1 = ?)limit ?; | insert into t9 select 8/8,c2  from t7 where c1 < (select a1 from t8 where a1 = 3)limit 1; |
+-----------+-----------------------+-------------------------------------------------------------------------------------------+-------------------------------------------------------------------------------------------+
affected rows: 1
rollback;
affected rows: 0

#"<="(命中三次，没有进行batch优化)
insert into t9 select 8*8,c2 from t7 where c1 <= (select a1 from t8 where a1 = 3)limit 1;insert into t9 select 9*9,c2 from t7 where c1 <= (select a1 from t8 where a1 = 4)limit 1;//
affected rows: 1
affected rows: 1
insert into t9 select 7*7,c2 from t7 where c1 <= (select a1 from t8 where a1 = 5)limit 1;insert into t9 select 6*6,c2 from t7 where c1 <= (select a1 from t8 where a1 = 6)limit 1;//
affected rows: 1
affected rows: 1
select * from t9;
+------+--------+
| b1   | b2     |
+------+--------+
|   64 | 牛二   |
|   81 | 牛二   |
|   49 | 牛二   |
|   36 | 牛二   |
+------+--------+
affected rows: 4
select hit_count, is_batched_multi_stmt, statement, query_sql from oceanbase.GV$OB_PLAN_CACHE_PLAN_STAT where statement like 'insert into t9 % where c1 <= %' order by hit_count;
+-----------+-----------------------+-------------------------------------------------------------------------------------------+-------------------------------------------------------------------------------------------+
| hit_count | is_batched_multi_stmt | statement                                                                                 | query_sql                                                                                 |
+-----------+-----------------------+-------------------------------------------------------------------------------------------+-------------------------------------------------------------------------------------------+
|         3 |                     0 | insert into t9 select ?*?,c2 from t7 where c1 <= (select a1 from t8 where a1 = ?)limit ?; | insert into t9 select 8*8,c2 from t7 where c1 <= (select a1 from t8 where a1 = 3)limit 1; |
+-----------+-----------------------+-------------------------------------------------------------------------------------------+-------------------------------------------------------------------------------------------+
affected rows: 1
rollback;
affected rows: 0

#"!="(命中3次，没有进行batch优化)
insert into t9 select 1+1,c2 from t7 where c1 != (select a1 from t8 where a1 = 2)limit 1;insert into t9 select 3+4,c2 from t7 where c1 != (select a1 from t8 where a1 = 4)limit 1;//
affected rows: 1
affected rows: 1
insert into t9 select 2+2,c2 from t7 where c1 != (select a1 from t8 where a1 = 3)limit 1;insert into t9 select 5+8,c2 from t7 where c1 != (select a1 from t8 where a1 = 6)limit 1;//
affected rows: 1
affected rows: 1
select * from t9;
+------+--------+
| b1   | b2     |
+------+--------+
|    2 | 牛二   |
|    7 | 牛二   |
|    4 | 牛二   |
|   13 | 牛二   |
+------+--------+
affected rows: 4
select hit_count, is_batched_multi_stmt, statement, query_sql from oceanbase.GV$OB_PLAN_CACHE_PLAN_STAT where statement like 'insert into t9 % where c1 != %' order by hit_count;
+-----------+-----------------------+-------------------------------------------------------------------------------------------+-------------------------------------------------------------------------------------------+
| hit_count | is_batched_multi_stmt | statement                                                                                 | query_sql                                                                                 |
+-----------+-----------------------+-------------------------------------------------------------------------------------------+-------------------------------------------------------------------------------------------+
|         3 |                     0 | insert into t9 select ?+?,c2 from t7 where c1 != (select a1 from t8 where a1 = ?)limit ?; | insert into t9 select 1+1,c2 from t7 where c1 != (select a1 from t8 where a1 = 2)limit 1; |
+-----------+-----------------------+-------------------------------------------------------------------------------------------+-------------------------------------------------------------------------------------------+
affected rows: 1
rollback;
affected rows: 0

#"<>"(命中3次，没有进行batch优化)
insert into t9 select 1+1,c2 from t7 where c1 <> (select a1 from t8 where a1 = 2)limit 1;insert into t9 select 3+4,c2 from t7 where c1 <> (select a1 from t8 where a1 = 4)limit 1;//
affected rows: 1
affected rows: 1
insert into t9 select 2+2,c2 from t7 where c1 <> (select a1 from t8 where a1 = 3)limit 1;insert into t9 select 5+8,c2 from t7 where c1 <> (select a1 from t8 where a1 = 6)limit 1;//
affected rows: 1
affected rows: 1
select * from t9;
+------+--------+
| b1   | b2     |
+------+--------+
|    2 | 牛二   |
|    7 | 牛二   |
|    4 | 牛二   |
|   13 | 牛二   |
+------+--------+
affected rows: 4
select hit_count, is_batched_multi_stmt, statement, query_sql from oceanbase.GV$OB_PLAN_CACHE_PLAN_STAT where statement like 'insert into t9 % where c1 <> %' order by hit_count;
+-----------+-----------------------+-------------------------------------------------------------------------------------------+-------------------------------------------------------------------------------------------+
| hit_count | is_batched_multi_stmt | statement                                                                                 | query_sql                                                                                 |
+-----------+-----------------------+-------------------------------------------------------------------------------------------+-------------------------------------------------------------------------------------------+
|         3 |                     0 | insert into t9 select ?+?,c2 from t7 where c1 <> (select a1 from t8 where a1 = ?)limit ?; | insert into t9 select 1+1,c2 from t7 where c1 <> (select a1 from t8 where a1 = 2)limit 1; |
+-----------+-----------------------+-------------------------------------------------------------------------------------------+-------------------------------------------------------------------------------------------+
affected rows: 1
rollback;
affected rows: 0


#insert into select join.....
#insert into 无条件连接 (命中一次，进行batch优化)
alter system flush plan cache global;
affected rows: 0
insert into t10 select * from t7,t8 where t7.c1 = 1 limit 1;insert into t10 select * from t7,t8 where t7.c1 = 2 limit 1;//
affected rows: 1
affected rows: 1
insert into t10 select * from t7,t8 where t7.c1 = 3 limit 1;insert into t10 select * from t7,t8 where t7.c1 = 4 limit 1;//
affected rows: 1
affected rows: 1
select * from t10;
+------+--------+------+------+
| d1   | d2     | d3   | d4   |
+------+--------+------+------+
|    1 | 张三   |    1 | abc  |
|    2 | 李四   |    1 | abc  |
|    3 | 王五   |    1 | abc  |
|    4 | 马六   |    1 | abc  |
+------+--------+------+------+
affected rows: 4
delete from t10;
affected rows: 4
commit;
affected rows: 0

#insert into select ... cross join ...(命中一次，进行batch优化)
insert into t10 select 1+1,t7.c2,2+2,t8.a2 from t7 cross join t8 where t7.c1 =1 limit 1;insert into t10 select 3+3,t7.c2,4+4,t8.a2 from t7 cross join t8 where t7.c1 =2 limit 1;//
affected rows: 1
affected rows: 1
insert into t10 select 5+5,t7.c2,6+6,t8.a2 from t7 cross join t8 where t7.c1 =3 limit 1;insert into t10 select 7+7,t7.c2,8+8,t8.a2 from t7 cross join t8 where t7.c1 =4 limit 1;//
affected rows: 1
affected rows: 1
commit;
affected rows: 0
select * from t10;
+------+--------+------+------+
| d1   | d2     | d3   | d4   |
+------+--------+------+------+
|    2 | 张三   |    4 | abc  |
|    6 | 李四   |    8 | abc  |
|   10 | 王五   |   12 | abc  |
|   14 | 马六   |   16 | abc  |
+------+--------+------+------+
affected rows: 4
select hit_count, is_batched_multi_stmt, statement, query_sql from oceanbase.GV$OB_PLAN_CACHE_PLAN_STAT where statement like 'insert into t10 % cross join %';
+-----------+-----------------------+------------------------------------------------------------------------------------------+------------------------------------------------------------------------------------------+
| hit_count | is_batched_multi_stmt | statement                                                                                | query_sql                                                                                |
+-----------+-----------------------+------------------------------------------------------------------------------------------+------------------------------------------------------------------------------------------+
|         3 |                     0 | insert into t10 select ?+?,t7.c2,?+?,t8.a2 from t7 cross join t8 where t7.c1 =? limit ?; | insert into t10 select 1+1,t7.c2,2+2,t8.a2 from t7 cross join t8 where t7.c1 =1 limit 1; |
+-----------+-----------------------+------------------------------------------------------------------------------------------+------------------------------------------------------------------------------------------+
affected rows: 1
delete from t10;
affected rows: 4
commit;
affected rows: 0

#insert into select ... natural join ...
alter system flush plan cache global;
affected rows: 0
insert into t10 select 2-1,t7.c2,3-1,t8.a2 from t7 natural join t8 where t7.c1 =1 limit 1;insert into t10 select 4-1,t7.c2,5-1,t8.a2 from t7 natural join t8 where t7.c1 =2 limit 1;//
affected rows: 1
affected rows: 1
insert into t10 select 6-1,t7.c2,8-1,t8.a2 from t7 natural join t8 where t7.c1 =3 limit 1;insert into t10 select 10-1,t7.c2,11-1,t8.a2 from t7 natural join t8 where t7.c1 =4 limit 1;//
affected rows: 1
affected rows: 1
commit;
affected rows: 0
select * from t10;
+------+--------+------+------+
| d1   | d2     | d3   | d4   |
+------+--------+------+------+
|    1 | 张三   |    2 | abc  |
|    3 | 李四   |    4 | abc  |
|    5 | 王五   |    7 | abc  |
|    9 | 马六   |   10 | abc  |
+------+--------+------+------+
affected rows: 4
select hit_count, is_batched_multi_stmt, statement, query_sql from oceanbase.GV$OB_PLAN_CACHE_PLAN_STAT where statement like 'insert into t10 select %,t7.c2,%,t8.a2 from t7 natural join t8 where t7.c1 =% limit 1' order by hit_count;
+-----------+-----------------------+-----------+-----------+
| hit_count | is_batched_multi_stmt | statement | query_sql |
+-----------+-----------------------+-----------+-----------+
+-----------+-----------------------+-----------+-----------+
affected rows: 0
delete from t10;
affected rows: 4
commit;
affected rows: 0

#自然连接
#insert into select ...where t7.c1 = t8.a1 ....
alter system flush plan cache global;
affected rows: 0
insert into t10 select 1/1,t7.c2,2/1,t8.a2 from t7,t8 where t7.c1 = t8.a1 and t7.c1 = 1;insert into t10 select 3/1,t7.c2,4/1,t8.a2 from t7,t8 where t7.c1 = t8.a1 and t7.c1 = 2;//
affected rows: 1
affected rows: 1
insert into t10 select 5/1,t7.c2,6/1,t8.a2 from t7,t8 where t7.c1 = t8.a1 and t7.c1 = 3;insert into t10 select 7/1,t7.c2,8/1,t8.a2 from t7,t8 where t7.c1 = t8.a1 and t7.c1 = 4;//
affected rows: 1
affected rows: 1
commit;
affected rows: 0
select * from t10;
+------+--------+------+------+
| d1   | d2     | d3   | d4   |
+------+--------+------+------+
|    1 | 张三   |    2 | abc  |
|    3 | 李四   |    4 | def  |
|    5 | 王五   |    6 | ghi  |
|    7 | 马六   |    8 | jkl  |
+------+--------+------+------+
affected rows: 4
select hit_count, is_batched_multi_stmt, statement, query_sql from oceanbase.GV$OB_PLAN_CACHE_PLAN_STAT where statement like 'insert into t10 select %,t7.c2,%,t8.a2 from t7,t8 where t7.c1 = t8.a1 and t7.c1 = %' order by hit_count;
+-----------+-----------------------+------------------------------------------------------------------------------------------+------------------------------------------------------------------------------------------+
| hit_count | is_batched_multi_stmt | statement                                                                                | query_sql                                                                                |
+-----------+-----------------------+------------------------------------------------------------------------------------------+------------------------------------------------------------------------------------------+
|         3 |                     0 | insert into t10 select ?/?,t7.c2,?/?,t8.a2 from t7,t8 where t7.c1 = t8.a1 and t7.c1 = ?; | insert into t10 select 1/1,t7.c2,2/1,t8.a2 from t7,t8 where t7.c1 = t8.a1 and t7.c1 = 1; |
+-----------+-----------------------+------------------------------------------------------------------------------------------+------------------------------------------------------------------------------------------+
affected rows: 1
delete from t10;
affected rows: 4
commit;
affected rows: 0

#内连接
#insert into select ... inner join ... (命中一次，执行batch优化)
insert into t10 select asin(t7.c1),t7.c2,asin(t8.a1),t8.a2 from t7 inner join t8 on t7.c1 =t8.a1 where t8.a1 = 1;insert into t10 select asin(t7.c1),t7.c2,asin(t8.a1),t8.a2 from t7 inner join t8 on t7.c1 =t8.a1 where t8.a1 = 2;//
affected rows: 1
affected rows: 1
insert into t10 select asin(t7.c1),t7.c2,asin(t8.a1),t8.a2 from t7 inner join t8 on t7.c1 =t8.a1 where t8.a1 = 3;insert into t10 select asin(t7.c1),t7.c2,asin(t8.a1),t8.a2 from t7 inner join t8 on t7.c1 =t8.a1 where t8.a1 = 4;//
affected rows: 1
affected rows: 1
commit;
affected rows: 0
select * from t10;
+------+--------+------+------+
| d1   | d2     | d3   | d4   |
+------+--------+------+------+
|    2 | 张三   |    2 | abc  |
| NULL | 李四   | NULL | def  |
| NULL | 王五   | NULL | ghi  |
| NULL | 马六   | NULL | jkl  |
+------+--------+------+------+
affected rows: 4
select hit_count, is_batched_multi_stmt, statement, query_sql from oceanbase.GV$OB_PLAN_CACHE_PLAN_STAT where statement like 'insert into t10 % inner join %' order by hit_count;
+-----------+-----------------------+-------------------------------------------------------------------------------------------------------------------+-------------------------------------------------------------------------------------------------------------------+
| hit_count | is_batched_multi_stmt | statement                                                                                                         | query_sql                                                                                                         |
+-----------+-----------------------+-------------------------------------------------------------------------------------------------------------------+-------------------------------------------------------------------------------------------------------------------+
|         3 |                     0 | insert into t10 select asin(t7.c1),t7.c2,asin(t8.a1),t8.a2 from t7 inner join t8 on t7.c1 =t8.a1 where t8.a1 = ?; | insert into t10 select asin(t7.c1),t7.c2,asin(t8.a1),t8.a2 from t7 inner join t8 on t7.c1 =t8.a1 where t8.a1 = 1; |
+-----------+-----------------------+-------------------------------------------------------------------------------------------------------------------+-------------------------------------------------------------------------------------------------------------------+
affected rows: 1
delete from t10;
affected rows: 4
commit;
affected rows: 0

#外连接
#insert into select ... left join ...
insert into t10 select cast(t7.c1 as unsigned)-2.0,t7.c2,cast(t8.a1 as unsigned)-2.0,t8.a2 from t7 left join t8 on t7.c1 =t8.a1 where t8.a1 = 1;insert into t10 select cast(t7.c1 as unsigned)-2.0,t7.c2,cast(t8.a1 as unsigned)-2.0,t8.a2 from t7 left join t8 on t7.c1 =t8.a1 where t8.a1 = 2;//
affected rows: 1
affected rows: 1
insert into t10 select cast(t7.c1 as unsigned)-2.0,t7.c2,cast(t8.a1 as unsigned)-2.0,t8.a2 from t7 left join t8 on t7.c1 =t8.a1 where t8.a1 = 3;insert into t10 select cast(t7.c1 as unsigned)-2.0,t7.c2,cast(t8.a1 as unsigned)-2.0,t8.a2 from t7 left join t8 on t7.c1 =t8.a1 where t8.a1 = 4;//
affected rows: 1
affected rows: 1
commit;
affected rows: 0
select * from t10;
+------+--------+------+------+
| d1   | d2     | d3   | d4   |
+------+--------+------+------+
|   -1 | 张三   |   -1 | abc  |
|    0 | 李四   |    0 | def  |
|    1 | 王五   |    1 | ghi  |
|    2 | 马六   |    2 | jkl  |
+------+--------+------+------+
affected rows: 4
select hit_count, is_batched_multi_stmt, statement, query_sql from oceanbase.GV$OB_PLAN_CACHE_PLAN_STAT where statement like 'insert into t10 % left join %' order by hit_count;
+-----------+-----------------------+----------------------------------------------------------------------------------------------------------------------------------------------+--------------------------------------------------------------------------------------------------------------------------------------------------+
| hit_count | is_batched_multi_stmt | statement                                                                                                                                    | query_sql                                                                                                                                        |
+-----------+-----------------------+----------------------------------------------------------------------------------------------------------------------------------------------+--------------------------------------------------------------------------------------------------------------------------------------------------+
|         3 |                     0 | insert into t10 select cast(t7.c1 as unsigned)-?,t7.c2,cast(t8.a1 as unsigned)-?,t8.a2 from t7 left join t8 on t7.c1 =t8.a1 where t8.a1 = ?; | insert into t10 select cast(t7.c1 as unsigned)-2.0,t7.c2,cast(t8.a1 as unsigned)-2.0,t8.a2 from t7 left join t8 on t7.c1 =t8.a1 where t8.a1 = 1; |
+-----------+-----------------------+----------------------------------------------------------------------------------------------------------------------------------------------+--------------------------------------------------------------------------------------------------------------------------------------------------+
affected rows: 1
delete from t10;
affected rows: 4
commit;
affected rows: 0

#insert into select ... right join ... (命中3次，没有执行batch优化)
insert into t10 select * from t7 right join t8 on t7.c1 =t8.a1 where t8.a1 = 1;insert into t10 select * from t7 right join t8 on t7.c1 =t8.a1 where t8.a1 = 2;//
affected rows: 1
affected rows: 1
insert into t10 select * from t7 right join t8 on t7.c1 =t8.a1 where t8.a1 = 3;insert into t10 select * from t7 right join t8 on t7.c1 =t8.a1 where t8.a1 = 4;//
affected rows: 1
affected rows: 1
commit;
affected rows: 0
select * from t10;
+------+--------+------+------+
| d1   | d2     | d3   | d4   |
+------+--------+------+------+
|    1 | 张三   |    1 | abc  |
|    2 | 李四   |    2 | def  |
|    3 | 王五   |    3 | ghi  |
|    4 | 马六   |    4 | jkl  |
+------+--------+------+------+
affected rows: 4
select hit_count, is_batched_multi_stmt, statement, query_sql from oceanbase.GV$OB_PLAN_CACHE_PLAN_STAT where statement like 'insert into t10 % right join %' order by hit_count;
+-----------+-----------------------+---------------------------------------------------------------------------------+---------------------------------------------------------------------------------+
| hit_count | is_batched_multi_stmt | statement                                                                       | query_sql                                                                       |
+-----------+-----------------------+---------------------------------------------------------------------------------+---------------------------------------------------------------------------------+
|         3 |                     0 | insert into t10 select * from t7 right join t8 on t7.c1 =t8.a1 where t8.a1 = ?; | insert into t10 select * from t7 right join t8 on t7.c1 =t8.a1 where t8.a1 = 1; |
+-----------+-----------------------+---------------------------------------------------------------------------------+---------------------------------------------------------------------------------+
affected rows: 1
delete from t10;
affected rows: 4
commit;
affected rows: 0
drop table t7,t8,t9,t10;
affected rows: 0

alter system set _rowsets_enabled=true;
affected rows: 0
set autocommit = true;
affected rows: 0
alter system set ob_enable_batched_multi_statement=false;
affected rows: 0

