drop database if exists db1;
create database db1;
use db1;
result_format: 4
alter system flush plan cache global;
affected rows: 0

alter system set _rowsets_enabled=false;
affected rows: 0

set autocommit = false;
affected rows: 0
alter system set ob_enable_batched_multi_statement=true;
affected rows: 0


#insert into v_t1 values(....)
#values值进行运算
create table t1(c1 int,c2 int);
affected rows: 0
create view v_t1 as select * from t1;
affected rows: 0
insert into v_t1 values(1-2,2-4);insert into v_t1 values(2-5,3-7);insert into v_t1 values(10-5,1-7);//
affected rows: 1
affected rows: 1
affected rows: 1
insert into v_t1 values(1*1,1*2);insert into v_t1 values(2*2,2*3);insert into v_t1 values(3*3,3*4);//
affected rows: 1
affected rows: 1
affected rows: 1
insert into v_t1 values(10/1,11/1);insert into v_t1 values(13/1,14/1);insert into v_t1 values(15/1,16/1);//
affected rows: 1
affected rows: 1
affected rows: 1
insert into v_t1 values(15%10,13%5);insert into v_t1 values(31%8,35%9);insert into v_t1 values(120%100,121%100);//
affected rows: 1
affected rows: 1
affected rows: 1
select * from v_t1;
+------+------+
| c1   | c2   |
+------+------+
|   -1 |   -2 |
|   -3 |   -4 |
|    5 |   -6 |
|    1 |    2 |
|    4 |    6 |
|    9 |   12 |
|   10 |   11 |
|   13 |   14 |
|   15 |   16 |
|    5 |    3 |
|    7 |    8 |
|   20 |   21 |
+------+------+
affected rows: 12
select hit_count, is_batched_multi_stmt, statement, query_sql from oceanbase.GV$OB_PLAN_CACHE_PLAN_STAT where statement like 'insert into v_t1 %' order by hit_count;
+-----------+-----------------------+----------------------------------+------------------------------------------------------------------------------------------------------------------+
| hit_count | is_batched_multi_stmt | statement                        | query_sql                                                                                                        |
+-----------+-----------------------+----------------------------------+------------------------------------------------------------------------------------------------------------------+
|         0 |                     1 | insert into v_t1 values(?-?,?-?) | insert into v_t1 values(1-2,2-4);insert into v_t1 values(2-5,3-7);insert into v_t1 values(10-5,1-7);             |
|         0 |                     1 | insert into v_t1 values(?*?,?*?) | insert into v_t1 values(1*1,1*2);insert into v_t1 values(2*2,2*3);insert into v_t1 values(3*3,3*4);              |
|         0 |                     1 | insert into v_t1 values(?/?,?/?) | insert into v_t1 values(10/1,11/1);insert into v_t1 values(13/1,14/1);insert into v_t1 values(15/1,16/1);        |
|         0 |                     1 | insert into v_t1 values(?%?,?%?) | insert into v_t1 values(15%10,13%5);insert into v_t1 values(31%8,35%9);insert into v_t1 values(120%100,121%100); |
+-----------+-----------------------+----------------------------------+------------------------------------------------------------------------------------------------------------------+
affected rows: 4
rollback;
affected rows: 0
drop view v_t1;
affected rows: 0
drop table t1;
affected rows: 0

#value值为字符串函数
create table t2(c1 varchar(60),c2 varchar(60));
affected rows: 0
create view v_t2 as select * from t2;
affected rows: 0
alter system flush plan cache global;
affected rows: 0
insert into v_t2 values(concat('aaa','bbb'),concat('ccc','ddd'));insert into v_t2 values(concat('eee','123'),concat('张三','ddd'));//
affected rows: 1
affected rows: 1
insert into v_t2 values(substr('abcdefg', 3, 2),substr('abcdefg' from -4 for 2));insert into v_t2 values(substr('abcdefg', 3, 2),substr('abcdefg' from -4 for 2));//
affected rows: 1
affected rows: 1
insert into v_t2 values(LENGTH('中国'),LENGTH('hello'));insert into v_t2 values(LENGTH('张'),LENGTH('world'));//
affected rows: 1
affected rows: 1
insert into v_t2 values(UPPER('obclient您好！'),UPPER('AAAcccddd周末！'));insert into v_t2 values(UPPER('asdaASD！'),UPPER('13asdg！'));//
affected rows: 1
affected rows: 1
insert into v_t2 values(lower('AAAA张三@@'),lower('CCaaBB==上'));insert into v_t2 values(lower('Abbb张三@@'),lower('yfhf'));//
affected rows: 1
affected rows: 1
select * from v_t2;
+-------------------+--------------------+
| c1                | c2                 |
+-------------------+--------------------+
| aaabbb            | cccddd             |
| eee123            | 张三ddd            |
| cd                | de                 |
| cd                | de                 |
| 6                 | 5                  |
| 3                 | 5                  |
| OBCLIENT您好！    | AAACCCDDD周末！    |
| ASDAASD！         | 13ASDG！           |
| aaaa张三@@        | ccaabb==上         |
| abbb张三@@        | yfhf               |
+-------------------+--------------------+
affected rows: 10
select hit_count, is_batched_multi_stmt, statement, query_sql from oceanbase.GV$OB_PLAN_CACHE_PLAN_STAT where statement like 'insert into v_t2 %' order by hit_count;
+-----------+-----------------------+------------------------------------------------------------------+--------------------------------------------------------------------------------------------------------------------------------------------------------------------+
| hit_count | is_batched_multi_stmt | statement                                                        | query_sql                                                                                                                                                          |
+-----------+-----------------------+------------------------------------------------------------------+--------------------------------------------------------------------------------------------------------------------------------------------------------------------+
|         0 |                     1 | insert into v_t2 values(concat(?,?),concat(?,?))                 | insert into v_t2 values(concat('aaa','bbb'),concat('ccc','ddd'));insert into v_t2 values(concat('eee','123'),concat('张三','ddd'));                                |
|         0 |                     1 | insert into v_t2 values(substr(?, 3, 2),substr(? from -4 for 2)) | insert into v_t2 values(substr('abcdefg', 3, 2),substr('abcdefg' from -4 for 2));insert into v_t2 values(substr('abcdefg', 3, 2),substr('abcdefg' from -4 for 2)); |
|         0 |                     1 | insert into v_t2 values(LENGTH(?),LENGTH(?))                     | insert into v_t2 values(LENGTH('中国'),LENGTH('hello'));insert into v_t2 values(LENGTH('张'),LENGTH('world'));                                                     |
|         0 |                     1 | insert into v_t2 values(UPPER(?),UPPER(?))                       | insert into v_t2 values(UPPER('obclient您好！'),UPPER('AAAcccddd周末！'));insert into v_t2 values(UPPER('asdaASD！'),UPPER('13asdg！'));                           |
|         0 |                     1 | insert into v_t2 values(lower(?),lower(?))                       | insert into v_t2 values(lower('AAAA张三@@'),lower('CCaaBB==上'));insert into v_t2 values(lower('Abbb张三@@'),lower('yfhf'));                                       |
+-----------+-----------------------+------------------------------------------------------------------+--------------------------------------------------------------------------------------------------------------------------------------------------------------------+
affected rows: 5
rollback;
affected rows: 0

#插入format函数,查内部表plan_cache 命中0次,没有进行batch优化
alter system flush plan cache global;
affected rows: 0
insert into v_t2 values(FORMAT(12332.123456, 4),FORMAT(12332.2, 0));insert into v_t2 values(FORMAT(456789.62456, 4),FORMAT(11653.2, 0));//
affected rows: 1
affected rows: 1
select * from v_t2;
+--------------+--------+
| c1           | c2     |
+--------------+--------+
| 12,332.1235  | 12,332 |
| 456,789.6246 | 11,653 |
+--------------+--------+
affected rows: 2
select hit_count, is_batched_multi_stmt, statement, query_sql from oceanbase.GV$OB_PLAN_CACHE_PLAN_STAT where statement like 'insert into v_t2 %' order by hit_count;
+-----------+-----------------------+-----------------------------------------------------+----------------------------------------------------------------------+
| hit_count | is_batched_multi_stmt | statement                                           | query_sql                                                            |
+-----------+-----------------------+-----------------------------------------------------+----------------------------------------------------------------------+
|         0 |                     0 | insert into v_t2 values(FORMAT(?, ?),FORMAT(?, ?)); | insert into v_t2 values(FORMAT(12332.123456, 4),FORMAT(12332.2, 0)); |
|         0 |                     0 | insert into v_t2 values(FORMAT(?, ?),FORMAT(?, ?)); | insert into v_t2 values(FORMAT(456789.62456, 4),FORMAT(11653.2, 0)); |
+-----------+-----------------------+-----------------------------------------------------+----------------------------------------------------------------------+
affected rows: 2
rollback;
affected rows: 0

drop view v_t2;
affected rows: 0
drop table t2;
affected rows: 0

#value值为时间函数
create table t3(c1 datetime,c2 timestamp);
affected rows: 0
create view v_t3 as select * from t3;
affected rows: 0
insert into v_t3 values(CONVERT_TZ('2021-10-18 15:01:49','+00:00','+10:00'),CONVERT_TZ('2021-10-18 15:01:49','+00:00','+10:00'));insert into v_t3 values(CONVERT_TZ('2022-10-18 15:01:49','+00:00','+10:00'),CONVERT_TZ('2023-10-18 15:01:49','+00:00','+10:00'));//
affected rows: 1
affected rows: 1
insert into v_t3 values(curdate(),curdate());insert into v_t3 values(curdate(),curdate());//
affected rows: 1
affected rows: 1
select hit_count, is_batched_multi_stmt, statement, query_sql from oceanbase.GV$OB_PLAN_CACHE_PLAN_STAT where statement like 'insert into v_t3 %' order by hit_count;
+-----------+-----------------------+--------------------------------------------------------------+--------------------------------------------------------------------------------------------------------------------------------------------------------------------------------------------------------------------------------------------------------------------+
| hit_count | is_batched_multi_stmt | statement                                                    | query_sql                                                                                                                                                                                                                                                          |
+-----------+-----------------------+--------------------------------------------------------------+--------------------------------------------------------------------------------------------------------------------------------------------------------------------------------------------------------------------------------------------------------------------+
|         0 |                     1 | insert into v_t3 values(CONVERT_TZ(?,?,?),CONVERT_TZ(?,?,?)) | insert into v_t3 values(CONVERT_TZ('2021-10-18 15:01:49','+00:00','+10:00'),CONVERT_TZ('2021-10-18 15:01:49','+00:00','+10:00'));insert into v_t3 values(CONVERT_TZ('2022-10-18 15:01:49','+00:00','+10:00'),CONVERT_TZ('2023-10-18 15:01:49','+00:00','+10:00')); |
|         0 |                     1 | insert into v_t3 values(curdate(),curdate())                 | insert into v_t3 values(curdate(),curdate());insert into v_t3 values(curdate(),curdate());                                                                                                                                                                         |
+-----------+-----------------------+--------------------------------------------------------------+--------------------------------------------------------------------------------------------------------------------------------------------------------------------------------------------------------------------------------------------------------------------+
affected rows: 2
rollback;
affected rows: 0
drop view v_t3;
affected rows: 0
drop table t3;
affected rows: 0

#value值为数学函数
create table t4(c1 double,c2 float);
affected rows: 0
create view v_t4 as select * from t4;
affected rows: 0
insert into v_t4 values(ACOS(-0.5),ACOS(0.5));insert into v_t4 values(ACOS(-0.5),ACOS(0.5));//
affected rows: 1
affected rows: 1
insert into v_t4 values(ATAN(-10),ATAN(10));insert into v_t4 values(ATAN(-10),ATAN(10));//
affected rows: 1
affected rows: 1
insert into v_t4 values(COT(-10),COT(10));insert into v_t4 values(COT(-10),COT(10));//
affected rows: 1
affected rows: 1
insert into v_t4 values(RADIANS(10),RADIANS(-0.5));insert into v_t4 values(RADIANS(10),RADIANS(-0.5));//
affected rows: 1
affected rows: 1
insert into v_t4 values(ceil(1=1),ceil(1>1));insert into v_t4 values(ceil(1=1),ceil(1>1));//
affected rows: 1
affected rows: 1
select * from v_t4;
+---------------------+-------------+
| c1                  | c2          |
+---------------------+-------------+
|  2.0943951023931957 |      1.0472 |
|  2.0943951023931957 |      1.0472 |
| -1.4711276743037347 |     1.47113 |
| -1.4711276743037347 |     1.47113 |
| -1.5423510453569202 |     1.54235 |
| -1.5423510453569202 |     1.54235 |
| 0.17453292519943295 | -0.00872665 |
| 0.17453292519943295 | -0.00872665 |
|                   1 |           0 |
|                   1 |           0 |
+---------------------+-------------+
affected rows: 10
select hit_count, is_batched_multi_stmt, statement, query_sql from oceanbase.GV$OB_PLAN_CACHE_PLAN_STAT where statement like 'insert into v_t4 %' order by hit_count;
+-----------+-----------------------+------------------------------------------------+--------------------------------------------------------------------------------------------------------+
| hit_count | is_batched_multi_stmt | statement                                      | query_sql                                                                                              |
+-----------+-----------------------+------------------------------------------------+--------------------------------------------------------------------------------------------------------+
|         0 |                     1 | insert into v_t4 values(ACOS(?),ACOS(?))       | insert into v_t4 values(ACOS(-0.5),ACOS(0.5));insert into v_t4 values(ACOS(-0.5),ACOS(0.5));           |
|         0 |                     1 | insert into v_t4 values(ATAN(?),ATAN(?))       | insert into v_t4 values(ATAN(-10),ATAN(10));insert into v_t4 values(ATAN(-10),ATAN(10));               |
|         0 |                     1 | insert into v_t4 values(COT(?),COT(?))         | insert into v_t4 values(COT(-10),COT(10));insert into v_t4 values(COT(-10),COT(10));                   |
|         0 |                     1 | insert into v_t4 values(RADIANS(?),RADIANS(?)) | insert into v_t4 values(RADIANS(10),RADIANS(-0.5));insert into v_t4 values(RADIANS(10),RADIANS(-0.5)); |
|         0 |                     1 | insert into v_t4 values(ceil(?=?),ceil(?>?))   | insert into v_t4 values(ceil(1=1),ceil(1>1));insert into v_t4 values(ceil(1=1),ceil(1>1));             |
+-----------+-----------------------+------------------------------------------------+--------------------------------------------------------------------------------------------------------+
affected rows: 5
rollback;
affected rows: 0

#插入radians函数，没有进行batch优化
alter system flush plan cache global;
affected rows: 0
insert into v_t4 values(round(2.15,2),round(-15.153,1));insert into v_t4 values(round(31.452,2),round(11.111,1));//
affected rows: 1
affected rows: 1
select hit_count, is_batched_multi_stmt, statement, query_sql from oceanbase.GV$OB_PLAN_CACHE_PLAN_STAT where statement like 'insert into v_t4 %' order by hit_count;
+-----------+-----------------------+-------------------------------------------------+-----------------------------------------------------------+
| hit_count | is_batched_multi_stmt | statement                                       | query_sql                                                 |
+-----------+-----------------------+-------------------------------------------------+-----------------------------------------------------------+
|         0 |                     0 | insert into v_t4 values(round(?,2),round(?,1)); | insert into v_t4 values(round(2.15,2),round(-15.153,1));  |
|         0 |                     0 | insert into v_t4 values(round(?,2),round(?,1)); | insert into v_t4 values(round(31.452,2),round(11.111,1)); |
+-----------+-----------------------+-------------------------------------------------+-----------------------------------------------------------+
affected rows: 2
select * from v_t4;
+-------+-------+
| c1    | c2    |
+-------+-------+
|  2.15 | -15.2 |
| 31.45 |  11.1 |
+-------+-------+
affected rows: 2
rollback;
affected rows: 0
drop view v_t4;
affected rows: 0
drop table t4;
affected rows: 0


#insert完整写法.
create table t6(c1 int not null primary key ,c2 int not null);
affected rows: 0
create view v_t6 as select * from t6;
affected rows: 0
insert into v_t6(c1,c2) values(1,1);insert into v_t6(c1,c2) values(2,2);insert into v_t6(c1,c2) values(3,3);//
affected rows: 1
affected rows: 1
affected rows: 1
select * from v_t6;
+----+----+
| c1 | c2 |
+----+----+
|  1 |  1 |
|  2 |  2 |
|  3 |  3 |
+----+----+
affected rows: 3
select hit_count, is_batched_multi_stmt, statement, query_sql from oceanbase.GV$OB_PLAN_CACHE_PLAN_STAT where statement like 'insert into v_t6(c1,c2) %' order by hit_count;
+-----------+-----------------------+-------------------------------------+--------------------------------------------------------------------------------------------------------------+
| hit_count | is_batched_multi_stmt | statement                           | query_sql                                                                                                    |
+-----------+-----------------------+-------------------------------------+--------------------------------------------------------------------------------------------------------------+
|         0 |                     1 | insert into v_t6(c1,c2) values(?,?) | insert into v_t6(c1,c2) values(1,1);insert into v_t6(c1,c2) values(2,2);insert into v_t6(c1,c2) values(3,3); |
+-----------+-----------------------+-------------------------------------+--------------------------------------------------------------------------------------------------------------+
affected rows: 1
rollback;
affected rows: 0

#insert完整写法value值进行运算符计算
alter system flush plan cache global;
affected rows: 0
insert into v_t6(c1,c2) values(1*1,1*2);insert into v_t6(c1,c2) values(2*2,2*3);insert into v_t6(c1,c2) values(3*3,3*4);//
affected rows: 1
affected rows: 1
affected rows: 1
insert into v_t6(c1,c2) values(10/1,11/1);insert into v_t6(c1,c2) values(13/1,14/1);insert into v_t6(c1,c2) values(15/1,16/1);//
affected rows: 1
affected rows: 1
affected rows: 1
insert into v_t6(c1,c2) values(15%10,13%5);insert into v_t6(c1,c2) values(31%8,35%9);insert into v_t6(c1,c2) values(120%100,121%100);//
affected rows: 1
affected rows: 1
affected rows: 1
select * from v_t6;
+----+----+
| c1 | c2 |
+----+----+
|  1 |  2 |
|  4 |  6 |
|  5 |  3 |
|  7 |  8 |
|  9 | 12 |
| 10 | 11 |
| 13 | 14 |
| 15 | 16 |
| 20 | 21 |
+----+----+
affected rows: 9
select hit_count, is_batched_multi_stmt, statement, query_sql from oceanbase.GV$OB_PLAN_CACHE_PLAN_STAT where statement like 'insert into v_t6(c1,c2) %' order by hit_count;
+-----------+-----------------------+-----------------------------------------+---------------------------------------------------------------------------------------------------------------------------------------+
| hit_count | is_batched_multi_stmt | statement                               | query_sql                                                                                                                             |
+-----------+-----------------------+-----------------------------------------+---------------------------------------------------------------------------------------------------------------------------------------+
|         0 |                     1 | insert into v_t6(c1,c2) values(?*?,?*?) | insert into v_t6(c1,c2) values(1*1,1*2);insert into v_t6(c1,c2) values(2*2,2*3);insert into v_t6(c1,c2) values(3*3,3*4);              |
|         0 |                     1 | insert into v_t6(c1,c2) values(?/?,?/?) | insert into v_t6(c1,c2) values(10/1,11/1);insert into v_t6(c1,c2) values(13/1,14/1);insert into v_t6(c1,c2) values(15/1,16/1);        |
|         0 |                     1 | insert into v_t6(c1,c2) values(?%?,?%?) | insert into v_t6(c1,c2) values(15%10,13%5);insert into v_t6(c1,c2) values(31%8,35%9);insert into v_t6(c1,c2) values(120%100,121%100); |
+-----------+-----------------------+-----------------------------------------+---------------------------------------------------------------------------------------------------------------------------------------+
affected rows: 3
rollback;
affected rows: 0

drop view v_t6;
affected rows: 0
drop table t6;
affected rows: 0


#insert 单列或多列
create table t7(c1 int  auto_increment,c2 int,c3 datetime default '2020-02-02');
affected rows: 0
create view v_t7 as select * from t7;
affected rows: 0
insert into v_t7(c1) values(1+1);insert into v_t7(c1) values(2+2);insert into v_t7(c1) values(3+3);//
affected rows: 1
affected rows: 1
affected rows: 1
insert into v_t7(c1) values(11*1);insert into v_t7(c1) values(12*2);insert into v_t7(c1) values(13*3);//
affected rows: 1
affected rows: 1
affected rows: 1
insert into v_t7(c1) values(111-1);insert into v_t7(c1) values(112-1);insert into v_t7(c1) values(113-1);//
affected rows: 1
affected rows: 1
affected rows: 1
insert into v_t7(c1) values(100/1);insert into v_t7(c1) values(100/2);insert into v_t7(c1) values(100/3);//
affected rows: 1
affected rows: 1
affected rows: 1
insert into v_t7(c1) values(99%20);insert into v_t7(c1) values(98%30);insert into v_t7(c1) values(97%40);//
affected rows: 1
affected rows: 1
affected rows: 1
select * from v_t7;
+-----+------+---------------------+
| c1  | c2   | c3                  |
+-----+------+---------------------+
|   2 | NULL | 2020-02-02 00:00:00 |
|   4 | NULL | 2020-02-02 00:00:00 |
|   6 | NULL | 2020-02-02 00:00:00 |
|  11 | NULL | 2020-02-02 00:00:00 |
|  24 | NULL | 2020-02-02 00:00:00 |
|  39 | NULL | 2020-02-02 00:00:00 |
| 110 | NULL | 2020-02-02 00:00:00 |
| 111 | NULL | 2020-02-02 00:00:00 |
| 112 | NULL | 2020-02-02 00:00:00 |
| 100 | NULL | 2020-02-02 00:00:00 |
|  50 | NULL | 2020-02-02 00:00:00 |
|  33 | NULL | 2020-02-02 00:00:00 |
|  19 | NULL | 2020-02-02 00:00:00 |
|   8 | NULL | 2020-02-02 00:00:00 |
|  17 | NULL | 2020-02-02 00:00:00 |
+-----+------+---------------------+
affected rows: 15
select hit_count, is_batched_multi_stmt, statement, query_sql from oceanbase.GV$OB_PLAN_CACHE_PLAN_STAT where statement like 'insert into v_t7(c1) %' order by hit_count;
+-----------+-----------------------+----------------------------------+-----------------------------------------------------------------------------------------------------------+
| hit_count | is_batched_multi_stmt | statement                        | query_sql                                                                                                 |
+-----------+-----------------------+----------------------------------+-----------------------------------------------------------------------------------------------------------+
|         0 |                     1 | insert into v_t7(c1) values(?+?) | insert into v_t7(c1) values(1+1);insert into v_t7(c1) values(2+2);insert into v_t7(c1) values(3+3);       |
|         0 |                     1 | insert into v_t7(c1) values(?*?) | insert into v_t7(c1) values(11*1);insert into v_t7(c1) values(12*2);insert into v_t7(c1) values(13*3);    |
|         0 |                     1 | insert into v_t7(c1) values(?-?) | insert into v_t7(c1) values(111-1);insert into v_t7(c1) values(112-1);insert into v_t7(c1) values(113-1); |
|         0 |                     1 | insert into v_t7(c1) values(?/?) | insert into v_t7(c1) values(100/1);insert into v_t7(c1) values(100/2);insert into v_t7(c1) values(100/3); |
|         0 |                     1 | insert into v_t7(c1) values(?%?) | insert into v_t7(c1) values(99%20);insert into v_t7(c1) values(98%30);insert into v_t7(c1) values(97%40); |
+-----------+-----------------------+----------------------------------+-----------------------------------------------------------------------------------------------------------+
affected rows: 5
rollback;
affected rows: 0

#insert 多列非全部列
alter system flush plan cache global;
affected rows: 0
insert into v_t7(c1,c2) values(1-2,2-4);insert into v_t7(c1,c2) values(2-5,3-7);insert into v_t7(c1,c2) values(10-5,1-7);//
affected rows: 1
affected rows: 1
affected rows: 1
insert into v_t7(c1,c2) values(1*7,1*2);insert into v_t7(c1,c2) values(2*2,2*3);insert into v_t7(c1,c2) values(3*3,3*4);//
affected rows: 1
affected rows: 1
affected rows: 1
insert into v_t7(c1,c2) values(10/1,11/1);insert into v_t7(c1,c2) values(13/1,14/1);insert into v_t7(c1,c2) values(15/1,16/1);//
affected rows: 1
affected rows: 1
affected rows: 1
insert into v_t7(c1,c2) values(15%10,13%5);insert into v_t7(c1,c2) values(31%8,35%9);insert into v_t7(c1,c2) values(120%100,121%100);//
affected rows: 1
affected rows: 1
affected rows: 1
select * from v_t7;
+----+------+---------------------+
| c1 | c2   | c3                  |
+----+------+---------------------+
| -1 |   -2 | 2020-02-02 00:00:00 |
| -3 |   -4 | 2020-02-02 00:00:00 |
|  5 |   -6 | 2020-02-02 00:00:00 |
|  7 |    2 | 2020-02-02 00:00:00 |
|  4 |    6 | 2020-02-02 00:00:00 |
|  9 |   12 | 2020-02-02 00:00:00 |
| 10 |   11 | 2020-02-02 00:00:00 |
| 13 |   14 | 2020-02-02 00:00:00 |
| 15 |   16 | 2020-02-02 00:00:00 |
|  5 |    3 | 2020-02-02 00:00:00 |
|  7 |    8 | 2020-02-02 00:00:00 |
| 20 |   21 | 2020-02-02 00:00:00 |
+----+------+---------------------+
affected rows: 12
select hit_count, is_batched_multi_stmt, statement, query_sql from oceanbase.GV$OB_PLAN_CACHE_PLAN_STAT where statement like 'insert into v_t7(c1,c2) %' order by hit_count;
+-----------+-----------------------+-----------------------------------------+---------------------------------------------------------------------------------------------------------------------------------------+
| hit_count | is_batched_multi_stmt | statement                               | query_sql                                                                                                                             |
+-----------+-----------------------+-----------------------------------------+---------------------------------------------------------------------------------------------------------------------------------------+
|         0 |                     1 | insert into v_t7(c1,c2) values(?-?,?-?) | insert into v_t7(c1,c2) values(1-2,2-4);insert into v_t7(c1,c2) values(2-5,3-7);insert into v_t7(c1,c2) values(10-5,1-7);             |
|         0 |                     1 | insert into v_t7(c1,c2) values(?*?,?*?) | insert into v_t7(c1,c2) values(1*7,1*2);insert into v_t7(c1,c2) values(2*2,2*3);insert into v_t7(c1,c2) values(3*3,3*4);              |
|         0 |                     1 | insert into v_t7(c1,c2) values(?/?,?/?) | insert into v_t7(c1,c2) values(10/1,11/1);insert into v_t7(c1,c2) values(13/1,14/1);insert into v_t7(c1,c2) values(15/1,16/1);        |
|         0 |                     1 | insert into v_t7(c1,c2) values(?%?,?%?) | insert into v_t7(c1,c2) values(15%10,13%5);insert into v_t7(c1,c2) values(31%8,35%9);insert into v_t7(c1,c2) values(120%100,121%100); |
+-----------+-----------------------+-----------------------------------------+---------------------------------------------------------------------------------------------------------------------------------------+
affected rows: 4
rollback;
affected rows: 0

drop table t7;
affected rows: 0
drop view v_t7;
affected rows: 0

#insert into  set.....   (各命中两次，没有进行batch优化)
create table t8(c1 int primary key,c2 varchar(60) not null);
affected rows: 0
create view v_t8 as select * from t8;
affected rows: 0
alter system flush plan cache global;
affected rows: 0
insert into v_t8 set c1 = 1,c2 = 'AA'; insert into v_t8 set c1 = 3,c2 = '张';insert into v_t8 set c1 = 5,c2 = '666';//
affected rows: 1
affected rows: 1
affected rows: 1
insert into v_t8 set c1 = 1*11,c2 = 'BB'; insert into v_t8 set c1 = 3*33,c2 = '王';insert into v_t8 set c1 = 5*55,c2 = '777';//
affected rows: 1
affected rows: 1
affected rows: 1
insert into v_t8 set c1 = 1+11,c2 = 'CC'; insert into v_t8 set c1 = 3+13,c2 = '李';insert into v_t8 set c1 = 5+16,c2 = '888';//
affected rows: 1
affected rows: 1
affected rows: 1
insert into v_t8 set c1 = 100/1,c2 = 'DD'; insert into v_t8 set c1 = 100/3,c2 = '赵';insert into v_t8 set c1 = 100/5,c2 = '2.12.21';//
affected rows: 1
affected rows: 1
affected rows: 1
commit;
affected rows: 0
select * from v_t8;
+-----+---------+
| c1  | c2      |
+-----+---------+
|   1 | AA      |
|   3 | 张      |
|   5 | 666     |
|  11 | BB      |
|  12 | CC      |
|  16 | 李      |
|  20 | 2.12.21 |
|  21 | 888     |
|  33 | 赵      |
|  99 | 王      |
| 100 | DD      |
| 275 | 777     |
+-----+---------+
affected rows: 12
select hit_count, is_batched_multi_stmt, statement, query_sql from oceanbase.GV$OB_PLAN_CACHE_PLAN_STAT where statement like 'insert into v_t8 set %' order by hit_count;
+-----------+-----------------------+--------------------------------------+---------------------------------------------------------------------------------------------------------------------------------------+
| hit_count | is_batched_multi_stmt | statement                            | query_sql                                                                                                                             |
+-----------+-----------------------+--------------------------------------+---------------------------------------------------------------------------------------------------------------------------------------+
|         0 |                     1 | insert into v_t8 set c1 = ?,c2 = ?   | insert into v_t8 set c1 = 1,c2 = 'AA'; insert into v_t8 set c1 = 3,c2 = '张';insert into v_t8 set c1 = 5,c2 = '666';                  |
|         0 |                     1 | insert into v_t8 set c1 = ?*?,c2 = ? | insert into v_t8 set c1 = 1*11,c2 = 'BB'; insert into v_t8 set c1 = 3*33,c2 = '王';insert into v_t8 set c1 = 5*55,c2 = '777';         |
|         0 |                     1 | insert into v_t8 set c1 = ?+?,c2 = ? | insert into v_t8 set c1 = 1+11,c2 = 'CC'; insert into v_t8 set c1 = 3+13,c2 = '李';insert into v_t8 set c1 = 5+16,c2 = '888';         |
|         0 |                     1 | insert into v_t8 set c1 = ?/?,c2 = ? | insert into v_t8 set c1 = 100/1,c2 = 'DD'; insert into v_t8 set c1 = 100/3,c2 = '赵';insert into v_t8 set c1 = 100/5,c2 = '2.12.21';  |
+-----------+-----------------------+--------------------------------------+---------------------------------------------------------------------------------------------------------------------------------------+
affected rows: 4
delete from v_t8;
affected rows: 12
commit;
affected rows: 0
drop table t8;
affected rows: 0
drop view v_t8;
affected rows: 0

#insert ignore into....
create table t9(a1 varchar(60) not null,c2 char(60) not null);
affected rows: 0
create view v_t9 as select * from t9;
affected rows: 0
alter system flush plan cache global;
affected rows: 0
insert ignore into v_t9 values('ABC','#%#%');insert ignore into v_t9 values('DDD','王五');insert ignore into v_t9 values('23FAD','/*-+52');//
affected rows: 1
affected rows: 1
affected rows: 1
commit;
affected rows: 0
select * from v_t9;
+-------+--------+
| a1    | c2     |
+-------+--------+
| ABC   | #%#%   |
| DDD   | 王五   |
| 23FAD | /*-+52 |
+-------+--------+
affected rows: 3
select hit_count, is_batched_multi_stmt, statement, query_sql from oceanbase.GV$OB_PLAN_CACHE_PLAN_STAT where statement like 'insert ignore into %' order by hit_count;
+-----------+-----------------------+-------------------------------------+-----------------------------------------------------------------------------------------------------------------------------------------------+
| hit_count | is_batched_multi_stmt | statement                           | query_sql                                                                                                                                     |
+-----------+-----------------------+-------------------------------------+-----------------------------------------------------------------------------------------------------------------------------------------------+
|         0 |                     1 | insert ignore into v_t9 values(?,?) | insert ignore into v_t9 values('ABC','#%#%');insert ignore into v_t9 values('DDD','王五');insert ignore into v_t9 values('23FAD','/*-+52');   |
+-----------+-----------------------+-------------------------------------+-----------------------------------------------------------------------------------------------------------------------------------------------+
affected rows: 1
delete from v_t9;
affected rows: 3
commit;
affected rows: 0

#命中一次，没有进行batch优化
create table t10(c1 int not null primary key,c2 int not null);
affected rows: 0
create view v_t10 as select * from t10;
affected rows: 0
alter system flush plan cache global;
affected rows: 0
insert ignore into v_t10 values(1-2,2-4);insert ignore into v_t10 values(2-5,3-7);insert into v_t10 values(10-5,1-7);//
affected rows: 1
affected rows: 1
affected rows: 1
insert ignore into v_t10 values(10*10,10*20);insert ignore into v_t10 values(10*10,10*20);insert into v_t10 values(30*3,30*4);//
affected rows: 1
affected rows: 0
affected rows: 1
insert ignore into v_t10 values(10/1,11/1);insert ignore into v_t10 values(13/1,14/1);insert ignore into v_t10 values(13/1,14/1);//
affected rows: 1
affected rows: 1
affected rows: 1
insert ignore into v_t10 values(15%10,13%5);insert ignore into v_t10 values(31%8,35%9);insert into v_t10 values(120%100,121%100);//
affected rows: 0
affected rows: 1
affected rows: 1
commit;
affected rows: 0
select * from v_t10;
+-----+-----+
| c1  | c2  |
+-----+-----+
|  -3 |  -4 |
|  -1 |  -2 |
|   5 |  -6 |
|   7 |   8 |
|  10 |  11 |
|  13 |  14 |
|  20 |  21 |
|  90 | 120 |
| 100 | 200 |
+-----+-----+
affected rows: 9
select hit_count, is_batched_multi_stmt, statement, query_sql from oceanbase.GV$OB_PLAN_CACHE_PLAN_STAT where statement like 'insert ignore into %' order by hit_count;
+-----------+-----------------------+-------------------------------------------+-----------------------------------------------------------------------------------------------------------------------------------+
| hit_count | is_batched_multi_stmt | statement                                 | query_sql                                                                                                                         |
+-----------+-----------------------+-------------------------------------------+-----------------------------------------------------------------------------------------------------------------------------------+
|         0 |                     1 | insert ignore into v_t10 values(?/?,?/?)  | insert ignore into v_t10 values(10/1,11/1);insert ignore into v_t10 values(13/1,14/1);insert ignore into v_t10 values(13/1,14/1); |
|         1 |                     0 | insert ignore into v_t10 values(?-?,?-?); | insert ignore into v_t10 values(1-2,2-4);                                                                                         |
|         1 |                     0 | insert ignore into v_t10 values(?*?,?*?); | insert ignore into v_t10 values(10*10,10*20);                                                                                     |
|         1 |                     0 | insert ignore into v_t10 values(?%?,?%?); | insert ignore into v_t10 values(15%10,13%5);                                                                                      |
+-----------+-----------------------+-------------------------------------------+-----------------------------------------------------------------------------------------------------------------------------------+
affected rows: 4
delete from v_t10;
affected rows: 9
commit;
affected rows: 0
drop table t10;
affected rows: 0
drop view v_t10;
affected rows: 0


#多个insert间 插入delete语句(没有进行batch 优化)
create table t11 (c1 int,c2 int);
affected rows: 0
create view v_t11 as select * from t11;
affected rows: 0
insert into v_t11 values(1,1),(2,2),(3,3),(4,4),(5,5);
affected rows: 5
info: Records: 5  Duplicates: 0  Warnings: 0
commit;
affected rows: 0
alter system flush plan cache global;
affected rows: 0
insert into v_t11 values(10,10);delete from v_t11 where c1 = 1;insert into v_t11 values(11,11);//
affected rows: 1
affected rows: 1
affected rows: 1
select hit_count, is_batched_multi_stmt, statement, query_sql from oceanbase.GV$OB_PLAN_CACHE_PLAN_STAT where statement like 'insert into v_t11 %' order by hit_count;
+-----------+-----------------------+--------------------------------+----------------------------------+
| hit_count | is_batched_multi_stmt | statement                      | query_sql                        |
+-----------+-----------------------+--------------------------------+----------------------------------+
|         1 |                     0 | insert into v_t11 values(?,?); | insert into v_t11 values(10,10); |
+-----------+-----------------------+--------------------------------+----------------------------------+
affected rows: 1
select * from v_t11;
+------+------+
| c1   | c2   |
+------+------+
|    2 |    2 |
|    3 |    3 |
|    4 |    4 |
|    5 |    5 |
|   10 |   10 |
|   11 |   11 |
+------+------+
affected rows: 6
rollback;
affected rows: 0

alter system flush plan cache global;
affected rows: 0
#多个insert间 插入update(没有进行batch优化)
insert into v_t11 values(10,10);update  v_t11 set c1 = 0 where c1 = 2;insert into v_t11 values(11,11);//
affected rows: 1
affected rows: 1
info:  Rows matched: 1  Changed: 1  Warnings: 0
affected rows: 1
select hit_count, is_batched_multi_stmt, statement, query_sql from oceanbase.GV$OB_PLAN_CACHE_PLAN_STAT where statement like 'insert into v_t11 %' order by hit_count;
+-----------+-----------------------+--------------------------------+----------------------------------+
| hit_count | is_batched_multi_stmt | statement                      | query_sql                        |
+-----------+-----------------------+--------------------------------+----------------------------------+
|         1 |                     0 | insert into v_t11 values(?,?); | insert into v_t11 values(10,10); |
+-----------+-----------------------+--------------------------------+----------------------------------+
affected rows: 1
commit;
affected rows: 0
select * from v_t11;
+------+------+
| c1   | c2   |
+------+------+
|    1 |    1 |
|    0 |    2 |
|    3 |    3 |
|    4 |    4 |
|    5 |    5 |
|   10 |   10 |
|   11 |   11 |
+------+------+
affected rows: 7
delete from v_t11;
affected rows: 7
commit;
affected rows: 0
drop view v_t11;
affected rows: 0
drop table t11;
affected rows: 0

alter system set _rowsets_enabled=true;
affected rows: 0
set autocommit = true;
affected rows: 0
alter system set ob_enable_batched_multi_statement=false;
affected rows: 0

