drop database if exists db1;
create database db1;
use db1;
result_format: 4
alter system flush plan cache global;
affected rows: 0

alter system set _rowsets_enabled=false;
affected rows: 0

set autocommit = false;
affected rows: 0
alter system set ob_enable_batched_multi_statement=true;
affected rows: 0

#insert into select ....(子查询)
drop view if exists v_t1,v_t2,v_t3,v_t4;
affected rows: 0
Warnings:
Note	1051	Unknown table 'db1.v_t1'
Note	1051	Unknown table 'db1.v_t2'
Note	1051	Unknown table 'db1.v_t3'
Note	1051	Unknown table 'db1.v_t4'
drop table if exists t1,t2,t3,t4;
affected rows: 0
Warnings:
Note	1051	Unknown table 'db1.t1'
Note	1051	Unknown table 'db1.t2'
Note	1051	Unknown table 'db1.t3'
Note	1051	Unknown table 'db1.t4'
create table t1(c1 int not null primary key ,c2 varchar(20) not null);
affected rows: 0
create view v_t1 as select * from t1;
affected rows: 0
insert into v_t1 values(0,'牛二'),(1,'张三'),(2,'李四'),(3,'王五'),(4,'马六'),(5,'田七'),(7,'腊八');
affected rows: 7
info: Records: 7  Duplicates: 0  Warnings: 0
commit;
affected rows: 0
create table t2(a1 int not null,a2 varchar(20));
affected rows: 0
create view v_t2 as select * from t2;
affected rows: 0
insert into v_t2 values(1,'abc'),(2,'def'),(3,'ghi'),(4,'jkl'),(5,null),(6,'mno');
affected rows: 6
info: Records: 6  Duplicates: 0  Warnings: 0
commit;
affected rows: 0
create table t3(b1 int,b2 varchar(20));
affected rows: 0
create table t4(d1 int,d2 varchar(20),d3 int,d4 varchar(20));
affected rows: 0
create view v_t3 as select * from t3;
affected rows: 0
create view v_t4 as select * from t4;
affected rows: 0


#insert + select + order by
insert into v_t3 select * from v_t1 where c1 = 1 order by c2;insert into v_t3 select * from v_t1 where c1 = 2 order by c2;insert into v_t3 select * from v_t1 where c1 = 3 order by c2;//
affected rows: 1
affected rows: 1
affected rows: 1
select * from v_t3;
+------+--------+
| b1   | b2     |
+------+--------+
|    1 | 张三   |
|    2 | 李四   |
|    3 | 王五   |
+------+--------+
affected rows: 3
select hit_count, is_batched_multi_stmt, statement, query_sql from oceanbase.GV$OB_PLAN_CACHE_PLAN_STAT where statement like 'insert into v_t3 select * from v_t1 where c1 = % order by c2' order by hit_count;
+-----------+-----------------------+-----------+-----------+
| hit_count | is_batched_multi_stmt | statement | query_sql |
+-----------+-----------------------+-----------+-----------+
+-----------+-----------------------+-----------+-----------+
affected rows: 0
rollback;
affected rows: 0

#insert + select + limit
insert into v_t3 select * from v_t1 where c1 = 1 limit 1;insert into v_t3 select * from v_t1 where c1 = 2 limit 1;insert into v_t3 select * from v_t1 where c1 = 3 limit 1;//
affected rows: 1
affected rows: 1
affected rows: 1
select * from v_t3;
+------+--------+
| b1   | b2     |
+------+--------+
|    1 | 张三   |
|    2 | 李四   |
|    3 | 王五   |
+------+--------+
affected rows: 3
select hit_count, is_batched_multi_stmt, statement, query_sql from oceanbase.GV$OB_PLAN_CACHE_PLAN_STAT where statement like 'insert into v_t3 select * from v_t1 where c1 = % order by c2' order by hit_count;
+-----------+-----------------------+-----------+-----------+
| hit_count | is_batched_multi_stmt | statement | query_sql |
+-----------+-----------------------+-----------+-----------+
+-----------+-----------------------+-----------+-----------+
affected rows: 0
rollback;
affected rows: 0


#in关键字  (plan cache命中两次,没有进行batch优化)
alter system flush plan cache global;
affected rows: 0
insert into v_t3 select c1,c2 from v_t1 where c1 in (select a1 from v_t2 where a1 = 1);insert into v_t3 select c1,c2 from v_t1 where c1 in (select a1 from v_t2 where a1 = 2);insert into v_t3 select c1,c2 from v_t1 where c1 in (select a1 from v_t2 where a1 = 3);//
affected rows: 1
affected rows: 1
affected rows: 1
select * from v_t3;
+------+--------+
| b1   | b2     |
+------+--------+
|    1 | 张三   |
|    2 | 李四   |
|    3 | 王五   |
+------+--------+
affected rows: 3
select hit_count, is_batched_multi_stmt, statement, query_sql from oceanbase.GV$OB_PLAN_CACHE_PLAN_STAT where statement like 'insert into v_t3 % where c1 in %' order by hit_count;
+-----------+-----------------------+-----------------------------------------------------------------------------------------+-----------------------------------------------------------------------------------------+
| hit_count | is_batched_multi_stmt | statement                                                                               | query_sql                                                                               |
+-----------+-----------------------+-----------------------------------------------------------------------------------------+-----------------------------------------------------------------------------------------+
|         2 |                     0 | insert into v_t3 select c1,c2 from v_t1 where c1 in (select a1 from v_t2 where a1 = ?); | insert into v_t3 select c1,c2 from v_t1 where c1 in (select a1 from v_t2 where a1 = ?); |
|         2 |                     0 | insert into v_t3 select c1,c2 from v_t1 where c1 in (select a1 from v_t2 where a1 = ?); | insert into v_t3 select c1,c2 from v_t1 where c1 in (select a1 from v_t2 where a1 = 1); |
+-----------+-----------------------+-----------------------------------------------------------------------------------------+-----------------------------------------------------------------------------------------+
affected rows: 2
rollback;
affected rows: 0

#not in关键字 (plan cache命中一次,没有进行batch优化)
insert into v_t3 select c1,c2 from v_t1 where c1 not in (select a1 from v_t2 where a1 = 1 order by a2);insert into v_t3 select c1,c2 from v_t1 where c1 not in (select a1 from v_t2 where a1 = 2 order by a2);insert into v_t3 select c1,c2 from v_t1 where c1 in (select a1 from v_t2 where a1 = 3 order by a2);//
affected rows: 6
info:  Records: 6  Duplicates: 0  Warnings: 0
affected rows: 6
info:  Records: 6  Duplicates: 0  Warnings: 0
affected rows: 1
select * from v_t3;
+------+--------+
| b1   | b2     |
+------+--------+
|    0 | 牛二   |
|    2 | 李四   |
|    3 | 王五   |
|    4 | 马六   |
|    5 | 田七   |
|    7 | 腊八   |
|    0 | 牛二   |
|    1 | 张三   |
|    3 | 王五   |
|    4 | 马六   |
|    5 | 田七   |
|    7 | 腊八   |
|    3 | 王五   |
+------+--------+
affected rows: 13
select hit_count, is_batched_multi_stmt, statement, query_sql from oceanbase.GV$OB_PLAN_CACHE_PLAN_STAT where statement like 'insert into v_t3 % where c1 not in %' order by hit_count;
+-----------+-----------------------+---------------------------------------------------------------------------------------------------------+---------------------------------------------------------------------------------------------------------+
| hit_count | is_batched_multi_stmt | statement                                                                                               | query_sql                                                                                               |
+-----------+-----------------------+---------------------------------------------------------------------------------------------------------+---------------------------------------------------------------------------------------------------------+
|         1 |                     0 | insert into v_t3 select c1,c2 from v_t1 where c1 not in (select a1 from v_t2 where a1 = ? order by a2); | insert into v_t3 select c1,c2 from v_t1 where c1 not in (select a1 from v_t2 where a1 = ? order by a2); |
|         1 |                     0 | insert into v_t3 select c1,c2 from v_t1 where c1 not in (select a1 from v_t2 where a1 = ? order by a2); | insert into v_t3 select c1,c2 from v_t1 where c1 not in (select a1 from v_t2 where a1 = 1 order by a2); |
+-----------+-----------------------+---------------------------------------------------------------------------------------------------------+---------------------------------------------------------------------------------------------------------+
affected rows: 2
rollback;
affected rows: 0


#any关键字 (plan cache命中两次,没有进行batch优化)
insert into v_t3 select c1,c2 from v_t1 where c1 = any (select a1 from v_t2 where a1 = 1);insert into v_t3 select c1,c2 from v_t1 where c1 = any (select a1 from v_t2 where a1 = 2);insert into v_t3 select c1,c2 from v_t1 where c1 = any (select a1 from v_t2 where a1 = 3);//
affected rows: 1
affected rows: 1
affected rows: 1
select * from v_t3;
+------+--------+
| b1   | b2     |
+------+--------+
|    1 | 张三   |
|    2 | 李四   |
|    3 | 王五   |
+------+--------+
affected rows: 3
select hit_count, is_batched_multi_stmt, statement, query_sql from oceanbase.GV$OB_PLAN_CACHE_PLAN_STAT where statement like 'insert into v_t3 % where c1 = any %' order by hit_count;
+-----------+-----------------------+--------------------------------------------------------------------------------------------+--------------------------------------------------------------------------------------------+
| hit_count | is_batched_multi_stmt | statement                                                                                  | query_sql                                                                                  |
+-----------+-----------------------+--------------------------------------------------------------------------------------------+--------------------------------------------------------------------------------------------+
|         2 |                     0 | insert into v_t3 select c1,c2 from v_t1 where c1 = any (select a1 from v_t2 where a1 = ?); | insert into v_t3 select c1,c2 from v_t1 where c1 = any (select a1 from v_t2 where a1 = ?); |
|         2 |                     0 | insert into v_t3 select c1,c2 from v_t1 where c1 = any (select a1 from v_t2 where a1 = ?); | insert into v_t3 select c1,c2 from v_t1 where c1 = any (select a1 from v_t2 where a1 = 1); |
+-----------+-----------------------+--------------------------------------------------------------------------------------------+--------------------------------------------------------------------------------------------+
affected rows: 2
rollback;
affected rows: 0


#all (plan cache命中两次,没有进行batch优化)
insert into v_t3 select c1,c2 from v_t1 where c1 = all (select a1 from v_t2 where a1 = 1) order by c2;insert into v_t3 select c1,c2 from v_t1 where c1 = all (select a1 from v_t2 where a1 = 2) order by c2;insert into v_t3 select c1,c2 from v_t1 where c1 = all (select a1 from v_t2 where a1 = 3) order by c2;//
affected rows: 1
affected rows: 1
affected rows: 1
select * from v_t3;
+------+--------+
| b1   | b2     |
+------+--------+
|    1 | 张三   |
|    2 | 李四   |
|    3 | 王五   |
+------+--------+
affected rows: 3
select hit_count, is_batched_multi_stmt, statement, query_sql from oceanbase.GV$OB_PLAN_CACHE_PLAN_STAT where statement like 'insert into v_t3 % where c1 = all %' order by hit_count;
+-----------+-----------------------+--------------------------------------------------------------------------------------------------------+--------------------------------------------------------------------------------------------------------+
| hit_count | is_batched_multi_stmt | statement                                                                                              | query_sql                                                                                              |
+-----------+-----------------------+--------------------------------------------------------------------------------------------------------+--------------------------------------------------------------------------------------------------------+
|         2 |                     0 | insert into v_t3 select c1,c2 from v_t1 where c1 = all (select a1 from v_t2 where a1 = ?) order by c2; | insert into v_t3 select c1,c2 from v_t1 where c1 = all (select a1 from v_t2 where a1 = ?) order by c2; |
|         2 |                     0 | insert into v_t3 select c1,c2 from v_t1 where c1 = all (select a1 from v_t2 where a1 = ?) order by c2; | insert into v_t3 select c1,c2 from v_t1 where c1 = all (select a1 from v_t2 where a1 = 1) order by c2; |
+-----------+-----------------------+--------------------------------------------------------------------------------------------------------+--------------------------------------------------------------------------------------------------------+
affected rows: 2
rollback;
affected rows: 0

#some  (命中1次，没有进行batch优化)
insert into v_t3 select c1,c2 from v_t1 where c1 = some (select min(a1) from v_t2);insert into v_t3 select c1,c2 from v_t1 where c1 = some(select max(a1)from v_t2);insert into v_t3 select c1,c2 from v_t1 where c1 = some (select min(a1) from v_t2);//
affected rows: 1
affected rows: 0
affected rows: 1
select * from v_t3;
+------+--------+
| b1   | b2     |
+------+--------+
|    1 | 张三   |
|    1 | 张三   |
+------+--------+
affected rows: 2
select hit_count, is_batched_multi_stmt, statement, query_sql from oceanbase.GV$OB_PLAN_CACHE_PLAN_STAT where statement like 'insert into v_t3 % where c1 = some %' order by hit_count;
+-----------+-----------------------+-------------------------------------------------------------------------------------+-------------------------------------------------------------------------------------+
| hit_count | is_batched_multi_stmt | statement                                                                           | query_sql                                                                           |
+-----------+-----------------------+-------------------------------------------------------------------------------------+-------------------------------------------------------------------------------------+
|         1 |                     0 | insert into v_t3 select c1,c2 from v_t1 where c1 = some (select min(a1) from v_t2); | insert into v_t3 select c1,c2 from v_t1 where c1 = some (select min(a1) from v_t2); |
|         1 |                     0 | insert into v_t3 select c1,c2 from v_t1 where c1 = some (select min(a1) from v_t2); | insert into v_t3 select c1,c2 from v_t1 where c1 = some (select min(a1) from v_t2); |
+-----------+-----------------------+-------------------------------------------------------------------------------------+-------------------------------------------------------------------------------------+
affected rows: 2
rollback;
affected rows: 0

#exists (命中0次，没有进行batch优化)
insert into v_t3 select c1,c2 from v_t1 where exists (select max(a1) from v_t2) limit 1;insert into v_t3 select c1,c2 from v_t1 where exists (select min(a1) from v_t2) limit 1;insert into v_t3 select c1,c2 from v_t1 where exists (select avg(a1) from v_t2) limit 1;//
affected rows: 1
affected rows: 1
affected rows: 1
select * from v_t3;
+------+--------+
| b1   | b2     |
+------+--------+
|    0 | 牛二   |
|    0 | 牛二   |
|    0 | 牛二   |
+------+--------+
affected rows: 3
select hit_count, is_batched_multi_stmt, statement, query_sql from oceanbase.GV$OB_PLAN_CACHE_PLAN_STAT where statement like 'insert into v_t3 % where exists %' order by hit_count;
+-----------+-----------------------+------------------------------------------------------------------------------------------+------------------------------------------------------------------------------------------+
| hit_count | is_batched_multi_stmt | statement                                                                                | query_sql                                                                                |
+-----------+-----------------------+------------------------------------------------------------------------------------------+------------------------------------------------------------------------------------------+
|         0 |                     0 | insert into v_t3 select c1,c2 from v_t1 where exists (select max(a1) from v_t2) limit ?; | insert into v_t3 select c1,c2 from v_t1 where exists (select max(a1) from v_t2) limit ?; |
|         0 |                     0 | insert into v_t3 select c1,c2 from v_t1 where exists (select max(a1) from v_t2) limit ?; | insert into v_t3 select c1,c2 from v_t1 where exists (select max(a1) from v_t2) limit 1; |
|         0 |                     0 | insert into v_t3 select c1,c2 from v_t1 where exists (select min(a1) from v_t2) limit ?; | insert into v_t3 select c1,c2 from v_t1 where exists (select min(a1) from v_t2) limit ?; |
|         0 |                     0 | insert into v_t3 select c1,c2 from v_t1 where exists (select min(a1) from v_t2) limit ?; | insert into v_t3 select c1,c2 from v_t1 where exists (select min(a1) from v_t2) limit 1; |
|         0 |                     0 | insert into v_t3 select c1,c2 from v_t1 where exists (select avg(a1) from v_t2) limit ?; | insert into v_t3 select c1,c2 from v_t1 where exists (select avg(a1) from v_t2) limit ?; |
|         0 |                     0 | insert into v_t3 select c1,c2 from v_t1 where exists (select avg(a1) from v_t2) limit ?; | insert into v_t3 select c1,c2 from v_t1 where exists (select avg(a1) from v_t2) limit 1; |
+-----------+-----------------------+------------------------------------------------------------------------------------------+------------------------------------------------------------------------------------------+
affected rows: 6
rollback;
affected rows: 0

#not exists
insert into v_t3 select c1,c2 from v_t1 where not exists (select max(a1) from v_t2) limit 1;insert into v_t3 select c1,c2 from v_t1 where not exists (select min(a1) from v_t2) limit 1;insert into v_t3 select c1,c2 from v_t1 where not exists (select avg(a1) from v_t2) limit 1;//
affected rows: 0
affected rows: 0
affected rows: 0
select * from v_t3;
+------+------+
| b1   | b2   |
+------+------+
+------+------+
affected rows: 0
select hit_count, is_batched_multi_stmt, statement, query_sql from oceanbase.GV$OB_PLAN_CACHE_PLAN_STAT where statement like 'insert into v_t3 % where not exists %' order by hit_count;
+-----------+-----------------------+----------------------------------------------------------------------------------------------+----------------------------------------------------------------------------------------------+
| hit_count | is_batched_multi_stmt | statement                                                                                    | query_sql                                                                                    |
+-----------+-----------------------+----------------------------------------------------------------------------------------------+----------------------------------------------------------------------------------------------+
|         0 |                     0 | insert into v_t3 select c1,c2 from v_t1 where not exists (select max(a1) from v_t2) limit ?; | insert into v_t3 select c1,c2 from v_t1 where not exists (select max(a1) from v_t2) limit ?; |
|         0 |                     0 | insert into v_t3 select c1,c2 from v_t1 where not exists (select max(a1) from v_t2) limit ?; | insert into v_t3 select c1,c2 from v_t1 where not exists (select max(a1) from v_t2) limit 1; |
|         0 |                     0 | insert into v_t3 select c1,c2 from v_t1 where not exists (select min(a1) from v_t2) limit ?; | insert into v_t3 select c1,c2 from v_t1 where not exists (select min(a1) from v_t2) limit ?; |
|         0 |                     0 | insert into v_t3 select c1,c2 from v_t1 where not exists (select min(a1) from v_t2) limit ?; | insert into v_t3 select c1,c2 from v_t1 where not exists (select min(a1) from v_t2) limit 1; |
|         0 |                     0 | insert into v_t3 select c1,c2 from v_t1 where not exists (select avg(a1) from v_t2) limit ?; | insert into v_t3 select c1,c2 from v_t1 where not exists (select avg(a1) from v_t2) limit ?; |
|         0 |                     0 | insert into v_t3 select c1,c2 from v_t1 where not exists (select avg(a1) from v_t2) limit ?; | insert into v_t3 select c1,c2 from v_t1 where not exists (select avg(a1) from v_t2) limit 1; |
+-----------+-----------------------+----------------------------------------------------------------------------------------------+----------------------------------------------------------------------------------------------+
affected rows: 6
rollback;
affected rows: 0


#insert into select join.....
#insert into 无条件连接 (命中一次，进行batch优化)与MYSQL结果不一致
alter system flush plan cache global;
affected rows: 0
insert into v_t4 select * from v_t1,v_t2 where v_t1.c1 = 1 limit 1;insert into v_t4 select * from v_t1,v_t2 where v_t1.c1 = 2 limit 1;//
affected rows: 1
affected rows: 1
insert into v_t4 select * from v_t1,v_t2 where v_t1.c1 = 3 limit 1;insert into v_t4 select * from v_t1,v_t2 where v_t1.c1 = 4 limit 1;//
affected rows: 1
affected rows: 1
select * from v_t4;
+------+--------+------+------+
| d1   | d2     | d3   | d4   |
+------+--------+------+------+
|    1 | 张三   |    1 | abc  |
|    2 | 李四   |    1 | abc  |
|    3 | 王五   |    1 | abc  |
|    4 | 马六   |    1 | abc  |
+------+--------+------+------+
affected rows: 4
select hit_count, is_batched_multi_stmt, statement, query_sql from oceanbase.GV$OB_PLAN_CACHE_PLAN_STAT where statement like 'insert into v_t4 % where v_t1.c1 = %' order by hit_count;
+-----------+-----------------------+---------------------------------------------------------------------+---------------------------------------------------------------------+
| hit_count | is_batched_multi_stmt | statement                                                           | query_sql                                                           |
+-----------+-----------------------+---------------------------------------------------------------------+---------------------------------------------------------------------+
|         3 |                     0 | insert into v_t4 select * from v_t1,v_t2 where v_t1.c1 = ? limit ?; | insert into v_t4 select * from v_t1,v_t2 where v_t1.c1 = ? limit ?; |
|         3 |                     0 | insert into v_t4 select * from v_t1,v_t2 where v_t1.c1 = ? limit ?; | insert into v_t4 select * from v_t1,v_t2 where v_t1.c1 = 1 limit 1; |
+-----------+-----------------------+---------------------------------------------------------------------+---------------------------------------------------------------------+
affected rows: 2
delete from v_t4;
affected rows: 4
commit;
affected rows: 0

#insert into select ... cross join ...(命中一次，进行batch优化)与MYSQL结果不一致
insert into v_t4 select 1+1,v_t1.c2,2+2,v_t2.a2 from v_t1 cross join v_t2 where v_t1.c1 =1 limit 1;insert into v_t4 select 3+3,v_t1.c2,4+4,v_t2.a2 from v_t1 cross join v_t2 where v_t1.c1 =2 limit 1;//
affected rows: 1
affected rows: 1
insert into v_t4 select 5+5,v_t1.c2,6+6,v_t2.a2 from v_t1 cross join v_t2 where v_t1.c1 =3 limit 1;insert into v_t4 select 7+7,v_t1.c2,8+8,v_t2.a2 from v_t1 cross join v_t2 where v_t1.c1 =4 limit 1;//
affected rows: 1
affected rows: 1
commit;
affected rows: 0
select * from v_t4;
+------+--------+------+------+
| d1   | d2     | d3   | d4   |
+------+--------+------+------+
|    2 | 张三   |    4 | abc  |
|    6 | 李四   |    8 | abc  |
|   10 | 王五   |   12 | abc  |
|   14 | 马六   |   16 | abc  |
+------+--------+------+------+
affected rows: 4
select hit_count, is_batched_multi_stmt, statement, query_sql from oceanbase.GV$OB_PLAN_CACHE_PLAN_STAT where statement like 'insert into v_t4 % cross join %' order by hit_count;
+-----------+-----------------------+-----------------------------------------------------------------------------------------------------+-----------------------------------------------------------------------------------------------------+
| hit_count | is_batched_multi_stmt | statement                                                                                           | query_sql                                                                                           |
+-----------+-----------------------+-----------------------------------------------------------------------------------------------------+-----------------------------------------------------------------------------------------------------+
|         3 |                     0 | insert into v_t4 select ?+?,v_t1.c2,?+?,v_t2.a2 from v_t1 cross join v_t2 where v_t1.c1 =? limit ?; | insert into v_t4 select 1+1,v_t1.c2,2+2,v_t2.a2 from v_t1 cross join v_t2 where v_t1.c1 =1 limit 1; |
|         3 |                     0 | insert into v_t4 select ?+?,v_t1.c2,?+?,v_t2.a2 from v_t1 cross join v_t2 where v_t1.c1 =? limit ?; | insert into v_t4 select 1+1,v_t1.c2,2+2,v_t2.a2 from v_t1 cross join v_t2 where v_t1.c1 =1 limit 1; |
+-----------+-----------------------+-----------------------------------------------------------------------------------------------------+-----------------------------------------------------------------------------------------------------+
affected rows: 2
delete from v_t4;
affected rows: 4
commit;
affected rows: 0

#insert into select ... natural join ...
alter system flush plan cache global;
affected rows: 0
insert into v_t4 select 2-1,v_t1.c2,3-1,v_t2.a2 from v_t1 natural join v_t2 where v_t1.c1 =1 limit 1;insert into v_t4 select 4-1,v_t1.c2,5-1,v_t2.a2 from v_t1 natural join v_t2 where v_t1.c1 =2 limit 1;//
affected rows: 1
affected rows: 1
insert into v_t4 select 6-1,v_t1.c2,8-1,v_t2.a2 from v_t1 natural join v_t2 where v_t1.c1 =3 limit 1;insert into v_t4 select 10-1,v_t1.c2,11-1,v_t2.a2 from v_t1 natural join v_t2 where v_t1.c1 =4 limit 1;//
affected rows: 1
affected rows: 1
commit;
affected rows: 0
select * from v_t4;
+------+--------+------+------+
| d1   | d2     | d3   | d4   |
+------+--------+------+------+
|    1 | 张三   |    2 | abc  |
|    3 | 李四   |    4 | abc  |
|    5 | 王五   |    7 | abc  |
|    9 | 马六   |   10 | abc  |
+------+--------+------+------+
affected rows: 4
select hit_count, is_batched_multi_stmt, statement, query_sql from oceanbase.GV$OB_PLAN_CACHE_PLAN_STAT where statement like 'insert into v_t4 select %,v_t1.c2,%,v_t2.a2 from v_t1 natural join v_t2 where v_t1.c1 =% limit 1' order by hit_count;
+-----------+-----------------------+-----------+-----------+
| hit_count | is_batched_multi_stmt | statement | query_sql |
+-----------+-----------------------+-----------+-----------+
+-----------+-----------------------+-----------+-----------+
affected rows: 0
delete from v_t4;
affected rows: 4
commit;
affected rows: 0

#自然连接
#insert into select ...where v_t1.c1 = v_t2.a1 ....
alter system flush plan cache global;
affected rows: 0
insert into v_t4 select 1/1,v_t1.c2,2/1,v_t2.a2 from v_t1,v_t2 where v_t1.c1 = v_t2.a1 and v_t1.c1 = 1;insert into v_t4 select 3/1,v_t1.c2,4/1,v_t2.a2 from v_t1,v_t2 where v_t1.c1 = v_t2.a1 and v_t1.c1 = 2;//
affected rows: 1
affected rows: 1
insert into v_t4 select 5/1,v_t1.c2,6/1,v_t2.a2 from v_t1,v_t2 where v_t1.c1 = v_t2.a1 and v_t1.c1 = 3;insert into v_t4 select 7/1,v_t1.c2,8/1,v_t2.a2 from v_t1,v_t2 where v_t1.c1 = v_t2.a1 and v_t1.c1 = 4;//
affected rows: 1
affected rows: 1
commit;
affected rows: 0
select * from v_t4;
+------+--------+------+------+
| d1   | d2     | d3   | d4   |
+------+--------+------+------+
|    1 | 张三   |    2 | abc  |
|    3 | 李四   |    4 | def  |
|    5 | 王五   |    6 | ghi  |
|    7 | 马六   |    8 | jkl  |
+------+--------+------+------+
affected rows: 4
select hit_count, is_batched_multi_stmt, statement, query_sql from oceanbase.GV$OB_PLAN_CACHE_PLAN_STAT where statement like 'insert into v_t4 select %,v_t1.c2,%,v_t2.a2 from v_t1,v_t2 where v_t1.c1 = v_t2.a1 and v_t1.c1 = %' order by hit_count;
+-----------+-----------------------+---------------------------------------------------------------------------------------------------------+---------------------------------------------------------------------------------------------------------+
| hit_count | is_batched_multi_stmt | statement                                                                                               | query_sql                                                                                               |
+-----------+-----------------------+---------------------------------------------------------------------------------------------------------+---------------------------------------------------------------------------------------------------------+
|         3 |                     0 | insert into v_t4 select ?/?,v_t1.c2,?/?,v_t2.a2 from v_t1,v_t2 where v_t1.c1 = v_t2.a1 and v_t1.c1 = ?; | insert into v_t4 select 1/1,v_t1.c2,2/1,v_t2.a2 from v_t1,v_t2 where v_t1.c1 = v_t2.a1 and v_t1.c1 = 1; |
|         3 |                     0 | insert into v_t4 select ?/?,v_t1.c2,?/?,v_t2.a2 from v_t1,v_t2 where v_t1.c1 = v_t2.a1 and v_t1.c1 = ?; | insert into v_t4 select 1/1,v_t1.c2,2/1,v_t2.a2 from v_t1,v_t2 where v_t1.c1 = v_t2.a1 and v_t1.c1 = 1; |
+-----------+-----------------------+---------------------------------------------------------------------------------------------------------+---------------------------------------------------------------------------------------------------------+
affected rows: 2
delete from v_t4;
affected rows: 4
commit;
affected rows: 0

#内连接
#insert into select ... inner join ... (命中一次，执行batch优化)
insert into v_t4 select asin(v_t1.c1),v_t1.c2,asin(v_t2.a1),v_t2.a2 from v_t1 inner join v_t2 on v_t1.c1 =v_t2.a1 where v_t2.a1 = 1;insert into v_t4 select asin(v_t1.c1),v_t1.c2,asin(v_t2.a1),v_t2.a2 from v_t1 inner join v_t2 on v_t1.c1 =v_t2.a1 where v_t2.a1 = 2;//
affected rows: 1
affected rows: 1
insert into v_t4 select asin(v_t1.c1),v_t1.c2,asin(v_t2.a1),v_t2.a2 from v_t1 inner join v_t2 on v_t1.c1 =v_t2.a1 where v_t2.a1 = 3;insert into v_t4 select asin(v_t1.c1),v_t1.c2,asin(v_t2.a1),v_t2.a2 from v_t1 inner join v_t2 on v_t1.c1 =v_t2.a1 where v_t2.a1 = 4;//
affected rows: 1
affected rows: 1
commit;
affected rows: 0
select * from v_t4;
+------+--------+------+------+
| d1   | d2     | d3   | d4   |
+------+--------+------+------+
|    2 | 张三   |    2 | abc  |
| NULL | 李四   | NULL | def  |
| NULL | 王五   | NULL | ghi  |
| NULL | 马六   | NULL | jkl  |
+------+--------+------+------+
affected rows: 4
select hit_count, is_batched_multi_stmt, statement, query_sql from oceanbase.GV$OB_PLAN_CACHE_PLAN_STAT where statement like 'insert into v_t4 % inner join %' order by hit_count;
+-----------+-----------------------+--------------------------------------------------------------------------------------------------------------------------------------+--------------------------------------------------------------------------------------------------------------------------------------+
| hit_count | is_batched_multi_stmt | statement                                                                                                                            | query_sql                                                                                                                            |
+-----------+-----------------------+--------------------------------------------------------------------------------------------------------------------------------------+--------------------------------------------------------------------------------------------------------------------------------------+
|         3 |                     0 | insert into v_t4 select asin(v_t1.c1),v_t1.c2,asin(v_t2.a1),v_t2.a2 from v_t1 inner join v_t2 on v_t1.c1 =v_t2.a1 where v_t2.a1 = ?; | insert into v_t4 select asin(v_t1.c1),v_t1.c2,asin(v_t2.a1),v_t2.a2 from v_t1 inner join v_t2 on v_t1.c1 =v_t2.a1 where v_t2.a1 = ?; |
|         3 |                     0 | insert into v_t4 select asin(v_t1.c1),v_t1.c2,asin(v_t2.a1),v_t2.a2 from v_t1 inner join v_t2 on v_t1.c1 =v_t2.a1 where v_t2.a1 = ?; | insert into v_t4 select asin(v_t1.c1),v_t1.c2,asin(v_t2.a1),v_t2.a2 from v_t1 inner join v_t2 on v_t1.c1 =v_t2.a1 where v_t2.a1 = 1; |
+-----------+-----------------------+--------------------------------------------------------------------------------------------------------------------------------------+--------------------------------------------------------------------------------------------------------------------------------------+
affected rows: 2
delete from v_t4;
affected rows: 4
commit;
affected rows: 0

#外连接
#insert into select ... left join ...
insert into v_t4 select cast(v_t1.c1 as unsigned)-2.0,v_t1.c2,cast(v_t2.a1 as unsigned)-2.0,v_t2.a2 from v_t1 left join v_t2 on v_t1.c1 =v_t2.a1 where v_t2.a1 = 1;insert into v_t4 select cast(v_t1.c1 as unsigned)-2.0,v_t1.c2,cast(v_t2.a1 as unsigned)-2.0,v_t2.a2 from v_t1 left join v_t2 on v_t1.c1 =v_t2.a1 where v_t2.a1 = 2;//
affected rows: 1
affected rows: 1
insert into v_t4 select cast(v_t1.c1 as unsigned)-2.0,v_t1.c2,cast(v_t2.a1 as unsigned)-2.0,v_t2.a2 from v_t1 left join v_t2 on v_t1.c1 =v_t2.a1 where v_t2.a1 = 3;insert into v_t4 select cast(v_t1.c1 as unsigned)-2.0,v_t1.c2,cast(v_t2.a1 as unsigned)-2.0,v_t2.a2 from v_t1 left join v_t2 on v_t1.c1 =v_t2.a1 where v_t2.a1 = 4;//
affected rows: 1
affected rows: 1
commit;
affected rows: 0
select * from v_t4;
+------+--------+------+------+
| d1   | d2     | d3   | d4   |
+------+--------+------+------+
|   -1 | 张三   |   -1 | abc  |
|    0 | 李四   |    0 | def  |
|    1 | 王五   |    1 | ghi  |
|    2 | 马六   |    2 | jkl  |
+------+--------+------+------+
affected rows: 4
select hit_count, is_batched_multi_stmt, statement, query_sql from oceanbase.GV$OB_PLAN_CACHE_PLAN_STAT where statement like 'insert into v_t4 % left join %' order by hit_count;
+-----------+-----------------------+-----------------------------------------------------------------------------------------------------------------------------------------------------------------+---------------------------------------------------------------------------------------------------------------------------------------------------------------------+
| hit_count | is_batched_multi_stmt | statement                                                                                                                                                       | query_sql                                                                                                                                                           |
+-----------+-----------------------+-----------------------------------------------------------------------------------------------------------------------------------------------------------------+---------------------------------------------------------------------------------------------------------------------------------------------------------------------+
|         3 |                     0 | insert into v_t4 select cast(v_t1.c1 as unsigned)-?,v_t1.c2,cast(v_t2.a1 as unsigned)-?,v_t2.a2 from v_t1 left join v_t2 on v_t1.c1 =v_t2.a1 where v_t2.a1 = ?; | insert into v_t4 select cast(v_t1.c1 as unsigned)-2.0,v_t1.c2,cast(v_t2.a1 as unsigned)-2.0,v_t2.a2 from v_t1 left join v_t2 on v_t1.c1 =v_t2.a1 where v_t2.a1 = 1; |
|         3 |                     0 | insert into v_t4 select cast(v_t1.c1 as unsigned)-?,v_t1.c2,cast(v_t2.a1 as unsigned)-?,v_t2.a2 from v_t1 left join v_t2 on v_t1.c1 =v_t2.a1 where v_t2.a1 = ?; | insert into v_t4 select cast(v_t1.c1 as unsigned)-2.0,v_t1.c2,cast(v_t2.a1 as unsigned)-2.0,v_t2.a2 from v_t1 left join v_t2 on v_t1.c1 =v_t2.a1 where v_t2.a1 = 1; |
+-----------+-----------------------+-----------------------------------------------------------------------------------------------------------------------------------------------------------------+---------------------------------------------------------------------------------------------------------------------------------------------------------------------+
affected rows: 2
delete from v_t4;
affected rows: 4
commit;
affected rows: 0

#insert into select ... right join ... (命中3次，没有执行batch优化)
insert into v_t4 select * from v_t1 right join v_t2 on v_t1.c1 =v_t2.a1 where v_t2.a1 = 1;insert into v_t4 select * from v_t1 right join v_t2 on v_t1.c1 =v_t2.a1 where v_t2.a1 = 2;//
affected rows: 1
affected rows: 1
insert into v_t4 select * from v_t1 right join v_t2 on v_t1.c1 =v_t2.a1 where v_t2.a1 = 3;insert into v_t4 select * from v_t1 right join v_t2 on v_t1.c1 =v_t2.a1 where v_t2.a1 = 4;//
affected rows: 1
affected rows: 1
commit;
affected rows: 0
select * from v_t4;
+------+--------+------+------+
| d1   | d2     | d3   | d4   |
+------+--------+------+------+
|    1 | 张三   |    1 | abc  |
|    2 | 李四   |    2 | def  |
|    3 | 王五   |    3 | ghi  |
|    4 | 马六   |    4 | jkl  |
+------+--------+------+------+
affected rows: 4
select hit_count, is_batched_multi_stmt, statement, query_sql from oceanbase.GV$OB_PLAN_CACHE_PLAN_STAT where statement like 'insert into v_t4 % right join %' order by hit_count;
+-----------+-----------------------+--------------------------------------------------------------------------------------------+--------------------------------------------------------------------------------------------+
| hit_count | is_batched_multi_stmt | statement                                                                                  | query_sql                                                                                  |
+-----------+-----------------------+--------------------------------------------------------------------------------------------+--------------------------------------------------------------------------------------------+
|         3 |                     0 | insert into v_t4 select * from v_t1 right join v_t2 on v_t1.c1 =v_t2.a1 where v_t2.a1 = ?; | insert into v_t4 select * from v_t1 right join v_t2 on v_t1.c1 =v_t2.a1 where v_t2.a1 = ?; |
|         3 |                     0 | insert into v_t4 select * from v_t1 right join v_t2 on v_t1.c1 =v_t2.a1 where v_t2.a1 = ?; | insert into v_t4 select * from v_t1 right join v_t2 on v_t1.c1 =v_t2.a1 where v_t2.a1 = 1; |
+-----------+-----------------------+--------------------------------------------------------------------------------------------+--------------------------------------------------------------------------------------------+
affected rows: 2
delete from v_t4;
affected rows: 4
commit;
affected rows: 0
drop view v_t1,v_t2,v_t3,v_t4;
affected rows: 0
drop table t1,t2,t3,t4;
affected rows: 0

alter system set _rowsets_enabled=true;
affected rows: 0
set autocommit = true;
affected rows: 0
alter system set ob_enable_batched_multi_statement=false;
affected rows: 0

