drop database if exists db1;
create database db1;
use db1;
result_format: 4
alter system flush plan cache global;
affected rows: 0

alter system set _rowsets_enabled=false;
affected rows: 0

set autocommit = false;
affected rows: 0
alter system set ob_enable_batched_multi_statement=true;
affected rows: 0

#insert into select ....(子查询)
drop table if exists tt1,tt2,tt3,tt4;
affected rows: 0
Warnings:
Note	1051	Unknown table 'db1.tt1'
Note	1051	Unknown table 'db1.tt2'
Note	1051	Unknown table 'db1.tt3'
Note	1051	Unknown table 'db1.tt4'
create table t1(c1 int not null primary key ,c2 varchar(20) not null);
affected rows: 0
insert into t1 values(0,'牛二'),(1,'张三'),(2,'李四'),(3,'王五'),(4,'马六'),(5,'田七'),(7,'腊八');
affected rows: 7
info: Records: 7  Duplicates: 0  Warnings: 0
commit;
affected rows: 0
create table t2(a1 int not null,a2 varchar(20));
affected rows: 0
insert into t2 values(1,'abc'),(2,'def'),(3,'ghi'),(4,'jkl'),(5,null),(6,'mno');
affected rows: 6
info: Records: 6  Duplicates: 0  Warnings: 0
commit;
affected rows: 0
create table t3(b1 int,b2 varchar(20));
affected rows: 0
create table t4(d1 int,d2 varchar(20),d3 int,d4 varchar(20));
affected rows: 0
create table tt1 as select * from t1;
affected rows: 7
create table tt2 as select * from t2;
affected rows: 6
create table tt3 as select * from t3;
affected rows: 0
create table tt4 as select * from t4;
affected rows: 0

#insert + select + order by
insert into tt3 select * from tt1 where c1 = 1 order by c2;insert into tt3 select * from tt1 where c1 = 2 order by c2;insert into tt3 select * from tt1 where c1 = 3 order by c2;//
affected rows: 1
affected rows: 1
affected rows: 1
select * from tt3;
+------+--------+
| b1   | b2     |
+------+--------+
|    1 | 张三   |
|    2 | 李四   |
|    3 | 王五   |
+------+--------+
affected rows: 3
select hit_count, is_batched_multi_stmt, statement, query_sql from oceanbase.GV$OB_PLAN_CACHE_PLAN_STAT where statement like 'insert into tt3 select * from tt1 where c1 = % order by c2' order by hit_count;
+-----------+-----------------------+-----------+-----------+
| hit_count | is_batched_multi_stmt | statement | query_sql |
+-----------+-----------------------+-----------+-----------+
+-----------+-----------------------+-----------+-----------+
affected rows: 0
rollback;
affected rows: 0

#insert + select + limit
insert into tt3 select * from tt1 where c1 = 1 limit 1;insert into tt3 select * from tt1 where c1 = 2 limit 1;insert into tt3 select * from tt1 where c1 = 3 limit 1;//
affected rows: 1
affected rows: 1
affected rows: 1
select * from tt3;
+------+--------+
| b1   | b2     |
+------+--------+
|    1 | 张三   |
|    2 | 李四   |
|    3 | 王五   |
+------+--------+
affected rows: 3
select hit_count, is_batched_multi_stmt, statement, query_sql from oceanbase.GV$OB_PLAN_CACHE_PLAN_STAT where statement like 'insert into tt3 select * from tt1 where c1 = % order by c2' order by hit_count;
+-----------+-----------------------+-----------+-----------+
| hit_count | is_batched_multi_stmt | statement | query_sql |
+-----------+-----------------------+-----------+-----------+
+-----------+-----------------------+-----------+-----------+
affected rows: 0
rollback;
affected rows: 0


#in关键字  (plan cache命中两次,没有进行batch优化)
alter system flush plan cache global;
affected rows: 0
insert into tt3 select c1,c2 from tt1 where c1 in (select a1 from tt2 where a1 = 1);insert into tt3 select c1,c2 from tt1 where c1 in (select a1 from tt2 where a1 = 2);insert into tt3 select c1,c2 from tt1 where c1 in (select a1 from tt2 where a1 = 3);//
affected rows: 1
affected rows: 1
affected rows: 1
select * from tt3;
+------+--------+
| b1   | b2     |
+------+--------+
|    1 | 张三   |
|    2 | 李四   |
|    3 | 王五   |
+------+--------+
affected rows: 3
select hit_count, is_batched_multi_stmt, statement, query_sql from oceanbase.GV$OB_PLAN_CACHE_PLAN_STAT where statement like 'insert into tt3 % where c1 in %' order by hit_count;
+-----------+-----------------------+--------------------------------------------------------------------------------------+--------------------------------------------------------------------------------------+
| hit_count | is_batched_multi_stmt | statement                                                                            | query_sql                                                                            |
+-----------+-----------------------+--------------------------------------------------------------------------------------+--------------------------------------------------------------------------------------+
|         2 |                     0 | insert into tt3 select c1,c2 from tt1 where c1 in (select a1 from tt2 where a1 = ?); | insert into tt3 select c1,c2 from tt1 where c1 in (select a1 from tt2 where a1 = ?); |
|         2 |                     0 | insert into tt3 select c1,c2 from tt1 where c1 in (select a1 from tt2 where a1 = ?); | insert into tt3 select c1,c2 from tt1 where c1 in (select a1 from tt2 where a1 = 1); |
+-----------+-----------------------+--------------------------------------------------------------------------------------+--------------------------------------------------------------------------------------+
affected rows: 2
rollback;
affected rows: 0

#not in关键字 (plan cache命中一次,没有进行batch优化)
insert into tt3 select c1,c2 from tt1 where c1 not in (select a1 from tt2 where a1 = 1 order by a2);insert into tt3 select c1,c2 from tt1 where c1 not in (select a1 from tt2 where a1 = 2 order by a2);insert into tt3 select c1,c2 from tt1 where c1 in (select a1 from tt2 where a1 = 3 order by a2);//
affected rows: 6
info:  Records: 6  Duplicates: 0  Warnings: 0
affected rows: 6
info:  Records: 6  Duplicates: 0  Warnings: 0
affected rows: 1
select * from tt3;
+------+--------+
| b1   | b2     |
+------+--------+
|    0 | 牛二   |
|    2 | 李四   |
|    3 | 王五   |
|    4 | 马六   |
|    5 | 田七   |
|    7 | 腊八   |
|    0 | 牛二   |
|    1 | 张三   |
|    3 | 王五   |
|    4 | 马六   |
|    5 | 田七   |
|    7 | 腊八   |
|    3 | 王五   |
+------+--------+
affected rows: 13
select hit_count, is_batched_multi_stmt, statement, query_sql from oceanbase.GV$OB_PLAN_CACHE_PLAN_STAT where statement like 'insert into tt3 % where c1 not in %' order by hit_count;
+-----------+-----------------------+------------------------------------------------------------------------------------------------------+------------------------------------------------------------------------------------------------------+
| hit_count | is_batched_multi_stmt | statement                                                                                            | query_sql                                                                                            |
+-----------+-----------------------+------------------------------------------------------------------------------------------------------+------------------------------------------------------------------------------------------------------+
|         1 |                     0 | insert into tt3 select c1,c2 from tt1 where c1 not in (select a1 from tt2 where a1 = ? order by a2); | insert into tt3 select c1,c2 from tt1 where c1 not in (select a1 from tt2 where a1 = ? order by a2); |
|         1 |                     0 | insert into tt3 select c1,c2 from tt1 where c1 not in (select a1 from tt2 where a1 = ? order by a2); | insert into tt3 select c1,c2 from tt1 where c1 not in (select a1 from tt2 where a1 = 1 order by a2); |
+-----------+-----------------------+------------------------------------------------------------------------------------------------------+------------------------------------------------------------------------------------------------------+
affected rows: 2
rollback;
affected rows: 0


#any关键字 (plan cache命中两次,没有进行batch优化)
insert into tt3 select c1,c2 from tt1 where c1 = any (select a1 from tt2 where a1 = 1);insert into tt3 select c1,c2 from tt1 where c1 = any (select a1 from tt2 where a1 = 2);insert into tt3 select c1,c2 from tt1 where c1 = any (select a1 from tt2 where a1 = 3);//
affected rows: 1
affected rows: 1
affected rows: 1
select * from tt3;
+------+--------+
| b1   | b2     |
+------+--------+
|    1 | 张三   |
|    2 | 李四   |
|    3 | 王五   |
+------+--------+
affected rows: 3
select hit_count, is_batched_multi_stmt, statement, query_sql from oceanbase.GV$OB_PLAN_CACHE_PLAN_STAT where statement like 'insert into tt3 % where c1 = any %' order by hit_count;
+-----------+-----------------------+-----------------------------------------------------------------------------------------+-----------------------------------------------------------------------------------------+
| hit_count | is_batched_multi_stmt | statement                                                                               | query_sql                                                                               |
+-----------+-----------------------+-----------------------------------------------------------------------------------------+-----------------------------------------------------------------------------------------+
|         2 |                     0 | insert into tt3 select c1,c2 from tt1 where c1 = any (select a1 from tt2 where a1 = ?); | insert into tt3 select c1,c2 from tt1 where c1 = any (select a1 from tt2 where a1 = ?); |
|         2 |                     0 | insert into tt3 select c1,c2 from tt1 where c1 = any (select a1 from tt2 where a1 = ?); | insert into tt3 select c1,c2 from tt1 where c1 = any (select a1 from tt2 where a1 = 1); |
+-----------+-----------------------+-----------------------------------------------------------------------------------------+-----------------------------------------------------------------------------------------+
affected rows: 2
rollback;
affected rows: 0


#all (plan cache命中两次,没有进行batch优化)
insert into tt3 select c1,c2 from tt1 where c1 = all (select a1 from tt2 where a1 = 1) order by c2;insert into tt3 select c1,c2 from tt1 where c1 = all (select a1 from tt2 where a1 = 2) order by c2;insert into tt3 select c1,c2 from tt1 where c1 = all (select a1 from tt2 where a1 = 3) order by c2;//
affected rows: 1
affected rows: 1
affected rows: 1
select * from tt3;
+------+--------+
| b1   | b2     |
+------+--------+
|    1 | 张三   |
|    2 | 李四   |
|    3 | 王五   |
+------+--------+
affected rows: 3
select hit_count, is_batched_multi_stmt, statement, query_sql from oceanbase.GV$OB_PLAN_CACHE_PLAN_STAT where statement like 'insert into tt3 % where c1 = all %' order by hit_count;
+-----------+-----------------------+-----------------------------------------------------------------------------------------------------+-----------------------------------------------------------------------------------------------------+
| hit_count | is_batched_multi_stmt | statement                                                                                           | query_sql                                                                                           |
+-----------+-----------------------+-----------------------------------------------------------------------------------------------------+-----------------------------------------------------------------------------------------------------+
|         2 |                     0 | insert into tt3 select c1,c2 from tt1 where c1 = all (select a1 from tt2 where a1 = ?) order by c2; | insert into tt3 select c1,c2 from tt1 where c1 = all (select a1 from tt2 where a1 = ?) order by c2; |
|         2 |                     0 | insert into tt3 select c1,c2 from tt1 where c1 = all (select a1 from tt2 where a1 = ?) order by c2; | insert into tt3 select c1,c2 from tt1 where c1 = all (select a1 from tt2 where a1 = 1) order by c2; |
+-----------+-----------------------+-----------------------------------------------------------------------------------------------------+-----------------------------------------------------------------------------------------------------+
affected rows: 2
rollback;
affected rows: 0

#some  (命中1次，没有进行batch优化)
insert into tt3 select c1,c2 from tt1 where c1 = some (select min(a1) from tt2);insert into tt3 select c1,c2 from tt1 where c1 = some(select max(a1)from tt2);insert into tt3 select c1,c2 from tt1 where c1 = some (select min(a1) from tt2);//
affected rows: 1
affected rows: 0
affected rows: 1
select * from tt3;
+------+--------+
| b1   | b2     |
+------+--------+
|    1 | 张三   |
|    1 | 张三   |
+------+--------+
affected rows: 2
select hit_count, is_batched_multi_stmt, statement, query_sql from oceanbase.GV$OB_PLAN_CACHE_PLAN_STAT where statement like 'insert into tt3 % where c1 = some %' order by hit_count;
+-----------+-----------------------+----------------------------------------------------------------------------------+----------------------------------------------------------------------------------+
| hit_count | is_batched_multi_stmt | statement                                                                        | query_sql                                                                        |
+-----------+-----------------------+----------------------------------------------------------------------------------+----------------------------------------------------------------------------------+
|         1 |                     0 | insert into tt3 select c1,c2 from tt1 where c1 = some (select min(a1) from tt2); | insert into tt3 select c1,c2 from tt1 where c1 = some (select min(a1) from tt2); |
|         1 |                     0 | insert into tt3 select c1,c2 from tt1 where c1 = some (select min(a1) from tt2); | insert into tt3 select c1,c2 from tt1 where c1 = some (select min(a1) from tt2); |
+-----------+-----------------------+----------------------------------------------------------------------------------+----------------------------------------------------------------------------------+
affected rows: 2
rollback;
affected rows: 0

#exists (命中0次，没有进行batch优化)
insert into tt3 select c1,c2 from tt1 where exists (select max(a1) from tt2) limit 1;insert into tt3 select c1,c2 from tt1 where exists (select min(a1) from tt2) limit 1;insert into tt3 select c1,c2 from tt1 where exists (select avg(a1) from tt2) limit 1;//
affected rows: 1
affected rows: 1
affected rows: 1
select * from tt3;
+------+--------+
| b1   | b2     |
+------+--------+
|    0 | 牛二   |
|    0 | 牛二   |
|    0 | 牛二   |
+------+--------+
affected rows: 3
select hit_count, is_batched_multi_stmt, statement, query_sql from oceanbase.GV$OB_PLAN_CACHE_PLAN_STAT where statement like 'insert into tt3 % where exists %' order by hit_count;
+-----------+-----------------------+---------------------------------------------------------------------------------------+---------------------------------------------------------------------------------------+
| hit_count | is_batched_multi_stmt | statement                                                                             | query_sql                                                                             |
+-----------+-----------------------+---------------------------------------------------------------------------------------+---------------------------------------------------------------------------------------+
|         0 |                     0 | insert into tt3 select c1,c2 from tt1 where exists (select max(a1) from tt2) limit ?; | insert into tt3 select c1,c2 from tt1 where exists (select max(a1) from tt2) limit ?; |
|         0 |                     0 | insert into tt3 select c1,c2 from tt1 where exists (select max(a1) from tt2) limit ?; | insert into tt3 select c1,c2 from tt1 where exists (select max(a1) from tt2) limit 1; |
|         0 |                     0 | insert into tt3 select c1,c2 from tt1 where exists (select min(a1) from tt2) limit ?; | insert into tt3 select c1,c2 from tt1 where exists (select min(a1) from tt2) limit ?; |
|         0 |                     0 | insert into tt3 select c1,c2 from tt1 where exists (select min(a1) from tt2) limit ?; | insert into tt3 select c1,c2 from tt1 where exists (select min(a1) from tt2) limit 1; |
|         0 |                     0 | insert into tt3 select c1,c2 from tt1 where exists (select avg(a1) from tt2) limit ?; | insert into tt3 select c1,c2 from tt1 where exists (select avg(a1) from tt2) limit ?; |
|         0 |                     0 | insert into tt3 select c1,c2 from tt1 where exists (select avg(a1) from tt2) limit ?; | insert into tt3 select c1,c2 from tt1 where exists (select avg(a1) from tt2) limit 1; |
+-----------+-----------------------+---------------------------------------------------------------------------------------+---------------------------------------------------------------------------------------+
affected rows: 6
rollback;
affected rows: 0

#not exists
insert into tt3 select c1,c2 from tt1 where not exists (select max(a1) from tt2) limit 1;insert into tt3 select c1,c2 from tt1 where not exists (select min(a1) from tt2) limit 1;insert into tt3 select c1,c2 from tt1 where not exists (select avg(a1) from tt2) limit 1;//
affected rows: 0
affected rows: 0
affected rows: 0
select * from tt3;
+------+------+
| b1   | b2   |
+------+------+
+------+------+
affected rows: 0
select hit_count, is_batched_multi_stmt, statement, query_sql from oceanbase.GV$OB_PLAN_CACHE_PLAN_STAT where statement like 'insert into tt3 % where not exists %' order by hit_count;
+-----------+-----------------------+-------------------------------------------------------------------------------------------+-------------------------------------------------------------------------------------------+
| hit_count | is_batched_multi_stmt | statement                                                                                 | query_sql                                                                                 |
+-----------+-----------------------+-------------------------------------------------------------------------------------------+-------------------------------------------------------------------------------------------+
|         0 |                     0 | insert into tt3 select c1,c2 from tt1 where not exists (select max(a1) from tt2) limit ?; | insert into tt3 select c1,c2 from tt1 where not exists (select max(a1) from tt2) limit ?; |
|         0 |                     0 | insert into tt3 select c1,c2 from tt1 where not exists (select max(a1) from tt2) limit ?; | insert into tt3 select c1,c2 from tt1 where not exists (select max(a1) from tt2) limit 1; |
|         0 |                     0 | insert into tt3 select c1,c2 from tt1 where not exists (select min(a1) from tt2) limit ?; | insert into tt3 select c1,c2 from tt1 where not exists (select min(a1) from tt2) limit ?; |
|         0 |                     0 | insert into tt3 select c1,c2 from tt1 where not exists (select min(a1) from tt2) limit ?; | insert into tt3 select c1,c2 from tt1 where not exists (select min(a1) from tt2) limit 1; |
|         0 |                     0 | insert into tt3 select c1,c2 from tt1 where not exists (select avg(a1) from tt2) limit ?; | insert into tt3 select c1,c2 from tt1 where not exists (select avg(a1) from tt2) limit ?; |
|         0 |                     0 | insert into tt3 select c1,c2 from tt1 where not exists (select avg(a1) from tt2) limit ?; | insert into tt3 select c1,c2 from tt1 where not exists (select avg(a1) from tt2) limit 1; |
+-----------+-----------------------+-------------------------------------------------------------------------------------------+-------------------------------------------------------------------------------------------+
affected rows: 6
rollback;
affected rows: 0

#like   (命中两次,没有进行batch 优化)
insert into tt3 select * from tt1 where c1 like (select a1 from tt2 where a1 = 3);insert into tt3 select * from tt1 where c1 like (select a1 from tt2 where a1 = 4);insert into tt3 select * from tt1 where c1 like (select a1 from tt2 where a1 = 5);//
affected rows: 1
affected rows: 1
affected rows: 1
select * from tt3;
+------+--------+
| b1   | b2     |
+------+--------+
|    3 | 王五   |
|    4 | 马六   |
|    5 | 田七   |
+------+--------+
affected rows: 3
select hit_count, is_batched_multi_stmt, statement, query_sql from oceanbase.GV$OB_PLAN_CACHE_PLAN_STAT where statement like 'insert into tt3 % where c1 like %' order by hit_count;
+-----------+-----------------------+------------------------------------------------------------------------------------+------------------------------------------------------------------------------------+
| hit_count | is_batched_multi_stmt | statement                                                                          | query_sql                                                                          |
+-----------+-----------------------+------------------------------------------------------------------------------------+------------------------------------------------------------------------------------+
|         2 |                     0 | insert into tt3 select * from tt1 where c1 like (select a1 from tt2 where a1 = ?); | insert into tt3 select * from tt1 where c1 like (select a1 from tt2 where a1 = ?); |
|         2 |                     0 | insert into tt3 select * from tt1 where c1 like (select a1 from tt2 where a1 = ?); | insert into tt3 select * from tt1 where c1 like (select a1 from tt2 where a1 = 3); |
+-----------+-----------------------+------------------------------------------------------------------------------------+------------------------------------------------------------------------------------+
affected rows: 2
rollback;
affected rows: 0

#运算符
# "=" (命中3次,没有进行batch优化)
alter system flush plan cache global;
affected rows: 0
insert into tt3 select 3*3*3+6,c2 from tt1 where c1 = (select a1 from tt2 where a1 = 1);insert into tt3 select 2*2*2+4,c2 from tt1 where c1 = (select a1 from tt2 where a1 = 2);//
affected rows: 1
affected rows: 1
insert into tt3 select 4*4*4+8,c2 from tt1 where c1 = (select a1 from tt2 where a1 = 3);insert into tt3 select 5*5*5+10,c2 from tt1 where c1 = (select a1 from tt2 where a1 = 4);//
affected rows: 1
affected rows: 1
select * from tt3;
+------+--------+
| b1   | b2     |
+------+--------+
|   33 | 张三   |
|   12 | 李四   |
|   72 | 王五   |
|  135 | 马六   |
+------+--------+
affected rows: 4
select hit_count, is_batched_multi_stmt, statement, query_sql from oceanbase.GV$OB_PLAN_CACHE_PLAN_STAT where statement like 'insert into tt3 % where c1 = %' order by hit_count;
+-----------+-----------------------+------------------------------------------------------------------------------------------+------------------------------------------------------------------------------------------+
| hit_count | is_batched_multi_stmt | statement                                                                                | query_sql                                                                                |
+-----------+-----------------------+------------------------------------------------------------------------------------------+------------------------------------------------------------------------------------------+
|         3 |                     0 | insert into tt3 select ?*?*?+?,c2 from tt1 where c1 = (select a1 from tt2 where a1 = ?); | insert into tt3 select 3*3*3+6,c2 from tt1 where c1 = (select a1 from tt2 where a1 = 1); |
|         3 |                     0 | insert into tt3 select ?*?*?+?,c2 from tt1 where c1 = (select a1 from tt2 where a1 = ?); | insert into tt3 select 3*3*3+6,c2 from tt1 where c1 = (select a1 from tt2 where a1 = 1); |
+-----------+-----------------------+------------------------------------------------------------------------------------------+------------------------------------------------------------------------------------------+
affected rows: 2
rollback;
affected rows: 0


# ">" (命中0次，没有进行batch优化)
insert into tt3 select * from tt1 where c1 > (select a1 from tt2 where a1 = 3);insert into tt3 select * from tt1 where c1 > (select a1 from tt2 where a1 = 4);//
affected rows: 3
info:  Records: 3  Duplicates: 0  Warnings: 0
affected rows: 2
info: Records: 2  Duplicates: 0  Warnings: 0
insert into tt3 select * from tt1 where c1 > (select a1 from tt2 where a1 = 5);insert into tt3 select * from tt1 where c1 > (select a1 from tt2 where a1 = 6);//
affected rows: 1
affected rows: 1
select * from tt3;
+------+--------+
| b1   | b2     |
+------+--------+
|    4 | 马六   |
|    5 | 田七   |
|    7 | 腊八   |
|    5 | 田七   |
|    7 | 腊八   |
|    7 | 腊八   |
|    7 | 腊八   |
+------+--------+
affected rows: 7
select hit_count, is_batched_multi_stmt, statement, query_sql from oceanbase.GV$OB_PLAN_CACHE_PLAN_STAT where statement like 'insert into tt3 % where c1 > %' order by hit_count;
+-----------+-----------------------+---------------------------------------------------------------------------------+---------------------------------------------------------------------------------+
| hit_count | is_batched_multi_stmt | statement                                                                       | query_sql                                                                       |
+-----------+-----------------------+---------------------------------------------------------------------------------+---------------------------------------------------------------------------------+
|         3 |                     0 | insert into tt3 select * from tt1 where c1 > (select a1 from tt2 where a1 = ?); | insert into tt3 select * from tt1 where c1 > (select a1 from tt2 where a1 = ?); |
|         3 |                     0 | insert into tt3 select * from tt1 where c1 > (select a1 from tt2 where a1 = ?); | insert into tt3 select * from tt1 where c1 > (select a1 from tt2 where a1 = 3); |
+-----------+-----------------------+---------------------------------------------------------------------------------+---------------------------------------------------------------------------------+
affected rows: 2
rollback;
affected rows: 0

#">=" (命中3次，没有进行batch优化)
insert into tt3 select 10+10,c2 from tt1 where c1 >= (select a1 from tt2 where a1 = 3);insert into tt3 select 30+30,c2 from tt1 where c1 >= (select a1 from tt2 where a1 = 4);//
affected rows: 4
info:  Records: 4  Duplicates: 0  Warnings: 0
affected rows: 3
info: Records: 3  Duplicates: 0  Warnings: 0
insert into tt3 select 20+20,c2 from tt1 where c1 >= (select a1 from tt2 where a1 = 5);insert into tt3 select 40+40,c2 from tt1 where c1 >= (select a1 from tt2 where a1 = 6);//
affected rows: 2
info:  Records: 2  Duplicates: 0  Warnings: 0
affected rows: 1
select * from tt3;
+------+--------+
| b1   | b2     |
+------+--------+
|   20 | 王五   |
|   20 | 马六   |
|   20 | 田七   |
|   20 | 腊八   |
|   60 | 马六   |
|   60 | 田七   |
|   60 | 腊八   |
|   40 | 田七   |
|   40 | 腊八   |
|   80 | 腊八   |
+------+--------+
affected rows: 10
select hit_count, is_batched_multi_stmt, statement, query_sql from oceanbase.GV$OB_PLAN_CACHE_PLAN_STAT where statement like 'insert into tt3 % where c1 >= %' order by hit_count;
+-----------+-----------------------+---------------------------------------------------------------------------------------+-----------------------------------------------------------------------------------------+
| hit_count | is_batched_multi_stmt | statement                                                                             | query_sql                                                                               |
+-----------+-----------------------+---------------------------------------------------------------------------------------+-----------------------------------------------------------------------------------------+
|         3 |                     0 | insert into tt3 select ?+?,c2 from tt1 where c1 >= (select a1 from tt2 where a1 = ?); | insert into tt3 select 10+10,c2 from tt1 where c1 >= (select a1 from tt2 where a1 = 3); |
|         3 |                     0 | insert into tt3 select ?+?,c2 from tt1 where c1 >= (select a1 from tt2 where a1 = ?); | insert into tt3 select 10+10,c2 from tt1 where c1 >= (select a1 from tt2 where a1 = 3); |
+-----------+-----------------------+---------------------------------------------------------------------------------------+-----------------------------------------------------------------------------------------+
affected rows: 2
rollback;
affected rows: 0

#"<" (命中0次,没有进行batch优化)
insert into tt3 select 8/8,c2  from tt1 where c1 < (select a1 from tt2 where a1 = 3)limit 1;insert into tt3 select 8/4,c2  from tt1 where c1 < (select a1 from tt2 where a1 = 4)limit 1;//
affected rows: 1
affected rows: 1
insert into tt3 select 9/3,c2  from tt1 where c1 < (select a1 from tt2 where a1 = 5)limit 1;insert into tt3 select 8/2,c2  from tt1 where c1 < (select a1 from tt2 where a1 = 6)limit 1;//
affected rows: 1
affected rows: 1
select * from tt3;
+------+--------+
| b1   | b2     |
+------+--------+
|    1 | 牛二   |
|    2 | 牛二   |
|    3 | 牛二   |
|    4 | 牛二   |
+------+--------+
affected rows: 4
select hit_count, is_batched_multi_stmt, statement, query_sql from oceanbase.GV$OB_PLAN_CACHE_PLAN_STAT where statement like 'insert into tt3 % where c1 < %' order by hit_count;
+-----------+-----------------------+----------------------------------------------------------------------------------------------+----------------------------------------------------------------------------------------------+
| hit_count | is_batched_multi_stmt | statement                                                                                    | query_sql                                                                                    |
+-----------+-----------------------+----------------------------------------------------------------------------------------------+----------------------------------------------------------------------------------------------+
|         3 |                     0 | insert into tt3 select ?/?,c2  from tt1 where c1 < (select a1 from tt2 where a1 = ?)limit ?; | insert into tt3 select 8/8,c2  from tt1 where c1 < (select a1 from tt2 where a1 = 3)limit 1; |
|         3 |                     0 | insert into tt3 select ?/?,c2  from tt1 where c1 < (select a1 from tt2 where a1 = ?)limit ?; | insert into tt3 select 8/8,c2  from tt1 where c1 < (select a1 from tt2 where a1 = 3)limit 1; |
+-----------+-----------------------+----------------------------------------------------------------------------------------------+----------------------------------------------------------------------------------------------+
affected rows: 2
rollback;
affected rows: 0

#"<="(命中三次，没有进行batch优化)
insert into tt3 select 8*8,c2 from tt1 where c1 <= (select a1 from tt2 where a1 = 3)limit 1;insert into tt3 select 9*9,c2 from tt1 where c1 <= (select a1 from tt2 where a1 = 4)limit 1;//
affected rows: 1
affected rows: 1
insert into tt3 select 7*7,c2 from tt1 where c1 <= (select a1 from tt2 where a1 = 5)limit 1;insert into tt3 select 6*6,c2 from tt1 where c1 <= (select a1 from tt2 where a1 = 6)limit 1;//
affected rows: 1
affected rows: 1
select * from tt3;
+------+--------+
| b1   | b2     |
+------+--------+
|   64 | 牛二   |
|   81 | 牛二   |
|   49 | 牛二   |
|   36 | 牛二   |
+------+--------+
affected rows: 4
select hit_count, is_batched_multi_stmt, statement, query_sql from oceanbase.GV$OB_PLAN_CACHE_PLAN_STAT where statement like 'insert into tt3 % where c1 <= %' order by hit_count;
+-----------+-----------------------+----------------------------------------------------------------------------------------------+----------------------------------------------------------------------------------------------+
| hit_count | is_batched_multi_stmt | statement                                                                                    | query_sql                                                                                    |
+-----------+-----------------------+----------------------------------------------------------------------------------------------+----------------------------------------------------------------------------------------------+
|         3 |                     0 | insert into tt3 select ?*?,c2 from tt1 where c1 <= (select a1 from tt2 where a1 = ?)limit ?; | insert into tt3 select 8*8,c2 from tt1 where c1 <= (select a1 from tt2 where a1 = 3)limit 1; |
|         3 |                     0 | insert into tt3 select ?*?,c2 from tt1 where c1 <= (select a1 from tt2 where a1 = ?)limit ?; | insert into tt3 select 8*8,c2 from tt1 where c1 <= (select a1 from tt2 where a1 = 3)limit 1; |
+-----------+-----------------------+----------------------------------------------------------------------------------------------+----------------------------------------------------------------------------------------------+
affected rows: 2
rollback;
affected rows: 0

#"!="(命中3次，没有进行batch优化)
insert into tt3 select 1+1,c2 from tt1 where c1 != (select a1 from tt2 where a1 = 2)limit 1;insert into tt3 select 3+4,c2 from tt1 where c1 != (select a1 from tt2 where a1 = 4)limit 1;//
affected rows: 1
affected rows: 1
insert into tt3 select 2+2,c2 from tt1 where c1 != (select a1 from tt2 where a1 = 3)limit 1;insert into tt3 select 5+8,c2 from tt1 where c1 != (select a1 from tt2 where a1 = 6)limit 1;//
affected rows: 1
affected rows: 1
select * from tt3;
+------+--------+
| b1   | b2     |
+------+--------+
|    2 | 牛二   |
|    7 | 牛二   |
|    4 | 牛二   |
|   13 | 牛二   |
+------+--------+
affected rows: 4
select hit_count, is_batched_multi_stmt, statement, query_sql from oceanbase.GV$OB_PLAN_CACHE_PLAN_STAT where statement like 'insert into tt3 % where c1 != %' order by hit_count;
+-----------+-----------------------+----------------------------------------------------------------------------------------------+----------------------------------------------------------------------------------------------+
| hit_count | is_batched_multi_stmt | statement                                                                                    | query_sql                                                                                    |
+-----------+-----------------------+----------------------------------------------------------------------------------------------+----------------------------------------------------------------------------------------------+
|         3 |                     0 | insert into tt3 select ?+?,c2 from tt1 where c1 != (select a1 from tt2 where a1 = ?)limit ?; | insert into tt3 select 1+1,c2 from tt1 where c1 != (select a1 from tt2 where a1 = 2)limit 1; |
|         3 |                     0 | insert into tt3 select ?+?,c2 from tt1 where c1 != (select a1 from tt2 where a1 = ?)limit ?; | insert into tt3 select 1+1,c2 from tt1 where c1 != (select a1 from tt2 where a1 = 2)limit 1; |
+-----------+-----------------------+----------------------------------------------------------------------------------------------+----------------------------------------------------------------------------------------------+
affected rows: 2
rollback;
affected rows: 0

#"<>"(命中3次，没有进行batch优化)
insert into tt3 select 1+1,c2 from tt1 where c1 <> (select a1 from tt2 where a1 = 2)limit 1;insert into tt3 select 3+4,c2 from tt1 where c1 <> (select a1 from tt2 where a1 = 4)limit 1;//
affected rows: 1
affected rows: 1
insert into tt3 select 2+2,c2 from tt1 where c1 <> (select a1 from tt2 where a1 = 3)limit 1;insert into tt3 select 5+8,c2 from tt1 where c1 <> (select a1 from tt2 where a1 = 6)limit 1;//
affected rows: 1
affected rows: 1
select * from tt3;
+------+--------+
| b1   | b2     |
+------+--------+
|    2 | 牛二   |
|    7 | 牛二   |
|    4 | 牛二   |
|   13 | 牛二   |
+------+--------+
affected rows: 4
select hit_count, is_batched_multi_stmt, statement, query_sql from oceanbase.GV$OB_PLAN_CACHE_PLAN_STAT where statement like 'insert into tt3 % where c1 <> %' order by hit_count;
+-----------+-----------------------+----------------------------------------------------------------------------------------------+----------------------------------------------------------------------------------------------+
| hit_count | is_batched_multi_stmt | statement                                                                                    | query_sql                                                                                    |
+-----------+-----------------------+----------------------------------------------------------------------------------------------+----------------------------------------------------------------------------------------------+
|         3 |                     0 | insert into tt3 select ?+?,c2 from tt1 where c1 <> (select a1 from tt2 where a1 = ?)limit ?; | insert into tt3 select 1+1,c2 from tt1 where c1 <> (select a1 from tt2 where a1 = 2)limit 1; |
|         3 |                     0 | insert into tt3 select ?+?,c2 from tt1 where c1 <> (select a1 from tt2 where a1 = ?)limit ?; | insert into tt3 select 1+1,c2 from tt1 where c1 <> (select a1 from tt2 where a1 = 2)limit 1; |
+-----------+-----------------------+----------------------------------------------------------------------------------------------+----------------------------------------------------------------------------------------------+
affected rows: 2
rollback;
affected rows: 0


#insert into select join.....
#insert into 无条件连接 (命中一次，进行batch优化)
alter system flush plan cache global;
affected rows: 0
insert into tt4 select * from tt1,tt2 where tt1.c1 = 1 limit 1;insert into tt4 select * from tt1,tt2 where tt1.c1 = 2 limit 1;//
affected rows: 1
affected rows: 1
insert into tt4 select * from tt1,tt2 where tt1.c1 = 3 limit 1;insert into tt4 select * from tt1,tt2 where tt1.c1 = 4 limit 1;//
affected rows: 1
affected rows: 1
select * from tt4;
+------+--------+------+------+
| d1   | d2     | d3   | d4   |
+------+--------+------+------+
|    1 | 张三   |    1 | abc  |
|    2 | 李四   |    1 | abc  |
|    3 | 王五   |    1 | abc  |
|    4 | 马六   |    1 | abc  |
+------+--------+------+------+
affected rows: 4
delete from tt4;
affected rows: 4
commit;
affected rows: 0

#insert into select ... cross join ...(命中一次，进行batch优化)
insert into tt4 select 1+1,tt1.c2,2+2,tt2.a2 from tt1 cross join tt2 where tt1.c1 =1 limit 1;insert into tt4 select 3+3,tt1.c2,4+4,tt2.a2 from tt1 cross join tt2 where tt1.c1 =2 limit 1;//
affected rows: 1
affected rows: 1
insert into tt4 select 5+5,tt1.c2,6+6,tt2.a2 from tt1 cross join tt2 where tt1.c1 =3 limit 1;insert into tt4 select 7+7,tt1.c2,8+8,tt2.a2 from tt1 cross join tt2 where tt1.c1 =4 limit 1;//
affected rows: 1
affected rows: 1
commit;
affected rows: 0
select * from tt4;
+------+--------+------+------+
| d1   | d2     | d3   | d4   |
+------+--------+------+------+
|    2 | 张三   |    4 | abc  |
|    6 | 李四   |    8 | abc  |
|   10 | 王五   |   12 | abc  |
|   14 | 马六   |   16 | abc  |
+------+--------+------+------+
affected rows: 4
select hit_count, is_batched_multi_stmt, statement, query_sql from oceanbase.GV$OB_PLAN_CACHE_PLAN_STAT where statement like 'insert into tt4 % cross join %';
+-----------+-----------------------+-----------------------------------------------------------------------------------------------+-----------------------------------------------------------------------------------------------+
| hit_count | is_batched_multi_stmt | statement                                                                                     | query_sql                                                                                     |
+-----------+-----------------------+-----------------------------------------------------------------------------------------------+-----------------------------------------------------------------------------------------------+
|         3 |                     0 | insert into tt4 select ?+?,tt1.c2,?+?,tt2.a2 from tt1 cross join tt2 where tt1.c1 =? limit ?; | insert into tt4 select 1+1,tt1.c2,2+2,tt2.a2 from tt1 cross join tt2 where tt1.c1 =1 limit 1; |
|         3 |                     0 | insert into tt4 select ?+?,tt1.c2,?+?,tt2.a2 from tt1 cross join tt2 where tt1.c1 =? limit ?; | insert into tt4 select 1+1,tt1.c2,2+2,tt2.a2 from tt1 cross join tt2 where tt1.c1 =1 limit 1; |
+-----------+-----------------------+-----------------------------------------------------------------------------------------------+-----------------------------------------------------------------------------------------------+
affected rows: 2
delete from tt4;
affected rows: 4
commit;
affected rows: 0

#insert into select ... natural join ...
alter system flush plan cache global;
affected rows: 0
insert into tt4 select 2-1,tt1.c2,3-1,tt2.a2 from tt1 natural join tt2 where tt1.c1 =1 limit 1;insert into tt4 select 4-1,tt1.c2,5-1,tt2.a2 from tt1 natural join tt2 where tt1.c1 =2 limit 1;//
affected rows: 1
affected rows: 1
insert into tt4 select 6-1,tt1.c2,8-1,tt2.a2 from tt1 natural join tt2 where tt1.c1 =3 limit 1;insert into tt4 select 10-1,tt1.c2,11-1,tt2.a2 from tt1 natural join tt2 where tt1.c1 =4 limit 1;//
affected rows: 1
affected rows: 1
commit;
affected rows: 0
select * from tt4;
+------+--------+------+------+
| d1   | d2     | d3   | d4   |
+------+--------+------+------+
|    1 | 张三   |    2 | abc  |
|    3 | 李四   |    4 | abc  |
|    5 | 王五   |    7 | abc  |
|    9 | 马六   |   10 | abc  |
+------+--------+------+------+
affected rows: 4
select hit_count, is_batched_multi_stmt, statement, query_sql from oceanbase.GV$OB_PLAN_CACHE_PLAN_STAT where statement like 'insert into tt4 select %,tt1.c2,%,tt2.a2 from tt1 natural join tt2 where tt1.c1 =% limit 1' order by hit_count;
+-----------+-----------------------+-----------+-----------+
| hit_count | is_batched_multi_stmt | statement | query_sql |
+-----------+-----------------------+-----------+-----------+
+-----------+-----------------------+-----------+-----------+
affected rows: 0
delete from tt4;
affected rows: 4
commit;
affected rows: 0

#自然连接
#insert into select ...where tt1.c1 = tt2.a1 ....
alter system flush plan cache global;
affected rows: 0
insert into tt4 select 1/1,tt1.c2,2/1,tt2.a2 from tt1,tt2 where tt1.c1 = tt2.a1 and tt1.c1 = 1;insert into tt4 select 3/1,tt1.c2,4/1,tt2.a2 from tt1,tt2 where tt1.c1 = tt2.a1 and tt1.c1 = 2;//
affected rows: 1
affected rows: 1
insert into tt4 select 5/1,tt1.c2,6/1,tt2.a2 from tt1,tt2 where tt1.c1 = tt2.a1 and tt1.c1 = 3;insert into tt4 select 7/1,tt1.c2,8/1,tt2.a2 from tt1,tt2 where tt1.c1 = tt2.a1 and tt1.c1 = 4;//
affected rows: 1
affected rows: 1
commit;
affected rows: 0
select * from tt4;
+------+--------+------+------+
| d1   | d2     | d3   | d4   |
+------+--------+------+------+
|    1 | 张三   |    2 | abc  |
|    3 | 李四   |    4 | def  |
|    5 | 王五   |    6 | ghi  |
|    7 | 马六   |    8 | jkl  |
+------+--------+------+------+
affected rows: 4
select hit_count, is_batched_multi_stmt, statement, query_sql from oceanbase.GV$OB_PLAN_CACHE_PLAN_STAT where statement like 'insert into tt4 select %,tt1.c2,%,tt2.a2 from tt1,tt2 where tt1.c1 = tt2.a1 and tt1.c1 = %' order by hit_count;
+-----------+-----------------------+-------------------------------------------------------------------------------------------------+-------------------------------------------------------------------------------------------------+
| hit_count | is_batched_multi_stmt | statement                                                                                       | query_sql                                                                                       |
+-----------+-----------------------+-------------------------------------------------------------------------------------------------+-------------------------------------------------------------------------------------------------+
|         3 |                     0 | insert into tt4 select ?/?,tt1.c2,?/?,tt2.a2 from tt1,tt2 where tt1.c1 = tt2.a1 and tt1.c1 = ?; | insert into tt4 select 1/1,tt1.c2,2/1,tt2.a2 from tt1,tt2 where tt1.c1 = tt2.a1 and tt1.c1 = 1; |
|         3 |                     0 | insert into tt4 select ?/?,tt1.c2,?/?,tt2.a2 from tt1,tt2 where tt1.c1 = tt2.a1 and tt1.c1 = ?; | insert into tt4 select 1/1,tt1.c2,2/1,tt2.a2 from tt1,tt2 where tt1.c1 = tt2.a1 and tt1.c1 = 1; |
+-----------+-----------------------+-------------------------------------------------------------------------------------------------+-------------------------------------------------------------------------------------------------+
affected rows: 2
delete from tt4;
affected rows: 4
commit;
affected rows: 0

#内连接
#insert into select ... inner join ... (命中一次，执行batch优化)
insert into tt4 select asin(tt1.c1),tt1.c2,asin(tt2.a1),tt2.a2 from tt1 inner join tt2 on tt1.c1 =tt2.a1 where tt2.a1 = 1;insert into tt4 select asin(tt1.c1),tt1.c2,asin(tt2.a1),tt2.a2 from tt1 inner join tt2 on tt1.c1 =tt2.a1 where tt2.a1 = 2;//
affected rows: 1
affected rows: 1
insert into tt4 select asin(tt1.c1),tt1.c2,asin(tt2.a1),tt2.a2 from tt1 inner join tt2 on tt1.c1 =tt2.a1 where tt2.a1 = 3;insert into tt4 select asin(tt1.c1),tt1.c2,asin(tt2.a1),tt2.a2 from tt1 inner join tt2 on tt1.c1 =tt2.a1 where tt2.a1 = 4;//
affected rows: 1
affected rows: 1
commit;
affected rows: 0
select * from tt4;
+------+--------+------+------+
| d1   | d2     | d3   | d4   |
+------+--------+------+------+
|    2 | 张三   |    2 | abc  |
| NULL | 李四   | NULL | def  |
| NULL | 王五   | NULL | ghi  |
| NULL | 马六   | NULL | jkl  |
+------+--------+------+------+
affected rows: 4
select hit_count, is_batched_multi_stmt, statement, query_sql from oceanbase.GV$OB_PLAN_CACHE_PLAN_STAT where statement like 'insert into tt4 % inner join %' order by hit_count;
+-----------+-----------------------+----------------------------------------------------------------------------------------------------------------------------+----------------------------------------------------------------------------------------------------------------------------+
| hit_count | is_batched_multi_stmt | statement                                                                                                                  | query_sql                                                                                                                  |
+-----------+-----------------------+----------------------------------------------------------------------------------------------------------------------------+----------------------------------------------------------------------------------------------------------------------------+
|         3 |                     0 | insert into tt4 select asin(tt1.c1),tt1.c2,asin(tt2.a1),tt2.a2 from tt1 inner join tt2 on tt1.c1 =tt2.a1 where tt2.a1 = ?; | insert into tt4 select asin(tt1.c1),tt1.c2,asin(tt2.a1),tt2.a2 from tt1 inner join tt2 on tt1.c1 =tt2.a1 where tt2.a1 = ?; |
|         3 |                     0 | insert into tt4 select asin(tt1.c1),tt1.c2,asin(tt2.a1),tt2.a2 from tt1 inner join tt2 on tt1.c1 =tt2.a1 where tt2.a1 = ?; | insert into tt4 select asin(tt1.c1),tt1.c2,asin(tt2.a1),tt2.a2 from tt1 inner join tt2 on tt1.c1 =tt2.a1 where tt2.a1 = 1; |
+-----------+-----------------------+----------------------------------------------------------------------------------------------------------------------------+----------------------------------------------------------------------------------------------------------------------------+
affected rows: 2
delete from tt4;
affected rows: 4
commit;
affected rows: 0

#外连接
#insert into select ... left join ...
insert into tt4 select cast(tt1.c1 as unsigned)-2.0,tt1.c2,cast(tt2.a1 as unsigned)-2.0,tt2.a2 from tt1 left join tt2 on tt1.c1 =tt2.a1 where tt2.a1 = 1;insert into tt4 select cast(tt1.c1 as unsigned)-2.0,tt1.c2,cast(tt2.a1 as unsigned)-2.0,tt2.a2 from tt1 left join tt2 on tt1.c1 =tt2.a1 where tt2.a1 = 2;//
affected rows: 1
affected rows: 1
insert into tt4 select cast(tt1.c1 as unsigned)-2.0,tt1.c2,cast(tt2.a1 as unsigned)-2.0,tt2.a2 from tt1 left join tt2 on tt1.c1 =tt2.a1 where tt2.a1 = 3;insert into tt4 select cast(tt1.c1 as unsigned)-2.0,tt1.c2,cast(tt2.a1 as unsigned)-2.0,tt2.a2 from tt1 left join tt2 on tt1.c1 =tt2.a1 where tt2.a1 = 4;//
affected rows: 1
affected rows: 1
commit;
affected rows: 0
select * from tt4;
+------+--------+------+------+
| d1   | d2     | d3   | d4   |
+------+--------+------+------+
|   -1 | 张三   |   -1 | abc  |
|    0 | 李四   |    0 | def  |
|    1 | 王五   |    1 | ghi  |
|    2 | 马六   |    2 | jkl  |
+------+--------+------+------+
affected rows: 4
select hit_count, is_batched_multi_stmt, statement, query_sql from oceanbase.GV$OB_PLAN_CACHE_PLAN_STAT where statement like 'insert into tt4 % left join %' order by hit_count;
+-----------+-----------------------+-------------------------------------------------------------------------------------------------------------------------------------------------------+-----------------------------------------------------------------------------------------------------------------------------------------------------------+
| hit_count | is_batched_multi_stmt | statement                                                                                                                                             | query_sql                                                                                                                                                 |
+-----------+-----------------------+-------------------------------------------------------------------------------------------------------------------------------------------------------+-----------------------------------------------------------------------------------------------------------------------------------------------------------+
|         3 |                     0 | insert into tt4 select cast(tt1.c1 as unsigned)-?,tt1.c2,cast(tt2.a1 as unsigned)-?,tt2.a2 from tt1 left join tt2 on tt1.c1 =tt2.a1 where tt2.a1 = ?; | insert into tt4 select cast(tt1.c1 as unsigned)-2.0,tt1.c2,cast(tt2.a1 as unsigned)-2.0,tt2.a2 from tt1 left join tt2 on tt1.c1 =tt2.a1 where tt2.a1 = 1; |
|         3 |                     0 | insert into tt4 select cast(tt1.c1 as unsigned)-?,tt1.c2,cast(tt2.a1 as unsigned)-?,tt2.a2 from tt1 left join tt2 on tt1.c1 =tt2.a1 where tt2.a1 = ?; | insert into tt4 select cast(tt1.c1 as unsigned)-2.0,tt1.c2,cast(tt2.a1 as unsigned)-2.0,tt2.a2 from tt1 left join tt2 on tt1.c1 =tt2.a1 where tt2.a1 = 1; |
+-----------+-----------------------+-------------------------------------------------------------------------------------------------------------------------------------------------------+-----------------------------------------------------------------------------------------------------------------------------------------------------------+
affected rows: 2
delete from tt4;
affected rows: 4
commit;
affected rows: 0

#insert into select ... right join ... (命中3次，没有执行batch优化)
insert into tt4 select * from tt1 right join tt2 on tt1.c1 =tt2.a1 where tt2.a1 = 1;insert into tt4 select * from tt1 right join tt2 on tt1.c1 =tt2.a1 where tt2.a1 = 2;//
affected rows: 1
affected rows: 1
insert into tt4 select * from tt1 right join tt2 on tt1.c1 =tt2.a1 where tt2.a1 = 3;insert into tt4 select * from tt1 right join tt2 on tt1.c1 =tt2.a1 where tt2.a1 = 4;//
affected rows: 1
affected rows: 1
commit;
affected rows: 0
select * from tt4;
+------+--------+------+------+
| d1   | d2     | d3   | d4   |
+------+--------+------+------+
|    1 | 张三   |    1 | abc  |
|    2 | 李四   |    2 | def  |
|    3 | 王五   |    3 | ghi  |
|    4 | 马六   |    4 | jkl  |
+------+--------+------+------+
affected rows: 4
select hit_count, is_batched_multi_stmt, statement, query_sql from oceanbase.GV$OB_PLAN_CACHE_PLAN_STAT where statement like 'insert into tt4 % right join %' order by hit_count;
+-----------+-----------------------+--------------------------------------------------------------------------------------+--------------------------------------------------------------------------------------+
| hit_count | is_batched_multi_stmt | statement                                                                            | query_sql                                                                            |
+-----------+-----------------------+--------------------------------------------------------------------------------------+--------------------------------------------------------------------------------------+
|         3 |                     0 | insert into tt4 select * from tt1 right join tt2 on tt1.c1 =tt2.a1 where tt2.a1 = ?; | insert into tt4 select * from tt1 right join tt2 on tt1.c1 =tt2.a1 where tt2.a1 = ?; |
|         3 |                     0 | insert into tt4 select * from tt1 right join tt2 on tt1.c1 =tt2.a1 where tt2.a1 = ?; | insert into tt4 select * from tt1 right join tt2 on tt1.c1 =tt2.a1 where tt2.a1 = 1; |
+-----------+-----------------------+--------------------------------------------------------------------------------------+--------------------------------------------------------------------------------------+
affected rows: 2
delete from tt4;
affected rows: 4
commit;
affected rows: 0
drop table tt1;
affected rows: 0
drop table tt2;
affected rows: 0
drop table tt3;
affected rows: 0
drop table tt4;
affected rows: 0


alter system set _rowsets_enabled=true;
affected rows: 0
set autocommit = true;
affected rows: 0
alter system set ob_enable_batched_multi_statement=false;
affected rows: 0

